created_utc,score,domain,id,title,ups,downs,num_comments,permalink,selftext,link_flair_text,over_18,thumbnail,subreddit_id,edited,link_flair_css_class,author_flair_css_class,is_self,name,url,distinguished
1349044999.0,761,imgur.com,10qc26,here is a picture that for some reason was posted to /r/WTF... but belongs here,843,82,57,http://www.reddit.com/r/bodyweightfitness/comments/10qc26/here_is_a_picture_that_for_some_reason_was_posted/,,,False,,t5_2tf0a,False,,,False,t3_10qc26,http://imgur.com/v2Ny5,
1370370785.0,726,self.bodyweightfitness,1fo10t,Complete Reddit BW Fitness Routine w/ Video Links,831,105,99,http://www.reddit.com/r/bodyweightfitness/comments/1fo10t/complete_reddit_bw_fitness_routine_w_video_links/,"[Here is a the complete /r/bodyweightfitness workout routine with point and click video linkage.](http://bodyweightfitness.routinemorning.com/)

Thanks to BrettMorningwood and Pethia from [this post](http://www.reddit.com/r/bodyweightfitness/comments/15bou5/exercise_cheatsheet_for_the_basic_beginner_routine/) for their excellent work and outline of a complete routine. 

I just inserted the links into the image so you don't have to go back and forth. I usually display it on my iPad when I workout and click on the exercise I need instructions on. 

Hope this helps.",,False,,t5_2tf0a,False,,,True,t3_1fo10t,http://www.reddit.com/r/bodyweightfitness/comments/1fo10t/complete_reddit_bw_fitness_routine_w_video_links/,
1352106115.0,723,i.imgur.com,12nrtf,"The Basic Bodyweight Fitness Beginners Routine...
What do you think?",815,92,143,http://www.reddit.com/r/bodyweightfitness/comments/12nrtf/the_basic_bodyweight_fitness_beginners_routine/,,,False,,t5_2tf0a,False,,,False,t3_12nrtf,http://i.imgur.com/vGeE5.png,
1362248761.0,661,self.bodyweightfitness,19j6i2,A word on strength training.,781,120,197,http://www.reddit.com/r/bodyweightfitness/comments/19j6i2/a_word_on_strength_training/,"Occasionally, we see a question on this subject, and I never have the time to explain it in as much detail as I would like. So, I decided to post this in hope that some of you would learn from it, and that the knowledge you may gain will benefit you :)

Before you read on, I must point out that if you're more advanced, than you probably already know most/all of this. This is aimed towards beginners looking to learn more.

There are multiple ways to increase strength. These include (but are not limited to):

* Increasing the size of myofibrils (specifically, type IIa and type IIb muscle fibers) aka **myofibrillar hypertrophy**.

* Increasing the amount of motor units recruited for a movement

* Increasing the efficiency of said motor units

* Inter-muscular coordination
 
But first and foremost, one must understand the concept of *Progressive Overload.*

### Progressive Overload.

Before I discuss *anything else*, I must ensure that you grasp this concept. In its simplest sense, progressive overload is simply ""doing more than you did before."" In order to gain strength, progressive overload is something that ***must*** occur. Whether it comes from increasing the weight, adding more reps, or decreasing the leverage of the movement, progressive overload is not optional. 

Take the squat, for example. If you squat 225lbs for 5x5 every workout, it's quite obvious that you aren't getting stronger. At least, it *should* be obvious. So how do you get stronger? There are two really simple ways to make progress here; you could increase the volume, or you could increase the weight. Doing either one of these will put your muscles and nervous system under stress, causing them to adapt to said stress by getting stronger. This is the key concept of strength training, forcing small adaptations that over time amount to a very large adaptation. Hypothetically, if you were to add 5-10 pounds to your squat every workout, you could go from 225lbsx5 to 315lbsx5 in a matter of months. 

### Myofibrillar Hypertrophy

It's a simple concept, once you learn about it. If a muscle is stressed at a high level, the body responds by making that muscle stronger, in case it should ever have to perform such a task again. One of the many ways to do this is to increase the number of myofibrils. Myofibrils are basic units of a muscle that make your muscles move. When they receive stimuli from the brain, they contract. To explain how this relates to strength;

More actin and myosin (the contractile proteins in myofibrils) = more muscular contraction =  MOAR STRENGTH

However, hypertrophy of any kind will not occur if one does not eat an adequate amount of calories. Simply put, you cannot make more muscle with out the proper building materials. If hypertrophy is the goal, ideally one should get at least 1g of protein per pound of bodyweight, and the same amount of carbs (if not more), and consume more calories than your TDEE (see the [/r/fitness FAQ](http://www.reddit.com/r/fitness/wiki/faq)). 

*it's the actin and myosin proteins that increase in number, not the myofibrils themselves. Sorry, I originally did this at 3:00 in the morning on little sleep.

### Increasing Recruited Motor Units

Motor units are a combination of a motor neuron and all the fibers activated by that neuron.  There are multiple types of motor units, but for strength training, we want to focus on High Threshold Motor Units (HTMUs).  HTMUs are basically what you sometimes hear referred to as *fast twitch muscle fibers*(type IIa and IIb). These are the motor units you use when you pick up something heavy.  They also happen to have the greatest capacity for strength (and hypertrophy), which is why we focus on them. Since they are primarily used when lifting heavy things, naturally, we want to train them by doing movements that require a lot of force (read: HARD).  This is why the upper rep limits for strength training tend to be 8-12 reps(fore begginers, 5-8 for everyone else). If you can do more than 8-12 reps of an exercise, than the exercise is too easy, and you are not effectively getting stronger. In addition to this, the movement should not intentionally be slowed down. I'm aware that CC instructs you to do reps at an intentionally slow pace, this is not the way to train HTMUs. The increase in the recruitment of motor units is exactly what it sounds like, the body increases how many HTMUs are used during the movement, effectively increasing the total amount of force that can be produced.  Once all of the motor units are being recruited, the body will begin to further increase strength by improving *rate coding*, telling the muscles to contract faster. 

Another factor involved in this is the inhibition of Golgi tendon organs. These are located at both the origin and insertion of the muscle, and one of the Golgi tendon organ's jobs is to limit the amount of force a muscle can produce. Strength training tends to reduce the effect of the Golgi tendon organs, allowing more recruitment of muscle fibers. According to OG, this effect is maximized when training with 85-90% 1RM. 

### Increase in Motor unit efficiency

I'm just going to take the lazy way out and quote [OG](http://shop.eatmoveimprove.com/) on this one.  ""In untrained individuals, the motor units fire randomly to recruit the forces necessary. As we further train a movement the motor cortex is able to synchronize the firing of the motor units."" - Steven Low, [**Overcoming Gravity**](http://shop.eatmoveimprove.com/), page 13.

Basically, **one big contraction &gt; a bunch of smaller contractions**.

How do we train for this?  Do the movement often. The more familiar a movement pattern is, the more efficient you will become at said movement.  Grease the groove is especially good for training this.

### Inter-muscular Coordination

I think the term ""inter-muscular coordination"" is pretty self-explanatory.  Simply put, it's the ability to coordinate all the muscles used in a movement in the most efficient way possible.  I'll use dips as an example: in a dip, the primary muscles used are triceps brachii, pectoralis major and minor, and the anterior and lateral deltoid head. If all of those muscles were to fire randomly, you would have a pretty hard time doing a dip. Since the body likes to do things in the most efficient way possible, eventually it will learn to fire the muscles in sync to make the movement easier.  This results in an increase in strength on that specific movement. This is generally only useful for beginners, or when learning a completely new movement. As with motor unit efficiency, this is best trained by doing the movement often. Grease the groove works great on this as well.


To sum all of this up, if strength is your goal, then your workout should meet the following criteria:

* The movements you do should be **hard**.  You should not be able to complete more than 8-12 reps per set.

* Try to increase the total work you do every workout. Whether it be doing one more rep or adding more weight.

* Once you *can* do 8-12 reps in one set, its time to pick a harder progression of the movement (e.g. push-ups --&gt; diamond push-ups) or add more weight.

In addition to this, you must get at least .7g of protein per pound of bodyweight to ensure proper muscle recovery, and you must get at least 7-8 hours of sleep per night.

One thing that I forgot to mention was rest time between sets.  For strength, you may rest as long as you need, usually 3-4 minutes, sometimes even longer.  If you would like some hypertrophy as well, keep the rest times at 1-2 minutes.

Feel free to comment with any questions.

Thanks to Steve for making sure I didn't fuck up part of this :)",,False,,t5_2tf0a,1370813610.0,,,True,t3_19j6i2,http://www.reddit.com/r/bodyweightfitness/comments/19j6i2/a_word_on_strength_training/,
1365876007.0,601,self.bodyweightfitness,1ca24z,"I gathered training videos for all of the Beginners Routine exercises, I hope it's of use to other newcomers.",710,109,31,http://www.reddit.com/r/bodyweightfitness/comments/1ca24z/i_gathered_training_videos_for_all_of_the/,"I compiled it all into a [playlist](http://www.youtube.com/watch?v=K4Sa9SUXz1k&amp;feature=share&amp;list=PL8BlungghwmU7651rLkgYYGO2BLbOf0Xe), but if you want the individual videos here they are:

* [Mobility Warmup](http://youtu.be/K4Sa9SUXz1k) (Now, every single video I saw on this was completely different, so please let me know if there is a better one)

* [L-Sit](http://youtu.be/16a529mtX68) (From tuck to normal)

* [Parallel Bar Support](http://youtu.be/RmTDHszp1v0)

* [Stomach-to-Wall Handstand](http://youtu.be/4-R385_Wpm8)

* [Diamond Pushups](http://youtu.be/J0DnG1_S92I)

* [Pseudo Planche Pushups](http://youtu.be/IJK_wU4UVw4)

* [Parallel Bar Dip](http://youtu.be/GBwVEqsl-FE)

* [Pike Handstand Pushup](http://youtu.be/sposDXWEB0A)

* [Box Handstand Pushup](http://youtu.be/8LNrVMoGUsw)

* [Negative Handstand Pushup](http://youtu.be/JOiWBKRbaEs)

* [Row](http://youtu.be/OYUxXMGVuuU) (Could not find anything for the Wide Row, I'm guessing you just spread your arms apart)

* [Tuck Front Lever Row](http://youtu.be/VUe3M0iLPG0)

* [Advanced Tuck Front Lever Row](http://youtu.be/XNsz7kyEBkg)

* [Negative Pullup](http://youtu.be/pfXuohjylwI)

* [Pullup](http://youtu.be/utjNyrxIgA4)

* [L-Sit Pullup](http://youtu.be/t2tXrg_cteQ)

* [Pullover](http://youtu.be/IqGBNBxUp-Y)

* [Deep Step Up](http://youtu.be/PegQw3wFKgI)

* [Squats](http://youtu.be/NdaS-I56PpI)

And that's it! Now, I'm still new to this myself, so if any of the more advanced trainers here have better videos let me know and I'll edit the playlist accordingly. Cheers!",,False,,t5_2tf0a,1365959273.0,,,True,t3_1ca24z,http://www.reddit.com/r/bodyweightfitness/comments/1ca24z/i_gathered_training_videos_for_all_of_the/,
1362896892.0,587,self.bodyweightfitness,1a0hnl,"Announcement: New basic exercise wiki. Also, new rule. [Please upvote for visibility]",674,87,33,http://www.reddit.com/r/bodyweightfitness/comments/1a0hnl/announcement_new_basic_exercise_wiki_also_new/,"#### New wiki

An issue was brought to my attention today, and this is the result.  It's far from completed, I plan on making it much more detailed in time.

**http://www.reddit.com/r/bodyweightfitness/wiki/basic_exercises**

So Here's how things are going to work:

For now, anyone can edit the page. ***BUT*** you must PM the mods before you edit, and tell us what you plan on adding/changing.  

**IF YOU PUT STUPID SHIT IN THERE, YOU WILL BE BANNED FROM EDITING.**

**IF YOU PUT SOMETHING IN WITHOUT MESSAGING THE MODS, YOU WILL BE BANNED FROM EDITING.**

This rule is here because I don't want this document getting messed up, or having potentially false/inaccurate information.  

Myself and the other mods (and everyone else, for that matter) are capable of seeing who edited it, and what they changed.  So don't put anything dumb in there.  

There are a few exercises that need to be added, a few that need completed entries, and a few that need pictures/videos (pics for isometrics, videos for dynamics).

______________________________________

[**New Rule**](http://www.reddit.com/r/bodyweightfitness/wiki/guidelines)

**Use the search bar before posting a question.**  

Too many people ask the same question once a week.  I'm more than happy to answer questions, but why wait for us to answer when you can just search and possibly find an immediate answer?",,False,,t5_2tf0a,1363028924.0,,,True,t3_1a0hnl,http://www.reddit.com/r/bodyweightfitness/comments/1a0hnl/announcement_new_basic_exercise_wiki_also_new/,moderator
1348168387.0,583,imgur.com,107gcf,Targeted muscles with different pushups,658,75,67,http://www.reddit.com/r/bodyweightfitness/comments/107gcf/targeted_muscles_with_different_pushups/,,,False,,t5_2tf0a,False,,,False,t3_107gcf,http://imgur.com/aIDZt,
1352020656.0,566,i.imgur.com,12lu8e,The Tri-Push Up (x post form R/Pics),654,88,49,http://www.reddit.com/r/bodyweightfitness/comments/12lu8e/the_tripush_up_x_post_form_rpics/,,,False,,t5_2tf0a,False,,,False,t3_12lu8e,http://i.imgur.com/MoWUu.gif,
1372330148.0,540,self.bodyweightfitness,1h66i3,The New FAQ is Live!,606,66,67,http://www.reddit.com/r/bodyweightfitness/comments/1h66i3/the_new_faq_is_live/,"Hey everyone,  
we spent the last couple of weeks working on reorganizing the FAQ to make the information people are looking for easier to find. We also added a couple of new sections and rewrote some of the old ones.  
The result is (hopefully) a FAQ that's easier to read, where information is easier to find. We hope you enjoy it!

Comments, suggestions, or any other type of feedback are welcome.",Upvote for visibility ,False,,t5_2tf0a,False,,,True,t3_1h66i3,http://www.reddit.com/r/bodyweightfitness/comments/1h66i3/the_new_faq_is_live/,
1341946180.0,539,i.imgur.com,wcag9,"After years of training, I can finally flag",582,43,42,http://www.reddit.com/r/bodyweightfitness/comments/wcag9/after_years_of_training_i_can_finally_flag/,,,False,,t5_2tf0a,False,,,False,t3_wcag9,http://i.imgur.com/gmgsV.jpg,
1355274247.0,511,i.imgur.com,14p4kd,"Winning Olympic Vaults, 56 years apart (xpost /r/woahdude)",600,89,38,http://www.reddit.com/r/bodyweightfitness/comments/14p4kd/winning_olympic_vaults_56_years_apart_xpost/,,,False,,t5_2tf0a,False,,,False,t3_14p4kd,http://i.imgur.com/lPzpq.gif,
1349831058.0,463,imgur.com,1185mr,New 'fitness playground' just got built near my home,507,44,69,http://www.reddit.com/r/bodyweightfitness/comments/1185mr/new_fitness_playground_just_got_built_near_my_home/,,,False,,t5_2tf0a,False,,,False,t3_1185mr,http://imgur.com/ZBUMl,
1346592912.0,456,i.imgur.com,z8997,Slow gains are the ones you keep.[me],503,47,44,http://www.reddit.com/r/bodyweightfitness/comments/z8997/slow_gains_are_the_ones_you_keepme/,,,False,,t5_2tf0a,False,,,False,t3_z8997,http://i.imgur.com/uJk5Q.jpg,
1339503766.0,435,i.imgur.com,uxtp8,Kip-up to handstand (x-post from r/gifs),468,33,30,http://www.reddit.com/r/bodyweightfitness/comments/uxtp8/kipup_to_handstand_xpost_from_rgifs/,,,False,,t5_2tf0a,False,,,False,t3_uxtp8,http://i.imgur.com/d0ZVK.gif,
1367355280.0,428,self.bodyweightfitness,1dfpen,"""How often can I work out?"" ""Am I doing too much?"" ""Why doesn't everybody work out 7 days a week?""",503,75,87,http://www.reddit.com/r/bodyweightfitness/comments/1dfpen/how_often_can_i_work_out_am_i_doing_too_much_why/,"A lot of people are confused on the topic of making their own programming. They want to know things like ""Is it ok to work out more than 3 days a week?"" or ""Why can't I spend 20+ hours a week training like the professional athletes do?"". I feel that promulgating the information needed to answer these questions would be extremely helpful.

For this reason, I want to talk about the dual factor theory of training. The theory isn't complicated and essentially states that everyone possesses two qualities: fitness and fatigue.

Fitness is the effect that you desire to get from your training (for most people here, strength) and fatigue denotes all the negative effects of working out, things like literal tiredness, soreness, damage to your connective tissues, and psychological or emotional strain. 

While working out, you accrue both fitness and fatigue.

While resting, fitness and fatigue both dissipate but fatigue dissipates approximately three times faster than fitness. Work capacity is the amount of strenuous exercise you can handle per unit of time. As your fitness increases, your work capacity increases. This is why professional athletes who've been training for 10+ years have a much greater work capacity than someone who's been doing the beginner routine for a month and can work out 20+ hours a week.

So, to summarize:

* There's nothing special about working out 3 days a week. It's just something pretty much everyone can handle.

* **The key to making good programming is giving yourself enough time off to recover from the fatigue you've induced by working out but not taking so much time off than you lose all your fitness.** If you take anything away from this post, let it be this.

* Overtraining isn't actually a thing; a better name would be ""underrecovering"". It's just a point at which you've accumulated enough fatigue to start noticing it. If you're noticing it, be sure to back off. Google ""symptoms of overtraining"" if you're not confident in your ability to recognize it.

* The amount of fatigue you can handle without underrecovering will increase the longer you've been training.

I have spent a lot of time reading about this stuff and *feel* like I have information that could help a lot of people. If my perception of reality doesn't accurately reflect it, feel free to let me know with downvotes. Otherwise, I'll probably continue to post occasionally.",,False,,t5_2tf0a,False,,,True,t3_1dfpen,http://www.reddit.com/r/bodyweightfitness/comments/1dfpen/how_often_can_i_work_out_am_i_doing_too_much_why/,
1359314360.0,384,self.bodyweightfitness,17dq2f,44 Bodyweight exercises ,457,73,51,http://www.reddit.com/r/bodyweightfitness/comments/17dq2f/44_bodyweight_exercises/,http://www.facebook.com/photo.php?v=10151393440761294,,False,,t5_2tf0a,False,,,True,t3_17dq2f,http://www.reddit.com/r/bodyweightfitness/comments/17dq2f/44_bodyweight_exercises/,
1346014564.0,382,i.imgur.com,yv9vy,"Spent some time at the beach last week, made a little bit of progress",421,39,21,http://www.reddit.com/r/bodyweightfitness/comments/yv9vy/spent_some_time_at_the_beach_last_week_made_a/,,,False,,t5_2tf0a,False,,,False,t3_yv9vy,http://i.imgur.com/3nNfI.jpg,
1337711500.0,374,imgur.com,tzmge,"1.5 years ago, I weighed 220 and couldn't do a pullup.  This is me flagging at my climbing wall.",403,29,45,http://www.reddit.com/r/bodyweightfitness/comments/tzmge/15_years_ago_i_weighed_220_and_couldnt_do_a/,,,False,,t5_2tf0a,False,,,False,t3_tzmge,http://imgur.com/eKPDe,
1353265622.0,363,i.imgur.com,13epir,Failed planche...,549,186,44,http://www.reddit.com/r/bodyweightfitness/comments/13epir/failed_planche/,,,False,,t5_2tf0a,False,,,False,t3_13epir,http://i.imgur.com/T3MTI.jpg,
1375820245.0,338,self.bodyweightfitness,1ju1w0,Quick question on chin up bar. Don't upvote,557,219,63,http://www.reddit.com/r/bodyweightfitness/comments/1ju1w0/quick_question_on_chin_up_bar_dont_upvote/,"Does anyone have any experience with one of those in between the door frame kind of chin up bars, [like this one](http://youtu.be/HhgqVyB7lxY)?

Do they work or is it shit that will damage my doorframe? Do i have to tighten everytime i use it or can i let it be?

Thanks

EDIT: thanks for the help guys, i'll give it a try and buy it. ",,False,,t5_2tf0a,1375844606.0,,,True,t3_1ju1w0,http://www.reddit.com/r/bodyweightfitness/comments/1ju1w0/quick_question_on_chin_up_bar_dont_upvote/,
1354592992.0,328,imgur.com,148r90,Human Flag Progression! Very proud of myself :),355,27,22,http://www.reddit.com/r/bodyweightfitness/comments/148r90/human_flag_progression_very_proud_of_myself/,,,False,,t5_2tf0a,False,,,False,t3_148r90,http://imgur.com/a/jaYly,
1372993816.0,328,self.bodyweightfitness,1ho62f,Shaolin Monk's bodyweight training,394,66,244,http://www.reddit.com/r/bodyweightfitness/comments/1ho62f/shaolin_monks_bodyweight_training/,"I was curious if anyone has adopted any bodyweight training techniques from the Shaolin Monks? Or at least compared them to modern techniques for fun? 

http://en.wikipedia.org/wiki/Shaolin_Monastery

An old video documentary on the Monk's and their training: http://www.youtube.com/watch?v=EMkz7lTGzQ8

There are lots of examples in the video, but see the Abdominal workout at 20 minutes in for a quick example. I like the idea of application in some of the work outs. Instead of just doing hanging crunches, he is moving water from one vessel to another.

From what I can tell they use a wide variety of training formats, from bodyweight for strength and endurance, to weight training, aerobics, martial arts sparring, balance and acrobatic gymnastics. Be aware they also include some carnival type tricks in their routines (breaking cinder blocks over the body and such). Though it seems like a majority of their training is just rigorous bodyweight exercises, often in a martial format.

I think if anything, they are a good example of how impressively fit you can be from very dedicated training. Really just wanted to share with you guys as I thought it may be relevant and interesting to some of you.

Edit: Thanks to TheCrafter for his responses. I didn't expect someone currently in a Shaolin school in China to respond!",,False,,t5_2tf0a,1373032516.0,,,True,t3_1ho62f,http://www.reddit.com/r/bodyweightfitness/comments/1ho62f/shaolin_monks_bodyweight_training/,
1362577053.0,319,self.bodyweightfitness,19rvhv,Visual references of body fat percentages,396,77,127,http://www.reddit.com/r/bodyweightfitness/comments/19rvhv/visual_references_of_body_fat_percentages/,"Thought some of you would find this visual reference interesting/useful...

http://imgur.com/Lh77Aej.jpg",,False,,t5_2tf0a,1362580515.0,,,True,t3_19rvhv,http://www.reddit.com/r/bodyweightfitness/comments/19rvhv/visual_references_of_body_fat_percentages/,
1372177330.0,318,self.bodyweightfitness,1h1mzr,"My Total Bodyweight Training Routine (w/ photos, videos, tutorials and a printer friendly version)",367,49,65,http://www.reddit.com/r/bodyweightfitness/comments/1h1mzr/my_total_bodyweight_training_routine_w_photos/,"Hey everybody, I'd like to share with you my bodyweight training guide that I've been putting together for the past couple weeks.

* **[Link to my Bodyweight Training Routine](http://antranik.org/bodyweight-training/)**

* In there you will find a warm up section that includes the familiar bodyline drills and skill-work.  And then below that is the strength routine that consists of exercises separated by pushing and pulling.

* The printer-friendly version is a google docs link near the bottom.  It's two pages, so I recommend you simply print them using both sides of a single page for ultra-compactness.

**Credit:** First and foremost this subreddit is an incredible community.  I don't think I would have been able to put this together without all the info in the sidelines.  Credit is clearly given where credit is due in the beginning of the page (which includes not just this sub but also gymnasticbodies.com).

**Inspiration:** I discovered [Old Muscle Beach (in Santa Monica, CA)](http://goo.gl/maps/VOajq) about a year ago. I've been thinking about this personal anniversary often this month because in just this one year more physical change has occurred than ever before. Not just muscle coordination but lots of neurological adaptation due to all the fun moves involved with the [traveling rings.](https://www.youtube.com/watch?v=_ggj-yJ0rDo)

The traveling rings are what got me addicted to the place, but at OMB, there are also parallel bars, still rings, slacklines, THE WORKS! (Yes, I am very lucky).  Most of the time I would go and play with these other apparatuses but I had no set routine/program.

**So I decided to create a PROPER three-day-split with ALL the progression exercises listed to get to specific goals.** While there is lots of overlap in muscle-use in bodyweight fitness (they all practically use the core, for example), splitting up the pulling exercises from the pushing could help one progress faster.

This is my way of giving back to the OMB/calisthenics/bodyweight/gymnastics/yoga community, because 99% of you have been so wonderful, helpful and *inspiring.*

**The page is a work in progress and it's being updated as I discover new ways to play with our bodies.  If you have suggestions, please, any feedback is appreciated.**",,False,,t5_2tf0a,1372177697.0,,,True,t3_1h1mzr,http://www.reddit.com/r/bodyweightfitness/comments/1h1mzr/my_total_bodyweight_training_routine_w_photos/,
