created_utc,score,domain,id,title,ups,downs,num_comments,permalink,selftext,link_flair_text,over_18,thumbnail,subreddit_id,edited,link_flair_css_class,author_flair_css_class,is_self,name,url,distinguished
1358280251.0,42,self.bodyweightfitness,16mx4d,Can we bring this infographic further?,51,9,46,http://www.reddit.com/r/bodyweightfitness/comments/16mx4d/can_we_bring_this_infographic_further/,"http://imgur.com/ntzC5
This went around a couple of months ago, and I think it's a great idea, but it's not executed as well as it could be if we worked on it with several people. I really think a lot of the general knowledge of this sub easily could be boiled down into an infographic to help beginners, if it were organized in an easy-to-read graphic.


**EDIT:** What I mean to do here is suggest that people volunteer to help rewrite it and redesign it.
Does anyone know of illustrations that depict the exercises that we can use?
The entire red box needs to be re-written, as well many of the exercises. Who is knowledgeable enough to do this part of the project?",,False,,t5_2tf0a,1358301739.0,,,True,t3_16mx4d,http://www.reddit.com/r/bodyweightfitness/comments/16mx4d/can_we_bring_this_infographic_further/,
1357672265.0,42,self.bodyweightfitness,16751v,"Best Forearm Exercises? Also, I click lots suddenly.",54,12,43,http://www.reddit.com/r/bodyweightfitness/comments/16751v/best_forearm_exercises_also_i_click_lots_suddenly/,"Hi

I'm currently doing very low volume exercise that's pretty easy (push ups on my knees... it's embarrassing) to rehabilitate a chest injury.
I want to use this time to work on my forearms more extensively.
What are the best exercises for them?

I'm currently doing wrist push ups (get in to push up position on fists, then roll hands so backs are against the ground, and roll back up again) and false grip pull ups. I rock climb 1-2 a week so gripping strength isn't an issue.
I'm specific looking for movements which hit the muscles that move the wrist side to side if anyone knows any.

In regards to the second part of my post - I'v not exercised for a few months (due to previously mentioned chest injury), coming back my shoulders and elbows click lots now when doing push ups, pull ups and sometimes just randomly. The clicks are usually small, but sometimes very loud and I feel them a bit when this happens- anyone know what's causing this, and if it will go away?

Thanks ",,False,,t5_2tf0a,False,,,True,t3_16751v,http://www.reddit.com/r/bodyweightfitness/comments/16751v/best_forearm_exercises_also_i_click_lots_suddenly/,
1345224565.0,41,self.bodyweightfitness,ydwt9,What are your reasons to choose bodyweight fitness over other options?,49,8,75,http://www.reddit.com/r/bodyweightfitness/comments/ydwt9/what_are_your_reasons_to_choose_bodyweight/,"I know one often-mentioned reason is that you don't need access to a gym to do it, so you can do it at home/while travelling/etc and it won't take so much time (transit etc) - practical reasons. But I am more interested in whether there are actual benefits in the effect on your body compared to, say, freeweights or machines or aerobics or martial arts etc.

I am asking because just lately I have got a feeling inside that it would be right to go for bodyweight fitness for me (despite easy access to gym and freeweights) and I find it difficult to understand why I feel that way - does my body tell me to because it is better (and I hope it would resonate with some of your answers) or is it just a fad for me, as I have just read more about it lately...",,False,,t5_2tf0a,False,,,True,t3_ydwt9,http://www.reddit.com/r/bodyweightfitness/comments/ydwt9/what_are_your_reasons_to_choose_bodyweight/,
1337156677.0,40,i.imgur.com,tpor5,A warning to people that wish to follow the DIY PVC parallette guides online...  ,53,13,37,http://www.reddit.com/r/bodyweightfitness/comments/tpor5/a_warning_to_people_that_wish_to_follow_the_diy/,,,False,,t5_2tf0a,False,,,False,t3_tpor5,http://i.imgur.com/Dvdwf.jpg,
1334072517.0,43,youtube.com,s2nqz,Video of Eugen Sandow posing and doing a backflip in 1903.,49,6,13,http://www.reddit.com/r/bodyweightfitness/comments/s2nqz/video_of_eugen_sandow_posing_and_doing_a_backflip/,,,False,,t5_2tf0a,False,,,False,t3_s2nqz,http://www.youtube.com/watch?v=qFeZa5UYWYY,
1375499468.0,42,self.bodyweightfitness,1jlv2j,Body Weight Beginner's Guide - Looking for Feedback,49,7,20,http://www.reddit.com/r/bodyweightfitness/comments/1jlv2j/body_weight_beginners_guide_looking_for_feedback/,Looking for thoughts and opinions on a body weight training guide that I threw together: http://shawnhuckabay.info/2013/08/02/body-weight-strong-a-beginners-guide/,,False,,t5_2tf0a,False,,,True,t3_1jlv2j,http://www.reddit.com/r/bodyweightfitness/comments/1jlv2j/body_weight_beginners_guide_looking_for_feedback/,
1375281745.0,40,self.bodyweightfitness,1jf8te,"Unsure if this is OK to post, but Ill try. David Procyshyn and Fiji McAlpine from doyogawithme.com are doing an AMA at /r/yoga.",55,15,1,http://www.reddit.com/r/bodyweightfitness/comments/1jf8te/unsure_if_this_is_ok_to_post_but_ill_try_david/,"Thought the people here might like having a chance to talk to these folks.

[**Here is a link to the AMA in /r/yoga**] (http://www.reddit.com/r/yoga/comments/1jf57q/we_are_fiji_mcalpine_and_david_procyshyn_of/)

[David Procyshyn] (http://www.doyogawithme.com/users/david-procyshyn) is the founder of doyogawithme.com and [Fiji McAlpine] (http://www.doyogawithme.com/users/fiji-mcalpine) is one of the most liked instructors on the site. 
",,False,,t5_2tf0a,False,,,True,t3_1jf8te,http://www.reddit.com/r/bodyweightfitness/comments/1jf8te/unsure_if_this_is_ok_to_post_but_ill_try_david/,
1373508316.0,40,self.bodyweightfitness,1i1w44,[Question] Will only doing pushups and crunches (or any variation on the two) provide any results?,44,4,42,http://www.reddit.com/r/bodyweightfitness/comments/1i1w44/question_will_only_doing_pushups_and_crunches_or/,"I'm slightly underweight, can't eat enough to increase weight, and have very little protein or other nutrition going into my diet, too poor;can't do it. So I was wondering if it's even worth doing any type of exercise at all to get stronger because of the lack of calories/protein/etc- I know it'd be ideal to have all that but I just can't right now. So far I've been trying every now and then to do, say; 3x20 pushups, 3x30 crunches. The pushups end with me barely or not able to finish the last 20 and the crunches end with me getting a mild burn in the ole abdominals- of course I can change my plan so far but as for the absolute minimal amount I'd need to get any kind of chest or abdominal improvements, is it enough? 

* TL:DR - 3x20 pushups, 3x30 crunches, open to suggestion, will I see any results?",,False,,t5_2tf0a,False,,,True,t3_1i1w44,http://www.reddit.com/r/bodyweightfitness/comments/1i1w44/question_will_only_doing_pushups_and_crunches_or/,
1370446651.0,42,self.bodyweightfitness,1fq5ld,What will I learn from getting Overcoming Gravity that's not in the FAQ?,49,7,36,http://www.reddit.com/r/bodyweightfitness/comments/1fq5ld/what_will_i_learn_from_getting_overcoming_gravity/,"Obviously the answer could be as big as the book, but as a novice will I get much more out of my training reading the book now as opposed to just what's in the FAQ, or does the book only become beneficial once I'm creating my own programs later? ",,False,,t5_2tf0a,False,,,True,t3_1fq5ld,http://www.reddit.com/r/bodyweightfitness/comments/1fq5ld/what_will_i_learn_from_getting_overcoming_gravity/,
1368822222.0,38,self.bodyweightfitness,1ejehk,"25(f) - 5'6"" - 110 lbs...Workout routine to get strong *and* build endurance (x-post from r/fitness)?",45,7,27,http://www.reddit.com/r/bodyweightfitness/comments/1ejehk/25f_56_110_lbsworkout_routine_to_get_strong_and/,"I am a student with full access to a gym. I also do indoor climbing 2x-3x/week. 

I have zero endurance when I need to run/hike etc but I can swim laps in the pool... I completely get out of breath running a 13 minute mile and will be the first person to take a break on an uphill hike where others are just marching on :(

I also want to gain some muscle since I am at a low BMI right now.

From /r/Fitness I gather that I need to obviously eat more calories. I was hoping I could get some advice on what a good work-out routine would be. Full body weight training 3x/week + running for endurance?

Thanks in advance :)",,False,,t5_2tf0a,False,,,True,t3_1ejehk,http://www.reddit.com/r/bodyweightfitness/comments/1ejehk/25f_56_110_lbsworkout_routine_to_get_strong_and/,
1367607718.0,43,self.bodyweightfitness,1dmvwh,What equipment do I need to buy to start?,57,14,20,http://www.reddit.com/r/bodyweightfitness/comments/1dmvwh/what_equipment_do_i_need_to_buy_to_start/,"First of all, I want to thank you for this amazing and professional looking subreddit!

I want start working out, and I've read the FAQ and I want to start doing the ''Beginner Routine'' that is discussed there. 
What equipment do I need for this? The only equipment I can find in the FAQ is a pullup-bar, but I'm guessing I need more, for instance for the L-Sit and the Parralel Bar support.


I might have read over it in the FAQ but I really couldn't find it, could somebody help me out? Thanks!",,False,,t5_2tf0a,False,,,True,t3_1dmvwh,http://www.reddit.com/r/bodyweightfitness/comments/1dmvwh/what_equipment_do_i_need_to_buy_to_start/,
1367520657.0,41,self.bodyweightfitness,1dkfte,Could you guys help the netherlands out to get more calisthenics parks? It would take five minutes max and it would mean the world to us!,52,11,11,http://www.reddit.com/r/bodyweightfitness/comments/1dkfte/could_you_guys_help_the_netherlands_out_to_get/,"Hey, I already posted this before. But I thought I should try one more time because people maybe did not see this, sorry if this is annoying. (today is the last day you can vote)

It would mean the world to us if you guys took 5 minutes of your time to help us get more votes to get this project(to build more calisthenics parks in the netherlands) funded.

Go to
https://deeljouwdroom.nl/participants/13760

Instructions (since it is in dutch):

http://i.imgur.com/kBMaDWU.jpg

It's abit messy, sorry. But just follow step 1 - 6, it may seem pointless(u have to do click the same button like 3 times) but it would help us alot!
Thanks !",,False,,t5_2tf0a,1367523583.0,,,True,t3_1dkfte,http://www.reddit.com/r/bodyweightfitness/comments/1dkfte/could_you_guys_help_the_netherlands_out_to_get/,
1367245860.0,41,self.bodyweightfitness,1dc7sl,"This is one of a few excercise stations, what can I do with it?",48,7,11,http://www.reddit.com/r/bodyweightfitness/comments/1dc7sl/this_is_one_of_a_few_excercise_stations_what_can/,"[Here it is](http://imgur.com/55oghOb). It's about 8-9 feet high. It's one of a bunch of excercise placements that I'd like to incorporate into a routine, only I have no idea how to utilize it.",,False,,t5_2tf0a,False,,,True,t3_1dc7sl,http://www.reddit.com/r/bodyweightfitness/comments/1dc7sl/this_is_one_of_a_few_excercise_stations_what_can/,
1366649715.0,43,self.bodyweightfitness,1cvf60,This is all still confusing to me,50,7,56,http://www.reddit.com/r/bodyweightfitness/comments/1cvf60/this_is_all_still_confusing_to_me/,"I have read the faqs, read answers, watched videos, but I can't get my head around this. I guess I'm worried that i'm going to end up not doing something I should have, and not seeing any gains.
              
If I do the routine that was in the FAQ's, along with jogging on off days, what kind of gains are we expecting?
            
Is it more of a skill thing, or a power? I have done the FAQ plan for two days now, but it always leaves me wanting more.

I don't care about muscle size, I just want to be able to preform at my maximum, and lose some flab around my chest, stomach, and tighten my entire body.

Can I add in Planks, and Leg raises to the routine? Because it seems like I am only doing 4 exercises, at 3 sets, for the whole day.

I was thinking about adding the Ab Riper X program from the P90X into my routine, and then doing upper body stuff, such as push ups, pull ups ect.",,False,,t5_2tf0a,1366650010.0,,,True,t3_1cvf60,http://www.reddit.com/r/bodyweightfitness/comments/1cvf60/this_is_all_still_confusing_to_me/,
1365047673.0,44,self.bodyweightfitness,1bn170,What is a short saying you use to get motivated to start a workout?,52,8,84,http://www.reddit.com/r/bodyweightfitness/comments/1bn170/what_is_a_short_saying_you_use_to_get_motivated/,"Also, do you generally enjoy calisthenics or is it a means to an end (health, looks, etc.) that requires a saying (or specific state of mind) to started each day?",,False,,t5_2tf0a,False,,,True,t3_1bn170,http://www.reddit.com/r/bodyweightfitness/comments/1bn170/what_is_a_short_saying_you_use_to_get_motivated/,
1363047323.0,42,self.bodyweightfitness,1a46dq,Which handstand kick-up technique is best/preferred?,48,6,18,http://www.reddit.com/r/bodyweightfitness/comments/1a46dq/which_handstand_kickup_technique_is_bestpreferred/,"I'm at the point in my handstand training where it's time to start kicking up into freestands. Which technique is best for kicking up? 

1. Starting standing up and lunging into the handstand like [this](http://www.drillsandskills.com/article/19) 
2. Starting with hands on the ground in ""runners stance"" and kicking up with one leg 
3. Starting with hands on the ground and kicking up with both feet at the same time 

I can perform all of this but I'm wondering if there's one I should be focusing on. My goals include press handstands if that matters",,False,,t5_2tf0a,False,,,True,t3_1a46dq,http://www.reddit.com/r/bodyweightfitness/comments/1a46dq/which_handstand_kickup_technique_is_bestpreferred/,
1362713493.0,43,self.bodyweightfitness,19w2kl,28 M 248 lbs please critique my diet/routine/progress,52,9,22,http://www.reddit.com/r/bodyweightfitness/comments/19w2kl/28_m_248_lbs_please_critique_my/,"I have been working hard on getting down to my target body fat %, while also trying to do some strength training and moderate cardio.


I have been running a deficit of 1000-1450 calories/day for the past 35 days. I am down to 248 from 271. I plan to reduce the deficit after I am no longer obese.


I have been doing bodyweightfitness beginner work for the past two weeks and have already seen improvement. I do 3 full body routines a week.

* I am now able to do two to three push-ups though I still do 3x6 knee push-ups for sets.
* I can do 3x10 leg raises laying on back.
* I can do 3x7 dips with straight legs toes up.
* I do 3x6 assisted pull ups before I have to cheat too much. I can do a 1x2-3 negatives max.
* I do 3x6 inverted rows
* For my L-Sit supports Ill use two 25 lb dumbells and leave my heels on the ground. I can hold that for up to 3x15secs.
* I can hold 3x25s Planks.
* I do 3x5 deadlifts and dumbbell squats with my 25lb dumbbells(i dont own any others)
* For cardio I can jog 20 minutes at 5.0mph.


I know that I have a long way to go until I can move to the intermediate routine especially with my planned bodyfat loss. I want to get down to 15% or so bodyfat by october.

Would you guys add or remove any workouts from my routine? Any other general training tips? I have read overcoming gravity and starting strength already. I also watched some videos on youtube to learn some progressions. 

Thanks for any input!
",,False,,t5_2tf0a,False,,,True,t3_19w2kl,http://www.reddit.com/r/bodyweightfitness/comments/19w2kl/28_m_248_lbs_please_critique_my/,
1361551387.0,42,self.bodyweightfitness,1910rg,Another practical application for BWF. ,54,12,14,http://www.reddit.com/r/bodyweightfitness/comments/1910rg/another_practical_application_for_bwf/,"Will Gadd, one of the worlds best ice climbers goes completely horizontal while climbing up one of the most difficult and stunning walls in the world. All core and upper body. Video is [here](http://www.outsideonline.com/blog/outdoor-adventure/climbing/will-gadd-climbs-spray-ice.html)",,False,,t5_2tf0a,False,,,True,t3_1910rg,http://www.reddit.com/r/bodyweightfitness/comments/1910rg/another_practical_application_for_bwf/,
1359123017.0,42,self.bodyweightfitness,1796w5,"Starting out as a skinny guy, is bodyweight beneficial?",60,18,56,http://www.reddit.com/r/bodyweightfitness/comments/1796w5/starting_out_as_a_skinny_guy_is_bodyweight/,"I want to get bigger. I know the (arguably) best way to do it would be to get under the bar and lift heavy weights. I sort of like the idea of working out in the comfort of my own home a little better though. So I'm 6'6 and around 200 and want to pack on some muscle, get bigger, and get more fit. Would bodyweight routines be a good thing for me at this point?",,False,,t5_2tf0a,False,,,True,t3_1796w5,http://www.reddit.com/r/bodyweightfitness/comments/1796w5/starting_out_as_a_skinny_guy_is_bodyweight/,
1354052302.0,43,self.bodyweightfitness,13w8i1,"Is there a ""starting strength"" equivalent for bodyweight..?",50,7,42,http://www.reddit.com/r/bodyweightfitness/comments/13w8i1/is_there_a_starting_strength_equivalent_for/,"Title says it all, really

I've been doing convict conditioning. Not sure if that's the equivalent..",,False,,t5_2tf0a,False,,,True,t3_13w8i1,http://www.reddit.com/r/bodyweightfitness/comments/13w8i1/is_there_a_starting_strength_equivalent_for/,
1353154178.0,39,self.bodyweightfitness,13cke8,Is it better to do a full body workout or split it up?,48,9,17,http://www.reddit.com/r/bodyweightfitness/comments/13cke8/is_it_better_to_do_a_full_body_workout_or_split/,"I've been doing full body bodyweight workouts for a while now but I've always had it in mind to split up my workout.

And also, are there any great benefits with bodyweightfitness that weight training doesn't give you? And vice versa. ",,False,,t5_2tf0a,False,,,True,t3_13cke8,http://www.reddit.com/r/bodyweightfitness/comments/13cke8/is_it_better_to_do_a_full_body_workout_or_split/,
1337973322.0,40,rosstraining.com,u4wbm,"Homemade Equipment Links:  DIY Strength Training Equipment, Grip Training, Odd Object Training, Medicine Balls, Suspension Trainers, Bodyweight and Gymnastic Based, Sleds, Combat Sports Equipment, Online Timers, Miscellaneous Equipment Ideas, and Additional Equipment Sites",48,8,2,http://www.reddit.com/r/bodyweightfitness/comments/u4wbm/homemade_equipment_links_diy_strength_training/,,,False,,t5_2tf0a,False,,,False,t3_u4wbm,http://www.rosstraining.com/forum/viewtopic.php?f=9&amp;t=157,
1337222561.0,40,imgur.com,tr1lz,My dip station in the office ,59,19,17,http://www.reddit.com/r/bodyweightfitness/comments/tr1lz/my_dip_station_in_the_office/,,,False,,t5_2tf0a,False,,,False,t3_tr1lz,http://imgur.com/GubAg,
1375958409.0,39,self.bodyweightfitness,1jy52e,Cutting vs Maintenance vs Bulking: Which improves bodyweight progressions fastest?,49,10,22,http://www.reddit.com/r/bodyweightfitness/comments/1jy52e/cutting_vs_maintenance_vs_bulking_which_improves/,"To give some clarity, assume that I would be losing 1lb per week cutting vs gaining 1lb per week bulking. I was wondering which of the three diets would show results in bodyweight fitness fastest. In barbell training it is self-explanatory since bodyweight isn't a factor in the resistance. 

Which diet would show progression fastest in:

Tuck Planche, Front Lever, HSPu

I very well understand the answer may be a big fat depends, however I'm trying to decide whether to keep bulking or cut; I just want to hear about other people's experiences so I can make a more informed choice.",,False,,t5_2tf0a,False,,,True,t3_1jy52e,http://www.reddit.com/r/bodyweightfitness/comments/1jy52e/cutting_vs_maintenance_vs_bulking_which_improves/,
1375716144.0,38,self.bodyweightfitness,1jqsjr,Pushups: Am I doing them wrong?,55,17,35,http://www.reddit.com/r/bodyweightfitness/comments/1jqsjr/pushups_am_i_doing_them_wrong/,"Hi all!

I've been doing pushups for the past few months because I don't really have easy access to a gym. I go to the gym once a week and then do push ups at home once a week. Started out with around 5 sets of 15-20, now I'm up to around 10 sets of 15-20.

One thing: Although my sets are going up, I still only manage about 25 pushups before failure, something I was able to do before. Each set seems easier, but the reps aren't going up. Am I doing anything wrong?

Also, is there a difference to splitting up my push ups into 2 workouts? Say 5 sets in the morning and 5 at night instead of all 10 at once. 

Thanks!

EDIT: Thanks for all the responses! I'll try to put in a bit more work. Any thoughts on my second question though?",,False,,t5_2tf0a,1375719481.0,,,True,t3_1jqsjr,http://www.reddit.com/r/bodyweightfitness/comments/1jqsjr/pushups_am_i_doing_them_wrong/,
1375444550.0,41,self.bodyweightfitness,1jk4x8,Best exercise to develop an abdominal V-line?,61,20,36,http://www.reddit.com/r/bodyweightfitness/comments/1jk4x8/best_exercise_to_develop_an_abdominal_vline/,"I am doing ok with upper abbs(six pack) but I have tried leg lifts and scissors but they only hurt my back and I'm not making any progress. I've been working out for about five months now in case that matters. 

EDIT: I should not have said ""hurt my back"". I do not have back pain doing leg lifts its just that I feel like I am straining and using the muscles in my back instead of my abdominals. I do not have low back pain walking around or doing anything daly, however thank you for the concern. ",,False,,t5_2tf0a,1375470235.0,,,True,t3_1jk4x8,http://www.reddit.com/r/bodyweightfitness/comments/1jk4x8/best_exercise_to_develop_an_abdominal_vline/,
1372687318.0,43,self.bodyweightfitness,1hfca7,"A great new way I discovered for doing rows with only a pull up bar, nothing else",48,5,37,http://www.reddit.com/r/bodyweightfitness/comments/1hfca7/a_great_new_way_i_discovered_for_doing_rows_with/,"Sounds strange, but I don't have any location for doing rows in my home, at all. No table/chair strong enough to support my weight, etc.

When I started off, I decided to leave out rows from my workout, thinking they weren't that important. 

I soon realized their importance, though, and started looking for a way to do those.

**So, here's what you do**. 

1. Take a chair, or a ladder, and place it in front of your pull up bar (Mine's around 1m or ~3.33ft high, I use the top part of my chair).

2. Hang from the pull up bar (Mine's around 7ft high, or 2.1m), swing, and place your legs on the chair.

3. ???

4. Do rows! Profit!

I found it better than other solution like hanging a towel etc, and I hope this helps someone.

**TL;DR**: Chair/Ladder/Something high in front of your pull up bar, swing from bar, legs on top of chair/ladder, do rows.",,False,,t5_2tf0a,1372687667.0,,,True,t3_1hfca7,http://www.reddit.com/r/bodyweightfitness/comments/1hfca7/a_great_new_way_i_discovered_for_doing_rows_with/,
1371851609.0,38,self.bodyweightfitness,1gtl61,Form Friday! Have a question on your form? Post it here.,44,6,28,http://www.reddit.com/r/bodyweightfitness/comments/1gtl61/form_friday_have_a_question_on_your_form_post_it/,Feel free to post and critique. Maybe we can make this a thing.,,False,,t5_2tf0a,False,,,True,t3_1gtl61,http://www.reddit.com/r/bodyweightfitness/comments/1gtl61/form_friday_have_a_question_on_your_form_post_it/,
1371756295.0,41,self.bodyweightfitness,1gqvqe,Help a girl out?,58,17,54,http://www.reddit.com/r/bodyweightfitness/comments/1gqvqe/help_a_girl_out/,"I was wondering, since I do all of my workouts at home aside from the climbing gym I'm a part of, is there anything to those workouts that you see in like Shape or Fitness magazine? I get bored just doing push ups and squats all the time and it's nice to be able to switch up routines but when it comes to working out I'm not very inventive I'm afraid. Can I get some opinions on what people think about say [this shape magazine arm workout](http://www.shape.com/fitness/workouts/5-minute-arms-workout) if I don't have access to any weights?",,False,,t5_2tf0a,False,,,True,t3_1gqvqe,http://www.reddit.com/r/bodyweightfitness/comments/1gqvqe/help_a_girl_out/,
1371122750.0,41,self.bodyweightfitness,1g9fi3,"One arm, one leg full bridge",46,5,13,http://www.reddit.com/r/bodyweightfitness/comments/1g9fi3/one_arm_one_leg_full_bridge/,"Is this safe? What I mean is, get into a full bridge (like so https://d3vs5ss8iow0ry.cloudfront.net/video-library/thumbnail/back-bridge_-_step_1.max.v1.png), and then lift one arm off the ground followed by the opposite leg, so that you are supporting yourself with one arm and one leg. I started to attempt this today but it just felt like something my body wasn't supposed to do. Is there any reason not to try it?",,False,,t5_2tf0a,False,,,True,t3_1g9fi3,http://www.reddit.com/r/bodyweightfitness/comments/1g9fi3/one_arm_one_leg_full_bridge/,
1366279884.0,36,self.bodyweightfitness,1clj3u,L-sit pullup does it work lats as hard as normal pullups?,46,10,16,http://www.reddit.com/r/bodyweightfitness/comments/1clj3u/lsit_pullup_does_it_work_lats_as_hard_as_normal/,"Just a thought? I have started to do l-sit pullups and make no mistake they are hard compared to standard pullups but are l-sit pullups working my lats any harder than normal pullups?  Or is it just harder cause of the core element?

Basically are my lats going to get bigger and stronger doing l-sit pullups for 6-7 reps when I can do 15 normal pullups? Or am I not getting as good a lat workout but a much better core workout!!??

Is a better solution doing weighted pullups and l-sit separately?
",,False,,t5_2tf0a,False,,,True,t3_1clj3u,http://www.reddit.com/r/bodyweightfitness/comments/1clj3u/lsit_pullup_does_it_work_lats_as_hard_as_normal/,
