created_utc,score,domain,id,title,ups,downs,num_comments,permalink,selftext,link_flair_text,over_18,thumbnail,subreddit_id,edited,link_flair_css_class,author_flair_css_class,is_self,name,url,distinguished
1367301585.0,27,self.bodyweightfitness,1de962,"Relationship between leg position and stable spine during pull-ups (discussion on ""Becoming a Supple Leopard"")",34,7,15,http://www.reddit.com/r/bodyweightfitness/comments/1de962/relationship_between_leg_position_and_stable/,"So I've been reading Kelly Starrett's ""Becoming a Supple Leopard"" and one of the main points he emphasises throughout the book (and indeed in his Mobility WOD video series) is to establish and maintain a braced and stable midline during exercise.

To maintain a stable midline during pull-ups, Starrett recommends that you ""straighten out your legs, position your feet together, and point your toes. Squeeze your butt and balance your ribcage over your pelvis"". I've tested this in the gym, and it definitely feels like a superior position compared to how I train at home (using a power tower where I have to bend my legs to stay off the ground). And may also explain why I occasionally get issues with my shoulders after doing workouts which emphasise pull-ups (Starrett discusses how doing a pull-up from an overextended position - e.g. with your legs hooked behind your body - will create a situation where you're applying torque to your shoulders from an unstable position). 

Anyone else experienced issues with doing pull-ups from a low bar? I'm considering if there's a way to perform the exercise with good form using a low bar, or if it's time to bite the bullet and rig up a proper high bar in my backyard.

Edit: Here's an image from ""Becoming a Supple Leopard"" to illustrate the form: http://i.imgur.com/bQGMNfO.jpg
Any concerned parties, just say the word and I'll take it down.",,False,,t5_2tf0a,1367305535.0,,,True,t3_1de962,http://www.reddit.com/r/bodyweightfitness/comments/1de962/relationship_between_leg_position_and_stable/,
1367173777.0,33,self.bodyweightfitness,1da916,Anyone have experience with Grease the Groove for pull ups?,38,5,12,http://www.reddit.com/r/bodyweightfitness/comments/1da916/anyone_have_experience_with_grease_the_groove_for/,How successful was it for you? What was your routine?,,False,,t5_2tf0a,False,,,True,t3_1da916,http://www.reddit.com/r/bodyweightfitness/comments/1da916/anyone_have_experience_with_grease_the_groove_for/,
1365034799.0,31,self.bodyweightfitness,1bmk9q,Negative pull ups,37,6,20,http://www.reddit.com/r/bodyweightfitness/comments/1bmk9q/negative_pull_ups/,Question on negative pull-ups how long do you hold yourself while going down?  Is there like a certain way for the exercise as like a set time for sets or just one long balls out negative?,,False,,t5_2tf0a,False,,,True,t3_1bmk9q,http://www.reddit.com/r/bodyweightfitness/comments/1bmk9q/negative_pull_ups/,
1364502984.0,33,self.bodyweightfitness,1b7646,Arm rotational movement in arm pressing/pulling,37,4,4,http://www.reddit.com/r/bodyweightfitness/comments/1b7646/arm_rotational_movement_in_arm_pressingpulling/,"A lot of people talk about the natural rotational or spiral path your arm wants to travel during a press or row, but I feel like I see polar opposite explanations that I have trouble understanding this aspect of arm movement. 

For example, Kelly Starrett, Pavel, and others (anatomy trains) talk a lot about 'screwing your shoulders in' into external rotation/supination/outward spiral for the strongest position, 'bending the bar' in a bench press, etc (much like working to keep legs in external rotation avoids knee cave and is the most stable position for executing loaded leg movements). However, if you throw a punch, do a cable press or row, do ring pushups, etc, you see a natural inward spiral/internal rotation/pronation. 

I'm having trouble wrapping my mind around these seemingly opposing viewpoints, and perhaps they only conflict due to my lack of understanding. Can anyone explain how this all fits together? ",,False,,t5_2tf0a,False,,,True,t3_1b7646,http://www.reddit.com/r/bodyweightfitness/comments/1b7646/arm_rotational_movement_in_arm_pressingpulling/,
1363073647.0,32,self.bodyweightfitness,1a4xy0,New and Curious,38,6,14,http://www.reddit.com/r/bodyweightfitness/comments/1a4xy0/new_and_curious/,"Hello everyone

I recently ordered a copy of Convict Conditioning (should be here tomorrow) and was wondering what I should expect.

I am 6'2"" 276lbs w/ 33% body fat. Am I crazy for trying BWF? Everything I have read/seen on here seems to show CC is a good starting point. I have no equipment in my house so I will either have to invest in that or figure out alternatives.

My goal is to get stronger...and keep up with my kids (who are 1 and 2.5 at the moment). Anything beyond that is just icing on the cake.

Any advice on motivation would be great too. 

TL;DR - I'm fat and will this work?

 ",,False,,t5_2tf0a,False,,,True,t3_1a4xy0,http://www.reddit.com/r/bodyweightfitness/comments/1a4xy0/new_and_curious/,
1361811167.0,31,self.bodyweightfitness,1976mk,"Can I find my absolute, magical bare minimum, workout-wise, by doing random exercises throughout the day?",35,4,17,http://www.reddit.com/r/bodyweightfitness/comments/1976mk/can_i_find_my_absolute_magical_bare_minimum/,"Hey folks. So here's a post that's originating out of a certain amount of focused frustration that I hope bares fruit. I want to know what the least amount of exercise I have to do to maintain my ideal weight and level of fitness.

I'm a musician and film editor. I travel a lot, and when I don't, I'm working from home. Bodyweight exercises are ideal because I don't always have access to equipment. Plus, there's something so zen about it. The one thing I do really enjoy is skipping, so that's the one tool I want to use.

So here's the thing: I want to get away from routines. Often, when I'm working from home, I find it easier to do a few reps of some exercise or the other roughly every hour - maybe three rounds of squats, pushups, situps, you name it. It charges me up and keeps me going. I get a rush to continue with my work, gets the creative juices flowing. However, I shy away from doing this as I feel it's useless and won't achieve the results that a focused half hour or hour long routine would.

Am I wrong? 

Can I reach and even maintain my ideal weight and fitness level by doing this? It feels easier, more enjoyable, and thus more sustainable. Everything else feels like a chore. I want to find a way of keeping fit that I enjoy and that motivates me.

Sorry if this is a bit of a ramble; it just struck me that I find it much easier to workout like this, as unconventional as it is. It might even actually be more work that doing a focused routine every or every other day, but somehow I think it would work for me.",,False,,t5_2tf0a,False,,,True,t3_1976mk,http://www.reddit.com/r/bodyweightfitness/comments/1976mk/can_i_find_my_absolute_magical_bare_minimum/,
1361454640.0,31,self.bodyweightfitness,18ybme,What to do in tiny apt? (x-posted from homefitness),32,1,6,http://www.reddit.com/r/bodyweightfitness/comments/18ybme/what_to_do_in_tiny_apt_xposted_from_homefitness/,"I am moving in a couple weeks to a very tiny apt in NYC. Any tips for working out?
I likely won't be able to set up a door-frame pull-up bar. I might not even have room to do a pushup (maybe vertical ones).",,False,,t5_2tf0a,False,,,True,t3_18ybme,http://www.reddit.com/r/bodyweightfitness/comments/18ybme/what_to_do_in_tiny_apt_xposted_from_homefitness/,
1359054510.0,31,self.bodyweightfitness,177dwt,Good routine without jumping around? (Apartment noise issues),34,3,10,http://www.reddit.com/r/bodyweightfitness/comments/177dwt/good_routine_without_jumping_around_apartment/,"Hey guys,

In the past, I went to the gym several times a week (3 or 4), but recently took a job with a longer commute, and now don't have time to get to the gym anymore (or, very little).

I was wondering if you could recommend a routine I could do **in my apartment**.  My apartment isn't particularly large, and has some drawbacks which I'll list below:

* I do not have any doorframe that is in a position to support a pullup bar.
* I can't do anything with jumping/banging the ground, as I'll get noise complaints from my downstairs neighbours.
* Anything else I am good to go!

Is there any routines that will work for this situation?  My primary goal is weight loss (well, lower body fat, technically), but gaining strength is always a good thing.

Thanks for any suggestions!",,False,,t5_2tf0a,False,,,True,t3_177dwt,http://www.reddit.com/r/bodyweightfitness/comments/177dwt/good_routine_without_jumping_around_apartment/,
1358812699.0,31,self.bodyweightfitness,170rw3,Love this workout!!! ,43,12,13,http://www.reddit.com/r/bodyweightfitness/comments/170rw3/love_this_workout/,http://www.teenbodybuilding.com/brent2.htm copy this and check it out! I love this workout and have done it multiple times. It's pretty bad A and doesn't require a ton of time until you hit like week 8. It will help challenge your body and get you into great shape. ,,False,,t5_2tf0a,False,,,True,t3_170rw3,http://www.reddit.com/r/bodyweightfitness/comments/170rw3/love_this_workout/,
1358241972.0,30,self.bodyweightfitness,16lzek,Slow burn?,36,6,13,http://www.reddit.com/r/bodyweightfitness/comments/16lzek/slow_burn/,"What's the opinion on slow-burn-like training, with 15-20 sec reps? Do they provide benefit when strength is the main goal, or would regular reps be better?

It seems to me that the slow burn approach makes the same progression harder, so that could be useful in bodyweight training as an alternative means to increase difficulty of an exercise.",,False,,t5_2tf0a,False,,,True,t3_16lzek,http://www.reddit.com/r/bodyweightfitness/comments/16lzek/slow_burn/,
1358101221.0,31,self.bodyweightfitness,16i1d3,Some questions from a skinny guy.,37,6,24,http://www.reddit.com/r/bodyweightfitness/comments/16i1d3/some_questions_from_a_skinny_guy/,"Yo /r/bodyweightfitness.

I am a ~5'8, 53kg 17-year old male and I'm looking to gain muscle and strength... because I'm skinny as shit.

Are bodyweight exercises such as those found in the FAQ (http://i.imgur.com/vGeE5.png) useful for gaining muscle mass and weight in general? Or should I just suck it up and hit the weights in the gym?

Thanks in advance guys :)

Edit: just realized this is actually only one question",,False,,t5_2tf0a,False,,,True,t3_16i1d3,http://www.reddit.com/r/bodyweightfitness/comments/16i1d3/some_questions_from_a_skinny_guy/,
1357634719.0,30,self.bodyweightfitness,166bah,working out at work,36,6,24,http://www.reddit.com/r/bodyweightfitness/comments/166bah/working_out_at_work/,"So I have a desk job, and this makes me have way to much energy during the day. So I try to do some training while working, but it's not so easy (since I'm on a chair all day, and I prefer my colleges not noticing). 

The best one I found so far is sitting up very straight in my chair and lifting my knees (while pushing my hands on desk), it's quite hard and not so noticeable.

I also have a stress ball that I like to use for some underarm training.

I also like to jump up the stairs

So I was wondering if you guys have any good suggestions ?

Also thanks everybody, I'm new here and even though not everything is very clear yet I like the exercises and feel like this is a fun way to work out.",,False,,t5_2tf0a,False,,,True,t3_166bah,http://www.reddit.com/r/bodyweightfitness/comments/166bah/working_out_at_work/,
1354506902.0,28,imgur.com,146lpw,Inside room Workout Station,40,12,3,http://www.reddit.com/r/bodyweightfitness/comments/146lpw/inside_room_workout_station/,,,False,,t5_2tf0a,False,,,False,t3_146lpw,http://imgur.com/a/hYOPP,
1351537984.0,29,self.bodyweightfitness,12ahcb,Doorway pull up bar transformation?,40,11,38,http://www.reddit.com/r/bodyweightfitness/comments/12ahcb/doorway_pull_up_bar_transformation/,"hey guys. here's the deal. i have [this](http://24.media.tumblr.com/tumblr_m41cu2Y7Zv1qe197lo1_400.jpg)

is there anyway i can build an extension to turn it into something like [this](http://shamrockgym.com/)

I want to be able to do tricep dips, but spending that much money not really plausible at the moment. 

Any safe/sturdy ways to do it?
thanks!",,False,,t5_2tf0a,False,,,True,t3_12ahcb,http://www.reddit.com/r/bodyweightfitness/comments/12ahcb/doorway_pull_up_bar_transformation/,
1344721306.0,34,youtube.com,y2cdw,Rings E and F elements,35,1,2,http://www.reddit.com/r/bodyweightfitness/comments/y2cdw/rings_e_and_f_elements/,,,False,,t5_2tf0a,False,,,False,t3_y2cdw,http://www.youtube.com/watch?v=zNqNDhap-QQ&amp;feature=plcp,
1344313406.0,34,bodybuilding.com,xt29n,What is this abs exercise by Bruce Lee called?,36,2,10,http://www.reddit.com/r/bodyweightfitness/comments/xt29n/what_is_this_abs_exercise_by_bruce_lee_called/,,,False,,t5_2tf0a,False,,,False,t3_xt29n,http://www.bodybuilding.com/fun/images/2010/getting-fit-and-strong-the-bruce-lee-way_d.jpg,
1337609461.0,29,self.bodyweightfitness,txif7,Prilepin tables for bodyweight strength isometric and eccentric exercises,38,9,13,http://www.reddit.com/r/bodyweightfitness/comments/txif7/prilepin_tables_for_bodyweight_strength_isometric/,"So, this is some more content directly from [Overcoming Gravity](http://www.amazon.com/gp/product/1467933120/) which is helpful in structuring isometrics such as the planche, back lever, front lever, cross, as well as some of the skill movements like handstand, L-sit, etc. Likewise, another chart was constructed for eccentrics which can be useful to work up to strength movements like one arm chinups or even just pullups or dips if you are just starting out.

I figured it would be good to release this because structuring loading parameters is difficult for most people to do, especially in regard to these two different types of exercises. This article serves to help answer the questions in regards to building strength and hypertrophy:

* How long do the sets need to be?

* Why are they that length?

* What overall volume (sets x holds) is good for these types of exercises

Without further ado,

http://www.eatmoveimprove.com/2012/05/prilepin-tables-for-bodyweight-strength-isometric-and-eccentric-exercises/

Also, if you were interested in grabbing Overcoming Gravity but living in a country other than the US, Overcoming Gravity is now available on the Amazons in the UK and the European Union! [Previous author AMA on OG if you weren't aware](http://www.reddit.com/r/Fitness/comments/o5nn7/i_am_steven_low_author_of_overcoming_gravity_ask/).

Hope you enjoy. Let me know if you guys have any questions or comments. ",,False,,t5_2tf0a,False,,,True,t3_txif7,http://www.reddit.com/r/bodyweightfitness/comments/txif7/prilepin_tables_for_bodyweight_strength_isometric/,
1336137223.0,30,youtube.com,t6rz7,This should help those of you striving for a strict muscle up,35,5,11,http://www.reddit.com/r/bodyweightfitness/comments/t6rz7/this_should_help_those_of_you_striving_for_a/,,,False,,t5_2tf0a,False,,,False,t3_t6rz7,http://www.youtube.com/watch?v=o52cZ-_bH7s&amp;feature=player_embedded,
1333290382.0,32,youtube.com,rnxwp,Starting out at a young age,38,6,11,http://www.reddit.com/r/bodyweightfitness/comments/rnxwp/starting_out_at_a_young_age/,,,False,,t5_2tf0a,False,,,False,t3_rnxwp,http://www.youtube.com/watch?v=W-nSKDg_ERw#!,
1332845704.0,30,self.bodyweightfitness,rfp3w,What are some crucial exercises to get a Gymnast's body?,36,6,92,http://www.reddit.com/r/bodyweightfitness/comments/rfp3w/what_are_some_crucial_exercises_to_get_a_gymnasts/,"Hi guys,

Well a few months ago I was your typical extremely skinny guy but after that I was sick of it I decided to do a Starting Strength variant and have since absolutely loved working out.

So first of all I don't even know if it's possible given Gymnasts seem to all be young guys that have developed them for well over a decade. I'm 20 at the moment and am still quite unmuscular. Would it be possible by the time I'm 30? Or would that be too late? [This should give you an idea of what I'm going for.](http://images.t-nation.com/forum_images/2/1/215b9-Building_the_Gymnastic_Body.jpg) It should be noted that I'm not trying to be a Gymnast, just look like one. I'd kill to be able to take Gymnastics classes but I don't have the money - I figure aiming for their body now would greatly benefit me when I get the chance to take classes.

I originally planned on showing you guys a basic plan but I've decided against it. But instead, I'll collate all the information from this thread and post a plan afterwards to see what you guys think.

So I have one hour per day to work out. I have access to a bench press (and barbell), chin up bar, and I'm quite good at Macguivering any other bodyweight equipment - like seats for hyperextensions. Give me your worst!

Cheers :)",,False,,t5_2tf0a,False,,,True,t3_rfp3w,http://www.reddit.com/r/bodyweightfitness/comments/rfp3w/what_are_some_crucial_exercises_to_get_a_gymnasts/,
1327679934.0,30,self.bodyweightfitness,oz88g,[Flexibility Friday] The Quadriceps / Hip Flexors,34,4,23,http://www.reddit.com/r/bodyweightfitness/comments/oz88g/flexibility_friday_the_quadriceps_hip_flexors/,"Ok, so this is the first in a (hopefully) long line of weekly posts. The point of this thread is to discuss flexibility - techniques, tools, struggles, and hardships.

The topic this week: those pesky hip flexors. I'm sure we ALL have issues with these, after years of sitting in chairs during classes, in cars, at home, at work.

**So what do you do to stretch your hip flexors? What's your favorite techniques? What's your least favorite?**

(This is, of course, open to all questions regarding flexibility, but keeping it focused on the hip flexors this time is ideal)",,False,,t5_2tf0a,False,,,True,t3_oz88g,http://www.reddit.com/r/bodyweightfitness/comments/oz88g/flexibility_friday_the_quadriceps_hip_flexors/,
1376592154.0,30,self.bodyweightfitness,1kfo73,Cool Excel Weight Tracker posted in /r/dataisbeautiful,37,7,4,http://www.reddit.com/r/bodyweightfitness/comments/1kfo73/cool_excel_weight_tracker_posted_in/,"Saw this posted in /r/dataisbeautiful:

http://i.imgur.com/yZR8WgX.png

Not everyone cares this much about their weight, but for those of us who do, this is a pretty cool tracker!  

And simple to use: Just add your starting weight to cells C2 and K2, then add your weight each day in column C.  

To adjust the charts to reflect your weight range, click on the chart, go to the ribbon at the top and click Chart Tools &gt; Format; in the far left of that menu, select Vertical Axis and change the ranges - that last step varies depending on which version of Excel you're in; in 2013, a panel opens on the right where you can change the min and max.  You can do the same thing with the dates by selecting Horizontal Axis - otherwise, it'll start with today.

Here's a link to the /r/dataisbeautiful thread:

http://www.reddit.com/r/dataisbeautiful/comments/1keya7/im_a_bodybuilder_heres_my_weight_tracking_system/

The OP answers a lot of the questions you might have about it.

Link to tracker template: 

https://docs.google.com/file/d/0B7QXB9iH3RlvTm43c1otaFIwaW8/edit?usp=sharing

All credit should go to /u/TheGoomba (other thread's OP) and /u/weDAMAGEwe (creator of the spreadsheet).",,False,,t5_2tf0a,False,,,True,t3_1kfo73,http://www.reddit.com/r/bodyweightfitness/comments/1kfo73/cool_excel_weight_tracker_posted_in/,
1376230339.0,33,self.bodyweightfitness,1k573l,Problem with right arm while doing side plank,46,13,11,http://www.reddit.com/r/bodyweightfitness/comments/1k573l/problem_with_right_arm_while_doing_side_plank/,"Whenever I try the side plank with my right arm fully extended (as opposed to on the elbow) I feel shocks like electricity going over the left side of my arm through the left side of my elbow (palm facing upwards). Any other exercise is, fine no pain or shocks.

Is it okay to work up from elbow on the floor or is there something else this hints at?",,False,,t5_2tf0a,1376230920.0,,,True,t3_1k573l,http://www.reddit.com/r/bodyweightfitness/comments/1k573l/problem_with_right_arm_while_doing_side_plank/,
1376150229.0,28,self.bodyweightfitness,1k3d4a,[Form check]Building up to pistol squats,40,12,22,http://www.reddit.com/r/bodyweightfitness/comments/1k3d4a/form_checkbuilding_up_to_pistol_squats/,"So I recently decided to back off pistol squats and try to really get the form down to protect my knees. 

I have dropped down to really deep squats and roll up to squats with a 10 lb sandbag (helps with balance). Can someone check my form and tell me if I'm getting the right idea?

https://www.youtube.com/watch?v=j4dcgtTWotY&amp;feature=youtube_gdata_player",,False,,t5_2tf0a,False,,,True,t3_1k3d4a,http://www.reddit.com/r/bodyweightfitness/comments/1k3d4a/form_checkbuilding_up_to_pistol_squats/,
1375905132.0,32,self.bodyweightfitness,1jwlpa,Best exercises to substitute/help with L-Sits?,36,4,13,http://www.reddit.com/r/bodyweightfitness/comments/1jwlpa/best_exercises_to_substitutehelp_with_lsits/,"Hey folks. So it's been almost a year now and I've made absolutely 0 progress with L-Sits. I can do an open tuck (legs bent) for about 10 seconds and that's it. I've been consistently at it for ages and it's just going nowhere. 

Anyway, question: What are some exercises I can do that will help me progress with L-Sits? I though hanging leg raises might help. Is there anything else I can try that will boost l-sit progress? Thanks for any help!

[Video](http://www.youtube.com/watch?v=JAfEbXW3OvA)",,False,,t5_2tf0a,1375912521.0,,,True,t3_1jwlpa,http://www.reddit.com/r/bodyweightfitness/comments/1jwlpa/best_exercises_to_substitutehelp_with_lsits/,
1375282752.0,26,self.bodyweightfitness,1jfa0l,Fed up with Fitocracy. Looking for a new app.,38,12,26,http://www.reddit.com/r/bodyweightfitness/comments/1jfa0l/fed_up_with_fitocracy_looking_for_a_new_app/,"Fitocracy was one of the things that got me motivated to work out, but their lack of selection of bodyweight exercises is really starting to frustrate me.  I don't feel like I need the motivation of points to keep exercising any more, so I'd like to find an app that just makes it easy to track workouts.  
  
**Here's what I'm looking for:**  
* Custom exercises - able to choose time/reps/weight  
* Custom routines - able to save sets of exercises  
* Notes - able to record some information about the workout  
* Free
  
I have spent some time looking through old posts here, and just browsing the web, but haven't been able to find something that meets all these criteria.  I've tried several alternatives, such as JIFIT, Gym Hero, and Workout Log, but they all either lack features or are buggy to the point of being useless.  Does anyone have an app that fits the bill?

**TL;DR: Looking for an iPhone app to track bodyweight routine accurately and easily**

Edit: Clarified that I'm looking for an iPhone app.",,False,,t5_2tf0a,1375284094.0,,,True,t3_1jfa0l,http://www.reddit.com/r/bodyweightfitness/comments/1jfa0l/fed_up_with_fitocracy_looking_for_a_new_app/,
1375116048.0,28,self.bodyweightfitness,1ja9y7,Left hand pain when coming out of handstands...,36,8,4,http://www.reddit.com/r/bodyweightfitness/comments/1ja9y7/left_hand_pain_when_coming_out_of_handstands/,"Been making good progress since working on my handstands seriously for about 3 months, 5 days a week with about 5 minutes of practice.  But recently, coming out of handstands I feel pain near the side of my left hand, sort of where the pinky and ring finger meet the palm.  Feels almost stress-fracturish, but goes away pretty quickly... I've stopped my regimen for the time being except for the occasional test, sometimes it hurts more, sometimes less, sometimes not at all.  Anyone have experience with this?  Is there a common form issue I could rectify?  Any and all feedback is appreciated cause I really just want to do more handstands as quickly as possible...",,False,,t5_2tf0a,False,,,True,t3_1ja9y7,http://www.reddit.com/r/bodyweightfitness/comments/1ja9y7/left_hand_pain_when_coming_out_of_handstands/,
1374283437.0,32,self.bodyweightfitness,1io568,First night as a rank beginner,39,7,8,http://www.reddit.com/r/bodyweightfitness/comments/1io568/first_night_as_a_rank_beginner/,"Hey all! I found this subreddit Wednesday night after my workout so I didn't get a chance to try the rank beginner's workout until tonight.  First impressions: OW. Handstand practice has been renamed ""don't eat the floor"" practice in my house.  I had no idea it was going to be as hard as it was, but damn I felt good afterward.  The exercises are hard for me as I'm kind of lanky, but they're a lot of fun.

A little background info; I'm 6'3"" and 190 lbs. I lost 53 pounds with MyFitnessPal and walking with my fiancee`, but walking isn't cutting it anymore, so I went looking for bodyweight workouts.  I tried one that I found on the internet Monday and Wednesday, then wondered if Reddit had something I could try.  The rank beginner's workout beats the other one hands down.

I've read through the FAQ several times and have really tried to soak up as much as I can. I've got a ton of questions, but they'll hold until Moronic Monday.

Thanks to all the ones who came before me, that contributed to the FAQ, that figured out what works and what doesn't and made it simple enough for me to understand.  I'm looking forward to progressing with all of you.",,False,,t5_2tf0a,False,,,True,t3_1io568,http://www.reddit.com/r/bodyweightfitness/comments/1io568/first_night_as_a_rank_beginner/,
