created_utc,score,domain,id,title,ups,downs,num_comments,permalink,selftext,link_flair_text,over_18,thumbnail,subreddit_id,edited,link_flair_css_class,author_flair_css_class,is_self,name,url,distinguished
1362295913.0,99,imgur.com,19kg92,You guys might like this better than the rest of reddit,109,10,13,http://www.reddit.com/r/Chefit/comments/19kg92/you_guys_might_like_this_better_than_the_rest_of/,,,False,http://d.thumbs.redditmedia.com/m__ugPbDHcsD_FX9.jpg,t5_2s1da,False,,,False,t3_19kg92,http://www.imgur.com/3arESlF.jpeg,
1370922401.0,66,imgur.com,1g3ie7,Culinary Artistry in easily accessible spreadsheet form. (Let me know if you need the file),76,10,22,http://www.reddit.com/r/Chefit/comments/1g3ie7/culinary_artistry_in_easily_accessible/,,,False,http://f.thumbs.redditmedia.com/fmk_F72a4QWgVWnS.jpg,t5_2s1da,False,,,False,t3_1g3ie7,http://imgur.com/a/cp9NP,
1367464112.0,64,i.imgur.com,1dj153,It places the produce order in the basket,76,12,9,http://www.reddit.com/r/Chefit/comments/1dj153/it_places_the_produce_order_in_the_basket/,,,False,http://a.thumbs.redditmedia.com/yraZn8HSl_RE_s1T.jpg,t5_2s1da,False,,,False,t3_1dj153,http://i.imgur.com/WWyVux6.jpg,
1353891496.0,52,imgur.com,13sbcl,"A young kid asked me if I could make him a ninja 
turtle pancake.  How did I do?",69,17,9,http://www.reddit.com/r/Chefit/comments/13sbcl/a_young_kid_asked_me_if_i_could_make_him_a_ninja/,,,False,http://d.thumbs.redditmedia.com/xWssuoxhZqp-X6uE.jpg,t5_2s1da,False,,,False,t3_13sbcl,http://imgur.com/n9wPO,
1371500231.0,47,imgur.com,1gjd96,80hrs/week no life and it's still worth it every day,60,13,8,http://www.reddit.com/r/Chefit/comments/1gjd96/80hrsweek_no_life_and_its_still_worth_it_every_day/,,,False,http://c.thumbs.redditmedia.com/x1OQvFXf3UAtRtHP.jpg,t5_2s1da,False,,,False,t3_1gjd96,http://imgur.com/gallery/woEX8,
1326749268.0,40,self.Chefit,ojtb5,Angry chefs,41,1,30,http://www.reddit.com/r/Chefit/comments/ojtb5/angry_chefs/,"Just came home from work and dear god, that was probably the worst day ever. The tension, the annoyance, the screaming, all over the fucking top. It's like we were in a middle of WW1, stuck in a trench for weeks and the Germans were about release copious amounts of mustard gas. I mean come on. It wasn't just unpleasant, it was, I dunno, the word unhealthy should probably sum it up. Honestly, if you're a chef and you get angry and annoyed over the slightest thing, if you're constantly power-tripping, if you have zero respect for maintaining reasonable work environment, well, here's a big fuck you from me.

Sorry for this not particularly informative or engaging thread, but it was a seriously shitty day.",,False,self,t5_2s1da,False,,,True,t3_ojtb5,http://www.reddit.com/r/Chefit/comments/ojtb5/angry_chefs/,
1339518598.0,39,fadeoutfade.in,uy52f,"""Jiro Dreams of Sushi"" is feature-length unapolagetic sushi food porn. And it is awesome.",42,3,10,http://www.reddit.com/r/Chefit/comments/uy52f/jiro_dreams_of_sushi_is_featurelength/,,,False,http://e.thumbs.redditmedia.com/qVSoqlmAXOpolNMd.jpg,t5_2s1da,False,,,False,t3_uy52f,http://fadeoutfade.in/jiro-dreams-sushi/,
1363964110.0,35,i.imgur.com,1asuqn,Pizza dough in a hot trunk (x-post from /r/wtf),37,2,8,http://www.reddit.com/r/Chefit/comments/1asuqn/pizza_dough_in_a_hot_trunk_xpost_from_rwtf/,,,False,http://a.thumbs.redditmedia.com/RmS9i4g87pq3n-X0.jpg,t5_2s1da,False,,,False,t3_1asuqn,http://i.imgur.com/zAevfs2.jpg,
1358500375.0,35,media-cache-ec5.pinterest.com,16t4wl,A Stress only a Chef could know,37,2,24,http://www.reddit.com/r/Chefit/comments/16t4wl/a_stress_only_a_chef_could_know/,,,False,http://f.thumbs.redditmedia.com/M5YA71lvdRj9wD65.jpg,t5_2s1da,False,,,False,t3_16t4wl,http://media-cache-ec5.pinterest.com/upload/464785624013375666_RkzQ1B2y.jpg,
1314724308.0,37,sale.images.woot.com,jz823,Kitchen Warfare,43,6,7,http://www.reddit.com/r/Chefit/comments/jz823/kitchen_warfare/,,,False,http://thumbs.reddit.com/t3_jz823.png,t5_2s1da,False,,,False,t3_jz823,http://sale.images.woot.com/Kitchen_WarfarecncDetail.png,
1344958341.0,34,i.imgur.com,y7fqu,"Chefs will appreciate this, stock pot of mash potato water met my hand today ",37,3,28,http://www.reddit.com/r/Chefit/comments/y7fqu/chefs_will_appreciate_this_stock_pot_of_mash/,,,False,http://c.thumbs.redditmedia.com/rjfo6d0OiA_51ka8.jpg,t5_2s1da,False,,,False,t3_y7fqu,http://i.imgur.com/93sVw.jpg,
1373645686.0,28,edx.org,1i5s95,I want to share an interesting food and science course I found available online.,33,5,10,http://www.reddit.com/r/Chefit/comments/1i5s95/i_want_to_share_an_interesting_food_and_science/,,,False,http://a.thumbs.redditmedia.com/HL2OLWWaglxUV9dB.jpg,t5_2s1da,False,,,False,t3_1i5s95,https://www.edx.org/course/harvard-university/spu27x/science-cooking-haute-cuisine/639,
1374070428.0,28,livememe.com,1ihioi,My freezer broke yesterday. My fridge broke last night. The repair guy is three hours late. But I'm happy :),38,10,23,http://www.reddit.com/r/Chefit/comments/1ihioi/my_freezer_broke_yesterday_my_fridge_broke_last/,,,False,http://b.thumbs.redditmedia.com/4x18oNB4M_atklH7.jpg,t5_2s1da,False,,,False,t3_1ihioi,http://www.livememe.com/od4mla9,
1367225368.0,27,i.imgur.com,1dbt5l,"New chef at my work wastes 2 hrs making tartare sauce(which usually takes 10 mins) then, proceeds to drop all 20 litres of it.",44,17,49,http://www.reddit.com/r/Chefit/comments/1dbt5l/new_chef_at_my_work_wastes_2_hrs_making_tartare/,,,False,default,t5_2s1da,False,,,False,t3_1dbt5l,http://i.imgur.com/MyaKCi1.jpg,
1364066475.0,30,self.Chefit,1avfwh,A Cook's Limerick,34,4,8,http://www.reddit.com/r/Chefit/comments/1avfwh/a_cooks_limerick/,"I came up with this while in the shower post-shift last night.  Thought I'd share it here.

Our forearms are covered in scars.
After work we go drinking at bars.
But at the end of the day, post shit work and shit pay, we still strive to someday be stars.",,False,self,t5_2s1da,False,,,True,t3_1avfwh,http://www.reddit.com/r/Chefit/comments/1avfwh/a_cooks_limerick/,
1328773774.0,30,self.Chefit,phkfc,I think this deserves a post here too: RIP Good Eats,34,4,8,http://www.reddit.com/r/Chefit/comments/phkfc/i_think_this_deserves_a_post_here_too_rip_good/,"I, like many, had our thought process improved greatly by arguably the greatest cooking show of all time, Good Eats. Personally, Good Eats expanded my knowledge in areas of food I didn't know I didn't know. 

Good Eats made me a better chef, and a line cook, and drove my near psychotic interest in cooking for a few years. My greatest sorrow is that it is ending far too soon, and there is far too much to cover in food. I sincerely hope a show comes along and picks up the torch, and shows home cooks techniques like Sous Vide, foams, butter basting, and spumas. 

Let's push ourselves in the only truly honest craft and pleasure left in the world.",,False,self,t5_2s1da,False,,,True,t3_phkfc,http://www.reddit.com/r/Chefit/comments/phkfc/i_think_this_deserves_a_post_here_too_rip_good/,moderator
1328225614.0,28,youtube.com,p8ftv,Have you guys seen this Thomas Keller TED talk?,31,3,28,http://www.reddit.com/r/Chefit/comments/p8ftv/have_you_guys_seen_this_thomas_keller_ted_talk/,,,False,http://b.thumbs.redditmedia.com/8KigKF6Dm9PwpI2C.jpg,t5_2s1da,False,,,False,t3_p8ftv,http://www.youtube.com/watch?v=QC_hDKzm900,
1375113630.0,28,self.Chefit,1ja6r2,Do's and Don'ts of posting an ad on craigslist (xpost from KitchenConfidential),33,5,14,http://www.reddit.com/r/Chefit/comments/1ja6r2/dos_and_donts_of_posting_an_ad_on_craigslist/,"I posted this in my local Craigslist not too long ago.  

Dear restaurant owners and operators, I have been browsing this section off and on for the last few years, and over that time I have noticed some things. I've heard many people complain that good help is hard to find, but let me tell you that a good ad is even more scarce. Here are a few pointers:

1. Include the name of your restaurant and its location. Most people want to know where they are applying to before they send out their resume, especially in a small area such as this. Name any restaurant from here to Boston and most restaurant employees can either name someone they know that works there or tell you about the last time they ate there. 

2. If you do not feel comfortable including your restaurant's name, at least give people a general idea of where it is. I can't tell you how many times I've seen an ad that simply lists the location as RI. I know it's a small state, but there is still a huge difference between Newport and Woonsocket. 

3. Be descriptive. Don't post an ad that simply says ""busy restaurant in Prov seeks cook."" Tell me about your place, and what you're looking for. 

4. ""Seeking an individual with experience working grill, saute, fry, and garde manger. Must be able to work independently. Starting pay is $10/hr."" If you want quality help, then you're going to have to pay for it. 

5. While we're on the subject of money, a line like ""compensation TBD"" means that I know you're going to try to talk me down to as low as I can possibly go, and ""Students welcome"" means that the pay is either pitifully low, or nonexistent. 

6. I can't pay my rent with valuable job experience, so you can't pay me with it. Don't get me wrong, I love what I do, but I also love having a roof over my head and gas in my car. You are on glue if you think that any cook out there is passionate enough about cooking to disagree with me on those points. 

7. DO NOT POST AN AD WITH ALL CAPS AND NO PUNCTUATION IT WILL MAKE ME WONDER ABOUT THE MENTAL STATUS OF THE PERSON I COULD POTENTIALLY BE WORKING FOR AND I READ IT AS IF YOURE SHOUTING AT ME.

8. Seriously, don't do that. 

9. Know the difference between a sous chef and a prep cook, and if you're looking for one, don't advertise for the other. 

10. Get back to people on time. Listen, I know that running a restaurant is a very time consuming and exhausting job, but this is 2013 and everyone except for my grandma has a smartphone. There is no reason why anyone should go three weeks without checking an e-mail, especially when you included that e-mail address in the contact info.",,False,self,t5_2s1da,False,,,True,t3_1ja6r2,http://www.reddit.com/r/Chefit/comments/1ja6r2/dos_and_donts_of_posting_an_ad_on_craigslist/,
1348094727.0,31,i.imgur.com,105ta1,"This is what happens when someone doesn't make a safety call like ""Behind."" (x-post WTF)",39,8,19,http://www.reddit.com/r/Chefit/comments/105ta1/this_is_what_happens_when_someone_doesnt_make_a/,,,False,http://c.thumbs.redditmedia.com/U59DZtbdb_m25DVJ.jpg,t5_2s1da,False,,,False,t3_105ta1,http://i.imgur.com/10HmI.jpg,
1373261358.0,26,imgur.com,1huimc,Julienne Leeks as done by the morning crew.,33,7,19,http://www.reddit.com/r/Chefit/comments/1huimc/julienne_leeks_as_done_by_the_morning_crew/,,,False,http://a.thumbs.redditmedia.com/4WQlYtv5ge_KBwzl.jpg,t5_2s1da,False,,,False,t3_1huimc,http://imgur.com/qQVpHC1,
1346146114.0,26,sfgate.com,yycld,"Are you putting out ""comma cuisine?""",26,0,24,http://www.reddit.com/r/Chefit/comments/yycld/are_you_putting_out_comma_cuisine/,,,False,http://e.thumbs.redditmedia.com/11nj8Nkcvz89NDuj.jpg,t5_2s1da,False,,,False,t3_yycld,http://www.sfgate.com/default/article/Tiny-morsels-arranged-with-tweezers-3813944.php,
1326191244.0,26,self.Chefit,oaowh,No more Nyquil for me..,28,2,24,http://www.reddit.com/r/Chefit/comments/oaowh/no_more_nyquil_for_me/,"I woke up last night in a panic because I thought my team’s sausages for our Garde Manger class were not poached. I proceeded to try to light my pillow on fire, thinking that it was a pot of poaching water. Apparently there is no pilot light under my pillow. No more Nyquil for me. My chef at work found it hilarious, so I figured I would share it with you guys.
",,False,self,t5_2s1da,False,,,True,t3_oaowh,http://www.reddit.com/r/Chefit/comments/oaowh/no_more_nyquil_for_me/,
1369351330.0,25,self.Chefit,1exq4n,Here we go.,29,4,28,http://www.reddit.com/r/Chefit/comments/1exq4n/here_we_go/,"I'm heading into his weekend solo. Lets call it 35 seats. Breakfast lunch bakery, 7-2. Still in physical therapy for a torn MCL from winter injury. Surgery scheduled for ingrown toenails. Two servers and a hostess to fill the seats and kick my ass with orders as fast as humanly possible without pacing. NO dishwasher. As in a human doing dishes, I have a working dishwasher but it is old and slow and barely does the job. Barely have any home fries left in my walk-in. Sysco and produce order to receive and put away. An owner/manager half way across the country. So basically in short. I am fucked. Wish me luck guys. 


Update: it's been a rough month but just got a $200 bonus. I honestly don't know how I have been keeping this kitchen afloat. As brutal as t has been, it feels great knowing I can handle this kind of shit. I like the in the weeds thing. Honestly of anyone here is in northern vt and has strong skills contact me. I can't hire you but we need help desperately at my restaurant still.",,False,self,t5_2s1da,1370819764.0,,,True,t3_1exq4n,http://www.reddit.com/r/Chefit/comments/1exq4n/here_we_go/,
1320741159.0,25,i.imgur.com,m4mne,Scumbag Customers (xpost from r/funny),28,3,6,http://www.reddit.com/r/Chefit/comments/m4mne/scumbag_customers_xpost_from_rfunny/,,,False,http://f.thumbs.redditmedia.com/ZOLcnwrUU6zQeOpM.jpg,t5_2s1da,False,,,False,t3_m4mne,http://i.imgur.com/X4zJI.jpg,
1371391755.0,22,self.Chefit,1ggcxi,Chefit travel guide.,23,1,9,http://www.reddit.com/r/Chefit/comments/1ggcxi/chefit_travel_guide/,"So I saw someone ask about traveling to Atlanta, asking what area chefs thought were the must see places. Personally, I use yelp when traveling to an area unknown and without contacts or friends there, but how about we compile a guide for chefs by chefs. If so, maybe we could start a google doc and post it here or just make a big comment thread of suggestions.",,False,self,t5_2s1da,False,,,True,t3_1ggcxi,http://www.reddit.com/r/Chefit/comments/1ggcxi/chefit_travel_guide/,
1355886138.0,25,i.imgur.com,1536cq,Hey!  I worked for that guy!,27,2,1,http://www.reddit.com/r/Chefit/comments/1536cq/hey_i_worked_for_that_guy/,,,False,http://f.thumbs.redditmedia.com/_bpyXFyUWOYN1uvk.jpg,t5_2s1da,False,,,False,t3_1536cq,http://i.imgur.com/MvMFn.png,
1358260583.0,23,self.Chefit,16macs,"Professional chefs of Reddit, Is it as bad as they say? (X-post from Askreddit)",27,4,28,http://www.reddit.com/r/Chefit/comments/16macs/professional_chefs_of_reddit_is_it_as_bad_as_they/,"I am really thinking about becoming a chef after getting out of high school, although I don't have as much time currently to cook as much as I would like, I love to cook and i can see it becoming a job I really enjoy.
My main question is how are you guys money wise? Are you struggling to get by like some have said they do online? Also what did you get in terms of training? (tech school, culinary school, etc.)",,False,self,t5_2s1da,False,,,True,t3_16macs,http://www.reddit.com/r/Chefit/comments/16macs/professional_chefs_of_reddit_is_it_as_bad_as_they/,
1353032957.0,22,self.Chefit,139yso,"What are some techniques you've learned over the years to help make you more efficient as a cook, professionally?",24,2,50,http://www.reddit.com/r/Chefit/comments/139yso/what_are_some_techniques_youve_learned_over_the/,"For example, lightly wetting a bundle of chives to cut them more easily.  

Prep, saute, pastry, pizzas, whatever you do.

Also first post ever in reddit.

Also, hello everybody.

Edit:  I guess that was a really really really broad question.  Rephrase: What are some tricks you use with food to help you prep faster, or cook faster.  Something like tenting a steak on the grill with a sizzle or pulling parsley through a rubber band to de-stem the lot of them.  

I had an ah-hah moment the other day with a tomato slicer, I usually make a big pile of tomato rounds and a big mess of pulp and seeds to clean up after.  I realized I could just put a bunch of empty six pans in my well, steady the slicer against the edge of it and push tomato slices straight into the six pans with little mess.",,False,self,t5_2s1da,1353044468.0,,,True,t3_139yso,http://www.reddit.com/r/Chefit/comments/139yso/what_are_some_techniques_youve_learned_over_the/,
1332264856.0,21,self.Chefit,r5c60,"Any decent line cooks in NYC need a place to land?
",21,0,4,http://www.reddit.com/r/Chefit/comments/r5c60/any_decent_line_cooks_in_nyc_need_a_place_to_land/,"My restaurant is in dire need of a decent line cook, even a sous chef if you can hack it. Located in Soho/Nolita area right off the bowery J and Spring 6. Its a small kitchen but its a really good environment. Its fun, fast paced, cramped as shit but all and all pretty awesome. PM me is anyone is interested.
",,False,self,t5_2s1da,False,,,True,t3_r5c60,http://www.reddit.com/r/Chefit/comments/r5c60/any_decent_line_cooks_in_nyc_need_a_place_to_land/,
1372039219.0,19,self.Chefit,1gxxyf,Now *this* is a hard-assed inspection...,21,2,8,http://www.reddit.com/r/Chefit/comments/1gxxyf/now_this_is_a_hardassed_inspection/,"Sixteen inspectors from the Health Department, Fire Department, Building Codes and Alcohol Bureau arrive at 10 pm wearing bulletproof vests and armed to inspect a restaurant. WTF?

Anybody ever seen anything like this? After a few decades in the business in three states, this kind of thing is new to me. 

Here's another news report: http://www.tennessean.com/article/20130619/NEWS01/306190152/Family-Wash-owner-accuses-law-enforcement-officials-outrageous-raid ",,False,self,t5_2s1da,False,,,True,t3_1gxxyf,http://www.reddit.com/r/Chefit/comments/1gxxyf/now_this_is_a_hardassed_inspection/,
1366159082.0,18,self.Chefit,1ci07u,Is there such thing as a low stress culinary job?,24,6,65,http://www.reddit.com/r/Chefit/comments/1ci07u/is_there_such_thing_as_a_low_stress_culinary_job/,"I enjoy culinary and want a career in it, but I have a hard time handling the high stress of line work. I've been a line cook for 8 months or so and im tired of being told im too slow even when i try to go as fast as I can. My new chef snapped at me today and told me ""would you hurry up?"". Im not the kind of person that likes getting yelled at (and yes, I know that's part of the job). Is there a branch in the culinary world that isn't so high stress? I dont know what to do anymore...

edit: Thanks everyone for the advice. I have to work again in an hour so lets see how it goes this time. ",,False,self,t5_2s1da,1366223685.0,,,True,t3_1ci07u,http://www.reddit.com/r/Chefit/comments/1ci07u/is_there_such_thing_as_a_low_stress_culinary_job/,
1365536986.0,19,self.Chefit,1c0e1e,Why can't we buy produce directly from farmers? Is there a good reason why I can't knock on a door and ask for something fresh? (Xpost /r/AskReddit),22,3,24,http://www.reddit.com/r/Chefit/comments/1c0e1e/why_cant_we_buy_produce_directly_from_farmers_is/,"(Insert Internet trolling joke about *Deliverence* here)

I'm a cook who's looking to become a chef somewhere down the road, and I'm looking to learn me something. How does the economics of the small farmer work? He/She can only produce so much and a restaurant needs to buy in bulk to satisfy demand.  I understand this concept in theory, but why wouldn't I want to carry local product if I can get my hands on it?  Is there some sort of proprietary relationship with a distributor or something like that?",,False,self,t5_2s1da,False,,,True,t3_1c0e1e,http://www.reddit.com/r/Chefit/comments/1c0e1e/why_cant_we_buy_produce_directly_from_farmers_is/,
1353458926.0,20,self.Chefit,13jgbo,Walkouts,23,3,7,http://www.reddit.com/r/Chefit/comments/13jgbo/walkouts/,"I am taking over a kitchen this week, last time I did this the whole room except the prep cook didn't show up the next day.  Maybe it is because I told them we were going to be busy......It was an interesting few days following.
Anyone else have a horror story of losing half/all/some staff at a bad time?",,False,self,t5_2s1da,False,,,True,t3_13jgbo,http://www.reddit.com/r/Chefit/comments/13jgbo/walkouts/,
1344900583.0,21,self.Chefit,y673r,It's mine.. ALL mine!,22,1,33,http://www.reddit.com/r/Chefit/comments/y673r/its_mine_all_mine/,"After 10+ years in this business... I am opening MY first restaurant. 

Started in the dish pit.  Garde. Fryer. Saute'. Expediter. Waiter. Bus boy.  Bartender. GM.  You name it I have done it.  I have run kitchens, currently one that does $800k+ a year.  Hired. Fired.  Ruined a serious long-term relationship.  You name it.. been there done that, and loved most of it.  

This will be my restaurant.  My menu.  I will sleep on my OWN kitchen's floor for a change.  

So I ask you, and by you I mean you that have been here before, what mistakes did you make/advice would you have given yourself at this point?  What did you miss, thinking you knew everything?  It will be a scratch Italian kitchen.  Simple. Clean. Small menu.   There is a place for it in my market and I know I will do well if I can keep the performance level high. ",,False,self,t5_2s1da,False,,,True,t3_y673r,http://www.reddit.com/r/Chefit/comments/y673r/its_mine_all_mine/,
1338432103.0,20,youtube.com,ud7jo,Whole Cow Processed in under 12 minutes,22,2,2,http://www.reddit.com/r/Chefit/comments/ud7jo/whole_cow_processed_in_under_12_minutes/,,,False,http://a.thumbs.redditmedia.com/JqUFm5Qd3Akim68f.jpg,t5_2s1da,False,,,False,t3_ud7jo,http://www.youtube.com/watch?NR=1&amp;v=1MRuCLXxqjs,
1338399262.0,21,sfgate.com,ucdll,CNN is hiring Anthony Bourdain for weekend show,22,1,8,http://www.reddit.com/r/Chefit/comments/ucdll/cnn_is_hiring_anthony_bourdain_for_weekend_show/,,,False,http://b.thumbs.redditmedia.com/5ab0BxKZD2-ehSFy.jpg,t5_2s1da,False,,,False,t3_ucdll,http://www.sfgate.com/cgi-bin/article.cgi?f=/n/a/2012/05/29/entertainment/e074813D83.DTL&amp;tsp=1,
1329843992.0,21,self.Chefit,pzidj,"I want to help a local burger joint make better fries, but I don't want to be rude. Opinions needed.",22,1,22,http://www.reddit.com/r/Chefit/comments/pzidj/i_want_to_help_a_local_burger_joint_make_better/,"A new mom and pop burger joint popped up a few months ago and they're serving very good stuff; grass fed beef, local produce, etc. I love their food and I want to see them do well in the future, but their french fries are just terrible! They don't par fry them, or even wash the starch off beforehand. 

I have a very good understanding of how to make good french fries, and I was wondering if it would be considered rude of me to show them how to make them right. I talked to one of the cooks and he was all for it, but he said the owner likes them that way (the soggy, fried one time way).

I realize I'm a bit of a fry snob, but that's only because I know they aren't that difficult to make! Any advice on how to approach this would be appreciated. ",,False,self,t5_2s1da,False,,,True,t3_pzidj,http://www.reddit.com/r/Chefit/comments/pzidj/i_want_to_help_a_local_burger_joint_make_better/,
