created_utc,score,domain,id,title,ups,downs,num_comments,permalink,selftext,link_flair_text,over_18,thumbnail,subreddit_id,edited,link_flair_css_class,author_flair_css_class,is_self,name,url,distinguished
1356824830.0,2,self.Chefit,15nar4,"Switching sides, from sweet to savory",2,0,2,http://www.reddit.com/r/Chefit/comments/15nar4/switching_sides_from_sweet_to_savory/,"Hey guys, I'm a successful professional pastry chef, I've dabbled a bit in the savory side, but I'm looking to switch over to full on savory cooking. What do I need to know? I know that it's way more intense.

I'm asking this because I'm applying for a Catering Manager position.  have both the knowledge and leadership to do that position, however I am not sure on menus etc, Overall I wouldn't know what my responsibilities would be. I don't think I would be down in the trench working with them, but I think it would be better if I was.

There's always room to learn, tell me what I should.",,False,self,t5_2s1da,False,,,True,t3_15nar4,http://www.reddit.com/r/Chefit/comments/15nar4/switching_sides_from_sweet_to_savory/,
1355672686.0,2,self.Chefit,14xzls,ACF exam menu,2,0,9,http://www.reddit.com/r/Chefit/comments/14xzls/acf_exam_menu/,"Slight background:

I'm taking my ACF certification exam for Chef De Cuisine in january, this will be the second official one and I have already done 2 unofficial ones at work and plan on doing 2 more before then. 
The menu that I'm using is as follows:

Fish Course:
Paupiettes of Flounder with Mousseline of Shrimp Served with
Venetian Sauce

Consomme Julienne:
Chicken Consomme Garnished with Julienne Leek and Carrot

Chicken Course:
Coq Au Vin Over a Wild Rice blend and Roasted Brussels Sprouts,
Garnished with Chicken Bacon.

Sauce Veloute

Sauce Espagnole

I thought that this will show a lot of technical skill and really highlight the classical french cuisine that they like to see. I do have to use these specific proteins and the courses that are outlined, they were rather specific about what to do, just not how to do it.",,False,self,t5_2s1da,False,,,True,t3_14xzls,http://www.reddit.com/r/Chefit/comments/14xzls/acf_exam_menu/,
1345100343.0,2,nal.usda.gov,yb50u,U.S. Department of Agriculture food yields chart from 1975 - Incredibly in depth. Interesting and useful.,2,0,0,http://www.reddit.com/r/Chefit/comments/yb50u/us_department_of_agriculture_food_yields_chart/,,,False,default,t5_2s1da,False,,,False,t3_yb50u,http://www.nal.usda.gov/fnic/foodcomp/Data/Classics/ah102.pdf,
1344970284.0,2,self.Chefit,y7t1w,Cookbook Writers SubReddit (Xpost from /r/Writing),3,1,3,http://www.reddit.com/r/Chefit/comments/y7t1w/cookbook_writers_subreddit_xpost_from_rwriting/,"I couldn't find any so (for what its worth) thought [I would start one.](http://www.reddit.com/r/CookBookWriters/) If there's an already established community for cookbook writers please point me at it and I'll redirect mine.

Thanks!",,False,self,t5_2s1da,False,,,True,t3_y7t1w,http://www.reddit.com/r/Chefit/comments/y7t1w/cookbook_writers_subreddit_xpost_from_rwriting/,
1343408479.0,1,self.Chefit,x96zq,Question on fillet knives,34,33,12,http://www.reddit.com/r/Chefit/comments/x96zq/question_on_fillet_knives/,"I'm not a professional chef but I've definitely come to appreciate the value of a good knife. Going from a crappy discount knife to an 8 inch Shun Chef's knife was a complete revelation for me and I can't imagine ever going back.

As far as fillet knives go though I really don't know anything about them but after doing some research I discovered that they come in many shapes and sizes, some have curved blades (and handles) some are straight, and some are much longer and thinner than others. Can you guys share what you know about them, what you've tried and what you like best and why? thanks!",,False,self,t5_2s1da,False,,,True,t3_x96zq,http://www.reddit.com/r/Chefit/comments/x96zq/question_on_fillet_knives/,
1341856152.0,0,self.Chefit,wa3mr,"First time cooking duck breast, any tips?",34,34,14,http://www.reddit.com/r/Chefit/comments/wa3mr/first_time_cooking_duck_breast_any_tips/,"I love duck when its well prepared but I've never actually tried cooking it myself and I'm wanna nail it on my first try. I'm going to serve it with an apricot sauce and a wild rice pilaf with chanterelles. I've done my homework though so here's my plan of attack:

* score the fat/skin side then season well with salt &amp; pepper
* start in a cool, dry pan, skin side down and slowly bring up heat to medium to render out all the fat
* once the skin side is nice and crisp/brown, flip and cook another minute to seal the flesh side
* flip back to skin side and cook in preheated 400 degree oven until done

Does that sound right? Any tips or tricks or gotchas I should be aware of?

I guess where I am mainly unsure is on my cooking times. Its a large duck breast (.890 of a lb) so I'm guessing it will take a little longer than usual but what should I be targetting for medium to meidum rare? I figure I can eyeball it pretty well when searing it off but what about when it goes in the oven? Does 10-12 mins in the oven sound right? More? Less? Much thanks for the help r/chefit!",,False,self,t5_2s1da,False,,,True,t3_wa3mr,http://www.reddit.com/r/Chefit/comments/wa3mr/first_time_cooking_duck_breast_any_tips/,
1341757686.0,2,self.Chefit,w7zsm,In dire need of insight about hood and vent systems...,2,0,10,http://www.reddit.com/r/Chefit/comments/w7zsm/in_dire_need_of_insight_about_hood_and_vent/,"Hi. I'm opening my own bakery later this summer, and I have a handle on every part of it with one exception - the hood and vent system. I know that rules differ from state to state (and even municipality to municipality), but I'm kind of stuck right now. I'm going to go look at a used hood later this morning, and it's my understanding that I can get a new fire suppression system to FIT a used hood. Is this true? 

Also - can I get a new make-up air vent installation on a used hood as well?

I know this is a random question. But I would really appreciate any help or advice! Thanks guys!",,False,self,t5_2s1da,False,,,True,t3_w7zsm,http://www.reddit.com/r/Chefit/comments/w7zsm/in_dire_need_of_insight_about_hood_and_vent/,
1340656768.0,3,kitchenbiz.blog.com,vl9y2,The True Spec Series,9,6,1,http://www.reddit.com/r/Chefit/comments/vl9y2/the_true_spec_series/,,,False,default,t5_2s1da,False,,,False,t3_vl9y2,http://kitchenbiz.blog.com/2012/06/25/the-true-spec-series/,
1340604857.0,2,self.Chefit,vk718,Looking for some bulk pork rib ideas.,3,1,9,http://www.reddit.com/r/Chefit/comments/vk718/looking_for_some_bulk_pork_rib_ideas/,"I am lead cook at a bar/grill. Our business is dwindling right now and the store manager wants good ribs to hopefully help get some business back. I've never successfully cooked ribs in my life as a cook. I'm very inexperienced with the idea and need a few pushes into the right direction. 

As far as equipment goes there is no smoker available. I have an oven and range.

What they've been having me do as of now is cook of a dozen full racks at a time. Skin peeled I soak the ribs half rack at a time in some liquid smoke and a few other seasonings. I make a coating of brown sugar and tenderizer and other spices and seasonings, put them in a pan and immerse them in water and cook them at 215 until done. I've got the flavor I want, but not the tenderness.

Any help you can give would be amazing. Thank you in advance for any responses.",,False,self,t5_2s1da,False,,,True,t3_vk718,http://www.reddit.com/r/Chefit/comments/vk718/looking_for_some_bulk_pork_rib_ideas/,
1339950914.0,2,self.Chefit,v6kpv,seeking advice on moving to south america..,3,1,9,http://www.reddit.com/r/Chefit/comments/v6kpv/seeking_advice_on_moving_to_south_america/,"i know a talented-seasoned cia graduate professional who is interested in ex-patriating or emigrating/moving to costa rica or dominican rep or some place similar where there are resorts, etc for work.

any advice/insight is appreciated.",,False,self,t5_2s1da,False,,,True,t3_v6kpv,http://www.reddit.com/r/Chefit/comments/v6kpv/seeking_advice_on_moving_to_south_america/,
1334909480.0,2,self.Chefit,sjcyf,"Inexperienced cook, offered a kitchen to lead. Any tips?",3,1,20,http://www.reddit.com/r/Chefit/comments/sjcyf/inexperienced_cook_offered_a_kitchen_to_lead_any/,"So I just met the owner of a local bar that happened to be looking for a new cook or chef. To be honest I am neither. I've worked a bit in fast food but i dont have any real line experience at all. He immediately seemed interested in getting me onboard to help out and maybe take over. Awesome right? I plan on giving it a try and seeing how i do but im pretty sure i will fall flat on my face.

Im currently halfway through school at a well renowned culinary school (and loving it) which is basically how i was suggested to him by a friend.

It seems like an amazing chance, to try out my skills. If i try an fail, so it goes, but i'd love to kill it and make something of this. I'd love any tips or help possible.

My starting shift is the brunch shift with a menu of a handful of omelettes and eggs, bacon and latkes and thats about it, btw

Please help.",,False,self,t5_2s1da,False,,,True,t3_sjcyf,http://www.reddit.com/r/Chefit/comments/sjcyf/inexperienced_cook_offered_a_kitchen_to_lead_any/,
1330105252.0,2,self.Chefit,q4ak7,Marketing in this brave new online world:,2,0,8,http://www.reddit.com/r/Chefit/comments/q4ak7/marketing_in_this_brave_new_online_world/,"Over the last 4 years, I've seen the effects of poor/minimal marketing in a variety of food jobs. It is all too frustrating to create or rework a good concept and then see it languish because the marketing dept. is a receptionist who occasionally posts some clunky blurb on fb or twitter. I'm working on my biz plan and marketing is definitely a big part of the time (if not $$) budget, really thinking about how I want to sell this place to anyone who doesn't know me and my food personally (this is also important for investors). How many of you out there are facing this, are you bringing this up in interviews, are you owners competing against all the other options? How are you using social media and online presence? Is print media still viable?  
Thoughts, discuss.",,False,self,t5_2s1da,False,,,True,t3_q4ak7,http://www.reddit.com/r/Chefit/comments/q4ak7/marketing_in_this_brave_new_online_world/,
1320070365.0,2,self.Chefit,lv5si,"Private club in Buffalo, NY looking for a head chef",2,0,2,http://www.reddit.com/r/Chefit/comments/lv5si/private_club_in_buffalo_ny_looking_for_a_head_chef/,"First, I hope this kind of post is acceptable here. If not, I'll delete it with apologies...

A private club in Buffalo, known for quality food, is in search of a new head chef.  The position is responsible for quality production and management of the kitchen, compliance, and administration of the culinary department. The Club is seeking an energetic, committed candidate with a track record of creativity and teamwork.

Starting pay is between $48k-$60k depending on experience.  Please send me a message if you or anyone you know has any interest in applying.

Thank you.",,False,self,t5_2s1da,False,,,True,t3_lv5si,http://www.reddit.com/r/Chefit/comments/lv5si/private_club_in_buffalo_ny_looking_for_a_head_chef/,
1310015644.0,2,self.Chefit,iiru4,looking for lobster consomme,3,1,10,http://www.reddit.com/r/Chefit/comments/iiru4/looking_for_lobster_consomme/,Recipe would be greatly appreciated !,,False,self,t5_2s1da,False,,,True,t3_iiru4,http://www.reddit.com/r/Chefit/comments/iiru4/looking_for_lobster_consomme/,
1299053049.0,2,self.Chefit,fvnup,Tell me about the person who gave you your first job in the industry.,2,0,6,http://www.reddit.com/r/Chefit/comments/fvnup/tell_me_about_the_person_who_gave_you_your_first/, ,,False,self,t5_2s1da,False,,,True,t3_fvnup,http://www.reddit.com/r/Chefit/comments/fvnup/tell_me_about_the_person_who_gave_you_your_first/,
1286755707.0,1,self.Chefit,dphff,"DAE HATE truffle oil, but love truffles?",5,4,5,http://www.reddit.com/r/Chefit/comments/dphff/dae_hate_truffle_oil_but_love_truffles/,"I swear every brand of truffle oil completely manages to miss the flavor of truffle and just overwhelms me with a soap like flavor and terrible aroma. However, real, fresh truffles are amazing, and I love to use them whenever I can.

I understand that for cost/efficiency purposes truffle oil makes a lot more sense but I just can't lie to myself and act like it's even close to as good as the real thing is.",,False,self,t5_2s1da,False,,,True,t3_dphff,http://www.reddit.com/r/Chefit/comments/dphff/dae_hate_truffle_oil_but_love_truffles/,
1376345162.0,1,self.Chefit,1k8in7,What exactly does it take to become a French Master Chocolatier?,1,0,1,http://www.reddit.com/r/Chefit/comments/1k8in7/what_exactly_does_it_take_to_become_a_french/,"Asked over at r/culinary and they suggested I ask here. 

What exactly does it take to become a French Master Chocolatier. Is it like Maîtres Cuisiniers de France where they need to have at least 10 years of working experience, etc...

Thanks in advance.",,False,self,t5_2s1da,False,,,True,t3_1k8in7,http://www.reddit.com/r/Chefit/comments/1k8in7/what_exactly_does_it_take_to_become_a_french/,
1375500983.0,1,self.Chefit,1jlwka,"/r/ChefIt, does anyone know why Michelin Stars are not in Canada?",1,0,6,http://www.reddit.com/r/Chefit/comments/1jlwka/rchefit_does_anyone_know_why_michelin_stars_are/,,,False,self,t5_2s1da,False,,,True,t3_1jlwka,http://www.reddit.com/r/Chefit/comments/1jlwka/rchefit_does_anyone_know_why_michelin_stars_are/,
1375204658.0,1,self.Chefit,1jcyyk,Need some help when it comes to applying for jobs,1,0,4,http://www.reddit.com/r/Chefit/comments/1jcyyk/need_some_help_when_it_comes_to_applying_for_jobs/,"First a little background. I was in the Navy and spent 2 years on a cruiser preparing and serving 4 meals a day to 250 people. I wasn't officially a cook but I did the necessary training while I was working there to do more than just serve meals and take out the trash. I started culinary school about a month ago and I'm currently in the process of getting my Servsafe food safety manager certification. I take the test in about a month. 

So I'm wondering what kind of jobs I can start applying for. Honestly I get a little freaked out when I see ads for prep cooks asking for 2+ years experience. How should I present myself when I apply?",,False,self,t5_2s1da,False,,,True,t3_1jcyyk,http://www.reddit.com/r/Chefit/comments/1jcyyk/need_some_help_when_it_comes_to_applying_for_jobs/,
1375034363.0,1,self.Chefit,1j84fh,Desperately wanting some advice/anything relating to improving as a novice line cook.,1,0,10,http://www.reddit.com/r/Chefit/comments/1j84fh/desperately_wanting_some_adviceanything_relating/,"A little history first, I've worked in a fish and chip for 9 months, attended William Angliss cookery school for a while, had to postpone due to health, (Anxiety disorder) and family issues, had some little in-between jobs which aren't worth mentioning before working at TGI Fridays in Melbourne, Australia.

The problem I'm always having, I get overwhelmed, lose focus don't end up prioritizing properly and then my communication skills drop because I get overwhelmed. A persistent problem no matter where I've worked, I'm trying REALLY hard too overcome these issues, but i feel like that I wont be able to perform at the level needed in time to keep my job.

I'm about 1.5 months into my current job and I'm having the same problems, I've got lots of feedback, they're happy with my attitude about wanting to improve and learn so they've been lenient with me. But by now I should be a lot closer to performing like my co-workers but I just don't, it's incredibly frustrating and I feel horrible about it because others have to work harder to compensate for me when I do get overwhelmed.

I have 14 more days to improve on my station, broiler at plating (yes... not even cooking, JUST plating.)

Any advice/tips and QUESTIONS are very much welcome, I need to get some sleep now but when I wake up I'll respond to any and all questions.",,False,self,t5_2s1da,1375034910.0,,,True,t3_1j84fh,http://www.reddit.com/r/Chefit/comments/1j84fh/desperately_wanting_some_adviceanything_relating/,
1374248172.0,1,self.Chefit,1imx0v,Question concerning storage of flammable materials.,1,0,2,http://www.reddit.com/r/Chefit/comments/1imx0v/question_concerning_storage_of_flammable_materials/,"I've recently been offered the head chef position at my country club's west course location. The club is in a bad way as a result of years of substandard practices and general ""not give a fuckery."" 

Organization is seriously lacking and I've recently come across the fact that they're storing charcoal and lighter fluid in the kitchen. It's a small issue among the larger glaring issues I'm currently facing. I'm looking for a little help figuring out where and how I'm supposed to store charcoal and lighter fluid..

It's for a turn grill outside, but it's in my kitchen and I wan to store it properly.. we don't have a flammables cabinet or storage locker.",,False,self,t5_2s1da,False,,,True,t3_1imx0v,http://www.reddit.com/r/Chefit/comments/1imx0v/question_concerning_storage_of_flammable_materials/,
1374198726.0,1,youtube.com,1ilqlw,Trailer for an oldish but good movie for those interested in food history and the history of cooks working in European noble households.,5,4,1,http://www.reddit.com/r/Chefit/comments/1ilqlw/trailer_for_an_oldish_but_good_movie_for_those/,,,False,http://b.thumbs.redditmedia.com/AT58kZeazgaCrT6s.jpg,t5_2s1da,False,,,False,t3_1ilqlw,https://www.youtube.com/watch?v=RGIp_NZX00c,
1374180393.0,1,self.Chefit,1il2ld,"Resource to learn more about emulsifiers, etc.",1,0,4,http://www.reddit.com/r/Chefit/comments/1il2ld/resource_to_learn_more_about_emulsifiers_etc/,"I'd like to learn more about using xanthine gum, guar gum, agar agar, etc... 
Rather than blindly following recipes, I'd like to be able to use them in recipes of own. Are there any resources you could recommend? ",,False,self,t5_2s1da,False,,,True,t3_1il2ld,http://www.reddit.com/r/Chefit/comments/1il2ld/resource_to_learn_more_about_emulsifiers_etc/,
1373934215.0,1,self.Chefit,1idm52,"Aside from the obvious job boards, whats the best way to get the word out to like, good/great people that you are hiring? Specifically in Vancouver is the bonus question.",1,0,1,http://www.reddit.com/r/Chefit/comments/1idm52/aside_from_the_obvious_job_boards_whats_the_best/,"Its the middle of summer so everywhere is busy and all the best people are making good money because the hours are there and the tip share is flowing. 

I'm opening up in about 2 months and I am looking to start sous chefs sooner than later and i have pretty good money to spend on them. I'm not super eager to clean out any of my old employers as most of the chefs/gms are friends of mine. 

I've obviously posted on craigslist and kijiji and reached out to the people I know in the industry and even some of the culinary schools. Does anyone have any tricks or insights? ",,False,self,t5_2s1da,False,,,True,t3_1idm52,http://www.reddit.com/r/Chefit/comments/1idm52/aside_from_the_obvious_job_boards_whats_the_best/,
1373354396.0,3,self.Chefit,1hx7h2,Kitchens are like pirate ships,11,8,12,http://www.reddit.com/r/Chefit/comments/1hx7h2/kitchens_are_like_pirate_ships/,"Sometimes there is mutiny,

sometimes there is betrayal,

the new guy usually has a ""hazing"" period,

there is no mercy,

there is a captain and a first mate,

there are the slackers and the suck ups,

and ones who have just been around far too long,

but most of all,

everyone has to work together to make it through the storm,

whether they get along or not.

And the swearing. Lots of swearing too.",,False,self,t5_2s1da,False,,,True,t3_1hx7h2,http://www.reddit.com/r/Chefit/comments/1hx7h2/kitchens_are_like_pirate_ships/,
1372823633.0,1,self.Chefit,1hjnle,Need some input on an idea.,3,2,16,http://www.reddit.com/r/Chefit/comments/1hjnle/need_some_input_on_an_idea/,"Hey so doing a veggie tasting menu for the new gf. I'm doing a chilled tomato consommé for the starter, I want to do some molecular gastronomy. Any ideas?

",,False,self,t5_2s1da,False,,,True,t3_1hjnle,http://www.reddit.com/r/Chefit/comments/1hjnle/need_some_input_on_an_idea/,
1372797553.0,1,self.Chefit,1hirqx,Restaurant ranking Toronto,3,2,6,http://www.reddit.com/r/Chefit/comments/1hirqx/restaurant_ranking_toronto/,So I know there are no Michilin star restaurants in Toronto but where would I go to find some sort of ranking system to help me identify the top quality chefs and restaurants in the Toronto area?,,False,self,t5_2s1da,False,,,True,t3_1hirqx,http://www.reddit.com/r/Chefit/comments/1hirqx/restaurant_ranking_toronto/,
1371132518.0,1,self.Chefit,1g9nnb,Making Your Own Recipes - Where Do You Even Begin?,10,9,19,http://www.reddit.com/r/Chefit/comments/1g9nnb/making_your_own_recipes_where_do_you_even_begin/,As the title asks. I'm a self-taught cook that has been cooking for 5 years and wants to make cooking a career in the future. After I finish up college and go to culinary school I wanna open up my own restaurant but to do that I need my own recipes. Where do I start? How do I go about it? Should I just use a base recipe and modify it?,,False,self,t5_2s1da,False,,,True,t3_1g9nnb,http://www.reddit.com/r/Chefit/comments/1g9nnb/making_your_own_recipes_where_do_you_even_begin/,
1370952775.0,1,self.Chefit,1g46la,Ploughmans plate with no beer.,3,2,6,http://www.reddit.com/r/Chefit/comments/1g46la/ploughmans_plate_with_no_beer/,"So, there is a lot of popularity with cheese and charcuterie in the market I work in, and me and my boss have been discussing a ploughmans plate to go on our summer menu. I was wondering if we should as the more I research the idea, it seems like it would be wrong to expect people to eat meat and cheese and not be able to pair it with beer. Would it work, despite the fact that we are a breakfast/lunch restaurant, the idea certainly fits the food concept we have going, but just wondering what the popular opinion in here is, thanks 

TL;DR: would a ploughmans plate work at a breakfast/lunch cafe that cannot serve beer? Or would it flop?",,False,self,t5_2s1da,1370957666.0,,,True,t3_1g46la,http://www.reddit.com/r/Chefit/comments/1g46la/ploughmans_plate_with_no_beer/,
1369339399.0,1,imgur.com,1exad5,"Starting a new job tomorrow, spent the last little while getting my whites spotless, and my gear in top shape... Here's my gear",1,0,0,http://www.reddit.com/r/Chefit/comments/1exad5/starting_a_new_job_tomorrow_spent_the_last_little/,,,False,http://a.thumbs.redditmedia.com/xtt_FYNWRnUKpPkx.jpg,t5_2s1da,False,,,False,t3_1exad5,http://imgur.com/rple5z5,
1366216854.0,1,self.Chefit,1cjik5,Online ordering for gourmet general store,1,0,0,http://www.reddit.com/r/Chefit/comments/1cjik5/online_ordering_for_gourmet_general_store/,"I'm a chef who will be moving into a general manager position for a gourmet general store selling local products, prepared foods and sandwiches. It's in a very wealthy rural town outside of Philly. One idea I have is starting an online ordering system. Does anyone have any experience with this type of software? What are your opinions, likes, dislikes and overall impressions. Any thoughts would be appreciated.",,False,self,t5_2s1da,False,,,True,t3_1cjik5,http://www.reddit.com/r/Chefit/comments/1cjik5/online_ordering_for_gourmet_general_store/,
1365182768.0,1,self.Chefit,1bqtux,Advice for catering a 50 person party solo?,1,0,3,http://www.reddit.com/r/Chefit/comments/1bqtux/advice_for_catering_a_50_person_party_solo/,"Hello Chefs, I am catering a a wedding party of 50 in June. The menu is posted [here](https://sites.google.com/site/ericandmikeswedding/menu), PLEASE IGNORE THE TYPOS. I am changing the roast pork to good sausage since it would not make sense to serve it here. What I am trying to ask is, what are some good pro tips.? I have 5 years of professional kitchen experience + large catered events. I have never done one solo, so please just give me some good prep/execution advice.",,False,self,t5_2s1da,False,,,True,t3_1bqtux,http://www.reddit.com/r/Chefit/comments/1bqtux/advice_for_catering_a_50_person_party_solo/,
1364802457.0,1,self.Chefit,1bet7h,Chefs of Reddit - Was culinary school worth?,2,1,8,http://www.reddit.com/r/Chefit/comments/1bet7h/chefs_of_reddit_was_culinary_school_worth/,I am looking at two year culinary schools and they are expensive (for anything I consider decent).  Was it worth the expense or would working during those to years glean similar results?,,False,self,t5_2s1da,False,,,True,t3_1bet7h,http://www.reddit.com/r/Chefit/comments/1bet7h/chefs_of_reddit_was_culinary_school_worth/,
1363964584.0,1,self.Chefit,1asv8z,Looking to open an ice cream/gelato shop. Looking for advice.,1,0,3,http://www.reddit.com/r/Chefit/comments/1asv8z/looking_to_open_an_ice_creamgelato_shop_looking/,"Had no luck at r/icecreamery and someone on r/askculinary suggested I try here.

I'm located in South East Asia. Batch freezers in the US are pretty expensive and we are looking to cut costs down to see demand before we invest in higher end machinery like Bravo, Carpigiani and such. Does anyone here have any familiarity or recommendations with batch freezers from China? Any suggestions would be welcome as well.",,False,self,t5_2s1da,False,,,True,t3_1asv8z,http://www.reddit.com/r/Chefit/comments/1asv8z/looking_to_open_an_ice_creamgelato_shop_looking/,
