created_utc,score,domain,id,title,ups,downs,num_comments,permalink,selftext,link_flair_text,over_18,thumbnail,subreddit_id,edited,link_flair_css_class,author_flair_css_class,is_self,name,url,distinguished
1368390864.0,4,self.Chefit,1e79mu,Need some advice that I couldn't really find on the FAQ section.,6,2,8,http://www.reddit.com/r/Chefit/comments/1e79mu/need_some_advice_that_i_couldnt_really_find_on/,"My dream is life is to become a chef and open my own restaurant. That may probably be a really cliche thing to say, but I really want that. I spent all of my time in high school planning to follow that dream, until my senior year when I foolishly convinced myself that it wasn't worth it and that I needed to get a degree to use for a 'real' job. Now, I'm a few years out from high school and I think I've decided that I want to chase that dream again.

I'm currently attending Georgia State University and plan on switching my major to a business degree to give myself some background and a safety net to fall back on in case things don't go as planned. After that's done, I would then plan on putting myself through culinary school. If opening my own restaurant isn't in the cards, I'd love to just work in the business in an everyday setting, using my degree.

My question is, is this the right path to achieve my goal? Getting a business degree and then putting myself through culinary school? I just got a job serving at a pretty high end restaurant that is about to open up here in Atlanta, and I hope that that can help me make connections in the industry.

If getting a degree at GSU is a waste of time, I'd like to know as soon as I can. Also, if you guys have any tips for me right now, I'd absolutely love to hear it.

Thanks, everyone!",,False,self,t5_2s1da,False,,,True,t3_1e79mu,http://www.reddit.com/r/Chefit/comments/1e79mu/need_some_advice_that_i_couldnt_really_find_on/,
1367328797.0,4,self.Chefit,1deqli,Website for Restaurant,6,2,8,http://www.reddit.com/r/Chefit/comments/1deqli/website_for_restaurant/,"So the place I work now has a website that just looks like trash, is never updated, and needs to be completely fixed. I want to set up a template for a new site and show my boss how much better it could look, but I want to do it on the free side. I have a feeling that is why it looks like shit though, because it is done on a free blog site. I want to make a tumblr blog for our cafe as well, in addition to making the website look better. Any tips? Does anyone have experience with good host sites or would we be better off hiring a web designer to make a page for us? ",,False,self,t5_2s1da,False,,,True,t3_1deqli,http://www.reddit.com/r/Chefit/comments/1deqli/website_for_restaurant/,
1366172686.0,5,self.Chefit,1cihr7,What do you guys think of Geroge Brown College's Culinary program as a culinary school? (cross post from r/culinary),7,2,17,http://www.reddit.com/r/Chefit/comments/1cihr7/what_do_you_guys_think_of_geroge_brown_colleges/,"Hi guys. I'm currently in my first year of university and realized that I have a passion for food. I know this probably sounds cliche to a lot of you, but it is something that I am incredibly serious about pursuing. From my understanding it pays to go to a highly regarded culinary school, as it is beneficial if you want to get your foot in the door of fine dining restaurants or even have the potential of obtaining a position in one later in your career. So my question to you guys is, what do you think about George Brown? Have any of you in America or internationally heard of it? Is it even recognized on the international culinary stage?

The reason I ask this is because I do not have 150k to drop on the CIA and I understand that a school's reputation does not determine your skill level after graduation. I understand that you get what you put into the program. My concern lies with spending money (that I don't have) and wasting time on a program that after graduation will equate me to someone who has no culinary certification. 

I know you guys work super long hours and are incredibly busy, so just in advance, I am grateful for any responses :)",,False,self,t5_2s1da,False,,,True,t3_1cihr7,http://www.reddit.com/r/Chefit/comments/1cihr7/what_do_you_guys_think_of_geroge_brown_colleges/,
1365371342.0,5,self.Chefit,1bvk02,Resume - Help to make it more concise? 1page+ a problem?,8,3,3,http://www.reddit.com/r/Chefit/comments/1bvk02/resume_help_to_make_it_more_concise_1page_a/,"Michael Bolding

Relevant Skills:

Extensive knowledge of recipes. Proficiency on every standard kitchen station. 
Handmade pasta experience. Pizza oven experience. Strong knife skills. Banquet
 experience up to 600. Proven kitchen leadership in both low and high volume situations. Serve Safe certified.


Work Experience:

Tom’s Pizza – Grill Cook, Pizza Cook

    Typical Family Pizza/Sandwich shop, flipped burgers and grilled sandwiches. 
Also ran fryolators, cooking wings, fries, etc.. About 2-300 covers at lunch, 
same at dinner. Supervisor: Lana Pietra  (phone number here)

May 2008 – August 2009                        DeLand, FL

Cress Restaurant – Dish Washer, Prep Cook, Line Cook

    Small, upscale restaurant specializing in global cuisine. Cooked seventy covers 
on an average night and at lunch about fifty. Supervisor:  Chef Hari Pulapaka 
(phone number here)

August 2008 – January 2009                  DeLand, FL

TEP Fraternity – Chef

    Small scale banquet style cooking, i prepared and served twenty two portions
 of a protein, two vegetables, a starch, and a dessert five nights weekly, as well 
as preparing food for various fraternity functions.

Supervisor: TEP President Anthony Willingham: (phone number here)

November 2009 – November 2010                    Boston, MA

Ten Tables - Pantry Cook, Prep Cook

As a prep cook I made ice creams, cakes, semi-freito, panna cotta, pastas,
 ricotta cheese, and others, all from scratch.. In the pantry I assembled 
charcuterie and cheese boards, made all the salads and cold appetizers, various 
entree components, and also plated all the deserts 
Supervisor: Chef Sean Callahan: (phone number here)

June 2010 - December 2010        Jamaica Plains, MA

Tomasita’s Cuban Bistro - Sous Chef

    Ran kitchen in Chef’s absence. I was responsible for overseeing two to three 
kitchen staff members, producing high quality bistro cuisine at an affordable 
price. We cooked anywhere from 60 to 190 covers each night. I created nightly 
prep lists, butchered meats, and finished various other preparations left from day 
shift’s tasks. I also wrote many daily specials and cooked Sautee’ and Grill, while 
expediting. Supervisor:  
Chef Michael Alvarez: No contact info available for Mike. Co-worker Nicole Perry can provide a reference: (phone number here)

December 2010 - July 2011                             Deland, FL

Pittmaster’s Barbecue - Rounds Cook

    Due to the unique nature of the Pittmaster’s kitchen, no set positions were 
worked. I moved from station to station working wherever needed. I worked 
sautee, grill, fryers, and the meat room. Prepped various southern sides. It was 
generally agreed upon that I fried the best shrimp in the house. 
Kitchen Manager: Mike Brown: (phone number here)

August 2011 - December 2011 Deleon Springs, FL

Pisgah Inn – Night Sous Chef (2012), Line Cook, Kitchen Side Expediter (2009)

Supervised a kitchen staff of up to 8 cooks and dishwashers. I prepared a nightly 
prep list, delegated tasks, and assisted the chef in developing specials. During 
service, i ran the wheel, finished plates, and cooked any station as necessary. 
Supervisor: Chef Ian Dropka: (phone number here)

March - November 2012, August – November 2009            Mt. Pisgah, Blue Ridge Mountains, NC

Big Sky Resort - Resort Roundsman, Cook I Convention Kitchen

          At Big Sky my primary location was in the Convention Kitchen, working 
with a large team to create excellent and varied buffets, plated dinners, and 
family style banquets. We regularly execute multiple 100-600 person banquets in 
a day. In addition to this work, I have filled in all 7 restaurants on the resort 
campus; doing everything from an omelet and egg station for 300+ solo, to hand 
tossed pizzas, to high volume sautee’ work, sometimes with just an hour’s 
training to get up to speed.  
Supervisor: Chef Tyler Sloan (phone number here)

January -  April 2013                                              Big Sky, Montana


edit: Definitely some formatting errors when posted to reddit, but hopefully that can be overlooked. I'm thinking that my best bet would probably be to condense a lot of job specific information into the skills area, but I feel it would lose a bit of specificity and informativeness. I would like to just go over 1 page, but I've heard that 1 page resumes are more appropriate.

Any help you guys can give me would be much appreciated.",,False,self,t5_2s1da,1365375971.0,,,True,t3_1bvk02,http://www.reddit.com/r/Chefit/comments/1bvk02/resume_help_to_make_it_more_concise_1page_a/,
1363966147.0,4,self.Chefit,1asx2b,Hey Chefs. I'm in the market for a new knife. What do you like?,9,5,12,http://www.reddit.com/r/Chefit/comments/1asx2b/hey_chefs_im_in_the_market_for_a_new_knife_what/,"I own a 8"" wustof right now, but someone, i don't know who, bent the tip on it at my last job. I really like the shape of the blade. I want to go a little longer and wider (that's what she said.) I'm thinking 10"" long 2.5"" wide. I'm also looking at damascus blades. What do you use and have you seen anything like this?",,False,self,t5_2s1da,False,,,True,t3_1asx2b,http://www.reddit.com/r/Chefit/comments/1asx2b/hey_chefs_im_in_the_market_for_a_new_knife_what/,
1361826987.0,4,self.Chefit,197q4d,Need help finding a piece of equipment.,7,3,6,http://www.reddit.com/r/Chefit/comments/197q4d/need_help_finding_a_piece_of_equipment/,"I'm trying to find a rack/shelving that can fit on a shelf in my cooler that has slots that fit sheet trays. They aren't that big, I think the ones I've seen at previous restaurants could fit like 6 or so trays. Ive talked to my purveyors (sysco etc) and been searching online but I'm coming up empty.",,False,self,t5_2s1da,False,,,True,t3_197q4d,http://www.reddit.com/r/Chefit/comments/197q4d/need_help_finding_a_piece_of_equipment/,
1361500655.0,4,self.Chefit,18zvza,How do you guys balance work and home life? And find time to cook dinner?,6,2,39,http://www.reddit.com/r/Chefit/comments/18zvza/how_do_you_guys_balance_work_and_home_life_and/,"Well, within reason. I get off work at three and take the bus home, which takes two hours. My SO is used to me cooking for her, and I'm just too tired to start on a meal at the end of the day. She's getting really frustrated that I can't. This week I made a shit ton of soups and froze them for us but that'll get boring fast. ",,False,self,t5_2s1da,False,,,True,t3_18zvza,http://www.reddit.com/r/Chefit/comments/18zvza/how_do_you_guys_balance_work_and_home_life_and/,
1361372500.0,5,self.Chefit,18vzd3,NC Chefs; Who does your sharpening?,7,2,11,http://www.reddit.com/r/Chefit/comments/18vzd3/nc_chefs_who_does_your_sharpening/,"I am looking for a new sharpening service for my restaurant, due to the retirement of my previous sharpener. If you don't do your sharpening in house, what sharpening service do you use and recommend in North Carolina? Bonus for mobile services that will come to the restaurant to do the sharpening!",,False,self,t5_2s1da,False,,,True,t3_18vzd3,http://www.reddit.com/r/Chefit/comments/18vzd3/nc_chefs_who_does_your_sharpening/,
1359688484.0,5,self.Chefit,17o8lb,Pretty sure this question has been asked a million times but here goes...,9,4,26,http://www.reddit.com/r/Chefit/comments/17o8lb/pretty_sure_this_question_has_been_asked_a/,"So i apologize ahead of time for asking this but i need some advice.

I live in Northern NJ and NY is literally 10 minutes away and i was wondering if anyone had any experience with cooking schools in this area and what a complete novice like me can expect? 

Should I learn something or read or practice something before even applying? 

Do most culinary schools take into consideration S.A.T scores or do they not care about any of that?

I'm 24 and i have absolutely no experience in the food industry and have never gone to any school after high school. I wanna pursue a career of cooking because its something i was always interested in doing and i like cooking at home (which is apparently worthless as soon as i get into school).


So chefit, help me out?

",,False,self,t5_2s1da,False,,,True,t3_17o8lb,http://www.reddit.com/r/Chefit/comments/17o8lb/pretty_sure_this_question_has_been_asked_a/,
1359429226.0,6,self.Chefit,17h1sh,Where do I get my career of the ground?,11,5,23,http://www.reddit.com/r/Chefit/comments/17h1sh/where_do_i_get_my_career_of_the_ground/,"So without too much back story, I've been a line cook a couple years, I'm 24, and love cooking. I dropped out of University to pursue a professional career. I read the disclaimer regarding cooking school, so I guess I won't ask that. I do want to know tips on where to start learning first-hand any and all knowledge associated with the field. My current position has given me great chops on the line, but it isn't what I would call fine dining. I want to cook quality food at a quality establishment under quality tutelage. Aside from spraying my resume anywhere close to where I live(NH), where do I begin?",,False,self,t5_2s1da,False,,,True,t3_17h1sh,http://www.reddit.com/r/Chefit/comments/17h1sh/where_do_i_get_my_career_of_the_ground/,
1357945620.0,6,self.Chefit,16en8y,ISO Professional Bread Maker's Opinions,8,2,9,http://www.reddit.com/r/Chefit/comments/16en8y/iso_professional_bread_makers_opinions/,"I am currently in the planning stages of designing a commercial kitchen for a culinary incubator.  They want provide a baking kitchen.  In a perfect world what kind of ovens do you want?  Brands, styles, types, etc.  Any info is helpful.  What other equipment is absolutely necessary?",,False,self,t5_2s1da,False,,,True,t3_16en8y,http://www.reddit.com/r/Chefit/comments/16en8y/iso_professional_bread_makers_opinions/,
1357576418.0,5,self.Chefit,164j8n,NYC,8,3,15,http://www.reddit.com/r/Chefit/comments/164j8n/nyc/,"I posted a thread a while back about the opening of my first restaurant, and well, as these things often do, that has fallen through.  My backer's wife has decided to divorce him and is claiming abuse so he has to lock down and can't pursue anything until this is over.  His lawyer is thinking 2 years.  This is going to be messy.  

On the bright side, I finish my undergraduate degree in May, finally, and for the first time in about a decade I will have nothing tying me down except my dog.  I am thinking about moving to New York, and letting my parent's babysit my dog for a year or so. 

So my questions: to any chefs currently living or who have lived and worked in New York, what kind of jobs are usually available?  What's the pay like?  How does that translate to where I would be able to find a place to live?  Any tips, suggestions, encouragement, discouragement, anything....

Background info:  I've never worked in a ""starred"" kitchen, which is one reason I would like to move to NYC.  I have a good resume, but no formal/school training.  I'm shooting for a middle of the road kitchen.  I'll apply to the top places but I need to make money as well so taking an intern type position isn't for me.",,False,self,t5_2s1da,False,,,True,t3_164j8n,http://www.reddit.com/r/Chefit/comments/164j8n/nyc/,
1356657112.0,5,self.Chefit,15jqug,Advice sought for starting in this business,7,2,10,http://www.reddit.com/r/Chefit/comments/15jqug/advice_sought_for_starting_in_this_business/,"Hey Chefit

So, I'm looking for advice on my situation on whether or not to pursue a career in food. I've loved cooking since I was 6 or 7, and I'm 33 now. I have not really done much in the way of anything professionally, floating from this job to that job and not really excited about any of it. A couple years ago, I did fry cook, and sous at a upscale grocery store deli, which by no accounts is as high pressure as what some of you guys go through. I got promoted to Cheesemonger after awhile there. Both positions were very fun for me, the former being a lot harder work than the latter, but much more satisfying. 

Being 33 though, I was told by one or two people that starting out being older than your average person starting I'm not going to make it and that I shouldn't try at all. 

Honestly though, nothing excites me like food does. It's something I can see myself doing in 5 years (and further out of course), no other industry has that sort of appeal to me.

I'd like to go down the route that eventually leads to executive chef, and I am willing to start at the bottom of ladder. However, due to my age, should I just bag this plan entirely? If not, what sort of things should I be careful to avoid or work harder at than the younger people in the business? Should I go really bottom of the ladder and seek dishwasher positions or would you recommend another position?",,False,self,t5_2s1da,1356674591.0,,,True,t3_15jqug,http://www.reddit.com/r/Chefit/comments/15jqug/advice_sought_for_starting_in_this_business/,
1355453969.0,4,self.Chefit,14tmn0,Developing a chocolate menu,6,2,18,http://www.reddit.com/r/Chefit/comments/14tmn0/developing_a_chocolate_menu/,"I'm working on a chocolate menu, and I'm having a hard time coming up with another dish to fill a spot.

Update:
The menu has been finalized, please let me know what your thoughts are on it. I've also split the menu into two parts; one dark chocolate based and the other white chocolate.

**Dark Menu**

* Amuse-bouche: Cocoa nibs, raspberry, chorizo, parsley, and queso fresco with chocolate-chile sauce

* Roasted beets, caramel glazed pistachios, bittersweet chocolate, arabella cheese, grapefruit segments, and mixed greens with mustard-sherry vinaigrette

* Chipotle, dark chocolate soup with bacon

* Chocolate pappardelle with duck ragu topped with chocolate shavings and aged balsamic vinegar

* Coffee, chile, and cocoa rubbed flank steak with kale and parsnips

* Layered chocolate cake

**Light Menu** 

* Amuse-bouche: White chocolate and caviar

* Chorizo, lime, cilantro, white chocolate truffle, cashews, and pea tendrils on flat bread

* Hazelnut, charred orange segments, cocoa nibs and mixed greens with chili-orange vinaigrette and tarragon, white chocolate, ricotta cheeseballs. 

* White chocolate and saffron risotto with seared scallops and macadamia nuts  

* Lemon and thyme fried chicken with waffles and a pink peppercorn, white chocolate sauce

* Orange flavored, white chocolate brownie with pistachio gelato and juniper berry caramel.  ",,False,self,t5_2s1da,1356559139.0,,,True,t3_14tmn0,http://www.reddit.com/r/Chefit/comments/14tmn0/developing_a_chocolate_menu/,
1353503551.0,3,self.Chefit,13kbn0,Community college culinary technology degree?,6,3,4,http://www.reddit.com/r/Chefit/comments/13kbn0/community_college_culinary_technology_degree/,"I have experience, but some jobs want a culinary degree. My local CC is not ACF accredited but does that matter? I obviously do not want to blow 50k on culinary school but I would like the paper as well as honing my basic techniques. Could the CC route work?",,False,self,t5_2s1da,False,,,True,t3_13kbn0,http://www.reddit.com/r/Chefit/comments/13kbn0/community_college_culinary_technology_degree/,
1353089334.0,5,self.Chefit,13b536,Can you take your knives on a plane?,8,3,17,http://www.reddit.com/r/Chefit/comments/13b536/can_you_take_your_knives_on_a_plane/,I'm moving cross country and I obviously want to take my knives with me. I obviously can't bring them in my carry on so can I put them with my other bags or do I have to have them shipped to me?,,False,self,t5_2s1da,False,,,True,t3_13b536,http://www.reddit.com/r/Chefit/comments/13b536/can_you_take_your_knives_on_a_plane/,
1353042322.0,4,self.Chefit,13a8ux,Chefs with allergies,6,2,18,http://www.reddit.com/r/Chefit/comments/13a8ux/chefs_with_allergies/,"Any chefs here with food allergies? I want to make a more serious move into culinary arts but I can't help but think that my success will be difficult due to a lifelong moderate-severe dairy allergy.

I can't imagine trying to create something I can't eat and serving it to someone and not knowing exactly how it tastes, asking them to just trust me. 

Is anyone here a chef or know of a chef with an food allergy to an allergen as common as milk? Would I be wasting my time? Can I still find success?",,False,self,t5_2s1da,1353046912.0,,,True,t3_13a8ux,http://www.reddit.com/r/Chefit/comments/13a8ux/chefs_with_allergies/,
1352076144.0,5,self.Chefit,12n1uk,Anyone know of any better way of making spaetzle?,7,2,11,http://www.reddit.com/r/Chefit/comments/12n1uk/anyone_know_of_any_better_way_of_making_spaetzle/,"Besides smashing through a perforated pan, anyone know of an easier/better way?",,False,self,t5_2s1da,False,,,True,t3_12n1uk,http://www.reddit.com/r/Chefit/comments/12n1uk/anyone_know_of_any_better_way_of_making_spaetzle/,
1350612313.0,5,soupstock.ca,11q4gw,SoupStock Toronto is this Sunday! (x/post from /r/Toronto),5,0,0,http://www.reddit.com/r/Chefit/comments/11q4gw/soupstock_toronto_is_this_sunday_xpost_from/,,,False,http://b.thumbs.redditmedia.com/kOWMZZx1WiQoZUBa.jpg,t5_2s1da,False,,,False,t3_11q4gw,http://www.soupstock.ca/,
1347364509.0,5,self.Chefit,zpczq,Ordering stuff for a culinary arts classroom,5,0,11,http://www.reddit.com/r/Chefit/comments/zpczq/ordering_stuff_for_a_culinary_arts_classroom/,I just started teaching culinary arts in Pittsburgh City Schools and have been told that I can order new small wares for my classroom which is awesome.  However I am at loss a to where I should order from.  I put together a basic order on Huberts website but haven't submitted it being it was upwards of 2k.  Where else can i look for deals and bargains?,,False,self,t5_2s1da,False,,,True,t3_zpczq,http://www.reddit.com/r/Chefit/comments/zpczq/ordering_stuff_for_a_culinary_arts_classroom/,
1345231624.0,4,self.Chefit,ye4ft,Tell me I'm not crazy...,5,1,12,http://www.reddit.com/r/Chefit/comments/ye4ft/tell_me_im_not_crazy/,"Just started a new job working at this breakfast/lunch joint. Brand new everything. Owner has zero experience operating a restaurant and has zero experience with kitchen work. I'm the weekend cook, and we have a pretty good ""chef"" for the weekdays. She controls most of what goes on as she is there most of the time. She does orders and most of the other chefly duties.

I am alone on my shift and it runs from 6am to 4pm. We open at 7 which means I have 1 hour to prep anything I need for the day. Last weekend was probably one of the worst days in my 8 year career. I managed to barely get through Saturday but Sunday was horrible. Service started at 7:30am and didn't stop until 3PM. I've never done a 7 1/2 rush. This was partly due to how slow the food was going out (Due to me only having two hands) and never really being able to catch up.

Around 2pm my prep was gone. I went through 20lbs of potatoes, half a box of bacon and I had to 86 anything with chicken. Lunch began at 11 and I had run out of thawed patties (We do scratch patties) and I was pulling from frozen for most of my items. My mise was completely drained and I had zero time to replenish any of my sauces. At this point I'm quite frazzled and I am losing my grip on any sanity. I tell the owner I need help and calls in the weekday cook. Well, there's really nothing that she could help with besides thaw the patties and prep some minor items (like romaine, slice tomatoes, ranch, etc). She takes over and I go outside for a much needed break. 

The whole attitude changes when I get back, as we were entering the tail end of the service. Nobody would really talk to me partly because I had almost completely shut down at that point. I've never run into this problem and on the surface it appears that it is possible to do with one cook, but I was just unable to. The weekday cook likely puts up with much less as we have a huge amount of traffic during the weekend.

I want to know if this load is acceptable and if I should be able to be prepared and able to complete these services. I am losing my confidence and feel very nervous going back into the fire tomorrow. I don't know how I should prepare. I've always had linemates with me during my career and I feel that it is a necessity that one be provided. Does anybody here have some advice on how I should approach this? Am I just not good enough? Because that's how I feel. I also feel like the weekday chef doesn't understand the volume I am going through. I am a third year apprentice with substantial line experience and this had made me question my abilities. Any insight would be great.",,False,self,t5_2s1da,False,,,True,t3_ye4ft,http://www.reddit.com/r/Chefit/comments/ye4ft/tell_me_im_not_crazy/,
