created_utc,score,domain,id,title,ups,downs,num_comments,permalink,selftext,link_flair_text,over_18,thumbnail,subreddit_id,edited,link_flair_css_class,author_flair_css_class,is_self,name,url,distinguished
1292285542.0,9,self.Chefit,elb7z,Need help with a Christmas present for a pastry chef,9,0,10,http://www.reddit.com/r/Chefit/comments/elb7z/need_help_with_a_christmas_present_for_a_pastry/,"My wife is a pastry chef, and I would like to get her something useful for her Christmas present this year.

I am looking for ideas of what to get her for things that would be useful for her - books, utensils, etc.  I am looking to spend $100.

Thank you.",,False,self,t5_2s1da,False,,,True,t3_elb7z,http://www.reddit.com/r/Chefit/comments/elb7z/need_help_with_a_christmas_present_for_a_pastry/,
1376805323.0,8,self.Chefit,1kld94,First dish on the menu road block.,8,0,9,http://www.reddit.com/r/Chefit/comments/1kld94/first_dish_on_the_menu_road_block/,"So today I am preparing a special, chipotle adobo Ny strip over a bed of rainbow swiss chard tossed with toasted walnuts and blue cheese crumbles. My issue is this I can not for the life of me think of a time sense-able starch. I wanted to go with a hasselback but not sure I can prep that in time. I am hoping some chefs on here could shed some light on a good starch that is time sensitive allowing us to put dishes out quickly.
",,False,self,t5_2s1da,False,,,True,t3_1kld94,http://www.reddit.com/r/Chefit/comments/1kld94/first_dish_on_the_menu_road_block/,
1376785384.0,8,cookshistory.blogspot.ca,1kkuj3,A blog post about the organization of the French royal bakery during the 13th century.,8,0,0,http://www.reddit.com/r/Chefit/comments/1kkuj3/a_blog_post_about_the_organization_of_the_french/,,,False,http://d.thumbs.redditmedia.com/UP3wANtl4nfSaajK.jpg,t5_2s1da,False,,,False,t3_1kkuj3,http://cookshistory.blogspot.ca/2013/08/the-brigade-ii-grand-panetier-and.html,
1375806271.0,8,self.Chefit,1jti7c,Newbie prep cook here. What are some good cheep foods i could use to practice my speed and proficiency with my cuts?,11,3,28,http://www.reddit.com/r/Chefit/comments/1jti7c/newbie_prep_cook_here_what_are_some_good_cheep/,*test*,,False,self,t5_2s1da,False,,,True,t3_1jti7c,http://www.reddit.com/r/Chefit/comments/1jti7c/newbie_prep_cook_here_what_are_some_good_cheep/,
1373952880.0,9,self.Chefit,1ie8j8,"Any Idea Where the Term ""86"" Originated?",11,2,13,http://www.reddit.com/r/Chefit/comments/1ie8j8/any_idea_where_the_term_86_originated/,,,False,self,t5_2s1da,False,,,True,t3_1ie8j8,http://www.reddit.com/r/Chefit/comments/1ie8j8/any_idea_where_the_term_86_originated/,
1372441001.0,10,self.Chefit,1h9drp,"We All have worked in kitchens that are far too hot, especially in the summer; What are your tricks for keeping cool while on the job?",12,2,38,http://www.reddit.com/r/Chefit/comments/1h9drp/we_all_have_worked_in_kitchens_that_are_far_too/,"I have a medical issue (over-active thyroid) where I'm just hot all the time and working in a kitchen in the summer sucks.

my main trick is soaking a clean rag in water, freezing it on the freezer door then rolling it up and wrapping it around the base of my neck under my whites...

How do you lot stay cool when the going gets heated?
",,False,self,t5_2s1da,False,,,True,t3_1h9drp,http://www.reddit.com/r/Chefit/comments/1h9drp/we_all_have_worked_in_kitchens_that_are_far_too/,
1370295528.0,10,self.Chefit,1flx6j,Inventory Management Software,10,0,19,http://www.reddit.com/r/Chefit/comments/1flx6j/inventory_management_software/,"So a few months ago (ok several more than a few) I found out that there was interest in software to track inventory/cost out recipes/ {insert other tedious task better done by a computer}.

It took me a while but I have an alpha version of a website designed to do just that.

Right now, I'm looking for some people who would be willing to give it a spin and give some feedback on what features they would like to see, what is broken and so on...

~~So, if you're interested just say so and I'll PM you a link to the website (it's not quite ready to be available to anyone yet.)~~

EDIT: Oops posted the link in the thread, well guess the cat's out of the bag now. The application can be found here http://thawing-springs-7687.herokuapp.com/.

If you don't understand how to use it or find something just ask and I can probably explain or fix it.
",,False,self,t5_2s1da,1370343365.0,,,True,t3_1flx6j,http://www.reddit.com/r/Chefit/comments/1flx6j/inventory_management_software/,
1368695920.0,6,youtube.com,1efwsg,"Check, Please! Arizona S3E6 Featuring Amy's Baking Company",17,11,9,http://www.reddit.com/r/Chefit/comments/1efwsg/check_please_arizona_s3e6_featuring_amys_baking/,,,False,http://d.thumbs.redditmedia.com/ijvozO5D0PTbyMMc.jpg,t5_2s1da,False,,,False,t3_1efwsg,http://www.youtube.com/watch?v=7bCmTiBjOTw,
1366954031.0,8,self.Chefit,1d4yf4,Best detergent for washing whites?,10,2,10,http://www.reddit.com/r/Chefit/comments/1d4yf4/best_detergent_for_washing_whites/,Just wondering if you guys have any good detergent or stain remover that  you use to wash them? I just use regular detergent but it doesn't seem to remove some of the dirtier stains,,False,self,t5_2s1da,False,,,True,t3_1d4yf4,http://www.reddit.com/r/Chefit/comments/1d4yf4/best_detergent_for_washing_whites/,
1365144794.0,8,self.Chefit,1bpx87,How Do I Go About Working Overseas?,13,5,4,http://www.reddit.com/r/Chefit/comments/1bpx87/how_do_i_go_about_working_overseas/,I'm thinking of going to a new city to just expand my learning and to gain new working experiences and I'm so lost right now. Do you guys go to a new city first and then just knock on restaurant doors or do you contact a specific restaurant and ask if you can get a job/stage or something?,,False,self,t5_2s1da,False,,,True,t3_1bpx87,http://www.reddit.com/r/Chefit/comments/1bpx87/how_do_i_go_about_working_overseas/,
1364437091.0,7,self.Chefit,1b5i7z,Seasonal Seafood - Ormond Beach - April ... Google Failed Me,9,2,20,http://www.reddit.com/r/Chefit/comments/1b5i7z/seasonal_seafood_ormond_beach_april_google_failed/,"What shell and fin fish are at their best in April? Bonus thanks if they are local to the Atlantic coast of Florida.  I spent a frustrating half hour with google, before I decided that the information was probably in the heads of professionals.  We will be just north of Daytona Beach for a while in April and I want the peak of perfection in fishitude.  Some I will cook in the hotel kit hen and some we will eat out.",,False,self,t5_2s1da,False,,,True,t3_1b5i7z,http://www.reddit.com/r/Chefit/comments/1b5i7z/seasonal_seafood_ormond_beach_april_google_failed/,
1364434347.0,7,self.Chefit,1b5eu7,"Can I get some advice/opinions about my cousin's resume? I revised it for him, but I'm not a professional cook.",11,4,31,http://www.reddit.com/r/Chefit/comments/1b5eu7/can_i_get_some_adviceopinions_about_my_cousins/,"My cousin asked me to look over his resume a few days ago.  I already knew that the only job that he's had since high school was working at Chick-fil-A.  But when I saw it on his resume, it nearly brought a tear to my eye.

I've worked in restaurants before (fast food, casual dining, back of the house, and front of the house).  So I was able to draw upon that experience when I started re-writing his resume. 

Is there anything in it that I should change?  What do you look for when a cook tries to send a resume to you?  What makes you look at a resume and makes you want to throw it in the garbage?

My cousin's ultimate goal is to work on a cruise ship with his fiancée-to-be.  His lady is going to finish her culinary degree in two months; it's the same degree that my cousin earned in 2011.
  
**[Original Resume](https://docs.google.com/file/d/0B8wWTgGUzypyUjFEZGN2UkVuVms/edit?usp=sharing)** 

****[Revised Resume](https://docs.google.com/file/d/0B8wWTgGUzypyYy1Ka1BmYlpQc3M/edit?usp=sharing)****

I'd really appreciate any constructive criticism that you are able to provide.  

Thanks

**Edit**:  Can anyone chime in about the importance of photography?  

Once again, I'm not a professional chef or cook.  The restaurant experience I have is from when I was working my way through college.  But I'd imagine that it'd be good to show up to an interview (or with an impromptu meeting with a chef) with a portfolio of dishes that you've prepared to demonstrate your skill.",,False,self,t5_2s1da,1364488183.0,,,True,t3_1b5eu7,http://www.reddit.com/r/Chefit/comments/1b5eu7/can_i_get_some_adviceopinions_about_my_cousins/,
1362870984.0,8,self.Chefit,19zteo,"Cooking at the Beard House in June, wanting to visit some of your restaurants while in NY. ",9,1,9,http://www.reddit.com/r/Chefit/comments/19zteo/cooking_at_the_beard_house_in_june_wanting_to/,"If you are a chef or cook in NY and here on Reddit, we would love to bring our team in for a meal. I and a couple of others will be extending our stay somewhat and are looking for great food. I can look up a thousand different options on Zagat et al, but want to hear it from my fellow redditor chefs. We are chefs so we don't care about being impressed or even what style of food, we just want really really good food. 
Thanks in advance. ",,False,self,t5_2s1da,False,,,True,t3_19zteo,http://www.reddit.com/r/Chefit/comments/19zteo/cooking_at_the_beard_house_in_june_wanting_to/,
1362256516.0,6,self.Chefit,19jequ,Hey everyone! I would like to ask all of you talented men and women who are in some sort of a management/leader position in the industry a few questions! ,8,2,31,http://www.reddit.com/r/Chefit/comments/19jequ/hey_everyone_i_would_like_to_ask_all_of_you/,"So I am a culinary student (I know, terrible, but please work with me here!) with a big presentation coming up. One of the requirements is to interview a few people that are in the industry. If I may, I'd like to ask you some questions about how you manage your employees and how you handle the sticky subject of motivation.

This is my love in life and yours as well, so I hope we can get a good conversation going! Thanks so much for your time!!
",,False,self,t5_2s1da,False,,,True,t3_19jequ,http://www.reddit.com/r/Chefit/comments/19jequ/hey_everyone_i_would_like_to_ask_all_of_you/,
1361940784.0,6,self.Chefit,19b5nc,"Took my first ""Official"" Sous-chef position, willing to take any and all advice!",11,5,11,http://www.reddit.com/r/Chefit/comments/19b5nc/took_my_first_official_souschef_position_willing/,"So, I have been working a management role for the past 1.5-2 years, but finally landed a legitimate Sous-chef position. The cuisine does not worry me so much as the necessity to maintain a 25% food cost. Hard line rustic Italian food with a focus on seasonal, organic product; and a need to please a very well-versed and selective proprietor


I am looking for any tricks and tips you all may have, as well as any fall-back recipes you love for Italian cuisine, and hey, the occasional word of encouragement might be nice :) Thanks in advance Chefit!",,False,self,t5_2s1da,False,,,True,t3_19b5nc,http://www.reddit.com/r/Chefit/comments/19b5nc/took_my_first_official_souschef_position_willing/,
1360704310.0,6,self.Chefit,18efl3,Married/engaged female chefs: do you wear your rings to work?,11,5,23,http://www.reddit.com/r/Chefit/comments/18efl3/marriedengaged_female_chefs_do_you_wear_your/,"I hope I am posting this in the correct subreddit! I would like to start saving for a ring so I can propose to my girlfriend. Are rings with raised stones a huge inconvenience (keeping it clean, wearing gloves, etc.)? Are you even allowed to wear them? We plan on getting married but I want the whole element of the proposal to be a complete surprise. Thank you! ",,False,self,t5_2s1da,False,,,True,t3_18efl3,http://www.reddit.com/r/Chefit/comments/18efl3/marriedengaged_female_chefs_do_you_wear_your/,
1360319236.0,9,self.Chefit,184iqw,"5 Years As A Dishwasher, MULTIPLE kitchens. How do I convince my next employer to put me on the line?",12,3,29,http://www.reddit.com/r/Chefit/comments/184iqw/5_years_as_a_dishwasher_multiple_kitchens_how_do/,"Well, Chefit, my mother has worked as Bartender for more than half her life, and I have special love for the restaurant industry as a result, appreciating the fact that I was raised off of the money my mom could make from it, and since I’ve been 15, I’ve been grinding it in various kitchens as a dishwasher (I’ve never worked in a chain), switching jobs frequently due to school, moving, or generally getting the short end of the stick so-to-speak as a dishwasher. I’m 19 now, and I've worked in 6 different kitchens never for more than 5 months. This is the result of it being summer work, legitimately not living up to expectations (my first full-time attempt, insomnia intervention at my fourth location), or in one example an owner who fired me on the spot when he heard through the grapevine I was going to hand in my 2 weeks’ notice as I was going back to University. I’ve only worked at one establishment that ever rewarded employees with upward mobility, and while they wanted to bring me on the line I had to attend University in a different city.

At all of these places I've worked, I tried to learn as much as I possibly could, but since I was categorized as just the dishwasher other than prepping food for the line when the kitchen was buried and I've been granted any on-hand practice. I love cooking, I love this industry, and I don’t want any other job. I've let all of my employers know I want to cook, and that I’m passionate about food, but none have given me the chance. I KNOW the hours, stress, no-social life, work fast, work hard, and don’t fuck up horribly routine that is the kitchen.

My problem is that I simply can’t get work as a line cook, apprentice, garde mange, or even prep, as one look at my resume screams dishwasher, and there are always more experienced applicants getting ahead of me, even when I ace the interview. I want to work at an establishment long-term, I’m not moving anymore or switching schools or quitting because I’m a student. I live in Guelph, Ontario, where there are approximately 207 restaurants and I need to convince one of them that I will work relentlessly and learn rapaciously and that my inexperience isn't a risk. At the very least, get a dishwashing position where my employer would be willing to train me later on.

What would I put on my resume? What would my cover letter look like? Is my one reference from a previous sous chef enough? When applying in person, what are some arguments I could make in my favour? I’m really looking for any tips/advice AskCulinary may have, as I want this to be my career for the next ~10 years.

**TL;DR** How do I gain employment on the line with only dishwasher experience? (Length was a give a broad image to cut down on ancillary questions)",,False,self,t5_2s1da,False,,,True,t3_184iqw,http://www.reddit.com/r/Chefit/comments/184iqw/5_years_as_a_dishwasher_multiple_kitchens_how_do/,
1360110858.0,8,self.Chefit,17yucx,My first kitchen trial is tomorrow!,10,2,12,http://www.reddit.com/r/Chefit/comments/17yucx/my_first_kitchen_trial_is_tomorrow/,"I had an interview with a new restaurant downtown about a week and a half ago and wrote it off as a failure because it lasted all of ninety seconds. Got a call back today asking me to come in for a trial tomorrow to make sure I'm a good fit. Oh my god I am about to explode. Whether it goes well or not, this is a huge esteem boost.",,False,self,t5_2s1da,False,,,True,t3_17yucx,http://www.reddit.com/r/Chefit/comments/17yucx/my_first_kitchen_trial_is_tomorrow/,
1359857551.0,8,self.Chefit,17samu,Dishwasher to Cook,9,1,14,http://www.reddit.com/r/Chefit/comments/17samu/dishwasher_to_cook/,"I'm currently a dishwasher that also does odd jobs around the restaurant (plating desserts, cutting veg, ect). I was told I will promoted to cook this summer, but don't know much as much about cooking as the other chefs. What can I cook/prep at home in the meantime to be more prepared? (Italian Restaurant, if it matters)",,False,self,t5_2s1da,False,,,True,t3_17samu,http://www.reddit.com/r/Chefit/comments/17samu/dishwasher_to_cook/,
1359762514.0,9,self.Chefit,17q4hs,anybody here ever cooked at the beard house?,13,4,19,http://www.reddit.com/r/Chefit/comments/17q4hs/anybody_here_ever_cooked_at_the_beard_house/,i've been invited to cook a dinner at the beard house along side 3 of my co-workers.  we are truly honored and excited and i am also a little nervous.  has anyone of /r/chefit ever had the priveledge?  can you possibly share some wisdom and/or advice?  ,,False,self,t5_2s1da,False,,,True,t3_17q4hs,http://www.reddit.com/r/Chefit/comments/17q4hs/anybody_here_ever_cooked_at_the_beard_house/,
1356588686.0,7,self.Chefit,15i9ny,A good way to wash aprons?,9,2,5,http://www.reddit.com/r/Chefit/comments/15i9ny/a_good_way_to_wash_aprons/,"So, for the past year or so I've been working for a place that requires me to provide my own uniform. As much as this sucks, I can accept it, minus one key part.

Every time I was my aprons they come out of the washer in a tangled mess that closely resembles the flying spaghetti monster. Does anyone have a secret on how to prevent this from happening?",,False,self,t5_2s1da,False,,,True,t3_15i9ny,http://www.reddit.com/r/Chefit/comments/15i9ny/a_good_way_to_wash_aprons/,
1356418426.0,8,self.Chefit,15eucs,Do chefs in the modern world have apprenticeship programs?,10,2,21,http://www.reddit.com/r/Chefit/comments/15eucs/do_chefs_in_the_modern_world_have_apprenticeship/,"I don't want to go to full on culinary school because of the academic aspects. I thought about this and I wondered if this still happens, how common it is, and what sort of requirements are needed to be an apprentice.

Edit: thank you all for your excellent suggestions and tips. I have found about the American Culinary Federation's apprenticeship programs. Is there anything experts would say about that one?",,False,self,t5_2s1da,1356605734.0,,,True,t3_15eucs,http://www.reddit.com/r/Chefit/comments/15eucs/do_chefs_in_the_modern_world_have_apprenticeship/,
1355203173.0,9,self.Chefit,14nfeq,Questions about catering,10,1,8,http://www.reddit.com/r/Chefit/comments/14nfeq/questions_about_catering/,"So me and a buddy are kicking around the idea of starting a catering company. Ideally something along the lines of ""we come to your house, handle the shopping, use your kitchen to cook for your party and knock out the dishes."" All bid based.

I've had a lot of years based in kitchens. On the line, head chef, sous chef, down to prep and dish. The gamut, as it would be. 

The question is: have you ever had experience making that transition? If so, how did you get started?

Caterers: How do you like it? How does it compare to service in a restaurant kitchen, and what exactly crosses over, if at all?
",,False,self,t5_2s1da,False,,,True,t3_14nfeq,http://www.reddit.com/r/Chefit/comments/14nfeq/questions_about_catering/,
1354673373.0,8,self.Chefit,14aqoo,"Help me out on this small pasta appetizer I'm developing, please!",10,2,20,http://www.reddit.com/r/Chefit/comments/14aqoo/help_me_out_on_this_small_pasta_appetizer_im/,"So the concept is pretty straight forward: It's a dough made with reduced beet juice, filled with kabocha squash, the shape will be tortellini, and I'm tossing it in mint oil. I wanted to originally incorporate the mint oil into the filling, but the flavor of the mint changed in an unappealing way after cooking the pasta. So far the only thing I have in the kabocha filling is salt, lemon juice and zest, and it tastes great, but I'm not sure what else would play well with it. Does anyone have any suggestions?",,False,self,t5_2s1da,False,,,True,t3_14aqoo,http://www.reddit.com/r/Chefit/comments/14aqoo/help_me_out_on_this_small_pasta_appetizer_im/,
1352591233.0,8,self.Chefit,12zho2,"Chefit, would you eat here?",10,2,33,http://www.reddit.com/r/Chefit/comments/12zho2/chefit_would_you_eat_here/,i have a deep passion for japanese/japanese fusion cuisine and sushi. but my friends and colleagues believe that most people would turn tail and run the moment they saw a ginger in whites in a place like that. what does Chefit think?,,False,self,t5_2s1da,False,,,True,t3_12zho2,http://www.reddit.com/r/Chefit/comments/12zho2/chefit_would_you_eat_here/,
1351750767.0,9,self.Chefit,12g2tv,"What is the best way to prepare, hold and finish fried chicken?",9,0,22,http://www.reddit.com/r/Chefit/comments/12g2tv/what_is_the_best_way_to_prepare_hold_and_finish/,"Helping a friend with his new restaurant concept in China and we are trying to come up with a fairly fool proof system for fried chicken.  He has tried to put it on the menu in the past but had problems with cooking consistency (read; occasionally raw in the middle!). 
 The cooks here are great people but lack certain western cooking intuition as well as, occasionally, the inclination to give much of a fuck. 
We have hesitantly considered par-cooking the chicken then frying to order for a nice crispy coating but I feel like there has got to be a better way.
...this is where you guys come in.  Anybody out there worked in, or run a kitchen had fried chicken on the menu? Got any tips or tricks?",,False,self,t5_2s1da,False,,,True,t3_12g2tv,http://www.reddit.com/r/Chefit/comments/12g2tv/what_is_the_best_way_to_prepare_hold_and_finish/,
1350498332.0,10,nytimes.com,11n4uy,Eleven Madison Park is now at Alinea.,13,3,1,http://www.reddit.com/r/Chefit/comments/11n4uy/eleven_madison_park_is_now_at_alinea/,,,False,default,t5_2s1da,False,,,False,t3_11n4uy,http://www.nytimes.com/2012/09/19/dining/at-the-reinvented-eleven-madison-park-the-words-fail-the-dishes.html?smid=pl-share,
1349123444.0,9,self.Chefit,10s1gn,How do I be the best teacher I can for my Culinary Math students? (X-post from r/askculinary),11,2,9,http://www.reddit.com/r/Chefit/comments/10s1gn/how_do_i_be_the_best_teacher_i_can_for_my/,"Asking for help, but if there is anything I can do in return based on my experience I'll try to answer... ask away :)

Obviously being well prepared, clear, patient, enthusiastic and generally stable are a great foundation for teaching. I'm a seasoned teacher but the regular Instructor has been released forever. I'm starting from scratch Monday in this class. I'll have the support of the other Chefs on Faculty so I will be well informed for the students, but they deserve my best. I am determined to give it!

They are associate degree seeking students and basically fresh out of high school (mostly). I have been in restaurants in many roles for almost 18 years. Sure I worked some line stuff, but years ago and never beyond pasta guy or appetizer/pantry.

I would love to hear your stories on importance (or non-importance) on properly portioning, calculating fractions, payroll concepts, food costing, edible portions, production reporting and how these all work within systematic management. I firmly believe, and research supports, that the study must seem related to some end goal like saving or making money. Adult learning principles are pretty well established and I want to make sure that my students get this ""feel.""

Thanks in advance for anything like resources or just your thoughts. I want to do my best.

I ain't no Chef and don't pretend to be. I want your opinions.
",,False,self,t5_2s1da,False,,,True,t3_10s1gn,http://www.reddit.com/r/Chefit/comments/10s1gn/how_do_i_be_the_best_teacher_i_can_for_my/,
1347642316.0,8,self.Chefit,zvuwj,New to being a personal chef,8,0,4,http://www.reddit.com/r/Chefit/comments/zvuwj/new_to_being_a_personal_chef/,"I just got a new job working as a personal live-in chef for a large group, 3 meals a day. I've been doing food service and prep for 4+ years new but never a position like this. Anyone have some tips/advice on meal planning and  purchasing? Much appreciated :)",,False,self,t5_2s1da,False,,,True,t3_zvuwj,http://www.reddit.com/r/Chefit/comments/zvuwj/new_to_being_a_personal_chef/,
1347315112.0,8,self.Chefit,zobrl,How would you make yogurt chips?,8,0,24,http://www.reddit.com/r/Chefit/comments/zobrl/how_would_you_make_yogurt_chips/,"I'm looking to add some acidic tartness to my charred plum ice cream dessert. I want to add a yogurt chip to add texture, and tartness. 
I was thinking about getting plain thick yogurt, spreading thin on a sil pat and dehydrating.......

I need some insight on other ideas. 

Thanks ",,False,self,t5_2s1da,False,,,True,t3_zobrl,http://www.reddit.com/r/Chefit/comments/zobrl/how_would_you_make_yogurt_chips/,
1345590648.0,9,self.Chefit,ylufr,Gift ideas for a chef?,9,0,29,http://www.reddit.com/r/Chefit/comments/ylufr/gift_ideas_for_a_chef/,"My sister is a chef in a small seafood restaurant and it's her birthday. I think I know what my ""main"" gift to her is going to be (unrelated to cooking), but I'm wondering if you guys have some ideas for a really awesome and useful cooking/chef gift ideas.
      
It could be something she would use at work or something she could use when cooking at home... any help would be greatly appreciated!",,False,self,t5_2s1da,False,,,True,t3_ylufr,http://www.reddit.com/r/Chefit/comments/ylufr/gift_ideas_for_a_chef/,
