created_utc,score,domain,id,title,ups,downs,num_comments,permalink,selftext,link_flair_text,over_18,thumbnail,subreddit_id,edited,link_flair_css_class,author_flair_css_class,is_self,name,url,distinguished
1368899275.0,38,self.communism,1el3v9,"Uphold the revolutionary legacy of our martyred comrade İbrahim Kaypakkaya, who 40 years ago to this day was tortured and murdered by the Turkish state!",49,11,2,http://www.reddit.com/r/communism/comments/1el3v9/uphold_the_revolutionary_legacy_of_our_martyred/,"For comrades not in the know, read of İbrahim [here](http://www.signalfire.org/?p=23967). He was a great a revolutionary taken from us far too soon, but both in his ideas and the changes he brought to the opportunist, revisionist communist movement in Turkey, he lives on!",,False,,t5_2qolz,False,,mao,True,t3_1el3v9,http://www.reddit.com/r/communism/comments/1el3v9/uphold_the_revolutionary_legacy_of_our_martyred/,
1368271915.0,32,self.communism,1e4h9y,Pop Stalinism in Russia today and why it sucks,51,19,13,http://www.reddit.com/r/communism/comments/1e4h9y/pop_stalinism_in_russia_today_and_why_it_sucks/,"The modern Russian state is anti-communist and rabidly anti-Stalinist. For example, on Victory Day (9 May in Russia) the state officially 'congratulated' WWII soldiers who endured much and 'suffered in Stalinist concentration camps' (!). President Vladimir Putin uses every occasion to publicly denounce communism and Soviet past, especially Stalin era.

On the other hand, Putin and his clique are also trying to capitalize on Soviet achievements, and especially on victory over fascism, but they are saying, of course, that it was 'Russia' who defeated the Nazis, though modern Russia and those betrayers who came to power in 1991 have nothing to do with victory of Soviet people. Kremlin doesn't support the so-called revival of Stalinism, for example, Stalin buses, monuments etc. but neither it hinders it.

Why is that? Obviously, Putin cannot rely on liberal ideology alone to support his power, because it is highly unpopular inside the country. His anti-Stalinist rhetoric is aimed mostly on the West and on liberal Russian bourgeoisie. For the rest of population, he uses a mix of rabid nationalism, religion and old Soviet ideology, which sometimes takes rather disgusting forms, as with pop stalinism.

What exactly is pop stalinism? This is a 'rehabilitaion' of Stalin, who is now portrayed not as a great proletarian revolutionary, not as a Soviet leader and a communist, but as an 'effective manager' (literally!), 'great state leader' and a 'moderniser' (who modernised the economy). Comparison with Putin is obvious: 'Putin is Stalin today!'

Pop stalinism is extremely reactionary. The radical Russian Left (except for Trotskyites of course, who use this phenomenon as an another argument against Stalin and Stalinism) doesn't support it.",,False,,t5_2qolz,False,,lenin,True,t3_1e4h9y,http://www.reddit.com/r/communism/comments/1e4h9y/pop_stalinism_in_russia_today_and_why_it_sucks/,
1366501137.0,35,en.wikipedia.org,1crqix,"COTD: The Battle of Meligalas. Greek communists fought with Nazi collaborators, slaughtered more than one thousand of them, and threw them in the Well of Meligalas. Greek fascists still mad about it.",39,4,9,http://www.reddit.com/r/communism/comments/1crqix/cotd_the_battle_of_meligalas_greek_communists/,,,False,,t5_2qolz,False,,lenin,False,t3_1crqix,http://en.wikipedia.org/wiki/Meligalas,
1366232483.0,38,self.communism,1ck514,Why is the US population (perceived as) particularly reactionary?,49,11,22,http://www.reddit.com/r/communism/comments/1ck514/why_is_the_us_population_perceived_as/,"I think it is a common diagnosis that the US is particularly more impervious to leftist ideas than other countries today. Generally we have this explained by weekly reposts of that John Steinbeck quote in /r/socialism. I would like to discuss this.  

First of all, how unique is this phenomenon to the US? And is it a contemporary phenomenon or more or less a historical constant since the 20th century? Was this a unique phenomenon even in Steinbeck's time?  

We know that liberalism is the dominant ideology in most of the world today, so we would expect that most people believe in the promised class mobility achieved through merit that capitalism promises but doesn't deliver. So this belief alone wouldn't make the US particularly more anti-communist.  

There is of course, the historical record of the cold-war, with, for better or worse, the US representing the international bourgeoisie and the USSR representing the international proletariat. Undoubtedly curtailing the expansion of the USSR was in the interests of the international bourgeoisie in a way that curtailing fascism never was (the international bourgeoisie was great with Pinochet, Franco, Salazar, Saddam, the Apartheid, and everything else, according to their convenience), but had united in an unprecedent way in the age of imperialism to contain the eastern bloc. Truly though, the biggest conflicts of the cold war were perhaps not the open military engagements that took place, but the ideological war within the great powers themselves, the attempt to guide class struggle towards or away from revolution everywhere.   

So in the context of the cold-war, there was a propaganda effort that was more longer lasting and more effective in the US that ultimately led it to reject socialism more than other countries. This means propaganda in education, from children's education to academia, in every news channel, in cultural production, in grassroots political organizing, and so on, in a manner that wasn't so thorough in other countries. That is one possibility. We would have to ask ourselves why this was particularly stronger in the US. Was it due to its status as the leader in the fight against the eastern bloc, and as such, it led and developed strategies and pioneered their implementation first?     

There is also the theory of labor-aristocracy. The US, as the dominant imperialist center, bribes its working class with superprofits from capital exports to the periphery. But this is not a unique phenomenon to the US in the first world, other imperialist nations are very nearly the same in this regard, arguably with small differences (slightly higher or lower wages, the presence welfare states, different consumption habits).  

Perhaps the way that US society is organized, I don't know, suburbs being an urbanisation method that, in general, generate more individualism than densely populated areas. Perhaps it is the US's ""unique"" historical background that prevents it from considering leftist ideas in the same way, with the liberal founding fathers and their cult of personality being more emphasized? Perhaps it is nationalism?  

I suppose I am just looking at all these variables and trying to look at the hypothesis that the US is special in it's anti-leftism. There are several of these that seem to have some validity to them, although it isn't clear to me why these variables themselves are unique to the US. I just figured this was a worthwhile discussion.  



",,False,,t5_2qolz,False,,stalin,True,t3_1ck514,http://www.reddit.com/r/communism/comments/1ck514/why_is_the_us_population_perceived_as/,
1362877252.0,39,cupcakecarny.sofia-albertsson.se,19zzsr,"With FIRE and IRON STRENGTH, we will crush the sin of IMPERIALISM!",78,39,34,http://www.reddit.com/r/communism/comments/19zzsr/with_fire_and_iron_strength_we_will_crush_the_sin/,,,False,,t5_2qolz,False,,mao,False,t3_19zzsr,http://cupcakecarny.sofia-albertsson.se/wp-content/uploads/2013/02/Nordkorea-propaganda.jpg,
1360952336.0,35,guardian.co.uk,18lboe,When did being lowly paid become a criminal offence?,45,10,11,http://www.reddit.com/r/communism/comments/18lboe/when_did_being_lowly_paid_become_a_criminal/,,,False,,t5_2qolz,False,,redstar,False,t3_18lboe,http://www.guardian.co.uk/commentisfree/2013/feb/14/when-did-lowly-paid-become-offence,
1357024320.0,36,self.communism,15ri8p,A Happy New Year to the finest Communist Forum I Know,64,28,6,http://www.reddit.com/r/communism/comments/15ri8p/a_happy_new_year_to_the_finest_communist_forum_i/,You all kick bourgeois ass.,,False,,t5_2qolz,False,,,True,t3_15ri8p,http://www.reddit.com/r/communism/comments/15ri8p/a_happy_new_year_to_the_finest_communist_forum_i/,
1351614587.0,40,workers.org,12cehs,"Huey P. Newton on gay, women’s liberation: ""We should try to form a working coalition with the gay liberation and women’s liberation groups. We must always handle social forces in the most appropriate manner.""",59,19,9,http://www.reddit.com/r/communism/comments/12cehs/huey_p_newton_on_gay_womens_liberation_we_should/,,,False,,t5_2qolz,False,,marx,False,t3_12cehs,http://www.workers.org/2012/us/huey_p_newton_0524/,
1350345733.0,37,imgur.com,11jheb,I figured that some new ban images might be appreciated -  For the Glory of /r/Communism!,63,26,44,http://www.reddit.com/r/communism/comments/11jheb/i_figured_that_some_new_ban_images_might_be/,,,False,,t5_2qolz,False,,redstar,False,t3_11jheb,http://imgur.com/a/Lw3LX,
1349457345.0,37,rrojasdatabank.info,1101f4,"What would be like to create a nation based solely on neocon political and economic beliefs? Imagine: no opposition, no political rivals, only a ""benevolent dictator"". The Chicago School of Economics got that chance for 16 years in Chile, under near-laboratory conditions. What were the results?",44,7,9,http://www.reddit.com/r/communism/comments/1101f4/what_would_be_like_to_create_a_nation_based/,,,False,,t5_2qolz,False,,,False,t3_1101f4,http://www.rrojasdatabank.info/econom~1.htm,
1348195614.0,35,youtube.com,1089k7,My friend just sent this to me. I thought it was funny.,42,7,10,http://www.reddit.com/r/communism/comments/1089k7/my_friend_just_sent_this_to_me_i_thought_it_was/,,,False,,t5_2qolz,False,,blackpower,False,t3_1089k7,http://www.youtube.com/watch?v=JbOrt1grRrI&amp;feature=player_embedded,
1343664113.0,36,docs.google.com,xe9sl,Anti-Communist cold war comic written and approved by the FBI.,45,9,27,http://www.reddit.com/r/communism/comments/xe9sl/anticommunist_cold_war_comic_written_and_approved/,,,False,,t5_2qolz,False,,mao,False,t3_xe9sl,https://docs.google.com/open?id=0B5sClAkMVQiGQzluUzJFOWRSWWc,
1342476490.0,34,youtube.com,wo10r,"Blatant Imperialism? Gen. David Petraeus: We Can't Leave Afghanistan Now, They Have Trillions of Dollars of Minerals ",45,11,8,http://www.reddit.com/r/communism/comments/wo10r/blatant_imperialism_gen_david_petraeus_we_cant/,,,False,,t5_2qolz,False,,,False,t3_wo10r,http://www.youtube.com/watch?v=wvQJcMmPmsY&amp;feature=youtu.be,
1336495566.0,39,imgur.com,td5ba,Just saw this in a beverage store,49,10,12,http://www.reddit.com/r/communism/comments/td5ba/just_saw_this_in_a_beverage_store/,,,False,,t5_2qolz,False,,,False,t3_td5ba,http://imgur.com/dX3P9,
1336231512.0,37,youtube.com,t8ej4,"Happy B-Day Marx! ""I Read Some Marx (And I liked It)""",45,8,4,http://www.reddit.com/r/communism/comments/t8ej4/happy_bday_marx_i_read_some_marx_and_i_liked_it/,,,False,,t5_2qolz,False,,lenin,False,t3_t8ej4,http://www.youtube.com/watch?v=wyqJ9wxZ9L0,
1376601299.0,36,systemiccapital.com,1kg0yz,New People's Army Disarm A Mayor and His Bodyguards,41,5,0,http://www.reddit.com/r/communism/comments/1kg0yz/new_peoples_army_disarm_a_mayor_and_his_bodyguards/,,,False,,t5_2qolz,False,,xtian,False,t3_1kg0yz,http://www.systemiccapital.com/new-peoples-army-disarms-mayor-bodyguards/,
1374877264.0,34,marxists.org,1j4k0d,Marx's refutation of the idea that profit is the capitalist's reward for risk.,43,9,8,http://www.reddit.com/r/communism/comments/1j4k0d/marxs_refutation_of_the_idea_that_profit_is_the/,,,False,,t5_2qolz,False,,lenin,False,t3_1j4k0d,http://www.marxists.org/archive/marx/works/1863/theories-surplus-value/ch06.htm#s3a,
1374200993.0,37,occupywallst.org,1ilt79,Sex Workers are the 99%! — July 19: International Day of Protest Against the Violent Abuse and Murder of Sex Workers,50,13,0,http://www.reddit.com/r/communism/comments/1ilt79/sex_workers_are_the_99_july_19_international_day/,,,False,,t5_2qolz,False,,,False,t3_1ilt79,http://occupywallst.org/article/july-19-international-day-protest-against-violent-/,
1372009932.0,35,marxists.org,1gx25i,Anarchism or Socialism? -Comrade Stalin. Should be read in the context of the current fascist movement happening in Brazil.,50,15,20,http://www.reddit.com/r/communism/comments/1gx25i/anarchism_or_socialism_comrade_stalin_should_be/,,,False,,t5_2qolz,False,,,False,t3_1gx25i,http://www.marxists.org/reference/archive/stalin/works/1906/12/x01.htm,
1371839270.0,33,self.communism,1gt5a8,Political crisis in Greece. Government sent an ultimatum to ERT's ex-employees to abandon ERT's buildings.,40,7,3,http://www.reddit.com/r/communism/comments/1gt5a8/political_crisis_in_greece_government_sent_an/,"(Read the background [here](http://www.reddit.com/r/communism/comments/1g8orr/greek_national_tv_is_currently_occupied_by_its/).)

ERT is still occupied by its ex-employees and is broadcasting a strike program for 9 days now. You can watch it live [here](http://www.thepressproject.gr/). All these days there are [demonstrations](http://epampatras.files.wordpress.com/2013/03/be6hgnacqaav9db.jpg) and events outside [ERT's headquarters](http://www.iefimerida.gr/sites/default/files/ert_kosmos660_0.jpg).

ERT is not only a TV station, it's a lot of cultural organisations that employed thousands of people. There has been cultural controversy too, since ERT is a cultural benchmark for Greece. You can see ERT's National Symphony Orchestra and Chorus ""unofficially"" performing Mozart's [Requiem](http://www.youtube.com/watch?v=6hqhNqT6h_Y) a few days ago. It's touching..

Yesterday ""Democratic Left"", one of the parties that supported the right-wing government, announced it [leaves the government](http://www.enetenglish.gr/?i=news.en.politics&amp;id=1212) after the latest events. Today the Ministry of Economics called the ex-employees to abandon the building and will probably try to invade the building with the police the next days.

The workers union [answered](http://i.imgur.com/TcfCBjs.jpg) to the threats a few minutes ago: [""molon labe""](http://en.wikipedia.org/wiki/Molon_labe). They called everyone that supports their struggle to go to the ERT headquarters to safeguard the building.",,False,,t5_2qolz,False,,lenin,True,t3_1gt5a8,http://www.reddit.com/r/communism/comments/1gt5a8/political_crisis_in_greece_government_sent_an/,
1371400842.0,33,space.com,1gglxa,Cosmonaut Valentina Tereshkova - the first woman in space,43,10,1,http://www.reddit.com/r/communism/comments/1gglxa/cosmonaut_valentina_tereshkova_the_first_woman_in/,,,False,,t5_2qolz,False,,lenin,False,t3_1gglxa,http://www.space.com/21562-women-space-history-anniversary.html,
1368998411.0,34,signalfire.org,1eniou,"May 19th: Celebrating the Lives of Ho Chi Minh, Malcolm X, and Yuri Kochiyama!",45,11,5,http://www.reddit.com/r/communism/comments/1eniou/may_19th_celebrating_the_lives_of_ho_chi_minh/,,,False,,t5_2qolz,False,,mao,False,t3_1eniou,http://www.signalfire.org/?p=24321,
1367473245.0,34,reddit.com,1djaup,Even reddit sees itself as a temporarily embarrassed millionaires,42,8,15,http://www.reddit.com/r/communism/comments/1djaup/even_reddit_sees_itself_as_a_temporarily/,,,False,,t5_2qolz,False,,,False,t3_1djaup,http://www.reddit.com/r/todayilearned/comments/1dhyjj/til_when_ben_jerrys_was_founded_they_followed_a_5/c9qmiyb?context=3#c9qm5pt,
1363841310.0,33,i.imgur.com,1aprig,"Found this today, it was published in China in 1972",42,9,5,http://www.reddit.com/r/communism/comments/1aprig/found_this_today_it_was_published_in_china_in_1972/,,,False,,t5_2qolz,False,,redstar,False,t3_1aprig,http://i.imgur.com/9cnAPHy.jpg,
1361145465.0,35,self.communism,18pvor,"""I hate the indifferent"" -- an inspirational letter from comrade Gramsci",44,9,10,http://www.reddit.com/r/communism/comments/18pvor/i_hate_the_indifferent_an_inspirational_letter/,"I hate the indifferent. I believe living means taking sides. They who truly live cannot help but to be citizens and partisans. Indifference is apathy, parasitism, perversion, not life. That's why I hate the indifferent.

Indifference is the burden of history. Indifference operates with great power on history. It operates passively, but it operates. It is fate; that which cannot be counted on; it is that which twists programs and ruins the best-conceived plans; it is the brute matter that chokes intelligence. That which happens, the evil that weighs upon all, happens because most of humanity renounces its own will, allows laws to be passed that only revolt can nullify, and leaves men that only mutiny can overthrow to achieve power. Thanks to indifference, few hands weave the fabric of collective life unsurveilled, and the masses ignore it because they are careless; then it seems like it is fate that runs over everything and everyone, it looks as if history is but an enormous natural phenomenon, an eruption, an earthquake of which everyone is a victim, those who consent as well as those who dissent, those who knew as well as those who didn't, the active as well as the indifferent. Some whimper pitifully, others curse obscenely, but none, or very few, ask themselves: if I too had fulfilled my duty, if I had tried to impose my will, would this have happened?

This too is why I hate the indifferent: Their wailing as if eternally innocent is a nuisance to me. I hold every person liable to how they fulfilled the task life has given them and continues to give them every day, of what they have done, and especially what they have not done. And I feel I have the right to be unrelenting, not to squander my compassion, of not having to share my tears with them.

I am a partisan, I am alive, and in the conscience of those on my part I feel the pulse of the future city we are building. And in it, the social chain does not rest on a few, nothing that happens in it is a matter of luck, nor the product of fate, but the intelligent work of citizens. In it, nobody is looking out their window while the few sacrifice and drain themselves. I live, I am a partisan. That is why I hate those who don’t take sides, I hate the indifferent.

    Antonio Gramsci, February 11th 1917

[Original Italian](http://www.partigiano.net/gt/gramsci_indifferenti.asp)",,False,,t5_2qolz,1361191054.0,,lenin,True,t3_18pvor,http://www.reddit.com/r/communism/comments/18pvor/i_hate_the_indifferent_an_inspirational_letter/,
1361029819.0,36,self.communism,18n2k5,What do folks here think of veganism and the animal rights movement?,49,13,66,http://www.reddit.com/r/communism/comments/18n2k5/what_do_folks_here_think_of_veganism_and_the/,"In the anarchist circles I've been involved with animal rights is a huge issue, and many people hold up veganism (and to a lesser degree vegetarianism) as some sort of grand moral choice. 

Though I haven't spent as much time with Marxist groups, I definitely haven't seen the same sort of emphasis. Since I haven't seen much mention about it here, I'm interested in starting a discussion in this subreddit about the issue. 

I personally view any sort of animal rights struggle as coming far behind human class struggle in importance. It only really seems to exist in the most privileged sectors of the first world and in my mind detracts from a focus on combating capitalism. That said, I think that in a post-capitalist society we should use as few animals as possible in order to minimize suffering (and use resources as efficiently as possible). This would probably include a shift towards vegetarianism and veganism in the countries that could do so more easily. 

I think at this point the decision to eat meat or not is a personal choice often dictated by class, and we should not think of it as meaning much more than that.

Thoughts?

",,False,,t5_2qolz,False,,redstar,True,t3_18n2k5,http://www.reddit.com/r/communism/comments/18n2k5/what_do_folks_here_think_of_veganism_and_the/,
1360865427.0,36,en.wikipedia.org,18izhm,Communism of the Day: Eugen Leviné,41,5,11,http://www.reddit.com/r/communism/comments/18izhm/communism_of_the_day_eugen_leviné/,,,False,,t5_2qolz,False,,redstar,False,t3_18izhm,http://en.wikipedia.org/wiki/Eugen_Levin%C3%A9,
1355023507.0,34,listverse.com,14j427,15 Revolutionary Soviet Posters,58,24,7,http://www.reddit.com/r/communism/comments/14j427/15_revolutionary_soviet_posters/,,,False,,t5_2qolz,False,,redstar,False,t3_14j427,http://listverse.com/2012/12/08/15-revolutionary-posters-of-the-soviet-union/,
1354586545.0,35,i.imgur.com,148jja,Anti-Amerikan week: The revolutionary adventures of the TRUE Captain America: “América is a continent!”,75,40,33,http://www.reddit.com/r/communism/comments/148jja/antiamerikan_week_the_revolutionary_adventures_of/,,,False,,t5_2qolz,False,,redstar,False,t3_148jja,http://i.imgur.com/OVC01.jpg,
1352224827.0,32,self.communism,12qnuc,Obama: The Other Right-wing of Capital,76,44,39,http://www.reddit.com/r/communism/comments/12qnuc/obama_the_other_rightwing_of_capital/,"I'm sure you've all seen and participated in the discussion among comrades over whether we should support Obama. Some consider Romney and the Republicans to represent unrestrained laissez-faire capitalism, while Obama and the Democrats represent 'Keynesian' liberal capitalism, so we should vote Democrat and at least get some sort of social safety net. I want to point out that this interpretation is erroneous for anyone who does not yet understand.

Obama is right-wing. He has extended the Bush tax cuts under his administration. He has filled his cabinet with conservative advisers, many of them from the Trilateral Commission. He appointed an ex-Monsanto executive as Senior Advisor to FDA. The rich-poor gap has continued to increase under his watch. Although he appeared to champion the idea of universal healthcare, his first choice for Secretary of Health was someone who lobbied against it for years. Obama also announced that he has cut $1 Trillion from domestic spending, and vowed to cut $4 Trillion more in his next term. Him and Romney both agree on this. It may also interest some comrades to know that 600,000 public sector jobs have vanished under Obama. Even under Bush, 800,000 public sector jobs were created.

As for ""allies of the working class,"" trade union rights have eroded under the Obama administration. One need look no further than their decision to host the DNC in Charlotte, North Carolina, a city and state notorious for its anti-labor actions in an attempt to make it a more lucrative spot for business. Obama is also a close friend of Ralph Emanuel, the mayor who opposed the Chicago teachers' strike. Even Romney sided with Emanuel on the issue of the teachers' strike. Some big difference between the parties, alright. Not only that, but Obama's ""Race to the Top"" legislation is more of the same ""educational reform"" bullshit that demands merit pay and teacher evaluation based on testing.

Now to civil rights, the true disaster. I'm sure we all know about NDAA, the act that essentially declared martial law by giving the government the authority to arrest citizens without trial. It's also interesting to note that Obama wrote a letter encouraging the Supreme Court to approve of cavity searches. The Democrats have also approved of drone strikes and extrajudicial executions anywhere in the world. Do I even need to mention the $3.7 Trillion sunk into Obama's conquest of the Middle East? $68,000 per missile, if I'm not mistaken.

As for Obama's supposed success at revitalizing the failing capitalist economy, America needs to create 9 million jobs in order to cover up for jobs lost during the Great Recession. Obama has produced 100,000. That is 1 percent of what is needed. Not that the bourgeoisie are suffering or anything, because corporate profits have reached record-breaking highs under the watchful eyes of the Democrats while wages and jobs continue to plummet.

None of this information is secret. Comrades who have been following the US election closely will know most of this. I only hope that I've given those undecided comrades something to consider.

Sources:
http://www.politicalcompass.org/uselection2012
http://socialistworker.org/2012/10/08/issues-they-wont-talk-about
http://socialistworker.org/2012/11/01/the-next-president-of-austerity",,False,,t5_2qolz,False,,,True,t3_12qnuc,http://www.reddit.com/r/communism/comments/12qnuc/obama_the_other_rightwing_of_capital/,
1350970117.0,35,imgur.com,11xk0b,"If we are still posting threads of communist leaders, here is a Huey Newton thread.",46,11,3,http://www.reddit.com/r/communism/comments/11xk0b/if_we_are_still_posting_threads_of_communist/,,,False,,t5_2qolz,False,,rosa,False,t3_11xk0b,http://imgur.com/a/FLiik,
1350081860.0,37,i.imgur.com,11e0s8,NOT MY COMRADES (x-post from r/soc),57,20,52,http://www.reddit.com/r/communism/comments/11e0s8/not_my_comrades_xpost_from_rsoc/,,,False,,t5_2qolz,False,,,False,t3_11e0s8,http://i.imgur.com/HZPrg.jpg,
1347211112.0,37,self.communism,zlx7f,Debunking Bourgeois Propaganda,41,4,7,http://www.reddit.com/r/communism/comments/zlx7f/debunking_bourgeois_propaganda/,I think a thread gathering all the info to debunk bourgeois notions of what actually existing socialism looked like would be a useful resource.,,False,,t5_2qolz,False,,brd,True,t3_zlx7f,http://www.reddit.com/r/communism/comments/zlx7f/debunking_bourgeois_propaganda/,
1343051432.0,36,i.imgur.com,x0k83,Fear mongering. Communism is taught as a dirty word in the US. ,44,8,5,http://www.reddit.com/r/communism/comments/x0k83/fear_mongering_communism_is_taught_as_a_dirty/,,,False,,t5_2qolz,False,,,False,t3_x0k83,http://i.imgur.com/0jF1p.png,
