created_utc,score,domain,id,title,ups,downs,num_comments,permalink,selftext,link_flair_text,over_18,thumbnail,subreddit_id,edited,link_flair_css_class,author_flair_css_class,is_self,name,url,distinguished
1368949805.0,20,self.communism,1emeel,A better system of book-sharing,30,10,9,http://www.reddit.com/r/communism/comments/1emeel/a_better_system_of_booksharing/,"There have been threads here before about sharing e-books, which everyone seems quite into; some texts can be hard to find for various reasons, especially for those of us living in states that block or ban the import or printing of socialist literature, or when texts are out of print (completely, or in their best translations). 

The problem is that everyone seems to share their books through file-upload services like MegaUpload, Sharebee, Rapidshare, Fileget, and so on. These links expire quickly, and they're not very effective for easily sharing large libraries between people.

Large libraries can be shared easily through torrents on sites like OneBigTorrent, but there you have the opposite problem -- you can easily share big bundles, but it's harder to effectively share individual texts. 

In the past, I've done both of these things. I have quite a large library (500+ books), and I'm interested in finding some more accessible and efficient system of sharing it -- and of expanding that library and finding new books from others, because I too have a list of books I've been looking for and have been totally unable to find, like Fraser &amp; Wilde's ""Marx Dictionary."" I've also gotten into the habit of re-formatting PDFs and e-textbooks in ways more suitable for use on e-readers and mobile devices, which I'm sure there's demand for.

The best system I've found so far is a **Calibre library** served over the web. That option produces a neat little website [like this](http://i.imgur.com/uZS09tZ.png), where each book is downloadable in any of its forms (PDF, ePub, Kindle, HTML, plaintext) with a displayed cover and description. That's a great feature, because it means users don't need to have a book in mind -- they can see what's available and research what seems striking. They could email their own ebooks to the person running the library to expand it. The disadvantage here is that it's centralised and openly on display, pretty easy for copyright holders to simply order it shut down. 

My other idea was to cross-post a monthly thread in /r/communism, /r/anarchism, /r/socialism, /r/radicalchristianity, /r/criticaltheory, /r/srssocialism, /r/communism101, /r/anarchy101 (and so on) in which users can ask for books they've been after, recommend non-obvious books, and share their favourites or their collections (either through file-service links, or by forwarding them all to someone who posts them as one big convenient reliable torrent). There have been individual book-sharing threads here, but they get old, they attract no attention, they're not cross-posted between the various leftist/radical subreddits, and the links die off -- it needs to be a monthly thing, IMO.)

I'm curious as to whether anyone else has a better idea, and whether anyone else is interested. ",,False,,t5_2qolz,False,,,True,t3_1emeel,http://www.reddit.com/r/communism/comments/1emeel/a_better_system_of_booksharing/,
1368108960.0,24,pslweb.org,1e02gv,Science experiment or racist attack?,30,6,3,http://www.reddit.com/r/communism/comments/1e02gv/science_experiment_or_racist_attack/,,,False,,t5_2qolz,False,,marx,False,t3_1e02gv,http://www.pslweb.org/liberationnews/news/student-victimized-for-science-experiment-that-went-wrong.html,
1367548664.0,20,karlomongaya.wordpress.com,1dlfq0,The End of the Vietnam War,24,4,4,http://www.reddit.com/r/communism/comments/1dlfq0/the_end_of_the_vietnam_war/,,,False,,t5_2qolz,False,,,False,t3_1dlfq0,http://karlomongaya.wordpress.com/2013/04/30/the-end-of-the-vietnam-war/,
1366683434.0,21,youtube.com,1cwpxc,China Is Not Communist (Anymore),30,9,5,http://www.reddit.com/r/communism/comments/1cwpxc/china_is_not_communist_anymore/,,,False,,t5_2qolz,False,,mao,False,t3_1cwpxc,http://www.youtube.com/watch?v=YA16UTJWugA,
1366336944.0,23,self.communism,1cngbt,Communist/Leftist slogans and chants?,28,5,37,http://www.reddit.com/r/communism/comments/1cngbt/communistleftist_slogans_and_chants/,"Demonstration chants? One-liner slogans you would see in spray paint on a wall? You know you love them, what are some really good ones?

I like ""Worker, without you no cog can turn, you can do without the bosses!"" as a chant and ""Workers of the world, unite!"" as a slogan to chalk or graffiti somewhere. (Also a good chant could be ""We won't go without a fight; workers of the world, unite!""",,False,,t5_2qolz,False,,mao,True,t3_1cngbt,http://www.reddit.com/r/communism/comments/1cngbt/communistleftist_slogans_and_chants/,
1366309439.0,22,self.communism,1cmdah,What is your view on homosexuality?,33,11,163,http://www.reddit.com/r/communism/comments/1cmdah/what_is_your_view_on_homosexuality/,"*Edit 
Perhaps another way of wording this would be: Is there room for homosexuality in a communist society?",,False,,t5_2qolz,1366313985.0,,,True,t3_1cmdah,http://www.reddit.com/r/communism/comments/1cmdah/what_is_your_view_on_homosexuality/,
1364839591.0,24,self.communism,1bfpcy,Communism of the Day: Communism on paper (Not an attempt to overthrow the mods ;) ),33,9,36,http://www.reddit.com/r/communism/comments/1bfpcy/communism_of_the_day_communism_on_paper_not_an/,"Yeah, the theories of Karl Marx, Roger Engles, Vladimir Lemon, STALIN^Totalitarianism and Mao *LOOK* good on paper...

But they simply don't work in real life. Communism has killed 7.78 x 10^8 people so far. Discuss.

BTW this thread is **NOT STATE SANCTIONED** so all lovers of free speech post here so we can start a coup (not funded by the U.S. ;) ) and free the oppressed redditors from the cyber-gulag!",,False,,t5_2qolz,False,,redstar,True,t3_1bfpcy,http://www.reddit.com/r/communism/comments/1bfpcy/communism_of_the_day_communism_on_paper_not_an/,
1364761220.0,24,self.communism,1bdjh9,The elimination of the Law of Value,29,5,10,http://www.reddit.com/r/communism/comments/1bdjh9/the_elimination_of_the_law_of_value/,"One the most important goals of the revolutionary dictatorship of the proletariat is the elimination of the Law of Value in society, and replace it with rational human planning.

In actually existing socialism of the 20th century, efforts were made to curtail the dominance of the Law of Value  *objectively* as in the USSR in the time of Stalin and in the PRC in the time of Mao, particularly during the Great Proletarian Cultural Revolution. However, these efforts were ultimately unsuccessful in consolidating the status of the proletariat as the ruling class.

Despite that, there remains an important discovery; Mao showed how the existence of the Law of Value represents the struggle between the proletariat and the bourgeoisie, which continues in Socialism. This struggle is ultimately what Socialist society is about, and the main reason there is a so-called ""transition stage"" between capitalism and communism.

I would like to discuss this here. Is the Cultural Revolution and the different struggles therein the answer that is applicable everywhere? No one wishes to argue that there weren't massive successes, but can it's failure, in the final analysis, be ascribed to the material conditions of that time? 

In addition, i would like to make a call for more discussion on Political Economy. The modern communist is faced with a daunting task when confronted with bourgeois ideology. She must be proficient in everything ranging from philosophy to economics to history in order to be taken seriously by the hostile environment she faces after the defeat and the undermining of Actually Existing Socialism. Especially in the context of the current crisis of capitalism, reactionary bourgeois ideology is asserting itself more and more, and we must work hard to combat the shroud of mystification it brings with it. This cannot be done if communists everywhere arm themselves more and more with contemporary developments in economics, such as the TSSI. In the end, if we don't study these things, who will?

",,False,,t5_2qolz,1364777184.0,,lenin,True,t3_1bdjh9,http://www.reddit.com/r/communism/comments/1bdjh9/the_elimination_of_the_law_of_value/,
1364552549.0,22,revolutionaryfrontlines.wordpress.com,1b8h1g,"Interview with Ganapathy, Leader of India’s Maoist Revolution",26,4,2,http://www.reddit.com/r/communism/comments/1b8h1g/interview_with_ganapathy_leader_of_indias_maoist/,,,False,,t5_2qolz,False,,redstar,False,t3_1b8h1g,http://revolutionaryfrontlines.wordpress.com/2010/03/26/interview-with-ganapathy-leader-of-indias-maoist-revolution/,
1364496801.0,22,prisoncensorship.info,1b6xs5,Maoist Internationalist Movement Theory discussion of Labor Aristocracy and Bourgeoisified White Proletariat ,32,10,16,http://www.reddit.com/r/communism/comments/1b6xs5/maoist_internationalist_movement_theory/,,,False,,t5_2qolz,False,,lenin,False,t3_1b6xs5,http://www.prisoncensorship.info/archive/etext/mt/oldxeroxmt/oldxeroxmt9and10from1987.pdf,
1364288107.0,22,boingboing.net,1b1620,"Updates on the ongoing trial of Montt, the US-backed Guatemalan dictator responsible for ~100,000 executions of leftists and genocide against indigenous peoples in the 80s. Very disturbing accounts...",28,6,11,http://www.reddit.com/r/communism/comments/1b1620/updates_on_the_ongoing_trial_of_montt_the/,,,False,,t5_2qolz,False,,redstar,False,t3_1b1620,http://boingboing.net/2013/03/25/guatemala-day-5-of-montt-geno.html,
1364082765.0,22,massline.org,1avxfn,Why Marxism-Leninism-Maoism is a Science,36,14,15,http://www.reddit.com/r/communism/comments/1avxfn/why_marxismleninismmaoism_is_a_science/,,,False,,t5_2qolz,False,,mao,False,t3_1avxfn,http://www.massline.org/Philosophy/ScottH/MLM_sci.htm,
1363495508.0,21,rachelcorrie.org,1ag7ac,Rachel Corrie was murdered 10 years ago today.,37,16,4,http://www.reddit.com/r/communism/comments/1ag7ac/rachel_corrie_was_murdered_10_years_ago_today/,,,False,,t5_2qolz,False,,,False,t3_1ag7ac,http://www.rachelcorrie.org/,
1363211352.0,23,i.imgur.com,1a8s0u,Marching in Step Leads to Victory,48,25,6,http://www.reddit.com/r/communism/comments/1a8s0u/marching_in_step_leads_to_victory/,,,False,,t5_2qolz,False,,mao,False,t3_1a8s0u,http://i.imgur.com/LbF4Blr.jpg,
1363109513.0,22,reddit.com,1a5osf,Such a great critique of our great community.,34,12,67,http://www.reddit.com/r/communism/comments/1a5osf/such_a_great_critique_of_our_great_community/,,,False,,t5_2qolz,False,,trotsky,False,t3_1a5osf,http://www.reddit.com/r/Anarchism/comments/1a55mx/why_is_rcommunism_so_fucking_weird/,
1361793442.0,22,self.communism,196s9w,What blogs do you read/subscribe to?,26,4,11,http://www.reddit.com/r/communism/comments/196s9w/what_blogs_do_you_readsubscribe_to/,"Here are mine:

* [Systemic Capital](http://www.systemiccapital.com/), which is just an aggregator. They mainly reblog good stuff but my only complaint is that there's too much petty U.S.A. struggle (not saying most of it isn't important, just that it isn't relevant/interesting to me). It's a good source for the Nepalese situation, and other similar subjects where information is hard to come by.

* [Anti-Imperialism.com](http://anti-imperialism.com/). Only recently subscribed to them but I enjoy all of the content. I thought their zine which comrade ksan posted on here was great as well (even though I'm not necessarily a third-worldist).

* and [MLM Mayhem](http://moufawad-paul.blogspot.dk/) which, as most of you know, is written by comrade JMP, who contributes great content to this sub.

Any suggestions?",,False,,t5_2qolz,False,,lenin,True,t3_196s9w,http://www.reddit.com/r/communism/comments/196s9w/what_blogs_do_you_readsubscribe_to/,
1361739419.0,24,youtube.com,195eor,Prof. Norman Finkelstein debates Zionist Imperialism,34,10,7,http://www.reddit.com/r/communism/comments/195eor/prof_norman_finkelstein_debates_zionist/,,,False,,t5_2qolz,False,,marxfem,False,t3_195eor,http://www.youtube.com/watch?v=cNQSV3BBtZ4&amp;,
1361306722.0,24,columbia.edu,18u80y,Black Like Mao - Red China and Black Revolution,28,4,1,http://www.reddit.com/r/communism/comments/18u80y/black_like_mao_red_china_and_black_revolution/,,,False,,t5_2qolz,False,,lenin,False,t3_18u80y,http://www.columbia.edu/cu/ccbh/souls/vol1no4/vol1num4art1.pdf,
1360808892.0,23,marxists.org,18hk7q,"What is the basis of the anti-Stalin argument that he was an antisemite? I hear this argument frequently, despite Stalin having passed laws such as this one.",32,9,18,http://www.reddit.com/r/communism/comments/18hk7q/what_is_the_basis_of_the_antistalin_argument_that/,,,False,,t5_2qolz,False,,mao,False,t3_18hk7q,http://www.marxists.org/reference/archive/stalin/works/1931/01/12.htm,
1360576643.0,22,i.imgur.com,18avkk,"Noam Chomsky, expert on Marxism (a bit circle-jerky, but I think it's worth it)",36,14,18,http://www.reddit.com/r/communism/comments/18avkk/noam_chomsky_expert_on_marxism_a_bit_circlejerky/,,,False,,t5_2qolz,False,,redstar,False,t3_18avkk,http://i.imgur.com/I23BJuo.jpg,
1360270414.0,21,self.communism,1834fl,Marxist poetry?,36,15,30,http://www.reddit.com/r/communism/comments/1834fl/marxist_poetry/,"That awkward moment when you realize all your favorite poets are reactionary as fuck...

Of course I still like their works, the same way one might appreciate Wagner's music even though he was an anti-semite. But I'm a big fan of communist songs of liberation, and I would really like to read some proletry (sorry). I did a quick search of Stalin's works and I found this, lol:

&gt;     The pinkish bud has opened,
    Rushing to the pale-blue violet
    And, stirred by a light breeze,
    The lily of the valley has bent over the grass.

(I bet it reads great in Russian, but I think the young comrade fared better with his looks)

I also ask because I like to partake in this activity from time to time, and I'm not sure how Marxism has influenced my writing. Any poets in this sub?",,False,,t5_2qolz,False,,lenin,True,t3_1834fl,http://www.reddit.com/r/communism/comments/1834fl/marxist_poetry/,
1360104080.0,20,self.communism,17ylk9,"Thematic Discussion: Week of February 5rd, 2013: Gender Roles in Socialist Societies",33,13,2,http://www.reddit.com/r/communism/comments/17ylk9/thematic_discussion_week_of_february_5rd_2013/,"This Thematic Discussion is based around Gender Roles in Socialist Societies. It has always been said that under Socialism, Gender Roles would melt away as they stopped being economically motivated.

* Was this really the case in many Socialist countries?

* How were women treated in relation to men? Was the Patriarchy destroyed or modified?

* Did the Patriarchy lead to Socialism eventually being overthrown? What role did it play in the construction/destruction of Socialist states?

* Why did LGBTQ groups/rights suffer under Socialist regimes?

* What lead to modern Communist groups developing a proper understanding of LGBTQ rights?

* What mistakes do we need to learn from the past?

* How do we build Socialism so that Patriarchy is defeated, and LGBTQ groups are granted their rights? What will lead us to liberation?

Some Sources to get the ball rolling:

[Private Life under Socialism](http://books.google.com/books?hl=en&amp;lr=&amp;id=d50_CqXVKIoC&amp;oi=fnd&amp;pg=PR9&amp;dq=Gender+Roles+under+Socialism&amp;ots=4qRinmxIZJ&amp;sig=1lAf6f-2Ff0iVlYVKgjSq5yc6o0#v=onepage&amp;q&amp;f=false)

[Cuba Celebrates Advancing Gay Rights](http://www.greenleft.org.au/node/39993)

[Homosexual Existence and Exist Socialism](http://glq.dukejournals.org/content/8/3/349.full.pdf+html)

[The Marxist Theory of Homosexuality Part III](http://www.freerepublic.com/focus/f-news/1751714/posts)

[Feminism, Marxism, Method, and the State: An Agenda for Theory](http://www.jstor.org/stable/3173853?seq=1)

[From Parent-State to Family Patriarchs: Gender and Nation in Contemporary Eastern Europe](http://www.newschool.edu/uploadedFiles/TCDS/Democracy_and_Diversity_Institutes/Verdery_FromParentState.pdf)

[Gender Role Socialization in Contemporary Russia](http://pwq.sagepub.com/content/17/4/389.full.pdf+html)

[Class and Gender Inequalities and Women's Role in Economic Development - Theoretical and Practical Implications](http://www.jstor.org/stable/3177584?seq=1)",,False,,t5_2qolz,False,,redstar,True,t3_17ylk9,http://www.reddit.com/r/communism/comments/17ylk9/thematic_discussion_week_of_february_5rd_2013/,
1357274031.0,20,self.communism,15xlc2,Engels on the Paris 1832 'Les Miserables' Uprising,31,11,4,http://www.reddit.com/r/communism/comments/15xlc2/engels_on_the_paris_1832_les_miserables_uprising/,"In prospect of the new Les Miserables movie coming out, I thought you guys might be interested in an article by Engels on the historic 1832 June Rebellion in Paris, which was the inspiration for the Student uprising depicted by Victor Hugo in Les Miserables.

http://en.wikipedia.org/wiki/June_Rebellion


**The June Revolution
The Course of the Paris Uprising**

by Frederick Engels

Translated: by the Marx-Engels Institute;
First published: in Neue Rheinische Zeitung No. 32, July 1, 1848;
Transcribed: by director@marx.org, 1994.

Gradually we gain a more comprehensive view of the June Revolution; fuller reports arrive, it becomes possible to distinguish facts from either hearsay or lies, and the nature of the uprising stands out with increasing clarity. The more one succeeds in grasping the interconnection of the events of the four days in June, the more is one astonished by the vast magnitude of the uprising, the heroic courage, the rapidly improvised organization and the unanimity of the insurgents.

The workers' plan of action, which Kersausie, a friend of Raspail and a former officer, is said to have drawn up, was as follows:

The insurgents, moving in four columns, advance concentrically towards the town hall.

The first column, whose base were the suburbs of Montmartre, La Chapelle and La Villette, advance southwards from the gates of Poissonniere, Rochechouart, St. Denis and La Villette, occupy the Boulevards and approach the town hall through the streets Montorgueil, St. Denis and St. Martin.

The second column, whose base were the faubourgs du Temple and St. Antoine, which are inhabited almost entirely by workers and protected by the St. Martin canal, advance towards the same centre through the streets du Temple and St. Antoine and along the quais of the northern bank of the Seine as well as through all other streets running in the same direction in this part of the city.

The third column based on the Faubourg St. Marceau move towards the Ile de la Cite through the Rue St. Victor and the quais of the southern bank of the Seine.

The fourth column, based on the Faubourg St. Jacques and the vicinity of the Medical School, move down the Rue Saint Jacques also to the Cite. There the two columns join, cross to the right bank of the Seine and envelop the town hall from the rear and flank.

Thus the plan, quite correctly, was based on the districts in which only workers lived. These districts form a semicircular belt, which surrounds the entire eastern half of Paris, widening out towards the east. First of all the eastern part of Paris was to be cleared of enemies, and then it was intended to move along both banks of the Seine towards the west and its centres, the Tuileries and the National Assembly.

These columns were to be supported by numerous flying squads which, operating independently alongside and between the columns, were to build barricades, occupy the smaller streets and be responsible for maintaining communication.

The operational bases were strongly fortified and skillfully transformed into formidable fortresses, e.g., the Clos St. Lazare, the Faubourg and Quartier St. Antoine and the Faubourg St. Jacques, in case it should become necessary to retreat.

If there was any flaw in this plan it was that in the beginning of the operations the western part of Paris was completely overlooked. There are several districts eminently suitable for armed action on both sides of the Rue St. Honore near the market halls and the Palais National, which have very narrow, winding streets tenanted mainly by workers. It was important to set up a fifth centre of the insurrection there, thus cutting off the town hall and at the same time holding up a considerable number of troops at this projecting strongpoint. The success of the uprising depended on the insurgents reaching the centre of Paris as quickly as possible and seizing the town hall. We cannot know what prevented Kersausic from organizing insurgent action in this part. But it is a fact that no uprising was ever successful which did not at the outset succeed in seizing the centre of Paris adjoining the Tuileries. Suffice to mention the uprising [The uprising took place in Paris on June 5-6, 1832. -- Ed.]"" which took place during General Lamarque's funeral when the insurgents got as far as the Rue Montorgueil and were then driven back.

The insurgents advanced in accordance with their plan. They immediately began to separate their territory, the Paris of the workers, from the Paris of the bourgeoisie, by two main fortifications -- the barricades at the Porte Saint Denis and those of the Cite. They were dislodged from the former, but were able to hold the latter. June 23, the first day, was merely a prelude. The plan of the insurgents already began to emerge clearly (and the Neue Rheinische Zeitung grasped it correctly at the outset, see No. 26, special supplement), especially after the first skirmishes between the advanced guards which took place in the morning. The Boulevard St. Martin, which crosses the line of operation of the first column, became the scene of fierce fighting, which, partly due to the nature of the terrain, ended with a victory for the forces of ""order"".

The approaches to the Cite were blocked on the right by a flying squad, which entrenched itself in the Rue de la Planche-Mibray; on the left by the third and fourth columns, which occupied and fortified the three southern bridges of the Cite. Here too a very fierce battle raged. The forces of ""order"" succeeded in taking the St. Michel bridge and advancing to the Rue St. Jacques. They felt sure that by the evening the revolt would be suppressed.

The plan of the forces of ""order"" stood out even more clearly than that of the insurgents. To begin with, their plan was merely to crush the insurrection with all available means. They announced their design to the insurgents with cannon-ball and grape-shot.

But the government believed it was dealing with an uncouth gang of common rioters acting without any plan. After clearing the main streets by the evening, the government declared that the revolt was quelled, and the stationing of troops in the conquered districts was arranged in an exceedingly negligent manner.

The insurgents made excellent use of this negligence by launching the great battle which followed the skirmishes of June 23. It is simply amazing how quickly the workers mastered the plan of campaign, how well-concerted their actions were and how skillfully they used the difficult terrain. This would be quite inexplicable if in the national workshops the workers had not already been to a certain extent organized on military lines and divided into companies, so that they only needed to apply their industrial Organization to their military enterprise in order to create a fully organized army.

On the morning of the 24th they had not only completely regained the ground they had lost, but even added new strips to it. True, the line of Boulevards up to the Boulevard du Temple remained in the hands of the troops, thus cutting off the first column from the centre, but on the other hand the second column pushed forward from the Quartier St. Antoine until it almost surrounded the town hall. It established its headquarters in the church of St. Gervais, within 300 paces of the town hall. It captured the St. Merri monastery and the adjoining streets and advanced far beyond the town hall so that together with the columns in the Cite it almost completely encircled the town hall. Only one way of approach, the quais of the right bank, remained open. In the south the Faubourg St. Jacques was completely reoccupied, communication with the Cite' was restored, reinforcements were sent there, and preparations were made for crossing to the right bank.

There was no time to be lost. The town hall, the revolutionary centre of Paris, was threatened and was bound to fall unless resolute measures were taken immediately.


http://www.marxists.org/archive/marx/works/1848/07/01.htm",,False,,t5_2qolz,1357274994.0,,,True,t3_15xlc2,http://www.reddit.com/r/communism/comments/15xlc2/engels_on_the_paris_1832_les_miserables_uprising/,
1355924905.0,21,moufawad-paul.blogspot.com,153wcf,M-L-M Mayhem!: Because and Despite of Identity Politics,31,10,5,http://www.reddit.com/r/communism/comments/153wcf/mlm_mayhem_because_and_despite_of_identity/,,,False,,t5_2qolz,False,,mao,False,t3_153wcf,http://moufawad-paul.blogspot.com/2012/12/because-and-despite-of-identity-politics.html,
1355171736.0,21,marxists.org,14mfe7," Erich Fromm's Marxism, Psychoanalysis, and Reality (Frankfurt school)",31,10,15,http://www.reddit.com/r/communism/comments/14mfe7/erich_fromms_marxism_psychoanalysis_and_reality/,,,False,,t5_2qolz,False,,mao,False,t3_14mfe7,http://www.marxists.org/archive/fromm/works/1966/psychoanalysis.htm,
