created_utc,score,domain,id,title,ups,downs,num_comments,permalink,selftext,link_flair_text,over_18,thumbnail,subreddit_id,edited,link_flair_css_class,author_flair_css_class,is_self,name,url,distinguished
1371771136.0,190,self.communism,1gremb,Brazil's protests have become fascist,278,88,163,http://www.reddit.com/r/communism/comments/1gremb/brazils_protests_have_become_fascist/,"Hello comrades.  

I am here to give you information about what is currently going on in Brazil. I am brazilian, born and raised in the city of São Paulo, where I am currently speaking to you from.  

The first thing I will tell you is that you should not pay attention to what the rest of reddit is telling you about the protests, and from what I hear comrades around the world telling me about their media reports, do not listen to them either.  

The protests which are currently going on are severely dynamic, but they have taken a definite turn towards fascism.  

The context of the protest is as follows:  

The initial wave of protests were organized by the MPL, Movimento Passe-Livre, which is an autonomist anarchist movement, based primarily in public universities. [Their main goal is and always was free, public funded transportation](http://en.wikipedia.org/wiki/Free_public_transport). The protests were organized in response to (left-wing, social democrat/liberal PT Worker's Party) mayor Fernando Haddad's and (right-wing, conservative, social democrat in name only PSDB governor) Geraldo Alckimin's hikes in bus and metro fares.  

The protests were instantly joined by communist parties PSTU, PSOL and PCB. The MPL, due their anarchist ideology, denounced party participation. This will become important later on.  

The media, at first, launched a total offensive against the protests, accusing it of vandalism, and of being made-up by extreme leftists. [This is a prime example](http://www.youtube.com/watch?feature=player_embedded&amp;v=luLzhtSYWC4). They justified the actions of the armed Military Police of Brazil (which is a Gendarme), which was, at the time, shooting rubber bullets at people's faces (which is lethal), beating up primarily women, using lots of tear gas and pepper spray to disperse the movement, as well as several intimidation tactics, such as baseless arrests (including the famous arrests for vinegar posession).  

The media realized that despite all of their efforts, the movement had a popular agenda and had been garnering support accross progressive sections of the population. [One very popular ultra-conservative pig-loving anchor attempted to ask the extremely loaded question to his viewers: do you support vandalism in ongoing protests?](http://sphotos-g.ak.fbcdn.net/hphotos-ak-frc1/p480x480/600742_502485453138395_1652625808_n.jpg) only to have his primarily reactionary audience humiliate him live by voting yes. The media, realizing they could no longer discredit the movement, and noticing that their most reactionary viewers were ready to take the street, switched strategies.  

[As I predicted in this post](http://www.reddit.com/r/communism/comments/1ggzfy/stand_up_with_the_proletarians_of_brazil_spread/cakfwgv), the raging anti-communist pundit [withdrew his previous opinion and started favoring the protests](http://cbn.globoradio.globo.com/comentaristas/arnaldo-jabor/2013/06/17/AMIGOS-EU-ERREI-E-MUITO-MAIS-DO-QUE-20-CENTAVOS.htm), but also started claiming that the protests were about ""much more"", and started to tell his viewers that the protests were about the long running list of anti-leftist complaints that were traditionally presented by the media against the left leaning worker's party and used electorally by the right-wing PSDB. The rest of the media did exactly the same thing. They even set up the narrative on the [international level, using this video that became the means through which reddit became aware of the protests](https://www.youtube.com/watch?feature=player_embedded&amp;v=AIBYEXLGdSg). This would later serve to legitimize the fascist coup in the eyes of the international audience.  

Now here is the tricky part. As I said in a [previous post about that particular video](http://www.reddit.com/r/communism/comments/1ggzfy/stand_up_with_the_proletarians_of_brazil_spread/cak6y5g) you will notice that there is nothing intrinsically socialist about the video. Socialists, just as much as conservatives, are loathe to corruption, wasteful spending and the degradation of public services. HOWEVER, this has to be looked at in the context that the media has built over the years that the semi-leftist PT government has been in the presidency of the country.  

Maybe one example most socialists here will be more familiar with is the [Venezuelan media and it's participation in the attempted 2002 coup against Hugo Chavez, who was a friend to pink-tide brazilian president Lula who was current president Dilma's predecessor](https://www.youtube.com/watch?v=3ZajyVas4Jg). What was the Venezuelan media's strategy? To constantly pound on the viewer's minds the idea that all leftism is corrupt, to fabricate accusations daily and to create the general feeling of constant crisis. The same has been absolutely true of Brazilian media since 2000.  

In fact, Rede Globo, which has the near-monopoly of TV audiences, which is owned by the billionaire heirs of Roberto Marinho, who had a personal fortune of 60 billion dollars, had previously attempted in 2007 to spark an [artificial ""popular"" march against the PT government led by several celebrities on its payroll](http://pt.wikipedia.org/wiki/Movimento_C%C3%ADvico_pelo_Direito_dos_Brasileiros).  

[**I SHOULD ALSO STRONGLY REMIND EVERYONE THAT THE 1964 MILITARY COUP WAS PRECEDED BY A MILLION STRONG REACTIONARY MARCH ON THE STATE OF GUANABARA ASKING FOR FASCISM AGAINST THE REFORMIST SOC-DEM JOÃO GOULART**](http://pt.wikipedia.org/wiki/Marcha_da_Fam%C3%ADlia_com_Deus_pela_Liberdade). So to those who are simply enamoured by any public protest thinking its impossible that the right can muster popular support, stop being so fucking naive.  

Now, you're probably asking, ""how can you suggest that the current protests are fascist? You're out of your mind!"". Well you are reading this and you are probably not in Brazil, watching how giddy the media is with the whole thing. You are probably not aware that the agenda against ""corruption"" was [suggested by the military chief of police when negotiating with MPL](http://ultimosegundo.ig.com.br/brasil/sp/2013-06-17/comandante-geral-da-pm-sugere-politizacao-de-protestos-em-sao-paulo.html) You are also probably not aware that the large majority of the opposition to the Worker's Party does not come from the radical left, as I wish it did, as MPL does, but it comes from PSDB and half of their electors are nostalgic of our fascist dictatorship. So they are going out there and [asking for a new one](http://sphotos-a.ak.fbcdn.net/hphotos-ak-frc3/q71/s720x720/972005_274587252681267_195263270_n.jpg).  

The sign says ""military intervention now. For the *democratic* government of civilians and military"" which is, I'm sure, how he remembers the 1964-1986 period to be.  

As I write this, thousands of right wing militants are [**BURNING RED FLAGS**](http://imgur.com/hHL7oPo) in Paulista Avenue and demanding the impeachment of brazilian president Dilma Roussef. These militants are those who think that democracy only exists when married to neoliberalism, so in her place they want to install PSDB or the brazilian equivalent of Pedro Carmona.  

Many leftists are only now waking up to this fact, there have been some interesting attempts to make people aware of the oncoming fascist coup by [some artists](http://sphotos-d.ak.fbcdn.net/hphotos-ak-prn1/p480x480/936406_251728094965815_2063686524_n.jpg), which are [conscious](http://www.pirikart.com.br/image/53331393870) of the media and right wing hijacking of the initial protests.  

Context: The toucan is the mascot for the right wing party. The other comic shows how the protest's agenda was hijacked by right wing demands.  

Now, the leftist parties have attempted to reclaim their movement and to fight against the reactionary agenda which always masquerades as ""apolitical"" demands for the moralization of politics. The right wing and the media have as such appropriated the anarchist ""anti-party"" discourse to denounce the left-wing in the protests, and some radical right wingers are demanding the extinction of parties, much like the 1964 military dictatorship proceeded to do. MPL and the anarchists are failing to react to this and are fueling the right wing rhetoric.  

There are also sections of the left which are too isolated in their group of friends and comrades to realize that the majority of people participating in the marches are not their friends. The majority of people joined in after the calls of reactionary media pundits. In many cities which the protests were not started by the left the protests are solely about the right wing protesting against left-politics. Do not be naive, communists would not gather up and protest near [former president Lula's house](http://oglobo.globo.com/pais/manifestantes-protestam-perto-da-casa-de-lula-em-sao-bernardo-8739640).  

Meanwhile, the Federation of Industries of São Paulo State (a business owner union, if there was ever full fascism in an organisation, its this one) is [supporting the protests](http://www.youtube.com/watch?v=XTydPLKxUbw). The brazilian Pedro Carmona sharpens his fangs.  

So I find it extremely upsetting that clueless redditors, especially those who claim to be socialist inclined, are basically providing international support for a fascist coup.  

So when the judiciary, which the media has built up as the great moralizing institution, its hero being the Supreme Court Justice Joaquim Barbosa, does some kind of maneuver to oust the left-leaning Dilma Roussef in favor of elections or whatever that bring back the neo-liberal PSDB to power, the international community will be ready to validate the coup. I should remind you all that this is the [textbook tactic of 21st century fascism, as taught to us by Honduras](http://en.wikipedia.org/wiki/2009_Honduran_constitutional_crisis).  

Brazil is in danger of going fascist, and I am sick of clueless foreigners which find out about what is going on through some stupid youtube video sponsored by some think tank like the Millenium Institute or by the brazilian equivalent of Miami Cubans and think that this is an overall positive development.  

Reddit disgusts me.    


",,False,,t5_2qolz,1371800987.0,,hero,True,t3_1gremb,http://www.reddit.com/r/communism/comments/1gremb/brazils_protests_have_become_fascist/,
1365781959.0,152,i.imgur.com,1c7n6m,Happy Yuri Gagarin Day Comrades!,193,41,13,http://www.reddit.com/r/communism/comments/1c7n6m/happy_yuri_gagarin_day_comrades/,,,False,,t5_2qolz,False,,stalin,False,t3_1c7n6m,http://i.imgur.com/8EjK404.jpg,
1350156905.0,145,i.imgur.com,11fd1e,"""Free Pussy Riot!!"" ""Leah-Lynn Plante? Who is that?"" Because state repression is only wrong when Russia does it.",212,67,40,http://www.reddit.com/r/communism/comments/11fd1e/free_pussy_riot_leahlynn_plante_who_is_that/,,,False,,t5_2qolz,False,,redstar,False,t3_11fd1e,http://i.imgur.com/R0Ynn.jpg,
1343001351.0,141,i.imgur.com,wzllb,"Looked up ""Communist Wallpaper""",174,33,12,http://www.reddit.com/r/communism/comments/wzllb/looked_up_communist_wallpaper/,,,False,,t5_2qolz,False,,rosa,False,t3_wzllb,http://i.imgur.com/UysjU.jpg,
1370985442.0,134,i.imgur.com,1g5eo6,Old woman with grey hair helps the protestors by sling shot in Turkey.,157,23,1,http://www.reddit.com/r/communism/comments/1g5eo6/old_woman_with_grey_hair_helps_the_protestors_by/,,,False,,t5_2qolz,False,,stalin,False,t3_1g5eo6,http://i.imgur.com/3qNw7a6.jpg,
1361483136.0,123,self.communism,18z9t2,EMERGENCY! POLICE TRYING TO MURDER AMERICAN COMMUNIST REVOLUTIONARY! EVERYONE WHO SEES THIS NEEDS TO COME HERE NOW TO SAVE HIS LIFE,167,44,22,http://www.reddit.com/r/communism/comments/18z9t2/emergency_police_trying_to_murder_american/,"Got you attention? Good, I think the situation merits the caps.

http://kasamaproject.org/repression/4402-emergency-fight-to-save-the-life-of-kevin-rashid-johnson

The police have posioned Kevin Rashid and they are refusing him medical attention. Call them now and put as much presure on them as possible. Spread this everywhere, every corner of reddit from the Leftists to the vaguely left-liberal. Heck maybe even Anon, we need as many people as possible to save the life of a real life communist revolutionary. Mods, please pin this or advertise this as much as you can.

I made an article that has links to all the information released so far, please post more information here so I can update it and remember, I am fucking busy tonight and regardless I have spent about 5 hours spreading this on the internet, I am not doing this for my health, I am doing this because a comrade might die if I don't. So please spread this article around

http://aroundthepear.blogspot.com/2013/02/emergency-police-attempting-to-murder.html",,False,,t5_2qolz,1361494582.0,,,True,t3_18z9t2,http://www.reddit.com/r/communism/comments/18z9t2/emergency_police_trying_to_murder_american/,
1360722215.0,118,i.imgur.com,18f2q0,My successful pilgrimage.,164,46,56,http://www.reddit.com/r/communism/comments/18f2q0/my_successful_pilgrimage/,,,False,,t5_2qolz,False,,,False,t3_18f2q0,http://i.imgur.com/v0tPjJz.jpg,
1362521056.0,107,bbc.co.uk,19qf7x,Hugo Chávez dies,135,28,22,http://www.reddit.com/r/communism/comments/19qf7x/hugo_chávez_dies/,,,False,,t5_2qolz,False,,mao,False,t3_19qf7x,http://www.bbc.co.uk/news/world-latin-america-21679053,
1340502027.0,103,imgur.com,vi983,I love election years in the US,154,51,9,http://www.reddit.com/r/communism/comments/vi983/i_love_election_years_in_the_us/,,,False,,t5_2qolz,False,,,False,t3_vi983,http://imgur.com/FJiR8,
1337974728.0,104,i.imgur.com,u4xfz,"Found this beauty browsing r/pics, I think we can all appreciate this",125,21,3,http://www.reddit.com/r/communism/comments/u4xfz/found_this_beauty_browsing_rpics_i_think_we_can/,,,False,,t5_2qolz,False,,lenin,False,t3_u4xfz,http://i.imgur.com/PSRok.jpg,
1332963444.0,103,i.imgur.com,ri051,"Scumbag pope (x-post from r/atheism, this belongs here)",137,34,34,http://www.reddit.com/r/communism/comments/ri051/scumbag_pope_xpost_from_ratheism_this_belongs_here/,,,False,,t5_2qolz,False,,redstar,False,t3_ri051,http://i.imgur.com/2Wv8y.jpg,
1367761710.0,101,self.communism,1dqbdk,"Happy birthday, comrade Marx!",119,18,6,http://www.reddit.com/r/communism/comments/1dqbdk/happy_birthday_comrade_marx/,[[1]](http://i.imgur.com/9LFV3be.jpg) [[2]](http://i.imgur.com/w8rZRGe.jpg) [[3]](http://i.imgur.com/xGgvuH4.jpg),,False,,t5_2qolz,False,,redstar,True,t3_1dqbdk,http://www.reddit.com/r/communism/comments/1dqbdk/happy_birthday_comrade_marx/,
1366603638.0,102,self.communism,1cuej6,"Happy Birthday, Lenin!",115,13,12,http://www.reddit.com/r/communism/comments/1cuej6/happy_birthday_lenin/,,,False,,t5_2qolz,False,,mao,True,t3_1cuej6,http://www.reddit.com/r/communism/comments/1cuej6/happy_birthday_lenin/,
1350146967.0,102,i.imgur.com,11f49l,Wise words by comrade Lenin,150,48,19,http://www.reddit.com/r/communism/comments/11f49l/wise_words_by_comrade_lenin/,,,False,,t5_2qolz,False,,redstar,False,t3_11f49l,http://i.imgur.com/I8Hv9.jpg,
1332088723.0,102,nataliedee.com,r2582,Proletarian Spider,128,26,10,http://www.reddit.com/r/communism/comments/r2582/proletarian_spider/,,,False,,t5_2qolz,False,,mao,False,t3_r2582,http://www.nataliedee.com/052510/the-spider-and-mans-inhumanity-to-man.jpg,
1343182639.0,96,imgur.com,x3xdo,Sally Ride died today. She was not the first woman in space.,128,32,15,http://www.reddit.com/r/communism/comments/x3xdo/sally_ride_died_today_she_was_not_the_first_woman/,,,False,,t5_2qolz,False,,lenin,False,t3_x3xdo,http://imgur.com/ZUkIX,
1367191685.0,97,imgur.com,1dauox,"Ready for International Workers' Day, Universidad Nacional de Colombia.",108,11,7,http://www.reddit.com/r/communism/comments/1dauox/ready_for_international_workers_day_universidad/,,,False,,t5_2qolz,False,,,False,t3_1dauox,http://imgur.com/VAilImu,
1363935845.0,92,imgur.com,1asdbi,"A Partisan Screaming ""Death to Fascism, Freedom to the People!"" Before his Execution by the Nazis",114,22,15,http://www.reddit.com/r/communism/comments/1asdbi/a_partisan_screaming_death_to_fascism_freedom_to/,,,False,,t5_2qolz,False,,,False,t3_1asdbi,http://imgur.com/56XiHAd,
1376417171.0,90,en.wikipedia.org,1kajjf,Happy 87th birthday to comrade Castro!,110,20,2,http://www.reddit.com/r/communism/comments/1kajjf/happy_87th_birthday_to_comrade_castro/,,,False,,t5_2qolz,False,,rosa,False,t3_1kajjf,http://en.wikipedia.org/wiki/Fidel_Castro,
1365422690.0,91,isthatcherdeadyet.co.uk,1bwuwm,Is Thatcher Dead Yet?,147,56,54,http://www.reddit.com/r/communism/comments/1bwuwm/is_thatcher_dead_yet/,,,False,,t5_2qolz,False,,redstar,False,t3_1bwuwm,http://www.isthatcherdeadyet.co.uk/,
1356391049.0,90,self.communism,15e9cd,Twas the night before Christmas...,135,45,23,http://www.reddit.com/r/communism/comments/15e9cd/twas_the_night_before_christmas/,"Twas the night before Christmas and all through the land,  
The workers were stirring - the time was at hand!  
The councils were meeting, more attended than ever;  
The masses were ready -uprise now or never.  
The people were angry and prepared to fight,  
Cries of ""Revolution!"" rang into the night.  


And all of my comrades from Council 19,  
Both Party and movement and all inbetween,   
Took to the streets and rose up in a clatter,  
Bourgeois illusions were thoroughly shatterred.  
We marched down Bay Street with our fists in the air,  
Then a cadre behind me set off a flare.  


We knew by the light that it was time to go,  
So we donned our face masks, just partly for show.  
We shouldered our weapons- some rifles, some sticks;  
Disorganised comrades began throwing bricks.  
""The state's not a window""; this lesson we knew,  
Pigs fell back ahead, we advanced for round two.  


I thought back to our meeting some hours before,  
Where a communist comrade had taken the floor.  
""To Marx! To Hoxha! To Mao and to Lenin!  
To Engels! To Luxemburg! To Che and to Stalin!""  
we cheered all their names and pledged to create,  
A communist world by smashing the state.  


But now in the moment the pig lines had reformed,  
Bolstered by army; we'd been misinformed!  
I thought that the soldiers had all deserted,  
As into their ranks, comrades were inserted.  
But before me I saw, as clear as the day,  
Some soldiers had stayed and had entered the fray.  


I drew my last breath, I thought we were done.  
Political power; it grows from a gun.  
Without an army the people have nothing;  
Could it have been that the Party was bluffing?  
But to my delight, as more shots rang out,  
It was only the pigs who started to shout.  


As the confusion and piggies began to die down,  
From the army ahead we could hear a sound.  
Songs as red as the blood that the workers had shed,  
Were carried up-street and entered our heads.  
The song they were singing we knew right away,  
The Internationale had carried the day.  


And Council 19, we advanced again,  
The soldiers, we found, composed Council 10.  
The battle was won, the war just beginning.  
Against the state and the bosses we clearly were winning.  
Main Street had been cleared, our objective was won,  
In the distance I saw a rising red sun.  


But if this night sounds too good to be true,  
I'll pause and I'll say: It could happen to you!  
Nothing written above should seem like fiction,  
If anything it should be viewed as prediction  
The masses of workers are angry and waiting,  
The people just need some more agitating.  
And so I propose: get off your tush,  
As Lenin reminds us, history's worth a push!  ",,False,,t5_2qolz,False,,mao,True,t3_15e9cd,http://www.reddit.com/r/communism/comments/15e9cd/twas_the_night_before_christmas/,
1341257716.0,95,i.imgur.com,vxt2x,4 out of 5 communist leaders agree,129,34,43,http://www.reddit.com/r/communism/comments/vxt2x/4_out_of_5_communist_leaders_agree/,,,False,,t5_2qolz,False,,stalin,False,t3_vxt2x,http://i.imgur.com/NZpnD.jpg,
1363826566.0,91,self.communism,1ap9gy,There's a nice little cold war brewing in my high school. ,117,26,83,http://www.reddit.com/r/communism/comments/1ap9gy/theres_a_nice_little_cold_war_brewing_in_my_high/,"Gee, where to start...

A few months ago, the majority of people at my high school first discovered that I was a communist. I usually bring socialist/communist books and wear an assortment of soviet pins every day. I even made a bust of Lenin in my sculpture class. It is of no surprise that many people took notice. My classmates would ask me softball questions about communism and things of that nature. They would always be surprised that the things they were taught in school were a lie (although, communist education was limited to one or two questions on a test.) Since more and more people were asking me questions, I could hardly keep track of them all. So I decided I would ""publish"" a one page communist newsletter that would hopefully shed light on the truth about communism. 

The first newsletter was about capitalism. It just layed out all of the problems with capitalism and all of the harm it causes to the workers and the environment (for the ""green"" kids that were reading.) Apparently, a student or two showed an economics and history teacher. The rat who showed the teacher said that the teacher called my paper ""shit communist propaganda."" I don't have to telly you, but that really rustled my jimmies. 

My second newsletter was about the fundamentals of communism and debunking its misconceptions. Since those two papers have been released, history and economics teachers have been stepping up there anti communist lesson plans. More and more people come up to me and repeat the lies their teachers have shoved down their throats, i try to resist the best i can. Things have become very interesting around my high school and most of the teachers in my grade have heard of me and my ""cause."" 

I am *very* excited to see what is going to happen next...
",,False,,t5_2qolz,1363827034.0,,,True,t3_1ap9gy,http://www.reddit.com/r/communism/comments/1ap9gy/theres_a_nice_little_cold_war_brewing_in_my_high/,
1359934623.0,91,i.imgur.com,17u0vm,My girlfriend's mom said she found something in her closets for me. I really like her.,140,49,11,http://www.reddit.com/r/communism/comments/17u0vm/my_girlfriends_mom_said_she_found_something_in/,,,False,,t5_2qolz,False,,,False,t3_17u0vm,http://i.imgur.com/Ne8X0t5.jpg,
1363015195.0,87,self.communism,1a32wj,6000 glorious subscribers,109,22,32,http://www.reddit.com/r/communism/comments/1a32wj/6000_glorious_subscribers/,"Let us celebrate the fulfillment of the Five-year Plan. Onward, comrades!",,False,,t5_2qolz,False,,lenin,True,t3_1a32wj,http://www.reddit.com/r/communism/comments/1a32wj/6000_glorious_subscribers/,
1360447588.0,88,self.communism,187pik,"/r/communism's Official Position on Feminism, Once and For All",132,44,147,http://www.reddit.com/r/communism/comments/187pik/rcommunisms_official_position_on_feminism_once/,Misogyny doubleplusungood.,,False,,t5_2qolz,False,,redstar,True,t3_187pik,http://www.reddit.com/r/communism/comments/187pik/rcommunisms_official_position_on_feminism_once/,moderator
1373835190.0,87,i.imgur.com,1ian97,Vladimir Lenin rage quits a game of chess.,106,19,28,http://www.reddit.com/r/communism/comments/1ian97/vladimir_lenin_rage_quits_a_game_of_chess/,,,False,,t5_2qolz,False,,redstar,False,t3_1ian97,http://i.imgur.com/5P6GkKX.jpg,
1370164769.0,88,liveleak.com,1fig47,Turkish communists charge through the police.,104,16,12,http://www.reddit.com/r/communism/comments/1fig47/turkish_communists_charge_through_the_police/,,,False,,t5_2qolz,False,,redstar,False,t3_1fig47,http://www.liveleak.com/view?i=dc5_1370093547,
1360561908.0,87,thepiratebay.se,18alzd,"Comrades, please download and SEED my torrent consisting of 4000+ communist propaganda posters (Cuba, URSS, Chile)",105,18,46,http://www.reddit.com/r/communism/comments/18alzd/comrades_please_download_and_seed_my_torrent/,,,False,,t5_2qolz,False,,redstar,False,t3_18alzd,http://thepiratebay.se/torrent/8129531,
1359751986.0,79,imgur.com,17prkt,My wife went on a trip to Seattle last summer. I asked her to make one stop for me. She did not disappoint.,114,35,24,http://www.reddit.com/r/communism/comments/17prkt/my_wife_went_on_a_trip_to_seattle_last_summer_i/,,,False,,t5_2qolz,False,,redstar,False,t3_17prkt,http://imgur.com/a/JrEdS,
