created_utc,score,domain,id,title,ups,downs,num_comments,permalink,selftext,link_flair_text,over_18,thumbnail,subreddit_id,edited,link_flair_css_class,author_flair_css_class,is_self,name,url,distinguished
1371608992.0,5,self.confidence,1gmnor,Help with a confusing friendship that hurts my confidence?,6,1,4,http://www.reddit.com/r/confidence/comments/1gmnor/help_with_a_confusing_friendship_that_hurts_my/,"So me and my best friend live together, and we are both 20. I love him to death, and we have a great time. There's a major flaw in our friendship that really affects me thigh: he is the most stubborn person I know.
Whenever we get into any debate about something, he HAS to win. And he has this uncanny and annoying ability to turn anything I say around on me. I understand that I'm not a very good debater, and he knows it too; he uses it to his advantage all the time. Whenever he wins any argument, I look like a fool, and now I'm his best friend who ""doesn't have a lot of common sense."" Whenever he feels like he is even remotely beginning to lose, he immediately tries to change the subject, or even worse, accuse me of being weird or annoying because i'm arguing with him.
Again, we have our good times, and it's awesome living with him, but this stuff has lowered my confidence and self-esteem so much. Now, I feel like I'm wrong ALL the time, even when he's not around. I constantly avoid standing up for myself due to the fear of being put down again. All of my opinions feel invalid, and my perspective and likes/dislikes has started to become just like his and not my own; if I don't, I would of course be wrong.
He also jokes around often, calling me an idiot and telling me to shut up. Even though I know he's joking, this doesn't help much. I've started joking at myself  so I don't have to hear it from him.
I know I need to stand up for myself and talk to him about this, but trust me, he would make me look wrong again. There was one time where I did try to stand up for myself, but he immediately turned it around on me, aggressively, and accused me of being a bad friend and saying he's wrong all the time and not supporting him. After not knowing what to say, I immediately agreed and began to believe that myself. Now, whenever we talk about the ""dark times"" of our friendship, the whole conversation is about what I did wrong and me being the bad person at that time.

I'm so tired of him putting me down, but if I try to talk to him about it, he's only going to put me down more. I CANNOT seem to win with him. Any tips/advice on this stubborn of a best friend?

",,False,self,t5_2rmn5,False,,,True,t3_1gmnor,http://www.reddit.com/r/confidence/comments/1gmnor/help_with_a_confusing_friendship_that_hurts_my/,
1369869844.0,4,self.confidence,1fauxw,Meaning of life for a while,5,1,0,http://www.reddit.com/r/confidence/comments/1fauxw/meaning_of_life_for_a_while/,http://waltherpragerandphilosophy.blogspot.ro/2013/03/meaning-of-life-for-while.html,,False,self,t5_2rmn5,False,,,True,t3_1fauxw,http://www.reddit.com/r/confidence/comments/1fauxw/meaning_of_life_for_a_while/,
1369853047.0,4,self.confidence,1fa8tr,Job Interview Friday - any advice or tips?,6,2,2,http://www.reddit.com/r/confidence/comments/1fa8tr/job_interview_friday_any_advice_or_tips/,"I've got a job interview this Friday, and although I'm somewhat confident I'll get the position - I'm looking for any tips/advice to help me appear more confident? ",,False,self,t5_2rmn5,False,,,True,t3_1fa8tr,http://www.reddit.com/r/confidence/comments/1fa8tr/job_interview_friday_any_advice_or_tips/,
1368311580.0,4,self.confidence,1e5hn8,I cannot walk with confidence,5,1,7,http://www.reddit.com/r/confidence/comments/1e5hn8/i_cannot_walk_with_confidence/,"Since the beginning of the year, I have lost 30 lbs and gained some muscle.  For the first time in my life, I have a 6 pack.  I have also been working on my social anxiety.  

As far as my social anxiety goes, my looks were a huge part of it.  Now I go out a lot more that I feel more confidence with my body.

Just one problem - the way I walk.  This has been a problem for YEARS.  I am always self conscious about the way I walk and of course this makes me walk even weirder.  Several friends have called me out on it as well, which makes the problem even worse.

I know this sounds ridiculous but its a huge confidence loss if I cannot do something as simple as walk normal.",,False,self,t5_2rmn5,False,,,True,t3_1e5hn8,http://www.reddit.com/r/confidence/comments/1e5hn8/i_cannot_walk_with_confidence/,
1364644644.0,5,self.confidence,1bar5u,I need to stop comparing myself to others,6,1,5,http://www.reddit.com/r/confidence/comments/1bar5u/i_need_to_stop_comparing_myself_to_others/,"I'm a very short guy. All people I interact with in a daily basis are very tall.

The fact that I'm comparing myself to them is detrimental to my self-esteem and confidence in myself. Yes, people will tell me that I'm intelligent and turn to me for help.

I am in a central cycle of low confidence. All of this stems from that I feel inferior due to my lack of stature. I'm 5'2"" and 54kg. I used to have confidence - I didn't give a damn about a lot of stuff. I was loved and revered at school, but I cannot bring myself to the same standard as I used to be. ",,False,self,t5_2rmn5,False,,,True,t3_1bar5u,http://www.reddit.com/r/confidence/comments/1bar5u/i_need_to_stop_comparing_myself_to_others/,
1361935576.0,4,self.confidence,19azaa,How Do I Ask Others For Help?,6,2,4,http://www.reddit.com/r/confidence/comments/19azaa/how_do_i_ask_others_for_help/,"A close friend suggested I get involved with Reddit, so here I am. Madeline Koller, aged 19, college sophomore majoring in natural sciences and geographic information systems. MTF transsexual currently in transition (I pretty much live full time as a woman now and can start HRT at any time as soon as my income improves).

It kills me to ask others for help, to let people in on my problems. That's really the whole issue here. I was going to an out-of-state university. Things happened, I couldn't handle it, and I moved home. The college I'm going to now is a community college which is cheaper, but I'm still continually putting myself in debt, unfortunately (thankfully 80% of my units transferred or I'd be screwed). Ever since I moved back home I've been looking for work; with any luck I'll find something in the next two or three months (it's been six months already). To make matters worse, I have bipolar disorder, for which I've been medicated for the past two years. That in itself increases my stress and anxiety exponentially.

I have NO GODDAMNED IDEA how to convey to others, even to my own family, that I'm not strong enough to do this on my own. I feel like, to even tell my parents that I'm this vulnerable, would put serious pressure on them and I can't bear to do that. It's bad enough they've had to deal with my bipolar disorder, my transsexuality and the subsequent breakdowns I've had over the past six months as it is.

But to be honest, my mind can't really handle it. I can't handle this putting myself into debt, this being unable to find work, this constant juggling of fiances, this continual struggle while those around me seem to be able to handle the real world effortlessly. It's too much to swallow all at once. I don't get how people can do it so easily.

I just wish someone would actually take the time to work with me, so that I don't feel so alone in what is truly an uphill battle. My therapist is really only there to vent to and my psychiatrist is only there to prescribe drugs. I need more than that. And to do that, I need to be able to, well, ask someone if they can take the time to work with me.

I guess that's it, really. That's my current situation: needing help understanding how life works but not knowing how to ask for it. I don't know how to better put it. ",,False,self,t5_2rmn5,False,,,True,t3_19azaa,http://www.reddit.com/r/confidence/comments/19azaa/how_do_i_ask_others_for_help/,
1358161682.0,5,self.confidence,16jobp,"You can still care what others think, just don't let if affect your actions negatively.",6,1,0,http://www.reddit.com/r/confidence/comments/16jobp/you_can_still_care_what_others_think_just_dont/,,,False,self,t5_2rmn5,False,,,True,t3_16jobp,http://www.reddit.com/r/confidence/comments/16jobp/you_can_still_care_what_others_think_just_dont/,
1354085268.0,6,21articles.com,13x8qr,About Confidence: How to Say Yes to You | 21 Articles,10,4,0,http://www.reddit.com/r/confidence/comments/13x8qr/about_confidence_how_to_say_yes_to_you_21_articles/,,,False,http://b.thumbs.redditmedia.com/ze3HcBe7oxS8JKQ7.jpg,t5_2rmn5,False,,,False,t3_13x8qr,http://www.21articles.com/Article/992/About-Confidence-How-to-Say-Yes-to-You,
1350158943.0,7,self.confidence,11fevk, [Q] Applying to a Highschool for the Arts. Feeling insecure.,8,1,4,http://www.reddit.com/r/confidence/comments/11fevk/q_applying_to_a_highschool_for_the_arts_feeling/,"Alright, so I know I have a very slim chance of getting in. They only take a small amount of new students each year, and this is kind of adding to a weird pool of anxiety I have.

I feel like I'm not good enough, and that I'll definitely be overshadowed.
It's come to a point where if I so much look at a single piece of artwork, it puts a damper on my mood. I even started to scout for pieces of portfolios posted online. There were none, and that made it worse.

It's kind of affecting my chances of being accepted. Whenever I try to draw something, I feel like it's inferior. I only have so much time to fulfill the aspects needed for my portfolio

What can I do to maybe alleviate the insecureness?",,False,self,t5_2rmn5,False,,,True,t3_11fevk,http://www.reddit.com/r/confidence/comments/11fevk/q_applying_to_a_highschool_for_the_arts_feeling/,
1349643538.0,3,self.confidence,113qcp,"New subscriber, need help",8,5,3,http://www.reddit.com/r/confidence/comments/113qcp/new_subscriber_need_help/,"Hi guys, I subscribed to here because, well, I really need to develop confidence. I guess that part's predictable enough though. I'm a 20 yr old guy who has never really developed much in the way of self-confidence (not exactly sure why, could be one of a few factors or a combination, I don't like to guess anyway). 

I've sought help for it through 2 therapists, neither have really worked unfortunately though, I still get kinda bad social anxiety, I still hate the fact I have Aspergers and all the related social clumsiness (and some days, honestly feel very bitter indeed about it) and just feel I cannot find confidence the way I currently am. The funny thing is that I know all the things I'm doing wrong as well, I know my mind focuses on the negative social interactions I have and force me to over-analyse them, I know I beat myself up too easily and too much for my mistakes, I know that in order to become confident I have to change my mindset. The kicker is that I just CANNOT seem to do this, no matter how hard I try I cannot force my mind not to keep focusing on the bad, I have tried to do this with therapists via CBT and Mindfulness, neither worked, same with individual efforts.

So, to put simply (and thanks very much if you read all that by the way), what do? I know I have to change my mindset in order to have a better opinion of myself and have a better experience in life, but, the mindset I have already just seems to be too stubborn to shift...",,False,self,t5_2rmn5,False,,,True,t3_113qcp,http://www.reddit.com/r/confidence/comments/113qcp/new_subscriber_need_help/,
1347295889.0,6,self.confidence,znro8,Hobby to help confidence and make new friends,9,3,8,http://www.reddit.com/r/confidence/comments/znro8/hobby_to_help_confidence_and_make_new_friends/,"So a little about me. I am a 26 year old male and I have graduated from college. While in college I mainly focused on studying and made a couple of friends, but I felt like I should have made more. I now have a job that actually uses my degree. So I guess I should feel fortunate; Though there are times I do not like my job. I am actually preparing to take my gre (I am fairly confident I will do well).

In college and before, I used to play a lot of video games. I think the main video game would have to have been WoW. I played WoW off and on for like 6 years, usually playing competitively in arena (quite well too at like a 2.2 k rating ~top 5% of the wow community). I also played starcraft 2 a lot and was a platinum/diamond player (maybe top ~30%). So I like to be competitive.

Now to bring this back to reality. I feel like I wasted a very large portion of my life playing video games that are only fun for some time and then I have to come back to reality (I actually quit WoW because it started to feel like a second job). It kind of sucks. I feel like I have a very hard time relating to people, especially girls. To me, I think this is the link in my life that I need. To find a wonderful woman for me, and great friends. Most of my friends have moved away too.

What kind of hobby would you recommend? I used to fence in high school. I think I was mediocre at it, but I think with practice and hard work I believe I can do well. I particularly do not mind working hard.

Edit: Oh and I might add that I have been running to try to get back into shape as well. I am so far working on training for a 5k. I can run like 2.4 miles now in 24 minutes, so I think I am doing well there too. I was thinking fencing would be good also because my legs are fairly strong, and my upper body is not as much.",,False,self,t5_2rmn5,False,,,True,t3_znro8,http://www.reddit.com/r/confidence/comments/znro8/hobby_to_help_confidence_and_make_new_friends/,
1343298224.0,5,selfexceed.com,x6lz7,How to not worry about what others think of you,11,6,2,http://www.reddit.com/r/confidence/comments/x6lz7/how_to_not_worry_about_what_others_think_of_you/,,,False,http://f.thumbs.redditmedia.com/Cvaa3t3QImFOBJcY.jpg,t5_2rmn5,False,,,False,t3_x6lz7,http://selfexceed.com/personality/how-to-not-worry-about-what-others-think/,
1334784829.0,6,how2bhappy.org,sgp00,Boost confidence!,7,1,0,http://www.reddit.com/r/confidence/comments/sgp00/boost_confidence/,,,False,http://a.thumbs.redditmedia.com/dON1F8taH4s7bQ9x.jpg,t5_2rmn5,False,,,False,t3_sgp00,http://www.how2bhappy.org/confidence/,
1365376868.0,4,self.confidence,1bvqsd,I'm nervous about getting a job,5,1,10,http://www.reddit.com/r/confidence/comments/1bvqsd/im_nervous_about_getting_a_job/,"Sorry about this rant, never really had a job, only potato sorting and working at a visitor centre during the summer. Now my first year at Uni is nearly at an end, i should get a job over the summer as i'm incredibly poor, but I'm really nervous, working in sales seems like my idea of hell. I had exactly these kind of thoughts when I was looking for a job last year when i didnt get into Uni (my darkest year so far)",,False,self,t5_2rmn5,False,,,True,t3_1bvqsd,http://www.reddit.com/r/confidence/comments/1bvqsd/im_nervous_about_getting_a_job/,
1364700265.0,3,self.confidence,1bc9aa,[Q] I worry about everything. How can I let things just happen and gain some confidence?,4,1,0,http://www.reddit.com/r/confidence/comments/1bc9aa/q_i_worry_about_everything_how_can_i_let_things/,"I try to be really carefree and not care about the little things, but I always tend to worry. I'm not panicky, I just often seem to imagine the worth thing possible happening. How can I stop worrying? I'm in high school and I think confidence will help me academically and athletically (I play varsity baseball and am fighting for a starting spot, which doesn't help.) Also, sorry I'm not sure if here or /r/socialskills is the best place to post this.",,False,self,t5_2rmn5,False,,,True,t3_1bc9aa,http://www.reddit.com/r/confidence/comments/1bc9aa/q_i_worry_about_everything_how_can_i_let_things/,
1344050490.0,4,self.confidence,xnlpi,"Anyone Have Conversation and/or Confidence-building Techniques They Can Share? I'm 23, F, with Social Anxiety, especially Around Guys I'm Attracted to. :(",6,2,3,http://www.reddit.com/r/confidence/comments/xnlpi/anyone_have_conversation_andor_confidencebuilding/,"I've never dated or had a bf in my life. People have said I'm cute/really pretty so I know it isn't my looks, but I have suffered for years from social anxiety. My SA gets particularly worse around men (especially those I find attractive). So I often cope with my fears by avoiding what scares me, ex. if a guy I find myself attracted to is in a room, I won't flirt with him because 

**#1.** I don't know how to flirt, and eye contact makes me SOOO nervous, as does smiling at guys.

**#2.** I mess up in conversations with guys I'm attracted to. Well, everyone but it's 100000x worse with cute guys. I'll stutter, blank out, or say something really lame or stupid. (sometimes I'll do all 4)

I realize it's a lot to hope a guy whom I don't know will see my shyness/anxiety for what it is, and not as rejection. I also realize most guys will dismiss me in life, and assume I'm disinterested, cold, or unavailable. Also, I don't see myself approaching guys in the near or distant future either. So yeah, I guess I'll be forever alone. Despite this, I'd still like to learn how to be a better conversationalist and build my confidence. 

If you have any recommendations please leave a comment or msg me. Thanks",,False,self,t5_2rmn5,False,,,True,t3_xnlpi,http://www.reddit.com/r/confidence/comments/xnlpi/anyone_have_conversation_andor_confidencebuilding/,
1344036029.0,4,self.confidence,xn982,Need help with shaky/wavering voice on phone,8,4,2,http://www.reddit.com/r/confidence/comments/xn982/need_help_with_shakywavering_voice_on_phone/,"Hi r/confidence:

I feel that I am normally a very confident person. I have no problem with talking to strangers, giving presentations, networking, etc..

I used to have really, really, bad anxiety. Super bad. As a child if someone talked to me, I would begin to cry. As I got older I did various leadership roles, confidence went up, etc etc. 

I am currently a college grad, and after I lost my new job due to a lack of funding, I am back on the job hunt. I find there is one thing I cannot kick: a wavering, nervous, about-to-cry sounding voice when I talk to a potential employer ON THE PHONE. In person, no problem. Once I'm on the phone I sound terrible. I think it's even more sad because I can't kick this tone of voice the entire conversation, even though I know what I am saying is right, correct, whatever. 

I really, really, need help with this. I have to do ""cold-calling"" aka just call up companies and ask to speak to HR reps or Managers.. etc.. and I just sound like I am about to break down crying at any moment. Does anyone have any tips possibly for helping me get over this?

I am rambling now, sorry. Thanks for reading!",,False,self,t5_2rmn5,False,,,True,t3_xn982,http://www.reddit.com/r/confidence/comments/xn982/need_help_with_shakywavering_voice_on_phone/,
1327299926.0,5,self.confidence,oskaq,I lack in confidence in many areas of my life. I am a really shy guy.,5,0,2,http://www.reddit.com/r/confidence/comments/oskaq/i_lack_in_confidence_in_many_areas_of_my_life_i/,"Here is the problem that i have. Whenever i talk when i have low confidence or in some stress, my voice becomes low and there is some inhibiting sensation that my wind pipe is closed like sensation. And then i can't talk properly. Maybe it's a childhood conditioning or i learnt it from my mother. How do i get rid of it?",,False,self,t5_2rmn5,False,,,True,t3_oskaq,http://www.reddit.com/r/confidence/comments/oskaq/i_lack_in_confidence_in_many_areas_of_my_life_i/,
1359483954.0,3,postmasculine.com,17ib2o,5 Problems With Self Help,11,8,1,http://www.reddit.com/r/confidence/comments/17ib2o/5_problems_with_self_help/,,,False,default,t5_2rmn5,False,,,False,t3_17ib2o,http://postmasculine.com/self-help,
1355281030.0,4,self.confidence,14pcae,My confidence is derailed when I'm even a little tired or stressed,5,1,3,http://www.reddit.com/r/confidence/comments/14pcae/my_confidence_is_derailed_when_im_even_a_little/,As the title explains I often have terrible confidence if I'm a little bit tired or stressing over something. I've tried a lot of different tips and tricks to keep myself happy and confident but if I'm tired or stressed I might as well be doing nothing. What can I do?,,False,self,t5_2rmn5,False,,,True,t3_14pcae,http://www.reddit.com/r/confidence/comments/14pcae/my_confidence_is_derailed_when_im_even_a_little/,
1355109392.0,2,pay.reddit.com,14l0a9,Guide from a Redditor... hope this helps some people out!,4,2,0,http://www.reddit.com/r/confidence/comments/14l0a9/guide_from_a_redditor_hope_this_helps_some_people/,,,False,default,t5_2rmn5,False,,,False,t3_14l0a9,https://pay.reddit.com/r/socialskills/comments/14j3y2/how_to_stop_being_the_guy_that_rarely_says/c7dmlqe,
1351035436.0,5,self.confidence,11z4kw,"Thought I'd post here. Me, a young man with a problem regarding job confidence.",8,3,9,http://www.reddit.com/r/confidence/comments/11z4kw/thought_id_post_here_me_a_young_man_with_a/,"I am a seventeen year old high school senior who, for the life of me, can't figure out why I am so afraid of getting a job. I can't even begin to contemplate on why I feel this way. I just cannot see myself getting a job. Perhaps I'm afraid of it because it's new, I'm afraid of what my potential coworkers would think/do (gee this sounds like anxiety). I don't feel like I have enough responsibility or skill to handle a job of ANY kind. I am scared to death of working in places like supermarkets, or restaurants. I also feel guilty because all of my other friends have jobs and money, whereas I do not. But even with that in mind, I cant work up the confidence to pick up the phone, and dial a company to ask about employment. I wouldnt even be able to choose. Maybe im afraid I'll make a fool of myself and become embarassed. What is it about me that makes me feel this way and how can I overcome it? I have confidence in other things, (I am a musician and a thespian/actor) but this I just cannot figure out. Can anyone help me?",,False,self,t5_2rmn5,False,,,True,t3_11z4kw,http://www.reddit.com/r/confidence/comments/11z4kw/thought_id_post_here_me_a_young_man_with_a/,
1350877730.0,5,self.confidence,11vnoe,(x-post)How to be more Assertive?,7,2,5,http://www.reddit.com/r/confidence/comments/11vnoe/xposthow_to_be_more_assertive/,"I've noticed that for that recently, my friends have started telling me to be ""assertive"". Usually they tell me to after having discussing a plan, arguing, or after watching me holding/leading a club meeting. So what do they mean by be more assertive? What can I do to become more assertive, have a presence, etc?",,False,self,t5_2rmn5,False,,,True,t3_11vnoe,http://www.reddit.com/r/confidence/comments/11vnoe/xposthow_to_be_more_assertive/,
1350620852.0,5,self.confidence,11qd26,How to get respect?,10,5,9,http://www.reddit.com/r/confidence/comments/11qd26/how_to_get_respect/,"I have many friends, and I like to joke around with them, but they can never exactly take me seriously and when do they do understand me seriously, they disregard it. How do I get respect?",,False,self,t5_2rmn5,False,,,True,t3_11qd26,http://www.reddit.com/r/confidence/comments/11qd26/how_to_get_respect/,
1347424111.0,3,self.confidence,zr1bz,[Q] How should i do for stop biting my nails? I need help...,6,3,20,http://www.reddit.com/r/confidence/comments/zr1bz/q_how_should_i_do_for_stop_biting_my_nails_i_need/,"Hi every1 guys. I am in a travel of self-improving with myself, and i'm working really hard for it. In 9 mounths i've changed quite a lot.

I wasnt able to talk easily with people, and my confidence with girls was zero. With this trip i've worked myself at a good level. 

One thing anyway, is keep strugling me, and i hate it so much, it's causing me to lose confidence a lot of times, when im in front of people...

i just can't stop biting my NAILS... i don't know how many times i tryed it...

So, i think this 1 is the right sub-redit to ask, because this problem is, as i told you already, destroying my confidence, i fell scared by the look of the people...

In the past, it happened few times, that people looked at my nails and asked me what was a problem with me... i felt so ashamed...

Anyway now, i'm trying to fix this problem, but it's really hard... 

So im asking for your help. 

Thanks every1.

- Aiyuris.",,False,self,t5_2rmn5,False,,,True,t3_zr1bz,http://www.reddit.com/r/confidence/comments/zr1bz/q_how_should_i_do_for_stop_biting_my_nails_i_need/,
1344573676.0,4,self.confidence,xzc4t,Really need some advice as to how to get my confidence back,9,5,2,http://www.reddit.com/r/confidence/comments/xzc4t/really_need_some_advice_as_to_how_to_get_my/,"I'm a pretty young gou (17) and I'm great at sports, I've had 4 girlfriends (some of which are women who I thought would never go for me) and most people say I'm a very nice guy. So I should be a very confident person right? Well, I've been slowly losing any confidence I have. why? It's been 8 months since I've had any sexual encounter with a woman, I'm not training as much as I should, am lazy and very sensitive to any insult I receive. If I even make eye contact with another woman, I imdeaitly assume they take me to be a very ugly person, or think I'm a creep. I hate this state of mind I'm in and would really love to change it, because it's causing harm to my social skills. I so afraid of talking to new people, and I degrade myself so much. How can I turn this around?",,False,self,t5_2rmn5,False,,,True,t3_xzc4t,http://www.reddit.com/r/confidence/comments/xzc4t/really_need_some_advice_as_to_how_to_get_my/,
