created_utc,score,domain,id,title,ups,downs,num_comments,permalink,selftext,link_flair_text,over_18,thumbnail,subreddit_id,edited,link_flair_css_class,author_flair_css_class,is_self,name,url,distinguished
1370017979.0,12,self.confidence,1feu5l,[Q] What is a good book for building up and sustaining self confidence for the long term?,15,3,2,http://www.reddit.com/r/confidence/comments/1feu5l/q_what_is_a_good_book_for_building_up_and/,"Hi Reddit! I came to a realization that I sometimes tie my self worth to others, my relationships, how others perceive me or material goods.  I am tired of the emotional rollercoasters associated with this mentality and would like to change it.  Does anyone know of a good book or online tutorial/article, preferably with exercises, that can be used to help build self confidence?  I know it may not be easy but I am willing to work for it because I know how important it is.  Thank you!",,False,self,t5_2rmn5,False,,,True,t3_1feu5l,http://www.reddit.com/r/confidence/comments/1feu5l/q_what_is_a_good_book_for_building_up_and/,
1367826614.0,12,self.confidence,1ds5de,A little help?,17,5,7,http://www.reddit.com/r/confidence/comments/1ds5de/a_little_help/,So for some reason my whole attitude and level of confidence changes depending on the girls I'm around. If I'm around girls that I'm not interested in I become really confident and cool and  I've  noticed that because of this most of those girls have had a thing for me. But if I'm around girls that I find attractive I go the complete opposite way and end up being either shy or socially awkward. Is there any way that I can stop this from happening?  Any thoughts or opinions on this would be much appreciated.  ,,False,self,t5_2rmn5,False,,,True,t3_1ds5de,http://www.reddit.com/r/confidence/comments/1ds5de/a_little_help/,
1362847019.0,12,self.confidence,19z4qa,Cocky vs confident?,13,1,9,http://www.reddit.com/r/confidence/comments/19z4qa/cocky_vs_confident/,We all know there is a fine line between the two. But what is the real difference. Can someone give some example of different situations where a cocky person would respond compared to a person with confidence. So many times. I try to be confident and it gets turned into arrogance when I don't intend it too. Thanks for the help,,False,self,t5_2rmn5,False,,,True,t3_19z4qa,http://www.reddit.com/r/confidence/comments/19z4qa/cocky_vs_confident/,
1362090422.0,13,self.confidence,19f9lm,Asking a random girl on a date,18,5,8,http://www.reddit.com/r/confidence/comments/19f9lm/asking_a_random_girl_on_a_date/,What is the best way to ask a random good looking girl out on a date without freaking them out or sounding like a total idiot? ,,False,self,t5_2rmn5,False,,,True,t3_19f9lm,http://www.reddit.com/r/confidence/comments/19f9lm/asking_a_random_girl_on_a_date/,
1361523365.0,12,self.confidence,190gzc,[Q] How to be more confident in my relationship?,17,5,6,http://www.reddit.com/r/confidence/comments/190gzc/q_how_to_be_more_confident_in_my_relationship/,"I've been in a relationship with my gf for 1 year and a half, and I get pissed off/bothered when she is online on facebook and not chatting with me, when she posts status', comments other people's pictures, likes other people's pictures, and most of all hangout with friends or go to parties without me.  It's affecting our relationship and my happiness.  Need some advice please.",,False,self,t5_2rmn5,False,,,True,t3_190gzc,http://www.reddit.com/r/confidence/comments/190gzc/q_how_to_be_more_confident_in_my_relationship/,
1357270750.0,13,self.confidence,15xhp5,Advice for a lack of confidence regarding future careers,16,3,7,http://www.reddit.com/r/confidence/comments/15xhp5/advice_for_a_lack_of_confidence_regarding_future/,"I'm currently suffering from a debilitating lack of confidence in myself and my abilities. I work at a dead-end office job, a generic English BA under my belt, and still living with my mother. 

What I really want is an exciting career that is satisfying and meaningful. I can't decide between four different career paths and all of them seem out of reach for me. I guess it's because where I'm at now and where I want to be seem to be worlds away. I get excited about these career paths and excited about what life might be like in 10 years or so when I'm fully enjoying my life, but it seems more like I'm watching a movie of someone who just looks like me. 

I'm actually afraid of the ""real"" world. I still feel like a teenager in school and I'm not an adult yet (I'm 25 btw). 

How can I get over this lack of confidence in myself?",,False,self,t5_2rmn5,False,,,True,t3_15xhp5,http://www.reddit.com/r/confidence/comments/15xhp5/advice_for_a_lack_of_confidence_regarding_future/,
1357189228.0,15,21articles.com,15vdv4,7 Steps to Inner Simplicity | 21 Articles,19,4,3,http://www.reddit.com/r/confidence/comments/15vdv4/7_steps_to_inner_simplicity_21_articles/,,,False,http://d.thumbs.redditmedia.com/yFJDlzfmHtu2wlUQ.jpg,t5_2rmn5,False,,,False,t3_15vdv4,http://www.21articles.com/Article/1309/7-Steps-to-Inner-Simplicity,
1343411314.0,12,self.confidence,x9a2g,I want to face my fears,16,4,5,http://www.reddit.com/r/confidence/comments/x9a2g/i_want_to_face_my_fears/,"This is probably insignificant, but last week, I rode roller coasters for the first time, as a 19 year old male. I had never done so before, and no one in my family ever rides roller coasters (which is probably why I was afraid of them). But, I went to the amusement park, and forced myself to ride as many as I could. And you know what? It was awesome, and now I'm not afraid of them anymore.

In my life, however, there are many things that I fear, and have anxiety over. Stupid things, like meeting new people, making good impressions at my work, my health (I suffered from hypochondria for a while). But I decided that the only way I can get rid of my fears are to face them head on. With that in mind, I'm going to try facing my fears more often, particularly my social fears, which have held me back from friends and relationships all my life. Yesterday I was invited to a camping trip, and I knew that there was only going to be one person who I was friends with that would be on the trip. I declined at first, but I am going to accept the offer regardless, even if I don't know anyone there. 

I figure, what's the worst that can happen? If they all hate me and I don't make any friends there, then so what? It's only one day of camping, and I'll probably forget about it in a week or two. But say I make a good impression? Well, maybe I'll make some friends, and some new connections? I'm afraid of meeting new people, but I'm going to force myself to do it anyways, and maybe then it will get easier in the long run.

Good luck to all you guys, we can do this.",,False,self,t5_2rmn5,False,,,True,t3_x9a2g,http://www.reddit.com/r/confidence/comments/x9a2g/i_want_to_face_my_fears/,
1332876275.0,12,self.confidence,rga3s,Welcome!,13,1,5,http://www.reddit.com/r/confidence/comments/rga3s/welcome/,"Hi everyone,

I just received moderation powers for this subreddit, and hope to turn it into a place where questions, advice, and stories about confidence can be shared between users.  

Enjoy.",,False,self,t5_2rmn5,False,,,True,t3_rga3s,http://www.reddit.com/r/confidence/comments/rga3s/welcome/,
1374253288.0,14,self.confidence,1in3ut,Lack of self-confidence after having lost 120lbs,17,3,10,http://www.reddit.com/r/confidence/comments/1in3ut/lack_of_selfconfidence_after_having_lost_120lbs/,"Hey guys, I have been fat for the majority of my life. As a result, I have always been the quiet guy in any social circle etc. However, over the course of the past 5 years i have managed to drop over 120 pounds and pack on some muscle. Even though everyone constantly tells me that i look great, i just won't allow myself to believe it. It's as if I don't think I look good enough or am the one person who looks different in any non specific outing (it's a very difficult feeling to explain). In a way, I lost the weight for my health but I believe I really did it for the attention I would get from the opposite sex. Lately, I have learned that looks don't count for much if your constantly stuck in your head thinking in about what you want to say/ should say/ could say etc. 

I was wondering if there is anyone out there who has also lost weight and managed to adapt to social interaction.

Anything would help me out at this point. I feel like i'm starting to break out of my shell a little but i still have some difficulties speaking with other people (especially girls).",,False,self,t5_2rmn5,False,,,True,t3_1in3ut,http://www.reddit.com/r/confidence/comments/1in3ut/lack_of_selfconfidence_after_having_lost_120lbs/,
1373853920.0,13,self.confidence,1ib8uz,[Q] The opposite of confidence in the dictionary is me,16,3,1,http://www.reddit.com/r/confidence/comments/1ib8uz/q_the_opposite_of_confidence_in_the_dictionary_is/,"So I've been dealing with a lack of self-confidence since I was a kid, being a foreign immigrant with little knowledge of the english language made me a prime target with bullies and classmates that wanted to seem smart. Over the years I started trying to direct my energy to studying and just staying above the rest. This worked out for a couple of years but then came high-school, now this a time where everyone and their dog are super funny and make tons of puns. In my circle of friends I'm pretty much the scapegoat and the one guy who just says ok to everything they do. And to top it off, I haven't ever even gone on a date before or had a girlfriend and I blame this as a contributing factor for me. 

**TL;DR I'm not funny and lack confidence to say no.**

Is there any hope? Thanks guys. ",,False,self,t5_2rmn5,False,,,True,t3_1ib8uz,http://www.reddit.com/r/confidence/comments/1ib8uz/q_the_opposite_of_confidence_in_the_dictionary_is/,
1372959852.0,11,self.confidence,1hn80t,"[Q] Need a little help, if anyone's out there.",12,1,9,http://www.reddit.com/r/confidence/comments/1hn80t/q_need_a_little_help_if_anyones_out_there/,"I'm a girl, I'm 18 years old. I go through spells of depression, and I've been this way for as long as I can remember. When I was just a kid I remember getting upset and sleeping on the hardwood floor because I felt that I didn't deserve a bed. I hate hearing people talk about how bad they have it because there is always someone out there who has it worse, and so I'm not going to tell you the complications of my life. I just want..well, need someone to talk to. Please..",,False,self,t5_2rmn5,False,,,True,t3_1hn80t,http://www.reddit.com/r/confidence/comments/1hn80t/q_need_a_little_help_if_anyones_out_there/,
1371852604.0,12,self.confidence,1gtmcc,Knocked Down a peg.,14,2,4,http://www.reddit.com/r/confidence/comments/1gtmcc/knocked_down_a_peg/,"This is s throw away because I have friends and family who reddiy.

The last school year I was going through a tough time dealing with a break up and going through the general depression that comes with that and I found myself in motivated to continue with school.   I found myself quickly on academic prohbation because of my poor performance.   Well it took some time but I worked my ass off to try and catch up and felt like I finished the year on good terms.   Today I got a letter informing me that i did not meet the criteria that was asked if me and I must appeal to the admissions councillor.

This was a real blow to my confidence and now I'm worried I will not be able to continue my education.   More so how do I tell my parents that I failed out of college and that there really was no one to blame but myself.   Any way I just needed to express myself, thanks for taking the time to read my post. 
",,False,self,t5_2rmn5,False,,,True,t3_1gtmcc,http://www.reddit.com/r/confidence/comments/1gtmcc/knocked_down_a_peg/,
1351261779.0,12,iwanttoimprovemyself.blogspot.co.uk,124hq4,An article by Claudette Rowley on why and how you should listen to your inner voice for your life decisions. A key personal development skill for those interested in self-development and success.,13,1,0,http://www.reddit.com/r/confidence/comments/124hq4/an_article_by_claudette_rowley_on_why_and_how_you/,,,False,http://e.thumbs.redditmedia.com/P8sY28u1Yt8XoKfj.jpg,t5_2rmn5,False,,,False,t3_124hq4,http://iwanttoimprovemyself.blogspot.co.uk/2012/10/listening-to-your-inner-voice.html,
1351201279.0,12,elevatedlabs.com,1237md,7 Tips For Developing Magnetic Confidence From One of Louisiana's Most Successful Trial Lawyers,26,14,2,http://www.reddit.com/r/confidence/comments/1237md/7_tips_for_developing_magnetic_confidence_from/,,,False,default,t5_2rmn5,False,,,False,t3_1237md,http://www.elevatedlabs.com/blogs/an-elevated-perspective/6782732-7-tips-for-developing-magnetic-confidence-from-one-of-louisiana-s-most-successful-trial-lawyers,
1344318523.0,14,self.confidence,xt6j6,I'm 5'0 and always hating my height. Need confidence. Help?,16,2,16,http://www.reddit.com/r/confidence/comments/xt6j6/im_50_and_always_hating_my_height_need_confidence/,"I'm not sure whether this is a proper subreddit to post this but I really need help boosting my confidence... I'm 15 and I'm always mocked about how short I am. If Reddit has any advice/tips about how to grow taller, then please comment.",,False,self,t5_2rmn5,False,,,True,t3_xt6j6,http://www.reddit.com/r/confidence/comments/xt6j6/im_50_and_always_hating_my_height_need_confidence/,
1335931338.0,12,reddit.com,t2rbg,I just gave a little bit of advice on /r/socialskills about confidence that I think is worth a read,16,4,1,http://www.reddit.com/r/confidence/comments/t2rbg/i_just_gave_a_little_bit_of_advice_on/,,,False,default,t5_2rmn5,False,,,False,t3_t2rbg,http://www.reddit.com/r/socialskills/comments/sdfif/being_psychoanalyzed_publicly_at_a_party/c4j1bim?context=3,
1376187960.0,11,self.confidence,1k4g7s,[H] How to gain confidence?,12,1,7,http://www.reddit.com/r/confidence/comments/1k4g7s/h_how_to_gain_confidence/,I have a lot of trouble with starting conversations. I feel as though I am a bother to the people I talk to. When I am texting somebody and they don't respond I feel as though I was bothering them and they don't want to talk to me. How would I fix this? If you had this problem what helped you?,,False,self,t5_2rmn5,False,,,True,t3_1k4g7s,http://www.reddit.com/r/confidence/comments/1k4g7s/h_how_to_gain_confidence/,
1372744734.0,9,self.confidence,1hhby2,"So I heard kick-boxing makes you more CONFIDENT. But exactly, how???",15,6,5,http://www.reddit.com/r/confidence/comments/1hhby2/so_i_heard_kickboxing_makes_you_more_confident/,,,False,self,t5_2rmn5,False,,,True,t3_1hhby2,http://www.reddit.com/r/confidence/comments/1hhby2/so_i_heard_kickboxing_makes_you_more_confident/,
1371939128.0,12,reddit.com,1gvlnm,How do I get my confidence back,14,2,0,http://www.reddit.com/r/confidence/comments/1gvlnm/how_do_i_get_my_confidence_back/,,,False,default,t5_2rmn5,False,,,False,t3_1gvlnm,http://www.reddit.com/r/workplace/comments/1gvjsq/not_sure_what_steps_to_take/,
1366649331.0,13,drjitesharora.com,1cvepk,21 Tips To Building Your Self Esteem and Confidence,13,0,0,http://www.reddit.com/r/confidence/comments/1cvepk/21_tips_to_building_your_self_esteem_and/,,,False,http://a.thumbs.redditmedia.com/JttkwSd8SHSlhE8Z.jpg,t5_2rmn5,False,,,False,t3_1cvepk,http://drjitesharora.com/21-tips-to-build-self-esteem-and-confidence/,
1360267026.0,10,self.confidence,18300o,How to fix my non existent confidence? I feel worthless due to my condition. ,20,10,5,http://www.reddit.com/r/confidence/comments/18300o/how_to_fix_my_non_existent_confidence_i_feel/,"I have turners, and I feel because of that I'll never be happy. I cry getting ready as I hate what I see,I purge, I post way to many pics here asking for validation and I know that's not good.
I am a loser.
You most likely don't know about TS so here is a short vid made
http://www.youtube.com/watch?v=y9aeQ_Jkrgs",,False,self,t5_2rmn5,False,,,True,t3_18300o,http://www.reddit.com/r/confidence/comments/18300o/how_to_fix_my_non_existent_confidence_i_feel/,
1354220107.0,12,self.confidence,140ep3,Advice on talking with confidence ,13,1,4,http://www.reddit.com/r/confidence/comments/140ep3/advice_on_talking_with_confidence/,Sometimes when I'm with people my voice sounds like I'm nervous and I kind of mumble sometimes. I wanted to know if there were techniques or anything to help me overcome my fear,,False,self,t5_2rmn5,False,,,True,t3_140ep3,http://www.reddit.com/r/confidence/comments/140ep3/advice_on_talking_with_confidence/,
1341045342.0,12,self.confidence,vu35s,I might as well be the biggest chicken alive.  :(,13,1,15,http://www.reddit.com/r/confidence/comments/vu35s/i_might_as_well_be_the_biggest_chicken_alive/,"I am 16 years old.  Currently:

-Have my permit, but have only driven maybe 12 times since last July, when I got my permit.  Driving is fucking scary.

-Have no friends.  I hate people my age, and I think not having friends has worn me down a bit.

-Don't have a job yet.  I'm afraid to go jobhunting because I feel anxiety in social situations, including being around a bunch of people for too long.  Also afraid that no one would hire a moron like me.  

-See inevitable failure in my future.  My grades are fine.  I still feel like a failure.  Don't know why.

-Afraid that everyone just sees how I see me.  Which, isn't good.

I feel like I can't do anything right.  Part of this is my depression, but I figured I'd have better luck in /r/confidence since that is my main problem.  I feel like such a chicken.  Seems like everyone else can do these things fine except me.  :(",,False,self,t5_2rmn5,False,,,True,t3_vu35s,http://www.reddit.com/r/confidence/comments/vu35s/i_might_as_well_be_the_biggest_chicken_alive/,
1338084115.0,11,self.confidence,u6r4v,"Need some advice - outwardly I look fine, but I am a mess inside",11,0,4,http://www.reddit.com/r/confidence/comments/u6r4v/need_some_advice_outwardly_i_look_fine_but_i_am_a/,"Male, 33 years old.  Outwardly, I seem very ""normal"".  I am quite intelligent, very polite, nice etc etc.  I do something I like (software) and I'm nice to everyone I come into contact with.  

But..

I've no confidence inside (even though I am fully aware that I am probably better than most people I come into contact with, in terms of ability, character etc).  I am socially awkward, have body image issues (I am not fat, but I am short, have small manhood).  I've never had a relationship, never even kissed a girl all my life.  I am not ugly, but I am not Keanu either.  I don't know if I'd ever have a relationship, and am terrified that even if some girl did show interest in me, she'll quickly leave when she finds out I haven't even kissed a girl :(

Again and again, I see people stealing the limelight - people who are superior than me in social skills (but nothing else) end up taking the limelight.  Don't get me wrong, I don't resent them or anything.  I just am sad that I can't do more, just because I have low confidence.

I know this is Reddit, and many people here might be in the same boat as I.  Still, I posted this, in the hope that there might be someone who has changed himself, and might give some advice, and tell me what worked for them.  Sorry if this all comes as depressing.  I don't have anyone else to talk to, so I pushed myself to post here.

It is Saturday night, and I don't have anyone to hang out with, which makes it all the more depressing.",,False,self,t5_2rmn5,False,,,True,t3_u6r4v,http://www.reddit.com/r/confidence/comments/u6r4v/need_some_advice_outwardly_i_look_fine_but_i_am_a/,
1371202368.0,10,self.confidence,1gbuth,"Am I losing my native language, or am I just not confident enough?",11,1,7,http://www.reddit.com/r/confidence/comments/1gbuth/am_i_losing_my_native_language_or_am_i_just_not/,"So I've been having this problem for a while now. I have been raised by parents with two different languages. After that, I learned english with the help of the school, and the internet. Soon after, I had to learn French, which didn't work out very well, and now I'm learning Spanish. I seem to be mixing the languages up a bit too much though. See, I mostly speak in my native language, think in english, and on ocassion have to speak german when I go to the country, or talk to my dad (which is quite often). 
Recently I'm starting to lose the words of my native language, and not just complicated ones. One time, I was staring at a box, and could not for the life of me figure out the word in my native language. 
This leads me to be extremely nervous in conversation, afraid that I won't be able to find the correct word, or completely mess up the sentence. Is this a self-fulfilling prophecy, or am I really losing my language?
Thanks in advance.",,False,self,t5_2rmn5,False,,,True,t3_1gbuth,http://www.reddit.com/r/confidence/comments/1gbuth/am_i_losing_my_native_language_or_am_i_just_not/,
1369145135.0,9,strategyfocussuccess.com,1erige,When Reality Slaps You: The Real Lesson Behind Amy &amp; Samyâ€™s Meltdown |,16,7,0,http://www.reddit.com/r/confidence/comments/1erige/when_reality_slaps_you_the_real_lesson_behind_amy/,,,False,http://c.thumbs.redditmedia.com/9yBQ6Sgh0hLgT0gh.jpg,t5_2rmn5,False,,,False,t3_1erige,http://www.strategyfocussuccess.com/when-reality-slaps-you/?utm_source=rss,
1367383362.0,12,self.confidence,1dgpob,I don't know what you people do.,15,3,2,http://www.reddit.com/r/confidence/comments/1dgpob/i_dont_know_what_you_people_do/,"The old story of the guru. I read it and after reading it occurred to me, I'd rather breath than try to be the best and think better of myself. I give up. I don't know where else on the internet to post this.",,False,self,t5_2rmn5,1367638167.0,,,True,t3_1dgpob,http://www.reddit.com/r/confidence/comments/1dgpob/i_dont_know_what_you_people_do/,
1365407841.0,9,self.confidence,1bwmqv,I'm too shy,11,2,4,http://www.reddit.com/r/confidence/comments/1bwmqv/im_too_shy/,I hate talking to people. I usually wear a  hoodie so I can hide and evade conversation with people. What do I do?,,False,self,t5_2rmn5,False,,,True,t3_1bwmqv,http://www.reddit.com/r/confidence/comments/1bwmqv/im_too_shy/,
1362990244.0,11,kamuelafranco.com,1a2m9r,A Winning Attitude Is a Crazy One - Be Crazy and Win!,14,3,0,http://www.reddit.com/r/confidence/comments/1a2m9r/a_winning_attitude_is_a_crazy_one_be_crazy_and_win/,,,False,http://c.thumbs.redditmedia.com/hjIHz2GxEbw3OrTJ.jpg,t5_2rmn5,False,,,False,t3_1a2m9r,http://kamuelafranco.com/a-winning-attitude-is-a-crazy-one/,
1352289601.0,10,self.confidence,12sk8f,"phobia of buying something, getting jobs",12,2,1,http://www.reddit.com/r/confidence/comments/12sk8f/phobia_of_buying_something_getting_jobs/,"is there such a thing as a phobia of buying stuff? i had a whole bunch of social fears and stuff which i think im doing better at now, so i know much of this is a confidence thing, but i have this fear of buying anything. Ok, for example, i want to buy a bike, but i want something second hand, so i look on craigslist, then i see something interesting, but then i look for stuff only close to where i live, then i only look for hybrid bikes, then i start to doubt myself, maybe i dont want to get a bike. I know theres a fear of going to someones house and then not being able to not buy the thing. so yeh i know it sounds silly, but does any one else have this problem, and how do you deal with it, sorting out all the negative thoughts seems so daunting and i know i cant 'figure' out the whole thing, but i dont know how to escape it. It invades so many areas, like looking for a job, i get excited about the job, but then cant pull through with making the call to apply. 
All helpful thoughts welcome.
Thanks, much love",,False,self,t5_2rmn5,False,,,True,t3_12sk8f,http://www.reddit.com/r/confidence/comments/12sk8f/phobia_of_buying_something_getting_jobs/,
1342583037.0,10,workehow.com,wqovs,Learn to be confident like a baby,15,5,2,http://www.reddit.com/r/confidence/comments/wqovs/learn_to_be_confident_like_a_baby/,,,False,http://b.thumbs.redditmedia.com/2Iw9CweHYkX2RlRO.jpg,t5_2rmn5,False,,,False,t3_wqovs,http://www.workehow.com/consciousness/learn-to-be-confident-like-a-baby/430/,
1370448126.0,9,self.confidence,1fq7h1,Need help making a good first impression.,9,0,5,http://www.reddit.com/r/confidence/comments/1fq7h1/need_help_making_a_good_first_impression/,"I'm having trouble make a good first impression on anyone. they seem uninterested, confused, and just don't want to talk to me. Any suggestions?",,False,self,t5_2rmn5,False,,,True,t3_1fq7h1,http://www.reddit.com/r/confidence/comments/1fq7h1/need_help_making_a_good_first_impression/,
1366653706.0,8,scoopfromthecoup.thedigitalarchitechs.com,1cvkjv,Confidence Part Two - Scoop From The Coup,10,2,0,http://www.reddit.com/r/confidence/comments/1cvkjv/confidence_part_two_scoop_from_the_coup/,,,False,default,t5_2rmn5,False,,,False,t3_1cvkjv,http://scoopfromthecoup.thedigitalarchitechs.com/?page_id=190,
1365364368.0,9,reddit.com,1bvb8v,Look yourself in the eyes when you look in a mirror (x-post from /r/LifeProTips),11,2,0,http://www.reddit.com/r/confidence/comments/1bvb8v/look_yourself_in_the_eyes_when_you_look_in_a/,,,False,default,t5_2rmn5,False,,,False,t3_1bvb8v,http://www.reddit.com/r/LifeProTips/comments/1b447f/lpt_look_yourself_in_the_eyes_when_you_look_in_a/,
1364459429.0,9,drawapig.desktopcreatures.com,1b61ab,This awkward group task before a small meeting at work made me feel pretty good about myself and everyone else gained confidence too. Takes 5 mins there's no surveys/signup/annoying shit then Post results!,9,0,3,http://www.reddit.com/r/confidence/comments/1b61ab/this_awkward_group_task_before_a_small_meeting_at/,,,False,default,t5_2rmn5,False,,,False,t3_1b61ab,http://drawapig.desktopcreatures.com/drawApig.asp,
