created_utc,score,domain,id,title,ups,downs,num_comments,permalink,selftext,link_flair_text,over_18,thumbnail,subreddit_id,edited,link_flair_css_class,author_flair_css_class,is_self,name,url,distinguished
1340871737.0,23,self.confidence,vqdfq,How to stop comparing yourself to other people? ,24,1,8,http://www.reddit.com/r/confidence/comments/vqdfq/how_to_stop_comparing_yourself_to_other_people/,"This problem escalated when I started studying in university in 2010. Suddenly, I was in the top university in the country, with hordes of people who were smarter, more handsome and buffer than me. I was already suffering from social anxiety (which unfortunately quickly turned into panic attacks, causing me to feel completely paralyzed), so I cracked like an eggshell. I didn't mean for things to go that far, but they did. Only recently have I started to put my life back together, and confidence is key. 

I have literally zero proper friends at university after two years of attending it. it's horrible, it makes me sick to my stomach and I want to feel better. I need concrete tips on how to train myself not to feel like shit in the company of more handsome/smarter/buffer/whatever people. :( ",,False,self,t5_2rmn5,False,,,True,t3_vqdfq,http://www.reddit.com/r/confidence/comments/vqdfq/how_to_stop_comparing_yourself_to_other_people/,
1374360969.0,22,self.confidence,1ipxhq,How can I learn to be confident enough to act independently?,22,0,9,http://www.reddit.com/r/confidence/comments/1ipxhq/how_can_i_learn_to_be_confident_enough_to_act/,"I'm in my late 20's, and I've had this problem for most of my life. I think I was raised in a rather authoritarian household, and am naturally very averse to ""disappointing"" people I respect/love, so I learned how to follow rules very very well. I find this incredibly detrimental to my life as an adult, in particular since all I've ever wanted to do is scientific research. 

I need the confidence to believe that I understand what I'm doing and that the work I do will be interesting and respected by other people. I don't have that now. It is holding me back to the point where I'm basically afraid to do anything anymore without a peer or mentor confirming it's a good idea. I feel incapable of believing that anything I do will be ""good enough."" 

This is extremely bad. ",,False,self,t5_2rmn5,False,,,True,t3_1ipxhq,http://www.reddit.com/r/confidence/comments/1ipxhq/how_can_i_learn_to_be_confident_enough_to_act/,
1373567857.0,23,self.confidence,1i3j6f,"Help with saying ""No"" to clients &amp; people in my life.",25,2,7,http://www.reddit.com/r/confidence/comments/1i3j6f/help_with_saying_no_to_clients_people_in_my_life/,"I work at a web design and SEO services firm and often deal with clients. Some trouble I have is with telling a client ""No"" when they are exceeding their (contracted) scope of work with us. 

Whenever I bring up the contract, they moan and complain they didn't understand it, or for some other reason, understood that they would still be getting X additional features. 

I have a hard time putting my foot down and saying ""tough luck"" and am always inclined to try to find a way to resolve it, which usually means us bending over and saying yes. I feel horrible when I do this, and I don't think it makes customers respect me, the contract, or our services, however it does solve the short term problem. 

I think this stems back from years of experience in the service industry and the notion of ""the customer is always right"", as well as some of my own personality traits. Whenever people ask something of me and I tell them know, they make me feel like I somehow let them down. 

Can anyone suggest exercises, tips, books, reading material, things to memorize, etc. that will help me avoid this and command some respect?",,False,self,t5_2rmn5,False,,,True,t3_1i3j6f,http://www.reddit.com/r/confidence/comments/1i3j6f/help_with_saying_no_to_clients_people_in_my_life/,
1369968526.0,23,self.confidence,1fdq39,Confidence vs. Arrogance?,24,1,5,http://www.reddit.com/r/confidence/comments/1fdq39/confidence_vs_arrogance/,"I have a real problem distinguishing between the two. I employ the fake it till you make it mentality to a lot of situations and it's become almost natural and translated into real confidence in many situations, but this sometimes bleeds into arrogance and me just being an asshole. And I really think the asshole-ness is my narcissistic insecurity pushing through. How do I fight this?",,False,self,t5_2rmn5,False,,,True,t3_1fdq39,http://www.reddit.com/r/confidence/comments/1fdq39/confidence_vs_arrogance/,
1369096888.0,20,gradutempore.com,1eqd9w,Wise Words on Self-Esteem,26,6,0,http://www.reddit.com/r/confidence/comments/1eqd9w/wise_words_on_selfesteem/,,,False,http://c.thumbs.redditmedia.com/JPcqodkqrLiQGDmt.jpg,t5_2rmn5,False,,,False,t3_1eqd9w,http://www.gradutempore.com/2013/05/boost-your-self-esteem-in-less-than-20.html,
1356303713.0,23,self.confidence,15cfxj,How has this subreddit helped you personally? I'll go first. ,24,1,2,http://www.reddit.com/r/confidence/comments/15cfxj/how_has_this_subreddit_helped_you_personally_ill/,"Hi to whoever is reading this. I've been coming by this subreddit for a while now - I struggle with confidence issues, big time. Or so I have been at least for many years now, but during the last few weeks my confidence have improved, and it has done so largely because of this subreddit. There's so much great advice here, and I'd like to share what I've found to work for me.

I now **hold eye-contact** way more, it helps a lot, and I don't feel as submissive as I used to because of it.

**I speak up**, its getting more and more natural to do so, but I've been a low-talker and a mumbler most of my life so I find it challenging at times. Lately I've had less people saying ""huh? Can you say that again?"" to me, which is good, because I felt insecure when people constantly either didn't hear me at all, or when they did they misunderstood me because of my low talking.. 

**I speak more slowly, a tiny bit more pause between each word, and this gives what I say more impact**. I've been getting more laughs, and more appreciation from what I've said. 

**I don't constantly second-guess my choices anymore**, I feel more confident in what I decide to do or say. A lot of my lack of confidence at least was that I had no confidence in myself while talking or doing anything really. This took some time to change. I used to despise everything I said, did, acted upon, you name it. And I just ended up hating myself for it, and my confidence just got lower because I didn't believe in my actions. Changing this has helped so much. Now I try to do stuff because I want to, because its gonna make me feel good, and I'm not gonna change to get the approval of someone else. 

This subreddit has helped me with all of these things. How has it helped you guys?
",,False,self,t5_2rmn5,False,,,True,t3_15cfxj,http://www.reddit.com/r/confidence/comments/15cfxj/how_has_this_subreddit_helped_you_personally_ill/,
1376160137.0,23,self.confidence,1k3nft,"Hey reddit, I am 17 years old, and I want my old self back.",27,4,11,http://www.reddit.com/r/confidence/comments/1k3nft/hey_reddit_i_am_17_years_old_and_i_want_my_old/,"When I was 15, I was really outgoing, had a lot of friends, wet to a lot of parties, had a lot of hook-ups. Basically, I was living the life any teenager would dream of. 

Then came League of Legends, the most addictive video game I have played to this day. When I started playing it, I began to find excuses not to go out with my friends, just so that I can stay home and play. I started making new friends that played this game, and play with them all day.

My social life was flying away, slowly but surely. Most of the girls I talked to I don't talk to anymore. I decided that even though I was addicted to a video game, I can still go out with friends and go partying. This is what I have been trying to do this year. The problem is, when I go out, I'm not the same person I was before, I don't talk to girls the same way, and I've become awkward. I've lost friends, I've lost female friends. Basically, I've lost myself.

So, Reddit, any tips on how I can become my old outgoing self without quitting gaming ?",,False,self,t5_2rmn5,False,,,True,t3_1k3nft,http://www.reddit.com/r/confidence/comments/1k3nft/hey_reddit_i_am_17_years_old_and_i_want_my_old/,
1371671201.0,23,self.confidence,1gocrl,"[Q] For those who have struggled/are struggling with self-confidence, what have you found actually helps?",27,4,9,http://www.reddit.com/r/confidence/comments/1gocrl/q_for_those_who_have_struggledare_struggling_with/,"I have improved my self-confidence in the past few years simply by focusing on changing the way I think of myself, but it seems like I have hit a wall. I no longer hate myself, but I do not have what I would consider a healthy confidence level and am having trouble progressing from here.

What have you done/read/whatever else that has helped you to improve your confidence?",,False,self,t5_2rmn5,False,,,True,t3_1gocrl,http://www.reddit.com/r/confidence/comments/1gocrl/q_for_those_who_have_struggledare_struggling_with/,
1370566327.0,23,self.confidence,1ftxpu,I had a bit of a confidence breakthrough today and I thought I'd share what I learned with all of you.,27,4,7,http://www.reddit.com/r/confidence/comments/1ftxpu/i_had_a_bit_of_a_confidence_breakthrough_today/,"So to preface what Iâ€™m about to share with you all, I just wanted to talk about myself a little bit and why I felt the need to post on this subreddit. To briefly describe myself, Iâ€™m 20 years old and I never really thought of myself as a guy who isnâ€™t confident. Thatâ€™s not to say that I ooze confidence and swagger, but I feel like Iâ€™ve always been in the middle, every now and then Iâ€™ll get flashes of confident brilliance as well as moments where Iâ€™m listening to myself thinking â€œBoy, could you sound like more a pansy talking to this pretty girl?â€ So suffice it to say, Iâ€™ve always been interested in maximizing my confidence highs and limiting my lows, which is why I find myself browsing this subreddit as well as a few other related ones.

Not too long ago I was giving a guy advice on here who asked what to do if he tried to kiss a girl who wasnâ€™t being responsive. I gave a piece of advice regarding confidence that was basically â€œfake it till you make it.â€ I thought this was great advice that I was sharing with this fellow in need, but what I found out from another commenter was that I wasnâ€™t really sharing anything tangible. I was taken aback at first, but after a while it made sense to me , after all, when I come on here I try and find quick fixes to my problems, even though those really donâ€™t exist, and I wanted to find a way to really help out.

That was a couple weeks ago, fast forward to today, I woke up early on my day off and found that all my roommates were away at work. It was one of those days where I hopped out of bed literally feeling like a million bucks ready to seize the day. I mowed the lawn, did my laundry and planned on getting a haircut later in the day.

Before my cut I decided to check out reddit and stumbled on this really insightful TED talk which discussed the importance of stretching and making yourself feel big and its effect on oneâ€™s self confidence as well as how big of an impact straightening your posture can have. Being someone who is always looking to be as confident possible (I often go out to bars with my pals and we all try and pick up girls, with mixed results), I decided to immediately put all this into effect and even as I write this out, Iâ€™m doing my best to keep a good posture which can be tough for me at times since I have a bit of scoliosis.

Anyways fast forward a bit more and Iâ€™m walking over to the barber shop, this is where I got my brilliant revelation. What I was trying to do for a while was find an immediate quick boost to my confidence that I could implement as soon as I walked into bars so I could leave with all sorts of exotic women, but really nothing in life ever works like that. I came up with a brilliant confidence analogy on my way to get a trim; confidence is really more of a muscle. You canâ€™t just enter a basketball court and expect to drop unreal shots against stingy defense, right? First you need to hit the courts on your own and practice when no one's around. Confidence is exactly the same thing. I found that since I get a little bit of nerves when I approach beautiful girls that I should first try on something a little easier.

I made the resolution today that I would talk to just about anyone I could and get comfortable. Situations where I would normally not speak to someone because I donâ€™t have to are perfect. Theyâ€™re no pressure, so I can try out things like starting a conversation and finding out more about a person and in the event I screw up I can just cut it off, it really is the perfect place to practice my social skills with someone who doesnâ€™t even know Iâ€™m doing it. This way I know what works and I know that itâ€™s worked in the past and I can feel free to use it when it actually matters.

As I finished this brilliant train of thought I had arrived to the barber, I decided I would do something Iâ€™ve never done before and actually try my hardest to maintain a long and fun conversation with the woman cutting my hair the entire 30-ish minutes I was with her. What actually ended up happening was even better than I thought; I ended up engaging 3 of the hairdressers there in a really intense discussion about the latest Game of Thrones episode. Suffice it say, I left that place feeling confident as ever because of what I had just done, not to mention that I was looking great after getting a great haircut.

So thatâ€™s my newest resolution, talk to anyone I can in order to hone my ability to approach strangers and getting them comfortable and talking, that literally includes everyone: cab drivers, people sitting next to me in a lecture hall, door to door salesmen whatever. If I donâ€™t have to speak to them itâ€™s even better because no pressure is on me and in the event things start going south or I lose my cool I can just bail, no harm, no foul. After a little while Iâ€™ll have gotten so good at chatting people up that models and actresses could be ordering drinks at the bar and Iâ€™ll be able to approach them without getting phased whatsoever (I hope).

So thatâ€™s what I discovered today, confidence is a muscle that needs constant and regular training in order to be big and ready for game day. Coupled with what I learned about posture, I should have absolutely no problem pulling that number from the next single hottie I lay my eyes on!

**EDIT: TL;DR always keep a good posture for added confidence and practice approaching people you don't need to approach, so you feel comfortable approaching the ones you need/want to.**",,False,self,t5_2rmn5,1370579406.0,,,True,t3_1ftxpu,http://www.reddit.com/r/confidence/comments/1ftxpu/i_had_a_bit_of_a_confidence_breakthrough_today/,
1369616619.0,22,self.confidence,1f407d,"My mother constantly puts me down in confidence, and today was the last straw.",29,7,6,http://www.reddit.com/r/confidence/comments/1f407d/my_mother_constantly_puts_me_down_in_confidence/,"Well my mother says "" you dont look prettt unless you put makeup on."" And "" put your hair up!you look like a rat!"". And to top it off, today i asked for a lip peircing and she said "" your teeth are to ugly and crooked for a lip peircing"". 

Just thought that i'd share this with reddit.",,False,self,t5_2rmn5,False,,,True,t3_1f407d,http://www.reddit.com/r/confidence/comments/1f407d/my_mother_constantly_puts_me_down_in_confidence/,
1367293263.0,20,self.confidence,1de0dz,"Someone like me should have confidence, but I don't. Any advice?",23,3,14,http://www.reddit.com/r/confidence/comments/1de0dz/someone_like_me_should_have_confidence_but_i_dont/,"Dear Reddit,

Self-confidence has always been an elusive concept to me. Before I delve into that, hereâ€™s the context of why I think Iâ€™ve had such a hard time with confidence.

Growing up, I didnâ€™t understand the purpose of motivational speeches and posters. I was raised in a religious family, which led me to be very skeptical about adults, my parents, my teachers, and the ones at church. I didnâ€™t trust a lot of their intentions, or what they meant by their attempts to offer perspective. That being said, I was still a very a thoughtful and contemplative kid. It was religion really, which I saw as an unfulfilling comfort for adults such as my parents, which led to my lack of self-faith and perspective. My mother is the most religious, but always talked of it and life in a way that seemed like she was trying to convince herself as well, not just me. My father followed, but with even less conviction. In addition, before I imply anything to the contrary, that my parents are very nice people. They were good parents, not great, but good. However, they were unresponsive, and failed in a lot of in my formative years. My mother was overbearing and my father was apathetic and probably couldnâ€™t relate to me (a common situation, I know).

Nevertheless, I do not blame my religious upbringing and parents for my lack of confidence alone. In fact, I know that a lot about confidence comes down to willpower and deliberate alterations to self-perception. 

The weird thing is, confidence shouldnâ€™t be an issue with me. Iâ€™m over 6â€™0â€, have what many would label as a â€œpretty-boyâ€ face and demeanor, musical, artistic, and good with kids. Lots of beautiful women, who I think would generally be rated as 10â€™s, approach me or look my way. Unfortunately, my lack of confidence has kept me from having the guts to talk to these women or even see myself under a positive light. 

Overall, I donâ€™t fully know why I donâ€™t have the confidence I want. Itâ€™s been wearing me down for years and Iâ€™ve long felt life to be a chore. 
",,False,self,t5_2rmn5,False,,,True,t3_1de0dz,http://www.reddit.com/r/confidence/comments/1de0dz/someone_like_me_should_have_confidence_but_i_dont/,
1335507533.0,23,iusedtobethatguy.com,suxk6,From Shy Guy to Confident Introvert,29,6,1,http://www.reddit.com/r/confidence/comments/suxk6/from_shy_guy_to_confident_introvert/,,,False,http://b.thumbs.redditmedia.com/BbyrdcGRIuhsZeqy.jpg,t5_2rmn5,False,,,False,t3_suxk6,http://iusedtobethatguy.com/from-shy-guy-to-confident-introvert/,
1369878049.0,19,gradutempore.com,1fb4qt,Attribute Success to Yourself,20,1,0,http://www.reddit.com/r/confidence/comments/1fb4qt/attribute_success_to_yourself/,,,False,http://b.thumbs.redditmedia.com/SXhdp09SORkebwdg.jpg,t5_2rmn5,False,,,False,t3_1fb4qt,http://www.gradutempore.com/2013/04/attribute-success-to-yourself.html,
1361835246.0,20,self.confidence,198161,"That sudden feeling of ""Oh man, I don't think I can do this.""",21,1,8,http://www.reddit.com/r/confidence/comments/198161/that_sudden_feeling_of_oh_man_i_dont_think_i_can/,"It's staring me in the face.
It's a giant 90 degree learning curve.

However, if I get past this, it could put me on the path to where I want to be in life.

I've been procrastinating for 2 years, escaping the world by playing on games, and not being productive.

So last week, I cracked, I decided to learn the tools that I need to make my own games, or at least give me a shot at getting into the industry.

I managed to work out how the 3D programme Blender works, how games are built, and found a small unpaid position doing the Audio for a non commercial game being built.

Here's the issue, that big game team has asked me to use a program I have never used before.

I have 2 weeks to work out how to create a sound and implement it, but I honestly feel like giving up.
I honestly feel myself turning away from it all and saying screw it...too much effort.

I need some advice, or some pep talk.

Kick me into gear Reddit!",,False,self,t5_2rmn5,False,,,True,t3_198161,http://www.reddit.com/r/confidence/comments/198161/that_sudden_feeling_of_oh_man_i_dont_think_i_can/,
1354777742.0,20,self.confidence,14dga8,"How to defend yourself from ""friends""?",21,1,19,http://www.reddit.com/r/confidence/comments/14dga8/how_to_defend_yourself_from_friends/,"Say you and some friends are basically chatting, when one of them makes a rude comment about you, then the rest follow. Now it's you vs. everyone else. How would you react?",,False,self,t5_2rmn5,False,,,True,t3_14dga8,http://www.reddit.com/r/confidence/comments/14dga8/how_to_defend_yourself_from_friends/,
1371007079.0,20,self.confidence,1g678b,Need help with Low self esteem/ low confidence,20,0,6,http://www.reddit.com/r/confidence/comments/1g678b/need_help_with_low_self_esteem_low_confidence/,"I have very low self esteem and confidence. I'm 22 and never had a girlfriend. My family tells me that I am very handsome and that I could get a super model, but I don't think so. I dont have many friends and often dont feel like going out. Although everyone tells me im really nice and funny. When ever I see a girl I think is attractive I always end up talking myself out of it, or are to shy to do anything so I just give up. I also have slight anxiety of going anywhere im not familiar with even if its down the street. I work out 3-5 days a week and also practice meditation, neither of these seem to help much. I have tried to fake confidence before but I found it to be extremely exhausting.",,False,self,t5_2rmn5,False,,,True,t3_1g678b,http://www.reddit.com/r/confidence/comments/1g678b/need_help_with_low_self_esteem_low_confidence/,
1363979223.0,20,self.confidence,1atdhg,"Want to start going to the Gym, scared etc.",20,0,21,http://www.reddit.com/r/confidence/comments/1atdhg/want_to_start_going_to_the_gym_scared_etc/,"Having started nofap and quit drinking aswell, I want to start gyming in order to improve my habits as well as my physical shape. I know the location of a local gym which isn't far, but thinking about the simple act of going down there makes me aware of my lack of Confidence.

I run scenarios through my head about what could happen, and whether i'll feel embarrassed or ashamed that this would be my first time going at age 22. I don't know if it's social anxiety since I believe I have good social skills and can talk to men and women fine. I guess an overwhelming sense of ""I would look out of place."" is how i'm thinking.

Any words of wisdom or advice would be fantastic. Sorry if this is the wrong sub for this kind of post.",,False,self,t5_2rmn5,False,,,True,t3_1atdhg,http://www.reddit.com/r/confidence/comments/1atdhg/want_to_start_going_to_the_gym_scared_etc/,
1332900629.0,19,youtube.com,rgvij,The most astounding fact,20,1,2,http://www.reddit.com/r/confidence/comments/rgvij/the_most_astounding_fact/,,,False,http://e.thumbs.redditmedia.com/qJ3i34TdGSfndY4p.jpg,t5_2rmn5,False,,,False,t3_rgvij,http://www.youtube.com/watch?v=Kmo1L8rYFWo,
1373146007.0,18,imgur.com,1hroaq,My inner struggle,36,18,3,http://www.reddit.com/r/confidence/comments/1hroaq/my_inner_struggle/,,,False,http://c.thumbs.redditmedia.com/KNVmhlT1OAtG8p-V.jpg,t5_2rmn5,False,,,False,t3_1hroaq,http://imgur.com/gallery/dWLAP,
1360388966.0,18,self.confidence,186hz0,How to increase your confidence in regards to your looks?[M],19,1,12,http://www.reddit.com/r/confidence/comments/186hz0/how_to_increase_your_confidence_in_regards_to/,"This basic question has kept me struggling for many years now and I hope someone here has/had the same problem and has some advice.

I have always been told by many people that Im a very good looking and attractive guy but lack confidence. However I have frizzy hair that has some bald spots. Whatever people say I keep focusing on this negative aspect and it has gotten to the point that I wont go out if I have a bad hairday (very often) I have to wash and gel it everyday to make it kinda reasonable for me but it is still my mind is all the time. Does anyone have a solution to this problem? Its gotten to the point that Im considering proffesional help.

thanks",,False,self,t5_2rmn5,False,,,True,t3_186hz0,http://www.reddit.com/r/confidence/comments/186hz0/how_to_increase_your_confidence_in_regards_to/,
1355247204.0,19,ted.com,14o9gj,Amy Cuddy: Your body language shapes who you are,20,1,0,http://www.reddit.com/r/confidence/comments/14o9gj/amy_cuddy_your_body_language_shapes_who_you_are/,,,False,http://b.thumbs.redditmedia.com/6XWZQROO6r8mgZeC.jpg,t5_2rmn5,False,,,False,t3_14o9gj,http://www.ted.com/talks/amy_cuddy_your_body_language_shapes_who_you_are.html?source=facebook#.UMVfEEh5VnQ.facebook,
1352394804.0,19,firstgenamerican.com,12v4sr,Life Changing Advice Part 1,22,3,1,http://www.reddit.com/r/confidence/comments/12v4sr/life_changing_advice_part_1/,,,False,http://b.thumbs.redditmedia.com/I5SF_Ocw-jx9hp7O.jpg,t5_2rmn5,False,,,False,t3_12v4sr,http://firstgenamerican.com/2012/08/24/life-changing-advice-part-1/,
1340346865.0,18,youtube.com,vfbqe,Be Yourself! =),21,3,0,http://www.reddit.com/r/confidence/comments/vfbqe/be_yourself/,,,False,http://a.thumbs.redditmedia.com/d6BiRESBYrhjoF3H.jpg,t5_2rmn5,False,,,False,t3_vfbqe,http://www.youtube.com/watch?v=fLLz7O9Lf6k,
