created_utc,score,domain,id,title,ups,downs,num_comments,permalink,selftext,link_flair_text,over_18,thumbnail,subreddit_id,edited,link_flair_css_class,author_flair_css_class,is_self,name,url,distinguished
1364862530.0,168,self.confidence,1bh8rh,For one night of my life I had confidence. I can honestly say it was the best night of my life.,184,16,35,http://www.reddit.com/r/confidence/comments/1bh8rh/for_one_night_of_my_life_i_had_confidence_i_can/,"I am an 18 year old guy. I'm very shy, awkward, social disaster spending most of my life encased indoors.

This saturday night I wen't to a concert, one of my favourite bands, Said the Whale, was opening for Stars. I brought one of my friends along to go see them. And met up with others later on. I wasn't expecting much other than some good music. I saw this really beautiful girl standing next to me. Normally I don't say anything to anyone. But I started up a conversation with her. I started talking to her about the band, she said she came to see Said the Whale too. Once the band played I started to dance, she joined in. After the Said the whale finished playing, I asked her if she'd like to dance again when the Stars start playing. She said told me she really wanted to and I asked her for her number so we could find each other again.

She put: ""Hot girl from concert ;)"" in my contacts.
Immediately I texted her saying: ""Hey, so now you have my number. From equally hot guy from concert. ;)""

We had a good laugh and said we'd meet up after. At this point I was so pumped I couldn't believe I got a girls phone number. Thats never happened to me before. I was super excited. After hanging out with my friends for a while, Stars came back on to play.

She texted me and told me to hold up my phone so she could find me. We met up and she brought me over to her friends and introduced me. We spent most of the songs dancing. I had the confidence to take her hand and twirl her around a few times she was loving it and so was I. Then a slow song came on and I was really really really wanting to hold her hand. It was practically screaming in my mind. I didn't. So we danced a bit more and then another slow song came on. I thought to myself: ""Fuck it, i'm going to hold her hand."" I slowly inched my hand towards her and put it right behind hers, I bumped it and she instantly grabbed it. And thank God the concert was dark because i would've been beet red.

We spent the rest of the concert dancing and holding hands.
I've never held a girls hand before. Hell, I've never got to dance with a girl or get her phone number. I was ecstatic. After the Stars stopped playing I shook her hand and said my goodbyes. My friends were shocked I was able to even work up the courage to talk to her. Let alone do everything else. I seriously wouldn't shut up about it for the rest of the night I was so happy. And keep thinking about her still today.

I don't know where the hell that burst of confidence came from, but it gave me the best night of my life.

tl;dr - I got to hold a girls hand and i'm blooding fucking happy about it.",,False,self,t5_2rmn5,1364864432.0,,,True,t3_1bh8rh,http://www.reddit.com/r/confidence/comments/1bh8rh/for_one_night_of_my_life_i_had_confidence_i_can/,
1356004470.0,112,rosssimmonds.com,155wes,6 Easy Ways to Develop the Confidence of Tony Stark,124,12,4,http://www.reddit.com/r/confidence/comments/155wes/6_easy_ways_to_develop_the_confidence_of_tony/,,,False,http://f.thumbs.redditmedia.com/vNyWZAK85N-uj11q.jpg,t5_2rmn5,False,,,False,t3_155wes,http://rosssimmonds.com/2012/10/28/confidence-tony-stark/,
1371601702.0,112,youtube.com,1gmf5o,Changing your body language can make you more confident. A 21 min TED talk that really helped me.,133,21,5,http://www.reddit.com/r/confidence/comments/1gmf5o/changing_your_body_language_can_make_you_more/,,,False,http://c.thumbs.redditmedia.com/9A-d7No3L70gXABh.jpg,t5_2rmn5,False,,,False,t3_1gmf5o,http://www.youtube.com/watch?v=Ks-_Mh1QhMc,
1361312350.0,87,youtube.com,18ufrl,How to Speak with Confidence- This has really been helping me,93,6,12,http://www.reddit.com/r/confidence/comments/18ufrl/how_to_speak_with_confidence_this_has_really_been/,,,False,http://d.thumbs.redditmedia.com/_nZZ_AU2ptrWdBYK.jpg,t5_2rmn5,False,,,False,t3_18ufrl,http://youtube.com/watch?v=Z9N-JRx9Ifw,
1369307898.0,90,i.imgur.com,1ewazs,This was a great confidence boost for me since it came from a girl I like.,106,16,13,http://www.reddit.com/r/confidence/comments/1ewazs/this_was_a_great_confidence_boost_for_me_since_it/,,,False,http://b.thumbs.redditmedia.com/Ic2uV0KlF-pQyC01.jpg,t5_2rmn5,False,,,False,t3_1ewazs,http://i.imgur.com/7JrjDfC.jpg,
1336215822.0,83,self.confidence,t880g,From Low Self Esteem to Absolute Confidence! A guide for any and everyone who wishes to be confident,99,16,6,http://www.reddit.com/r/confidence/comments/t880g/from_low_self_esteem_to_absolute_confidence_a/,"Really glad this sub-reddit is up and running. Hopefully it will continue to grow! These are some of the things I did in order to build up my self esteem till I felt confident.

I've suffered with low self esteem for a long time, but I've been working at it and its improving. It may not be quite where I want it, but its getting there. Here's my advice, take it with a grain of salt and figure out what works best for you.

1) Erase negative self thinking. There are different causes of low self esteem, maybe you failed at something or your parents, friends, peers or teachers put you down at one point or for a very long time. The strange thing about that is that even if those people or events that caused you to doubt yourself are no longer in your life, you have internalised it. It doesn't matter what happened, because now you are your own negative reinforcer! So every time you hear yourself saying something negative, about yourself or anyone. Just stop. Stop the train of thought right there.

2) Promote positive self thinking. What is self confidence, but an unwavering positive regard for yourself and your abilities. Every time you hear yourself saying something negative, stop. Now replace that with a positive thought. A friend of mine used to find herself saying in her thoughts ""I hate myself"". Every time she heard herself say this or that train of thought starting she would say ""pickles"" instead. It was silly, but it helped her to stop uttering the phrase. Eventually she replaced it with ""I don't hate myself."" and then ""I like myself"" and then ""I love myself"".

3) Meditate. This one comes up a lot. [1] [1] [1] /r/meditation can probably help you in this area. Meditation teaches you how to focus and calm your mind. Get your mind to be a clam serene ocean as opposed to a wild storm. It doesn't have to be with candles, incense and groovy music either. There are even atheists who meditate. How can you have an unwavering positive regard for yourself if your mind is constantly distracted by negative things, and the negative things you say about yourself? Learn to focus and achieve.

4) Start a journal of some type. I use an ordinary high school notebook, but you can use absolutely anything, even a blog. Write down what your thoughts, it helps big time. Its like a private therapist you are only privy to. For a long time my journal was filled with negative things I would say about myself. Slowly I started writing positive things, as I saw them. Acknowledging thoughts is important in regarding yourself as a person - you've got to acknowledge that you're a person that should be listened to. Writing things down makes them real. And you can track your progress.

5) Talk to people. Have you ever noticed that confident people make friends easily? Have you ever noticed that they can strike up a conversation with anyone? This is actually surprisingly simple! Talk to as many people as you can, make chit chat - this can be to whomever even store clerks, the person serving you. Its not hard to give compliments or be friendly. At first it may seem awkward, but take a risk. Go out there, develop that confidence.

6) Treat others and yourself with respect. What you see in others is what you see in yourself. People who are really judgemental also put themselves to those unrealistic standards. Start accepting others, and you will start accepting yourself. The two are surprisingly related! Think of a confident (not necessarily arrogant) person in your life, notice how they always see the good in others. Do the same. A very useful book in this regard is ""How to Win Friends and Influence People"", which I'm sure you've heard of. Give it a read, the worst that could happen is that you at least tried, the best thing that could happen is that it worked.

7) Keep moving. You can't always control your mind, but you can control your behaviour. If you act in a certain way, pretty soon your mind will follow suit. Change something in your life, do something that makes you happy, practice something that you're good at. Focus on it.

8) Exercise. If you want self confidence and a strong sense of self, you need a good body image. I don't mean you have to have the perfect body, I mean you should be comfortable in your body. You should be aware of it. You should be aware of the space you inhibit. Exercise increases your understanding of your body. It also releases a high that positively influences your thoughts. Exercising to a goal can really build your self confidence.

Here are some VERY useful links, which I have used:

1) [The Mood Gym](http://moodgym.anu.edu.au/welcome) Conditioning positive self thinking and behaviour.

2) [Self Confidence](http://www.self-confidence.co.uk/) This is a 6 part email course, that I found useful. The site offers some products for sale, I haven't looked at those yet so can't comment. I used the free email course and that was good.

The most important thing to do is to keep trying. I'm 28 and only now do I feel confident, after all those years. The point is that I got there, eventually. In 10 years time will you look back on this day and think, I should've done something or will you look back on it as the day you changed for the better? As I said, take everything I've said with a grain of salt and find what works best for you. Please feel free to add things to this list. Good luck :)

A final word, I noticed on the sidebar there are links to seduction reddits. I have no problem with this, but I think this sub-reddit should be about confidence in everything, not just in relationships. Injecting confidence into your family, your work, your friendships and hobbies can only be a good thing.
",,False,self,t5_2rmn5,False,,,True,t3_t880g,http://www.reddit.com/r/confidence/comments/t880g/from_low_self_esteem_to_absolute_confidence_a/,
1354209516.0,83,calmingmanatee.com,1402f9,I would be lying if I said this silly website did not make me feel better,94,11,3,http://www.reddit.com/r/confidence/comments/1402f9/i_would_be_lying_if_i_said_this_silly_website_did/,,,False,http://a.thumbs.redditmedia.com/uPZygQzreHJ63frB.jpg,t5_2rmn5,False,,,False,t3_1402f9,http://calmingmanatee.com/,
1376466620.0,79,i.imgur.com,1kc4ez,"Small victory, but I finally had the nerve to change my abusive ex's number in my phone. (x-post from /r/smallvictories",94,15,16,http://www.reddit.com/r/confidence/comments/1kc4ez/small_victory_but_i_finally_had_the_nerve_to/,,,False,http://e.thumbs.redditmedia.com/ojxMKeoHWsmnZcLX.jpg,t5_2rmn5,False,,,False,t3_1kc4ez,http://i.imgur.com/ZxRIQjq.jpg,
1336534109.0,76,primermagazine.com,te48x,3 Visual Tricks That Will Instantly Make People Think Youâ€™re More Confident,82,6,7,http://www.reddit.com/r/confidence/comments/te48x/3_visual_tricks_that_will_instantly_make_people/,,,False,http://f.thumbs.redditmedia.com/okBWo8II4LH0iuu_.jpg,t5_2rmn5,False,,,False,t3_te48x,http://www.primermagazine.com/2010/learn/3-visual-tricks-that-will-instantly-make-people-think-youre-more-confident,
1357101832.0,75,self.confidence,15t4nv,Just stumbled upon this sub. Here's something I hope helps.,86,11,7,http://www.reddit.com/r/confidence/comments/15t4nv/just_stumbled_upon_this_sub_heres_something_i/,"A common misconception is that confidence arises from ability and that if you want more confidence, you have to get better at what you do. This is false. what people usually describe as confidence is actually competence. It is through competence that we feel not insecure about our abilities. Competence is knowing what you're doing and doing it well. Competence isn't confidence. The truth about confidence is one of life's wonders because even a lazy person can succeed in this area.if you want to be more confident you don't have to add anything to your personality or skill level. In fact you already have too much of something.because confidence isn't the presence of anything at all. Confidence is a reduction of your interest in whether others are thinking about you, and if so what they're thinking. Confidence isn't something you feel or possess; it's something others use to describe what they see when they look at you. Trying to feel confident will instead make you anxious. You'll never experience a single moment of confidence in your life. Instead of thinking about confidence, what you need to do is focus on exactly what's happening in the instant. Not even the whole moment; The instant at hand.",,False,self,t5_2rmn5,False,,,True,t3_15t4nv,http://www.reddit.com/r/confidence/comments/15t4nv/just_stumbled_upon_this_sub_heres_something_i/,
1368735018.0,65,i.imgur.com,1egzwm,"Don't Hide Yourself. Pride Yourself. (This is me last year before my first triathlon. 300+lbs, Bug Eyes, and proud as heck!)",91,26,9,http://www.reddit.com/r/confidence/comments/1egzwm/dont_hide_yourself_pride_yourself_this_is_me_last/,,,False,http://f.thumbs.redditmedia.com/UEdyLGXHcDwEz5ye.jpg,t5_2rmn5,False,,,False,t3_1egzwm,http://i.imgur.com/MNPCKuJ.jpg,
1365026940.0,62,imgur.com,1bm9lp,My effort at breaking out of my comfort zone..,82,20,19,http://www.reddit.com/r/confidence/comments/1bm9lp/my_effort_at_breaking_out_of_my_comfort_zone/,,,False,http://d.thumbs.redditmedia.com/XTmos7CF68dXEW-u.jpg,t5_2rmn5,False,,,False,t3_1bm9lp,"http://imgur.com/NwmtuHH,uzx6XJE#0",
1332878512.0,67,self.confidence,rgc42,"I like that a self-post here is called ""self.confidence""",68,1,3,http://www.reddit.com/r/confidence/comments/rgc42/i_like_that_a_selfpost_here_is_called/,That is all.,,False,self,t5_2rmn5,False,,,True,t3_rgc42,http://www.reddit.com/r/confidence/comments/rgc42/i_like_that_a_selfpost_here_is_called/,
1344033346.0,60,qkme.me,xn6lg,"Don't know why, but this really helped.",67,7,7,http://www.reddit.com/r/confidence/comments/xn6lg/dont_know_why_but_this_really_helped/,,,False,http://f.thumbs.redditmedia.com/k6MO1y1_S7h7Bshq.jpg,t5_2rmn5,False,,,False,t3_xn6lg,http://qkme.me/3qcdm9?id=225646065,
1343245507.0,55,getgirlsnotgame.com,x5bxa,7 Ways To Feel Instantly Confident,71,16,1,http://www.reddit.com/r/confidence/comments/x5bxa/7_ways_to_feel_instantly_confident/,,,False,http://c.thumbs.redditmedia.com/T7FL5maheJ5gxlqt.jpg,t5_2rmn5,False,,,False,t3_x5bxa,http://www.getgirlsnotgame.com/7-ways-to-feel-instantly-confident/#.UBBMm7fNzn0.reddit,
1370108010.0,54,youtube.com,1fh0qy,"How to Have Confidence - Guys and girls, start following this advice TODAY!!",66,12,5,http://www.reddit.com/r/confidence/comments/1fh0qy/how_to_have_confidence_guys_and_girls_start/,,,False,http://e.thumbs.redditmedia.com/gzGeS8Rt1OMbuysL.jpg,t5_2rmn5,False,,,False,t3_1fh0qy,http://youtube.com/watch?v=enJQp8PhrLg,
1366141176.0,53,realbeautysketches.dove.us,1chbu5,self perception vs reality. All it takes to be awesome is to realize you already are!,58,5,4,http://www.reddit.com/r/confidence/comments/1chbu5/self_perception_vs_reality_all_it_takes_to_be/,,,False,http://d.thumbs.redditmedia.com/dl-oS8aTn85uvaB-.jpg,t5_2rmn5,False,,,False,t3_1chbu5,http://realbeautysketches.dove.us/,
1364148824.0,48,waynevsparker.com,1ax9m9,Fake It Until You Become It: How forcing your body language can help,55,7,5,http://www.reddit.com/r/confidence/comments/1ax9m9/fake_it_until_you_become_it_how_forcing_your_body/,,,False,http://b.thumbs.redditmedia.com/yYSu4_dEEYo7JhmU.jpg,t5_2rmn5,False,,,False,t3_1ax9m9,http://waynevsparker.com/?p=156,
1364261363.0,48,self.confidence,1b0i5e,Wear nice underwear.,55,7,10,http://www.reddit.com/r/confidence/comments/1b0i5e/wear_nice_underwear/,"It will make you feel nice, whether you're just going to work or on a date. ",,False,self,t5_2rmn5,False,,,True,t3_1b0i5e,http://www.reddit.com/r/confidence/comments/1b0i5e/wear_nice_underwear/,
1356566378.0,48,self.confidence,15hpar,What is the #1 tip you could give to someone about boosting their confidence?,58,10,28,http://www.reddit.com/r/confidence/comments/15hpar/what_is_the_1_tip_you_could_give_to_someone_about/,In other words what is something that's helped you in bringing you your confidence back? ,,False,self,t5_2rmn5,False,,,True,t3_15hpar,http://www.reddit.com/r/confidence/comments/15hpar/what_is_the_1_tip_you_could_give_to_someone_about/,
1374629796.0,47,inshannity.blogspot.com,1ixd4n,"3 tips to appear more confident, even when you're not.",57,10,2,http://www.reddit.com/r/confidence/comments/1ixd4n/3_tips_to_appear_more_confident_even_when_youre/,,,False,http://f.thumbs.redditmedia.com/YcgxnhVsCkHN8hfA.jpg,t5_2rmn5,False,,,False,t3_1ixd4n,http://inshannity.blogspot.com/2013/07/a-few-things-i-wish-i-had-been-told.html,
1344047533.0,43,self.confidence,xnj8q,Some confidence tips,57,14,8,http://www.reddit.com/r/confidence/comments/xnj8q/some_confidence_tips/,"Hello,

I used to be very self-conscious. While I am still self-conscious to some degree, I have seen massive improvements and would like to help others see the same. This i primarily geared towards men, but a lot of what I'm saying may be useful to women too.

**Body Language**

* Get fit. Quite possibly the easiest way to gain confidence. If you're skinny, lift and eat like fucking crazy. If you're fat, make a life choice to change your diet (less sugar, no soda), and exercise. Barring a medical condition, there is absolutely nothing stopping you from looking like [this](http://build-muscles.maxupdates.tv/wp-content/uploads/2010/06/Flat-Stomach-and-Ripped-Abs-a.jpg). Do you think that guy is confident? Truthfully, you have no idea what he thinks. However, he looks confident, and that's all that matters. A large portion of being confident is appearing confident. 

* Take up space. This can very easily be related to getting fit. Confident people take up space. If you're sitting down, spread your legs and lean back. On a couch? Spread your wings and rest them on the top of the couch.

* Always appear relaxed. Being confident is all about being in control. Tense people are very rarely in control. If you're out drinking, lean up against the bar. Don't hold your drink in front of your chest, leave it hanging at your side. Make deliberate movements. Don't fidget.

**Interactions**

* I listen to my iPod constantly. I used to have the habit of turning it off every time I passed someone, so I could prepare for the possible greeting. At the gym, I would turn it off constantly if I thought someone was nearing me to ask me a question or start a discussion. The problem with this approach is that it puts the impetus on you to prepare for coming interactions. The correct way to deal with these situations is to let people make the move before you react. If they greet you, nod, say 'hi', and move on. Don't put too much thought into passing greetings. If you're listening to music, ignore them completely until they've actually addressed you. Then, take out your earphones, ask them to repeat themselves, and answer their questions. Don't rush any interaction, and don't be afraid to ask people to repeat themselves. I realize these examples are specific but I believe they are common.

* Understand that everyone has a mind similar to yours. People may say things they regret. The incredible-looking, confident-seeming girl you just talked to may be wishing she had handled the interaction differently. She may be obsessing over the smallest detail: the slight pause in your reply, the lack of a smile in your face, the short, stilted, uninterested response you provided. The truth is that everyone thinks, and no one is so self-confident that they don't question their own actions on occasion. This is an important realization. Even the most beautiful girl may feel rejected by the ugliest man. Knowing how your own responses affect others is a useful and learnable skill. My only request is that, upon learning this skill, you do not use it to abuse others. Most people depend heavily on human interaction, and are very manipulable as a result.

* Don't complain. Nearly everyone will have at least one consistent problem in their life. Maybe your knees are fucked up. Maybe you have migraines. Maybe your family is shitty. Whatever. As important as these issues are, they will never mean to others what they mean to you. Complaining about them will not have the effect you desire, and will cause your peers to cast you in a negative light.

**Personal**

* Don't get angry. Remain relaxed and in charge in all situations. If you encounter a problem, remedy it calmly. A lot of people get very angry over small things. Let me give you an example. A friend of mine who is an angry drive, upon missing a turn, flips his shit, complains, yells at his GPS, swears at other drives, and generally appears childish. My brother, upon missing a turn, doesn't say a word, gets in the next turning lane, and resolves the problem. Imagine yourself as the passenger in each situation. Who appears more confident? Who would you rather drive with? Most problems require minimal effort to resolve.

* Get over it. Fucked up a conversation with that hot girl in your class? Get over it. Had an awkward greeting with a coworker? Get over it. Give yourself a brief period of analysis for every negative interaction you have. Look at what you did wrong, learn from it, and then forget the interaction happened. I had a few important realizations about a year and a half ago, when I was fairly unhappy. 1) Every emotion is contained in my consciousness. 2) I have partial control over my consciousness. 3) I can influence my emotions to a certain degree. Learn to reject negative feelings and accept positive ones. Don't let yourself fall into that self-pity that feels so strangely good -- it is ultimately dangerous. Become an optimist.

* Push yourself. Talk to everyone you can. Work out until you can't work out any longer. If you see a possible area of self-improvement, work hard on fulfilling the positive maxim of the trait that represents that area. Learn from those around you at every opportunity.

A few important points: 
Certain advice above may not work for you. Don't get discouraged. Everyone thinks differently. Just because you don't fit one definition of a stereotypically confident person does not mean that you aren't confident. 
Confidence is cyclical -- the more confident you become, the more people will treat you as if you are confident. This leads to increased confidence. 

I feel like I could write about these topics forever. Realize that your potential is not limited. Realize that you are in control of your brain. Realize that your current confidence level is not indicative of your future confidence self.

If you have any questions, ask me. I'm no George Clooney but I feel that I have a good perspective on confidence.",,False,self,t5_2rmn5,False,,,True,t3_xnj8q,http://www.reddit.com/r/confidence/comments/xnj8q/some_confidence_tips/,
1365794637.0,44,youtube.com,1c841x,On Being Ugly,48,4,10,http://www.reddit.com/r/confidence/comments/1c841x/on_being_ugly/,,,False,http://a.thumbs.redditmedia.com/9U23DWYPccCOr-m6.jpg,t5_2rmn5,False,,,False,t3_1c841x,http://www.youtube.com/watch?v=2js063a1Suk,
1365424202.0,42,lifehatched.com,1bww4u,Build confidence by changing limiting beliefs,45,3,0,http://www.reddit.com/r/confidence/comments/1bww4u/build_confidence_by_changing_limiting_beliefs/,,,False,default,t5_2rmn5,False,,,False,t3_1bww4u,http://lifehatched.com/build-confidence-by-changing-limiting-beliefs/,
1366727409.0,36,gradutempore.com,1cxqmk,Intelligent words on self-confidence - I think,38,2,0,http://www.reddit.com/r/confidence/comments/1cxqmk/intelligent_words_on_selfconfidence_i_think/,,,False,http://c.thumbs.redditmedia.com/xEiYUhfVxwrlWnWb.jpg,t5_2rmn5,False,,,False,t3_1cxqmk,http://www.gradutempore.com/2013/04/boost-self-confidence-in-less-than-30.html,
1362622250.0,39,self.confidence,19tgbq,The Power Of Smiling,43,4,12,http://www.reddit.com/r/confidence/comments/19tgbq/the_power_of_smiling/,"Hey redditors, I'm a 15 year old guy in High School and I have to tell you, a simple smile goes a long way. Today, I was randomly approached by about 5 different people who all told me the same thing:

""You're like the only person I've seen today that's actually happy. What's up, ragecomics109?""


If you smile, pick your head up, and take care of yourself, you'll see your confidence soar like a freaking eagle. And guess what? People notice. So smile! 

",,False,self,t5_2rmn5,False,,,True,t3_19tgbq,http://www.reddit.com/r/confidence/comments/19tgbq/the_power_of_smiling/,
1339459925.0,35,kinowear.com,ux15r,[Advice]How to Build Unstoppable Confidence ,35,0,2,http://www.reddit.com/r/confidence/comments/ux15r/advicehow_to_build_unstoppable_confidence/,,,False,http://f.thumbs.redditmedia.com/S5n8ntwDo0FOf7sA.jpg,t5_2rmn5,False,,,False,t3_ux15r,http://www.kinowear.com/blog/how-to-build-unstoppable-confidence,
