created_utc,score,domain,id,title,ups,downs,num_comments,permalink,selftext,link_flair_text,over_18,thumbnail,subreddit_id,edited,link_flair_css_class,author_flair_css_class,is_self,name,url,distinguished
1369923206.0,181,bbc.co.uk,1fc529,El Salvador court denies seriously ill woman abortion. Lawyers for the young woman argued that continuing the pregnancy would place her life at risk. The foetus itself is missing part or all of its brain.,214,33,46,http://www.reddit.com/r/Freethought/comments/1fc529/el_salvador_court_denies_seriously_ill_woman/,,,False,http://e.thumbs.redditmedia.com/eN8kXHUFuozc64Xj.jpg,t5_2qhzx,False,,,False,t3_1fc529,http://www.bbc.co.uk/news/world-latin-america-22712756,
1369245928.0,177,english.alarabiya.net,1eujfr,"Amina Tyler, Tunisia’s ‘topless jihad’ activist, caught and under arrest. In March, Tyler posted pictures of her topless body with the phrase “my body is my own” scrawled on it, and she went into hiding after receiving death threats.",209,32,23,http://www.reddit.com/r/Freethought/comments/1eujfr/amina_tyler_tunisias_topless_jihad_activist/,,,False,http://c.thumbs.redditmedia.com/CGpjiXxD_P_338lh.jpg,t5_2qhzx,False,,,False,t3_1eujfr,http://english.alarabiya.net/en/News/middle-east/2013/05/21/Amina-Tyler-Tunisia-s-topless-jihad-activist-under-arrest.html,
1365695978.0,177,patheos.com,1c53bu,"New Survey Shows Millennials Are Losing Faith, but Americans Still Think Atheism is Bad for Society",205,28,45,http://www.reddit.com/r/Freethought/comments/1c53bu/new_survey_shows_millennials_are_losing_faith_but/,,,False,http://f.thumbs.redditmedia.com/3GuFDrfTKJVb7yDq.jpg,t5_2qhzx,False,,,False,t3_1c53bu,http://www.patheos.com/blogs/friendlyatheist/2013/04/10/new-survey-shows-millennials-are-losing-faith-but-americans-still-think-atheism-is-bad-for-society/,
1363185120.0,179,coloradoan.com,1a7st0,"Catholic Charities will quit Colorado instead of letting same-sex couples adopt children (same-sex civil unions has passed Congress, and the governor will be signing it into law soon)",224,45,74,http://www.reddit.com/r/Freethought/comments/1a7st0/catholic_charities_will_quit_colorado_instead_of/,,,False,default,t5_2qhzx,False,,,False,t3_1a7st0,http://www.coloradoan.com/article/20130312/NEWS01/303120025/Catholic-Charities-Adoption-services-imperiled-by-civil-unions,
1371441669.0,180,politicususa.com,1ght2m,"How Christian Myth Overinflates the Religious Right’s Sense of Self Importance -- ""Fundamentalist Christians must understand that the world didn't begin with them and it won't end with them. In the absence of Mosaic law, the world got along just fine. Morality has scientific, not religious, origins""",228,48,53,http://www.reddit.com/r/Freethought/comments/1ght2m/how_christian_myth_overinflates_the_religious/,,,False,http://c.thumbs.redditmedia.com/2jcXjuSNmXiH-c5h.jpg,t5_2qhzx,False,,,False,t3_1ght2m,http://www.politicususa.com/2013/06/16/christian-myth-overinflates-religious-rights-sense-importance.html,
1371097532.0,178,ffrf.org,1g8xm2,FFRF has filed a lawsuit against the Orange County School Board in Orlando FL for censoring distribution of freethought materials while allowing unfettered distribution of the Christian bible,206,28,2,http://www.reddit.com/r/Freethought/comments/1g8xm2/ffrf_has_filed_a_lawsuit_against_the_orange/,,,False,http://c.thumbs.redditmedia.com/Tp4CDec9Ux_D24db.jpg,t5_2qhzx,False,,,False,t3_1g8xm2,http://ffrf.org/news/news-releases/item/17906-ffrf-sues-over-literature-discrimination,
1366405316.0,176,wosu.org,1cp6z1,"Catholic high school in Columbus OH fires teacher of 19 years when they found out she was a lesbian, a ""violation of moral law."" Columbus has an ordinance that protects employees from discrimination including sexual orientation. Religious employers are not exempt.",209,33,20,http://www.reddit.com/r/Freethought/comments/1cp6z1/catholic_high_school_in_columbus_oh_fires_teacher/,,,False,http://e.thumbs.redditmedia.com/hhMBaMC1h4Ta6dWj.jpg,t5_2qhzx,False,,,False,t3_1cp6z1,http://wosu.org/2012/news/2013/04/18/watterson-teacher-wants-job-back-thats-all-im-hoping-for/,
1338471376.0,178,joemygod.blogspot.com,udtwt,"You've got to be carefully taught - 4 year old sings ""No homos gonna make it to heaven""",202,24,62,http://www.reddit.com/r/Freethought/comments/udtwt/youve_got_to_be_carefully_taught_4_year_old_sings/,,,False,http://c.thumbs.redditmedia.com/3TaI6aJHoNKWC4Hn.jpg,t5_2qhzx,False,,,False,t3_udtwt,http://joemygod.blogspot.com/2012/05/four-year-old-church-singer-performs.html?utm_source=twitterfeed&amp;utm_medium=twitter,
1346880341.0,179,huffingtonpost.com,zewl8,"Bill Nye 'The Science Guy' Talks Creationism Critique, Religion, Education (EXCLUSIVE INTERVIEW)",207,28,7,http://www.reddit.com/r/Freethought/comments/zewl8/bill_nye_the_science_guy_talks_creationism/,,,False,http://d.thumbs.redditmedia.com/UPVt9IlbVz_lpQCQ.jpg,t5_2qhzx,False,,,False,t3_zewl8,http://www.huffingtonpost.com/2012/08/28/bill-nye-creationism_n_1837505.html,
1344272827.0,175,ffrf.org,xruza,"FFRF awards 12-year-old freethinker $1,000 for student activism; she asked her local government to stop opening official meetings with Christian prayers; ""It is not fair for you to pray openly to your God without praying to all the others as well""",219,44,5,http://www.reddit.com/r/Freethought/comments/xruza/ffrf_awards_12yearold_freethinker_1000_for/,,,False,default,t5_2qhzx,False,,,False,t3_xruza,http://ffrf.org/news/releases/ffrf-awards-12-year-old-freethinker-for-student-activism/,
1317502443.0,178,forcechange.com,kxro4,"FFRF fights against Alabama's ""Jesus or Jail"" program which gives people charged with misdemeanors the choice of going to jail, paying a fine or attending church every Sunday for a year.",191,13,16,http://www.reddit.com/r/Freethought/comments/kxro4/ffrf_fights_against_alabamas_jesus_or_jail/,,,False,default,t5_2qhzx,False,,,False,t3_kxro4,http://forcechange.com/5490/go-to-church-or-go-to-jail-suspend-alabamas-jesus-or-jail-program/?utm_source=rss&amp;utm_medium=rss&amp;utm_campaign=go-to-church-or-go-to-jail-suspend-alabamas-jesus-or-jail-program,
1276623977.0,178,religion.blogs.cnn.com,cfaqw,"Six-story tall statue of Jesus coming out of a lake with outstretched arms upward, overlooking the interstate in Ohio, is struck by lightning and completely destroyed!",211,33,38,http://www.reddit.com/r/Freethought/comments/cfaqw/sixstory_tall_statue_of_jesus_coming_out_of_a/,,,False,http://thumbs.reddit.com/t3_cfaqw.png,t5_2qhzx,False,,,False,t3_cfaqw,http://religion.blogs.cnn.com/2010/06/15/jesus-statue-struck-by-lightning/,
1358783922.0,173,thinkprogress.org,16zr4d,"Rick Perry’s Solution To Gun Violence: ‘Pray For Our Children’ -- ""Laws, the only redoubt of secularism, will not suffice. Let us all return to our places of worship and pray for help. Above all, let us pray for our children""",215,42,50,http://www.reddit.com/r/Freethought/comments/16zr4d/rick_perrys_solution_to_gun_violence_pray_for_our/,,,False,http://a.thumbs.redditmedia.com/FGIINtTTItuybLfN.jpg,t5_2qhzx,False,,,False,t3_16zr4d,http://thinkprogress.org/justice/2013/01/16/1458551/rick-perrys-sole-solution-to-gun-violence-pray-for-our-children/,
1352554904.0,173,americanhumanist.org,12ynkv,"American Humanist Association to newly elected Congress: Don't Join Prayer Caucus -- ""Members of the Congressional Prayer Caucus have repeatedly introduced and supported legislation that many secular Americans feel is unconstitutional and often favors Christianity above all other religions""",202,29,4,http://www.reddit.com/r/Freethought/comments/12ynkv/american_humanist_association_to_newly_elected/,,,False,http://f.thumbs.redditmedia.com/rXfx_62KoNdj57rY.jpg,t5_2qhzx,False,,,False,t3_12ynkv,http://www.americanhumanist.org/news/details/2012-11-nonbelievers-ask-new-house-representatives-to-shun-p,
1340219773.0,170,patheos.com,vcceg,"Christian group Illinois Family Institute is freaking out because young people are questioning their faith: ""[this poll] ought to be a call to action for every pastor and patriotic American""",213,43,34,http://www.reddit.com/r/Freethought/comments/vcceg/christian_group_illinois_family_institute_is/,,,False,http://a.thumbs.redditmedia.com/-DJDXV4s5isgpMU6.jpg,t5_2qhzx,False,,,False,t3_vcceg,http://www.patheos.com/blogs/friendlyatheist/2012/06/20/christian-group-is-freaking-out-because-young-people-are-questioning-their-faith/,
1368887630.0,173,thesubjectiv.com,1ekssz,Why the decision to demolish Sandy Hook Elementary School is an unusual and possibly problematic response to a national trauma,200,27,29,http://www.reddit.com/r/Freethought/comments/1ekssz/why_the_decision_to_demolish_sandy_hook/,,,False,http://d.thumbs.redditmedia.com/pJdf07LZL2kEs4O3.jpg,t5_2qhzx,False,,,False,t3_1ekssz,http://thesubjectiv.com/editorials/2013/the-problem-with-demolishing-sandy-hook/,
1349281570.0,171,alternet.org,10vqx0,"
The 10 Most Dangerous Religious Right Organizations. The religious right is more powerful than ever, using its massive annual revenue and grassroots troops to promote a right-wing ideology and undermine church and state separation.",211,40,21,http://www.reddit.com/r/Freethought/comments/10vqx0/the_10_most_dangerous_religious_right/,,,False,http://e.thumbs.redditmedia.com/O4dHowoHxh4qkox4.jpg,t5_2qhzx,False,,,False,t3_10vqx0,http://www.alternet.org/belief/10-most-dangerous-religious-right-organizations?paging=off,
1332113993.0,174,youtube.com,r2ncw,"Moroccan girl commits suicide after being forced to marry rapist, excellent commentary on religion by the Young Turks ",199,25,22,http://www.reddit.com/r/Freethought/comments/r2ncw/moroccan_girl_commits_suicide_after_being_forced/,,,False,http://c.thumbs.redditmedia.com/XE4xgZrDwfTcGJpt.jpg,t5_2qhzx,False,,,False,t3_r2ncw,http://www.youtube.com/watch?v=oT2aDC4HRQg&amp;feature=youtu.be,
1375328028.0,174,scientificamerican.com,1jgy3m,"Religious Experiences Shrink Part of the Brain: A study links life-changing religious experiences, like being “born again,” with atrophy in the hippocampus",223,49,21,http://www.reddit.com/r/Freethought/comments/1jgy3m/religious_experiences_shrink_part_of_the_brain_a/,,,False,http://f.thumbs.redditmedia.com/ZZl44Gow31LhFkEe.jpg,t5_2qhzx,False,,,False,t3_1jgy3m,http://www.scientificamerican.com/article.cfm?id=religious-experiences-shrink-part-of-brain,
1326737476.0,171,youtube.com,ojjid,Psychic's epic fail on live television,204,33,52,http://www.reddit.com/r/Freethought/comments/ojjid/psychics_epic_fail_on_live_television/,,,False,http://c.thumbs.redditmedia.com/F3y_xbI4Q-DgwQF8.jpg,t5_2qhzx,False,,,False,t3_ojjid,http://www.youtube.com/watch?feature=player_embedded&amp;v=cK7j3tB9A6k,
1376578809.0,172,rawstory.com,1kf6o7,"Evangelical pastor to stand trial in Massachusetts for alleged crimes against humanity -- ""The lawsuit alleged that Lively aided the persecution of LGBT people in Uganda over the past decade and inspired notorious anti-LGBT legislation known as the “Kill the Gays” bill""",204,32,28,http://www.reddit.com/r/Freethought/comments/1kf6o7/evangelical_pastor_to_stand_trial_in/,,,False,http://a.thumbs.redditmedia.com/UNwv5kifkKuGiehf.jpg,t5_2qhzx,False,,,False,t3_1kf6o7,http://www.rawstory.com/rs/2013/08/14/evangelical-pastor-to-stand-trial-in-massachusetts-for-alleged-crimes-against-humanity/,
1364655297.0,174,cnn.com,1baxyr,"Condoms on campus? No thanks, we're Catholic, college says -- Boston College students told to stop handing out condoms on campus",210,36,39,http://www.reddit.com/r/Freethought/comments/1baxyr/condoms_on_campus_no_thanks_were_catholic_college/,,,False,default,t5_2qhzx,False,,,False,t3_1baxyr,http://www.cnn.com/2013/03/27/us/boston-college-condoms-dispute,
1341162205.0,175,jonathanturley.org,vvudw,The Myth Of Religious Charity,203,28,31,http://www.reddit.com/r/Freethought/comments/vvudw/the_myth_of_religious_charity/,,,False,http://d.thumbs.redditmedia.com/dTc4JG-NIt5QR3SE.jpg,t5_2qhzx,False,,,False,t3_vvudw,http://jonathanturley.org/2012/07/01/the-myth-of-religious-charity/,
1328239668.0,173,samharris.org,p8qph,Sam Harris on criticizing beliefs.,193,20,71,http://www.reddit.com/r/Freethought/comments/p8qph/sam_harris_on_criticizing_beliefs/,,,False,http://b.thumbs.redditmedia.com/7TAPDeTaEyXYEX71.jpg,t5_2qhzx,False,,,False,t3_p8qph,http://www.samharris.org/blog/item/the-fireplace-delusion,
1375199918.0,170,washingtonpost.com,1jcsaw,Home-schooled student asks local officials to enroll his siblings in public school against his parents' wishes,206,36,87,http://www.reddit.com/r/Freethought/comments/1jcsaw/homeschooled_student_asks_local_officials_to/,,,False,http://c.thumbs.redditmedia.com/a9zlIGn5k_UsYyYt.jpg,t5_2qhzx,False,,,False,t3_1jcsaw,http://www.washingtonpost.com/local/students-home-schooling-highlights-debate-over-va-religious-exemption-law/2013/07/28/ee2dbb1a-efbc-11e2-bed3-b9b6fe264871_story.html?tid=pm_local_pop,
1367787596.0,172,patheos.com,1dr17h,School board member resigns in protest after colleagues decide to vote on prayers at meetings,200,28,26,http://www.reddit.com/r/Freethought/comments/1dr17h/school_board_member_resigns_in_protest_after/,,,False,http://e.thumbs.redditmedia.com/T4XkBiw50Z-F4UlX.jpg,t5_2qhzx,False,,,False,t3_1dr17h,http://www.patheos.com/blogs/friendlyatheist/2013/05/04/school-board-member-resigns-in-protest-after-colleagues-decide-to-vote-on-prayers-at-meetings/,
1328098031.0,171,peoplesworld.org,p6180,"books banned in AZ replaced with new elective course about how ""the Bible and Biblical principles"" influenced Western civilization and democracy",191,20,32,http://www.reddit.com/r/Freethought/comments/p6180/books_banned_in_az_replaced_with_new_elective/,,,False,http://d.thumbs.redditmedia.com/cph2xGjTRRg8Dtio.jpg,t5_2qhzx,False,,,False,t3_p6180,http://www.peoplesworld.org/tucson-bans-mexican-american-studies-students-walk-out/,
1372266073.0,170,imgur.com,1h49vo,95 things to remember about the Mormon religion,221,51,35,http://www.reddit.com/r/Freethought/comments/1h49vo/95_things_to_remember_about_the_mormon_religion/,,,False,http://f.thumbs.redditmedia.com/wd7pdMN_qR_7JUre.jpg,t5_2qhzx,False,,,False,t3_1h49vo,http://imgur.com/a/lBZLC#0,
1371606653.0,171,patheos.com,1gmky7,"Court Strikes Down New Hampshire’s Tax-Money-For-Religious-Schools Law -- ""the government is expressly forbidden from [funding religious education] by the very language of the New Hampshire Constitution""",201,30,2,http://www.reddit.com/r/Freethought/comments/1gmky7/court_strikes_down_new_hampshires/,,,False,http://f.thumbs.redditmedia.com/HD4kZOjiXz8bBTTq.jpg,t5_2qhzx,False,,,False,t3_1gmky7,http://www.patheos.com/blogs/friendlyatheist/2013/06/18/new-hampshires-tax-money-for-religious-schools-law-failed-lets-say-thanks-to-ulysses-grant/,
1368792890.0,165,americanhumanist.org,1eihcl,"Public high school in Missouri has weekly morning prayer sessions led by a teacher -- ""Students are encouraged to attend these sessions by an announcement made by the principal over the school’s intercom system. These public school prayer sessions are clearly unconstitutional.""",209,44,34,http://www.reddit.com/r/Freethought/comments/1eihcl/public_high_school_in_missouri_has_weekly_morning/,,,False,http://f.thumbs.redditmedia.com/rXfx_62KoNdj57rY.jpg,t5_2qhzx,False,,,False,t3_1eihcl,http://www.americanhumanist.org/news/details/2013-05-humanists-demand-an-end-to-teacher-led-prayer-sessio,
1339818214.0,171,patheos.com,v4j9d,"CNN gives more facetime to atheists: ""Friendly Atheist"" (and fellow Redditor) Hemant Mehta will be on at 7 pm ET Saturday along with Secular Student Alliance's Jesse Galef; they will be talking about the future of religion",195,24,10,http://www.reddit.com/r/Freethought/comments/v4j9d/cnn_gives_more_facetime_to_atheists_friendly/,,,False,default,t5_2qhzx,False,,,False,t3_v4j9d,http://www.patheos.com/blogs/friendlyatheist/2012/06/15/im-appearing-on-cnn-tomorrow/,
1292308009.0,170,newsfeed.time.com,elhdf,Looks Like Julian Assange is going to be Time Magazine's man of the year.,187,17,14,http://www.reddit.com/r/Freethought/comments/elhdf/looks_like_julian_assange_is_going_to_be_time/,,,False,default,t5_2qhzx,False,,,False,t3_elhdf,http://newsfeed.time.com/2010/12/13/julian-assange-readers-choice-for-times-person-of-the-year-2010/#ixzz180bBoCok,
1351647920.0,171,religion.blogs.cnn.com,12di32,"My Take: God not in whirlwinds of Sandy, presidential race – by Stephen Prothero, ""When it comes to storms like Sandy, I just don't believe in a God who drowns black babies in Haiti yet refuses to drown out the voices of cranky white men who claim so irreverently to speak in His name.""",203,32,21,http://www.reddit.com/r/Freethought/comments/12di32/my_take_god_not_in_whirlwinds_of_sandy/,,,False,http://d.thumbs.redditmedia.com/NfexIHzRs4grsnCc.jpg,t5_2qhzx,False,,,False,t3_12di32,http://religion.blogs.cnn.com/2012/10/29/my-take-god-not-in-whirlwinds-of-sandy-presidential-race/?iid=article_sidebar,
1343107398.0,171,artsbeat.blogs.nytimes.com,x254q,"A weeklong contest to determine ""the least credible history book in print"" was just concluded by the History News Network. The winner: ""The Jefferson Lies"" by Christian historical revisionist David Barton",210,39,20,http://www.reddit.com/r/Freethought/comments/x254q/a_weeklong_contest_to_determine_the_least/,,,False,http://d.thumbs.redditmedia.com/fm0nditpV82L_Q4K.jpg,t5_2qhzx,False,,,False,t3_x254q,http://artsbeat.blogs.nytimes.com/2012/07/16/and-the-worst-book-of-history-is/,
1285254905.0,165,timesonline.co.uk,dhv7v,"In general, higher rates of belief in and worship of a creator correlate with higher rates of homicide, juvenile and early adult mortality, STD infection rates, teen pregnancy and abortion in the prosperous democracies.",191,26,38,http://www.reddit.com/r/Freethought/comments/dhv7v/in_general_higher_rates_of_belief_in_and_worship/,,,False,default,t5_2qhzx,False,,,False,t3_dhv7v,http://www.timesonline.co.uk/tol/news/uk/article571206.ece,
1274477689.0,171,palibandaily.com,c6u46,"Most Texans want teachers and scholars to decide school curriculum, not fundamentalist-stacked Texas State Board of Education",178,7,18,http://www.reddit.com/r/Freethought/comments/c6u46/most_texans_want_teachers_and_scholars_to_decide/,,,False,http://thumbs.reddit.com/t3_c6u46.png,t5_2qhzx,False,,,False,t3_c6u46,http://www.palibandaily.com/2010/05/21/poll-result-texans-want-experts-not-board-members-to-decide-curriculum/,
1347918860.0,167,ffrf.org,101ma3,"Three Illinois public schools are coming under fire because of a decision to invite First Amendment advocate Jessica Ahlquist to speak during their ""Constitution Week"" festivities; the Christian anti-gay Illinois Family Institute has issued a mean-spirited call to citizens to protest her appearances",195,28,9,http://www.reddit.com/r/Freethought/comments/101ma3/three_illinois_public_schools_are_coming_under/,,,False,default,t5_2qhzx,False,,,False,t3_101ma3,http://ffrf.org/news/action/tell-illinois-schools-to-stand-by-jessica-ahlquist/,
1330881740.0,167,peoplesworld.org,qhbb4,"Georgia sheriff say no to policing of free speech. """"The role of law enforcement should not be to police free speech. But the intent of the bill seems to be just that.""  Fulton County Sheriff Theodore ""Ted"" Jackson ",179,12,12,http://www.reddit.com/r/Freethought/comments/qhbb4/georgia_sheriff_say_no_to_policing_of_free_speech/,,,False,default,t5_2qhzx,False,,,False,t3_qhbb4,http://peoplesworld.org/georgia-sheriff-condemns-proposed-anti-picketing-law/,
1348297445.0,163,realcourage.org,10afey,"Violence, murders, and demands for public beheadings for a video insulting your religion? Hypocrisy - Egyptian *state television* aired a 41 part series based on ""Protocols of the Elders of Zion"" that accuses Jews of a global conspiracy, murdering Christian babies, and fabrication of the Holocaust.",201,38,35,http://www.reddit.com/r/Freethought/comments/10afey/violence_murders_and_demands_for_public/,,,False,http://e.thumbs.redditmedia.com/jWnud8ZbK9E7jYkp.jpg,t5_2qhzx,False,,,False,t3_10afey,http://www.realcourage.org/2010/01/egyptian-tv-defends-anti-jewish-hate/,
1285040638.0,169,bsalert.com,dgo6v,"In his weekly address, Obama tells us to prepare for an unparalleled wave of anonymous attack ads, now made legal by a bad SCOTUS decision",182,13,31,http://www.reddit.com/r/Freethought/comments/dgo6v/in_his_weekly_address_obama_tells_us_to_prepare/,,,False,http://thumbs.reddit.com/t3_dgo6v.png,t5_2qhzx,False,,,False,t3_dgo6v,http://bsalert.com/news/2619/Obama_Be_Prepared_For_New_Wave_Of_Anonymous_Attack_Ads.html,
1351441468.0,168,guardian.co.uk,1281va,"How Christian fundamentalism feeds the toxic partisanship of US politics: When evangelicals attack 'the gay agenda' of an anti-bullying event in schools, something is sick in America's religious culture",193,25,13,http://www.reddit.com/r/Freethought/comments/1281va/how_christian_fundamentalism_feeds_the_toxic/,,,False,http://c.thumbs.redditmedia.com/0cX_kTqz_jKjOCut.jpg,t5_2qhzx,False,,,False,t3_1281va,http://www.guardian.co.uk/commentisfree/2012/oct/26/religious-fundamentalism-toxic-partisanship-us-politics,
1326939952.0,169,coffeeshopatheist.com,omkfx,"MLK, Jr. believed Virgin Birth to be Mistranslation of Isaiah, believed Christianity was influenced by Mithraism",185,16,21,http://www.reddit.com/r/Freethought/comments/omkfx/mlk_jr_believed_virgin_birth_to_be_mistranslation/,,,False,http://c.thumbs.redditmedia.com/J5Ev9fxSavGWhyot.jpg,t5_2qhzx,False,,,False,t3_omkfx,http://coffeeshopatheist.com/blog/2012/01/mlk-jr-theology/,
1291794595.0,167,news.yahoo.com,ei60q,It Was an Unnecessary Death Which Could Have Been Avoided by Taking Their Son to the Doctor Rather Than Praying.,180,13,48,http://www.reddit.com/r/Freethought/comments/ei60q/it_was_an_unnecessary_death_which_could_have_been/,,,False,http://thumbs.reddit.com/t3_ei60q.png,t5_2qhzx,False,,,False,t3_ei60q,http://news.yahoo.com/s/ap/20101207/ap_on_re_us/us_prayer_death_toddler,
1376317185.0,165,patheos.com,1k7h9a,"Researchers Aggregate 63 Studies and Find ‘Significant Negative Association Between Intelligence and Religiosity’ -- ""intelligent people are less likely to conform and, thus, are more likely to resist religious dogma""",194,29,31,http://www.reddit.com/r/Freethought/comments/1k7h9a/researchers_aggregate_63_studies_and_find/,,,False,http://e.thumbs.redditmedia.com/Fwb-PzMz1bQ92L_X.jpg,t5_2qhzx,False,,,False,t3_1k7h9a,http://www.patheos.com/blogs/friendlyatheist/2013/08/12/researchers-aggregate-63-studies-and-find-significant-negative-association-between-intelligence-and-religiosity/,
1368137247.0,166,startribune.com,1e12ws,"Minnesota House approves gay marriage bill: ""Opponents argued the bill would leave those people opposed for religious reasons tarred as bigots""",195,29,57,http://www.reddit.com/r/Freethought/comments/1e12ws/minnesota_house_approves_gay_marriage_bill/,,,False,http://a.thumbs.redditmedia.com/BiuBQ4yhV6M9gqQx.jpg,t5_2qhzx,False,,,False,t3_1e12ws,http://www.startribune.com/politics/206794041.html,
1351019484.0,164,whyevolutionistrue.wordpress.com,11ym0h,New Atheism scares a Christian because it’s *too optimistic*,213,49,34,http://www.reddit.com/r/Freethought/comments/11ym0h/new_atheism_scares_a_christian_because_its_too/,,,False,http://b.thumbs.redditmedia.com/NeCprOhdJ_vCwpnm.jpg,t5_2qhzx,False,,,False,t3_11ym0h,https://whyevolutionistrue.wordpress.com/2012/10/22/new-atheism-scares-a-christian-because-its-too-optimistic/,
1299040389.0,165,youtube.com,fvk9g,"Fox wishes you to believe that there are palm trees in Madison Wisconsin. Oh, and that there are violent union thugs hiding in them. ",189,24,16,http://www.reddit.com/r/Freethought/comments/fvk9g/fox_wishes_you_to_believe_that_there_are_palm/,,,False,http://thumbs.reddit.com/t3_fvk9g.png,t5_2qhzx,False,,,False,t3_fvk9g,http://www.youtube.com/watch?v=RClJ6vK9x_4,
1286991233.0,164,patheos.com,dqrgg,Want to know what the fundamental differences between the world's major religions are?  This web site allows you to compare.,173,9,26,http://www.reddit.com/r/Freethought/comments/dqrgg/want_to_know_what_the_fundamental_differences/,,,False,http://thumbs.reddit.com/t3_dqrgg.png,t5_2qhzx,False,,,False,t3_dqrgg,http://www.patheos.com/Library/Lenses/Side-By-Side.html?path1=x714&amp;path2=x621&amp;path3=x1574,
1240870498.0,166,zenhabits.net,8fy1x,"“This [seven word phrase] is the registered trademark of Susan Jeffers, Ph.D. and is used with her permission.”",171,5,36,http://www.reddit.com/r/Freethought/comments/8fy1x/this_seven_word_phrase_is_the_registered/,,,False,http://thumbs.reddit.com/t3_8fy1x.png,t5_2qhzx,False,,,False,t3_8fy1x,http://zenhabits.net/2009/04/feel-the-fear-and-do-it-anyway-or-the-privatization-of-the-english-language/,
1366675538.0,163,news.yahoo.com,1cwf33,"China wants to promote knowledge and banish superstitious beliefs about things like sickness and death, the country's top religious affairs official told a state-run newspaper",196,33,24,http://www.reddit.com/r/Freethought/comments/1cwf33/china_wants_to_promote_knowledge_and_banish/,,,False,http://f.thumbs.redditmedia.com/U02Ze4CbwZTWS_IG.jpg,t5_2qhzx,False,,,False,t3_1cwf33,http://news.yahoo.com/china-says-aims-banish-superstition-promote-knowledge-055415307.html?rss=1,
1316537362.0,163,freethoughtpedia.com,klqfz,A long list of contradictions in the Bible,193,30,53,http://www.reddit.com/r/Freethought/comments/klqfz/a_long_list_of_contradictions_in_the_bible/,,,False,http://thumbs.reddit.com/t3_klqfz.png,t5_2qhzx,False,,,False,t3_klqfz,http://freethoughtpedia.com/wiki/Bible_Contradictions,
