created_utc,score,domain,id,title,ups,downs,num_comments,permalink,selftext,link_flair_text,over_18,thumbnail,subreddit_id,edited,link_flair_css_class,author_flair_css_class,is_self,name,url,distinguished
1309739168.0,66,samharris.org,ifzp1,Sam Harris responds to a critique of his AMA video : the importance of understanding transcendence (x-post),83,17,28,http://www.reddit.com/r/Freethought/comments/ifzp1/sam_harris_responds_to_a_critique_of_his_ama/,,,False,http://thumbs.reddit.com/t3_ifzp1.png,t5_2qhzx,False,,,False,t3_ifzp1,http://www.samharris.org/blog/item/whats-the-point-of-transcendence/,
1294967285.0,67,csmonitor.com,f1xbk,"I never thought I'd agree with the Christian Science Monitor:  ""Why astrology is even sillier than we thought """,99,32,35,http://www.reddit.com/r/Freethought/comments/f1xbk/i_never_thought_id_agree_with_the_christian/,,,False,http://thumbs.reddit.com/t3_f1xbk.png,t5_2qhzx,False,,,False,t3_f1xbk,http://www.csmonitor.com/Science/2011/0113/New-zodiac-sign-Ophiuchus-Why-astrology-is-even-sillier-than-we-thought,
1272381129.0,67,news.com.au,bws71,Evangelical filmmaker '99.9 percent sure' he's found Noah's ark,84,17,47,http://www.reddit.com/r/Freethought/comments/bws71/evangelical_filmmaker_999_percent_sure_hes_found/,,,False,http://thumbs.reddit.com/t3_bws71.png,t5_2qhzx,False,,,False,t3_bws71,http://www.news.com.au/breaking-news/pc-certainty-of-noahs-ark-discovery-on-mount-ararat/story-e6frfku0-1225858591328,
1266838147.0,65,news.bbc.co.uk,b4yu7,BBC News - NHS money 'wasted' on homeopathy,78,13,12,http://www.reddit.com/r/Freethought/comments/b4yu7/bbc_news_nhs_money_wasted_on_homeopathy/,,,False,http://thumbs.reddit.com/t3_b4yu7.png,t5_2qhzx,False,,,False,t3_b4yu7,http://news.bbc.co.uk/1/hi/health/8524926.stm,
1265122473.0,67,alternet.org,ax4y2,"Because of a ""time bomb"" effect, you may be far more susceptible to propaganda than you think.
",77,10,10,http://www.reddit.com/r/Freethought/comments/ax4y2/because_of_a_time_bomb_effect_you_may_be_far_more/,,,False,default,t5_2qhzx,False,,,False,t3_ax4y2,http://www.alternet.org/module/printversion/143831,
1360163767.0,64,wonkette.com,1802fg,David Barton gets his gun facts from fiction. This time not the bible.,74,10,8,http://www.reddit.com/r/Freethought/comments/1802fg/david_barton_gets_his_gun_facts_from_fiction_this/,,,False,http://f.thumbs.redditmedia.com/H7ex7FcGEcPwWukw.jpg,t5_2qhzx,False,,,False,t3_1802fg,http://wonkette.com/500104/genius-of-history-david-barton-finds-reliable-gun-facts-in-louis-lamour-novel,
1324325831.0,63,aljazeera.com,niv7q,"Vaclav Havel, the late artist, activist, and president of the Czech Republic, wrote an excellent piece on the role of intellectuals in politics and society.  ",75,12,0,http://www.reddit.com/r/Freethought/comments/niv7q/vaclav_havel_the_late_artist_activist_and/,,,False,http://c.thumbs.redditmedia.com/159VYMsl1ZCj9JD8.jpg,t5_2qhzx,False,,,False,t3_niv7q,http://www.aljazeera.com/indepth/opinion/2011/12/2011121983828945679.html,
1306124383.0,67,whyevolutionistrue.wordpress.com,hhs6r,Why out-of-body and near-death experiences don’t prove God,79,12,16,http://www.reddit.com/r/Freethought/comments/hhs6r/why_outofbody_and_neardeath_experiences_dont/,,,False,default,t5_2qhzx,False,,,False,t3_hhs6r,http://whyevolutionistrue.wordpress.com/2011/05/22/why-out-of-body-and-near-death-experiences-dont-prove-god/,
1293086219.0,62,youtube.com,eqb4d,Bill Donohue has a simple solution to any conflict between religions: everyone should convert to Catholicism,78,16,35,http://www.reddit.com/r/Freethought/comments/eqb4d/bill_donohue_has_a_simple_solution_to_any/,,,False,http://thumbs.reddit.com/t3_eqb4d.png,t5_2qhzx,False,,,False,t3_eqb4d,http://www.youtube.com/watch?v=OewwDBMrF5Q,
1352403292.0,61,wendythomasrussell.com,12ve9w,"Yoga Class Indoctrinates Kids! (Um, Yeah, No)",81,20,12,http://www.reddit.com/r/Freethought/comments/12ve9w/yoga_class_indoctrinates_kids_um_yeah_no/,,,False,http://d.thumbs.redditmedia.com/LWOFlf9K4KhyrjG9.jpg,t5_2qhzx,False,,,False,t3_12ve9w,http://wendythomasrussell.com/yoga-class-indoctrinates-kids-um-yeah-no/,
1347245099.0,66,samharris.org,zmtpe,Sam Harris - Life Without Free Will,77,11,9,http://www.reddit.com/r/Freethought/comments/zmtpe/sam_harris_life_without_free_will/,,,False,http://e.thumbs.redditmedia.com/YTowLStBpDUqUznd.jpg,t5_2qhzx,False,,,False,t3_zmtpe,http://www.samharris.org/blog/item/life-without-free-will,
1300778139.0,62,youtube.com,g8sbz,"Obama's Nobel Prize speech. r/Politics doesn't want to have a rational discussion of it, or even watch it, so maybe we can have one in FreeThought. :)",93,31,41,http://www.reddit.com/r/Freethought/comments/g8sbz/obamas_nobel_prize_speech_rpolitics_doesnt_want/,,,False,http://thumbs.reddit.com/t3_g8sbz.png,t5_2qhzx,False,,,False,t3_g8sbz,http://www.youtube.com/watch?v=k3uU_mCNcKM,
1253033899.0,62,palibandaily.com,9ktw4,"Modern-Day Witch Hunt at Stoudtburg Village: Religious bigotry is alive and well in Pennsylvania. Once again, witches — that is, neo-Pagans, Wiccans, and the like — are the target of Christians’ rhetoric of hate and intolerance.",74,12,14,http://www.reddit.com/r/Freethought/comments/9ktw4/modernday_witch_hunt_at_stoudtburg_village/,,,False,http://thumbs.reddit.com/t3_9ktw4.png,t5_2qhzx,False,,,False,t3_9ktw4,http://www.palibandaily.com/2009/09/15/modern-day-witch-hunt-at-stoudtbrg-village/,
1233869442.0,68,democracyforamerica.com,7v76z,"Texas teacher suspended for ""being too liberal.""",73,5,6,http://www.reddit.com/r/Freethought/comments/7v76z/texas_teacher_suspended_for_being_too_liberal/,,,False,http://thumbs.reddit.com/t3_7v76z.png,t5_2qhzx,False,,,False,t3_7v76z,http://democracyforamerica.com/blog_posts/27752-texas-teacher-suspended-for-being-liberal-and-an-atheist,
1361558649.0,59,malcontentsgambit.com,1919il,"Dan Barker talks about the expansion of the FFRF, our priorities this year and a few of our currents cases including our case against the IRS and Jackson, OH.",72,13,0,http://www.reddit.com/r/Freethought/comments/1919il/dan_barker_talks_about_the_expansion_of_the_ffrf/,,,False,http://d.thumbs.redditmedia.com/issnH0GeMTbi8nzo.jpg,t5_2qhzx,False,,,False,t3_1919il,http://www.malcontentsgambit.com/tag/freedom-from-religion-foundation/,
1353442298.0,66,jsonline.com,13ixs8,"An atheist group at UW-Madison seems on track to receive nearly $70,000 in student fees for staffing and programming next year, in what appears to be a first for the university and student atheist groups nationally",75,9,1,http://www.reddit.com/r/Freethought/comments/13ixs8/an_atheist_group_at_uwmadison_seems_on_track_to/,,,False,http://c.thumbs.redditmedia.com/YZqiwuMSnsF_451n.jpg,t5_2qhzx,False,,,False,t3_13ixs8,http://www.jsonline.com/features/religion/atheist-group-likely-to-get-67000-in-uwmadison-student-fees-n27koob-179388121.html,
1297110911.0,62,christianpost.com,fh2et,"""...we can draw a straight line from the emergence of evolutionary theory to the resurgence of atheism in our times.""",79,17,63,http://www.reddit.com/r/Freethought/comments/fh2et/we_can_draw_a_straight_line_from_the_emergence_of/,,,False,http://thumbs.reddit.com/t3_fh2et.png,t5_2qhzx,False,,,False,t3_fh2et,http://www.christianpost.com/article/20110207/the-new-atheism-and-the-dogma-of-darwinism/,
1275039193.0,60,youtube.com,c8zp8,The vides the USA (Army) doesn't want you to see.,73,13,19,http://www.reddit.com/r/Freethought/comments/c8zp8/the_vides_the_usa_army_doesnt_want_you_to_see/,,,False,http://thumbs.reddit.com/t3_c8zp8.png,t5_2qhzx,False,,,False,t3_c8zp8,http://www.youtube.com/watch?v=8XE4eRiKrz8,
1253683759.0,60,liarsforjesus.com,9n77u,Liars For Jesus - The Religious Right's Alternate Version of American History,71,11,3,http://www.reddit.com/r/Freethought/comments/9n77u/liars_for_jesus_the_religious_rights_alternate/,,,False,http://thumbs.reddit.com/t3_9n77u.png,t5_2qhzx,False,,,False,t3_9n77u,http://www.liarsforjesus.com/,
1249948922.0,66,scienceblogs.com,99e4t,P.Z. Myers reviews the Creation 'Museum',76,10,5,http://www.reddit.com/r/Freethought/comments/99e4t/pz_myers_reviews_the_creation_museum/,,,False,http://thumbs.reddit.com/t3_99e4t.png,t5_2qhzx,False,,,False,t3_99e4t,http://scienceblogs.com/pharyngula/2009/08/the_creation_museum_1.php,
1370184870.0,64,thesubjectiv.com,1fir6a,"Talk is cheap, but it’s also deadly – How careless rhetoric has and may continue to motivate violence in the US",82,18,12,http://www.reddit.com/r/Freethought/comments/1fir6a/talk_is_cheap_but_its_also_deadly_how_careless/,,,False,http://e.thumbs.redditmedia.com/Ob4m67pepxJxr1up.jpg,t5_2qhzx,False,,,False,t3_1fir6a,http://thesubjectiv.com/editorials/2013/talk-is-cheap-but-its-also-deadly-how-to-incite-violence-with-careless-rhetoric/,
1361902925.0,61,huffingtonpost.com,199sft,Pakistan's Ambassador To The U.S Investigated For Blasphemy -- She could face the death penalty for indirectly insulting the Prophet Muhammad because she stood up for a Pakistani Christian who was earlier sentenced to death for blasphemy,70,9,6,http://www.reddit.com/r/Freethought/comments/199sft/pakistans_ambassador_to_the_us_investigated_for/,,,False,http://b.thumbs.redditmedia.com/XKh5lnzbWuKdbmkg.jpg,t5_2qhzx,False,,,False,t3_199sft,http://www.huffingtonpost.com/2013/02/21/sherry-rehman-blasphemy-pakistan-ambassador_n_2734501.html,
1348144742.0,65,illusionsanddelusions.com,106tdc,What we learn from Islam's hypersensitivity,83,18,9,http://www.reddit.com/r/Freethought/comments/106tdc/what_we_learn_from_islams_hypersensitivity/,,,False,http://d.thumbs.redditmedia.com/0eMECtSdtBOm8NwQ.jpg,t5_2qhzx,False,,,False,t3_106tdc,http://illusionsanddelusions.com/what-we-learn-from-islams-hypersensitivity/,
1345062005.0,66,coffeewithcaesar.com,ya2ux,"Hope I'm not repeating myself too much here, but here's an article I wrote examining the flaws of religious education.",90,24,11,http://www.reddit.com/r/Freethought/comments/ya2ux/hope_im_not_repeating_myself_too_much_here_but/,,,False,http://f.thumbs.redditmedia.com/AqfuLiVDSnZbbHyw.jpg,t5_2qhzx,False,,,False,t3_ya2ux,http://coffeewithcaesar.com/faith-substitute-fact/,
1340810537.0,64,space.com,vos7i,Religion Would Likely Survive Alien Life Discovery,86,22,36,http://www.reddit.com/r/Freethought/comments/vos7i/religion_would_likely_survive_alien_life_discovery/,,,False,http://a.thumbs.redditmedia.com/YajFSqiFxwlQhrOr.jpg,t5_2qhzx,False,,,False,t3_vos7i,http://www.space.com/16285-alien-life-discovery-religion-impact.html,
1304442729.0,60,talk2action.org,h3a2a,"""Pray For Newark"" claims amazing results as its Christian volunteers ""prayer walk"" the Newark city streets, seeking to pray down crime.  Um, no.",71,11,7,http://www.reddit.com/r/Freethought/comments/h3a2a/pray_for_newark_claims_amazing_results_as_its/,,,False,default,t5_2qhzx,False,,,False,t3_h3a2a,http://www.talk2action.org/story/2011/5/3/91235/90609/,
1297390779.0,61,news.yahoo.com,fj6fg,"Multiculturalism has failed, says French president",70,9,43,http://www.reddit.com/r/Freethought/comments/fj6fg/multiculturalism_has_failed_says_french_president/,,,False,http://thumbs.reddit.com/t3_fj6fg.png,t5_2qhzx,False,,,False,t3_fj6fg,http://news.yahoo.com/s/afp/20110210/wl_afp/francepoliticsimmigrationsociety_20110210231042,
1285789813.0,64,bsalert.com,dknpk,"I continue to have friends and associates speak of the economic mess, ""Obama's created.""  I wrote this essay almost 2 years ago with a more rational examination of what really happened. ",81,17,14,http://www.reddit.com/r/Freethought/comments/dknpk/i_continue_to_have_friends_and_associates_speak/,,,False,http://thumbs.reddit.com/t3_dknpk.png,t5_2qhzx,False,,,False,t3_dknpk,http://bsalert.com/news/2416/What_Caused_The_Second_Depression_In-A-Nutshell.html?r4,
1275010736.0,63,foreignpolicy.com,c8vvd,Mikey Weinstein's Crusade -- the man who wants to purge evangelical religion from the military,68,5,1,http://www.reddit.com/r/Freethought/comments/c8vvd/mikey_weinsteins_crusade_the_man_who_wants_to/,,,False,http://thumbs.reddit.com/t3_c8vvd.png,t5_2qhzx,False,,,False,t3_c8vvd,http://www.foreignpolicy.com/articles/2010/05/25/mikey_weinsteins_crusade,
1271098077.0,58,palibandaily.com,bpx1z,Research suggests that near-death experiences may be induced by elevated CO2 in the bloodstream.,68,10,13,http://www.reddit.com/r/Freethought/comments/bpx1z/research_suggests_that_neardeath_experiences_may/,,,False,http://thumbs.reddit.com/t3_bpx1z.png,t5_2qhzx,False,,,False,t3_bpx1z,http://www.palibandaily.com/2010/04/10/near-death-experience-overdose-of-co2/,
1261958703.0,64,freethoughtpedia.com,aj0g4,"Shhhh!  It's ""a Secret.""  The ""Power of Attraction"" new agey scam that has everyone from Oprah to your masseuse falling for a well-produced bastardization of science.",72,8,21,http://www.reddit.com/r/Freethought/comments/aj0g4/shhhh_its_a_secret_the_power_of_attraction_new/,,,False,http://thumbs.reddit.com/t3_aj0g4.png,t5_2qhzx,False,,,False,t3_aj0g4,http://www.freethoughtpedia.com/wiki/The_Secret?r2,
1261169175.0,59,infopackets.com,ag9wn,"Hey Reddit, How can a country call itself 'free' and get away with mass censorship of the entire Internet?",66,7,17,http://www.reddit.com/r/Freethought/comments/ag9wn/hey_reddit_how_can_a_country_call_itself_free_and/,,,False,http://thumbs.reddit.com/t3_ag9wn.png,t5_2qhzx,False,,,False,t3_ag9wn,http://www.infopackets.com/news/government/2009/20091218_australian_govt_approves_internet_censorship_plan.htm,
1236053887.0,60,atheistnation.net,81mar,Stephen Colbert interview w/ Richard Dawkins,67,7,12,http://www.reddit.com/r/Freethought/comments/81mar/stephen_colbert_interview_w_richard_dawkins/,,,False,http://thumbs.reddit.com/t3_81mar.png,t5_2qhzx,False,,,False,t3_81mar,http://www.atheistnation.net/video/?video/02662/atheist/stephen-colbert-interview-w-richard-dawkins/,
1373612172.0,58,news.atheists.org,1i50vu,Fifty Years of Reason: A Special Message from our President on the Anniversary of the Supreme Court Case that Launched American Atheists,83,25,2,http://www.reddit.com/r/Freethought/comments/1i50vu/fifty_years_of_reason_a_special_message_from_our/,,,False,http://c.thumbs.redditmedia.com/qJfsgTMPp2tcYFaD.jpg,t5_2qhzx,False,,,False,t3_1i50vu,http://news.atheists.org/2013/06/17/fifty-years-of-reason-a-special-message-from-our-president-on-the-anniversary-of-the-supreme-court-case-that-launched-american-atheists/,
1373066791.0,57,patheos.com,1hpwqq,Dale McGowan: How to Raise (Actual) Freethinkers,74,17,2,http://www.reddit.com/r/Freethought/comments/1hpwqq/dale_mcgowan_how_to_raise_actual_freethinkers/,,,False,default,t5_2qhzx,False,,,False,t3_1hpwqq,http://www.patheos.com/blogs/friendlyatheist/2013/07/05/dale-mcgowan-how-to-raise-actual-freethinkers/,
1356314641.0,60,counterpunch.org,15cpiy,"Atheism and the Class Problem, Revisited » Why Obscene Levels of Inequality are the Moral Issue of Our Time",84,24,22,http://www.reddit.com/r/Freethought/comments/15cpiy/atheism_and_the_class_problem_revisited_why/,,,False,http://d.thumbs.redditmedia.com/BbmftO22dXwAiaKi.jpg,t5_2qhzx,False,,,False,t3_15cpiy,http://www.counterpunch.org/2012/12/21/atheism-and-the-class-problem-revisited/,
1344870574.0,61,youtu.be,y5au5,Did You Choose Your Beliefs? Something to keep in mind and discuss. [Vlog],95,34,25,http://www.reddit.com/r/Freethought/comments/y5au5/did_you_choose_your_beliefs_something_to_keep_in/,,,False,http://a.thumbs.redditmedia.com/o9-oXycGHALnr4c6.jpg,t5_2qhzx,False,,,False,t3_y5au5,http://youtu.be/aD90H18HY0Y,
1339135218.0,60,huffingtonpost.com,ur6oo,"Michigan Anti-Abortion Bill, 'Most Extreme' In The Country, Barrels Through State House.",73,13,7,http://www.reddit.com/r/Freethought/comments/ur6oo/michigan_antiabortion_bill_most_extreme_in_the/,,,False,http://c.thumbs.redditmedia.com/UpE5HELZWMGsqf1V.jpg,t5_2qhzx,False,,,False,t3_ur6oo,http://www.huffingtonpost.com/2012/06/07/michigan-abortion-bill_n_1578179.html,
1335246136.0,60,whyevolutionistrue.wordpress.com,spk16,William Lane Craig and the incoherence of (and prevalence of belief in) Hell,76,16,6,http://www.reddit.com/r/Freethought/comments/spk16/william_lane_craig_and_the_incoherence_of_and/,,,False,http://f.thumbs.redditmedia.com/YVVaJtwSCzfKQQgA.jpg,t5_2qhzx,False,,,False,t3_spk16,http://whyevolutionistrue.wordpress.com/2012/04/22/william-lane-craig-and-the-incoherence-of-and-prevalence-of-belief-in-hell/,
1334892179.0,60,current.com,sj14r,Cenk to Catholic League: Why bother with ‘Daily Show’ boycott if ‘John Stewart is gonna burn over an open fire’?,72,12,6,http://www.reddit.com/r/Freethought/comments/sj14r/cenk_to_catholic_league_why_bother_with_daily/,,,False,http://d.thumbs.redditmedia.com/fAWFTA4UBUseH60E.jpg,t5_2qhzx,False,,,False,t3_sj14r,http://current.com/shows/the-young-turks/videos/cenk-to-catholic-league-why-bother-with-daily-show-boycott-if-john-stewart-is-gonna-burn-over-an-open-fire,
1330138504.0,63,alternet.org,q4zlb,Rick Santorum On Religious Freedom: What He Has Forgotten Since Law School | News &amp; Politics | AlterNet,74,11,10,http://www.reddit.com/r/Freethought/comments/q4zlb/rick_santorum_on_religious_freedom_what_he_has/,,,False,http://f.thumbs.redditmedia.com/PaeIUOi6_NNfB_e_.jpg,t5_2qhzx,False,,,False,t3_q4zlb,http://www.alternet.org/news/154277/rick_santorum_on_religious_freedom:_what_he_has_forgotten_since_law_school?utm_source=feedblitz&amp;utm_medium=FeedBlitzRss&amp;utm_campaign=alternet,
1328816312.0,58,news.emory.edu,pi6p9,"""Why Religion Is Natural and Science Is Not"". Emory philosopher Robert McCauley suggests that science is more fragile than we think while religion more resilient – all for reasons coming back to humans' cognitive processes.",94,36,63,http://www.reddit.com/r/Freethought/comments/pi6p9/why_religion_is_natural_and_science_is_not_emory/,,,False,http://f.thumbs.redditmedia.com/8CMu0msMUsuuru8M.jpg,t5_2qhzx,False,,,False,t3_pi6p9,http://news.emory.edu/stories/2012/02/er_book_report_robert_mccauley/campus.html,
1297049244.0,59,bsalert.com,fgm8t,"On this 100th anniversary of Ronald Reagan, here's an economist's unabashed analysis of what Reagan's economic policy did to America.",77,18,18,http://www.reddit.com/r/Freethought/comments/fgm8t/on_this_100th_anniversary_of_ronald_reagan_heres/,,,False,default,t5_2qhzx,False,,,False,t3_fgm8t,http://bsalert.com/news/2634/What_Ronald_Reagan_Actually_Did_To_The_American_Economy.html,
1293951245.0,63,americamagazine.org,euufg,On Their Way Out,69,6,13,http://www.reddit.com/r/Freethought/comments/euufg/on_their_way_out/,,,False,http://thumbs.reddit.com/t3_euufg.png,t5_2qhzx,False,,,False,t3_euufg,http://www.americamagazine.org/content/article.cfm?article_id=12642,
1290035451.0,58,bluecollarmamma.wordpress.com,e7s4k,"Thanks, Mr. Weird Guy! .. By the time I reached my stoop, I was nearly in tears. Not because I was scared. I’ve lived in this neighborhood all my life and know how to deal with random junkies. Hell, I know half of them. No, I was nearly in tears because he had a good point.",90,32,14,http://www.reddit.com/r/Freethought/comments/e7s4k/thanks_mr_weird_guy_by_the_time_i_reached_my/,,,False,default,t5_2qhzx,False,,,False,t3_e7s4k,http://bluecollarmamma.wordpress.com/2010/11/17/thanks-mr-weird-guy/,
1277306452.0,64,freethinker.co.uk,ci5zg,Ad campaign launched in London to improve the image of Islam,68,4,18,http://www.reddit.com/r/Freethought/comments/ci5zg/ad_campaign_launched_in_london_to_improve_the/,,,False,http://thumbs.reddit.com/t3_ci5zg.png,t5_2qhzx,False,,,False,t3_ci5zg,http://freethinker.co.uk/2010/06/21/ad-campaign-launched-in-london-to-improve-the-image-of-islam/,
1274126358.0,58,freethoughtpedia.com,c5a78,Why should atheists care about religion?,76,18,41,http://www.reddit.com/r/Freethought/comments/c5a78/why_should_atheists_care_about_religion/,,,False,http://thumbs.reddit.com/t3_c5a78.png,t5_2qhzx,False,,,False,t3_c5a78,http://www.freethoughtpedia.com/wiki/Why_atheists_care_about_religion,
1264870706.0,61,news.bbc.co.uk,aw305,Why do people often vote against their own interests?,67,6,24,http://www.reddit.com/r/Freethought/comments/aw305/why_do_people_often_vote_against_their_own/,,,False,http://thumbs.reddit.com/t3_aw305.png,t5_2qhzx,False,,,False,t3_aw305,http://news.bbc.co.uk/1/hi/world/americas/8474611.stm,
1261265034.0,62,arkansasnews.com,aglug,"Judge overrules Sec. of State's rejection and OKs ""Solstice display"" by an Arkansas atheist group for the grounds of the state capital.",69,7,15,http://www.reddit.com/r/Freethought/comments/aglug/judge_overrules_sec_of_states_rejection_and_oks/,,,False,http://thumbs.reddit.com/t3_aglug.png,t5_2qhzx,False,,,False,t3_aglug,http://arkansasnews.com/2009/12/14/courts-rules-for-%E2%80%98winter-solstice%E2%80%99-display-at-capitol/,
1243966818.0,59,vimeo.com,8p7me,Fundy Christian anti-atheist propaganda has reached a new high (and low),76,17,31,http://www.reddit.com/r/Freethought/comments/8p7me/fundy_christian_antiatheist_propaganda_has/,,,False,http://thumbs.reddit.com/t3_8p7me.png,t5_2qhzx,False,,,False,t3_8p7me,http://www.vimeo.com/4784525,
1374512012.0,58,forbes.com,1itlhs,Is Organic Agriculture 'Affluent Narcissism?',91,33,61,http://www.reddit.com/r/Freethought/comments/1itlhs/is_organic_agriculture_affluent_narcissism/,,,False,http://a.thumbs.redditmedia.com/pVXL5ztidrwV9fml.jpg,t5_2qhzx,False,,,False,t3_1itlhs,http://www.forbes.com/sites/henrymiller/2012/11/07/organic-agricultures-bitter-taste-or-is-organic-agriculture-affluent-narcissism/,
1373569109.0,62,self.Freethought,1i3l5r,Religion ruining the world of politics?,80,18,42,http://www.reddit.com/r/Freethought/comments/1i3l5r/religion_ruining_the_world_of_politics/,"This is just an open thought here a friend and I were discussing. 

Do you feel like religion plays a huge world in politics today and is ruining countries by saying 'this is how we are supposed to live'? 

I think we should just throw religion out the door when it comes to politics but by all means still let people have their FREE will like they should have and be able to still pray to their god or whomever it may be.",,False,self,t5_2qhzx,False,,,True,t3_1i3l5r,http://www.reddit.com/r/Freethought/comments/1i3l5r/religion_ruining_the_world_of_politics/,
1372709147.0,63,wendythomasrussell.com,1hg4kx,4 Reasons I Love Being ‘Out’ as Nonreligious,93,30,8,http://www.reddit.com/r/Freethought/comments/1hg4kx/4_reasons_i_love_being_out_as_nonreligious/,,,False,http://f.thumbs.redditmedia.com/3A5yPGUpLiiNSqwA.jpg,t5_2qhzx,False,,,False,t3_1hg4kx,http://wendythomasrussell.com/coming-out/,
1369308288.0,61,bbc.co.uk,1ewb7n,British soldier hacked to death in Woolwich,80,19,26,http://www.reddit.com/r/Freethought/comments/1ewb7n/british_soldier_hacked_to_death_in_woolwich/,,,False,http://c.thumbs.redditmedia.com/aaV_7APss2x5an_D.jpg,t5_2qhzx,False,,,False,t3_1ewb7n,http://www.bbc.co.uk/news/uk-22634468,
1359206805.0,58,youtu.be,17bb40,Edward Tarte Asks: What if Your God Told You to Kill a Loved One?,81,23,14,http://www.reddit.com/r/Freethought/comments/17bb40/edward_tarte_asks_what_if_your_god_told_you_to/,,,False,http://d.thumbs.redditmedia.com/RNwKDjXV9x1HQtSK.jpg,t5_2qhzx,False,,,False,t3_17bb40,http://youtu.be/Z_hYOy-rpIo,
1355619374.0,57,independent.co.uk,14x444,Debate on Islam and evolution has to be called off after revolt by student societies,72,15,9,http://www.reddit.com/r/Freethought/comments/14x444/debate_on_islam_and_evolution_has_to_be_called/,,,False,http://b.thumbs.redditmedia.com/TN8h-29w_BA5RR7O.jpg,t5_2qhzx,False,,,False,t3_14x444,http://www.independent.co.uk/news/uk/home-news/debate-on-islam-and-evolution-has-to-be-called-off-after-revolt-by-student-societies-8418022.html,
1317232464.0,61,psychologytoday.com,kuasi,The Problem with Absolute Thinking,74,13,10,http://www.reddit.com/r/Freethought/comments/kuasi/the_problem_with_absolute_thinking/,,,False,http://thumbs.reddit.com/t3_kuasi.png,t5_2qhzx,False,,,False,t3_kuasi,http://www.psychologytoday.com/blog/promoting-empathy-your-teen/201109/the-problem-absolute-thinking,
1316045542.0,62,geekatheist.wordpress.com,kfxv7,The utopia the Bible didn't foresee [BLOG; X-post from /r/atheism],85,23,29,http://www.reddit.com/r/Freethought/comments/kfxv7/the_utopia_the_bible_didnt_foresee_blog_xpost/,,,False,http://thumbs.reddit.com/t3_kfxv7.png,t5_2qhzx,False,,,False,t3_kfxv7,http://geekatheist.wordpress.com/2011/09/14/the-future-the-bible-didnt-foresee/,
1313439653.0,59,peoplesworld.org,jjpjh,Protests erupt over cell phone shutdown in San Francisco to prevent rally,63,4,22,http://www.reddit.com/r/Freethought/comments/jjpjh/protests_erupt_over_cell_phone_shutdown_in_san/,,,False,http://thumbs.reddit.com/t3_jjpjh.png,t5_2qhzx,False,,,False,t3_jjpjh,http://www.peoplesworld.org/protests-erupt-over-cell-phone-shutdown/,
1292377689.0,58,doctorofdisbelief.com,elylc,Woman Whipped In Public For Wearing Trousers - This is why we fight,94,36,10,http://www.reddit.com/r/Freethought/comments/elylc/woman_whipped_in_public_for_wearing_trousers_this/,,,False,http://thumbs.reddit.com/t3_elylc.png,t5_2qhzx,False,,,False,t3_elylc,http://www.doctorofdisbelief.com/blog/woman-whipped-in-public-for-wearing-trousers-this-is-why-we-fight.html,
1365027937.0,58,saiu.org,1bmax4,A critique of Murtaza Hussain's article on Sam Harris and scientific racism,70,12,7,http://www.reddit.com/r/Freethought/comments/1bmax4/a_critique_of_murtaza_hussains_article_on_sam/,,,False,http://b.thumbs.redditmedia.com/cM3l4YmXe_En6PKa.jpg,t5_2qhzx,False,,,False,t3_1bmax4,http://saiu.org/2013/04/03/greenwald-and-hussain-on-sam-harris-and-racism/,
