created_utc,score,domain,id,title,ups,downs,num_comments,permalink,selftext,link_flair_text,over_18,thumbnail,subreddit_id,edited,link_flair_css_class,author_flair_css_class,is_self,name,url,distinguished
1351503450.0,725,i.imgur.com,129nmb,"Vikings punter Chris Kluwe featured in AHA advertisement: ""The First Amendment isn't just about the freedom FOR religion, it's also about the freedom FROM religion...I will support your right to worship at whatever altar you choose, but I will not support you trying to force it on someone else""",847,122,91,http://www.reddit.com/r/Freethought/comments/129nmb/vikings_punter_chris_kluwe_featured_in_aha/,,,False,http://f.thumbs.redditmedia.com/DVtEt1Cug3nsAyV_.jpg,t5_2qhzx,False,,,False,t3_129nmb,http://i.imgur.com/gbghl.jpg,
1343693035.0,629,i.imgur.com,xf4yo,CNN has an article from a Christian pastor explaining where his god was during the Aurora CO theater shootings. This is the first comment in reply...and it's fucking brilliant,880,251,155,http://www.reddit.com/r/Freethought/comments/xf4yo/cnn_has_an_article_from_a_christian_pastor/,,,False,http://d.thumbs.redditmedia.com/Rs_arp3jPCtH5yIE.jpg,t5_2qhzx,False,,,False,t3_xf4yo,http://i.imgur.com/Tapgy.png,
1350041481.0,565,patheos.com,11d0gq,"Joe Biden gets the separation of church and state: ""Life begins at conception. That's the [Catholic] church's judgment. I accept it in my personal life. But I refuse to impose it on equally devout Christians and Muslims and Jews and -- I just refuse to impose that on others, unlike [Paul Ryan]""",656,91,120,http://www.reddit.com/r/Freethought/comments/11d0gq/joe_biden_gets_the_separation_of_church_and_state/,,,False,default,t5_2qhzx,False,,,False,t3_11d0gq,http://www.patheos.com/blogs/friendlyatheist/2012/10/11/the-religion-and-abortion-question-in-tonights-debate/,
1336521602.0,562,religion.blogs.cnn.com,tdss2,"Delta pulls 'Daily Show' ads over 'vagina manger' skit: Stewart to Christians Offended by Skit: ""I'm not going to censor myself to comfort your ignorance,""",639,77,85,http://www.reddit.com/r/Freethought/comments/tdss2/delta_pulls_daily_show_ads_over_vagina_manger/,,,False,http://c.thumbs.redditmedia.com/C_aSJnuSxTKTjKIh.jpg,t5_2qhzx,False,,,False,t3_tdss2,http://religion.blogs.cnn.com/2012/05/08/delta-pulls-daily-show-ads-over-vagina-manger-skit/?hpt=hp_c3,
1340379711.0,521,patheos.com,vftrd,"Jesse Ventura, former governor of Minnesota: ""I've come out of the closet now: I'm an atheist. And I'm proud to say it. I'm a follower of George Carlin.""",622,101,77,http://www.reddit.com/r/Freethought/comments/vftrd/jesse_ventura_former_governor_of_minnesota_ive/,,,False,http://a.thumbs.redditmedia.com/rYnEal9nwImsc1Mr.jpg,t5_2qhzx,False,,,False,t3_vftrd,http://www.patheos.com/blogs/friendlyatheist/2012/06/22/jesse-ventura-i%E2%80%99m-an-atheist-and-i%E2%80%99m-proud-to-say-it/,
1353264166.0,501,patheos.com,13eo6n,Drunk-driving teen in Oklahoma sentenced to 10 years of church attendance as part of his probation,587,86,98,http://www.reddit.com/r/Freethought/comments/13eo6n/drunkdriving_teen_in_oklahoma_sentenced_to_10/,,,False,http://f.thumbs.redditmedia.com/GZvgFe3Kvs7ndFjM.jpg,t5_2qhzx,False,,,False,t3_13eo6n,http://www.patheos.com/blogs/friendlyatheist/2012/11/16/drunk-driving-teen-sentenced-to-10-years-of-church-attendance-as-part-of-his-probation/,
1358967356.0,489,nytimes.com,174xko,"“If there’s no god, what would stop me from raping and killing everyone I want to.” My answer is always: “I, myself, have raped and killed everyone I want to ... and the number for both is zero.”",576,87,113,http://www.reddit.com/r/Freethought/comments/174xko/if_theres_no_god_what_would_stop_me_from_raping/,,,False,http://e.thumbs.redditmedia.com/mRW8QWG3D-YaYF34.jpg,t5_2qhzx,False,,,False,t3_174xko,http://www.nytimes.com/roomfordebate/2013/01/22/is-atheism-a-religion/atheism-should-end-religion-not-replace-it,
1345782005.0,482,i.imgur.com,yqjy3,Meet the Members of the Congressional Science Committee Who Don't Get Science,610,128,116,http://www.reddit.com/r/Freethought/comments/yqjy3/meet_the_members_of_the_congressional_science/,,,False,http://c.thumbs.redditmedia.com/hRb_Uq7f2f9u9Lfn.jpg,t5_2qhzx,False,,,False,t3_yqjy3,http://i.imgur.com/Uoua1.jpg,
1344226150.0,432,salon.com,xqx48,"GOP insider: Religion destroyed my party --
A veteran Republican says the religious right has taken over, and turned his party into anti-intellectual nuts; ""All around us now is a prevailing anti-intellectualism and hostility to science""",481,49,115,http://www.reddit.com/r/Freethought/comments/xqx48/gop_insider_religion_destroyed_my_party_a_veteran/,,,False,http://d.thumbs.redditmedia.com/MlqNkMGx_2Gj8CDi.jpg,t5_2qhzx,False,,,False,t3_xqx48,http://www.salon.com/2012/08/05/republicans_slouching_toward_theocracy/,
1343599689.0,409,koat.com,xcyaz,"Christian school rejects 3-year-old because parents are gay; the school will receive more than $60,000 in federal tax dollars this school year",491,82,62,http://www.reddit.com/r/Freethought/comments/xcyaz/christian_school_rejects_3yearold_because_parents/,,,False,http://c.thumbs.redditmedia.com/EUc7kvz-31LcVY58.jpg,t5_2qhzx,False,,,False,t3_xcyaz,http://www.koat.com/news/new-mexico/albuquerque/School-rejects-3-year-old-because-parents-are-gay/-/9153728/15665304/-/aadto3/-/index.html,
1363272153.0,400,ncronline.org,1aab31,"National Catholic Reporter: There are now 22 million ex-Catholics in America, the largest of any religion. One in three Americans raised Catholic has left the church. For every one member the church adds, it loses four.",464,64,92,http://www.reddit.com/r/Freethought/comments/1aab31/national_catholic_reporter_there_are_now_22/,,,False,http://c.thumbs.redditmedia.com/MG1xms8l2NOVXC6J.jpg,t5_2qhzx,False,,,False,t3_1aab31,http://ncronline.org/blogs/all-things-catholic/americas-religious-marketplace-real-catholic-problem-new-sales?page=1,
1356056825.0,398,patheos.com,157cg7,"American Atheists is suing the IRS, claiming that it gives preferential treatment to religious groups",469,71,39,http://www.reddit.com/r/Freethought/comments/157cg7/american_atheists_is_suing_the_irs_claiming_that/,,,False,http://e.thumbs.redditmedia.com/P0Z2qiQrdGAfrBCR.jpg,t5_2qhzx,False,,,False,t3_157cg7,http://www.patheos.com/blogs/friendlyatheist/2012/12/20/american-atheists-is-suing-the-irs-claiming-that-it-gives-preferential-treatment-to-religious-groups/,
1332820241.0,386,ffrf.org,rfcvh,"A missionary's experience with a tribe who define happiness without a god (best article quote: I repeated, “Who made the trees and who made the water?” He answered, “Nobody made the trees and nobody made the water; they’re just trees and water.”) Missionary became atheist.",422,36,37,http://www.reddit.com/r/Freethought/comments/rfcvh/a_missionarys_experience_with_a_tribe_who_define/,,,False,http://c.thumbs.redditmedia.com/IkeHxGGo2wLQKVAn.jpg,t5_2qhzx,False,,,False,t3_rfcvh,http://ffrf.org/publications/freethought-today/articles/the-pirahae-people-who-define-happiness-without-god/,
1349194613.0,380,huffingtonpost.com,10tlzm,"U.S. Army suicide prevention sessions lead to forced ""mass Christian prayer,"" soldiers furious",439,59,38,http://www.reddit.com/r/Freethought/comments/10tlzm/us_army_suicide_prevention_sessions_lead_to/,,,False,http://b.thumbs.redditmedia.com/gAbO_NlEAzaJfbaa.jpg,t5_2qhzx,False,,,False,t3_10tlzm,http://www.huffingtonpost.com/2012/10/02/military-proselytizing-army-chaplain_n_1930703.html,
1335958309.0,369,crackpotchronicle.net,t34p5,"This atheist dad is fighting tooth and nail for custody of his daughter, torn away from him by his ex and her evangelical family (unbelievable)! ",465,96,29,http://www.reddit.com/r/Freethought/comments/t34p5/this_atheist_dad_is_fighting_tooth_and_nail_for/,,,False,http://f.thumbs.redditmedia.com/GC77f-kB24e_TQ_k.jpg,t5_2qhzx,False,,,False,t3_t34p5,http://crackpotchronicle.net/main/2012/05/02/being-an-atheist-is-causing-a-good-man-to-fight-for-custody-of-his-daughter/,
1352918439.0,365,ffrf.org,136yzb,"Freedom From Religion Foundation sues IRS to enforce church electioneering ban, calling it a violation of the Establishment Clause of the First Amendment; as many as 1,500 clergy reportedly violated the electioneering restrictions on Sunday, Oct. 7, 2012",402,37,28,http://www.reddit.com/r/Freethought/comments/136yzb/freedom_from_religion_foundation_sues_irs_to/,,,False,http://c.thumbs.redditmedia.com/Tp4CDec9Ux_D24db.jpg,t5_2qhzx,False,,,False,t3_136yzb,http://ffrf.org/news/news-releases/item/16091-ffrf-sues-irs-to-enforce-church-electioneering-ban,
1348762132.0,353,patheos.com,10kgwn,"US Representative Stephen Fincher (R-TN) has introduced legislation to ""reaffirm the importance of religion"" -- but only if that religion is Christianity",404,51,55,http://www.reddit.com/r/Freethought/comments/10kgwn/us_representative_stephen_fincher_rtn_has/,,,False,http://a.thumbs.redditmedia.com/If-TrnLe3LVb_GGZ.jpg,t5_2qhzx,False,,,False,t3_10kgwn,http://www.patheos.com/blogs/friendlyatheist/2012/09/26/tennessee-congressman-introduces-legislation-to-reaffirm-the-importance-of-religion/,
1368715442.0,353,patheos.com,1egb6q,"After public high school student blows the whistle on Christian abstinence speaker, she's told she can't speak at graduation",421,68,60,http://www.reddit.com/r/Freethought/comments/1egb6q/after_public_high_school_student_blows_the/,,,False,http://e.thumbs.redditmedia.com/MvVJPk5J-6oeM0dL.jpg,t5_2qhzx,False,,,False,t3_1egb6q,http://www.patheos.com/blogs/friendlyatheist/2013/05/16/after-high-school-student-blows-whistle-on-christian-abstinence-speaker-shes-told-she-cant-speak-at-graduation/,
1358376933.0,348,salon.com,16pozy,Religion may not survive the Internet,401,53,85,http://www.reddit.com/r/Freethought/comments/16pozy/religion_may_not_survive_the_internet/,,,False,http://b.thumbs.redditmedia.com/FlKh8SEd8VWIAD_y.jpg,t5_2qhzx,False,,,False,t3_16pozy,http://www.salon.com/2013/01/16/religion_may_not_survive_the_internet/,
1326381812.0,343,centerforinquiry.net,odyxu,Jessica Ahlquist won her lawsuit to have the prayer banner removed from her public school. WIN!,425,82,70,http://www.reddit.com/r/Freethought/comments/odyxu/jessica_ahlquist_won_her_lawsuit_to_have_the/,,,False,http://b.thumbs.redditmedia.com/AQMCv2b5QlHLVJe7.jpg,t5_2qhzx,False,,,False,t3_odyxu,http://www.centerforinquiry.net/oncampus/blog/entry/jessica_ahlquist_won/,
1360866970.0,345,newsok.com,18j1sh,Bill eliminating blasphemy as a crime in Oklahoma advances: A House of Representatives committee passed a measure repealing a law that makes insulting someone's religion a crime,373,28,31,http://www.reddit.com/r/Freethought/comments/18j1sh/bill_eliminating_blasphemy_as_a_crime_in_oklahoma/,,,False,http://e.thumbs.redditmedia.com/0dQJagmiVATT3-Kv.jpg,t5_2qhzx,False,,,False,t3_18j1sh,http://newsok.com/bill-eliminating-blasphemy-as-a-crime-in-oklahoma-advances/article/3752652/,
1340643684.0,347,en.wikipedia.org,vkv9k,"50 years ago today, the US Supreme Court ruled school official-initiated prayer in public schools was unconstitutional",391,44,18,http://www.reddit.com/r/Freethought/comments/vkv9k/50_years_ago_today_the_us_supreme_court_ruled/,,,False,http://b.thumbs.redditmedia.com/YWs77BnyBBKFzMPI.jpg,t5_2qhzx,False,,,False,t3_vkv9k,http://en.wikipedia.org/wiki/Engel_v._Vitale,
1358272419.0,335,npr.org,16mn5l,NPR takes a look at why more and more young people are losing their religion.,397,62,293,http://www.reddit.com/r/Freethought/comments/16mn5l/npr_takes_a_look_at_why_more_and_more_young/,,,False,http://b.thumbs.redditmedia.com/BdTHwW7exj-IVG97.jpg,t5_2qhzx,False,,,False,t3_16mn5l,http://www.npr.org/2013/01/15/169342349/more-young-people-are-moving-away-from-religion-but-why,
1375566774.0,340,patheos.com,1jnbbs,Former Congressman Barney Frank (D-MA) Finally Comes Out as an Atheist,410,70,44,http://www.reddit.com/r/Freethought/comments/1jnbbs/former_congressman_barney_frank_dma_finally_comes/,,,False,http://f.thumbs.redditmedia.com/hgGWe0xT121ykMcw.jpg,t5_2qhzx,False,,,False,t3_1jnbbs,http://www.patheos.com/blogs/friendlyatheist/2013/08/03/former-congressman-barney-frank-finally-comes-out-as-an-atheist/,
1354030345.0,340,time.com,13vkev,"Richard Dawkins: ""Vote Malala [as TIME Magazine's Person of the Year], fighter for girls' education in Pakistan.""",400,60,31,http://www.reddit.com/r/Freethought/comments/13vkev/richard_dawkins_vote_malala_as_time_magazines/,,,False,http://c.thumbs.redditmedia.com/73saAii76YCfrjfD.jpg,t5_2qhzx,False,,,False,t3_13vkev,"http://www.time.com/time/specials/packages/article/0,28804,2128881_2128882_2129199,00.html",
1350821927.0,335,kens5.com,11uamt,"Church in Texas violates federal law by endorsing Mitt Romney: ""Vote for the Mormon, not the Muslim! The capitalist, not the communist!""",399,64,32,http://www.reddit.com/r/Freethought/comments/11uamt/church_in_texas_violates_federal_law_by_endorsing/,,,False,http://f.thumbs.redditmedia.com/03glPO3WeamYQCB_.jpg,t5_2qhzx,False,,,False,t3_11uamt,http://www.kens5.com/home/Church-marquee-with-political-message-stirs-sentiment-in-Leakey-Texas-174869651.html,
1354201878.0,332,csmonitor.com,13zut7,"""Are You Smarter Than an Atheist?"" Christian Science Monitor questionnaire reveals that atheists and agnostics scored the highest on a 32-question survey of religious knowledge.",390,58,131,http://www.reddit.com/r/Freethought/comments/13zut7/are_you_smarter_than_an_atheist_christian_science/,,,False,http://c.thumbs.redditmedia.com/vUf-Cb95lQaO-ch8.jpg,t5_2qhzx,False,,,False,t3_13zut7,http://www.csmonitor.com/USA/2011/0105/Are-you-smarter-than-an-atheist-A-religious-quiz/When-does-the-Jewish-Sabbath-begin,
1359049557.0,334,io9.com,1777l1,How 19-year-old activist Zack Kopplin is making life hell for Louisiana's creationists(x-post:r/atheism),407,73,28,http://www.reddit.com/r/Freethought/comments/1777l1/how_19yearold_activist_zack_kopplin_is_making/,,,False,http://c.thumbs.redditmedia.com/zLFJbcOYi_JU-4fV.jpg,t5_2qhzx,False,,,False,t3_1777l1,http://io9.com/5976112/how-19+year+old-activist-zack-kopplin-is-making-life-hell-for-louisianas-creationists,
1352317442.0,331,religion.blogs.cnn.com,12tao0,"Election results raise questions about Christian right's influence -- For many conservative Christian leaders, it was a nightmare scenario: Barack Obama decisively re-elected. Same-sex marriage adopted by voters in some states. Rigorously anti-abortion candidates defeated in conservative red states.",367,36,38,http://www.reddit.com/r/Freethought/comments/12tao0/election_results_raise_questions_about_christian/,,,False,http://f.thumbs.redditmedia.com/0RVxCJs3L4C8_sCG.jpg,t5_2qhzx,False,,,False,t3_12tao0,http://religion.blogs.cnn.com/2012/11/07/election-results-raise-questions-about-christian-rights-influence/,
1340123767.0,332,patheos.com,va64o,"Englishman calling religion a ""fairy tale for adults"" could be arrested, say police. Because he's an atheist, the police are telling him he could be arrested for the ""threatening"" message he put on his door.",381,49,90,http://www.reddit.com/r/Freethought/comments/va64o/englishman_calling_religion_a_fairy_tale_for/,,,False,http://a.thumbs.redditmedia.com/pQQY2Mn_oNuLQXaf.jpg,t5_2qhzx,False,,,False,t3_va64o,http://www.patheos.com/blogs/friendlyatheist/2012/06/19/englishman-calling-religion-a-fairy-tale-for-adults-could-be-arrested-say-police/,
1354121877.0,329,youtube.com,13xvge,"Pat Robertson denies the Earth is 6,000 years old -- In response to a letter from a Young Earth Creationist mother worried about her family, he said ""if you fight science, you're going to lose your children""",385,56,84,http://www.reddit.com/r/Freethought/comments/13xvge/pat_robertson_denies_the_earth_is_6000_years_old/,,,False,http://d.thumbs.redditmedia.com/3PXaQA75r6CcE9hK.jpg,t5_2qhzx,False,,,False,t3_13xvge,http://www.youtube.com/watch?v=4sKIymtsOAc,
1370354870.0,323,patheos.com,1fnh0v,"America is Intolerant of Christians, Says Christian Leader at Meeting with the Vice President -- The very first line in the piece goes like this: ""Recently I was at a White House meeting with Vice President Joe Biden…"" You’ve already disproven your thesis in the first sentence.",385,62,27,http://www.reddit.com/r/Freethought/comments/1fnh0v/america_is_intolerant_of_christians_says/,,,False,http://b.thumbs.redditmedia.com/h0uayYYr2Z0cjeNU.jpg,t5_2qhzx,False,,,False,t3_1fnh0v,http://www.patheos.com/blogs/friendlyatheist/2013/06/04/america-is-intolerant-of-christians-says-christian-leader-at-meeting-with-the-vice-president/,
1366561788.0,312,newstatesman.com,1ct0c6,"New Atheism should be able to criticise Islam without being accused of Islamophobia - The atheist community is right to pursue rational, civilised debate, and should be able to do so without being tarred as bigots.",378,66,116,http://www.reddit.com/r/Freethought/comments/1ct0c6/new_atheism_should_be_able_to_criticise_islam/,,,False,http://d.thumbs.redditmedia.com/vDBvsUGVOsrg5SCQ.jpg,t5_2qhzx,False,,,False,t3_1ct0c6,http://www.newstatesman.com/religion/2013/04/new-atheism-should-be-able-criticise-islam-without-being-accused-islamophobia,
1309252282.0,317,ffrf.org,ib5ls,"""I can be good without god"" billboard removed because of church complaint in Columbus, Ohio.",337,20,61,http://www.reddit.com/r/Freethought/comments/ib5ls/i_can_be_good_without_god_billboard_removed/,,,False,default,t5_2qhzx,False,,,False,t3_ib5ls,http://ffrf.org/news/releases/church-complains-good-without-god-billboard-removed/,
1348678013.0,309,salon.com,10iick,"Son of a bigot: His dad founded the infamous Westboro Baptist Church. Nate Phelps is dedicated to reversing that legacy of hate. -- Q: ""How did your father explain you were one of God’s chosen ones and yet he could mistreat you?"" A: ""He was able to justify using verses out of the Bible""",377,68,18,http://www.reddit.com/r/Freethought/comments/10iick/son_of_a_bigot_his_dad_founded_the_infamous/,,,False,http://b.thumbs.redditmedia.com/PTo6C0SLgb9Hc7Ms.jpg,t5_2qhzx,False,,,False,t3_10iick,http://www.salon.com/2012/09/25/son_of_a_bigot/,
1344543974.0,313,eyelid.livejournal.com,xyhpy,"Woman walking into an abortion clinic gives Flying Spaghetti Monster pamphlet to anti-choice protester. Anti-choicer assaults her. Woman calls police, gets abortion, then blogs about the experience.",393,80,236,http://www.reddit.com/r/Freethought/comments/xyhpy/woman_walking_into_an_abortion_clinic_gives/,,,False,default,t5_2qhzx,False,,,False,t3_xyhpy,http://eyelid.livejournal.com/1468278.html,
1357938450.0,308,buffalonews.com,16eemw,"Public school teacher in Buffalo NY sues school after being made to remove religious items from her classroom. She had Christian posters, Bible quotes, and a ""prayer request"" box in the room. She teaches biology and anatomy, and ""had referred to Adam and Eve in a discussion about the human rib cage""",355,47,89,http://www.reddit.com/r/Freethought/comments/16eemw/public_school_teacher_in_buffalo_ny_sues_school/,,,False,http://b.thumbs.redditmedia.com/NNs6KziaZ5v0U6JC.jpg,t5_2qhzx,False,,,False,t3_16eemw,http://www.buffalonews.com/apps/pbcs.dll/article?AID=%2F20130110%2FCITYANDREGION%2F130119944%2F1109,
1374109041.0,306,patheos.com,1iiyux,"Rhode Island Governor Vetoes ""Choose Life"" License Plate -- Some of the proceeds benefit a Christian anti-abortion crisis center with a mission to ""share the love and truth of Jesus Christ."" Governor: ""[Sending state money to them] would violate the separation of church and state""",358,52,24,http://www.reddit.com/r/Freethought/comments/1iiyux/rhode_island_governor_vetoes_choose_life_license/,,,False,http://a.thumbs.redditmedia.com/rDywdlUZ9wiOFg8l.jpg,t5_2qhzx,False,,,False,t3_1iiyux,http://www.patheos.com/blogs/friendlyatheist/2013/07/17/rhode-island-governor-vetoes-choose-life-license-plate/,
1349619689.0,297,nydailynews.com,1135y6,"Paralyzed bank manager terminally ill with brain cancer fights for her right to die; her parents are Evangelical Christians and want to keep her alive (against her wishes) because she would go to hell for suicide; her mother: ""I keep telling her she can get better. God's going to save you.""",339,42,78,http://www.reddit.com/r/Freethought/comments/1135y6/paralyzed_bank_manager_terminally_ill_with_brain/,,,False,http://d.thumbs.redditmedia.com/lH7-qGS1VA7fXAKo.jpg,t5_2qhzx,False,,,False,t3_1135y6,http://www.nydailynews.com/new-york/queens/paralyzed-terminally-ill-patient-fight-death-article-1.1174383,
1336605620.0,297,salon.com,tfj2n,"Noam Chomskey: ""Jobs aren't coming back because America no longer makes anything.. it just manipulates money.""",376,79,63,http://www.reddit.com/r/Freethought/comments/tfj2n/noam_chomskey_jobs_arent_coming_back_because/,,,False,http://c.thumbs.redditmedia.com/1O21rUgf0U_2EpW8.jpg,t5_2qhzx,False,,,False,t3_tfj2n,http://www.salon.com/2012/05/08/chomsky_jobs_arent_coming_back/singleton/,
1313897450.0,294,christianpost.com,jpdax,"Atheist group in Arkansas wants to put ""Are you good without god? Millions are,"" signs on buses. Judge rules they must post $15k damage deposit because they will likely be vandalized by christians.",316,22,75,http://www.reddit.com/r/Freethought/comments/jpdax/atheist_group_in_arkansas_wants_to_put_are_you/,,,False,default,t5_2qhzx,False,,,False,t3_jpdax,http://www.christianpost.com/news/arkansas-judge-oks-atheist-bus-ads-christians-fight-back-53831/?r1,
1345228836.0,293,rdfrs.com,ye1fp,"Richard Dawkins: England's religious-inspired legal system forbids assisted suicide for two men, who have locked-in-syndrome and who cannot physically kill themselves -- ""I am ashamed of my country and its laws""",337,44,40,http://www.reddit.com/r/Freethought/comments/ye1fp/richard_dawkins_englands_religiousinspired_legal/,,,False,http://c.thumbs.redditmedia.com/1WaTZYO5qtrGYeNh.jpg,t5_2qhzx,False,,,False,t3_ye1fp,http://rdfrs.com/foundation_articles/2012/8/17/no-precedent-then-set-one,
1344001113.0,293,joemygod.blogspot.com,xma91,"Fox News' Meghan Kelly...actually makes sense? She said people used the Bible to justify slavery, banning interracial marriages, and keeping women as second class citizens. All of these were overturned. So how is same-sex marriage any different?",345,52,55,http://www.reddit.com/r/Freethought/comments/xma91/fox_news_meghan_kellyactually_makes_sense_she/,,,False,http://b.thumbs.redditmedia.com/5sK3Yj60cDC5V6xa.jpg,t5_2qhzx,False,,,False,t3_xma91,http://joemygod.blogspot.com/2012/08/fox-news-host-vs-world-net-daily.html,
1362969952.0,293,change.org,1a25av,"Facebook has shut down a non-violent page of secularists and atheists in Pakistan. Meanwhile, Facebook has long allowed a page that provides specific image instructions on how to stone people to death according to ""God's law.""",368,75,10,http://www.reddit.com/r/Freethought/comments/1a25av/facebook_has_shut_down_a_nonviolent_page_of/,,,False,default,t5_2qhzx,False,,,False,t3_1a25av,http://www.change.org/petitions/mark-zuckerberg-sheryl-sandberg-restore-peaceful-pakistani-fb-page-compare-to-page-w-stoning-to-death-how-to,
1288360470.0,289,advocate.com,dy8of,"Arkansas school board member says he'll wear purple if all homosexuals commit suicide.  Says it on Facebook, thinking it will be ""private."" oops.",328,39,28,http://www.reddit.com/r/Freethought/comments/dy8of/arkansas_school_board_member_says_hell_wear/,,,False,http://thumbs.reddit.com/t3_dy8of.png,t5_2qhzx,False,,,False,t3_dy8of,http://www.advocate.com/News/News_Features/Arkansas_School_Board_Member_Thinks_Fags_Should_Die//,
1360244892.0,286,alternet.org,182b3y,Busting the Myth That Christians Are More Generous Than Non-Believers - Many religious people believe giving to the church is the be-all and end all of generosity.,326,40,17,http://www.reddit.com/r/Freethought/comments/182b3y/busting_the_myth_that_christians_are_more/,,,False,http://e.thumbs.redditmedia.com/4MKTTY2kOCK5eBoF.jpg,t5_2qhzx,False,,,False,t3_182b3y,http://www.alternet.org/belief/busting-myth-christians-are-more-generous-non-believers,
1351777578.0,287,tbo.com,12ggcg,"Christian pastor urges 600 other pastors to bring politics into pulpits: ""Tell your people that they have a choice: to cast a vote for righteousness or vote for unrighteousness."" He then alluded to the Holocaust when warning about what will happen if Obama is reelected.",332,45,51,http://www.reddit.com/r/Freethought/comments/12ggcg/christian_pastor_urges_600_other_pastors_to_bring/,,,False,http://d.thumbs.redditmedia.com/A88iTBy5luL0bmx3.jpg,t5_2qhzx,False,,,False,t3_12ggcg,http://www2.tbo.com/lifestyles/life/2012/oct/31/wtbn-speaker-urges-pastors-to-bring-politics-into-ar-549483/,
1364489067.0,288,patheos.com,1b6owj,More Americans Than Ever Before See the Bible as a Book of Myths,350,62,20,http://www.reddit.com/r/Freethought/comments/1b6owj/more_americans_than_ever_before_see_the_bible_as/,,,False,http://b.thumbs.redditmedia.com/2kLfQcYQ9BZHA0iU.jpg,t5_2qhzx,False,,,False,t3_1b6owj,http://www.patheos.com/blogs/friendlyatheist/2013/03/28/more-americans-than-ever-before-see-the-bible-as-a-book-of-myths/,
1344424919.0,286,belfasttelegraph.co.uk,xvjuz,"Ireland abandoning religion faster than almost every other country: In 2005, 69% of people declared themselves to be ""a religious person""; now, only 47% do",336,50,25,http://www.reddit.com/r/Freethought/comments/xvjuz/ireland_abandoning_religion_faster_than_almost/,,,False,http://e.thumbs.redditmedia.com/3su3L0TS7LQhz66X.jpg,t5_2qhzx,False,,,False,t3_xvjuz,http://www.belfasttelegraph.co.uk/news/local-national/republic-of-ireland/ireland-abandoning-religion-faster-than-almost-every-other-country-16195112.html,
