created_utc,score,domain,id,title,ups,downs,num_comments,permalink,selftext,link_flair_text,over_18,thumbnail,subreddit_id,edited,link_flair_css_class,author_flair_css_class,is_self,name,url,distinguished
1330718051.0,9,alternet.org,qevj8,The World Bank's Plans for Fisheries Could Destroy Fishing Communities,10,1,0,http://www.reddit.com/r/oceans/comments/qevj8/the_world_banks_plans_for_fisheries_could_destroy/,,,False,,t5_2s7su,False,,,False,t3_qevj8,http://www.alternet.org/newsandviews/article/824695/the_world_bank%27s_plans_for_fisheries_could_destroy_fishing_communities/www.foodandwaterwatch.org/blogs,
1330116190.0,12,bbc.co.uk,q4jc1,Interactive BBC page illustrates the depths of the oceans.,12,0,0,http://www.reddit.com/r/oceans/comments/q4jc1/interactive_bbc_page_illustrates_the_depths_of/,,,False,,t5_2s7su,False,,,False,t3_q4jc1,http://www.bbc.co.uk/news/science-environment-17013285,
1329031487.0,10,swissinfo.ch,pltze,"Oceans could run out of oxygen, Swiss co-authored study warns - swissinfo",10,0,0,http://www.reddit.com/r/oceans/comments/pltze/oceans_could_run_out_of_oxygen_swiss_coauthored/,,,False,,t5_2s7su,False,,,False,t3_pltze,http://www.swissinfo.ch/eng/science_technology/Oceans_could_run_out_of_oxygen.html?cid=32061254,
1328705446.0,10,sciencenews.org,pg6bt,Deep Life: It’s time to meet the intraterrestrials,11,1,0,http://www.reddit.com/r/oceans/comments/pg6bt/deep_life_its_time_to_meet_the_intraterrestrials/,,,False,,t5_2s7su,False,,,False,t3_pg6bt,http://www.sciencenews.org/view/feature/id/337918/title/Deep_Life,
1328451181.0,12,imgur.com,pbtsw,Blue Whales (7200x4800) [x-post from r/wallpaper],13,1,3,http://www.reddit.com/r/oceans/comments/pbtsw/blue_whales_7200x4800_xpost_from_rwallpaper/,,,False,,t5_2s7su,False,,,False,t3_pbtsw,http://imgur.com/3nZvJ,
1327970626.0,9,upi.com,p3swu,'Microplastic' said accumulating in oceans,10,1,2,http://www.reddit.com/r/oceans/comments/p3swu/microplastic_said_accumulating_in_oceans/,,,False,,t5_2s7su,False,,,False,t3_p3swu,http://www.upi.com/Science_News/2012/01/27/Microplastic-said-accumulating-in-oceans/UPI-25571327702371/?spt=hs&amp;or=sn,
1327907325.0,10,sciencedaily.com,p2qu1,An int'l team of scientists concluded that anthropogenic CO2 emissions over the last 100 to 200 years have already raised ocean acidity far beyond the range of natural variations. | xpost /r/science,10,0,2,http://www.reddit.com/r/oceans/comments/p2qu1/an_intl_team_of_scientists_concluded_that/,,,False,,t5_2s7su,False,,,False,t3_p2qu1,http://www.sciencedaily.com/releases/2012/01/120122152542.htm,
1325675396.0,12,physorg.com,o2e4x,"'Lost world' discovered around Antarctic vents: 
Communities of species previously unknown to 
science have been discovered on the seafloor near 
Antarctica, clustered in the hot, dark environment 
surrounding hydrothermal vents",12,0,0,http://www.reddit.com/r/oceans/comments/o2e4x/lost_world_discovered_around_antarctic_vents/,,,False,,t5_2s7su,False,,,False,t3_o2e4x,http://www.physorg.com/news/2012-01-lost-world-antarctic-vents.html,
1325171975.0,10,newyorker.com,nuyrm,Culture Desk: No Sharks Were Harmed in the Making of This Shark Fin Soup : The New Yorker,10,0,0,http://www.reddit.com/r/oceans/comments/nuyrm/culture_desk_no_sharks_were_harmed_in_the_making/,,,False,,t5_2s7su,False,,,False,t3_nuyrm,http://www.newyorker.com/online/blogs/culture/2011/12/no-sharks-were-harmed-in-the-making-of-this-shark-fin-soup.html,
1324482939.0,10,timeslive.co.za,nlcct,"Businessman helps crack rhino horn, ivory and shark fin ring | Cape Town",10,0,0,http://www.reddit.com/r/oceans/comments/nlcct/businessman_helps_crack_rhino_horn_ivory_and/,,,False,,t5_2s7su,False,,,False,t3_nlcct,http://www.timeslive.co.za/local/2011/12/21/businessman-helps-crack-rhino-horn-ring,
1323714235.0,9,buzzfeed.com,n9w0i,[VIDEO] A moray eel visits the doctor,10,1,0,http://www.reddit.com/r/oceans/comments/n9w0i/video_a_moray_eel_visits_the_doctor/,,,False,,t5_2s7su,False,,,False,t3_n9w0i,http://www.buzzfeed.com/thejives/eel-out-of-water-3ku0,
1322167764.0,9,lh4.googleusercontent.com,mo7c1,Thanksgiving Photo: Released orphaned penguin chicks follow an adult back to the ocean,10,1,1,http://www.reddit.com/r/oceans/comments/mo7c1/thanksgiving_photo_released_orphaned_penguin/,,,False,,t5_2s7su,False,,,False,t3_mo7c1,https://lh4.googleusercontent.com/-1EOOwkl-SEI/Ts5UGUeQhFI/AAAAAAAAAUA/2mc7ogT-hAU/s640/blogger-image--2009948362.jpg,
1321828551.0,10,uwire.com,mjf34,Algae poisons Gulf of Mexico,10,0,0,http://www.reddit.com/r/oceans/comments/mjf34/algae_poisons_gulf_of_mexico/,,,False,,t5_2s7su,False,,,False,t3_mjf34,http://uwire.com/2011/11/17/algae-poisons-gulf-of-mexico/,
1319766702.0,10,ldeo.columbia.edu,lrp93,Debunking a common myth: climate change is not going to shut down the Gulf Stream and cause an ice age in Europe.,12,2,0,http://www.reddit.com/r/oceans/comments/lrp93/debunking_a_common_myth_climate_change_is_not/,,,False,,t5_2s7su,False,,,False,t3_lrp93,http://www.ldeo.columbia.edu/res/div/ocp/gs/,
1317520537.0,8,sciencedaily.com,kxzuz,"Sharks are in trouble, new analysis confirms: Sharks are in big trouble on the Great Barrier Reef and worldwide, according to an Australian-based team who have developed a world-first way to measure rates of decline in shark populations. ",13,5,0,http://www.reddit.com/r/oceans/comments/kxzuz/sharks_are_in_trouble_new_analysis_confirms/,,,False,,t5_2s7su,False,,,False,t3_kxzuz,http://www.sciencedaily.com/releases/2011/09/110929103057.htm,
1317456473.0,9,guardian.co.uk,kxce3,"UK cod collapse due to overfishing and political failure, says fisheries expert",11,2,0,http://www.reddit.com/r/oceans/comments/kxce3/uk_cod_collapse_due_to_overfishing_and_political/,,,False,,t5_2s7su,False,,,False,t3_kxce3,http://www.guardian.co.uk/environment/2011/sep/30/uk-cod-collapse-overfishing?intcmp=122,
1316701053.0,10,thedorsalfin.com,knwuk,Scott Cassell doesn't see a single shark on 30-mile dive to raise awareness about decreasing shark populations,10,0,0,http://www.reddit.com/r/oceans/comments/knwuk/scott_cassell_doesnt_see_a_single_shark_on_30mile/,,,False,,t5_2s7su,False,,,False,t3_knwuk,http://www.thedorsalfin.com/shark-news-stories/scott-cassell-doesnt-see-a-single-shark-on-30-mile-dive/,
1314807782.0,10,news.discovery.com,k0bil,Smart or what? - Dolphin Fish-Eating Trick Catches On,10,0,0,http://www.reddit.com/r/oceans/comments/k0bil/smart_or_what_dolphin_fisheating_trick_catches_on/,,,False,,t5_2s7su,False,,,False,t3_k0bil,http://news.discovery.com/animals/dolphins-fish-trick-110831.html,
1314772692.0,8,vimeo.com,jzy6v,"Sperm Whale Encounter, gorgeous HD video (watch fullscreen)",10,2,2,http://www.reddit.com/r/oceans/comments/jzy6v/sperm_whale_encounter_gorgeous_hd_video_watch/,,,False,,t5_2s7su,False,,,False,t3_jzy6v,http://vimeo.com/19050434,
1311312260.0,10,theseamonster.net,iwk7l,Breaking news: 357 dead sharks found on illegal fishing vessel in Galapagos National Park,10,0,0,http://www.reddit.com/r/oceans/comments/iwk7l/breaking_news_357_dead_sharks_found_on_illegal/,,,False,,t5_2s7su,False,,,False,t3_iwk7l,http://theseamonster.net/2011/07/illegal-shark-fishing-vessel-caught-in-galapagos-national-park/,
1375128511.0,10,americanwaterblog.com,1jarqy,More than 20m acres in the Gulf of Mexico will go on sale for oil and natural gas development next month,11,1,2,http://www.reddit.com/r/oceans/comments/1jarqy/more_than_20m_acres_in_the_gulf_of_mexico_will_go/,,,False,,t5_2s7su,False,,,False,t3_1jarqy,http://americanwaterblog.com/2013/07/20-7-million-acres-of-gulf-oil-and-gas-leases-for-sale-in-august.html,
1374846677.0,10,reddit.com,1j3haa,Hey! Rebecca Aldworth of Humane Society International is doing an IAmA today about ending the commercial slaughter of baby seals - it just went live,14,4,0,http://www.reddit.com/r/oceans/comments/1j3haa/hey_rebecca_aldworth_of_humane_society/,,,False,,t5_2s7su,False,,,False,t3_1j3haa,http://www.reddit.com/r/IAmA/comments/1j3g2s/i_am_rebecca_aldworth_with_humane_society/,
1374788812.0,8,fondriest.com,1j212n,"In Chesapeake Bay, water quality dictates where near-bottom fish swim",10,2,0,http://www.reddit.com/r/oceans/comments/1j212n/in_chesapeake_bay_water_quality_dictates_where/,,,False,,t5_2s7su,False,,,False,t3_1j212n,http://www.fondriest.com/news/water-quality-dictates-where-near-bottom-fish-swim-in-chesapeake-bay.htm,
1372224296.0,10,youtube.com,1h39sm,"Here is the highlight reel from ""The Americas"" Hangout I did for World Oceans Day",10,0,0,http://www.reddit.com/r/oceans/comments/1h39sm/here_is_the_highlight_reel_from_the_americas/,,,False,,t5_2s7su,False,,,False,t3_1h39sm,http://www.youtube.com/watch?v=VaxyRrVSgNo&amp;feature=youtu.be,
1371774866.0,9,blog.mbl.edu,1grivd,MBL oceanographers to air research dive from depths of Caribbean Sea live tomorrow (Friday 6am EST),10,1,1,http://www.reddit.com/r/oceans/comments/1grivd/mbl_oceanographers_to_air_research_dive_from/,,,False,,t5_2s7su,False,,,False,t3_1grivd,http://blog.mbl.edu/?p=2374,
1371302177.0,9,guardian.co.uk,1gecdx,"New species of shellfish, polychaete worms and ancient 'living fossil' species of shark discovered near methane vent in north-east Atlantic",9,0,0,http://www.reddit.com/r/oceans/comments/1gecdx/new_species_of_shellfish_polychaete_worms_and/,,,False,,t5_2s7su,False,,,False,t3_1gecdx,http://www.guardian.co.uk/environment/2013/jun/14/fishing-banned-rockall-new-species-found,
1369175536.0,9,oneworldoneocean.com,1esm98,"A bunch of teenagers created some PSAs for World Oceans Day, and they are so cute.",11,2,0,http://www.reddit.com/r/oceans/comments/1esm98/a_bunch_of_teenagers_created_some_psas_for_world/,,,False,,t5_2s7su,False,,,False,t3_1esm98,http://www.oneworldoneocean.com/get-involved/wod-vc-voting,
1369065930.0,9,inhabitat.com,1ep7us,"The Fallacy of Cleaning the Gyres of Plastic With a Floating 'Ocean Cleanup Array': ""What I find astonishing is that out of all the gyre cleanup proponents I've met, none of them have ever been to the gyres.""",10,1,4,http://www.reddit.com/r/oceans/comments/1ep7us/the_fallacy_of_cleaning_the_gyres_of_plastic_with/,,,False,,t5_2s7su,False,,,False,t3_1ep7us,http://inhabitat.com/the-fallacy-of-cleaning-the-gyres-of-plastic-with-a-floating-ocean-cleanup-array/5-gyres-ocean-plastic-pollution-3/,
1368210980.0,10,strandednomore.wordpress.com,1e30n5,"Military Excercise Joint Warrior &amp; Marine Mammal Casualties: 6 killer whales, 4 pilot whales and one Sowerby’s beaked whale",24,14,0,http://www.reddit.com/r/oceans/comments/1e30n5/military_excercise_joint_warrior_marine_mammal/,,,False,,t5_2s7su,False,,,False,t3_1e30n5,http://strandednomore.wordpress.com/2013/05/10/military-excercise-joint-warrior-marine-mammal-casualties-6-killer-whales-4-pilot-whales-and-one-sowerbys-beaked-whale/,
1367840530.0,8,kickstarter.com,1dsce1,Microcosm: a high-definition expedition into the ocean universe through the lens of a microscope,14,6,1,http://www.reddit.com/r/oceans/comments/1dsce1/microcosm_a_highdefinition_expedition_into_the/,,,False,,t5_2s7su,False,,,False,t3_1dsce1,http://www.kickstarter.com/projects/1016645379/microcosm,
1366942692.0,8,vimeo.com,1d4lx9,Oahu,9,1,0,http://www.reddit.com/r/oceans/comments/1d4lx9/oahu/,,,False,,t5_2s7su,False,,,False,t3_1d4lx9,https://vimeo.com/63924812,
1366914444.0,9,grindtv.com,1d3k7k,Humpback whale rescued after dramatic community effort in La Paz Bay,9,0,0,http://www.reddit.com/r/oceans/comments/1d3k7k/humpback_whale_rescued_after_dramatic_community/,,,False,,t5_2s7su,False,,,False,t3_1d3k7k,http://www.grindtv.com/outdoor/nature/post/humpback-whale-rescued-after-dramatic-community-effort-in-mexicos-la-paz-bay/,
1366041855.0,9,youtube.com,1ce8v3,Shatner is helping save the ocean--asks you to save Kipper and the Bering Sea,11,2,2,http://www.reddit.com/r/oceans/comments/1ce8v3/shatner_is_helping_save_the_oceanasks_you_to_save/,,,False,,t5_2s7su,False,,,False,t3_1ce8v3,http://www.youtube.com/watch?v=aeqidklrDBY,
1364582674.0,9,vimeo.com,1b99gh,Meet Cyro a robotic jellyfish which could be used for undersea military surveillance.,9,0,5,http://www.reddit.com/r/oceans/comments/1b99gh/meet_cyro_a_robotic_jellyfish_which_could_be_used/,,,False,,t5_2s7su,False,,,False,t3_1b99gh,http://vimeo.com/62880818,
1363736519.0,9,climatecentral.org,1amm77,Large Fractures Spotted in Vulnerable Arctic Sea Ice,10,1,0,http://www.reddit.com/r/oceans/comments/1amm77/large_fractures_spotted_in_vulnerable_arctic_sea/,,,False,,t5_2s7su,False,,,False,t3_1amm77,http://www.climatecentral.org/news/large-fractures-spotted-in-arctic-sea-ice-15728,
1362508200.0,8,vimeo.com,19pxyx,Protecting Our Coast: Marine Protected Areas in the Monterey bay ,10,2,0,http://www.reddit.com/r/oceans/comments/19pxyx/protecting_our_coast_marine_protected_areas_in/,,,False,,t5_2s7su,False,,,False,t3_19pxyx,http://vimeo.com/61032787,
1362163543.0,8,guardian.co.uk,19h61l,Sea Shepherd conservation group declared 'pirates' in US court ruling ,11,3,6,http://www.reddit.com/r/oceans/comments/19h61l/sea_shepherd_conservation_group_declared_pirates/,,,False,,t5_2s7su,False,,,False,t3_19h61l,http://www.guardian.co.uk/environment/2013/feb/27/sea-shepherd-pirates-us-court?goback=%2Egde_2346752_member_218374357,
1361970488.0,9,youtube.com,19bpeu,"National Geographic's ""City Under the Sea"", a speculative future documentary about human settlements in the ocean",10,1,2,http://www.reddit.com/r/oceans/comments/19bpeu/national_geographics_city_under_the_sea_a/,,,False,,t5_2s7su,False,,,False,t3_19bpeu,http://www.youtube.com/watch?v=RcHJbQ1ele4,
1360593515.0,8,guardian.co.uk,18b5of,David Miliband to head global fight to prevent eco-disaster in oceans | Environment,10,2,3,http://www.reddit.com/r/oceans/comments/18b5of/david_miliband_to_head_global_fight_to_prevent/,,,False,,t5_2s7su,False,,,False,t3_18b5of,http://www.guardian.co.uk/environment/2013/feb/09/lawless-high-seas-threaten-the-planet?intcmp=122,
1360272049.0,8,scientificamerican.com,1836on,Tainted Samples Caused Gender-Bending Ocean Fish ,11,3,1,http://www.reddit.com/r/oceans/comments/1836on/tainted_samples_caused_genderbending_ocean_fish/,,,False,,t5_2s7su,False,,,False,t3_1836on,http://www.scientificamerican.com/article.cfm?id=tainted-samples-caused-gender-bending-ocean-fish,
1359726772.0,9,self.oceans,17oz6k,"Monthly Beach Cleanup - Sat Feb2nd 2013, Key Biscayne/Miami FL",11,2,0,http://www.reddit.com/r/oceans/comments/17oz6k/monthly_beach_cleanup_sat_feb2nd_2013_key/,"Please join us for our Monthly Beach Cleanup. 8:00am, Sat Feb2nd 2013, Key Biscayne, FL. Hope to see you there!

Event details at our Facebook Page: http://www.facebook.com/events/230629737072259/

Also please join our group: http://www.facebook.com/groups/soflabeachcleanup/

Map of the beach we adopted to cleanup: http://i.imgur.com/SZ4fU.jpg
",,False,,t5_2s7su,False,,,True,t3_17oz6k,http://www.reddit.com/r/oceans/comments/17oz6k/monthly_beach_cleanup_sat_feb2nd_2013_key/,
1358197972.0,9,explorers.neaq.org,16kn8v,"Leopard seals, researchers study robots in Antarctica",9,0,1,http://www.reddit.com/r/oceans/comments/16kn8v/leopard_seals_researchers_study_robots_in/,,,False,,t5_2s7su,False,,,False,t3_16kn8v,http://explorers.neaq.org/2013/01/antarctica-expedition-palmer-lters.html,
1358038779.0,10,coastodian.org,16gsav,"Sparkle, a northern fur seal pup rescued at Drakes Beach, Point Reyes National Seashore, and her struggle to survive",11,1,0,http://www.reddit.com/r/oceans/comments/16gsav/sparkle_a_northern_fur_seal_pup_rescued_at_drakes/,,,False,,t5_2s7su,False,,,False,t3_16gsav,http://coastodian.org/?p=892,
1357143788.0,10,youtu.be,15txe6,Waves crash on grounded Shell drilling ship in Alaska - YouTube,13,3,2,http://www.reddit.com/r/oceans/comments/15txe6/waves_crash_on_grounded_shell_drilling_ship_in/,,,False,,t5_2s7su,False,,,False,t3_15txe6,http://youtu.be/YMOaQYTar3w,
1356148938.0,9,foodandwaterwatch.org,159k1n,Holiday Horror Story: GE Salmon Swims Towards Approval | Food &amp; Water Watch,10,1,0,http://www.reddit.com/r/oceans/comments/159k1n/holiday_horror_story_ge_salmon_swims_towards/,,,False,,t5_2s7su,False,,,False,t3_159k1n,https://www.foodandwaterwatch.org/blogs/ge-salmon-swims-towards-approval-hows-that-for-a-holiday-surprise/,
1355539638.0,9,un.org,14vkr8,UN report highlights importance of ocean-friendly investments,9,0,0,http://www.reddit.com/r/oceans/comments/14vkr8/un_report_highlights_importance_of_oceanfriendly/,,,False,,t5_2s7su,False,,,False,t3_14vkr8,http://www.un.org/apps/news/story.asp?NewsID=43780&amp;Cr=undp&amp;Cr1=#.UMvkmIU1rg8,
1355386333.0,10,californiakingtides.org,14ryuh,Biggest tides of the year. Take photos of the King Tides and help envision future scenarios. ,11,1,0,http://www.reddit.com/r/oceans/comments/14ryuh/biggest_tides_of_the_year_take_photos_of_the_king/,,,False,,t5_2s7su,False,,,False,t3_14ryuh,http://www.californiakingtides.org/citizenscience/,
1354804139.0,8,news.yahoo.com,14du80,Filmmaker Cameron Expedition Finds Weird Deep-Sea Life - Yahoo! News,9,1,0,http://www.reddit.com/r/oceans/comments/14du80/filmmaker_cameron_expedition_finds_weird_deepsea/,,,False,,t5_2s7su,False,,,False,t3_14du80,http://news.yahoo.com/filmmaker-cameron-expedition-finds-weird-deep-sea-life-215833028.html,
1353805345.0,8,kickstarter.com,13qlcu,Surfrider SANTA BARBARA Chapter Needs Your Help! 4 Days Left to Save Gaviota! ,11,3,1,http://www.reddit.com/r/oceans/comments/13qlcu/surfrider_santa_barbara_chapter_needs_your_help_4/,,,False,,t5_2s7su,False,,,False,t3_13qlcu,http://www.kickstarter.com/projects/thetwenty/the-twenty-a-surfrider-foundation-film,
1352785254.0,8,rjd.miami.edu,133y7s,Toxic Food Webs,10,2,0,http://www.reddit.com/r/oceans/comments/133y7s/toxic_food_webs/,,,False,,t5_2s7su,False,,,False,t3_133y7s,http://rjd.miami.edu/research/projects/toxic-food-webs,
1350320355.0,10,rightwhales.neaq.org,11ionk,Orca sighting in the Bay of Fundy,11,1,0,http://www.reddit.com/r/oceans/comments/11ionk/orca_sighting_in_the_bay_of_fundy/,,,False,,t5_2s7su,False,,,False,t3_11ionk,http://rightwhales.neaq.org/2012/10/23-one-last-peek-at-bay.html,
1349984093.0,7,wired.com,11bps3,The Kraken's Cousin: Searching for the Mysterious Jumbo Squid,10,3,0,http://www.reddit.com/r/oceans/comments/11bps3/the_krakens_cousin_searching_for_the_mysterious/,,,False,,t5_2s7su,False,,,False,t3_11bps3,http://www.wired.com/wiredscience/2012/10/humboldt-squid/,
1349267953.0,9,savethearctic.org,10vdyq,"Greenpeace ""Save The Arctic"" petition for a global sanctuary hits two million signatures!",11,2,0,http://www.reddit.com/r/oceans/comments/10vdyq/greenpeace_save_the_arctic_petition_for_a_global/,,,False,,t5_2s7su,False,,,False,t3_10vdyq,http://www.savethearctic.org/,
1349196904.0,10,youtube.com,10togi,Toro the Bluefin Tuna has something to say... [:30],10,0,0,http://www.reddit.com/r/oceans/comments/10togi/toro_the_bluefin_tuna_has_something_to_say_30/,,,False,,t5_2s7su,False,,,False,t3_10togi,http://www.youtube.com/watch?v=cP7cV-g7K-E&amp;feature=player_embedded#,
1348952956.0,9,rockofthecoast.com,10ol5c,C.O.A.S.T Alliance Formed to Fight PG&amp;E Central Coast Seismic Test | The ROCK,12,3,2,http://www.reddit.com/r/oceans/comments/10ol5c/coast_alliance_formed_to_fight_pge_central_coast/,,,False,,t5_2s7su,False,,,False,t3_10ol5c,http://www.rockofthecoast.com/2012/09/25/c-o-a-s-t-alliance-formed-to-fight-pge-central-coast-seismic-test/,
1347559579.0,9,seafloorexplorer.org,zu0en,"From the people that brought you GalaxyZoo.com, you can now help identify species and ground cover in images of the seafloor.",12,3,0,http://www.reddit.com/r/oceans/comments/zu0en/from_the_people_that_brought_you_galaxyzoocom_you/,,,False,,t5_2s7su,False,,,False,t3_zu0en,http://www.seafloorexplorer.org,
1347433994.0,8,nerkasalmon.wordpress.com,zr831,Gripping accout of a boy rescued at sea. ,9,1,2,http://www.reddit.com/r/oceans/comments/zr831/gripping_accout_of_a_boy_rescued_at_sea/,,,False,,t5_2s7su,False,,,False,t3_zr831,http://nerkasalmon.wordpress.com/2012/09/11/lost-at-sea-the-man-in-the-fish-tote/,
1347329038.0,8,travel.nytimes.com,zopzb,Eco-Resort in Raja Ampat,10,2,1,http://www.reddit.com/r/oceans/comments/zopzb/ecoresort_in_raja_ampat/,,,False,,t5_2s7su,False,,,False,t3_zopzb,http://travel.nytimes.com/2012/09/09/travel/sharing-paradise-with-the-barracuda.html?ref=travel&amp;_r=0,
1345817575.0,9,asf.ca,yr5tk,"Solar-powered fish-tracking drone recovered off N.S. after 3,000 km journey - solar-powered robot communicates with satellites to solve mysteries about the lives of fish.",9,0,0,http://www.reddit.com/r/oceans/comments/yr5tk/solarpowered_fishtracking_drone_recovered_off_ns/,,,False,,t5_2s7su,False,,,False,t3_yr5tk,http://asf.ca/wave-glider-recovered-off-nova-scotia.html,
1345760518.0,9,rockofthecoast.com,ypy1x,PG&amp;E to Conduct Seismic Testing With Severe Marine Life Impact,10,1,7,http://www.reddit.com/r/oceans/comments/ypy1x/pge_to_conduct_seismic_testing_with_severe_marine/,,,False,,t5_2s7su,False,,,False,t3_ypy1x,http://www.rockofthecoast.com/2012/08/19/undersea-hiroshima-the-great-central-coast-seismic-disaster/,
1345561554.0,8,rightwhales.neaq.org,ykzon,Calf breaching signals start of right whale sightings in the Bay of Fundy!,13,5,0,http://www.reddit.com/r/oceans/comments/ykzon/calf_breaching_signals_start_of_right_whale/,,,False,,t5_2s7su,False,,,False,t3_ykzon,http://rightwhales.neaq.org/2012/08/they-have-finally-arrived.html,
1344787912.0,10,youtube.com,y3i2y,Brief video of our sea turtle release last week. 10 baby loggerheads were given a second chance,10,0,0,http://www.reddit.com/r/oceans/comments/y3i2y/brief_video_of_our_sea_turtle_release_last_week/,,,False,,t5_2s7su,False,,,False,t3_y3i2y,http://www.youtube.com/watch?v=2vaMFYWswxg&amp;feature=youtu.be,
1344349099.0,9,inhabitat.com,xtny4,New Study Suggests Pacific Ocean is Polluted With Coffee: Scientists found elevated concentrations of caffeine in the Pacific Ocean in areas off the coast of Oregon,11,2,1,http://www.reddit.com/r/oceans/comments/xtny4/new_study_suggests_pacific_ocean_is_polluted_with/,,,False,,t5_2s7su,False,,,False,t3_xtny4,http://inhabitat.com/new-study-suggests-pacific-ocean-is-polluted-with-coffee/,
1343746629.0,9,coml.org,xg8zk,A Decade of Discovery – enjoy a break today and check out some Census of Marine Life videos,9,0,0,http://www.reddit.com/r/oceans/comments/xg8zk/a_decade_of_discovery_enjoy_a_break_today_and/,,,False,,t5_2s7su,False,,,False,t3_xg8zk,http://www.coml.org/video-gallery,
1343445613.0,9,avaaz.org,xa6v5,Petition to properly manage Canada's oceanic territory,9,0,0,http://www.reddit.com/r/oceans/comments/xa6v5/petition_to_properly_manage_canadas_oceanic/,,,False,,t5_2s7su,False,,,False,t3_xa6v5,http://www.avaaz.org/en/petition/Honestly_Manage_Canadian_Oceans/,
1343332350.0,8,noaacoastsurvey.wordpress.com,x7gj7,NOAA survey team captures images of sunken steamer CITY OF WACO,9,1,0,http://www.reddit.com/r/oceans/comments/x7gj7/noaa_survey_team_captures_images_of_sunken/,,,False,,t5_2s7su,False,,,False,t3_x7gj7,http://noaacoastsurvey.wordpress.com/2012/07/25/capturing-the-seafloors-rich-history-while-positioning-america-for-the-future/,
1343107406.0,9,nytimes.com,x2552,"A Gold Rush in the Abyss: Vast Deposits of Gold and 
Other Ores Lure Seabed",9,0,2,http://www.reddit.com/r/oceans/comments/x2552/a_gold_rush_in_the_abyss_vast_deposits_of_gold/,,,False,,t5_2s7su,False,,,False,t3_x2552,http://www.nytimes.com/2012/07/10/science/vast-deposits-of-gold-and-other-ores-lure-seabed-miners.html?pagewanted=all,
1342623389.0,8,noaanews.noaa.gov,wrf8x,NOAA collects 50 metric tons of marine debris from Northwestern Hawaiian Islands on annual removal mission,10,2,0,http://www.reddit.com/r/oceans/comments/wrf8x/noaa_collects_50_metric_tons_of_marine_debris/,,,False,,t5_2s7su,False,,,False,t3_wrf8x,http://www.noaanews.noaa.gov/stories2012/20120717_marinedebris_cruise.html,
1342546830.0,9,thescuttlefish.com,wpm9m,Diving with Cousteau to the last undersea base,10,1,0,http://www.reddit.com/r/oceans/comments/wpm9m/diving_with_cousteau_to_the_last_undersea_base/,,,False,,t5_2s7su,False,,,False,t3_wpm9m,http://thescuttlefish.com/2012/07/the-best-time-i-dove-with-a-cousteau-to-the-last-undersea-base/,
1341603048.0,9,self.oceans,w56cy,A question to Marine Biologists/Oceanographers ,11,2,3,http://www.reddit.com/r/oceans/comments/w56cy/a_question_to_marine_biologistsoceanographers/,"I am a high school student who will be competing in the [National Ocean Sciences Bowl](http://www.nosb.org/) in a few months. My team has much potential, but we are despertly looking for resources, mostly books and videos. Any leads would be great. 

We currently use [this book](http://www.amazon.com/Oceanography-Invitation-Science-OceanographyNow-InfoTrac/dp/0534408877) for most of our studying, but we are looking for something more advanced, more directed to majors level Marine Biology/Oceanography.

Thanks!",,False,,t5_2s7su,False,,,True,t3_w56cy,http://www.reddit.com/r/oceans/comments/w56cy/a_question_to_marine_biologistsoceanographers/,
1340615914.0,10,nature.com,vkcls,"Shark species more diverse than thought: Genetic 
analysis suggests overlooked species, raises 
concerns about conservation",13,3,0,http://www.reddit.com/r/oceans/comments/vkcls/shark_species_more_diverse_than_thought_genetic/,,,False,,t5_2s7su,False,,,False,t3_vkcls,http://www.nature.com/news/shark-species-more-diverse-than-thought-1.10879,
1340330917.0,9,whoi.edu,vexwj,The Boy in the Alvin Sphere: a semi-technical history about the pressure hull of the most active deep diving research submersible in the world.,9,0,0,http://www.reddit.com/r/oceans/comments/vexwj/the_boy_in_the_alvin_sphere_a_semitechnical/,,,False,,t5_2s7su,False,,,False,t3_vexwj,http://www.whoi.edu/oceanus/viewArticle.do?id=141451&amp;sectionid=1000,
