created_utc,score,domain,id,title,ups,downs,num_comments,permalink,selftext,link_flair_text,over_18,thumbnail,subreddit_id,edited,link_flair_css_class,author_flair_css_class,is_self,name,url,distinguished
1369325398.0,80,imgur.com,1ewrqr,"My kids asked me to take them to the beach so they could pick up trash. In 1000' of shoreline they filled four bags of garbage. Mostly plastic bags and Mylar balloons but I was really disturbed to see a lot of ""Royal Caribbean"" plastic cups.",86,6,9,http://www.reddit.com/r/oceans/comments/1ewrqr/my_kids_asked_me_to_take_them_to_the_beach_so/,,,False,,t5_2s7su,False,,,False,t3_1ewrqr,http://imgur.com/a/DlXza,
1367564018.0,58,i.imgur.com,1dluox,Shark attacks on humans vs human attacks on sharks (x-post from r/sharks),65,7,5,http://www.reddit.com/r/oceans/comments/1dluox/shark_attacks_on_humans_vs_human_attacks_on/,,,False,,t5_2s7su,False,,,False,t3_1dluox,http://i.imgur.com/WE5bU7N.jpg,
1371043998.0,55,washingtonexaminer.com,1g6zxi,"James Cameron Appeals to Congress: Fund Deep Sea Exploration. ""As much as I love space exploration in the abstract, going to Mars is not speaking directly to our life-support systems.""",60,5,1,http://www.reddit.com/r/oceans/comments/1g6zxi/james_cameron_appeals_to_congress_fund_deep_sea/,,,False,,t5_2s7su,False,,,False,t3_1g6zxi,http://washingtonexaminer.com/james-cameron-directs-congress-fund-deep-sea-exploration/article/2531633,
1364319625.0,51,imgur.com,1b1xd6,Depths of lakes and oceans [pic],57,6,7,http://www.reddit.com/r/oceans/comments/1b1xd6/depths_of_lakes_and_oceans_pic/,,,False,,t5_2s7su,False,,,False,t3_1b1xd6,http://imgur.com/ILusQ3M,
1373554739.0,46,treehugger.com,1i300q,Big win for sharks: European Union bans all shark finning,49,3,4,http://www.reddit.com/r/oceans/comments/1i300q/big_win_for_sharks_european_union_bans_all_shark/,,,False,,t5_2s7su,False,,,False,t3_1i300q,http://www.treehugger.com/environmental-policy/big-win-sharks-european-union-bans-all-shark-finning.html,
1358471629.0,49,xkcd.com,16sdny,"This is so interesting, check it out! Really puts things in scale. ",52,3,0,http://www.reddit.com/r/oceans/comments/16sdny/this_is_so_interesting_check_it_out_really_puts/,,,False,,t5_2s7su,False,,,False,t3_16sdny,http://xkcd.com/1040/large/,
1358375426.0,44,smdp.com,16pn2o,Shark finning must stop now,50,6,1,http://www.reddit.com/r/oceans/comments/16pn2o/shark_finning_must_stop_now/,,,False,,t5_2s7su,False,,,False,t3_16pn2o,http://www.smdp.com/shark-finning-must-stop-now/116723,
1369946647.0,43,slate.com,1fcz62,Mermaids aren’t real: What Animal Planet’s fake documentaries don’t tell you about the ocean.,44,1,2,http://www.reddit.com/r/oceans/comments/1fcz62/mermaids_arent_real_what_animal_planets_fake/,,,False,,t5_2s7su,False,,,False,t3_1fcz62,http://www.slate.com/articles/health_and_science/science/2013/05/mermaids_aren_t_real_animal_planet_s_fake_documentaries_misrepresent_ocean.html,
1367259125.0,45,oceana.org,1dcos3,A deaf whale is a dead whale. Help Oceana put an end to the seismic airguns blasts that cause deafness in marine life by signing the White House petition.,48,3,11,http://www.reddit.com/r/oceans/comments/1dcos3/a_deaf_whale_is_a_dead_whale_help_oceana_put_an/,,,False,,t5_2s7su,False,,,False,t3_1dcos3,http://oceana.org/en/news-media/publications/reports/a-deaf-whale-is-a-dead-whale-seismic-airgun-testing-for-oil-and-gas-threatens-marine-life-and-co,
1358784571.0,42,globalnation.inquirer.net,16zrs8,"US Navy minesweeper trespasses on Philippine seas, destroys 100 years worth of corals in Marine Protected Area",43,1,0,http://www.reddit.com/r/oceans/comments/16zrs8/us_navy_minesweeper_trespasses_on_philippine_seas/,,,False,,t5_2s7su,False,,,False,t3_16zrs8,http://globalnation.inquirer.net/62149/us-pressed-to-issue-formal-apology-over-tubbataha-reef-damage,
1354660889.0,44,pmel.noaa.gov,14ac44,The Bloop sound has been solved!,44,0,2,http://www.reddit.com/r/oceans/comments/14ac44/the_bloop_sound_has_been_solved/,,,False,,t5_2s7su,False,,,False,t3_14ac44,http://www.pmel.noaa.gov/vents/acoustics/sounds/bloop.html,
1348670810.0,39,maps.google.com,10ib39,The Great Barrier Reef is about to kill your productivity...,42,3,6,http://www.reddit.com/r/oceans/comments/10ib39/the_great_barrier_reef_is_about_to_kill_your/,,,False,,t5_2s7su,False,,,False,t3_10ib39,"https://maps.google.com/maps?cbll=-23.442896,151.906584&amp;z=3&amp;layer=c&amp;panoid=CWskcsTEZBNXaD8gG-zATA&amp;cbp=13,332.33,,0,11.68",
1337180795.0,42,i.imgur.com,tq13h,Rays,54,12,9,http://www.reddit.com/r/oceans/comments/tq13h/rays/,,,False,,t5_2s7su,False,,,False,t3_tq13h,http://i.imgur.com/w0Yqp.jpg,
1374164302.0,39,theconversation.com,1ikexb,The Great Barrier Reef is disappearing: 1/3 of inshore reef lost in last 6 years. Time to make polluters pay!,41,2,0,http://www.reddit.com/r/oceans/comments/1ikexb/the_great_barrier_reef_is_disappearing_13_of/,,,False,,t5_2s7su,False,,,False,t3_1ikexb,http://theconversation.com/great-barrier-reef-report-in-time-to-make-polluters-pay-16073,
1376320220.0,38,i.imgur.com,1k7kpv,Dorado caught in a Houston fishing tournament found to have eaten more than 20 critically endangered Kemp's ridley sea turtle hatchlings,42,4,5,http://www.reddit.com/r/oceans/comments/1k7kpv/dorado_caught_in_a_houston_fishing_tournament/,,,False,,t5_2s7su,False,,,False,t3_1k7kpv,http://i.imgur.com/Wvfps1w.jpg,
1357846381.0,33,guardian.co.uk,16bwb4,Pacific bluefin tuna numbers down 96.4%,36,3,0,http://www.reddit.com/r/oceans/comments/16bwb4/pacific_bluefin_tuna_numbers_down_964/,,,False,,t5_2s7su,False,,,False,t3_16bwb4,http://www.guardian.co.uk/environment/2013/jan/09/overfishing-pacific-bluefin-tuna,
1355281218.0,35,self.oceans,14pche,Anyone recently graduate with a degree in Marine Biology yet can't find a job? I recently got one and want to try to help you guys! ,36,1,37,http://www.reddit.com/r/oceans/comments/14pche/anyone_recently_graduate_with_a_degree_in_marine/,I recently got a position as a Marine Mammal Observer working in the Gulf of Mexico. I worked for half a year as a cashier at a grocery store after graduating and was lucky enough to find a random connection and land this job. I know not many people subscribe here but I want to try to help anyone I can find a job because I know how much it sucks to be out of work..especially with loans to pay back. PM me and I can send you more information about what I do to see if you'd want to apply! Take care guys.,,False,,t5_2s7su,False,,,True,t3_14pche,http://www.reddit.com/r/oceans/comments/14pche/anyone_recently_graduate_with_a_degree_in_marine/,
1370713890.0,33,imgur.com,1fxp7o,"Happy World Oceans Day, from the bottom of the Pacific!",37,4,3,http://www.reddit.com/r/oceans/comments/1fxp7o/happy_world_oceans_day_from_the_bottom_of_the/,,,False,,t5_2s7su,False,,,False,t3_1fxp7o,http://imgur.com/sb8EiYT,
1341936258.0,34,sharkdefenders.com,wbzr0,Huzzah! Shark finners busted in Marshall Islands,38,4,2,http://www.reddit.com/r/oceans/comments/wbzr0/huzzah_shark_finners_busted_in_marshall_islands/,,,False,,t5_2s7su,False,,,False,t3_wbzr0,http://www.sharkdefenders.com/2012/07/pirates-busted-for-poaching-sharks-in.html,
1341412673.0,31,nytimes.com,w16cj,China Says No More Shark Fin Soup at State Banquets,37,6,0,http://www.reddit.com/r/oceans/comments/w16cj/china_says_no_more_shark_fin_soup_at_state/,,,False,,t5_2s7su,False,,,False,t3_w16cj,http://www.nytimes.com/2012/07/04/world/asia/china-says-no-more-shark-fin-soup-at-state-banquets.html?smid=re-share,
1372782989.0,29,mercurynews.com,1hi7k7,Shark fin soup ban went into effect Monday,33,4,1,http://www.reddit.com/r/oceans/comments/1hi7k7/shark_fin_soup_ban_went_into_effect_monday/,,,False,,t5_2s7su,False,,,False,t3_1hi7k7,http://www.mercurynews.com/science/ci_23567375/shark-fin-soup-ban-takes-effect-monday,
1360532724.0,33,images.nationalgeographic.com,189n1w,"Whale Shark: The sweeping color of sea and sky, blue is a common thread in nature",35,2,0,http://www.reddit.com/r/oceans/comments/189n1w/whale_shark_the_sweeping_color_of_sea_and_sky/,,,False,,t5_2s7su,False,,,False,t3_189n1w,http://images.nationalgeographic.com/wpf/media-live/photos/000/013/custom/1342_1600x1200-wallpaper-cb1349383530.jpg,
1364273531.0,31,truereality.org,1b0wha,"19-Year-Old Develops Ocean Cleanup Array That Could Remove 7,250,000 Tons Of Plastic From the World’s Oceans.   (will x-post to r/science, as well)",34,3,6,http://www.reddit.com/r/oceans/comments/1b0wha/19yearold_develops_ocean_cleanup_array_that_could/,,,False,,t5_2s7su,False,,,False,t3_1b0wha,http://truereality.org/?p=4480,
1358965839.0,31,oceana.org,174vop,Sperm Whales Adopt Malformed Dolphin Into Their Group ,32,1,0,http://www.reddit.com/r/oceans/comments/174vop/sperm_whales_adopt_malformed_dolphin_into_their/,,,False,,t5_2s7su,False,,,False,t3_174vop,http://oceana.org/en/blog/2013/01/sperm-whales-adopt-malformed-dolphin-into-their-group,
1375340265.0,30,theguardian.com,1jha29,Caribbean has lost 80% of its coral reefs in recent years,32,2,0,http://www.reddit.com/r/oceans/comments/1jha29/caribbean_has_lost_80_of_its_coral_reefs_in/,,,False,,t5_2s7su,False,,,False,t3_1jha29,http://www.theguardian.com/environment/2013/aug/01/caribbean-coral-reef-loss,
1367680777.0,30,smh.com.au,1doip7,UN plans to list Great Barrier Reef as endangered | x-post /r/environment,30,0,0,http://www.reddit.com/r/oceans/comments/1doip7/un_plans_to_list_great_barrier_reef_as_endangered/,,,False,,t5_2s7su,False,,,False,t3_1doip7,http://www.smh.com.au/environment/un-plans-to-list-reef-as-endangered-20130504-2izkq.html#comments,
1365171697.0,30,news.com.au,1bqfg9,Japan whaling haul at 'record low',35,5,2,http://www.reddit.com/r/oceans/comments/1bqfg9/japan_whaling_haul_at_record_low/,,,False,,t5_2s7su,False,,,False,t3_1bqfg9,http://www.news.com.au/breaking-news/world/japan-whaling-haul-at-record-low/story-e6frfkui-1226613440007,
1365005911.0,30,oneworldoneocean.com,1blfqp,This is one marine biologist's effort to boost Orange County's depleted abalone population,31,1,0,http://www.reddit.com/r/oceans/comments/1blfqp/this_is_one_marine_biologists_effort_to_boost/,,,False,,t5_2s7su,False,,,False,t3_1blfqp,http://www.oneworldoneocean.com/blog/entry/saving_kelp_forests_abalone#.UVxWGat4ZxJre,
1370465581.0,29,wired.com,1fqvd3,Way to go Humans - Deep-Sea Dump: ROVs Expose Trashed Ocean Floor | Wired Science,29,0,3,http://www.reddit.com/r/oceans/comments/1fqvd3/way_to_go_humans_deepsea_dump_rovs_expose_trashed/,,,False,,t5_2s7su,False,,,False,t3_1fqvd3,http://www.wired.com/wiredscience/2013/06/deep-sea-debris/,
1351445972.0,28,self.oceans,12863l,"Not only do I feel as though I robbed you of something, I feel like I have violated you. I honestly don't think I could feel worse about it than if I had literally robbed you at gunpoint. I had no right, and I apologize to you deeply, and with absolute sincerity. [x-post from r/environment]",32,4,1,http://www.reddit.com/r/oceans/comments/12863l/not_only_do_i_feel_as_though_i_robbed_you_of/,"I screwed up Friday afternoon. 

Hopefully, somewhere there's a Redditor/activist in the Galveston area that knows other activists, possibly from one of the local campuses, (UTMB, A&amp;M, GC) that knows who was canvassing Fish Village passing out [these flyers](http://imgur.com/a/w2OVV) Friday late afternoon, 10/26. 


You were on the odd-numbered side of Mackeral trying to get people to help out with a very important issue. I did not respond to your plea. All you were asking was for me to write a couple of brief letters, and I refused you. I don't know if you will ever see this, but I hope so.


Later on, when I realized what I had done, it wasn't the cause you were standing up for, or that you *were* standing up for something good in a world where we have poisoned our garden, trashed our oceans, and mistreated our beasts. It wasn't that at all. It was a look in your eye as you turned to walk away. It was from the side, and I saw it for only the briefest of moments, because I looked away. But, it was a powerful image and now I cannot unsee it. It was one of defeat-there you were, busting your ass going door to door, on foot with the weather turning windy &amp; cold, probably thinking "" what the hell do I have to do to get through to people, and some old, bald, dumbass won't help me out even by just writing a few short paragraphs in a couple of letters that I'll pick up &amp; mail for him anyway."" You didn't do anything wrong in presenting your case. I was just in a negative mood. I don't think I was rude or impolite or anything, I just didn't step up to the plate.


Usually, I like being a cynical old fart, but, for whatever reason, it has become a little more than *glaringly* apparent to me that I need to be more selective in the use of that cynicism, and wield it more responsibly, as it does have a place in certain arenas. I use it often as a coping skill. Yesterday afternoon I failed horribly and miserably.


I am going to make this right for you. [Here](http://imgur.com/a/Yx9GD) are pics of the letters, I will mail them.
You were asking for donations but I had zero cash, I truly am sometimes living paycheck to paycheck, but I make a promise to you now to donate to your cause via your website or other means as soon as $$ permits.


While I of course agree with your cause, it is not what provides the impetus for all this. I am trying to encourage that which I had discouraged, and ask that *anybody* who ever gets shot down by jerks like me to never give up your fight.


Upvote please for visibility. I am posting self. as I want no meaningless internet karma from it-I am trying to keep the real karma merely equal if nothing else.


TL;DR: I can be an ass at times.",,False,,t5_2s7su,False,,,True,t3_12863l,http://www.reddit.com/r/oceans/comments/12863l/not_only_do_i_feel_as_though_i_robbed_you_of/,
1350133125.0,28,ecorazzi.com,11euxx,Costa Rica Passes Blanket Ban on Shark Finning,31,3,0,http://www.reddit.com/r/oceans/comments/11euxx/costa_rica_passes_blanket_ban_on_shark_finning/,,,False,,t5_2s7su,False,,,False,t3_11euxx,http://www.ecorazzi.com/2012/10/11/costa-rica-passes-blanket-ban-on-shark-finning/,
1346951400.0,27,csmonitor.com,zghal,"Bottom trawling wrecking ocean floor, study finds",30,3,3,http://www.reddit.com/r/oceans/comments/zghal/bottom_trawling_wrecking_ocean_floor_study_finds/,,,False,,t5_2s7su,False,,,False,t3_zghal,http://www.csmonitor.com/Science/2012/0906/Bottom-trawling-wrecking-ocean-floor-study-finds,
1364399197.0,27,imgur.com,1b45jb,Picture I took of arc-eye hawkfish off the coast of lanai [OC],29,2,0,http://www.reddit.com/r/oceans/comments/1b45jb/picture_i_took_of_arceye_hawkfish_off_the_coast/,,,False,,t5_2s7su,False,,,False,t3_1b45jb,http://imgur.com/AkjFeef,
1364302824.0,27,whoi.edu,1b1ehq,James Cameron Gives DEEPSEA CHALLENGER Sub to  Woods Hole Oceanographic Institution,29,2,7,http://www.reddit.com/r/oceans/comments/1b1ehq/james_cameron_gives_deepsea_challenger_sub_to/,,,False,,t5_2s7su,False,,,False,t3_1b1ehq,http://www.whoi.edu/news-release/deepsea_challenger,
1362842797.0,27,rawstory.com,19z17r,Beached sperm whale in Spain dies after eating large amounts of plastic ,27,0,0,http://www.reddit.com/r/oceans/comments/19z17r/beached_sperm_whale_in_spain_dies_after_eating/,,,False,,t5_2s7su,False,,,False,t3_19z17r,http://www.rawstory.com/rs/2013/03/07/beached-sperm-whale-in-spain-dies-after-eating-large-amounts-of-plastic/,
1336759660.0,25,khon2.com,tihzt,"Hawaii first state in US to ban plastic bags, all via local ordinances - Oahu plastic bag ban signed into law on May 10",28,3,0,http://www.reddit.com/r/oceans/comments/tihzt/hawaii_first_state_in_us_to_ban_plastic_bags_all/,,,False,,t5_2s7su,False,,,False,t3_tihzt,http://www.khon2.com/news/local/story/Oahu-plastic-bag-ban-signed-into-law/G8ozCB7SHUmpQLx22yfPVQ.cspx,
1364060201.0,26,oceana.org,1av8u8,Victory! More than 739 Miles of U.S. Coastline Protected for Loggerhead Sea Turtles,27,1,1,http://www.reddit.com/r/oceans/comments/1av8u8/victory_more_than_739_miles_of_us_coastline/,,,False,,t5_2s7su,False,,,False,t3_1av8u8,http://oceana.org/en/blog/2013/03/victory-more-than-739-miles-of-us-coastline-protected-for-loggerhead-sea-turtles,
1349295318.0,26,oneworldoneocean.com,10w6on,Sustainable Seafood Infographic ,29,3,3,http://www.reddit.com/r/oceans/comments/10w6on/sustainable_seafood_infographic/,,,False,,t5_2s7su,False,,,False,t3_10w6on,http://www.oneworldoneocean.com/OWOO_KnowYourSeafood.jpg,
1346860552.0,25,rendezvous.blogs.nytimes.com,zebzc,Hong Kong Airline Bans Shark Fin as Cargo - NYTimes.com,26,1,0,http://www.reddit.com/r/oceans/comments/zebzc/hong_kong_airline_bans_shark_fin_as_cargo/,,,False,,t5_2s7su,False,,,False,t3_zebzc,http://rendezvous.blogs.nytimes.com/2012/09/05/hong-kong-airline-bans-shark-fin-as-cargo/,
1334790869.0,25,news.bbc.co.uk,sguqn,Freak waves spotted from space,28,3,4,http://www.reddit.com/r/oceans/comments/sguqn/freak_waves_spotted_from_space/,,,False,,t5_2s7su,False,,,False,t3_sguqn,http://news.bbc.co.uk/2/hi/3917539.stm,
1331045590.0,26,youtube.com,qk6rc,Boy buys shark from vendor and immediately releases it to the wild,28,2,3,http://www.reddit.com/r/oceans/comments/qk6rc/boy_buys_shark_from_vendor_and_immediately/,,,False,,t5_2s7su,False,,,False,t3_qk6rc,http://www.youtube.com/watch?v=lWCDaynkt8Q,
1374596563.0,26,contracostatimes.com,1iw4gc,"As wetlands are restored, shark populations flourish - a sign of improved San Franciso Bay health",27,1,0,http://www.reddit.com/r/oceans/comments/1iw4gc/as_wetlands_are_restored_shark_populations/,,,False,,t5_2s7su,False,,,False,t3_1iw4gc,http://www.contracostatimes.com/breaking-news/ci_23709145/leopard-sharks-flourishing-south-san-francisco-bay-wetlands,
1372533985.0,26,latimes.com,1hbp10,#Sharkfin ban in CA takes effect on Monday,27,1,0,http://www.reddit.com/r/oceans/comments/1hbp10/sharkfin_ban_in_ca_takes_effect_on_monday/,,,False,,t5_2s7su,False,,,False,t3_1hbp10,"http://www.latimes.com/local/lanow/la-me-ln-shark-fin-ban-brings-end-to-asia-food-tradition-20130629,0,4731797.story",
1372082951.0,25,schmidtocean.org,1gyw67,"Live look at the deepest known hydrothermal vents on the planet (~5000m, Cayman Rise)",26,1,3,http://www.reddit.com/r/oceans/comments/1gyw67/live_look_at_the_deepest_known_hydrothermal_vents/,,,False,,t5_2s7su,False,,,False,t3_1gyw67,http://www.schmidtocean.org/story/show/1666,
1370542652.0,23,i.imgur.com,1ft15w,Big Oil sneakily tries to open entire Gulf of Mexico from Texas to Florida to extensive oil exploration activities. Please consider attend public meeting that start next week and comment about your opposition. This has potential to finish off entire Gulf of Mexico with all its inhabitants.,37,14,1,http://www.reddit.com/r/oceans/comments/1ft15w/big_oil_sneakily_tries_to_open_entire_gulf_of/,,,False,,t5_2s7su,False,,,False,t3_1ft15w,http://i.imgur.com/bJtpdbu.gif,
1354917522.0,24,guardian.co.uk,14gt4x,South Korea drops plans to resume whaling,25,1,0,http://www.reddit.com/r/oceans/comments/14gt4x/south_korea_drops_plans_to_resume_whaling/,,,False,,t5_2s7su,False,,,False,t3_14gt4x,http://www.guardian.co.uk/world/2012/dec/06/south-korea-drops-plan-whaling?goback=%2Egde_2346752_member_193305940,
1348016330.0,23,explorers.neaq.org,1040jt,"Two-thirds of the farmed shrimp we eat comes from Asia, this is what a fish farm in China looks like",26,3,8,http://www.reddit.com/r/oceans/comments/1040jt/twothirds_of_the_farmed_shrimp_we_eat_comes_from/,,,False,,t5_2s7su,False,,,False,t3_1040jt,http://explorers.neaq.org/2012/09/mainland-china-shrimp-farming.html,
1334946302.0,25,imgur.com,sk2hj,"A Nudibranch - not at all what I thought it would be, and it's so pretty!",27,2,2,http://www.reddit.com/r/oceans/comments/sk2hj/a_nudibranch_not_at_all_what_i_thought_it_would/,,,False,,t5_2s7su,False,,,False,t3_sk2hj,http://imgur.com/gdpB5,
1334216264.0,26,xkcd.com,s5v9k,I've spent a long time looking at this infographic...,26,0,1,http://www.reddit.com/r/oceans/comments/s5v9k/ive_spent_a_long_time_looking_at_this_infographic/,,,False,,t5_2s7su,False,,,False,t3_s5v9k,http://xkcd.com/1040/large/,
1372678940.0,23,slate.com,1hf5vs,"The Worst Marine Invasion Ever: Lionfish are spreading in the Atlantic, reducing native fish populations by 70 percent in some areas.",26,3,5,http://www.reddit.com/r/oceans/comments/1hf5vs/the_worst_marine_invasion_ever_lionfish_are/,,,False,,t5_2s7su,False,,,False,t3_1hf5vs,http://www.slate.com/articles/health_and_science/science/2013/07/lionfish_invasion_the_invasive_fish_are_eating_so_many_native_species_that.single.html#pagebreak_anchor_3,
1371320786.0,24,huffingtonpost.com,1get06,"Sylvia Earle: Can We Stop Killing Our Oceans Now, Please?",25,1,3,http://www.reddit.com/r/oceans/comments/1get06/sylvia_earle_can_we_stop_killing_our_oceans_now/,,,False,,t5_2s7su,False,,,False,t3_1get06,http://www.huffingtonpost.com/sylvia-earle/world-ocean-day_b_3443436.html,
1370605174.0,24,grindtv.com,1futs7,ROV captures first-ever footage of oarfish in the wild,25,1,2,http://www.reddit.com/r/oceans/comments/1futs7/rov_captures_firstever_footage_of_oarfish_in_the/,,,False,,t5_2s7su,False,,,False,t3_1futs7,http://www.grindtv.com/outdoor/nature/post/rov-captures-first-ever-footage-of-oarfish-in-the-wild/,
1366781584.0,26,liveleak.com,1czrhz,Ocean Beauties: The bottom of the ocean has lost it's mind.,26,0,1,http://www.reddit.com/r/oceans/comments/1czrhz/ocean_beauties_the_bottom_of_the_ocean_has_lost/,,,False,,t5_2s7su,False,,,False,t3_1czrhz,http://www.liveleak.com/view?i=c33_1366766973,
1366123452.0,25,self.oceans,1cgo8v,World Oceans Day is June 8th,28,3,0,http://www.reddit.com/r/oceans/comments/1cgo8v/world_oceans_day_is_june_8th/,"Hi /r/oceans, just wanted to invite you to participate in World Oceans Day! It's the UN-recognized day of ocean celebration - last year we had 600 events organized globally.  

You can visit [the World Oceans Day website](http://WorldOceansDay.org/ideas) for more info on how to attend or hold your own event.

One thing I wanted to share with the sub is the **Youth Video Contest**! [Visit this site for more info](http://www.oneworldoneocean.com/get-involved/wod_vc_signup). It's a video contest held by [One World One Ocean](http://oneworldoneocean.org) for 7 - 12th graders, and they could win free GoPro cameras and some cash. Please share with anyone you think would be interested.

We're happy to answer any questions you have!

**edit**: btw if you're a diver, check out the DiveFlagApp for smartphones. They have a guide on how to hold your own World Oceans Day dive meet-up/clean-up. Even if you have a small group you can still list your dive on the website and be recognized: http://WorldOceansDay.org/submit",,False,,t5_2s7su,1366208992.0,,,True,t3_1cgo8v,http://www.reddit.com/r/oceans/comments/1cgo8v/world_oceans_day_is_june_8th/,
1342715667.0,23,i.imgur.com,wtnvd,"You don't have to wait for Earth Day, Project AWARE, or anyone. Find some friends and remove some plastic from the sea, today :)",24,1,4,http://www.reddit.com/r/oceans/comments/wtnvd/you_dont_have_to_wait_for_earth_day_project_aware/,,,False,,t5_2s7su,False,,,False,t3_wtnvd,http://i.imgur.com/X645E.jpg,
1340907566.0,24,mediamatters.org,vr3vl,STUDY: Kardashians Get 40 Times More News Coverage Than Ocean Acidification,26,2,2,http://www.reddit.com/r/oceans/comments/vr3vl/study_kardashians_get_40_times_more_news_coverage/,,,False,,t5_2s7su,False,,,False,t3_vr3vl,http://mediamatters.org/blog/201206270006,
1335190911.0,22,bbc.co.uk,so6ft,First ever adult white orca spotted,24,2,0,http://www.reddit.com/r/oceans/comments/so6ft/first_ever_adult_white_orca_spotted/,,,False,,t5_2s7su,False,,,False,t3_so6ft,http://www.bbc.co.uk/news/science-environment-17783603,
1319929152.0,23,imgur.com,ltlvd,Boyfriend went swimming with Whale Sharks!,25,2,6,http://www.reddit.com/r/oceans/comments/ltlvd/boyfriend_went_swimming_with_whale_sharks/,,,False,,t5_2s7su,False,,,False,t3_ltlvd,http://imgur.com/UPY3J,
1376946687.0,23,commondreams.org,1kou3v,Epic Blow To California's Marine Life: The US Navy just announced they officially do not give a shit about California Coastal Commission's recommendations &amp; will kill as many marine animals as they see fit,31,8,8,http://www.reddit.com/r/oceans/comments/1kou3v/epic_blow_to_californias_marine_life_the_us_navy/,,,False,,t5_2s7su,False,,,False,t3_1kou3v,http://www.commondreams.org/newswire/2013/08/19-1,
1373655368.0,24,youtu.be,1i662r,Thresher Sharks tail-slap prey into oblivion!,25,1,4,http://www.reddit.com/r/oceans/comments/1i662r/thresher_sharks_tailslap_prey_into_oblivion/,,,False,,t5_2s7su,False,,,False,t3_1i662r,http://youtu.be/lHoCCPsRuhg,
1369139238.0,24,sharkadvocates.org,1erd94,"Coastal sharks, often called dogfish, need sound conservation policies just like bigger sharks (x-post from r/conservation)",25,1,1,http://www.reddit.com/r/oceans/comments/1erd94/coastal_sharks_often_called_dogfish_need_sound/,,,False,,t5_2s7su,False,,,False,t3_1erd94,http://www.sharkadvocates.org/pdf/dogfish_infographic.pdf,
1366070837.0,23,self.oceans,1cfcmm,"Marine Biologists, is there anything a high school student should know if they are interested in marine biology?",23,0,17,http://www.reddit.com/r/oceans/comments/1cfcmm/marine_biologists_is_there_anything_a_high_school/,Is there anything a high school student interested in going into marine biology for university know before hand?,,False,,t5_2s7su,False,,,True,t3_1cfcmm,http://www.reddit.com/r/oceans/comments/1cfcmm/marine_biologists_is_there_anything_a_high_school/,
