created_utc,score,domain,id,title,ups,downs,num_comments,permalink,selftext,link_flair_text,over_18,thumbnail,subreddit_id,edited,link_flair_css_class,author_flair_css_class,is_self,name,url,distinguished
1328135119.0,9,treehugger.com,p6rh3,Endangered Green Turtle Baby Boom Breaks 28-year Record,9,0,0,http://www.reddit.com/r/oceans/comments/p6rh3/endangered_green_turtle_baby_boom_breaks_28year/,,,False,,t5_2s7su,False,,,False,t3_p6rh3,http://www.treehugger.com/endangered-species/endangered-green-turtle-baby-boom-breaks-28-year-record.html,
1328112393.0,7,nj.com,p68lp,Atlantic sturgeon in the Delaware River to be listed an endangered species,8,1,1,http://www.reddit.com/r/oceans/comments/p68lp/atlantic_sturgeon_in_the_delaware_river_to_be/,,,False,,t5_2s7su,False,,,False,t3_p68lp,http://www.nj.com/salem/index.ssf/2012/01/atlantic_sturgeon_in_the_delaw.html,
1327588073.0,8,ia.ucsb.edu,oxl4x,Major Study of Ocean Acidification Helps Scientists Evaluate Effects of Atmospheric Carbon Dioxide on Marine Life | UCSB,9,1,0,http://www.reddit.com/r/oceans/comments/oxl4x/major_study_of_ocean_acidification_helps/,,,False,,t5_2s7su,False,,,False,t3_oxl4x,http://www.ia.ucsb.edu/pa/display.aspx?pkey=2618,
1327465172.0,7,ecology.com,ovlaj,"Drowning in Controversy, Shark Fin Soup Swims Out of Favor ",10,3,1,http://www.reddit.com/r/oceans/comments/ovlaj/drowning_in_controversy_shark_fin_soup_swims_out/,,,False,,t5_2s7su,False,,,False,t3_ovlaj,http://www.ecology.com/2012/01/24/controversy-shark-fin-soup/,
1326948634.0,9,salon.com,omsuf,Swallowed by a whale,10,1,1,http://www.reddit.com/r/oceans/comments/omsuf/swallowed_by_a_whale/,,,False,,t5_2s7su,False,,,False,t3_omsuf,http://www.salon.com/2012/01/15/swallowed_by_a_whale_a_true_tale/singleton/,
1326777655.0,8,cnn.com,okg9j,At least 20 dolphins found dead in Cape Cod area,8,0,1,http://www.reddit.com/r/oceans/comments/okg9j/at_least_20_dolphins_found_dead_in_cape_cod_area/,,,False,,t5_2s7su,False,,,False,t3_okg9j,http://www.cnn.com/2012/01/16/us/massachusetts-dead-dolphins/index.html,
1326310297.0,9,treehugger.com,ocqgf,10 Marine Species on the Brink Due to Ocean Acidification | X-post /r/lifeaquatic,9,0,1,http://www.reddit.com/r/oceans/comments/ocqgf/10_marine_species_on_the_brink_due_to_ocean/,,,False,,t5_2s7su,False,,,False,t3_ocqgf,http://www.treehugger.com/slideshows/ocean-conservation/10-marine-species-brink-mass-extinction-due-ocean-acidification/,
1326247667.0,9,wwf.panda.org,obpvj,WWF congratulates Pacific Islands for certification of major tuna fishery,9,0,0,http://www.reddit.com/r/oceans/comments/obpvj/wwf_congratulates_pacific_islands_for/,,,False,,t5_2s7su,False,,,False,t3_obpvj,http://wwf.panda.org/wwf_news/?203069/WWF-congratulates-Pacific-Islands-for-certification-of-major-tuna-fishery,
1325570316.0,7,self.oceans,o0s5a,Life of a Plastic Bag,8,1,1,http://www.reddit.com/r/oceans/comments/o0s5a/life_of_a_plastic_bag/,"Our environmental science prof showed us this clip after he failed half of the class a while back..lol, makes you think.
http://www.youtube.com/watch?v=GLgh9h2ePYw",,False,,t5_2s7su,False,,,True,t3_o0s5a,http://www.reddit.com/r/oceans/comments/o0s5a/life_of_a_plastic_bag/,
1324372506.0,8,blog.knowyourearth.com,njod9,A Focus on Biodiversity and the Acidification of our Oceans,11,3,0,http://www.reddit.com/r/oceans/comments/njod9/a_focus_on_biodiversity_and_the_acidification_of/,,,False,,t5_2s7su,False,,,False,t3_njod9,http://blog.knowyourearth.com/archives/biodiversity-and-the-acidification-of-our-oceans/,
1323220548.0,8,theworld.org,n39kk,Sea Levels May Rise Faster Than Expected ,8,0,0,http://www.reddit.com/r/oceans/comments/n39kk/sea_levels_may_rise_faster_than_expected/,,,False,,t5_2s7su,False,,,False,t3_n39kk,http://www.theworld.org/2011/12/sea-levels-may-rise-faster-than-expected/,
1323160218.0,7,washingtonpost.com,n2bbk,"Japan’s stricken nuclear plant leaks radioactive water, some may have reached Pacific Ocean",8,1,1,http://www.reddit.com/r/oceans/comments/n2bbk/japans_stricken_nuclear_plant_leaks_radioactive/,,,False,,t5_2s7su,False,,,False,t3_n2bbk,http://www.washingtonpost.com/world/asia-pacific/japan-stricken-nuke-plant-leaks-radioactive-water-some-may-have-reached-ocean/2011/12/05/gIQAplB7UO_story.html,
1322580567.0,8,southernfriedscience.com,mtecp,How you can help a shark researcher up for scholarship.,8,0,2,http://www.reddit.com/r/oceans/comments/mtecp/how_you_can_help_a_shark_researcher_up_for/,,,False,,t5_2s7su,False,,,False,t3_mtecp,http://www.southernfriedscience.com/?p=12045,
1321367546.0,7,nj.com,md3be,Little fish could cause big waves in coastal economies if regulations cut deep into harvests,8,1,0,http://www.reddit.com/r/oceans/comments/md3be/little_fish_could_cause_big_waves_in_coastal/,,,False,,t5_2s7su,False,,,False,t3_md3be,http://www.nj.com/business/index.ssf/2011/11/little_fish_could_cause_big_wa.html,
1320425731.0,8,na.oceana.org,m0geo,Victory for Vulnerable Porbeagle Sharks | The Beacon: Oceana's Blog,8,0,0,http://www.reddit.com/r/oceans/comments/m0geo/victory_for_vulnerable_porbeagle_sharks_the/,,,False,,t5_2s7su,False,,,False,t3_m0geo,http://na.oceana.org/en/blog/2011/11/victory-for-vulnerable-porbeagle-sharks,
1320187623.0,7,pnj.com,lwza7,Scientists studying East Bay oyster die-off | FL,8,1,0,http://www.reddit.com/r/oceans/comments/lwza7/scientists_studying_east_bay_oyster_dieoff_fl/,,,False,,t5_2s7su,False,,,False,t3_lwza7,http://www.pnj.com/article/20111101/NEWS01/111010311/Scientists-arrive-study-East-Bay-oyster-die-off,
1319742043.0,8,news.sciencemag.org,lr9o3,Laundry Lint Pollutes the World's Oceans,8,0,1,http://www.reddit.com/r/oceans/comments/lr9o3/laundry_lint_pollutes_the_worlds_oceans/,,,False,,t5_2s7su,False,,,False,t3_lr9o3,http://news.sciencemag.org/sciencenow/2011/10/laundry-lint-pollutes-the-worlds.html,
1319562870.0,8,mirror.co.uk,lolcs,Fishermen haul in huge Nazi mine | UK,8,0,1,http://www.reddit.com/r/oceans/comments/lolcs/fishermen_haul_in_huge_nazi_mine_uk/,,,False,,t5_2s7su,False,,,False,t3_lolcs,http://www.mirror.co.uk/news/weird-world/2011/10/18/fishermen-haul-in-huge-nazi-mine-115875-23495964/,
1319293024.0,8,foxnews.com,ll05w,Strange Form Of Life Discovered In Ocean's Blackest Depths,11,3,2,http://www.reddit.com/r/oceans/comments/ll05w/strange_form_of_life_discovered_in_oceans/,,,False,,t5_2s7su,False,,,False,t3_ll05w,http://www.foxnews.com/scitech/2011/10/21/strange-form-life-discovered-in-oceans-blackest-depths/,
1318958636.0,8,youtube.com,lgh6c,"Kayaking with Redondo Beach Blue Whales, with underwater footage and Lunge feeding | Video",8,0,2,http://www.reddit.com/r/oceans/comments/lgh6c/kayaking_with_redondo_beach_blue_whales_with/,,,False,,t5_2s7su,False,,,False,t3_lgh6c,http://www.youtube.com/watch?v=HVtw94PJ8XA&amp;feature=player_embedded,
1318893080.0,9,i.imgur.com,lfo0j,"I like to think we have some artistic talent, at Western...",9,0,0,http://www.reddit.com/r/oceans/comments/lfo0j/i_like_to_think_we_have_some_artistic_talent_at/,,,False,,t5_2s7su,False,,,False,t3_lfo0j,http://i.imgur.com/v9Ydy.jpg,
1318657360.0,8,calost.org,lcx0l,Plastic Debris in the California Marine Ecosystem | Report,10,2,0,http://www.reddit.com/r/oceans/comments/lcx0l/plastic_debris_in_the_california_marine_ecosystem/,,,False,,t5_2s7su,False,,,False,t3_lcx0l,http://calost.org/science-initiatives/?page=marine-debris,
1318620329.0,6,redgreenandblue.org,lce7l,"California’s oceans, rivers more toxic than ever",8,2,0,http://www.reddit.com/r/oceans/comments/lce7l/californias_oceans_rivers_more_toxic_than_ever/,,,False,,t5_2s7su,False,,,False,t3_lce7l,http://redgreenandblue.org/2011/10/12/report-californias-oceans-rivers-more-toxic-than-ever/,
1318565836.0,6,fis.com,lboso,Cod makes remarkable comeback in Barents Sea,9,3,1,http://www.reddit.com/r/oceans/comments/lboso/cod_makes_remarkable_comeback_in_barents_sea/,,,False,,t5_2s7su,False,,,False,t3_lboso,http://www.fis.com/fis/worldnews/worldnews.asp?monthyear&amp;day=14&amp;id=46771&amp;l=e&amp;special&amp;ndb=1+target%3D,
1317360255.0,8,fis.com,kw614,Tipping point for coral reef collapse identified,8,0,1,http://www.reddit.com/r/oceans/comments/kw614/tipping_point_for_coral_reef_collapse_identified/,,,False,,t5_2s7su,False,,,False,t3_kw614,http://fis.com/fis/worldnews/worldnews.asp?l=e&amp;ndb=1&amp;id=46363,
1317226307.0,9,wbaltv.com,ku76h,Poachers Looting Chesapeake Bay,10,1,0,http://www.reddit.com/r/oceans/comments/ku76h/poachers_looting_chesapeake_bay/,,,False,,t5_2s7su,False,,,False,t3_ku76h,http://www.wbaltv.com/news/29321000/detail.html,
1316984426.0,8,oceanleadership.org,kr517,Senate Committee Approves Funding for White House’s Oceans Endowment,8,0,0,http://www.reddit.com/r/oceans/comments/kr517/senate_committee_approves_funding_for_white/,,,False,,t5_2s7su,False,,,False,t3_kr517,http://www.oceanleadership.org/2011/senate-committee-approves-funding-for-oceans-endowment/,
1315926359.0,9,scientificamerican.com,ke9kn,Secret lives of plankton [Photos],9,0,1,http://www.reddit.com/r/oceans/comments/ke9kn/secret_lives_of_plankton_photos/,,,False,,t5_2s7su,False,,,False,t3_ke9kn,http://www.scientificamerican.com/slideshow.cfm?id=marine-drifters-secret-life-of-plankton,
1314643150.0,8,news.stanford.edu,jy7cf,"Preserving 4 percent of the ocean could protect most marine mammal species, study finds | Stanford News Release",9,1,3,http://www.reddit.com/r/oceans/comments/jy7cf/preserving_4_percent_of_the_ocean_could_protect/,,,False,,t5_2s7su,False,,,False,t3_jy7cf,http://news.stanford.edu/pr/2011/seals-082611.html,
1314108764.0,8,self.oceans,jrp0n,Check out all the interesting work going on at the New England Aquarium [links on the sidebar].,8,0,0,http://www.reddit.com/r/oceans/comments/jrp0n/check_out_all_the_interesting_work_going_on_at/,"* [New England Aquarium Research](http://www.neaq.org/conservation_and_research/projects/project_pages/)
* [New England Aquarium Blogs](http://www.neaq.org/education_and_activities/blogs_webcams_videos_and_more/)",,False,,t5_2s7su,False,,,True,t3_jrp0n,http://www.reddit.com/r/oceans/comments/jrp0n/check_out_all_the_interesting_work_going_on_at/,
1314094036.0,8,sciencedaily.com,jrk03,Decade-long study reveals recurring patterns of viruses in the open ocean.,10,2,0,http://www.reddit.com/r/oceans/comments/jrk03/decadelong_study_reveals_recurring_patterns_of/,,,False,,t5_2s7su,False,,,False,t3_jrk03,http://www.sciencedaily.com/releases/2011/08/110811133130.htm,
1313640517.0,9,self.oceans,jmdsm,"Hey guys I want to become more knowledgable about the ocean, conservation, the environment etc. Do you have any reading/book suggestions for me?",9,0,17,http://www.reddit.com/r/oceans/comments/jmdsm/hey_guys_i_want_to_become_more_knowledgable_about/,"I just finished A Short History of Nearly Everything, and wanted to get into more specific areas. Give me your best ocean book! 

Edit: All of these books/movies are wonderful! Thank you all **goes to the library*",,False,,t5_2s7su,True,,,True,t3_jmdsm,http://www.reddit.com/r/oceans/comments/jmdsm/hey_guys_i_want_to_become_more_knowledgable_about/,
1313075952.0,7,youtube.com,jfr28,Palau president speak on ocean conservation and shark sanctuary,8,1,0,http://www.reddit.com/r/oceans/comments/jfr28/palau_president_speak_on_ocean_conservation_and/,,,False,,t5_2s7su,False,,,False,t3_jfr28,http://www.youtube.com/watch?v=gs_h-ZDBLNQ,
1313006569.0,8,fishnewseu.com,jex8g,Chesapeake Bay blue crab stocks bouncing back,8,0,1,http://www.reddit.com/r/oceans/comments/jex8g/chesapeake_bay_blue_crab_stocks_bouncing_back/,,,False,,t5_2s7su,False,,,False,t3_jex8g,http://www.fishnewseu.com/index.php?option=com_content&amp;view=article&amp;id=6404:chesapeake-bay-blue-crab-stocks-bouncing-back&amp;catid=46:world&amp;Itemid=56,
1312072357.0,9,nytimes.com,j4ha8,Dams to Be Removed in Washington to Replenish Salmon,9,0,0,http://www.reddit.com/r/oceans/comments/j4ha8/dams_to_be_removed_in_washington_to_replenish/,,,False,,t5_2s7su,False,,,False,t3_j4ha8,http://www.nytimes.com/2011/07/30/us/30dam.html,
1310048759.0,7,salon.com,ij1s2,The disappearing fish we should worry about,8,1,3,http://www.reddit.com/r/oceans/comments/ij1s2/the_disappearing_fish_we_should_worry_about/,,,False,,t5_2s7su,False,,,False,t3_ij1s2,http://www.salon.com/news/env/environment/index.html?story=/food/feature/2011/07/06/menhaden_disappearing_virginia,
1309965445.0,6,diverwire.com,ii5us,The Bahamas announces ban on commercial shark fishing | xpost /r/worldnews,8,2,0,http://www.reddit.com/r/oceans/comments/ii5us/the_bahamas_announces_ban_on_commercial_shark/,,,False,,t5_2s7su,False,,,False,t3_ii5us,http://www.diverwire.com/post/scuba-environment-news/the-bahamas-announces-ban-on-commercial-shark-fishing/,
1309813307.0,7,sciencedaily.com,ignn7,"Warming ocean layers will undermine polar ice sheets, climate models show: Warming of the ocean's subsurface layers will melt underwater portions of the Greenland and Antarctic ice sheets faster than previously thought",10,3,0,http://www.reddit.com/r/oceans/comments/ignn7/warming_ocean_layers_will_undermine_polar_ice/,,,False,,t5_2s7su,False,,,False,t3_ignn7,http://www.sciencedaily.com/releases/2011/07/110703133838.htm,
1308029063.0,7,theepochtimes.com,hz5yt,Ocean Report: The Death of South Florida’s Reefs,10,3,0,http://www.reddit.com/r/oceans/comments/hz5yt/ocean_report_the_death_of_south_floridas_reefs/,,,False,,t5_2s7su,False,,,False,t3_hz5yt,http://www.theepochtimes.com/n2/science/ocean-report-the-death-of-south-floridas-reefs-57597.html,
1306299775.0,8,worldfishing.net,hjj9g,WWF welcomes Hong Kong trawl ban,10,2,0,http://www.reddit.com/r/oceans/comments/hjj9g/wwf_welcomes_hong_kong_trawl_ban/,,,False,,t5_2s7su,False,,,False,t3_hjj9g,http://www.worldfishing.net/news101/wwf-welcomes-hong-kong-trawl-ban,
1376753452.0,8,kpbs.org,1kjwz0,Calif. Shark Fin Ban Argued In Federal Court | Obama administration supports sides with opponents,8,0,0,http://www.reddit.com/r/oceans/comments/1kjwz0/calif_shark_fin_ban_argued_in_federal_court_obama/,,,False,,t5_2s7su,False,,,False,t3_1kjwz0,http://www.kpbs.org/news/2013/aug/15/calif-shark-fin-ban-argued-in-federal-court/,
1376699212.0,6,scientificamerican.com,1kittb,help save the oceans...,7,1,0,http://www.reddit.com/r/oceans/comments/1kittb/help_save_the_oceans/,,,False,,t5_2s7su,False,,,False,t3_1kittb,http://www.scientificamerican.com/article.cfm?id=how-to-help-oceans-recover-based-on-telling-our-way-to-the-sea,
1375882533.0,8,montrealgazette.com,1jvrel,"Unprecedented ocean acidification from greenhouse gases putting Canadian waters at risk, says report",8,0,1,http://www.reddit.com/r/oceans/comments/1jvrel/unprecedented_ocean_acidification_from_greenhouse/,,,False,,t5_2s7su,False,,,False,t3_1jvrel,http://www.montrealgazette.com/technology/environment/Unprecedented+ocean+acidification+from/8607447/story.html,
1375356253.0,7,sci-news.com,1jhk32,Two New Species of Sea Pen Discovered in New Zealand Waters,7,0,1,http://www.reddit.com/r/oceans/comments/1jhk32/two_new_species_of_sea_pen_discovered_in_new/,,,False,,t5_2s7su,False,,,False,t3_1jhk32,http://www.sci-news.com/biology/article01106-new-zealand-sea-pen.html,
1374151807.0,8,news.discovery.com,1ik0et,"In Fiji's largest marine reserve, shark populations are benefiting from ""no-take"" protections that keep their food supply steady, according to a new study",8,0,0,http://www.reddit.com/r/oceans/comments/1ik0et/in_fijis_largest_marine_reserve_shark_populations/,,,False,,t5_2s7su,False,,,False,t3_1ik0et,http://news.discovery.com/earth/oceans/shark-fishing-fiji-reserve-130717.htm,
1373483867.0,8,voanews.com,1i0zea,What will the growing number of farmed fish eat as wild-caught fish supplies plateau? How picky are they? Can we taste the difference?,8,0,15,http://www.reddit.com/r/oceans/comments/1i0zea/what_will_the_growing_number_of_farmed_fish_eat/,,,False,,t5_2s7su,False,,,False,t3_1i0zea,http://www.voanews.com/content/as-ocean-supply-dries-up-fishing-for-a-feed-alternative/1698814.html,
1373165885.0,6,nature.com,1hs7ov,Crowdsourcing may open up ocean science,8,2,0,http://www.reddit.com/r/oceans/comments/1hs7ov/crowdsourcing_may_open_up_ocean_science/,,,False,,t5_2s7su,False,,,False,t3_1hs7ov,http://www.nature.com/news/crowdsourcing-may-open-up-ocean-science-1.13341,
1373082689.0,7,youtube.com,1hqcpt,The Jellyfish Project - a program from a band from my hometown raising awareness about the issues facing the oceans,7,0,0,http://www.reddit.com/r/oceans/comments/1hqcpt/the_jellyfish_project_a_program_from_a_band_from/,,,False,,t5_2s7su,False,,,False,t3_1hqcpt,https://www.youtube.com/watch?v=cSlpJwRz7g0,
1372279974.0,7,explorers.neaq.org,1h4tcr,[PICTURES] BBC cinematographer talks hermit crab vacancy chains—and how to film them—in Belize,8,1,0,http://www.reddit.com/r/oceans/comments/1h4tcr/pictures_bbc_cinematographer_talks_hermit_crab/,,,False,,t5_2s7su,False,,,False,t3_1h4tcr,http://explorers.neaq.org/2013/06/2013-belize-guest-post-from-bbc.html,
1371838515.0,8,schmidtocean.org,1gt4aq,Live streaming video from the bottom of the Cayman Trough using hybrid ROV Nereus,9,1,1,http://www.reddit.com/r/oceans/comments/1gt4aq/live_streaming_video_from_the_bottom_of_the/,,,False,,t5_2s7su,False,,,False,t3_1gt4aq,http://www.schmidtocean.org/story/show/1699,
1371739210.0,7,youtu.be,1gq970,Grand Isle Water Spout 6/19/13,7,0,1,http://www.reddit.com/r/oceans/comments/1gq970/grand_isle_water_spout_61913/,,,False,,t5_2s7su,False,,,False,t3_1gq970,http://youtu.be/uJJWRqyVFcg,
1371494795.0,5,explorers.neaq.org,1gj5lu,"Researchers in Belize show what happens when a reef ecosystem is plagued by bleaching, disease, hurricanes and earthquakes",8,3,0,http://www.reddit.com/r/oceans/comments/1gj5lu/researchers_in_belize_show_what_happens_when_a/,,,False,,t5_2s7su,False,,,False,t3_1gj5lu,http://explorers.neaq.org/2013/06/belize-2013-trip-to-pelican-cays.html,
1371150085.0,7,redorbit.com,1gab2i,Purple Urchins Quickly Adapt To Acidic Oceans,9,2,0,http://www.reddit.com/r/oceans/comments/1gab2i/purple_urchins_quickly_adapt_to_acidic_oceans/,,,False,,t5_2s7su,False,,,False,t3_1gab2i,http://www.redorbit.com/news/science/1112873077/purple-urchins-adapt-to-acidic-oceans-061313/,
1371148082.0,6,opb.org,1ga88c,OSU Study Explains How Even A Little Ocean Acidification Can Kill Baby Oysters,8,2,0,http://www.reddit.com/r/oceans/comments/1ga88c/osu_study_explains_how_even_a_little_ocean/,,,False,,t5_2s7su,False,,,False,t3_1ga88c,http://www.opb.org/news/blog/ecotrope/osu-study-explains-how-even-a-little-ocean-acidification-can-kill-baby-oysters/,
1371098766.0,7,foxnews.com,1g8yvt,400-Million-year-old 'spiny shark' fossil found,8,1,0,http://www.reddit.com/r/oceans/comments/1g8yvt/400millionyearold_spiny_shark_fossil_found/,,,False,,t5_2s7su,False,,,False,t3_1g8yvt,http://www.foxnews.com/science/2013/06/05/400-million-year-old-spiny-shark-fossil-found/,
1370950605.0,8,savingseafood.org,1g450z,What is Peer Review?,9,1,2,http://www.reddit.com/r/oceans/comments/1g450z/what_is_peer_review/,,,False,,t5_2s7su,False,,,False,t3_1g450z,http://www.savingseafood.org/management-regulation/criticism-of-saving-seafoods-lenfest-pew-forage-fish-report-raises-the-question-what-is-peer-re-3.html,
1370604905.0,8,dotearth.blogs.nytimes.com,1futlm,NOAA Seeking Permanent Rule to Reduce Whale Ship Strikes Along U.S. East Coast,8,0,0,http://www.reddit.com/r/oceans/comments/1futlm/noaa_seeking_permanent_rule_to_reduce_whale_ship/,,,False,,t5_2s7su,False,,,False,t3_1futlm,http://dotearth.blogs.nytimes.com/2013/06/05/the-right-rules-for-keeping-ships-from-hitting-right-whales/?src=twrhp,
1370458196.0,7,losangeles.cbslocal.com,1fql2o,"Human killing machine slaughters 1,000-lb, 11-foot mako shark for sport.",10,3,5,http://www.reddit.com/r/oceans/comments/1fql2o/human_killing_machine_slaughters_1000lb_11foot/,,,False,,t5_2s7su,False,,,False,t3_1fql2o,http://losangeles.cbslocal.com/2013/06/04/possible-world-record-breaking-mako-shark-caught-off-la-coast/,
1370014683.0,7,gloucestertimes.com,1feq75,"AG Coakley files suit to block NOAA catch limits | Gloucester, MA",8,1,0,http://www.reddit.com/r/oceans/comments/1feq75/ag_coakley_files_suit_to_block_noaa_catch_limits/,,,False,,t5_2s7su,False,,,False,t3_1feq75,http://www.gloucestertimes.com/local/x2026368093/AG-Coakley-files-suit-to-block-NOAA-catch-limits,
1369840498.0,7,galleries.neaq.org,1f9sx7,"Amazing post about goosefish, with video of it eating in slow motion!",7,0,1,http://www.reddit.com/r/oceans/comments/1f9sx7/amazing_post_about_goosefish_with_video_of_it/,,,False,,t5_2s7su,False,,,False,t3_1f9sx7,http://galleries.neaq.org/2013/05/goosefish-feeding-timein-slow-motion.html,
1366522605.0,6,10news.com,1csc0b,"Sea lions returned to Pacific Ocean | 1,300 have been saved along southern California's coast this year",7,1,1,http://www.reddit.com/r/oceans/comments/1csc0b/sea_lions_returned_to_pacific_ocean_1300_have/,,,False,,t5_2s7su,False,,,False,t3_1csc0b,http://www.10news.com/news/sea-lions-returned-to-pacific-ocean-041913,
1366226787.0,7,galleries.neaq.org,1cjwq4,Three cool vine videos of the octopus at the New England Aquarium,10,3,2,http://www.reddit.com/r/oceans/comments/1cjwq4/three_cool_vine_videos_of_the_octopus_at_the_new/,,,False,,t5_2s7su,False,,,False,t3_1cjwq4,http://galleries.neaq.org/2013/04/theres-something-about-octopus.html,
1365854475.0,7,blog.maptia.com,1c9jw5,Ode to the Ocean [Photo Essay],7,0,0,http://www.reddit.com/r/oceans/comments/1c9jw5/ode_to_the_ocean_photo_essay/,,,False,,t5_2s7su,False,,,False,t3_1c9jw5,http://blog.maptia.com/posts/photo-essay-ode-to-the-ocean,
1365725884.0,6,pcmag.com,1c68ew,So Cool - Liquid Robotics Unveils Powerful Data-Collecting Ocean Robot,8,2,0,http://www.reddit.com/r/oceans/comments/1c68ew/so_cool_liquid_robotics_unveils_powerful/,,,False,,t5_2s7su,False,,,False,t3_1c68ew,"http://www.pcmag.com/article2/0,2817,2417517,00.asp?kc=PCRSS03069TX1K0001121",
1365105864.0,5,seadiscovery.com,1bolxc,Seadiscovery.com - Seawater Battery Key to Renewable Energy Storage,7,2,0,http://www.reddit.com/r/oceans/comments/1bolxc/seadiscoverycom_seawater_battery_key_to_renewable/,,,False,,t5_2s7su,False,,,False,t3_1bolxc,http://www.seadiscovery.com/mtStories.aspx?ShowStory=1090342075&amp;utm_source=buffer&amp;buffer_share=e2558,
1364489029.0,7,gearthhacks.com,1b6ou7,Teaching about the ocean bottom with Google Maps and Google Earth.,8,1,0,http://www.reddit.com/r/oceans/comments/1b6ou7/teaching_about_the_ocean_bottom_with_google_maps/,,,False,,t5_2s7su,False,,,False,t3_1b6ou7,http://www.gearthhacks.com/forums/showthread.php?16147-Teaching-about-the-ocean-bottom-with-Google-Map-and-Google-Earth,
1361986238.0,9,dispatch.com,19c5mc,International Polar Bear day!,9,0,0,http://www.reddit.com/r/oceans/comments/19c5mc/international_polar_bear_day/,,,False,,t5_2s7su,False,,,False,t3_19c5mc,http://www.dispatch.com/content/roundup-story/2013/02/polar-bear-day.html,
1361810604.0,8,synergyexhibit.org,19760j,Ocean Stories: A Synergy of Art and Science.  (Special exhibit at the Boston Museum of Science.),8,0,0,http://www.reddit.com/r/oceans/comments/19760j/ocean_stories_a_synergy_of_art_and_science/,,,False,,t5_2s7su,False,,,False,t3_19760j,http://synergyexhibit.org/ocean-stories-exhibit/,
1361489837.0,5,strandednomore.wordpress.com,18zim1,"Independent Investigation of Recent Cetacean Mutispecies Die Offs in France, Ireland and UK: R/V Celtic Explorer Connection?",15,10,6,http://www.reddit.com/r/oceans/comments/18zim1/independent_investigation_of_recent_cetacean/,,,False,,t5_2s7su,False,,,False,t3_18zim1,http://strandednomore.wordpress.com/2013/02/21/independent-investigation-of-recent-cetacean-mutispecies-die-offs-in-france-ireland-and-uk-rv-celtic-explorer-connection/,
1361460223.0,6,wtop.com,18ygtg,US winery experiments with aging wine in ocean ,7,1,1,http://www.reddit.com/r/oceans/comments/18ygtg/us_winery_experiments_with_aging_wine_in_ocean/,,,False,,t5_2s7su,False,,,False,t3_18ygtg,http://www.wtop.com/1228/3229847/Winery-experiments-with-aging-wine-in-ocean,
1360523681.0,6,self.oceans,189cbt,An Incredibly Weird and Specific Tidal (&amp; History) Question,8,2,3,http://www.reddit.com/r/oceans/comments/189cbt/an_incredibly_weird_and_specific_tidal_history/,"Here is my incredibly specific question: 

Is it at all plausible that there may have been a **low tide**:

1. At night, 
2. during Spring 
3. of any year in the late 16th Century, 
4. on the Friesland coast of the North Sea?

Data has been hard to come by, so I haven't found any resources I can use to infer anything close to an answer. Also, I'm not even a little bit of an oceanographer. What I do know is that this particular coast was especially capricious re: storm tides (which is why there was so little settlement there), and that it generally followed a semi-diurnal pattern, which makes it possible for a midnight low-tide. Is this correct?

I'm researching the plausibility of a causeway, exposed only during low-tide, that lead to an otherwise inaccessible island. This causeway, if plausible, might only have been accessible at very specific points throughout the year, and if so, might such a point fall during or near Vernal Equinox. 

What are your thoughts?",,False,,t5_2s7su,False,,,True,t3_189cbt,http://www.reddit.com/r/oceans/comments/189cbt/an_incredibly_weird_and_specific_tidal_history/,
1360235051.0,8,awi.de,1825hs,Deep-sea researchers and space travel technologists jointly develop robot systems for the exploration of extreme regions,9,1,0,http://www.reddit.com/r/oceans/comments/1825hs/deepsea_researchers_and_space_travel/,,,False,,t5_2s7su,False,,,False,t3_1825hs,http://www.awi.de/en/news/press_releases/detail/item/two_expert_teams_start_cooperation/?cHash=78212ada487bf5dac5fe63e8bd77d32d,
