created_utc,score,domain,id,title,ups,downs,num_comments,permalink,selftext,link_flair_text,over_18,thumbnail,subreddit_id,edited,link_flair_css_class,author_flair_css_class,is_self,name,url,distinguished
1320203758.0,90,i.imgur.com,lx9to,My Best friend since fifth grade just passed at 16. R.I.P Boris I couldn't have asked for a better companion.,107,17,2,http://www.reddit.com/r/Pets/comments/lx9to/my_best_friend_since_fifth_grade_just_passed_at/,,,False,,t5_2qh6o,False,,,False,t3_lx9to,http://i.imgur.com/t2wZ0.jpg,
1317753370.0,96,i.imgur.com,l0rsj,I noticed my cats weren't bugging me while I was trying to work.  I went searching for and found them.,105,9,9,http://www.reddit.com/r/Pets/comments/l0rsj/i_noticed_my_cats_werent_bugging_me_while_i_was/,,,False,,t5_2qh6o,False,,,False,t3_l0rsj,http://i.imgur.com/B0fXH.jpg,
1309668419.0,93,i.imgur.com,ifgcf,"My dog, sleeping in her favorite position.",103,10,6,http://www.reddit.com/r/Pets/comments/ifgcf/my_dog_sleeping_in_her_favorite_position/,,,False,,t5_2qh6o,False,,,False,t3_ifgcf,http://i.imgur.com/etHzV.jpg,
1307786945.0,92,i.imgur.com,hx2fh,My 8 year old pal Mr. Bandit,98,6,14,http://www.reddit.com/r/Pets/comments/hx2fh/my_8_year_old_pal_mr_bandit/,,,False,,t5_2qh6o,False,,,False,t3_hx2fh,http://i.imgur.com/1T44p.jpg,
1307742742.0,96,i.imgur.com,hwpxl,My pup always steals my place in bed,104,8,18,http://www.reddit.com/r/Pets/comments/hwpxl/my_pup_always_steals_my_place_in_bed/,,,False,,t5_2qh6o,False,,,False,t3_hwpxl,http://i.imgur.com/L4hCF.jpg,
1296431663.0,97,i.imgur.com,fc1te,my only friend,103,6,17,http://www.reddit.com/r/Pets/comments/fc1te/my_only_friend/,,,False,,t5_2qh6o,False,,,False,t3_fc1te,http://i.imgur.com/zaDE6.jpg,
1288667153.0,93,youtube.com,dzucg,My rescued baby gray squirrel. They are like this ALL THE TIME. [VID],100,7,45,http://www.reddit.com/r/Pets/comments/dzucg/my_rescued_baby_gray_squirrel_they_are_like_this/,,,False,,t5_2qh6o,False,,,False,t3_dzucg,http://www.youtube.com/watch?v=di3ro3_T2Jk,
1346024500.0,94,i.imgur.com,yvjg5,I was dog sitting for a friend. Here they are waiting for their owner to come back.,117,23,2,http://www.reddit.com/r/Pets/comments/yvjg5/i_was_dog_sitting_for_a_friend_here_they_are/,,,False,,t5_2qh6o,False,,,False,t3_yvjg5,http://i.imgur.com/KmFHm.jpg,
1337452406.0,94,i.imgur.com,tuz59,"I moved in with a long-time friend. She had a dog, and I was a bit weary at first. However, now... I'm in love with him. Meet Thor. :)",112,18,10,http://www.reddit.com/r/Pets/comments/tuz59/i_moved_in_with_a_longtime_friend_she_had_a_dog/,,,False,,t5_2qh6o,False,,,False,t3_tuz59,http://i.imgur.com/2PSXu.jpg,
1329911209.0,93,i.imgur.com,q0suc,"This is my boyfriend, his dog and I. We have to put the dog down tomorrow; but I thought I'd share a photo of the 3 of us that we just took. We love you, Shasta. &lt;3 We'll never forget you. &lt;3",151,58,19,http://www.reddit.com/r/Pets/comments/q0suc/this_is_my_boyfriend_his_dog_and_i_we_have_to_put/,,,False,,t5_2qh6o,False,,,False,t3_q0suc,http://i.imgur.com/vpbnb.jpg,
1324666331.0,93,self.Pets,no6p8,Hug them now.  They may not be there tomorrow.,111,18,42,http://www.reddit.com/r/Pets/comments/no6p8/hug_them_now_they_may_not_be_there_tomorrow/,"Late last night my 6 year old [Lab/Pointer mix]( http://www.imgur.com/nMoQN.jpg) was watching my wife put up a few more ornaments on our tree and lounging on the couch as she usually did.  Suddenly she got down and started making noises like she was going to be sick and threw up her dinner.  Now being a lab, sometimes she swallows a piece of chew toy, but it always comes back up and my wife thought that's what was the culprit.  As she went to clean up the mess, the dog went and sat at the landing of the stairs.  This was odd because usually if she got sick she would cower and tuck tail thinking that she did something wrong, but she just indifferently went and sat down, then laid down.  My wife called up to me, ""I think there's something wrong with Lani."" I came down the stairs and noticed she was tracking me with her eyes, but not lifting her head.  As I was checking her over, she stopped breathing.  We moved her to the living room floor and started CPR.  I wrapped her up and put her in the car, racing to the veterinary hospital while my wife continued compressions.  At the hospital they continued trying to revive her to no avail.  The DVM did an ultrasound to determine what caused the sudden crash and discovered a tumor on her heart that had ruptured and filled the sac around her heart with fluid.  There was nothing we could do.  

She was the perfect dog; sweet, playful, obedient, great with our toddler, never peed in the house, etc.  Now a large void sits where our Lei Lani used to be.  We have lost a member of the family.  I just wanted to share with you all as a reminder of how quickly these critters that make life a little brighter can disappear from our lives.  Please give your furry family members a hug and kiss on behalf of those of us who can't.  

* [Her favorite spot]( http://www.imgur.com/moyJY.jpg)

* [The last footprints she will have left]( http://www.imgur.com/CFL1C.jpg)

",,False,,t5_2qh6o,False,,,True,t3_no6p8,http://www.reddit.com/r/Pets/comments/no6p8/hug_them_now_they_may_not_be_there_tomorrow/,
1317588477.0,92,i.imgur.com,kyn5w,Always take time to smell the flowers,108,16,5,http://www.reddit.com/r/Pets/comments/kyn5w/always_take_time_to_smell_the_flowers/,,,False,,t5_2qh6o,False,,,False,t3_kyn5w,http://i.imgur.com/JkwmE.jpg,
1310738633.0,91,imgur.com,iqew0,Introducing Leeloo Dallas Multipass (Leeloo for short) Our newest family member --rescued mixed breed Yorkshire/Rat Terrier. ,103,12,17,http://www.reddit.com/r/Pets/comments/iqew0/introducing_leeloo_dallas_multipass_leeloo_for/,,,False,,t5_2qh6o,False,,,False,t3_iqew0,http://imgur.com/MdiMA,
1300767129.0,92,i.imgur.com,g8p69,I was outside on a small ladder changing a lightbulb when my wife yells from inside for me to look down - this is what I saw. ,104,12,14,http://www.reddit.com/r/Pets/comments/g8p69/i_was_outside_on_a_small_ladder_changing_a/,,,False,,t5_2qh6o,False,,,False,t3_g8p69,http://i.imgur.com/19Cpg.jpg,
1372577275.0,94,medievalists.net,1hcsxi,Medieval Pet Names,108,14,5,http://www.reddit.com/r/Pets/comments/1hcsxi/medieval_pet_names/,,,False,,t5_2qh6o,False,,,False,t3_1hcsxi,http://www.medievalists.net/2013/06/23/medieval-pet-names/,
1355521447.0,89,self.Pets,14v3ls,"My chicken has 9 lives. This is the true story of how an abused chicken was attacked by a dog and survived.  Picture of dog and chicken ""playing dead"" included",117,28,44,http://www.reddit.com/r/Pets/comments/14v3ls/my_chicken_has_9_lives_this_is_the_true_story_of/,"I wrote this story because it's an inspiring story of something that happened to one of my chickens. This was meant to be a poem with stanzas. Reddit doesn't show the formatting well so you can see it formatted correctly here:  

[Formatted version of Nugget's Story](http://nuggetthechicken.blogspot.com/2012/12/nugget-story-of-how-abused-chicken-was.html)


**Pecking Order: The story of Nugget, the chicken who never gave up**

Nugget grew up with 3 other chickens, Kung Pao, The Colonel, and Tandoori.
And when they were young, these birds never had a worry.

I never knew the origin of the phrase, ""pecking order"".
But the words came alive when watching chickens grow up in close quarters.

As the chickens matured, rough bullying started.
Our friend Jim, Nugget's first owner, was broken hearted.

Nugget was the target and they would peck, peck, peck.
Nugget never fought back, even with blood soaked feathers on her neck.

Nugget laid down motionless as if she wasn't there.
The chickens kept attacking her as if they didn't care.

Nugget could not defend herself so Jim looked for a new home.
Maybe one with nicer chickens that would leave her alone.

So we adopted Nugget from Jim and hoped for the best.
Would she fare better with us? That was the test.

Her new coop mates had names like Uggs, Puggs, and Sweets.
We hoped she wouldn't be the new target of their tweets.

Though her neighbors were different, the result was the same.
The chickens kept pecking at her as if it was a game.

We couldn't stand it and we built her an individual cage.
Nugget would have her own area where she could peacefully age.

She wouldn't be bothered when she wanted water or a meal.
And we hoped the wound on her neck would eventually heal.

After a few weeks we decided to let Nugget mingle.
We knew she was desperately lonely and feeling single.

But this time around Nugget seemed stronger.
We could leave her in the yard with other chickens for longer.

Nugget didn't socialize because she wasn't quite able.
But she would watch from a chair or up high on a table.

And when the chickens approached her to try to attack.
Nugget puffed herself up and would take a step back.

Everything went well for Nugget for a few weeks.
But we knew something was terribly wrong when we heard shouting from their beaks.

Somehow or another a dog had entered our yard.
And his target was the chicken who was most mentally scarred.

By the time we got outside we saw.
A mean dog running with Nugget firmly in its jaw.

My daughter cried and said why Nugget - she had lived the hardest life.
I watched in horror, completely stupefied and called my wife.

I put my daughter in the house and locked her in.
Then I searched for the dog who had attacked our chicken.

I found the dog with Nugget motionless by its side.
To be honest I didn't know what to do and I was terrified.

Suddenly an amazing thing happened that I didn't believe.
Nugget stood up and started running. But I was only partially relieved.

The dog tried to chase after Nugget but I kept him at bay.
I tried to give Nugget time to get away.

I searched all over the yard but Nugget was lost.
But I kept looking and I would find her at any cost.

I imagined finding her dead and my stomach sickened.
But to my surprise she was at the coop talking to the other chickens.

The chickens crowded around her wanting to hear how she survived.
Nugget had learned to play dead in order to stay alive.

All of the times she laid motionless and abused against her will, 
in one lucky moment was her life saving skill.

We put her in a box and then drove her to the vet.
They asked for her name. Embarrassed, we whispered, ""Nugget.""

The doctor gave her stitches and said Nugget would be fine.
How many lives would this chicken have ...  Nine?

When we brought her back home we locked her safely away.
So she could relax and rest for the rest of the day.

She wouldn't be bothered when she wanted water or a meal.
And we hoped the wounds from the dog would eventually heal.

After several weeks we let Nugget back out into the yard.
But this time the other chickens didn't make her life hard.

It seemed the other chickens were glad to have Nugget back.
And they were in awe of her for surviving the dog attack.

Nugget played with the other chickens during the day.
But retreated to her own coop at night to get away.

One day during a rain storm, her coop door was closed.
Nugget could not get in and had nowhere else to go.

Nugget went to the coop with the other chickens to stay warm.
She was alone at the bottom but she was safe from the storm.

In the morning we set Nugget free to play outside.
And we left her private coop door open to let her decide.

The next evening Nugget stayed with the other chickens again.
She slept on the second level and was fitting in with the other hens!

On the third night after the storm we looked in the coop.
Nugget had reserved the most coveted top stoop!

From then on Nugget lived with the rest of the flock.
Amazingly she was no longer the one to be mocked.

It was as if the other chickens now respected her.
And Nugget had a new-found confidence we never expected in her.

**Photos of Nugget**

* [The dog who attacked Nugget](http://imgur.com/nV8mQ)
* [Nugget at the Vet after the attack](http://imgur.com/Z75mv)

",,False,,t5_2qh6o,1355668106.0,,,True,t3_14v3ls,http://www.reddit.com/r/Pets/comments/14v3ls/my_chicken_has_9_lives_this_is_the_true_story_of/,
1346728000.0,94,i.imgur.com,zbejl,You coming with us?! Lol,122,28,0,http://www.reddit.com/r/Pets/comments/zbejl/you_coming_with_us_lol/,,,False,,t5_2qh6o,False,,,False,t3_zbejl,http://i.imgur.com/LmBYz.jpg,
1346554890.0,91,imgur.com,z7q4n,New kitten! Names?,118,27,54,http://www.reddit.com/r/Pets/comments/z7q4n/new_kitten_names/,,,False,,t5_2qh6o,False,,,False,t3_z7q4n,http://imgur.com/McsrK,
1338762874.0,95,i.imgur.com,uj6t6,Boss Loves Chasing Daddy,100,5,7,http://www.reddit.com/r/Pets/comments/uj6t6/boss_loves_chasing_daddy/,,,False,,t5_2qh6o,False,,,False,t3_uj6t6,http://i.imgur.com/7TwEE.jpg,
1338258625.0,92,imgur.com,u9oig,Isn't my dog a cutie :D,124,32,4,http://www.reddit.com/r/Pets/comments/u9oig/isnt_my_dog_a_cutie_d/,,,False,,t5_2qh6o,False,,,False,t3_u9oig,http://imgur.com/dejDP,
1336801016.0,95,i.imgur.com,tjc1w,There's no more room in the box of happiness.,101,6,0,http://www.reddit.com/r/Pets/comments/tjc1w/theres_no_more_room_in_the_box_of_happiness/,,,False,,t5_2qh6o,False,,,False,t3_tjc1w,http://i.imgur.com/ttGtD.jpg,
1334761640.0,93,i.imgur.com,sg35f,What was she thinking?,119,26,8,http://www.reddit.com/r/Pets/comments/sg35f/what_was_she_thinking/,,,False,,t5_2qh6o,False,,,False,t3_sg35f,http://i.imgur.com/WGLy1.jpg,
1330051375.0,91,i.imgur.com,q3hfm,This is puma,124,33,4,http://www.reddit.com/r/Pets/comments/q3hfm/this_is_puma/,,,False,,t5_2qh6o,False,,,False,t3_q3hfm,http://i.imgur.com/di3WN.jpg,
1327209589.0,89,i.imgur.com,or4u0,This is Freyja. She is dog.,125,36,14,http://www.reddit.com/r/Pets/comments/or4u0/this_is_freyja_she_is_dog/,,,False,,t5_2qh6o,False,,,False,t3_or4u0,http://i.imgur.com/uSp3v.jpg,
1317943919.0,88,i.imgur.com,l3jpj,HEY YOU'RE HOME!,102,14,7,http://www.reddit.com/r/Pets/comments/l3jpj/hey_youre_home/,,,False,,t5_2qh6o,False,,,False,t3_l3jpj,http://i.imgur.com/uD1Q0.jpg,
1312768343.0,94,self.Pets,jbzdo,My little man. Put down today at 7 months old.,107,13,51,http://www.reddit.com/r/Pets/comments/jbzdo/my_little_man_put_down_today_at_7_months_old/,"What do you do when someone you love is severely sick?
I only knew him for Seven months.
When I first saw him he was a little fur-ball.  He was so cute running around the pen dashing at you filling your heart with his sweet nature. We instantly fell in love with him, filled out the paper work and took him home.
It seemed to us he grew bigger every day. He was our “Big boy” he was supposed to be 200 pounds someday!
At first we thought he was just hard to house train, but it then became apparent that something was wrong when he couldn’t even hold it in while he was in his cage.
He was taken to the vet and they suspected it being diabetes. We were shocked, how could our little man have that? We did the “water tests”, he was drinking more then 13 cups a day. It was sure to be just Diabetes.
Months went on and we dealt with his “Diabetes” constantly showering with him, giving him water, cleaning up all of his “water”, buying rolls of paper towel like no tomorrow.
Then it was time for him to get neutered, they did pre-surgical blood work to make sure everything was ok.
But it wasn’t.

The test showed his liver enzymes were way too high. We had him tested for quite a few different diseases, all negative. So it was down to a few possible things; a Parasitic Fluke, Hepatitis, or a liver shunt. Every option was horrific. We decided to treat for the liver shunt as it was the least expensive thing and hopefully “easiest” to treat. Other options were to have ultrasounds done to his liver to confirm a shunt, where then the only possible treatments were medication his whole life or a surgery that can only be done at the University of Saskatoon which was thousands of dollars which he would be hospitalized and would need continuous vet visits to ensure that he would be progressing. 
He was on antibiotics and Lactulose, and his new vegetarian diet. For the first few days he was responding really well to the therapy. He didn’t seem as lethargic; he was walking around, and was even starting to play again!
He started to get sick again. The medication was no longer working. More blood tests were done.
They showed his body was now attacking his Red Blood Cells. His RBC was very low, and he was severely Dehydrated and now Anemic. Even if it was a Shunt and we had the means to get the surgery done we couldn’t because of the anemia. More needles, subcutaneous injection of fluids for his dehydration and a new set of medications to help prevent his body from attacking itself.
Only it didn’t work.
His eyes, ears and gums all yellow. His liver was not working and he now had severe jaundice. His body attacking itself and now he was poisoned, he was having a very hard time breathing and it was a struggle to just look at him. I held him that night, felt his fur, trying to make sure he was ok, making sure he was still breathing.
I woke up to him howling. I was relieved he must be better if he’s barking. I got up to find his kennel covered in vomit.  We took him out washed his paws and set the kennel bottom outside. I watched him sleep, he was struggling.
A little while later he vomited again, this time it was black. Immediately we knew something was very wrong. We called a vet and made an appointment, got him in the car and left.
We waited about an hour for the Veterinarian. After he examined him and we showed him the medications and filled him in about his medical history he gave us two options.
1.	Subcutaneous fluids for the dehydration and Zantac injection to stop him from puking. He was bleeding in his stomach from a peptic ulcer caused by the medications that’s why his vomit had been black. He would continue to bleed internally, but it would ease his stomach until we could get him to his regular vet.
2.	Blood transfusion. He would need one every day for at least three days. It wasn’t guaranteed to work because his body was already destroying his RBC’s so it would also most likely reject the donor cells. It was also a very lengthy and expensive procedure.
I stared at him. He was panting on the ground, nonresponsive as the Doctor continued to look at his eyes and gums. We realized the only real option.
We were all in the room, for how long I’m not sure. Petting him, holding him, giving our last bit of love that we could. 
Second last needle; to sedate him. He was fully sedated after 10 to 15 minutes. We were all there for him.
It was the last needle and shortly thereafter his last breath, and most importantly no more suffering.
We love you Moose.


Edit: I wanted to share more pictures of him, he was so darling. Thank you all SO much for the support! It's really helping me deal with the loss. Thank you again.

http://imgur.com/a/tCEHK/all

http://imgur.com/5nvH8",,False,,t5_2qh6o,True,,,True,t3_jbzdo,http://www.reddit.com/r/Pets/comments/jbzdo/my_little_man_put_down_today_at_7_months_old/,
1312199441.0,91,i.imgur.com,j5lx8,My rabbit grooming my husband.,105,14,11,http://www.reddit.com/r/Pets/comments/j5lx8/my_rabbit_grooming_my_husband/,,,False,,t5_2qh6o,False,,,False,t3_j5lx8,http://i.imgur.com/bRBn0.jpg,
1375913912.0,87,self.Pets,1jwy13,[UPDATE] I asked r/pets for advice concerning my 23 year-old cat... was I considering letting her go for her or me? Here's my update.,106,19,23,http://www.reddit.com/r/Pets/comments/1jwy13/update_i_asked_rpets_for_advice_concerning_my_23/,"[Here's a link to the original post.](http://www.reddit.com/r/Pets/comments/1jpren/am_i_putting_my_23_yearold_cat_down_for_myself_or/)

First, a huge thanks to the r/pets community - you guys were so kind and thoughtful with your replies and I valued each one.

I took her to the vet once again, kind of desperate to just be told bluntly one way or the other if they thought she should be put down. The vet seemed really concerned just by looking at her. He said he suspected renal failure - he said she was severely dehydrated and apparently weighed less than a four week-old kitten he'd weighed earlier that day. I asked him straight up, ""if she was your cat, what would you do?"" He said he'd put her down.

That was enough for me and helped me with the guilt I felt about having her put down because she'd become 'hard work'. I suggested having one more week with her, but he actually said he wouldn't leave it a week in her condition. Which really shocked me, I thought she might have a few months left in her, if I pushed it.

So she's booked in for Friday and I'm heartbroken, but in a way relieved because a decision has finally been reached. Now I'm looking at her through fresh eyes I've suddenly realised how weak and frail she is. I do think it's time.

I hope this update was okay with the mods, as it is technically about pet loss, I guess. Anyway, [here's a picture](http://imgur.com/a/cdM0C) of the girl in question... my gorgeous Flo (bonus pic of the dog shaking his head!) ",,False,,t5_2qh6o,False,,,True,t3_1jwy13,http://www.reddit.com/r/Pets/comments/1jwy13/update_i_asked_rpets_for_advice_concerning_my_23/,
1375379709.0,94,self.Pets,1jiayt,"Pomeranian wanders off, used Craig's List to get him found in 10 minutes",106,12,14,http://www.reddit.com/r/Pets/comments/1jiayt/pomeranian_wanders_off_used_craigs_list_to_get/,"So I work nights (or did at the time) and my Odie-esque Pom went on walkabout.  He just wandered out at 7 am because our back gate was left open by landscapers.  

At 10, I realize he hasn't barked to come in, like always.  

Discovered his absence, and went ballistic.  I am not a dog person (former letter carrier with two rather bad encounters with dogs), but this one was rescued, and rather charming in his own less than intelligent manner.  

So, I drive the surrounding area calling him, cursing and grumbling.

Then it hits me.....Craig's List! Post about him, especially that he is epileptic and in need of medicine. I figure its worth it.

I called my wife and as I do my inbox on my comp chimes three times.  

It's been 10 minutes and 2 people tell me to read the post 2 above mine.  The third is the author of the post, saying call me, I have a tired, dirty, non smart puffball.

Had him back 30 minutes from noticing him gone.

I can't say enough how wonderful that person who found him was, and how awesome using such a locally based web site can be.
**TL;DR  Craig's List is awesome for finding lost pets quickly IMHO**",,False,,t5_2qh6o,False,,,True,t3_1jiayt,http://www.reddit.com/r/Pets/comments/1jiayt/pomeranian_wanders_off_used_craigs_list_to_get/,
1353947391.0,90,self.Pets,13tg5c,So my cat decided to eat some raw pizza dough,112,22,16,http://www.reddit.com/r/Pets/comments/13tg5c/so_my_cat_decided_to_eat_some_raw_pizza_dough/,"Two nights ago my fiancée and I decided to make some pizza for dinner. We made the dough, wrapped it lightly in saran wrap on the counter, and went out to the store to get some ingredients while letting the dough rise. This isn't uncommon, we've done it many times and the cat has no interest in the dough. We come back about 45 minutes later, and the dough is missing. Confused, we start looking aroung. After some searching, we find that he's carried the whole ball of dough half-way up the stairs to the landing where he decided to have a snack. Quite am impressive feat I must say. We couldn't help but laugh at it.

It was pretty funny, he acted totally normal until he saw that we found the dough, then he immediately ran away to hide. We locked him in the bedroom for a few minutes as punishment, but I think the real punishment was a big ball of yeasty goodness now going to town in his stomach. 

Long story short, he was a very gassy kitty for the rest of the evening, and not enjoying it at all. I've never seen a cat burping before, it was hilarious. I think he learned his lesson, and so have we. Don't assume it's something the cat doesn't want to eat.


Before anyone goes an jumps on my back about this, yes I called the vet after he ate it to make sure that he would be ok. The vet said give him lots of water, and watch him to make sure he doesn't get the runs, or get super lethargic.  ",,False,,t5_2qh6o,False,,,True,t3_13tg5c,http://www.reddit.com/r/Pets/comments/13tg5c/so_my_cat_decided_to_eat_some_raw_pizza_dough/,
1341771928.0,89,imgur.com,w89t1,Progress of my homemade lizard enclosure.,108,19,22,http://www.reddit.com/r/Pets/comments/w89t1/progress_of_my_homemade_lizard_enclosure/,,,False,,t5_2qh6o,False,,,False,t3_w89t1,http://imgur.com/a/TURK7,
1332625658.0,92,i.imgur.com,rbvrt,Mito chilling with me on the couch.,98,6,5,http://www.reddit.com/r/Pets/comments/rbvrt/mito_chilling_with_me_on_the_couch/,,,False,,t5_2qh6o,False,,,False,t3_rbvrt,http://i.imgur.com/lRkEZ.jpg,
1329104216.0,92,imgur.com,pmycp,Any love for my 7 year old cat Peter?,128,36,15,http://www.reddit.com/r/Pets/comments/pmycp/any_love_for_my_7_year_old_cat_peter/,,,False,,t5_2qh6o,False,,,False,t3_pmycp,http://imgur.com/P5UgE,
1323723402.0,93,i.imgur.com,na20f,so i walk into my sisters bedroom to find her bearded dragon doing this.,109,16,10,http://www.reddit.com/r/Pets/comments/na20f/so_i_walk_into_my_sisters_bedroom_to_find_her/,,,False,,t5_2qh6o,False,,,False,t3_na20f,http://i.imgur.com/JAqGj.png,
1320695484.0,91,imgur.com,m3una,The beauty of fall in the midwest,96,5,16,http://www.reddit.com/r/Pets/comments/m3una/the_beauty_of_fall_in_the_midwest/,,,False,,t5_2qh6o,False,,,False,t3_m3una,http://imgur.com/a/ttUIm,
1316872361.0,93,imgur.com,kq0su,It's my dog Yadkin's 1 year gotcha day! He says hello.,110,17,13,http://www.reddit.com/r/Pets/comments/kq0su/its_my_dog_yadkins_1_year_gotcha_day_he_says_hello/,,,False,,t5_2qh6o,False,,,False,t3_kq0su,http://imgur.com/Jirbo,
