created_utc,score,domain,id,title,ups,downs,num_comments,permalink,selftext,link_flair_text,over_18,thumbnail,subreddit_id,edited,link_flair_css_class,author_flair_css_class,is_self,name,url,distinguished
1319040155.0,1058,imgur.com,lhlfe,"Keller's too old (18) to go for a long walk, but we hate leaving her at home. Here's my husband's solution. ",1244,186,90,http://www.reddit.com/r/Pets/comments/lhlfe/kellers_too_old_18_to_go_for_a_long_walk_but_we/,,,False,,t5_2qh6o,False,,,False,t3_lhlfe,http://imgur.com/TLagD,
1329667122.0,602,self.Pets,pwhyn,"""Stop listening to stupid people on the internet."" My vet's response to reddit.",731,129,226,http://www.reddit.com/r/Pets/comments/pwhyn/stop_listening_to_stupid_people_on_the_internet/,"Not long ago I posted a picture titled, “Why I don’t buy doggie treats.”  It was a picture of an 88¢ package of hot dogs.  Most of the responses I got were terrible. Two redditors told me “I hope you die.”

Really?  For giving my dogs the occasional piece of hot dog as a treat?  I wonder what you would think of me when I let my children eat a Hershey kiss.

Most of the comments went way overboard.  Most of the comments were downright misleading and uninformed. (“You are killing your dogs”) How do I know this?  Because I consulted my vet after I read the posts. The over-blown responses sounded more like PETA that reddit. My vet rolled his eyes and told me, “stop listening to stupid people on the internet.” He went on to explain that a steady and exclusive diet of fatty, salty processed foods can cause serious health problems, but treats are virtually insignificant. “Just like humans.” He said.

So I did a bit of research and found that the probability of a large dog getting pancreatitis from eating two grape-size pieces of hot dog every day for 5 years straight is less than 2% higher than a dog that eats specially formulated dog foods and nothing else.  By comparison, a child that eats two Hershey kisses a day for 20 years has less than a 2% greater chance of contracting diabetes than if he ate nothing but healthy foods exclusively for 20 years.

The fact is, most dogs, especially large dogs can easily and safely digest these kinds of treats.  Dogs have been human companions for at least 10,000 years, but food made specifically for dogs has only been around for a bit over 100 years. Even then, dog nutrition has only been studied and applied to dog food for about 50 years.  What did people feed dogs for the first 9900 years?  Scraps, fat, lard, stale bread, spoiled milk and rotten eggs, an overwhelmingly fatty diet.

Being a dog owner means giving your dog a good life.  A good life means being flexible and reasonable, and not dictatorial or overly restrictive.  When my 10 year old drops a chicken nugget, I’m not going to rush off to have my dog’s stomach pumped. In fact, I’m not going to worry about it at all.  But I guarantee I won’t tell reddit about it – too many knee-jerk reactions by uninformed people.
",,False,,t5_2qh6o,False,,,True,t3_pwhyn,http://www.reddit.com/r/Pets/comments/pwhyn/stop_listening_to_stupid_people_on_the_internet/,
1359921754.0,558,self.Pets,17tlmt,I am shocked... and disgusted.. by what I'm seeing.,663,105,139,http://www.reddit.com/r/Pets/comments/17tlmt/i_am_shocked_and_disgusted_by_what_im_seeing/,"I just found this subreddit after seeing a related post in /r/veterinary. So I came over, lurked for a bit to see what is going on, and I'm shocked by what I'm seeing. People are coming here asking for help for medical issues with their pets, and every unqualified yokel is just posting whatever snake oil solution they heard about from their neighbor.

In one post, a person made a suggestion to the OP that could have been FATAL to their cat. A reply to another post essentially informed the OP their animal was going to die when all it needed was a bath and a round of antibiotics.

I have worked in an emergency animal hospital for 3 years (not quite new to it, not quite an old hand) as a veterinary technician. I am going back and forth between cringing and facepalming as I read these posts, and I feel like I need to express a few pieces of knowledge.

1.) If an animal's nose is dry, the only thing it indicates is that it's been a while since they licked their nose. It has ~nothing~ to do with their physical well-being.

2.) DO NOT give your animal aspirin, acetaminophen, or ibuprofen without a specific dosage provided by a vet. Dogs and cats are unable to metabolize it out of their body as quickly and efficiently as we can, and it can build up quickly and cause toxic reactions... liver failure, kidney failure, bleeding ulcers, neurotoxicity... etc., etc.

3.) DO NOT induce vomiting at home with hydrogen peroxide or salt without having previously been given a dose by a vet. Hydrogen peroxide can lead to gastroenteritis because it irritates the lining of the stomach and intestines as it goes through. Giving salt can cause sodium toxicity and lead to kidney failure and heart problems.

4.) There are no respiratory illnesses that can be passed to or from cats and dogs to humans. If you had the flu last week and now your cat is sneezing, IT IS NOT the same thing and you DID NOT give it to them. ...But there are plenty of things that can be passed, especially parasites. If your animal is diagnosed with worms, fleas, or ringworm, use good hygiene to protect yourself. Do not directly handle feces or urine at any time, and if you are exposed... wash your hands before you do anything else.

5.) If your dog is eating the cat food, expect diarrhea, but it will be fine. If your cat eats the dog food, expect constipation. If your cat eats ONLY dog food, expect to find him at the vet with blindness or heart problems due to taurine deficiency.

6.) If your animal eats any of the following, it is an ~emergency~ and you need to consult a vet or be seen by one ~immediately~... not tomorrow morning: garlic, onions, sugar-free gum or any product with xylitol, grapes, raisins, chocolate, coffee/espresso/cappucino beans/grounds. The list goes on, but those are the major ones we frequently see.

7.) Marijuana is toxic to dogs and cats!! Do not be afraid to tell your vet that your animal may have ingested it... they will not report you to the police. We just need to know what your pet ingested so we can treat it correctly. Marijuana toxicity has a very specific set of symptoms and we likely already know, upon seeing your animal, that that is the problem. But we need you to confirm it! Set aside your paranoia!

8.) A seizure lasting longer than 5 minutes needs to be seen by a vet immediately, even if there is a history of seizures and you are used to it. Prolonged seizures can cause a spike in body temperature... we had one in our clinic last week whose temp was 107.7. After we stopped the seizure with meds, it slipped into a coma and never woke up... because the owners didn't think it was a big deal to seize for an hour straight.

9.) Animals are not little people! It doesn't matter how well they know you, if they are scared, cornered, or hurt, they will lash out to protect themselves. 

10.) Going back to things we feed our animals, feeding high-fat items... like meat trimmings, pizza rolls, cake (yes, seen it)... to cats and dogs has a chance of causing a wonderful condition called pancreatitis... days of hospitalization with IV fluids and meds. If you want to give your animals a treat, try green beans... they love them and it's good for them.

11.) If your animal has been vomiting for more than 24 hours, SEE A VET. Dehydration can happen quickly and lead to a number of secondary issues! We ~regularly~ see patients who have been vomiting for 1-2 weeks and the owners didn't think it was a big enough deal to be seen... and then are shocked when we present them with a $1000 treatment estimate to correct all the problems associated with it.

I'll edit if I think of anything else, but for now, PLEASE, think before you give things to your animal or follow the advice of unqualified people.

EDIT: To be clear with everyone, I am not going to respond to individual requests for medical advice. This post is about not trusting internet advice, and I'd like to point out that despite what I say, you have no proof that I am a Vet Tech.

If you have questions concerning medical situations or nutrition, please consult your vet. If you have questions concerning whether something, or a particular amount of something, is toxic, consult your vet or the APSCA Poison Control center.",,False,,t5_2qh6o,1360003987.0,,,True,t3_17tlmt,http://www.reddit.com/r/Pets/comments/17tlmt/i_am_shocked_and_disgusted_by_what_im_seeing/,
1310556616.0,491,i.imgur.com,iocmn,My best friend of 21 years.,548,57,73,http://www.reddit.com/r/Pets/comments/iocmn/my_best_friend_of_21_years/,,,False,,t5_2qh6o,False,,,False,t3_iocmn,http://i.imgur.com/B3Chq.jpg,
1307638970.0,470,imgur.com,hvn9m,Best year ever.,519,49,65,http://www.reddit.com/r/Pets/comments/hvn9m/best_year_ever/,,,False,,t5_2qh6o,False,,,False,t3_hvn9m,http://imgur.com/4pP7Z,
1319640512.0,457,imgur.com,lpqc2,Leia is sho shad :c,552,95,25,http://www.reddit.com/r/Pets/comments/lpqc2/leia_is_sho_shad_c/,,,False,,t5_2qh6o,False,,,False,t3_lpqc2,http://imgur.com/NAvZT,
1323094449.0,399,i.imgur.com,n13pu,occupy cats water,444,45,11,http://www.reddit.com/r/Pets/comments/n13pu/occupy_cats_water/,,,False,,t5_2qh6o,False,,,False,t3_n13pu,http://i.imgur.com/mkWUp,
1345647161.0,401,imgur.com,yn1dx,My mom just got home from surgery. Charlie hasn't left her side since - Imgur,484,83,27,http://www.reddit.com/r/Pets/comments/yn1dx/my_mom_just_got_home_from_surgery_charlie_hasnt/,,,False,,t5_2qh6o,False,,,False,t3_yn1dx,http://imgur.com/KvVY5,
1374844150.0,383,seattle.craigslist.org,1j3evq,Man's dog sold while he was Deployed. He put up an ad on craigslist trying to get him back.,469,86,27,http://www.reddit.com/r/Pets/comments/1j3evq/mans_dog_sold_while_he_was_deployed_he_put_up_an/,,,False,,t5_2qh6o,False,,,False,t3_1j3evq,http://seattle.craigslist.org/sno/pet/3956713351.html,
1344445229.0,373,i.imgur.com,xw0jg,The awkward moment when your cat brings back someones pet rabbit,450,77,87,http://www.reddit.com/r/Pets/comments/xw0jg/the_awkward_moment_when_your_cat_brings_back/,,,False,,t5_2qh6o,False,,,False,t3_xw0jg,http://i.imgur.com/G0I1c.jpg,
1344605505.0,372,imgur.com,xzu7q,The place where my two dogs were boarded for the weekend has a facebook page and posts pictures. They appear never to have left each others' sides.,436,64,38,http://www.reddit.com/r/Pets/comments/xzu7q/the_place_where_my_two_dogs_were_boarded_for_the/,,,False,,t5_2qh6o,False,,,False,t3_xzu7q,http://imgur.com/a/w9WGB#0,
1321551615.0,367,i.imgur.com,mfvbn,Our poor dog,413,46,5,http://www.reddit.com/r/Pets/comments/mfvbn/our_poor_dog/,,,False,,t5_2qh6o,False,,,False,t3_mfvbn,http://i.imgur.com/pV2As.jpg,
1340827869.0,366,i.imgur.com,vpawa,Look at this crazy bird that wants to come hang out with me at work. My work isn't even fun.,451,85,26,http://www.reddit.com/r/Pets/comments/vpawa/look_at_this_crazy_bird_that_wants_to_come_hang/,,,False,,t5_2qh6o,False,,,False,t3_vpawa,http://i.imgur.com/eHSUp.jpg,
1339074691.0,363,i.imgur.com,uppiy,My beagle puppy,411,48,7,http://www.reddit.com/r/Pets/comments/uppiy/my_beagle_puppy/,,,False,,t5_2qh6o,False,,,False,t3_uppiy,http://i.imgur.com/IfNxj.jpg,
1317981097.0,353,i.imgur.com,l3zmr,The Army is letting us take our COS dogs home.,386,33,36,http://www.reddit.com/r/Pets/comments/l3zmr/the_army_is_letting_us_take_our_cos_dogs_home/,,,False,,t5_2qh6o,False,,,False,t3_l3zmr,http://i.imgur.com/iT2Um.jpg,
1366662133.0,348,lifewithdogs.tv,1cvwdj,Reddit this needs more attention. A proposed law will create an animal abuser registry.,435,87,10,http://www.reddit.com/r/Pets/comments/1cvwdj/reddit_this_needs_more_attention_a_proposed_law/,,,False,,t5_2qh6o,False,,,False,t3_1cvwdj,http://www.lifewithdogs.tv/2013/04/proposed-logans-law-would-create-animal-abuser-registry/,
1328455947.0,337,i.imgur.com,pbvp4,This is my puppy Lennon,433,96,27,http://www.reddit.com/r/Pets/comments/pbvp4/this_is_my_puppy_lennon/,,,False,,t5_2qh6o,False,,,False,t3_pbvp4,http://i.imgur.com/GuE2L.jpg,
1343798670.0,338,i.imgur.com,xhq1n,My cat Marty caught a poor helpless birdy,418,80,9,http://www.reddit.com/r/Pets/comments/xhq1n/my_cat_marty_caught_a_poor_helpless_birdy/,,,False,,t5_2qh6o,False,,,False,t3_xhq1n,http://i.imgur.com/T5FWf.jpg,
1347202357.0,332,youtube.com,zlpzm,Petco in my area found throwing away iguanas.,389,57,75,http://www.reddit.com/r/Pets/comments/zlpzm/petco_in_my_area_found_throwing_away_iguanas/,,,False,,t5_2qh6o,False,,,False,t3_zlpzm,http://www.youtube.com/watch?v=q_p969U0eSA,
1327068533.0,331,i.imgur.com,ootze,"Seeing as it was my cakeday on the 18th, here's a picture of my wolfhounds. Enjoy.",415,84,68,http://www.reddit.com/r/Pets/comments/ootze/seeing_as_it_was_my_cakeday_on_the_18th_heres_a/,,,False,,t5_2qh6o,False,,,False,t3_ootze,http://i.imgur.com/kH8Ag.jpg,
1354901673.0,329,quickmeme.com,14gb6o,"/r/pets, I'm only going to say this ONE MORE TIME",440,111,97,http://www.reddit.com/r/Pets/comments/14gb6o/rpets_im_only_going_to_say_this_one_more_time/,,,False,,t5_2qh6o,False,,,False,t3_14gb6o,http://www.quickmeme.com/meme/3s368d/,
1368906746.0,309,self.Pets,1elbpn,Harts Products Kill. Upvote for visibility please. SAVE YOUR PETS,388,79,56,http://www.reddit.com/r/Pets/comments/1elbpn/harts_products_kill_upvote_for_visibility_please/,"My friend gave her kitten Hartz kitten flea medicine and the kitten started coughing up blood everywhere. If you are an avid Hartz user, or do not believe me, go to this site. Please Please PLEASE do not use Hartz products on your pets, they could be severely harmed. 
http://www.hartzvictims.org/",,False,,t5_2qh6o,False,,,True,t3_1elbpn,http://www.reddit.com/r/Pets/comments/1elbpn/harts_products_kill_upvote_for_visibility_please/,
1334844031.0,310,mypetforumonline.com,sht04,Pet Stores In LA May Be Required To Sell Only Animals From Shelters Or Rescues,336,26,28,http://www.reddit.com/r/Pets/comments/sht04/pet_stores_in_la_may_be_required_to_sell_only/,,,False,,t5_2qh6o,False,,,False,t3_sht04,http://mypetforumonline.com/2012/04/19/pet-stores-in-la-may-be-required-to-sell-only-rescues/,
1320125612.0,310,i.imgur.com,lw540,My cockatiel likes to warm himself with my laptop's fan. It makes him fluffy.,334,24,11,http://www.reddit.com/r/Pets/comments/lw540/my_cockatiel_likes_to_warm_himself_with_my/,,,False,,t5_2qh6o,False,,,False,t3_lw540,http://i.imgur.com/aSCzy.jpg,
1338637186.0,307,imgur.com,uh2fc,Happy 32nd birthday old man!,373,66,11,http://www.reddit.com/r/Pets/comments/uh2fc/happy_32nd_birthday_old_man/,,,False,,t5_2qh6o,False,,,False,t3_uh2fc,http://imgur.com/dBCSf,
1331302591.0,300,i.imgur.com,qovwa,"My dog, happy as shit.",382,82,19,http://www.reddit.com/r/Pets/comments/qovwa/my_dog_happy_as_shit/,,,False,,t5_2qh6o,False,,,False,t3_qovwa,http://i.imgur.com/1F4Uz.jpg,
1343336445.0,302,imgur.com,x7l9u,My vain hamster didn't get much love in /r/aww,411,109,12,http://www.reddit.com/r/Pets/comments/x7l9u/my_vain_hamster_didnt_get_much_love_in_raww/,,,False,,t5_2qh6o,False,,,False,t3_x7l9u,http://imgur.com/5WLwX,
1333449447.0,299,i.imgur.com,rr00h,"So I'm staying at my parents' house for a few months. This gal came to greet me, haven't seen her in ages! ",327,28,13,http://www.reddit.com/r/Pets/comments/rr00h/so_im_staying_at_my_parents_house_for_a_few/,,,False,,t5_2qh6o,False,,,False,t3_rr00h,http://i.imgur.com/NVk3H.jpg,
1322673831.0,297,i.imgur.com,muwyj,This little lady lived under my porch for a month before she let me pet her.  Now she is happy and healthy living inside with all of us :),330,33,12,http://www.reddit.com/r/Pets/comments/muwyj/this_little_lady_lived_under_my_porch_for_a_month/,,,False,,t5_2qh6o,False,,,False,t3_muwyj,http://i.imgur.com/Uq7Tr.jpg,
1352044979.0,300,imgur.com,12m5qx,It was his first day at the Humane Society and he tried to run away. I grabbed him and took him home with me. Meet Trip.,352,52,17,http://www.reddit.com/r/Pets/comments/12m5qx/it_was_his_first_day_at_the_humane_society_and_he/,,,False,,t5_2qh6o,False,,,False,t3_12m5qx,http://imgur.com/RLRsR,
1315057493.0,298,i.imgur.com,k3i1x,"What about me, am I still important?!!",321,23,6,http://www.reddit.com/r/Pets/comments/k3i1x/what_about_me_am_i_still_important/,,,False,,t5_2qh6o,False,,,False,t3_k3i1x,http://i.imgur.com/XabEP.jpg,
1346383229.0,296,i.imgur.com,z47d5,My best friend of 21 years.,366,70,16,http://www.reddit.com/r/Pets/comments/z47d5/my_best_friend_of_21_years/,,,False,,t5_2qh6o,False,,,False,t3_z47d5,http://i.imgur.com/O6rlt.jpg,
1328297371.0,296,i.imgur.com,p9mpy,This is Buddy. Any reddit love for a pretty horse?,394,98,35,http://www.reddit.com/r/Pets/comments/p9mpy/this_is_buddy_any_reddit_love_for_a_pretty_horse/,,,False,,t5_2qh6o,False,,,False,t3_p9mpy,http://i.imgur.com/LKiv2.jpg,
1341178944.0,292,i.imgur.com,vw7lx,Why I love my vet,333,41,27,http://www.reddit.com/r/Pets/comments/vw7lx/why_i_love_my_vet/,,,False,,t5_2qh6o,False,,,False,t3_vw7lx,http://i.imgur.com/Pa9rh.jpg,
1346965592.0,287,imgur.com,zgwj9,Annoyance and tolerance: taken to a new level.,346,59,8,http://www.reddit.com/r/Pets/comments/zgwj9/annoyance_and_tolerance_taken_to_a_new_level/,,,False,,t5_2qh6o,False,,,False,t3_zgwj9,http://imgur.com/QsN4a,
1360285363.0,286,dogheirs.com,183ntw,Disabled veteran asks for public support; service dog faces euthanasia for biting woman who beat him with metal pole,326,40,37,http://www.reddit.com/r/Pets/comments/183ntw/disabled_veteran_asks_for_public_support_service/,,,False,,t5_2qh6o,False,,,False,t3_183ntw,http://www.dogheirs.com/dogheirs/posts/2744-disabled-veteran-asks-for-public-support-service-dog-faces-euthanasia-for-biting-woman-who-beat-him-with-metal-poles,
1331228543.0,282,farm8.staticflickr.com,qnk70,got no love from r/aww. This is Rorschach- one of the three puppies that we're currently fostering.,392,110,17,http://www.reddit.com/r/Pets/comments/qnk70/got_no_love_from_raww_this_is_rorschach_one_of/,,,False,,t5_2qh6o,False,,,False,t3_qnk70,http://farm8.staticflickr.com/7067/6816521584_83ee74369d_b.jpg,
1344019188.0,288,i.imgur.com,xms2m,"Ben and Phoebe, German Shepherd pups! ",341,53,11,http://www.reddit.com/r/Pets/comments/xms2m/ben_and_phoebe_german_shepherd_pups/,,,False,,t5_2qh6o,False,,,False,t3_xms2m,http://i.imgur.com/IIrPB.jpg,
1308108812.0,285,imgur.com,i001d,Why I get up early on my day off to volunteer at my local shelter. ,299,14,33,http://www.reddit.com/r/Pets/comments/i001d/why_i_get_up_early_on_my_day_off_to_volunteer_at/,,,False,,t5_2qh6o,False,,,False,t3_i001d,http://imgur.com/xgsiw,
1334938903.0,285,i.imgur.com,sjv1b,"She is new; I don't know her name yet , but she has already stolen my heart",337,52,15,http://www.reddit.com/r/Pets/comments/sjv1b/she_is_new_i_dont_know_her_name_yet_but_she_has/,,,False,,t5_2qh6o,False,,,False,t3_sjv1b,http://i.imgur.com/gZz9t.jpg,
1320932390.0,284,i.imgur.com,m7duw,This is how I know the mail carrier came by...,299,15,7,http://www.reddit.com/r/Pets/comments/m7duw/this_is_how_i_know_the_mail_carrier_came_by/,,,False,,t5_2qh6o,False,,,False,t3_m7duw,http://i.imgur.com/QBbNZ.jpg,
1340590864.0,282,i.imgur.com,vjv7n,We aren't cats but if we fits we also sits. ,320,38,10,http://www.reddit.com/r/Pets/comments/vjv7n/we_arent_cats_but_if_we_fits_we_also_sits/,,,False,,t5_2qh6o,False,,,False,t3_vjv7n,http://i.imgur.com/jKeHv.jpg,
1328537866.0,276,imgur.com,pd652,He thinks he's people.,343,67,5,http://www.reddit.com/r/Pets/comments/pd652/he_thinks_hes_people/,,,False,,t5_2qh6o,False,,,False,t3_pd652,http://imgur.com/MDxqX,
1347303199.0,274,i.imgur.com,znz13,Friend's Dog Lost Near Lake Tahoe. Figured any exposure helps.,340,66,28,http://www.reddit.com/r/Pets/comments/znz13/friends_dog_lost_near_lake_tahoe_figured_any/,,,False,,t5_2qh6o,False,,,False,t3_znz13,http://i.imgur.com/6YNPE.jpg,
1341235372.0,280,imgur.com,vx83s,She lost her best friend to cancer last week.,322,42,11,http://www.reddit.com/r/Pets/comments/vx83s/she_lost_her_best_friend_to_cancer_last_week/,,,False,,t5_2qh6o,False,,,False,t3_vx83s,http://imgur.com/oXEOX,
1345839877.0,276,i.imgur.com,yrtcm,I give you my vicious Husky Shepard mix and her favorite prey.,311,35,24,http://www.reddit.com/r/Pets/comments/yrtcm/i_give_you_my_vicious_husky_shepard_mix_and_her/,,,False,,t5_2qh6o,False,,,False,t3_yrtcm,http://i.imgur.com/ytd3Ph.jpg?1,
1319161758.0,271,i.imgur.com,ljf9h,My GF and her dog Jazzy on their last night together. Some things never change. ,296,25,47,http://www.reddit.com/r/Pets/comments/ljf9h/my_gf_and_her_dog_jazzy_on_their_last_night/,,,False,,t5_2qh6o,False,,,False,t3_ljf9h,http://i.imgur.com/WASCp.jpg,
1319999103.0,271,i.imgur.com,lu9ga,My friend for 13 years.  Last night he crawled under the bushes in the backyard and died.,302,31,39,http://www.reddit.com/r/Pets/comments/lu9ga/my_friend_for_13_years_last_night_he_crawled/,,,False,,t5_2qh6o,False,,,False,t3_lu9ga,http://i.imgur.com/CmpdP.jpg,
1332477753.0,268,imgur.com,r9jvt,Saw this little guy fast asleep at the pet store today.,340,72,13,http://www.reddit.com/r/Pets/comments/r9jvt/saw_this_little_guy_fast_asleep_at_the_pet_store/,,,False,,t5_2qh6o,False,,,False,t3_r9jvt,http://imgur.com/0zzRJ,
1325783082.0,271,imgur.com,o44ru,Got laid off this morning. She knows its gonna be ok. ,344,73,22,http://www.reddit.com/r/Pets/comments/o44ru/got_laid_off_this_morning_she_knows_its_gonna_be/,,,False,,t5_2qh6o,False,,,False,t3_o44ru,http://imgur.com/BhtbZ,
1335540212.0,269,imgur.com,svdsi,Why I'm late to work,300,31,8,http://www.reddit.com/r/Pets/comments/svdsi/why_im_late_to_work/,,,False,,t5_2qh6o,False,,,False,t3_svdsi,http://imgur.com/lYpHp,
1318651291.0,272,i.imgur.com,lcudz,Caught it! ... Now what?,295,23,5,http://www.reddit.com/r/Pets/comments/lcudz/caught_it_now_what/,,,False,,t5_2qh6o,False,,,False,t3_lcudz,http://i.imgur.com/C0m9l.jpg,
1338826089.0,268,i.imgur.com,ukd0t,Old girl still loves the sun,314,46,9,http://www.reddit.com/r/Pets/comments/ukd0t/old_girl_still_loves_the_sun/,,,False,,t5_2qh6o,False,,,False,t3_ukd0t,http://i.imgur.com/xBfl7.jpg,
1338516229.0,264,imgur.com,uexe6,"9 months ago, no one thought she'd survive.  Happy first birthday to my sweet pup.",295,31,13,http://www.reddit.com/r/Pets/comments/uexe6/9_months_ago_no_one_thought_shed_survive_happy/,,,False,,t5_2qh6o,False,,,False,t3_uexe6,http://imgur.com/b6XdA,
1319723785.0,265,i.imgur.com,lqy2z,My old lady in her sweater! She's always cold.,304,39,17,http://www.reddit.com/r/Pets/comments/lqy2z/my_old_lady_in_her_sweater_shes_always_cold/,,,False,,t5_2qh6o,False,,,False,t3_lqy2z,http://i.imgur.com/73td1.jpg,
