created_utc,score,domain,id,title,ups,downs,num_comments,permalink,selftext,link_flair_text,over_18,thumbnail,subreddit_id,edited,link_flair_css_class,author_flair_css_class,is_self,name,url,distinguished
1363314057.0,114,self.Pets,1abr7y,The Internet Saved My Dog,137,23,17,http://www.reddit.com/r/Pets/comments/1abr7y/the_internet_saved_my_dog/,"My dog Oliver got loose about a week ago while I was away from my house when my roommates left the door open. They chased him down the street, lost him, and then caught a glimpse of him just as he got hit by a car going about 30mph. They ran over to him, and he proceeded to get really freaked out and take off into the city (Chattanooga, TN). We searched high and low, in every nook and cranny in about a three mile radius of my house (which is in the middle of downtown Chattanooga), but were unable to find him. The next day I set out to put up flyers, signs, anything I thought that might catch someone's attention and bring him home. Every minute I wasn't in class I spent looking for my pup. Nothing. Nothing... Nothing for over a week. I had put up a post on Facebook that was shared by a decent amount of my friends and their friends as well as an ad on craigslist, but no one had seen him. My dog is epileptic and had been going through a spell of seizures (all you epileptic dog owners know how scary this can be), and he was so disoriented that I knew he wouldn't be able to find his way home. I was devastated. He was my baby. I couldn't help but break down every time I walked up the stairs and didn't hear his paws scrambling and scraping behind me. I wanted to give up.

Last night at about 6 o'clock, I got a call from an unknown number. It was a girl who went to my school (where I had put up about 200 flyers with my Oliver's picture and my phone number). She had seen a dog getting picked up at her apartment complex, some 6 miles from my house, and was pretty sure it was him. She found my number on craigslist. Craigslist. I couldn't believe it. So today I called up the animal shelter where she thought he might have been taken. They had him. My baby was coming home. And home he is.

During my search, I felt helpless. I felt like everything I did accomplished nothing towards bringing my Ollie home. But it wasn't hopeless. There are good people out there who worked hard to bring my dog home. Today I came to find out that animal services chased him for three days, starting on Sunday in the middle of the interstate, all the way to the complex where he was eventually picked up. I found out that a stranger would go out of her way to call me and tell me where my dog was. I wouldn't have my best friend back without them. 

Never lose hope. There are always people out there that will go out of their way to help. There are always good forces at work. My dog was saved by good people getting on their computer to do something wonderful for a complete and total stranger. I love my dog. I love the people that found him. I love this world. And I love the internet, for making it all possible.",,False,,t5_2qh6o,False,,,True,t3_1abr7y,http://www.reddit.com/r/Pets/comments/1abr7y/the_internet_saved_my_dog/,
1358867116.0,121,isfoundation.com,17229k,DIY-Give the gift of warmth to feral cats this winter!,148,27,9,http://www.reddit.com/r/Pets/comments/17229k/diygive_the_gift_of_warmth_to_feral_cats_this/,,,False,,t5_2qh6o,False,,,False,t3_17229k,http://www.isfoundation.com/news/creatures/diy-give-gift-warmth-feral-cats-winter,
1344617716.0,118,i.imgur.com,y05y7,My daughter wanted a puppy for her birthday &amp; I gave her the choice of getting whatever kind she wanted. She chose to save this little girl from the animal shelter. &lt;3,144,26,10,http://www.reddit.com/r/Pets/comments/y05y7/my_daughter_wanted_a_puppy_for_her_birthday_i/,,,False,,t5_2qh6o,False,,,False,t3_y05y7,http://i.imgur.com/f6ouD.jpg,
1344519842.0,119,imgur.com,xxsgu,Restless Diesel is ready for the weekend! ,148,29,2,http://www.reddit.com/r/Pets/comments/xxsgu/restless_diesel_is_ready_for_the_weekend/,,,False,,t5_2qh6o,False,,,False,t3_xxsgu,http://imgur.com/DCWhf,
1333720051.0,119,imgur.com,rw8tn,My beautiful boy. Kelpie + Blue Heeler.,154,35,3,http://www.reddit.com/r/Pets/comments/rw8tn/my_beautiful_boy_kelpie_blue_heeler/,,,False,,t5_2qh6o,False,,,False,t3_rw8tn,http://imgur.com/pbQyq,
1332764722.0,117,imgur.com,re3m1,"These are my axolotls.  As a species, axolotls are as close to extinction in the wild as giant pandas, but luckily they thrive in captivity. I hope you enjoy my strange little (and by little, I mean fat fatties) babies!",134,17,43,http://www.reddit.com/r/Pets/comments/re3m1/these_are_my_axolotls_as_a_species_axolotls_are/,,,False,,t5_2qh6o,False,,,False,t3_re3m1,http://imgur.com/a/MnZxN#0,
1332561703.0,120,imgur.com,rb0ht,My indoor cat got outside today. ,150,30,16,http://www.reddit.com/r/Pets/comments/rb0ht/my_indoor_cat_got_outside_today/,,,False,,t5_2qh6o,False,,,False,t3_rb0ht,http://imgur.com/JPL8P,
1330711255.0,118,i.imgur.com,qeq4w,"New dog at daycare, Mika, we all love her to colloquial death",127,9,3,http://www.reddit.com/r/Pets/comments/qeq4w/new_dog_at_daycare_mika_we_all_love_her_to/,,,False,,t5_2qh6o,False,,,False,t3_qeq4w,http://i.imgur.com/VNGNU.jpg,
1322031273.0,122,i.imgur.com,mmham,Just my Degus snuggling. ,136,14,17,http://www.reddit.com/r/Pets/comments/mmham/just_my_degus_snuggling/,,,False,,t5_2qh6o,False,,,False,t3_mmham,http://i.imgur.com/AeqGW.jpg,
1321057135.0,120,imgur.com,m9api,"I miss my dog, but he looks pretty comfortable at the grandparents'",124,4,4,http://www.reddit.com/r/Pets/comments/m9api/i_miss_my_dog_but_he_looks_pretty_comfortable_at/,,,False,,t5_2qh6o,False,,,False,t3_m9api,http://imgur.com/SH7OX,
1300379887.0,115,i.imgur.com,g5x4f,"My friends Boxer, apparently she has been sitting like this for over 20 minutes.",123,8,18,http://www.reddit.com/r/Pets/comments/g5x4f/my_friends_boxer_apparently_she_has_been_sitting/,,,False,,t5_2qh6o,False,,,False,t3_g5x4f,http://i.imgur.com/yoMhG.jpg,
1361693188.0,119,humanesociety.org,194iog,An Open Letter to Anyone Who's Ever Thought About Getting a Parrot,136,17,19,http://www.reddit.com/r/Pets/comments/194iog/an_open_letter_to_anyone_whos_ever_thought_about/,,,False,,t5_2qh6o,False,,,False,t3_194iog,http://www.humanesociety.org/animals/pet_birds/tips/open_letter_to_bird_owner.html,
1348013035.0,115,imgur.com,103x0p,"A while ago I submitted this picture of my boyfriend's dog Ben, today 2 baseball sized tumors were found in his neck. It is looking like lymphoma, keeping my thoughts positive. He overcame being extremely sick in the shelter, I'm sure he'll overcome this.",140,25,12,http://www.reddit.com/r/Pets/comments/103x0p/a_while_ago_i_submitted_this_picture_of_my/,,,False,,t5_2qh6o,False,,,False,t3_103x0p,http://imgur.com/nP9z7,
1343216259.0,116,i.imgur.com,x4kmd,"Fabricio, my snuffle bug",151,35,10,http://www.reddit.com/r/Pets/comments/x4kmd/fabricio_my_snuffle_bug/,,,False,,t5_2qh6o,False,,,False,t3_x4kmd,http://i.imgur.com/O76hZ.png,
1329936246.0,120,i.imgur.com,q18o1,Ginger and Enzo love going on road trips! ,135,15,7,http://www.reddit.com/r/Pets/comments/q18o1/ginger_and_enzo_love_going_on_road_trips/,,,False,,t5_2qh6o,False,,,False,t3_q18o1,http://i.imgur.com/29eOt.jpg,
1328135805.0,113,i.imgur.com,p6s2r,"Those eyes... (Mety, future guide dog hopefully)",154,41,16,http://www.reddit.com/r/Pets/comments/p6s2r/those_eyes_mety_future_guide_dog_hopefully/,,,False,,t5_2qh6o,False,,,False,t3_p6s2r,http://i.imgur.com/twdhW.jpg,
1327335144.0,120,i.imgur.com,oszit,We're officially a pet therapy team!,165,45,30,http://www.reddit.com/r/Pets/comments/oszit/were_officially_a_pet_therapy_team/,,,False,,t5_2qh6o,False,,,False,t3_oszit,http://i.imgur.com/8y5sR.jpg,
1325030346.0,120,i.imgur.com,nsw8k,"Brought my mastiff to the vet for hip problems, found out he has heartworms :( Just need to vent",135,15,100,http://www.reddit.com/r/Pets/comments/nsw8k/brought_my_mastiff_to_the_vet_for_hip_problems/,,,False,,t5_2qh6o,False,,,False,t3_nsw8k,http://i.imgur.com/ml8N3.jpg,
1323041934.0,117,our-compass.org,n0avk,"Cumberland County North Carolina to pass breed ban requiring all Dobermans, Rottweilers, Chow Chows, German Shepherds, Great Danes, Pitbulls, Mastiffs, Akitas and Huskies be killed after 72 hours without the option to be adopted. ",131,14,44,http://www.reddit.com/r/Pets/comments/n0avk/cumberland_county_north_carolina_to_pass_breed/,,,False,,t5_2qh6o,False,,,False,t3_n0avk,http://our-compass.org/2011/12/01/new-policy-requires-all-chows-danes-dobermans-mastiffs-rotties-shepherds-all-bully-breeds-to-be-killed-nc-shelter/,
1306982388.0,121,i.imgur.com,hplfc,TIL that Bear is a river dog.,131,10,13,http://www.reddit.com/r/Pets/comments/hplfc/til_that_bear_is_a_river_dog/,,,False,,t5_2qh6o,False,,,False,t3_hplfc,http://i.imgur.com/KuaAS.jpg,
1305554775.0,120,i.imgur.com,hcjdx,"Hello Reddit, meet my new 2 month old puppy named Sadie.  ",128,8,24,http://www.reddit.com/r/Pets/comments/hcjdx/hello_reddit_meet_my_new_2_month_old_puppy_named/,,,False,,t5_2qh6o,False,,,False,t3_hcjdx,http://i.imgur.com/oLPGH.jpg,
1361420161.0,119,i.imgur.com,18xnfg,She just doesn't care. ,146,27,7,http://www.reddit.com/r/Pets/comments/18xnfg/she_just_doesnt_care/,,,False,,t5_2qh6o,False,,,False,t3_18xnfg,http://i.imgur.com/G5dVyrC.jpg,
1356501640.0,116,self.Pets,15gf7t,"My sister bought me a bearded dragon without first letting me know, I told her after researching it that I wasn't ready for the 10-20 year commitment and she was mad at me, am I being unreasonable?",149,33,48,http://www.reddit.com/r/Pets/comments/15gf7t/my_sister_bought_me_a_bearded_dragon_without/,I mean a pet as a gift isn't a good idea is it?,,False,,t5_2qh6o,False,,,True,t3_15gf7t,http://www.reddit.com/r/Pets/comments/15gf7t/my_sister_bought_me_a_bearded_dragon_without/,
1331825148.0,115,i.imgur.com,qxv8y,her first snow,136,21,2,http://www.reddit.com/r/Pets/comments/qxv8y/her_first_snow/,,,False,,t5_2qh6o,False,,,False,t3_qxv8y,http://i.imgur.com/XTQrV.jpg,
1329428562.0,113,imgur.com,psvxs,Best friends,163,50,4,http://www.reddit.com/r/Pets/comments/psvxs/best_friends/,,,False,,t5_2qh6o,False,,,False,t3_psvxs,http://imgur.com/XUkQp,
1328702876.0,116,change.org,pg5ca,Dog duct taped and left to die in a ditch. Neither of the two men involved will face jail time. Sign this petition,137,21,9,http://www.reddit.com/r/Pets/comments/pg5ca/dog_duct_taped_and_left_to_die_in_a_ditch_neither/,,,False,,t5_2qh6o,False,,,False,t3_pg5ca,http://www.change.org/petitions/washington-county-district-attorney-indict-the-two-men-charged-with-duct-taping-a-dog-with-felony-charges,
1328626850.0,116,i.imgur.com,pepow,She has turned an end table into her own 2 story condo,154,38,5,http://www.reddit.com/r/Pets/comments/pepow/she_has_turned_an_end_table_into_her_own_2_story/,,,False,,t5_2qh6o,False,,,False,t3_pepow,http://i.imgur.com/kq7WV.jpg,
1320385056.0,118,i.imgur.com,lzzis,My wife had her first photography client: our dog,127,9,8,http://www.reddit.com/r/Pets/comments/lzzis/my_wife_had_her_first_photography_client_our_dog/,,,False,,t5_2qh6o,False,,,False,t3_lzzis,http://i.imgur.com/KSTYz.jpg,
1302189980.0,117,i.imgur.com,gksi4,"Rescued this guy a year ago when he had only a few days left to live.  Since then I have never been more at home, no matter where i am.",129,12,18,http://www.reddit.com/r/Pets/comments/gksi4/rescued_this_guy_a_year_ago_when_he_had_only_a/,,,False,,t5_2qh6o,False,,,False,t3_gksi4,http://i.imgur.com/W0irh.jpg,
1300901584.0,116,nj.com,g9ugf,Dog Found In Garbage Bag Is Recovering From Worst Case of Animal Abuse Ever Seen,125,9,43,http://www.reddit.com/r/Pets/comments/g9ugf/dog_found_in_garbage_bag_is_recovering_from_worst/,,,False,,t5_2qh6o,False,,,False,t3_g9ugf,http://www.nj.com/news/index.ssf/2011/03/tinton_falls_animal_hospital_h.html,
1345839182.0,114,imgur.com,yrsn1,this face makes it so hard to go to work,135,21,2,http://www.reddit.com/r/Pets/comments/yrsn1/this_face_makes_it_so_hard_to_go_to_work/,,,False,,t5_2qh6o,False,,,False,t3_yrsn1,http://imgur.com/jMQbs,
1345767601.0,114,imgur.com,yq59r,"Two Years Later - Monkey(Momo), Our Buddy - Our Rescue Dog.",144,30,25,http://www.reddit.com/r/Pets/comments/yq59r/two_years_later_monkeymomo_our_buddy_our_rescue/,,,False,,t5_2qh6o,False,,,False,t3_yq59r,http://imgur.com/a/LA1W4,
1332713677.0,116,i.imgur.com,rd8s7,Here are my sugar glider joeys Luke &amp; Leia 10 days out of pouch.,129,13,8,http://www.reddit.com/r/Pets/comments/rd8s7/here_are_my_sugar_glider_joeys_luke_leia_10_days/,,,False,,t5_2qh6o,False,,,False,t3_rd8s7,http://i.imgur.com/9pAaV.jpg,
1326205530.0,117,imgur.com,oau7v,Cute as a button,138,21,6,http://www.reddit.com/r/Pets/comments/oau7v/cute_as_a_button/,,,False,,t5_2qh6o,False,,,False,t3_oau7v,http://imgur.com/e7mQp,
1317222514.0,113,i.imgur.com,ku51v,He was squirming around for a sweet spot.  I guess he found it.,126,13,9,http://www.reddit.com/r/Pets/comments/ku51v/he_was_squirming_around_for_a_sweet_spot_i_guess/,,,False,,t5_2qh6o,False,,,False,t3_ku51v,http://i.imgur.com/7MHBJ.jpg,
1316008962.0,115,i.imgur.com,kfcz9,"My 9 Year Old Irish Setter ""Lady"".",123,8,11,http://www.reddit.com/r/Pets/comments/kfcz9/my_9_year_old_irish_setter_lady/,,,False,,t5_2qh6o,False,,,False,t3_kfcz9,http://i.imgur.com/Z328Q.jpg,
1309588986.0,115,imgur.com,ieud4,My dog's getting ready for his July 4th attire!,123,8,9,http://www.reddit.com/r/Pets/comments/ieud4/my_dogs_getting_ready_for_his_july_4th_attire/,,,False,,t5_2qh6o,False,,,False,t3_ieud4,http://imgur.com/y6uRw,
1359769744.0,110,blogs.seattletimes.com,17qc2b,Cats outnumber kids by 50% in Seattle households - [X-post from US News],139,29,8,http://www.reddit.com/r/Pets/comments/17qc2b/cats_outnumber_kids_by_50_in_seattle_households/,,,False,,t5_2qh6o,False,,,False,t3_17qc2b,http://blogs.seattletimes.com/fyi-guy/2013/02/01/in-seattle-its-cats-dogs-and-kids-in-that-order/,
1341634238.0,113,imgur.com,w5xui,"My boys, Then to Now",129,16,3,http://www.reddit.com/r/Pets/comments/w5xui/my_boys_then_to_now/,,,False,,t5_2qh6o,False,,,False,t3_w5xui,http://imgur.com/a/Gculs,
1340050429.0,114,imgur.com,v8nhc,What are YOU looking at human?,138,24,4,http://www.reddit.com/r/Pets/comments/v8nhc/what_are_you_looking_at_human/,,,False,,t5_2qh6o,False,,,False,t3_v8nhc,http://imgur.com/Ucs66,
1337613725.0,112,imgur.com,txlhy,That look you give when you're about to pounce on your sleeping roommate.,166,54,0,http://www.reddit.com/r/Pets/comments/txlhy/that_look_you_give_when_youre_about_to_pounce_on/,,,False,,t5_2qh6o,False,,,False,t3_txlhy,http://imgur.com/rmGfQ,
1336257083.0,116,imgur.com,t8x3g,"In a relationship it's important to set aside ""snuggle time"". Too bad this happens every morning. [sfw]",129,13,9,http://www.reddit.com/r/Pets/comments/t8x3g/in_a_relationship_its_important_to_set_aside/,,,False,,t5_2qh6o,False,,,False,t3_t8x3g,http://imgur.com/Hx3NC,
1328189737.0,116,i.imgur.com,p7nig,"Meet Ramsey, my 13 week old Shar Pei.",160,44,22,http://www.reddit.com/r/Pets/comments/p7nig/meet_ramsey_my_13_week_old_shar_pei/,,,False,,t5_2qh6o,False,,,False,t3_p7nig,http://i.imgur.com/frQCN.jpg,
1325535693.0,115,imgur.com,o04rk,My Chocolate Lab couldn't hang for New Years.,123,8,3,http://www.reddit.com/r/Pets/comments/o04rk/my_chocolate_lab_couldnt_hang_for_new_years/,,,False,,t5_2qh6o,False,,,False,t3_o04rk,http://imgur.com/iLNrv,
1309790799.0,115,i.imgur.com,igevy,This is Abbigail she was a stray who wandered into my family's backyard were she was attacked by the dog. We are keeping her.,133,18,16,http://www.reddit.com/r/Pets/comments/igevy/this_is_abbigail_she_was_a_stray_who_wandered/,,,False,,t5_2qh6o,False,,,False,t3_igevy,http://i.imgur.com/JYuyH.jpg,
1296747319.0,116,imgur.com,fejif,"It's shit like this, dog",127,11,11,http://www.reddit.com/r/Pets/comments/fejif/its_shit_like_this_dog/,,,False,,t5_2qh6o,False,,,False,t3_fejif,http://imgur.com/a/2j94H,
1357903217.0,110,nytimes.com,16dht7,"Where cats run free: 72 year old Siglinda Scarpa turned her home into a sanctuary for hundreds of cats, but there's nothing crazy about it",133,23,12,http://www.reddit.com/r/Pets/comments/16dht7/where_cats_run_free_72_year_old_siglinda_scarpa/,,,False,,t5_2qh6o,False,,,False,t3_16dht7,http://www.nytimes.com/2013/01/10/garden/300-cats-and-counting.html?smid=re-share,
1345048725.0,112,i.imgur.com,y9nzo,My dog smoochy thinks its cool to freak out rolling all over my rug -_-,146,34,9,http://www.reddit.com/r/Pets/comments/y9nzo/my_dog_smoochy_thinks_its_cool_to_freak_out/,,,False,,t5_2qh6o,False,,,False,t3_y9nzo,http://i.imgur.com/QleGu.jpg,
1343953233.0,115,imgur.com,xldpd,This is Enid my good pal who deserves love for being sweet.,148,33,17,http://www.reddit.com/r/Pets/comments/xldpd/this_is_enid_my_good_pal_who_deserves_love_for/,,,False,,t5_2qh6o,False,,,False,t3_xldpd,http://imgur.com/eC5IP,
1335980977.0,112,i.imgur.com,t3l9q,Sunbathing outside with my new best friend.,130,18,12,http://www.reddit.com/r/Pets/comments/t3l9q/sunbathing_outside_with_my_new_best_friend/,,,False,,t5_2qh6o,False,,,False,t3_t3l9q,http://i.imgur.com/u92s3.jpg,
1328895863.0,116,imgur.com,pjlqt,My buddies...,150,34,11,http://www.reddit.com/r/Pets/comments/pjlqt/my_buddies/,,,False,,t5_2qh6o,False,,,False,t3_pjlqt,http://imgur.com/a/MDmmv,
1326167584.0,114,i.imgur.com,oac7k,My Sweet Old Lady,130,16,10,http://www.reddit.com/r/Pets/comments/oac7k/my_sweet_old_lady/,,,False,,t5_2qh6o,False,,,False,t3_oac7k,http://i.imgur.com/Uzo5A.jpg,
1318738174.0,112,flickr.com,ldsql,What my 80 pound dog likes to do while I'm trying to read.,127,15,12,http://www.reddit.com/r/Pets/comments/ldsql/what_my_80_pound_dog_likes_to_do_while_im_trying/,,,False,,t5_2qh6o,False,,,False,t3_ldsql,http://www.flickr.com/photos/49594453@N06/6244750766/,
1315681156.0,114,i.imgur.com,kbcay,She's got the underbite of a champ. ,129,15,3,http://www.reddit.com/r/Pets/comments/kbcay/shes_got_the_underbite_of_a_champ/,,,False,,t5_2qh6o,False,,,False,t3_kbcay,http://i.imgur.com/LJFba.jpg,
1305750622.0,113,i.imgur.com,heheo,"Took the rats outside today, here are some pictures!",133,20,23,http://www.reddit.com/r/Pets/comments/heheo/took_the_rats_outside_today_here_are_some_pictures/,,,False,,t5_2qh6o,False,,,False,t3_heheo,http://i.imgur.com/BHeBM.jpg,
1297484690.0,114,i.imgur.com,fjwen,We got our third rescue greyhound today and she was an instant couch potato.,123,9,36,http://www.reddit.com/r/Pets/comments/fjwen/we_got_our_third_rescue_greyhound_today_and_she/,,,False,,t5_2qh6o,False,,,False,t3_fjwen,http://i.imgur.com/q87xN.jpg,
1364916808.0,110,cnn.com,1biq2q,Hero dog helps pull girl from icy river,135,25,5,http://www.reddit.com/r/Pets/comments/1biq2q/hero_dog_helps_pull_girl_from_icy_river/,,,False,,t5_2qh6o,False,,,False,t3_1biq2q,http://www.cnn.com/2013/04/02/world/americas/canada-river-rescue/#.UVr6NBZd8EY.reddit,
1345408317.0,112,imgur.com,yhje3,I haven't seen a chow chow on here before so here is my little cinnamon girl,136,24,13,http://www.reddit.com/r/Pets/comments/yhje3/i_havent_seen_a_chow_chow_on_here_before_so_here/,,,False,,t5_2qh6o,False,,,False,t3_yhje3,http://imgur.com/pKuaT,
1343289529.0,113,i.imgur.com,x6hus,"Me and my new dog, Diesel the Great Dane.",141,28,21,http://www.reddit.com/r/Pets/comments/x6hus/me_and_my_new_dog_diesel_the_great_dane/,,,False,,t5_2qh6o,False,,,False,t3_x6hus,http://i.imgur.com/wV5AB.jpg,
1343193891.0,110,imgur.com,x48fb,Found this picture of my first dog. She tolerated a lot.,136,26,2,http://www.reddit.com/r/Pets/comments/x48fb/found_this_picture_of_my_first_dog_she_tolerated/,,,False,,t5_2qh6o,False,,,False,t3_x48fb,http://imgur.com/fsV23,
1333906548.0,114,imgur.com,rzfoi,Oh hai der! My name is Oscar!,145,31,2,http://www.reddit.com/r/Pets/comments/rzfoi/oh_hai_der_my_name_is_oscar/,,,False,,t5_2qh6o,False,,,False,t3_rzfoi,http://imgur.com/MhYjW,
1333612620.0,110,imgur.com,rucz9,Of course her favorite spot has to be in the doorway...,133,23,24,http://www.reddit.com/r/Pets/comments/rucz9/of_course_her_favorite_spot_has_to_be_in_the/,,,False,,t5_2qh6o,False,,,False,t3_rucz9,http://imgur.com/p7tkm,
1318129835.0,111,imgur.com,l5ogi,My Dog Yoshi: How You Can Tell When They Are Getting Too Smart,122,11,12,http://www.reddit.com/r/Pets/comments/l5ogi/my_dog_yoshi_how_you_can_tell_when_they_are/,,,False,,t5_2qh6o,False,,,False,t3_l5ogi,http://imgur.com/I5CSp,
1303306420.0,111,i.imgur.com,gufvc,Journalists' Guide to Dog Breed Identification,125,14,18,http://www.reddit.com/r/Pets/comments/gufvc/journalists_guide_to_dog_breed_identification/,,,False,,t5_2qh6o,False,,,False,t3_gufvc,http://i.imgur.com/5yLoT.png,
1360170732.0,111,bbc.co.uk,180a06,"Stewie, the worlds longest cat, has died.",125,14,7,http://www.reddit.com/r/Pets/comments/180a06/stewie_the_worlds_longest_cat_has_died/,,,False,,t5_2qh6o,False,,,False,t3_180a06,http://www.bbc.co.uk/news/world-us-canada-21346868,
1321169204.0,111,i.imgur.com,majya,The old man and the young puppy,123,12,0,http://www.reddit.com/r/Pets/comments/majya/the_old_man_and_the_young_puppy/,,,False,,t5_2qh6o,False,,,False,t3_majya,http://i.imgur.com/SNv8B.jpg,
1309184358.0,111,imgur.com,iac90,It wasn't me. Honest.,132,21,14,http://www.reddit.com/r/Pets/comments/iac90/it_wasnt_me_honest/,,,False,,t5_2qh6o,False,,,False,t3_iac90,http://imgur.com/fT7RJ,
1308021905.0,111,i.imgur.com,hz36q,"My girl just woke up, went into the other room, came back with my shoe, and now she's sleeping with it.",123,12,14,http://www.reddit.com/r/Pets/comments/hz36q/my_girl_just_woke_up_went_into_the_other_room/,,,False,,t5_2qh6o,False,,,False,t3_hz36q,http://i.imgur.com/9RVfJ.jpg,
1307063380.0,108,i.imgur.com,hqe7c,"My Doberman loves diving, and he can jump!",117,9,29,http://www.reddit.com/r/Pets/comments/hqe7c/my_doberman_loves_diving_and_he_can_jump/,,,False,,t5_2qh6o,False,,,False,t3_hqe7c,http://i.imgur.com/if0jx.jpg,
1374592728.0,110,delaware.newszap.com,1ivzjd,Delaware's newest no kill shelter is closing at the end of August due to financial problems.....and still need to find homes for 250+ pets,140,30,3,http://www.reddit.com/r/Pets/comments/1ivzjd/delawares_newest_no_kill_shelter_is_closing_at/,,,False,,t5_2qh6o,False,,,False,t3_1ivzjd,http://delaware.newszap.com/centraldelaware/124233-70/safe-haven-shelter-to-close-from-fiscal-woes,
1366074383.0,114,mnn.com,1cfhlh,"Meet Momo, the dog that hides in plain sight",135,21,17,http://www.reddit.com/r/Pets/comments/1cfhlh/meet_momo_the_dog_that_hides_in_plain_sight/,,,False,,t5_2qh6o,False,,,False,t3_1cfhlh,http://www.mnn.com/family/pets/stories/meet-momo-the-dog-that-hides-in-plain-sight,
1338759106.0,108,i.imgur.com,uj3no,"Fifteen years old, brothers, still as adorable as ever.",122,14,4,http://www.reddit.com/r/Pets/comments/uj3no/fifteen_years_old_brothers_still_as_adorable_as/,,,False,,t5_2qh6o,False,,,False,t3_uj3no,http://i.imgur.com/zQ2Va.jpg,
1333813956.0,110,imgur.com,rxy33,Maggie the Easter bunny,134,24,4,http://www.reddit.com/r/Pets/comments/rxy33/maggie_the_easter_bunny/,,,False,,t5_2qh6o,False,,,False,t3_rxy33,http://imgur.com/2VHhK,
1330279269.0,108,i.imgur.com,q6vpz,"For the past two years, Cookie has taken the same toy up to bed every night. What cute/quirky things do your pets do?",138,30,47,http://www.reddit.com/r/Pets/comments/q6vpz/for_the_past_two_years_cookie_has_taken_the_same/,,,False,,t5_2qh6o,False,,,False,t3_q6vpz,http://i.imgur.com/UhLJQ.jpg,
1320118894.0,111,imgur.com,lw1ps,"Skipped out on passing out candy to go pick up ""Sofi"" my new chocolate lab :)",117,6,17,http://www.reddit.com/r/Pets/comments/lw1ps/skipped_out_on_passing_out_candy_to_go_pick_up/,,,False,,t5_2qh6o,False,,,False,t3_lw1ps,http://imgur.com/kgLza,
1319343077.0,111,i.imgur.com,llppr,Cosmo sniffing a flower,119,8,4,http://www.reddit.com/r/Pets/comments/llppr/cosmo_sniffing_a_flower/,,,False,,t5_2qh6o,False,,,False,t3_llppr,http://i.imgur.com/SWn4R.jpg,
1318551280.0,108,i.imgur.com,lbghc,"All the money I have wasted... (xpost, reddit.com -- no one appreciated it; perhaps some of you will :-)",124,16,19,http://www.reddit.com/r/Pets/comments/lbghc/all_the_money_i_have_wasted_xpost_redditcom_no/,,,False,,t5_2qh6o,False,,,False,t3_lbghc,http://i.imgur.com/1JPfs.png,
1316908784.0,110,i.imgur.com,kqfob,"I didn't think at 3 weeks old he was going to make it. But here he is, 7 weeks, sleepin' with his best friend. Good job, little orange one!",125,15,8,http://www.reddit.com/r/Pets/comments/kqfob/i_didnt_think_at_3_weeks_old_he_was_going_to_make/,,,False,,t5_2qh6o,False,,,False,t3_kqfob,http://i.imgur.com/Orf4G.jpg,
1315437286.0,108,en.wikipedia.org,k859i,"Because of their social behaviour, it is illegal in Sweden to sell a lone guinea pig to a buyer who does not have any other guinea pigs.",116,8,24,http://www.reddit.com/r/Pets/comments/k859i/because_of_their_social_behaviour_it_is_illegal/,,,False,,t5_2qh6o,False,,,False,t3_k859i,http://en.wikipedia.org/wiki/Guinea_pig,
1314762157.0,112,i.imgur.com,jztbg,My two beautiful rats :),123,11,16,http://www.reddit.com/r/Pets/comments/jztbg/my_two_beautiful_rats/,,,False,,t5_2qh6o,False,,,False,t3_jztbg,http://i.imgur.com/xhq0G.jpg,
