created_utc,score,domain,id,title,ups,downs,num_comments,permalink,selftext,link_flair_text,over_18,thumbnail,subreddit_id,edited,link_flair_css_class,author_flair_css_class,is_self,name,url,distinguished
1363842445.0,431,i.imgur.com,1apso4,This has helped me out dozens of times when traveling. Does anyone know if there are more like this?,476,45,25,http://www.reddit.com/r/productivity/comments/1apso4/this_has_helped_me_out_dozens_of_times_when/,,,False,,t5_2qh1k,False,,,False,t3_1apso4,http://i.imgur.com/Reay4Z6.jpg,
1361320309.0,372,cdn3.groovypost.com,18uqbu,Use a Google Live Form to track your goals and daily activity. Dump it all in a spreadsheet and analyze it for trends and progress. Takes seconds per day.,409,37,16,http://www.reddit.com/r/productivity/comments/18uqbu/use_a_google_live_form_to_track_your_goals_and/,,,False,,t5_2qh1k,False,,,False,t3_18uqbu,http://cdn3.groovypost.com/wp-content/uploads/2013/02/googlegoals-pin.png,
1368721999.0,323,thumbnails.visually.netdna-cdn.com,1egiyj,How To Focus in the Age of Distraction [Badass Infographic/Desktop Wallpaper],359,36,26,http://www.reddit.com/r/productivity/comments/1egiyj/how_to_focus_in_the_age_of_distraction_badass/,,,False,,t5_2qh1k,False,,,False,t3_1egiyj,http://thumbnails.visually.netdna-cdn.com/how-to-focus_50290d04c13f4.jpg,
1355283454.0,311,1.bp.blogspot.com,14pf1i,"How I take notes, Cornell notes. I never went back to the regular, messy line-by-line notes",346,35,52,http://www.reddit.com/r/productivity/comments/14pf1i/how_i_take_notes_cornell_notes_i_never_went_back/,,,False,,t5_2qh1k,False,,,False,t3_14pf1i,http://1.bp.blogspot.com/-c5d4XO00GFU/Tsq9nIOA6RI/AAAAAAAABr4/tyTIl3fbkwo/s1600/cornell-layout.jpg,
1367874587.0,291,imgur.com,1dtf73,"Hey, pssst, hey you over there browsing reddit...",432,141,40,http://www.reddit.com/r/productivity/comments/1dtf73/hey_pssst_hey_you_over_there_browsing_reddit/,,,False,,t5_2qh1k,False,,,False,t3_1dtf73,http://imgur.com/ZUVATyH,
1355844118.0,274,self.productivity,151ylo,How I solved MY procrastination,308,34,46,http://www.reddit.com/r/productivity/comments/151ylo/how_i_solved_my_procrastination/,"I cant speak to anyone else, and i won't assume to understand anyone else to tell them what to do. All i can do i share my own experience...

Procrastination was my life. In all the ways you know it, i did it. Couple that with what was medically described as ""A pretty decent dose of ADHD"" from my doctors. So yeah, as you can imagine, my life hasnt been really great on that front. The only way i would ever get anything done is by terrifying myself into thinking my life would be over if i didnt get that report in, or call that person, or whatever day to day things you have to do. It worked well enough to keep my afloat, but my ""quality of life"" was complete shit.

My procrastination got bad to the point where my boss was commenting on it. This was completely unacceptable. My family's work ethic is beyond everything else, and so is mine. Work came first, and procrastination was not going to be the end of me, i wouldnt let it. So i seeked medical help.

Through the sessions i had realized a very important tendency i had. Whenever i looked at my to do list, it would usually have quite a few things on it, my mind would look at the entirety as a singular object. The immensity and impossibility of completing that singular object was overwhelming, to the point i didnt even want to think about it.

So i didnt. I would go on reddit, i would watch youtube videos, watch movies, and everytime i would glance over at my to-do list, my self loathing would grow bigger and bigger. I would occupy my time with whatever i could so that i had some kind of excuse for not getting things done. I did this subconsciously. I didnt even know i was doing it until it was pointed out.

Once i realized i was evaluating the ENTIRETY of my tasks as a single task, i decided to ignore everything on the list except the top priority. I literally said to myself, ""This one thing is the only thing i have to do today"". Lo and behold, and hour later that task is complete. And then i said to myself ""well shit, why didnt i do that earlier?, ok fine, the next thing is all i have to worry about.""

Rinse and repeat and before i knew it, my task lists were regularly getting done. My quailty of life has skyrocketed (mainly because productivity=happiness for me). 

As time went on, I started to smooth out this new tool. I dont use a ""to-do"" list anymore, i use my outlook calendar (same can be done with google/ical). If i need something done, i schedule it into the calendar. Everything is prioritized based on urgency. Sometimes i inaccurately estimate the time i need for a task, pfft, whatever, work until its done, or schedule it later for the day. At least now i have the experience for similar future items.

Then i thought to myself, shit...I am a slave to my calendar. At first that REALLY bothered me. But thats when you remember, UH DUR - YOU CREATED YOUR CALENDAR. So in reality, you are a slave to a more objective self, which i needed in the first place; to listen to the ""you need to do that report, not check reddit"".

Every single day i have an entry at 9am which says ""schedule your day"". I have 10 minutes allocated to it (it usually takes me 2). That brings me to my next point.

Overestimate needed completion time. ESPECIALLY if you are just starting out. Does sending an email take 30 seconds? schedule 5-10 minutes. Now you dont feel like you are rushing, you can feel comfortable, and most importantly, you dont start to hate this calendar. the calendar is nice to you, its understanding, its loving, but at the same time, it expects certain a certain level of productivity.

Caveat: you may feel ""i have no idea how #5 of my to-do list will take"" - THATS OK. Thats the type of experience that comes with time. One of my tricks is to think of every task as a science experiment, that the ""data"" i'm trying to collect is

* How good quality can i make this?
* How long will it take (dont rush, you need the objective data)


There are other things that go into it, but that epiphany of putting on proverbial horse blinders and only focusing on ONE thing, while completely IGNORING the rest, was what really started the ""holy shit, holy shit, holy shit, my stuff is getting done""


So stop living vicariously through the successes of everyone else, and start the path that allows YOU to become the person OTHER people live through. **Stop consuming; Start Producing.**

PS. I still procrastinate every once in a while, i dont think that will ever go away, but at least i've learned to catch myself. I know that i will get the important things done way ahead of when they should. That kind of confidence can not be harvested from anywhere, it must be grown within.


~~TL;DR~~

Stop using ""tl;dr"" as an excuse. Read it.",,False,,t5_2qh1k,False,,,True,t3_151ylo,http://www.reddit.com/r/productivity/comments/151ylo/how_i_solved_my_procrastination/,
1362342787.0,264,quickmeme.com,19lde7,After I've spent four hours on reddit,334,70,17,http://www.reddit.com/r/productivity/comments/19lde7/after_ive_spent_four_hours_on_reddit/,,,False,,t5_2qh1k,False,,,False,t3_19lde7,http://www.quickmeme.com/meme/3t7z68/,
1362674640.0,242,calnewport.com,19uowi,"If You’re Busy, You’re Doing Something Wrong: The Surprisingly Relaxed Lives of Elite Achievers",281,39,21,http://www.reddit.com/r/productivity/comments/19uowi/if_youre_busy_youre_doing_something_wrong_the/,,,False,,t5_2qh1k,False,,,False,t3_19uowi,http://calnewport.com/blog/2011/11/11/if-youre-busy-youre-doing-something-wrong-the-surprisingly-relaxed-lives-of-elite-achievers/,
1367248615.0,228,imgs.xkcd.com,1dcayd,XKCD: Avoid overoptimization!,271,43,70,http://www.reddit.com/r/productivity/comments/1dcayd/xkcd_avoid_overoptimization/,,,False,,t5_2qh1k,False,,,False,t3_1dcayd,http://imgs.xkcd.com/comics/is_it_worth_the_time.png,
1360098359.0,210,i.imgur.com,17ydvn,"I'd like to thank one of the posters here for this idea for tracking daily habits. While I have failed at many things, having it written down makes me feel better, and I'm still doing better than I was previously!",232,22,60,http://www.reddit.com/r/productivity/comments/17ydvn/id_like_to_thank_one_of_the_posters_here_for_this/,,,False,,t5_2qh1k,False,,,False,t3_17ydvn,http://i.imgur.com/2PoeYfB.png,
1347892620.0,203,sphotos-b.xx.fbcdn.net,100uwo,When someone is coming over,227,24,5,http://www.reddit.com/r/productivity/comments/100uwo/when_someone_is_coming_over/,,,False,,t5_2qh1k,False,,,False,t3_100uwo,https://sphotos-b.xx.fbcdn.net/hphotos-snc6/10248_10151197878531858_1927923279_n.jpg,
1365452488.0,199,i.imgur.com,1bxumb,I made a wallpaper to help me stay focused (X-Post from r/Filmmakers),231,32,38,http://www.reddit.com/r/productivity/comments/1bxumb/i_made_a_wallpaper_to_help_me_stay_focused_xpost/,,,False,,t5_2qh1k,False,,,False,t3_1bxumb,http://i.imgur.com/QD7dtUx.jpg,
1353692629.0,186,zenhabits.net,13oakf,» Best Procrastination Tip Ever,209,23,7,http://www.reddit.com/r/productivity/comments/13oakf/best_procrastination_tip_ever/,,,False,,t5_2qh1k,False,,,False,t3_13oakf,http://zenhabits.net/tada/,
1370268916.0,184,52weeksofhabits.com,1fkxxa,Make Waking Up Early a Habit: Get Up Every Morning Automatically,213,29,48,http://www.reddit.com/r/productivity/comments/1fkxxa/make_waking_up_early_a_habit_get_up_every_morning/,,,False,,t5_2qh1k,False,,,False,t3_1fkxxa,http://www.52weeksofhabits.com/2013/05/21/make-waking-up-early-a-habit/,
1359913770.0,179,kickstarter.com,17tcgg,Habit RPG: An application that turns your life into a role playing game,208,29,25,http://www.reddit.com/r/productivity/comments/17tcgg/habit_rpg_an_application_that_turns_your_life/,,,False,,t5_2qh1k,False,,,False,t3_17tcgg,http://www.kickstarter.com/projects/lefnire/habitrpg-mobile,
1363357967.0,153,thoughtcatalog.com,1acnk4,Procrastination Is Not Laziness,178,25,17,http://www.reddit.com/r/productivity/comments/1acnk4/procrastination_is_not_laziness/,,,False,,t5_2qh1k,False,,,False,t3_1acnk4,http://thoughtcatalog.com/2013/procrastination-is-not-laziness/,
1350688309.0,154,i.imgur.com,11ruza,Is this really what you want to be asking yourself one day? ,179,25,3,http://www.reddit.com/r/productivity/comments/11ruza/is_this_really_what_you_want_to_be_asking/,,,False,,t5_2qh1k,False,,,False,t3_11ruza,http://i.imgur.com/Cj811.jpg,
1357807300.0,148,inc.com,16b0ju,10 Things Extraordinary People Say Every Day,188,40,9,http://www.reddit.com/r/productivity/comments/16b0ju/10_things_extraordinary_people_say_every_day/,,,False,,t5_2qh1k,False,,,False,t3_16b0ju,http://www.inc.com/jeff-haden/10-things-extraordinary-people-say-every-day.html,
1333490660.0,147,self.productivity,rrujz,How to learn a new language efficiently (and quickly),166,19,33,http://www.reddit.com/r/productivity/comments/rrujz/how_to_learn_a_new_language_efficiently_and/,"I needed to learn to speak 3-4 languages over the past few years for my job, and in the process have landed on a pretty damn good method.  It got me to C1 fluency in French in about 5 months, and I'm currently using it with Russian (and plan on reaching C1 equivalent fluency by September).  At this point, I go in 4 stages:





* Stage 1: Learn the correct pronunciation of the language.  Doing this does a few things –  because I’m first and foremost learning how to hear that language’s sounds, my listening comprehension gets an immediate boost before I even start traditional language age learning.  Once I start vocabulary training, I retain it better because I’m familiar with how words should sound and how they should be spelled.  (Correct spellings in French, for example, are much easier to remember when there’s a connection between the spelling and the sound), and once I finally start speaking to native speakers, they don't switch to English for me or dumb down their language, which is awesome sauce.  If you're learning a language with a different alphabet, this is where you learn the phonetic alphabet(s) (Kana, for Japanese or Pinyin for Chinese, for example)

 



* Stage 2: Vocabulary and grammar acquisition (itself in a few stages), no English allowed.
I start with a frequency list and mark off any words I can portray with pictures alone (basic nouns and verbs).  I put those in an [Anki deck](http://www.towerofbabelfish.com/Tower_of_Babelfish/Anki.html) and learn them.  Once I have some words to play with, I start putting them together.  I use Google translate (Exception to no English rule - just be careful there's no English in your Anki deck) and a grammar book to start making sentences, then get everything double-checked at lang-8.com before putting them into my Anki deck.  Turning them into fill-in-the-blank flashcards builds the initial grammar and connecting words.  As vocab and grammar grow, I eventually move to monolingual dictionaries and writing my own definitions for more abstract words (again doublechecked at lang-8.com).  This builds on itself; the more vocab and grammar you get, the more vocab and grammar concepts you can describe in the target language.  Eventually you can cover all the words in a 2000 word frequency list as a foundation and add any specific vocab you need for your own interests.





* Stage 3: Listening, writing and reading work
Once I have a decent vocabulary and familiarity with grammar, I start writing essays, watching TV shows and reading books, and talking (mostly to myself) about the stuff I see and do.  Every writing correction gets added to the Anki deck, which continues to build my vocab and grammar.





* Stage 4: Speech
At the point where I can more or less talk (haltingly, but without too many grammar or vocab holes) and write about most familiar things, I find some place to immerse in the language and speak all the time (literally.  No English allowed or else you won't learn the skill you're trying to learn, which is adapting to holes in your grammar or vocabulary by going around them rapidly and automatically without having to think about it).  I prefer Middlebury college, but a few weeks in the target country will work as well if you're very vigorous with sticking to the target language and not switching to English.  If you're extremely strict with yourself, your brain adapts pretty quickly and learns how to put all the info you learned in stages 1-3 together quickly enough to turn into fluent speech.

 



I've written a (not yet available) book on the topic and a (now available) website, [Tower of Babelfish.com](http://www.towerofbabelfish.com).  You can find some language-specific resources at the [Languages page](http://www.towerofbabelfish.com/Tower_of_Babelfish/Languages.html), some more [detailed discussions](http://www.towerofbabelfish.com/Tower_of_Babelfish/The_Method.html) about this stuff, and some [video tutorials about pronunciation](http://www.towerofbabelfish.com/Tower_of_Babelfish/Videos.html)",,False,,t5_2qh1k,False,,,True,t3_rrujz,http://www.reddit.com/r/productivity/comments/rrujz/how_to_learn_a_new_language_efficiently_and/,
1374171382.0,146,psychologytoday.com,1ikoxt,15 Psychology Experts Share Their Best Productivity Tips,164,18,11,http://www.reddit.com/r/productivity/comments/1ikoxt/15_psychology_experts_share_their_best/,,,False,,t5_2qh1k,False,,,False,t3_1ikoxt,http://www.psychologytoday.com/blog/in-practice/201303/15-psychology-experts-share-their-best-productivity-tips,
1357658632.0,136,humorthatworks.com,166pst,"""I wasted 27 hours of my life hitting snooze."" And other things I learned from tracking my time for 6 months.",154,18,14,http://www.reddit.com/r/productivity/comments/166pst/i_wasted_27_hours_of_my_life_hitting_snooze_and/,,,False,,t5_2qh1k,False,,,False,t3_166pst,http://www.humorthatworks.com/learning/create-consume-6-month-update/,
1325363212.0,132,i.imgur.com,nxtxc,A day in the life of Benjamin Franklin,147,15,11,http://www.reddit.com/r/productivity/comments/nxtxc/a_day_in_the_life_of_benjamin_franklin/,,,False,,t5_2qh1k,False,,,False,t3_nxtxc,http://i.imgur.com/JIr05.jpg,
1341446125.0,127,kratosguide.com,w1y30,16 Habits You Should Do Everyday,163,36,30,http://www.reddit.com/r/productivity/comments/w1y30/16_habits_you_should_do_everyday/,,,False,,t5_2qh1k,False,,,False,t3_w1y30,http://www.kratosguide.com/16-habits-you-should-do-every-day/,
1367947681.0,123,youtube.com,1dvg06,"Guys, I think this guy might be talking about us.",144,21,11,http://www.reddit.com/r/productivity/comments/1dvg06/guys_i_think_this_guy_might_be_talking_about_us/,,,False,,t5_2qh1k,False,,,False,t3_1dvg06,http://www.youtube.com/watch?feature=player_embedded&amp;v=cKaWJ72x1rI,
1335469986.0,123,i.imgur.com,su22t,Yup.,153,30,8,http://www.reddit.com/r/productivity/comments/su22t/yup/,,,False,,t5_2qh1k,False,,,False,t3_su22t,http://i.imgur.com/NT8hN.png,
1366098479.0,125,blog.bufferapp.com,1cg79w,"7 Simple productivity tips you can apply today, backed by science",143,18,8,http://www.reddit.com/r/productivity/comments/1cg79w/7_simple_productivity_tips_you_can_apply_today/,,,False,,t5_2qh1k,False,,,False,t3_1cg79w,http://blog.bufferapp.com/simple-productivity-tips-science,
1358725956.0,123,imgur.com,16yg0s,"Thought I'd share my application of the ideas from the 16 Habits (which hovers around the #9 spot of all-time top posts).  Comment, drop some advice, AMA, judge me, share your own, etc.  This has improved my life significantly and you too should try it to some degree IMO.",136,13,45,http://www.reddit.com/r/productivity/comments/16yg0s/thought_id_share_my_application_of_the_ideas_from/,,,False,,t5_2qh1k,False,,,False,t3_16yg0s,http://imgur.com/ftnj4Rb,
1348371970.0,115,self.productivity,10btuu,My story on how I became a productive person (and tips how you can too),135,20,16,http://www.reddit.com/r/productivity/comments/10btuu/my_story_on_how_i_became_a_productive_person_and/,"Hey everyone,

A bit about me, I'm 27 years old, male, and a natural procrastinator. For the past 9 months or so I have been operating at a much higher level than average and much higher than most of my peers. How do I do it? Three ways:

* New habits
* Core motivation
* Accountability

Right now I have a full time job, I go to school, I'm building two new websites, I'm learning to play the Viola, and up until last month when I broke my nose and had severe complications I was training MMA a couple times a week. I still work out now, but I do things that are less violent until my cartilage fully heals ;) 

So how does someone who naturally wants to put things off do so much? By creating *new habits*



**New Habits**
I didn't start off doing all of that at once, I slowly added. One thing I did do is go to work every day, that has been a habit of mine ever since I was 16, so in a sense I had a head start. I know some people don't have jobs, but that doesn't mean you can get into a habit of working and improving every day. The great thing about having a job is they MAKE you come in. If you don't come in, then you don't get paid. If you don't get paid, you don't have the money to live. This makes it a great motivation for me and speaks to one of the other principals, *accountability*.

So here I am working 40 hours a week and I decide I want to go to school (why I want to go is from the *core motivation* principal we will get to later). Another great thing about school is they also hold you accountable, just like work, except with school you are paying THEM! You best be going to all your classes and doing all your work so you are getting your moneys worth. Once you go for a few weeks this becomes a habit. It becomes 'easy' to work 40 hours a week and go to school, at least in the sense that its automatic.

It has been my experience that if I'm only working 40 hours a week I am general lazy when I get off work. I drink scotch, watch netflix, and in general piss away my time. *If I am working 40 hours a week and I have another obligation that takes a significant amount of time (between 10-20 hours a week) then it has a tendency to push me over the edge and make even my 'relaxing' time become productive.* I think this is the most important discovery about myself I have made in the last year. 



**Core Motivation**

This require a bit of soul searching and when it comes to that I can't really help too much. I consider myself lucky that I have figured out exactly what I want to do with my life, most of my peers have not. One thing that contributed to that epiphany was figuring out what really drives me. Was it money? Power? Creativity? Laziness? Love? Sex?

None of the above for me. My core motivation is ""Helping people"" as cliche as that sounds. There are a few caveats for me, I want to be able to help people, be creative, make decent income, and have control of my own schedule. Those 'accessories' helped narrow down my career choices. If I really just wanted to help people I could go volunteer at some non-profit making pennies, but I would rather not.

*Figuring out my core motivation has given me strength and drive when I need to start a new habit (like going to school), or if I run into problems or setbacks during the course of executing my plans.* I really make an effort to visual the life I want, and the life I am creating, and I know that someday (soon) I will have that life. 



**Accountability**

Like I said, I am a natural procrastinator. One thing I do have going for me though is 'honor'. I am an honorable bastard and I hate being shamed. I use this to my advantage and I have surrounded myself with people that hold me accountable for my actions. Some of these are mentors, friends, parents, consultants and teachers. Some days I really don't want to practice my Viola, but I know that I have a lesson on Friday so I better practice otherwise it will be embarrassing for me to fumble through a song while my teacher stands by and listens. If I get bad grades at school then I will be letting down the people that have granted me a partial scholarship to take these classes. If I don't accomplish the goals I set forth for my website then my business consultant will be asking me hard questions and I won't have the answers...

Some people suggest you tell your goals to the whole world, I see people posting on reddit as a way to keep themselves accountable. This never really made sense to me. People on the internet don't look me in the eye when I tell them I failed, but my teachers/mentors/friends do. I have found it much more effective to have real life contacts than anything online. 



**Conclusion**

The reason I'm posting this is not to brag and not to say ""Oh look how productive I am."" I do think that we should be studying people that are actively achieving and figuring out what they are doing right. It's similar to the idea in psychology of studying how healthy people are that way rather than studying sick people and figuring out how to make them healthy. Pick a model that is working, and then form yourself to that. It makes things soooooooooo much easier. 

You will notice that in this whole post I didn't include anything about to-do lists, productivity apps, or mind 'hacks' that help me increase my effectiveness. My method of doing things changes and flows depending on my life, and I think concerning yourself with the minutia like that just bogs you down and makes you feel productive when you really are just being 'busy'. Thank you for reading.",,False,,t5_2qh1k,False,,,True,t3_10btuu,http://www.reddit.com/r/productivity/comments/10btuu/my_story_on_how_i_became_a_productive_person_and/,
1361843197.0,117,i.imgur.com,198ba7,This is how I take my notes from a textbook. It's sort of a Cornell/outline blend. How do you take yours?,147,30,18,http://www.reddit.com/r/productivity/comments/198ba7/this_is_how_i_take_my_notes_from_a_textbook_its/,,,False,,t5_2qh1k,False,,,False,t3_198ba7,http://i.imgur.com/GuWxq5S.jpg,
1371394583.0,111,gradutempore.com,1ggffm,16 Productivity Tips for Better Work and Life,126,15,3,http://www.reddit.com/r/productivity/comments/1ggffm/16_productivity_tips_for_better_work_and_life/,,,False,,t5_2qh1k,False,,,False,t3_1ggffm,http://www.gradutempore.com/2013/06/16-productivity-tips-for-better-work.html,
1365303274.0,117,welcome.prioritor.com,1btzva,"I can admit that sometimes I spend to much time on Reddit, so we created a desktop app that turns productivity into a game. We are launching soon, please consider signing up for our Beta.",149,32,34,http://www.reddit.com/r/productivity/comments/1btzva/i_can_admit_that_sometimes_i_spend_to_much_time/,,,False,,t5_2qh1k,False,,,False,t3_1btzva,http://welcome.prioritor.com/,
1365900854.0,115,self.productivity,1catpu,"From the Louis CK AMA, on getting prepared.",138,23,2,http://www.reddit.com/r/productivity/comments/1catpu/from_the_louis_ck_ama_on_getting_prepared/,"
I try just to clear my mind. Put down the phone. Turn off the tv radio whatever. Just be quiet and don't talk to anyone and just go over the set in my head and see what new thoughts crop up. simply the act of thinking about something gets your mind ready in a big way.

-Louis CK",,False,,t5_2qh1k,False,,,True,t3_1catpu,http://www.reddit.com/r/productivity/comments/1catpu/from_the_louis_ck_ama_on_getting_prepared/,
1361418786.0,112,self.productivity,18xlrz,"Can anyone demonstrate to me the Cornell note taking method? I've read into it, but having trouble harnessing it, and I start University again in one week. ",128,16,15,http://www.reddit.com/r/productivity/comments/18xlrz/can_anyone_demonstrate_to_me_the_cornell_note/,"A text post would be fine, but any kind of visual representation would be a godsend. 

Thank you. ",,False,,t5_2qh1k,False,,,True,t3_18xlrz,http://www.reddit.com/r/productivity/comments/18xlrz/can_anyone_demonstrate_to_me_the_cornell_note/,
