created_utc,score,domain,id,title,ups,downs,num_comments,permalink,selftext,link_flair_text,over_18,thumbnail,subreddit_id,edited,link_flair_css_class,author_flair_css_class,is_self,name,url,distinguished
1357484648.0,25,thameera.wordpress.com,1628t6,Using email + spaced repetition to remember things easily,32,7,2,http://www.reddit.com/r/productivity/comments/1628t6/using_email_spaced_repetition_to_remember_things/,,,False,,t5_2qh1k,False,,,False,t3_1628t6,http://thameera.wordpress.com/2013/01/06/spaced-repetition-like-a-boss/,
1353109172.0,23,outgrow.me,13bqp6,Big 2013 Wall Calendar,34,11,0,http://www.reddit.com/r/productivity/comments/13bqp6/big_2013_wall_calendar/,,,False,,t5_2qh1k,False,,,False,t3_13bqp6,http://outgrow.me/product/seize-the-year-2013/,
1351146061.0,24,lifehacker.com,121y4s,Facebook Nanny Blocks You From Visiting Facebook Unless You Have Notifications,35,11,3,http://www.reddit.com/r/productivity/comments/121y4s/facebook_nanny_blocks_you_from_visiting_facebook/,,,False,,t5_2qh1k,False,,,False,t3_121y4s,http://lifehacker.com/5954578/facebook-nanny-blocks-you-from-visiting-facebook-unless-you-have-notifications,
1349703637.0,23,erik.craddock.org,114xjg,How to Form Habits with Google Forms,27,4,0,http://www.reddit.com/r/productivity/comments/114xjg/how_to_form_habits_with_google_forms/,,,False,,t5_2qh1k,False,,,False,t3_114xjg,http://erik.craddock.org/2012/10/08/how-to-build-habits-with-google-forms/,
1348782800.0,23,theatlantic.com,10l3dt,"Procrastination: Admitting You Have a Problem, and What to Do About It - Kasia Cieplak-Mayr von Baldegg - The Atlantic Fool your brain, not yourself.",29,6,2,http://www.reddit.com/r/productivity/comments/10l3dt/procrastination_admitting_you_have_a_problem_and/,,,False,,t5_2qh1k,False,,,False,t3_10l3dt,http://www.theatlantic.com/video/archive/2012/09/procrastination-admitting-you-have-a-problem-and-what-to-do-about-it/262919/,
1345521544.0,22,primermagazine.com,ykal1,Hard Work in 5 Easy Steps: Understanding Perseverance in the Modern Age | Primer,27,5,0,http://www.reddit.com/r/productivity/comments/ykal1/hard_work_in_5_easy_steps_understanding/,,,False,,t5_2qh1k,False,,,False,t3_ykal1,http://www.primermagazine.com/2012/live/what-is-hard-work,
1342771530.0,23,tynan.com,wv4nv,Why I Took Four Violin Lessons and then Quit,30,7,2,http://www.reddit.com/r/productivity/comments/wv4nv/why_i_took_four_violin_lessons_and_then_quit/,,,False,,t5_2qh1k,False,,,False,t3_wv4nv,http://tynan.com/uid/30046,
1342279894.0,23,self.productivity,wjv6s,"A Review Of ""How to Beat Procrastination"", And How To Properly Use The Procrastination Equation To Reduce Procrastination",38,15,6,http://www.reddit.com/r/productivity/comments/wjv6s/a_review_of_how_to_beat_procrastination_and_how/,"==Introduction==
As you know, I have read a lot about procrastination and willpower. I've come to the conclusion that willpower, as it is commonly defined, does not exist, or at least there is no reason to believe that it exists. I might be described as a behaviourist or logical positivist or eliminative materialist. Philosophy does not interest me. The point is that I no longer accept hypothetical constructs such as ""the mind"", ""the ego"", ""the id"", ""the superego"", ""the will"", ""intentions"", ""willpower"", ""desires"", ""passions"", ""emotions"", ""feelings"" and so forth. Yes, I am aware that some people argue there is a so-called ""limbic system"", that the amygdala is somehow responsible for ""emotions"", that the ""neocortex"", or the prefrontal cortex, is somehow responsible for planning and inhibition. Does this mean that we can somehow stop procrastination by removing the parts of the brain responsible for impulsive behaviour? Lobotomy turned out not to have been so successful after all (most patients either died or were permanently incapacitated); perhaps we don't know nearly as much about the brain as we think we did. The point is that neuroscience, in its current stage of development, does not have any answers for resolving procrastination. The only answers, therefore, must come from observational studies, and theories constructed with the ""black box"" analogy. Enter the Procrastination Equation. 

==The Procrastination Equation==

Piers Steel is a researcher in the field of procrastination; this guy actually studies procrastination for a living. He helpfully constructed an equation to predict procrastination. There is obviously no explanation, but the fact that this equation can at least be quantified, even roughly, makes it infinitely more useful than all of the theories on procrastination previously discussed.  

At this point, you would be tempted to go on google and search for ""the procrastination equation"" and sure enough, one of the results is lesswrong.com/lw/3w3/how_to_beat_procrastination/ which did the same thing I am doing: use the procrastination equation to try to beat procrastination. 

There are a few flaws with his method, however, which I will delve into. But first, let's take look at the procrastination equation itself:



Motivation = (Expectancy x Value) / (Impulsiveness x Delay)



Where:
Expectancy = likelihood of being rewarded
Value = how much you like the task
Impulsiveness = how impulsive you are
Delay = how long before you get the reward



Now onto the website that I linked to earlier - lesswrong.com:


&gt;To beat procrastination, we need to:
&gt;Increase your expectancy of success.

Yes, we want to increase our likelihood of receiving the reward. Who wouldn't? If it were at all possible, we would have done it already. This is a pretty useless piece of advice. 

&gt;Increase the task's value (make it more pleasant and rewarding).

This is more interesting. But we need to go into more details to find out exactly how this guy intends to make the task more attractive. 

&gt;Decrease your impulsiveness.

Dohohoho. Through what, meditation and mindfulness? Taking pills? If you've read my previous post on this issue, you'd know that I advocate mindfulness. Yet even I know that mindfulness is pretty fucking difficult especially when you are trying to concentrate. How can you fully focus on the task when you are fully focused on stopping yourself from doing impulsive things? Doesn't quite work out does it? This is a pretty useless bit of advice. 

Now we come to the real meat and bones of the advice:

&gt;Optimizing Optimism
&gt;One way to build your optimism for success is to make use of success spirals.11 When you achieve one challenging goal after another, your obviously gain confidence in your ability to succeed. So: give yourself a series of meaningful, challenging but achievable goals, and then achieve them! Set yourself up for success by doing things you know you can succeed at, again and again, to keep your confidence high.

Optimism! Just be confident! It doesn't really work. Ever heard of depressive realism? Being confident doesn't make you more likely to succeed at the task, it will simply make your failure all the more spectacular. 

Expectancy isn't even an issue in most forms of procrastination. Students who procrastinate on writing a paper know that they CAN write the paper, pupils who delay on revising for an exam know that they CAN revise for the exam. People who put off washing the dishes probably aren't under any illusion that they physically can't wash the dishes. So that renders this piece of advice pretty much worthless. Let's see what's next:

&gt;If the task you're avoiding is boring, try to make it more difficult, right up to the point where the difficulty level matches your current skill, and you achieve ""flow.""21 This is what the state troopers of Super Troopers did: they devised strange games and challenges to make their boring job passable. Myrtle Young made her boring job at a potato chip factory more interesting and challenging by looking for potato chips that resembled celebrities and pulling them off the conveyor belts.

Okay, this is where he is wrong. Making a task more difficult definitely does not increase its appeal. It will almost certainly become less attractive as a result. You do not achieve ""flow"", which is a feeling of ease, by making the task more demanding and difficult. You achieve flow by getting so good at the task that you don't even have to think about it, it becomes so easy that it's relaxing. You do not get into a state of flow by making the task even more challenging than it already is. 

&gt;It also helps to make sure tasks are connected to something you care about for its own sake,22 at least through a chain: you read the book so you can pass the test so you can get the grade so you can get the job you want and have a fulfilling career. 

Yeah, so repeat the same old stuff that your parents and teachers drone on about every day to yourself. Does it work? Not even once. 

&gt;Obviously, tasks are harder when you don't have much energy.23 Tackle tasks when you are most alert. This depends on your circadian rhythm,24 but most people have the most energy during a period starting a few hours after they wake up and lasting 4 hours.25 Also, make sure to get enough sleep and exercise regularly.26

Here we go again. ""Sleep more"", ""do more exercise"". The same general advice that gets handed out to every problem regardless of what it is. Do you really think people don't know this already? How is it going to help people who already sleep 12 hours a day?

&gt;One obvious way to inject more value into a task is to reward yourself for completing it.27 Also, mix bitter medicine with sweet honey. Pair a long-term interest with a short-term pleasure.28 Find a workout partner whose company you enjoy. Treat yourself to a specialty coffee when doing your taxes. I bribe myself with Pinkberry frozen yogurt to do things I hate doing.

Yes, so basically reward yourself for doing something. This approach doesn't work, partially because you can cheat, and partially because if the task is unattractive enough that you will procrastinate on it, it's unattractive that you would forgo the reward just to avoid the task. 

&gt;Of course, the most powerful way to increase the value of a task is to focus on doing what you love wherever possible. It doesn't take much extra motivation for me to research meta-ethics or write summaries of scientific self-help: that is what I love to do. Some people who love playing video games have made careers out of it. To figure out which career might be full of tasks that you love to do, taking a RIASEC personality test might help. In the USA, O*NET can help you find jobs that are in-demand and fit your personality.

Yes, the same old ""do what you love"" nonsense that people like Steve Jobs prattle on about all the time. 

Let's think about it for one second: if people all did what they loved, they'd all be professional gamers, footballers and movie critics. How many gamers, footballers and movie critics actually earn enough money to make a living from just playing games, football and watching movies? Do you really think society would continue to function if everyone played video games, football and watched movies all day long? 

Fact is that we can't all be professional gamers, footballers and movie critics, as much as we all love playing video games, playing football and watching movies. Not everyone can do what they love, unfortunately. Yes we are trying our best to get there, but until The Singularity actually happens, most of us have to work for a living, work that we are often not particularly passionate about. 

Which makes this piece of advice completely useless. Next:

&gt;One method is to ""throw away the key"": Close off tempting alternatives. Many people see a productivity boost when they decide not to allow a TV in their home; I haven't owned one in years. But now, TV and more is available on the internet. To block that, you might need a tool like RescueTime. Or, unplug your router when you've got work to do.

This does not reduce impulsiveness at all. All it does is close off certain avenues for impulsiveness. Before, when you wanted to watch TV, you would go watch it. Now that you don't have a TV, you would just be sitting there reminiscing your old TV-watching days. Hardly increased productivity. 

[continued]",,False,,t5_2qh1k,1342352390.0,,,True,t3_wjv6s,http://www.reddit.com/r/productivity/comments/wjv6s/a_review_of_how_to_beat_procrastination_and_how/,
1341937109.0,24,pacificwavejiujitsu.com,wc0mz,How Being a Morning Person Can Be More Productive (with Fixes for Night Owls) ,29,5,2,http://www.reddit.com/r/productivity/comments/wc0mz/how_being_a_morning_person_can_be_more_productive/,,,False,,t5_2qh1k,False,,,False,t3_wc0mz,http://pacificwavejiujitsu.com/blog/how-being-a-morning-person-can-be-more-productive-with-fixes-for-night-owls,
1340022663.0,26,samspurlin.com,v7ziv,Make Yourself Uncomfortable to Unlock Your Subconscious Mind,33,7,1,http://www.reddit.com/r/productivity/comments/v7ziv/make_yourself_uncomfortable_to_unlock_your/,,,False,,t5_2qh1k,False,,,False,t3_v7ziv,http://www.samspurlin.com/blog/2012/6/18/make-yourself-uncomfortable-to-unlock-your-subconscious-mind.html,
1339380447.0,22,heydave.org,uvh3z,Introducing the Week Chart,35,13,12,http://www.reddit.com/r/productivity/comments/uvh3z/introducing_the_week_chart/,,,False,,t5_2qh1k,False,,,False,t3_uvh3z,http://heydave.org/post/24857123736/introducing-the-week-chart,
1338592404.0,24,self.productivity,ugdur,"Sparetime and a thousand opportunities, can't decide end up doing nothing really. How to fix this?",30,6,9,http://www.reddit.com/r/productivity/comments/ugdur/sparetime_and_a_thousand_opportunities_cant/,"Not sure if I'm the only one who has this. I tend to have a lot of interests. From making music, over reading to programming and many more. When I'm at work I often think ""if I had spare time now I'd totally do x"". But when I'm back home ""but I wanted do to A and B for quite a while. So maybe I should stick with that. Ugh, my todo list says I should also do Y and Z"". 

As a result I avoid a decision and end up doing nothing. Or playing D3, well at least I am not productive. 

Anyone with some similar experiences? Ideas/lifehacks to get over this?",,False,,t5_2qh1k,False,,,True,t3_ugdur,http://www.reddit.com/r/productivity/comments/ugdur/sparetime_and_a_thousand_opportunities_cant/,
1335273502.0,24,micahcobb.com,spwff,A Cool Trick for Learning from Lectures and Reading | Thinking and Believing,31,7,7,http://www.reddit.com/r/productivity/comments/spwff/a_cool_trick_for_learning_from_lectures_and/,,,False,,t5_2qh1k,False,,,False,t3_spwff,http://micahcobb.com/blog/?p=2389,
1331565052.0,26,htmlgiant.com,qsz0a,100 things to do when you have the time | HTMLGIANT,38,12,3,http://www.reddit.com/r/productivity/comments/qsz0a/100_things_to_do_when_you_have_the_time_htmlgiant/,,,False,,t5_2qh1k,False,,,False,t3_qsz0a,http://htmlgiant.com/random/100-things-to-do-when-you-have-the-time/,
1295444002.0,22,ryanwaggoner.com,f5392,135 days of getting up at 345am (and how I fell off the wagon),33,11,12,http://www.reddit.com/r/productivity/comments/f5392/135_days_of_getting_up_at_345am_and_how_i_fell/,,,False,,t5_2qh1k,False,,,False,t3_f5392,http://ryanwaggoner.com/2011/01/135-days-of-getting-up-at-345am-and-how-i-fell-off-the-wagon/,
1293123317.0,24,ryanwaggoner.com,eqi9s,You will not be a different person tomorrow,27,3,5,http://www.reddit.com/r/productivity/comments/eqi9s/you_will_not_be_a_different_person_tomorrow/,,,False,,t5_2qh1k,False,,,False,t3_eqi9s,http://ryanwaggoner.com/2010/12/you-will-not-be-a-different-person-tomorrow/,
1283253474.0,25,freestylemind.com,d7nso,13 Routines For Improving Your Life,25,0,0,http://www.reddit.com/r/productivity/comments/d7nso/13_routines_for_improving_your_life/,,,False,,t5_2qh1k,False,,,False,t3_d7nso,http://freestylemind.com/routines-for-improving-your-life,
1276960168.0,24,pomodorotechnique.com,cgrds,The Pomodoro Technique,30,6,4,http://www.reddit.com/r/productivity/comments/cgrds/the_pomodoro_technique/,,,False,,t5_2qh1k,False,,,False,t3_cgrds,http://www.pomodorotechnique.com/,
1265732180.0,24,marcandangel.com,azyqb,29 Semi-Productive Things I Do Online When I’m Trying to Avoid Real Work,30,6,1,http://www.reddit.com/r/productivity/comments/azyqb/29_semiproductive_things_i_do_online_when_im/,,,False,,t5_2qh1k,False,,,False,t3_azyqb,http://www.marcandangel.com/2010/02/08/29-semi-productive-things-i-do-online/,
1234138939.0,24,blogs.harvardbusiness.org,7vv32,Why Doing Things Half Right Gives You the Best Results,30,6,3,http://www.reddit.com/r/productivity/comments/7vv32/why_doing_things_half_right_gives_you_the_best/,,,False,,t5_2qh1k,False,,,False,t3_7vv32,http://blogs.harvardbusiness.org/cs/2009/02/for_fullscale_returns_do_thing.html,
1376375368.0,22,self.productivity,1k9hty,Looking for an app to manage projects that are neither urgent nor important (too many brain crack hobbies!),28,6,9,http://www.reddit.com/r/productivity/comments/1k9hty/looking_for_an_app_to_manage_projects_that_are/,"What I would really like to see is a UI for building hierarchical, structured to-do lists (like a Gantt chart, with less detail) and then have the app present a list of tasks on all the projects that aren't waiting on a prerequisite.

The project list should be easy to tweak, and fill in with subtasks in greater detail, in case something more abstract than actionable was added hastily.",,False,,t5_2qh1k,False,,,True,t3_1k9hty,http://www.reddit.com/r/productivity/comments/1k9hty/looking_for_an_app_to_manage_projects_that_are/,
1373796841.0,23,self.productivity,1i9qh3,trying to find name of motivational tool... a sort of productivity ledger?,30,7,9,http://www.reddit.com/r/productivity/comments/1i9qh3/trying_to_find_name_of_motivational_tool_a_sort/,There was this motivational tool I saw once. It was like a bank ledger except instead of deposits and withdrawals you put in actions towards your goal and each hour spent would count as an hourly wage paid towards your envisioned monetary goal. I forget what it was called. Does anyone know?,,False,,t5_2qh1k,False,,,True,t3_1i9qh3,http://www.reddit.com/r/productivity/comments/1i9qh3/trying_to_find_name_of_motivational_tool_a_sort/,
1370650586.0,21,self.productivity,1fwcp6,Is there a resource to train yourself to read progressively more challenging books?,33,12,12,http://www.reddit.com/r/productivity/comments/1fwcp6/is_there_a_resource_to_train_yourself_to_read/,"For all of my life, I have had anxiety towards reading books. I can read complicated  articles just fine, but once something exceeds five pages, I get progressively more frustrated and anxious until I cannot focus anymore. This is bad news since I'm heading off to grad school in about a year. I know that the volume and reading level of the course material is currently too much for me to handle.

So I was wondering if there was a resource online that I could use to motivate myself to start reading middle-school level books, and once I feel comfortable reading at that level, progress to more challenging material until I can read grad school level literature without struggling.

tl;dr I need a resource to make reading challenging books less of a struggle for me
",,False,,t5_2qh1k,False,,,True,t3_1fwcp6,http://www.reddit.com/r/productivity/comments/1fwcp6/is_there_a_resource_to_train_yourself_to_read/,
1370442128.0,23,52weeksofhabits.com,1fq026,Willpower and Habits,24,1,6,http://www.reddit.com/r/productivity/comments/1fq026/willpower_and_habits/,,,False,,t5_2qh1k,False,,,False,t3_1fq026,http://www.52weeksofhabits.com/2013/05/26/willpower-and-habits/,
1366317228.0,23,self.productivity,1cmope,Recommendations for Time Management software?,28,5,9,http://www.reddit.com/r/productivity/comments/1cmope/recommendations_for_time_management_software/,"Something that lets you prioritize tasks/deadlines and develops a todo for you? Something that just lets you see a full picture of whats needed in a good calendar format? 

Thanks!",,False,,t5_2qh1k,False,,,True,t3_1cmope,http://www.reddit.com/r/productivity/comments/1cmope/recommendations_for_time_management_software/,
1366313483.0,24,self.productivity,1cmj5x,Colleague Screwups: Fix them yourself or not?,31,7,13,http://www.reddit.com/r/productivity/comments/1cmj5x/colleague_screwups_fix_them_yourself_or_not/,"How do you guys handle it when you find a screwup by someone you work with? Obviously there are different ways of handling the situation based on the context: is it a minor nuisance or a now-we've-screwed-the-pooch problem, for example? 

Mentors have insisted to me that it's best to point the mistake out to the person who made it ""so that they can learn by fixing it."" Does that make sense to you guys, or is it just fancy-pants talk for 'slow the work down even more'?

Curious to hear the community's thoughts on this.

EDIT: I must say the great, thoughtful responses I've received here have been some of the best I've gotten since I started reading &amp; writing on this sub. Thanks, everyone.",,False,,t5_2qh1k,1366484194.0,,,True,t3_1cmj5x,http://www.reddit.com/r/productivity/comments/1cmj5x/colleague_screwups_fix_them_yourself_or_not/,
1357350658.0,23,franzisk.us,15zgeq,Early-Bird vs Night-Owl: Finding your optimal workflow,27,4,0,http://www.reddit.com/r/productivity/comments/15zgeq/earlybird_vs_nightowl_finding_your_optimal/,,,False,,t5_2qh1k,False,,,False,t3_15zgeq,http://franzisk.us/2013/01/05/early-bird-vs-night-owl-finding-your-optimal-workflow/,
1355002384.0,24,techcrunch.com,14ijyb,Apple Patents A Smart To-Do List That Uses Contextual Information From Your iPhone To Fill The Gaps  |  TechCrunch,29,5,7,http://www.reddit.com/r/productivity/comments/14ijyb/apple_patents_a_smart_todo_list_that_uses/,,,False,,t5_2qh1k,False,,,False,t3_14ijyb,http://techcrunch.com/2012/12/06/apple-patents-a-smart-to-do-list-that-uses-contextual-information-from-your-iphone-to-fill-the-gaps/,
1351478383.0,22,simpleprogrammer.com,1295c9,My 15 Minute Rule to Productivity « Making the Complex Simple,23,1,1,http://www.reddit.com/r/productivity/comments/1295c9/my_15_minute_rule_to_productivity_making_the/,,,False,,t5_2qh1k,False,,,False,t3_1295c9,http://simpleprogrammer.com/2012/10/28/my-15-minute-rule-to-productivity/,
1351228105.0,23,lesswrong.com,123yzb,"Self-empathy as a source of ""willpower""",31,8,0,http://www.reddit.com/r/productivity/comments/123yzb/selfempathy_as_a_source_of_willpower/,,,False,,t5_2qh1k,False,,,False,t3_123yzb,http://lesswrong.com/lw/2yd/selfempathy_as_a_source_of_willpower/,
1347566409.0,23,andyjohansson.com,zu7dn,Morning and night routines - Your foundation,25,2,0,http://www.reddit.com/r/productivity/comments/zu7dn/morning_and_night_routines_your_foundation/,,,False,,t5_2qh1k,False,,,False,t3_zu7dn,http://www.andyjohansson.com/2012/05/morning-night-routines-foundation/,
1346862293.0,22,asianefficiency.com,zedp8,10 Email Filters That Will Reduce Inbox Stress,35,13,0,http://www.reddit.com/r/productivity/comments/zedp8/10_email_filters_that_will_reduce_inbox_stress/,,,False,,t5_2qh1k,False,,,False,t3_zedp8,http://www.asianefficiency.com/email-management/10-email-filters/,
1346157537.0,23,self.productivity,yyibx,What software have you found useful for productivity?,29,6,39,http://www.reddit.com/r/productivity/comments/yyibx/what_software_have_you_found_useful_for/,,,False,,t5_2qh1k,False,,,True,t3_yyibx,http://www.reddit.com/r/productivity/comments/yyibx/what_software_have_you_found_useful_for/,
1341953076.0,22,livemybestlife.com,wci8j,9 Ways to Have More Time,25,3,1,http://www.reddit.com/r/productivity/comments/wci8j/9_ways_to_have_more_time/,,,False,,t5_2qh1k,False,,,False,t3_wci8j,http://www.livemybestlife.com/8-ways-to-have-more-time/,
1341079838.0,25,gooddeedtime.com,vukov,Research shows you'll be more productive by helping others once a week,30,5,3,http://www.reddit.com/r/productivity/comments/vukov/research_shows_youll_be_more_productive_by/,,,False,,t5_2qh1k,False,,,False,t3_vukov,http://www.gooddeedtime.com/,
1340948990.0,24,gurushya.com,vs7lk,5 minute guide to Pomodoro Technique,32,8,5,http://www.reddit.com/r/productivity/comments/vs7lk/5_minute_guide_to_pomodoro_technique/,,,False,,t5_2qh1k,False,,,False,t3_vs7lk,http://gurushya.com/pomodoro-technique/,
1340743492.0,23,buzzfeed.com,vncy0,5 minimalist writing apps compared,26,3,7,http://www.reddit.com/r/productivity/comments/vncy0/5_minimalist_writing_apps_compared/,,,False,,t5_2qh1k,False,,,False,t3_vncy0,http://www.buzzfeed.com/spavis/5-minimalist-writing-applications-which-one-actua,
1339560779.0,24,heydave.org,uz9hd,Get in the zone by learning to say no.,35,11,4,http://www.reddit.com/r/productivity/comments/uz9hd/get_in_the_zone_by_learning_to_say_no/,,,False,,t5_2qh1k,False,,,False,t3_uz9hd,http://heydave.org/post/25003098272/get-in-the-zone-by-learning-to-say-no,
1338315484.0,24,lifehacker.com,uaocx,I Want to Make Something on My Day Off,30,6,0,http://www.reddit.com/r/productivity/comments/uaocx/i_want_to_make_something_on_my_day_off/,,,False,,t5_2qh1k,False,,,False,t3_uaocx,http://lifehacker.com/5913435/i-want-to-make-something-on-my-day-off,
1336656741.0,23,wakeupdeadman.com,tgfsb,"To Reclaim your Time, Control your Spending",30,7,2,http://www.reddit.com/r/productivity/comments/tgfsb/to_reclaim_your_time_control_your_spending/,,,False,,t5_2qh1k,False,,,False,t3_tgfsb,http://www.wakeupdeadman.com/2012/05/07/to-reclaim-your-time-control-your-spending/,
