created_utc,score,domain,id,title,ups,downs,num_comments,permalink,selftext,link_flair_text,over_18,thumbnail,subreddit_id,edited,link_flair_css_class,author_flair_css_class,is_self,name,url,distinguished
1231267815.0,16,nytimes.com,7nt6q,Mind - Some Protect the Ego by Working on Their Excuses Early - NYTimes.com,17,1,2,http://www.reddit.com/r/productivity/comments/7nt6q/mind_some_protect_the_ego_by_working_on_their/,,,False,,t5_2qh1k,False,,,False,t3_7nt6q,http://www.nytimes.com/2009/01/06/health/06mind.html?ref=health,
1228344893.0,17,43folders.com,7h7y0,Real Advice Hurts,21,4,3,http://www.reddit.com/r/productivity/comments/7h7y0/real_advice_hurts/,,,False,,t5_2qh1k,False,,,False,t3_7h7y0,http://www.43folders.com/2008/12/03/real-advice-hurts,
1227764761.0,17,toothpastefordinner.com,7fyor,Gettin' Crap Done,26,9,0,http://www.reddit.com/r/productivity/comments/7fyor/gettin_crap_done/,,,False,,t5_2qh1k,False,,,False,t3_7fyor,http://www.toothpastefordinner.com/112708/gettin-crap-done.gif,
1225305524.0,18,productiveflourishing.com,7a4ls,Do You Have an Idea Garden?,22,4,2,http://www.reddit.com/r/productivity/comments/7a4ls/do_you_have_an_idea_garden/,,,False,,t5_2qh1k,False,,,False,t3_7a4ls,http://www.productiveflourishing.com/do-you-have-an-idea-garden/,
1216847785.0,16,belifesavvy.com,6t5kh,Inbox Zen with the three folder email system,27,11,9,http://www.reddit.com/r/productivity/comments/6t5kh/inbox_zen_with_the_three_folder_email_system/,,,False,,t5_2qh1k,False,,,False,t3_6t5kh,http://belifesavvy.com/2008/07/23/inbox-zen-with-the-three-folder-email-system/,
1375846645.0,18,self.productivity,1juz9u,Being productive on my days off?,19,1,4,http://www.reddit.com/r/productivity/comments/1juz9u/being_productive_on_my_days_off/,"Hey everyone. I wanted to get some tips on how to stay productive when I'm not working my regular full time job. 



I work roughly 43 hours a week at a restaurant from Wednesday to Sunday. With this schedule I work doubles on Fridays, Saturdays, and Sundays since it's the busiest time of the week. Meanwhile on my days off, I'm a graphic designer on the side. While I get my work done for my clients at the time promised, I find it hard to keep my creativity going on my off days (Mondays and Tuesdays) and find myself being distracted with errands or general laziness. 



I try making to-do lists but they usually get cast aside. Waking up in the morning, I try do a bit of a workout routine, but that's about as far as my diligence goes when there isn't anything pending on my design plate.



Am I burning myself out? I'm looking all the time for a new job so I don't have to work these crazy hours but I need something to break this cycle now. I find I'm always more creative on the days where I have work in the evening and by the time Sunday rolls around, the spark goes out.",,False,,t5_2qh1k,False,,,True,t3_1juz9u,http://www.reddit.com/r/productivity/comments/1juz9u/being_productive_on_my_days_off/,
1372703671.0,16,self.productivity,1hfwvd,"looking for iPhone app that vibrates or beeps at set intervals. NOT Buzz Clock, it just doesn't work for some reason on my phone.",19,3,4,http://www.reddit.com/r/productivity/comments/1hfwvd/looking_for_iphone_app_that_vibrates_or_beeps_at/,"I could just set alarms that vibrate, but if there's an app, that'd be great.",,False,,t5_2qh1k,False,,,True,t3_1hfwvd,http://www.reddit.com/r/productivity/comments/1hfwvd/looking_for_iphone_app_that_vibrates_or_beeps_at/,
1367498465.0,16,self.productivity,1djpmq,Rapidly create lists and sync with Dropbox (iPhone app),22,6,5,http://www.reddit.com/r/productivity/comments/1djpmq/rapidly_create_lists_and_sync_with_dropbox_iphone/,"Try it for free: https://itunes.apple.com/us/app/listacular-for-dropbox-rapid/id624606571?ls=1&amp;mt=8
 


Listacular is a streamlined list and note app with Dropbox sync (txt). With Listacular, you can rapidly create to-do's, outline projects, or take notes. Since it syncs with Dropbox, you can pick up and work on your lists from anywhere. The coolest part is that you can share lists with others and collaborate on lists (imagine a shared grocery list with your friend/partner).",,False,,t5_2qh1k,False,,,True,t3_1djpmq,http://www.reddit.com/r/productivity/comments/1djpmq/rapidly_create_lists_and_sync_with_dropbox_iphone/,
1367266446.0,14,guardian.co.uk,1dcz4g,'Find what you love and let it kill you',19,5,4,http://www.reddit.com/r/productivity/comments/1dcz4g/find_what_you_love_and_let_it_kill_you/,,,False,,t5_2qh1k,False,,,False,t3_1dcz4g,http://www.guardian.co.uk/music/musicblog/2013/apr/26/james-rhodes-blog-find-what-you-love,
1365713197.0,17,self.productivity,1c5r8e,How do you encourage--or lead--your team(mates)?,23,6,5,http://www.reddit.com/r/productivity/comments/1c5r8e/how_do_you_encourageor_leadyour_teammates/,"I have colleagues on my team who I can sometimes see flagging in their energy and focus. Obviously this is a problem I (and maybe you) face too--but I've found tools and strategies that can really help me steer myself back into realms of focus and manage my energy better. It works for me, and I get lots done.

But motivating other people is a different story. I've got a handful of ideas I've put to use doing community organizing to motivate people, but I'd love to hear how people in /r/productivity have worked to motivate, energize, encourage and lead other members of teams they've been a part of. What's the story?",,False,,t5_2qh1k,False,,,True,t3_1c5r8e,http://www.reddit.com/r/productivity/comments/1c5r8e/how_do_you_encourageor_leadyour_teammates/,
1363250597.0,16,tosbourn.com,1a9wlb,How I got my links out of Google Reader,21,5,3,http://www.reddit.com/r/productivity/comments/1a9wlb/how_i_got_my_links_out_of_google_reader/,,,False,,t5_2qh1k,False,,,False,t3_1a9wlb,http://tosbourn.com/2013/03/web-stuff/how-i-got-my-links-out-of-google-reader/,
1357949221.0,16,blog.alexmaccaw.com,16erft,Life TODO,18,2,3,http://www.reddit.com/r/productivity/comments/16erft/life_todo/,,,False,,t5_2qh1k,False,,,False,t3_16erft,http://blog.alexmaccaw.com/life-todo,
1357169573.0,16,self.productivity,15urbr,Trying to pin down a nomenclature,20,4,8,http://www.reddit.com/r/productivity/comments/15urbr/trying_to_pin_down_a_nomenclature/,"Hi Everyone. I guess I'm here because of my new years resolution of being a better human/getting shit handled/deeply engaging with life.  

I've seen stuff before, but I was wondering if there is a list of ""life areas"" that I could sit down and work off of.  Something that gives me a pretty solid template of ""life"" so I can know and tell that I am making gains in every area of my life.

Some off the top of my head are money/finances, fitness, creativity.

Thanks",,False,,t5_2qh1k,False,,,True,t3_15urbr,http://www.reddit.com/r/productivity/comments/15urbr/trying_to_pin_down_a_nomenclature/,
1354769298.0,18,self.productivity,14d8wu,Keeping track of notes on Computer,21,3,13,http://www.reddit.com/r/productivity/comments/14d8wu/keeping_track_of_notes_on_computer/,"I browse Reddit a lot, and have been trying to put it to good use. There's A LOT of good content on Reddit. There's a lot of good words of motivation, fitness tips, etc etc. What's a good way to organize all this information on the computer? I don't want to write all these things down. Something I can add on to very easily. Thanks a lot!

EDIT: It's not videos or pictures, it's just text. What good note taking programs should I consider? I don't want to save text to notepad... Notepad looks ugly.",,False,,t5_2qh1k,False,,,True,t3_14d8wu,http://www.reddit.com/r/productivity/comments/14d8wu/keeping_track_of_notes_on_computer/,
1352901002.0,16,self.productivity,136i0k,"So /r/productivity, what is YOUR routine!?",18,2,20,http://www.reddit.com/r/productivity/comments/136i0k/so_rproductivity_what_is_your_routine/,Tell me about it! ,,False,,t5_2qh1k,False,,,True,t3_136i0k,http://www.reddit.com/r/productivity/comments/136i0k/so_rproductivity_what_is_your_routine/,
1352306337.0,15,samspurlin.com,12sxub,Utilizing Space to Improve Your Work,18,3,0,http://www.reddit.com/r/productivity/comments/12sxub/utilizing_space_to_improve_your_work/,,,False,,t5_2qh1k,False,,,False,t3_12sxub,http://www.samspurlin.com/blog/2012/11/7/utilizing-space-to-improve-your-work.html,
1347754576.0,15,chrome.google.com,zy6ts,Tabminder: Stop distracted browsing before it starts. (Google Chrome extension),18,3,4,http://www.reddit.com/r/productivity/comments/zy6ts/tabminder_stop_distracted_browsing_before_it/,,,False,,t5_2qh1k,False,,,False,t3_zy6ts,https://chrome.google.com/webstore/detail/haffdbbhnmojclpkpmjhpdflflienkmk,
1343582366.0,15,lishennair.com,xcj1g,How to deal with stressful people in the office,20,5,1,http://www.reddit.com/r/productivity/comments/xcj1g/how_to_deal_with_stressful_people_in_the_office/,,,False,,t5_2qh1k,False,,,False,t3_xcj1g,http://www.lishennair.com/2012/07/how-to-deal-with-panic-mechanic.html,
1343497471.0,17,self.productivity,xazqi,My Productivity App Idea,24,7,11,http://www.reddit.com/r/productivity/comments/xazqi/my_productivity_app_idea/,"Hi.

tl;dr I want to write a productivity application that monitors how much you get done and implements various strategies to try to increase that. An individual user could monitor how different strategies affected their productivity. As a group, users could choose to share their anonymous numerical data of their success (or otherwise) so that we can predict which strategies are likely to make the biggest difference to the most people.

The long version:

I suck at keeping on top of my jobs and I suck at motivating myself to get stuff done. I don't think I'm the only one out there. I want to improve this, and am wondering if technology could help. Here's my idea.

We write an app that provides basic task management. You tell it what you need to do and when you actually get stuff done. Something like taskwarrior or todo.txt. The simpler and cleaner the better. No tags, no start dates, no context lists, no ABC priorities etc. Most importantly, it would rate your ""productivity"" from day-to-day i.e. how much shit you're getting done each day.

Then, people write plugins on top of that core. Plugins could do any number of things to implement hacks or strategies to increase productivity:

* Store more information about tasks, such as which context they should be done in (like GTD) or what priority you attach to a task (like ABC analysis);
* Note when a task has been on your list for a long time, and add tasks to your list to try to deal with that (e.g ""Consider breaking down task X into smaller tasks"" or ""Journal about why you may be resisting task X"");
* Remind you to do stuff by sending you SMS messages or IM messages;
* Make a list of rewards and put one of those on your list every now and again;
* Decide at the start of the day what tasks you want to get done and then promise yourself you will go and play when you've finished;
* Remind you to take a break every so often;
* Add specific one off tasks on an irregular basis (say yearly), such as ""Thoroughly tidy your work space"";
* Ask you to write down why you're doing what you're doing when you enter the task;
* Add a daily habit to your list (e.g meditation or exercise);
* Precommit to some task or goal (like Stickk)
* And lots and lots of other things for other people to think of...

Over a period of time, a user could obtain statistics on their productivity using different plugins. From there, they could use the plugins that maximised their productivity. They could also develop new plugins based on the most successful of the ones they'd already used.

For those users that wanted to, they could anonymously share the numerical results of using certain plugins. Again, over time, a picture would hopefully develop of the most effective plugins. Further, the app could even use affinity analysis (like Amazon's recommendations) to say something like: ""You found plugin A effective. Other users who liked plugin A, also liked plugins B, C and D.""

The app could even be put on autopilot, adding plugins automagically based upon the anonymously submitted statistics of others.

Gentle readers of r/productivity, what are your thoughts and comments on my suggestion?",,False,,t5_2qh1k,False,,,True,t3_xazqi,http://www.reddit.com/r/productivity/comments/xazqi/my_productivity_app_idea/,
1341860043.0,16,bits.blogs.nytimes.com,wa809,Email increases stress and drastically diminishes productivity,21,5,4,http://www.reddit.com/r/productivity/comments/wa809/email_increases_stress_and_drastically_diminishes/,,,False,,t5_2qh1k,False,,,False,t3_wa809,http://bits.blogs.nytimes.com/2012/07/08/life%E2%80%99s-too-short-for-so-much-e-mail/?ref=business,
1340388564.0,16,appfluence.com,vg2cg,What ocean swimming taught me about goal setting,22,6,2,http://www.reddit.com/r/productivity/comments/vg2cg/what_ocean_swimming_taught_me_about_goal_setting/,,,False,,t5_2qh1k,False,,,False,t3_vg2cg,http://www.appfluence.com/productivity/what-ocean-swimming-taught-me-about-goal-setting/,
1338985186.0,16,stevecorona.com,untxn,On Keeping a Journal,22,6,2,http://www.reddit.com/r/productivity/comments/untxn/on_keeping_a_journal/,,,False,,t5_2qh1k,False,,,False,t3_untxn,http://stevecorona.com/on-keeping-a-journal/,
1328652401.0,17,self.productivity,pf9xo,Can I pick Your Minds for An Idea?,22,5,22,http://www.reddit.com/r/productivity/comments/pf9xo/can_i_pick_your_minds_for_an_idea/,"Hey responsible redditors,

I'm currently a college student and I'm teaching myself some programming. My main problem is coming up with good ideas for things to build.

I love productivity as well as goal setting so I was wondering if anyone has some ideas for a website that aims to help your productivity, or something along those lines.

If this comes off as spam I'm truly sorry. I just need some ideas for something to make and I would really appreciate any help or suggestions.

Thanks for taking the time to read this!",,False,,t5_2qh1k,True,,,True,t3_pf9xo,http://www.reddit.com/r/productivity/comments/pf9xo/can_i_pick_your_minds_for_an_idea/,
1327954875.0,16,edition.cnn.com,p3fs0,50 New Tech Tools You Should Know About,24,8,0,http://www.reddit.com/r/productivity/comments/p3fs0/50_new_tech_tools_you_should_know_about/,,,False,,t5_2qh1k,False,,,False,t3_p3fs0,http://edition.cnn.com/2012/01/25/tech/web/50-tech-tools/index.html,
1327625412.0,16,productify.me,oyetk,"I'm making a website to help keep projects moving along, it's not done but what do you think so far?",22,6,10,http://www.reddit.com/r/productivity/comments/oyetk/im_making_a_website_to_help_keep_projects_moving/,,,False,,t5_2qh1k,False,,,False,t3_oyetk,http://productify.me/,
1326319925.0,17,self.productivity,ocymm,How do you organize your hard drive?,25,8,17,http://www.reddit.com/r/productivity/comments/ocymm/how_do_you_organize_your_hard_drive/,"I was wondering how do you guys organize all your files on your computer: Kits, Music, Photos, Movies, Videos, Work, Projects, Training material etc.

I know things are different on Windows and on UNIX based OSs so please explain. I currently feel my computer is a mess.",,False,,t5_2qh1k,False,,,True,t3_ocymm,http://www.reddit.com/r/productivity/comments/ocymm/how_do_you_organize_your_hard_drive/,
1324419324.0,16,self.productivity,nkf95,How do you keep track of your goals?,20,4,16,http://www.reddit.com/r/productivity/comments/nkf95/how_do_you_keep_track_of_your_goals/,,,False,,t5_2qh1k,False,,,True,t3_nkf95,http://www.reddit.com/r/productivity/comments/nkf95/how_do_you_keep_track_of_your_goals/,
1318544582.0,17,thinksimplenow.com,lbcj3,15 Tips for Writing Effective Email,21,4,2,http://www.reddit.com/r/productivity/comments/lbcj3/15_tips_for_writing_effective_email/,,,False,,t5_2qh1k,False,,,False,t3_lbcj3,http://thinksimplenow.com/productivity/15-tips-for-writing-effective-email/,
1313766180.0,16,self.productivity,jnws6,A Tip for the Forgetful.,28,12,25,http://www.reddit.com/r/productivity/comments/jnws6/a_tip_for_the_forgetful/,"Hey all. I have been using this sub-reddit and others for a while for motivation and general tips on how to lead a more efficient and effective lifestyle. Here's a tip on something I've discovered that's easy to implement but very useful, at least for me. It's not new or novel, but it is useful.

I struggle from being forgetful, and I'm sure many of you do as well. It's normal. Everyday you have things you plan to accomplish but the day doesn't ever go as planned. We are constantly met with new tasks and problems, minor or major, that we must deal with on the fly. These things paired with those we've already planned to do, can make a day cluttered. Remembering everything can be next to impossible, and doing it all in a time-efficient manner is worse.

The easy tip to combat this clutter, I've realized, is to write things down. As I head out to run my errands or go to work or school, I have a pad of post-its and a pen. That's all it takes, some blank paper and a writing utensil. I realized I'm often planning late at night the day before, so I've taken to writing down my plans at this time.

I write down everything I want to remember to absolutely do in little blurbs. ""fix sink,"" ""return shoes,"" ""fix your CV,"". Easy things that I keep planning on doing, but can easily be put off until the next day.

The benefits of writing things down are threefold. First of all, you don't have to constantly remind yourself of your plans. You have it written down. It might not seem like much but being able to focus on the task at hand knowing it's impossible to forget any other planned activities is  relaxing. Furthermore, having it written down in front of you will entice you to get that thing done *right now*. You realize what you have, and since it's in writing it's a real task, not just a mental note that you can disregard. I've accomplished so many things sooner than I would have if I hadn't written it down. Lastly, and most importantly, when you are met with new tasks as the day goes on, just add it to the list and now you can't forget that either, and it gains the first two benefits I've stated too.

I know this sounds kind of nutty. Writing things down can't persuade you to accomplish them, right? I thought the same, but you'd be surprised how much more willing you are to do things that are listed in the real world as opposed to just in your mind. The best though, is completing a task, and crossing it off. As the day goes on and more tasks are crossed off, as menial as they may be, you can really be *shown* how well you used the time you had in the day.

Anyway,  this is just a suggestion, and I hope you guys give it a try. It really helped me with my daily planning and forgetfulness, and I believe it can help others too.
",,False,,t5_2qh1k,False,,,True,t3_jnws6,http://www.reddit.com/r/productivity/comments/jnws6/a_tip_for_the_forgetful/,
1310766441.0,18,blog.idonethis.com,iqsqk,The Seinfeld Productivity Secret Meets Getting Things Done,22,4,4,http://www.reddit.com/r/productivity/comments/iqsqk/the_seinfeld_productivity_secret_meets_getting/,,,False,,t5_2qh1k,False,,,False,t3_iqsqk,http://blog.idonethis.com/post/7625037098/how-i-ran-a-quarter-marathon,
1296251982.0,16,youtube.com,fazpl,Why work doesn't happen at work ,17,1,0,http://www.reddit.com/r/productivity/comments/fazpl/why_work_doesnt_happen_at_work/,,,False,,t5_2qh1k,False,,,False,t3_fazpl,http://www.youtube.com/watch?v=5XD2kNopsUs,
1292805170.0,18,youtube.com,eoijs,Irresistable Instant Motivation,19,1,8,http://www.reddit.com/r/productivity/comments/eoijs/irresistable_instant_motivation/,,,False,,t5_2qh1k,False,,,False,t3_eoijs,http://www.youtube.com/watch?v=dpS_cJP5nzs,
1284412072.0,17,dustyreagan.com,dddhc,Life-hacking Productivity Tip #1: You're gonna die,22,5,1,http://www.reddit.com/r/productivity/comments/dddhc/lifehacking_productivity_tip_1_youre_gonna_die/,,,False,,t5_2qh1k,False,,,False,t3_dddhc,http://dustyreagan.com/life-hacking-productivity-tip-1-youre-gonna-die/comment-page-1/,
1279641742.0,15,kalzumeus.com,crnws,"Work Less, Get More Done (Analytics For Maximizing Productivity)",18,3,0,http://www.reddit.com/r/productivity/comments/crnws/work_less_get_more_done_analytics_for_maximizing/,,,False,,t5_2qh1k,False,,,False,t3_crnws,http://www.kalzumeus.com/2009/10/04/work-smarter-not-harder/,
1271191236.0,16,imgur.com,bqglx,/r/productivity now has 4000 unproductive members :),22,6,5,http://www.reddit.com/r/productivity/comments/bqglx/rproductivity_now_has_4000_unproductive_members/,,,False,,t5_2qh1k,False,,,False,t3_bqglx,http://imgur.com/3druq.jpg,
1261153727.0,15,mywifequitherjob.com,ag6w3,How To Find Time To Start A Side Business | MyWifeQuitHerJob.com,27,12,1,http://www.reddit.com/r/productivity/comments/ag6w3/how_to_find_time_to_start_a_side_business/,,,False,,t5_2qh1k,False,,,False,t3_ag6w3,http://mywifequitherjob.com/how-to-find-time-to-start-a-side-business/,
1256840745.0,16,sidsavara.com,9z3a7,Seven Reasons You Check Email So Frequently - And How To Stop,17,1,1,http://www.reddit.com/r/productivity/comments/9z3a7/seven_reasons_you_check_email_so_frequently_and/,,,False,,t5_2qh1k,False,,,False,t3_9z3a7,http://sidsavara.com/personal-development/seven-reasons-you-check-email-so-frequently-and-how-to-stop,
1254969452.0,17,youtube.com,9rweh,Procrastination... results from a slave-master relationship imposed on us as children,21,4,8,http://www.reddit.com/r/productivity/comments/9rweh/procrastination_results_from_a_slavemaster/,,,False,,t5_2qh1k,False,,,False,t3_9rweh,http://www.youtube.com/watch?v=h1WC6hNTONg,
1244411270.0,18,theemotionmachine.com,8qjz1,Why Breaks Are Just As Important As Work,21,3,2,http://www.reddit.com/r/productivity/comments/8qjz1/why_breaks_are_just_as_important_as_work/,,,False,,t5_2qh1k,False,,,False,t3_8qjz1,http://www.theemotionmachine.com/?p=242,
1242833667.0,15,organizeit.co.uk,8lwbo,The 5 Big Reasons Why You Fall Off The Productivity Wagon,19,4,5,http://www.reddit.com/r/productivity/comments/8lwbo/the_5_big_reasons_why_you_fall_off_the/,,,False,,t5_2qh1k,False,,,False,t3_8lwbo,http://www.organizeit.co.uk/2009/04/21/the-5-big-reasons-why-you-fall-off-the-productivity-wagon/,
1242314354.0,16,vandelaydesign.com,8kgn9,15 Steps To A More Productive Workday,18,2,2,http://www.reddit.com/r/productivity/comments/8kgn9/15_steps_to_a_more_productive_workday/,,,False,,t5_2qh1k,False,,,False,t3_8kgn9,http://vandelaydesign.com/blog/design-process/productive-workday/,
1233060892.0,15,brokegradstudent.com,7sr0p,Procrastinator’s Pie Chart ,21,6,2,http://www.reddit.com/r/productivity/comments/7sr0p/procrastinators_pie_chart/,,,False,,t5_2qh1k,False,,,False,t3_7sr0p,http://www.brokegradstudent.com/procrastinators-pie-chart/,
1223739252.0,18,tools-for-thought.com,76k6f,Time Management vs. Task Management,21,3,0,http://www.reddit.com/r/productivity/comments/76k6f/time_management_vs_task_management/,,,False,,t5_2qh1k,False,,,False,t3_76k6f,http://tools-for-thought.com/2008/10/06/time-management-vs-task-management/,
1223593445.0,17,productiveflourishing.com,76939,"Time, Creativity, and Metaprojects",26,9,0,http://www.reddit.com/r/productivity/comments/76939/time_creativity_and_metaprojects/,,,False,,t5_2qh1k,False,,,False,t3_76939,http://www.productiveflourishing.com/time-creativity-and-metaprojects/,
1218040224.0,15,pluginid.com,6v5u9,Beginner’s Guide to Meditation,20,5,0,http://www.reddit.com/r/productivity/comments/6v5u9/beginners_guide_to_meditation/,,,False,,t5_2qh1k,False,,,False,t3_6v5u9,http://www.pluginid.com/beginners-guide-to-meditation/,
1373845279.0,17,gist.github.com,1iaz0m,WorkRPG - Collaborative Document to Provide RPG Elements to your Workplace.,23,6,4,http://www.reddit.com/r/productivity/comments/1iaz0m/workrpg_collaborative_document_to_provide_rpg/,,,False,,t5_2qh1k,False,,,False,t3_1iaz0m,https://gist.github.com/sdwrage/5996593,
1373239891.0,14,self.productivity,1htv3f,Anyone use Sharepoint for personal use?,20,6,13,http://www.reddit.com/r/productivity/comments/1htv3f/anyone_use_sharepoint_for_personal_use/,"At work we use sharepoint as a tool to update each other on project progression, shift handovers and filling in internal forms. Seems like a very flexible tool and something I can see myself using for my own use, be it for - online journal, document backup, personal project management etc. The best part I think is everything is centralized. 

I've been googling but can't find any information on people using it for their personal stuffs. 

What do you guys think ?",,False,,t5_2qh1k,False,,,True,t3_1htv3f,http://www.reddit.com/r/productivity/comments/1htv3f/anyone_use_sharepoint_for_personal_use/,
1371519711.0,16,samspurlin.com,1gk2lp,Cultivating More Than One Way to Work,20,4,0,http://www.reddit.com/r/productivity/comments/1gk2lp/cultivating_more_than_one_way_to_work/,,,False,,t5_2qh1k,False,,,False,t3_1gk2lp,http://www.samspurlin.com/blog/2013/6/17/cultivating-more-than-one-way-to-work.html,
