created_utc,score,domain,id,title,ups,downs,num_comments,permalink,selftext,link_flair_text,over_18,thumbnail,subreddit_id,edited,link_flair_css_class,author_flair_css_class,is_self,name,url,distinguished
1330970755.0,42,self.productivity,qiu0q,So how do you actually do stuff you like?,48,6,33,http://www.reddit.com/r/productivity/comments/qiu0q/so_how_do_you_actually_do_stuff_you_like/,"Being (non)productive at work is one thing, but how do you manage to be ""productive"" in private areas of life?

I for one am one of those people who, as it turns out, like to daydream about their hobbies more than actually doing them. I like photography, cooking, programming, playing music, watching movies, biking and playing other sports, gaming and whatnot. However, I've not touched my guitar for months, I rode my bike ONCE in the entire last year, I photograph only when there's an actual ""well this should be documented"" occasion and I rarely ever manage to push myself to do some developing at home. 

If I'm home straight from work I have 5-6 hours before I go to sleep at best. In that time I have to squeeze in cooking and eating something, hanging out with my family at least a little bit, and lately there's more and more work to be done. On a different day I'll hang out after work, where I'll have no more than maybe 2-3 hours of time before going to bed.

So how the heck do you manage your hobbies? 

edit: Thank you all for your kind replies. I guess there's no better way than actually forcing yourself to do stuff. I can proudly say I played my guitar yesterday after months of pausing, and yes, it felt really good.",,False,,t5_2qh1k,True,,,True,t3_qiu0q,http://www.reddit.com/r/productivity/comments/qiu0q/so_how_do_you_actually_do_stuff_you_like/,
1330041628.0,42,i.imgur.com,q3a0b,This feels wrong...  but so right.,49,7,11,http://www.reddit.com/r/productivity/comments/q3a0b/this_feels_wrong_but_so_right/,,,False,,t5_2qh1k,False,,,False,t3_q3a0b,http://i.imgur.com/SrZrh.jpg,
1324311335.0,39,budibar.com,nilg1,Brain Food For Exams: What MIT Students Eat and Drink During Finals Week,48,9,2,http://www.reddit.com/r/productivity/comments/nilg1/brain_food_for_exams_what_mit_students_eat_and/,,,False,,t5_2qh1k,False,,,False,t3_nilg1,http://www.budibar.com/2011/12/19/brain-food-for-exams-final-exams-what-mit-says-to-eat-and-drink-before-the-big-exam/,
1319479134.0,41,self.productivity,lncbi,DAE only become productive after you shower in the morning,50,9,14,http://www.reddit.com/r/productivity/comments/lncbi/dae_only_become_productive_after_you_shower_in/,Wondering if it's just me,,False,,t5_2qh1k,False,,,True,t3_lncbi,http://www.reddit.com/r/productivity/comments/lncbi/dae_only_become_productive_after_you_shower_in/,
1365614795.0,39,msoutlookit.com,1c2pfw,"This might *ruin* your productivity, but it's cool: Reddit via Fake Outlook",74,35,19,http://www.reddit.com/r/productivity/comments/1c2pfw/this_might_ruin_your_productivity_but_its_cool/,,,False,,t5_2qh1k,False,,,False,t3_1c2pfw,http://msoutlookit.com/,
1360731902.0,39,imgur.com,18ffbi,Found possibly the first effective planning and reflection strategy that might work to get my shit together,50,11,7,http://www.reddit.com/r/productivity/comments/18ffbi/found_possibly_the_first_effective_planning_and/,,,False,,t5_2qh1k,False,,,False,t3_18ffbi,http://imgur.com/gjbwl2d,
1358180877.0,37,thehackedmind.com,16k27s,It Gets Worse Before it Gets Better,52,15,2,http://www.reddit.com/r/productivity/comments/16k27s/it_gets_worse_before_it_gets_better/,,,False,,t5_2qh1k,False,,,False,t3_16k27s,http://www.thehackedmind.com/it-gets-worse-before-it-gets-better/,
1343911251.0,43,hanselman.com,xk6fi,Productivity vs. Guilt and Self-Loathing,44,1,0,http://www.reddit.com/r/productivity/comments/xk6fi/productivity_vs_guilt_and_selfloathing/,,,False,,t5_2qh1k,False,,,False,t3_xk6fi,http://www.hanselman.com/blog/ProductivityVsGuiltAndSelfLoathing.aspx,
1332615012.0,43,howtogetfocused.com,rbocq,"It's been posted to other subreddits, but thought it was good for r/productivity: 8 things to know about concentrating",48,5,3,http://www.reddit.com/r/productivity/comments/rbocq/its_been_posted_to_other_subreddits_but_thought/,,,False,,t5_2qh1k,False,,,False,t3_rbocq,http://howtogetfocused.com/chapters/8-things-everybody-ought-to-know-about-concentrating/,
1327862017.0,41,inc.com,p1wgo,Working overtime doesn't increase your productivity. It makes you stupid.,49,8,4,http://www.reddit.com/r/productivity/comments/p1wgo/working_overtime_doesnt_increase_your/,,,False,,t5_2qh1k,False,,,False,t3_p1wgo,http://www.inc.com/margaret-heffernan/the-truth-about-sleep-and-productivity.html?utm_source=feedburner&amp;utm_medium=feed&amp;utm_campaign=Feed%3A+inc%2Fheadlines+%28Inc.com+Headlines%29,
1374586837.0,40,self.productivity,1ivsxr,Is there a way to block a site so that it can only be used for 1h a day?,53,13,25,http://www.reddit.com/r/productivity/comments/1ivsxr/is_there_a_way_to_block_a_site_so_that_it_can/,"I installed rescutime on my computer and i spend a lot of time on a few sites that i would like to cut down on.

I know about ""block site"" but i need thees sites daily and it doesn't work because i need to unblock them every time when i want to use them and it just gets messy and annoying.

Is there a program that you can put a time limit per day on a site and the only way to change it is to change the block and it will change it after 24h has passed.

If you got any other ideas, maybe own experience then please share i appreciate it!



EDIT: (I use firefox) Thx for all the suggestions i will try them out!
",,False,,t5_2qh1k,1374591351.0,,,True,t3_1ivsxr,http://www.reddit.com/r/productivity/comments/1ivsxr/is_there_a_way_to_block_a_site_so_that_it_can/,
1370120867.0,37,self.productivity,1fhefw,How to stay focused?,54,17,12,http://www.reddit.com/r/productivity/comments/1fhefw/how_to_stay_focused/,"I'm a software developer and often I find it difficult to focus.

Knowledge wise and experience wise I am very good, but when it comes to raw hitting the keyboard producing code I often distract myself and procrastinate on the web.

Please tell me what has worked for you so far that made you more laser focused on a single task.

I would like to hear all sorts of types of advice such as diet, exercise etc.",,False,,t5_2qh1k,False,,,True,t3_1fhefw,http://www.reddit.com/r/productivity/comments/1fhefw/how_to_stay_focused/,
1369790085.0,43,unclutterer.com,1f8lwy,Creating a personalized filing system,48,5,3,http://www.reddit.com/r/productivity/comments/1f8lwy/creating_a_personalized_filing_system/,,,False,,t5_2qh1k,False,,,False,t3_1f8lwy,http://unclutterer.com/2013/05/28/creating-a-personalized-filing-system/,
1362056000.0,42,bbc.co.uk,19e629,Teleworking: The myth of working from home,51,9,7,http://www.reddit.com/r/productivity/comments/19e629/teleworking_the_myth_of_working_from_home/,,,False,,t5_2qh1k,False,,,False,t3_19e629,http://www.bbc.co.uk/news/magazine-21588760,
1360263797.0,43,stentontoledo.com,182vts,How I learned to stop getting distracted and love productivity ,47,4,2,http://www.reddit.com/r/productivity/comments/182vts/how_i_learned_to_stop_getting_distracted_and_love/,,,False,,t5_2qh1k,False,,,False,t3_182vts,http://www.stentontoledo.com/blog/how-i-learned-to-stop-getting-distracted-and-love-productivity/,
1351177333.0,35,technori.com,122gn6,How to Get More Done In a One Day Than You Ever Have Before ,47,12,1,http://www.reddit.com/r/productivity/comments/122gn6/how_to_get_more_done_in_a_one_day_than_you_ever/,,,False,,t5_2qh1k,False,,,False,t3_122gn6,http://technori.com/2012/10/2615-the-ultimate-guide-to-time-management-part-2-add-more-time-to-your-day/,
1294157417.0,39,lesswrong.com,ew1l7,"Working hurts less than procrastinating, but we fear the twinge of [closing Reddit and] starting",40,1,4,http://www.reddit.com/r/productivity/comments/ew1l7/working_hurts_less_than_procrastinating_but_we/,,,False,,t5_2qh1k,False,,,False,t3_ew1l7,http://lesswrong.com/lw/3kv/working_hurts_less_than_procrastinating_we_fear/#more,
1375583656.0,40,chrome.google.com,1jnrsl,Facebook News Feed Eradicator - Chrome Extension to save your brain,49,9,5,http://www.reddit.com/r/productivity/comments/1jnrsl/facebook_news_feed_eradicator_chrome_extension_to/,,,False,,t5_2qh1k,False,,,False,t3_1jnrsl,https://chrome.google.com/webstore/detail/news-feed-eradicator-for/fjcldmjmjhkklehbacihaiopjklihlgg?hl=en,
1370111626.0,37,alexreichert.com,1fh4m2,Develop skills that will make you more marketable,49,12,2,http://www.reddit.com/r/productivity/comments/1fh4m2/develop_skills_that_will_make_you_more_marketable/,,,False,,t5_2qh1k,False,,,False,t3_1fh4m2,http://alexreichert.com/earn/develop-skills/,
1369432318.0,34,samspurlin.com,1ezw8e,Knowing the difference between what you can actually do and what you WISH you could do or think you SHOULD be able to do is pretty huge,49,15,4,http://www.reddit.com/r/productivity/comments/1ezw8e/knowing_the_difference_between_what_you_can/,,,False,,t5_2qh1k,False,,,False,t3_1ezw8e,http://www.samspurlin.com/blog/2013/5/23/achievement-unlocked-master-of-positive-developmental-psycho.html,
1360734632.0,37,self.productivity,18fiag,What's your system for interesting articles you find and want to keep but don't have time to read immediately?,39,2,50,http://www.reddit.com/r/productivity/comments/18fiag/whats_your_system_for_interesting_articles_you/,"I use Google Reader and Readability, but I find that my list grows by 10 articles every day but I can only ever read one or two.

EDIT: I should clarify--I'm not looking for a tool so much as a system (I also use Diigo). I find that I spend a large amount of time opening tab after tab until it gets overwhelming, and then I save them to Readability or Diigo. I feel like this just creates an illusion of productivity.",,False,,t5_2qh1k,1360769655.0,,,True,t3_18fiag,http://www.reddit.com/r/productivity/comments/18fiag/whats_your_system_for_interesting_articles_you/,
1351523631.0,41,lifehacker.com,12a0ij,Pen and paper vs. everything else,42,1,3,http://www.reddit.com/r/productivity/comments/12a0ij/pen_and_paper_vs_everything_else/,,,False,,t5_2qh1k,False,,,False,t3_12a0ij,http://lifehacker.com/5955721/three-ways-ive-simplified-my-life-using-pen-and-paper-instead-of-technology,
1348335837.0,38,gsb.stanford.edu,10azql,"Why creativity rests on diet, exercise, and a good night's sleep",41,3,9,http://www.reddit.com/r/productivity/comments/10azql/why_creativity_rests_on_diet_exercise_and_a_good/,,,False,,t5_2qh1k,False,,,False,t3_10azql,http://www.gsb.stanford.edu/news/research/rx-for-innovation.html,
1330959547.0,39,inspiremyday.com,qilqr,"Not exactly a tip, but a website that helped motivate me to get into a productive state of mind",42,3,1,http://www.reddit.com/r/productivity/comments/qilqr/not_exactly_a_tip_but_a_website_that_helped/,,,False,,t5_2qh1k,False,,,False,t3_qilqr,http://www.inspiremyday.com/,
1259715772.0,37,sivers.org,aa2ll,There's no speed limit. (The lessons that changed my life.) | Derek Sivers,41,4,3,http://www.reddit.com/r/productivity/comments/aa2ll/theres_no_speed_limit_the_lessons_that_changed_my/,,,False,,t5_2qh1k,False,,,False,t3_aa2ll,http://sivers.org/kimo,
1233012109.0,39,westegg.com,7sm5t,An oldie but a goodie: How To Win Friends And Influence People by Dale Carnagie,39,0,3,http://www.reddit.com/r/productivity/comments/7sm5t/an_oldie_but_a_goodie_how_to_win_friends_and/,,,False,,t5_2qh1k,False,,,False,t3_7sm5t,http://www.westegg.com/unmaintained/carnegie/win-friends.html,
1370401312.0,36,self.productivity,1fp4fa,Using a pocket-sized notebook throughout the day,41,5,22,http://www.reddit.com/r/productivity/comments/1fp4fa/using_a_pocketsized_notebook_throughout_the_day/,"Does anyone have use a little notebook to write down notes throughout the day? I always kinda thought I could just use my iPhone for that but it has proven to not be very effective since most of the time I'm too lazy to type it out. I feel a little notebook would be very useful just to jot down small reminders, such as ""pick up milk"" on the way home, or to write down someone's name that I just met. 

For those who have it, how do you use it to its maximum efficiency? For example, do you use only one page a day or just keep writing until the page is full? How often do you check it? What kind of paper does your notebook have? I'm deciding between blank white paper, lined paper, and graph, which each have their own advantages and disadvantages.

Not that the brand matters, but I like the Moleskine one, something like this http://www.amazon.com/Moleskine-Plain-Notebook-Pocket-Classic/dp/8883701038/ref=sr_1_9?ie=UTF8&amp;qid=1370401239&amp;sr=8-9&amp;keywords=moleskine",,False,,t5_2qh1k,False,,,True,t3_1fp4fa,http://www.reddit.com/r/productivity/comments/1fp4fa/using_a_pocketsized_notebook_throughout_the_day/,
1363217180.0,37,self.productivity,1a8zgr,"Motivation for boring, pointless tasks",45,8,28,http://www.reddit.com/r/productivity/comments/1a8zgr/motivation_for_boring_pointless_tasks/,"My company has a policy that once a month, you have to login to your purchasing card account and check boxes next to that month's purchases. This is, of course, in addition to the separate system in place for managerial approval and receipt filing. It serves no purpose in my work, has no monetary benefit for the company or customers, and is, imo, a waste of time. And it's exactly the kind of thing that I will put off until my boss gets a tattling e-mail from the accounting department and tells me to do it. 

This is my problem: my to-do list has become a parking lot for all my tasks that are uninteresting and inconsequential. While this isn't that big a deal, I find it spills up the scale of importance -- first I let stuff slide that doesn't matter, then I let stuff slide that doesn't matter *much*, until I'm procrastinating on all but the most interesting stuff.  It's like deciding one day to stop making your bed because you can spend the time doing something more in line with your goals, and it's just going to get messed up in a few hours anyway. Then you decide to stop putting your dirty clothes in the hamper because you can just pick them all up on laundry day, and all of a sudden you're sleeping on a pile of empty drink cups and pizza boxes, wrapped in a towel because there's no clean underwear. 

But more so than just not being interested in it, I'm actually irritated about having to check those boxes, to remember yet another login, to have another bookmark. I find I really have to spend a lot of mental energy to drag myself to do these kinds of things, it's like talking myself into doing another 3 reps or another quarter mile at the gym. I'm actually mentally tired after I do them, as if I've done hard work. 

So does anyone have any tips or tricks on making those irritating little tasks less stressful? ",,False,,t5_2qh1k,False,,,True,t3_1a8zgr,http://www.reddit.com/r/productivity/comments/1a8zgr/motivation_for_boring_pointless_tasks/,
1361635153.0,37,lessguide.com,192zew,"Always tied up doing things you don't like? Start becoming a ""no"" person. ",50,13,7,http://www.reddit.com/r/productivity/comments/192zew/always_tied_up_doing_things_you_dont_like_start/,,,False,,t5_2qh1k,False,,,False,t3_192zew,http://lessguide.com/always-tied-up-how-to-get-more-done-with-less-free-time/,
1360446066.0,40,examiner.com,187ntk,25 things to do in 5 minutes or less ,69,29,7,http://www.reddit.com/r/productivity/comments/187ntk/25_things_to_do_in_5_minutes_or_less/,,,False,,t5_2qh1k,False,,,False,t3_187ntk,http://www.examiner.com/article/what-can-you-do-5-minutes-top-25-things-to-do-5-minutes-or-less,
1359625258.0,35,roy.roypovarchik.com,17megr,Habits that work - how to easily adapt productive habits,47,12,0,http://www.reddit.com/r/productivity/comments/17megr/habits_that_work_how_to_easily_adapt_productive/,,,False,,t5_2qh1k,False,,,False,t3_17megr,http://roy.roypovarchik.com/2012/11/habits-that-work/,
1354707046.0,36,atlassian.com,14bguq,You waste a lot of time at work,50,14,1,http://www.reddit.com/r/productivity/comments/14bguq/you_waste_a_lot_of_time_at_work/,,,False,,t5_2qh1k,False,,,False,t3_14bguq,http://www.atlassian.com/time-wasting-at-work-infographic,
1353174815.0,36,visitsteve.com,13cxa2,"Hope this isn't a repost, but this little app is the reason I'm currently still in college. about to use it now",46,10,13,http://www.reddit.com/r/productivity/comments/13cxa2/hope_this_isnt_a_repost_but_this_little_app_is/,,,False,,t5_2qh1k,False,,,False,t3_13cxa2,http://visitsteve.com/made/selfcontrol/,
1351016124.0,35,alexanderle.com,11yi2n,Paralyzed By Choice,38,3,1,http://www.reddit.com/r/productivity/comments/11yi2n/paralyzed_by_choice/,,,False,,t5_2qh1k,False,,,False,t3_11yi2n,http://alexanderle.com/blog/2012/paralyzed-by-choice.html,
1346436397.0,38,inboxpause.com,z5aa8,Inbox Pause - A pause button for incoming mail in Gmail,46,8,5,http://www.reddit.com/r/productivity/comments/z5aa8/inbox_pause_a_pause_button_for_incoming_mail_in/,,,False,,t5_2qh1k,False,,,False,t3_z5aa8,http://inboxpause.com/,
1342298618.0,37,blog.toddmedema.com,wkact,"If you aren't passionate, no amount of ""productivity help"" will make you productive",48,11,12,http://www.reddit.com/r/productivity/comments/wkact/if_you_arent_passionate_no_amount_of_productivity/,,,False,,t5_2qh1k,False,,,False,t3_wkact,http://blog.toddmedema.com/if-you-arent-feeling-passionate-stop-working,
1336730989.0,36,corwinolson.com,thz7i,Using small windows of time,41,5,5,http://www.reddit.com/r/productivity/comments/thz7i/using_small_windows_of_time/,,,False,,t5_2qh1k,False,,,False,t3_thz7i,http://www.corwinolson.com/2012/05/10/using-small-windows-of-time/,
1331562662.0,35,sridattalabs.com,qsxgs,Rabbit holes: Why being smart hurts your productivity,46,11,0,http://www.reddit.com/r/productivity/comments/qsxgs/rabbit_holes_why_being_smart_hurts_your/,,,False,,t5_2qh1k,False,,,False,t3_qsxgs,http://sridattalabs.com/2012/02/06/rabbit-holes-being-smart-hurts-prod/,
1328837879.0,34,radiolab.org,piowf,"This may be an hour long, but I found it inspiring: It's the Radiolab episode ""Help!"", and it's about the different ways people kick themselves in the ass to accomplish their most elusive goals.",38,4,4,http://www.reddit.com/r/productivity/comments/piowf/this_may_be_an_hour_long_but_i_found_it_inspiring/,,,False,,t5_2qh1k,False,,,False,t3_piowf,http://www.radiolab.org/2011/mar/08/,
1324546178.0,41,self.productivity,nmgen,Being productive with little to no drive? ,44,3,38,http://www.reddit.com/r/productivity/comments/nmgen/being_productive_with_little_to_no_drive/,"I've never had any. I was bright for high school and college, so I ended up just sailing through most things, banging out papers in a panic 2 hours before they're due, etc. 

But now? Without a full time job, without a direction? I can't get things done and I feel like I'm in a haze.

I try using some of the techniques on here, it works for a bit and then I fail. I just get to the point where I can't find it within me to care and everything collapses. 

I use a blackberry with outlook which seems to have worked the best over the years, otherwise I'd even be missing appointments. Winter depression makes it even worse. I sometime don't even even know where a week has gone. And the whole time stuff keeps piling up. My ""need to do list"" - stuff like taxes from 5 years ago - is hundreds of items long. 

Help? :(",,False,,t5_2qh1k,True,,,True,t3_nmgen,http://www.reddit.com/r/productivity/comments/nmgen/being_productive_with_little_to_no_drive/,
1376234483.0,38,udemy.com,1k5ao4,Improve your meetings with this Udemy course. Free (normally $69) for Reddit readers with the coupon Reddit,59,21,7,http://www.reddit.com/r/productivity/comments/1k5ao4/improve_your_meetings_with_this_udemy_course_free/,,,False,,t5_2qh1k,False,,,False,t3_1k5ao4,https://www.udemy.com/high-payback-meetings-for-startups-managers-team-leaders/,
1367446929.0,36,self.productivity,1dif2i,I record my computer screen and watching it at the end of my day to recap and increase productivity. Is that software you would buy? Looking for feedback.,51,15,29,http://www.reddit.com/r/productivity/comments/1dif2i/i_record_my_computer_screen_and_watching_it_at/,"Hey folks. I wrote some screen-recording software for myself to recap on the day and stay more motivated to be productive while I'm at my computer.

Would this interest you as a product? I'm trying to figure out if I should market it.",,False,,t5_2qh1k,False,,,True,t3_1dif2i,http://www.reddit.com/r/productivity/comments/1dif2i/i_record_my_computer_screen_and_watching_it_at/,
1360885908.0,36,addictivetips.com,18jrlb,"If you use the Calendars iPhone app, you should get this much better version",50,14,13,http://www.reddit.com/r/productivity/comments/18jrlb/if_you_use_the_calendars_iphone_app_you_should/,,,False,,t5_2qh1k,False,,,False,t3_18jrlb,http://www.addictivetips.com/ios/event-book-calendar-app-with-weather-maps-a-flipboard-like-ui/,
1360626279.0,39,nytimes.com,18cadg,Want to be more productive? All you gotta do is relax,46,7,7,http://www.reddit.com/r/productivity/comments/18cadg/want_to_be_more_productive_all_you_gotta_do_is/,,,False,,t5_2qh1k,False,,,False,t3_18cadg,http://www.nytimes.com/2013/02/10/opinion/sunday/relax-youll-be-more-productive.html?smid=tw-share&amp;_r=1&amp;,
1360451356.0,38,thenextweb.com,187th8,A ‘frighteningly ambitious’ way to improve email,43,5,7,http://www.reddit.com/r/productivity/comments/187th8/a_frighteningly_ambitious_way_to_improve_email/,,,False,,t5_2qh1k,False,,,False,t3_187th8,http://thenextweb.com/voice/2013/02/08/inboxpro-com-structured-communications/,
1359520557.0,37,self.productivity,17jkrv,How can I use GTD + notebooks to organise my life?,42,5,35,http://www.reddit.com/r/productivity/comments/17jkrv/how_can_i_use_gtd_notebooks_to_organise_my_life/,"I'm starting a nice new job in a new state, pretty much a clean slate after a recent work fail. This time, I want to be at the top of my game both in work and in my personal life, and not let procrastination and laziness get the better of me. 

I've had a look through various articles about GTD, and the system and its variants intrigues me. However, I want to stay away from computer assisted GTD (as I aim to cut down the amount of time I spend on the computer), and instead use notebooks and a daily planner. 

The daily planner would largely travel between work and my home, while the notebook would stay on my person at all times. I envision the former as a record of daily work, a log of all work to date and a record of meetings and interactions at work. The latter would be more personal, and act as both a second brain (storage wise) and a way to organise my daily life. I'm also considering a weekly journal. 

**TL:DR - Please help me find a good GTD-style system using notebooks so that I don't screw up this rare opportunity.** 

",,False,,t5_2qh1k,False,,,True,t3_17jkrv,http://www.reddit.com/r/productivity/comments/17jkrv/how_can_i_use_gtd_notebooks_to_organise_my_life/,
1358278402.0,36,blog.dispatch.io,16mupp,Your work on X: How various substances affect your productivity.,41,5,1,http://www.reddit.com/r/productivity/comments/16mupp/your_work_on_x_how_various_substances_affect_your/,,,False,,t5_2qh1k,False,,,False,t3_16mupp,http://blog.dispatch.io/post/40615382054/your-work-on-x-how-alcohol-caffeine-and-other,
1349117487.0,34,postmasculine.com,10rurw,Our current generation lacks self-discipline more than almost any generation before us,60,26,15,http://www.reddit.com/r/productivity/comments/10rurw/our_current_generation_lacks_selfdiscipline_more/,,,False,,t5_2qh1k,False,,,False,t3_10rurw,http://postmasculine.com/self-discipline,
1339002247.0,36,zenhabits.net,uo766,The Three-Day Monk Syndrome,39,3,1,http://www.reddit.com/r/productivity/comments/uo766/the_threeday_monk_syndrome/,,,False,,t5_2qh1k,False,,,False,t3_uo766,http://zenhabits.net/3-day-monk/,
1335222331.0,34,self.productivity,soz0e,I just realized,59,25,4,http://www.reddit.com/r/productivity/comments/soz0e/i_just_realized/,That this subreddit is an oxymoron.,,False,,t5_2qh1k,False,,,True,t3_soz0e,http://www.reddit.com/r/productivity/comments/soz0e/i_just_realized/,
1331433476.0,36,youtube.com,qr1j9,Why you will fail to have a great career,47,11,10,http://www.reddit.com/r/productivity/comments/qr1j9/why_you_will_fail_to_have_a_great_career/,,,False,,t5_2qh1k,False,,,False,t3_qr1j9,http://www.youtube.com/watch?v=iKHTawgyKWQ,
1319069419.0,37,chrome.google.com,li3lh,This gem honestly saves my grades,40,3,8,http://www.reddit.com/r/productivity/comments/li3lh/this_gem_honestly_saves_my_grades/,,,False,,t5_2qh1k,False,,,False,t3_li3lh,https://chrome.google.com/webstore/detail/laankejkbhbdhmipfmgcngdelahlfoji,
1241634119.0,38,thinksimplenow.com,8idyq,The 4 Hour Workday,42,4,2,http://www.reddit.com/r/productivity/comments/8idyq/the_4_hour_workday/,,,False,,t5_2qh1k,False,,,False,t3_8idyq,http://thinksimplenow.com/productivity/the-4-hour-workday/,
1374696350.0,38,improvementhub.blogspot.ca,1iz8ip,Use Strategic Pairing to Multitask Effectively,44,6,2,http://www.reddit.com/r/productivity/comments/1iz8ip/use_strategic_pairing_to_multitask_effectively/,,,False,,t5_2qh1k,False,,,False,t3_1iz8ip,http://improvementhub.blogspot.ca/2013/07/strategic-pairing-to-multitask-effectively.html,
1368713412.0,36,reachia.com,1eg8u2,"I've launched a 100% FREE project management network. It's like Basecamp, but free. It's in early stages, but I would love to get some feedback to see if developing a mobile app is worth pursuing. Productive Redditors, please try it out and let me know your thoughts.",41,5,22,http://www.reddit.com/r/productivity/comments/1eg8u2/ive_launched_a_100_free_project_management/,,,False,,t5_2qh1k,False,,,False,t3_1eg8u2,http://reachia.com,
