created_utc,score,domain,id,title,ups,downs,num_comments,permalink,selftext,link_flair_text,over_18,thumbnail,subreddit_id,edited,link_flair_css_class,author_flair_css_class,is_self,name,url,distinguished
1366314035.0,7,self.RBI,1cmjzm,Just received this email,17,10,12,http://www.reddit.com/r/RBI/comments/1cmjzm/just_received_this_email/,I received this email [Imgur](http://i.imgur.com/2fq6WSX). The link actually directs you to h++p://odensefyr.dk/html/vtii/yahoo.com/index.php. When responding to the email i got a failure to send notice. I looked in the upper directory h++p://odensefyr.dk/html/vtii/ and it looks like they plan on doing this for other sites. Can anything be done about this site or at least stop them?,,False,,t5_2tayf,1366317806.0,,,True,t3_1cmjzm,http://www.reddit.com/r/RBI/comments/1cmjzm/just_received_this_email/,
1366223919.0,7,self.RBI,1cjsld,Website similar to itcouldhappentoallof.us from the past: itstartswiththeflu dot com,18,11,1,http://www.reddit.com/r/RBI/comments/1cjsld/website_similar_to_itcouldhappentoallofus_from/,"I found a similar occurrence that was unsolved. (website is now down) itstartswiththeflu.com  I'm not sure if it was failed video game marketing, zombie marketing, a hoax, or a failed attempt at something else.

The only thing that made me make this thread is that GoDaddy hosted this website.  I thought that odd since this one is also hosted by GD and it all has a familiar format...  

Is there any way to investigate this now that the website is gone?

Edit: I know GoDaddy hosts butt-tons of websites, I'm not saying anything conclusive, just pointing out similarities.",,False,,t5_2tayf,1366224745.0,,,True,t3_1cjsld,http://www.reddit.com/r/RBI/comments/1cjsld/website_similar_to_itcouldhappentoallofus_from/,
1365660696.0,7,self.RBI,1c4c4b,Suspect six year old neighbor of being sexually abused by father. How can I locate the mother in China?,8,1,6,http://www.reddit.com/r/RBI/comments/1c4c4b/suspect_six_year_old_neighbor_of_being_sexually/,"American man living in Southeast Asia, Chinese mother, two children.  One child living with mother.  One child with father.  It is almost certain that the father fled with the child and that the mother does not know where they are.  There are many reasons to believe the father is sexually, physically, and emotionally abusing the girl.  The authorities here are useless.  The best thing we could do is locate the mother.  Only then will our authorities investigate.  The family previously lived in the U.S., but it appears as if the mother is in China now, although we can't determine if that is Hong Kong, Taiwan, or mainland China.  The Chinese embassy has not responded to several letters.  Need to brainstorm.   ",,False,,t5_2tayf,False,,,True,t3_1c4c4b,http://www.reddit.com/r/RBI/comments/1c4c4b/suspect_six_year_old_neighbor_of_being_sexually/,
1364339110.0,7,imgur.com,1b2nqj,Need help identifying Make/Model of vehicle pictured as well as license plate details. It's involved in a theft I'm currently investigating.,10,3,9,http://www.reddit.com/r/RBI/comments/1b2nqj/need_help_identifying_makemodel_of_vehicle/,,,False,,t5_2tayf,False,,,False,t3_1b2nqj,http://imgur.com/a/zofeR,
1360803409.0,8,self.RBI,18hdcm,"What can you find out about a person with just a first &amp; last name, cell phone number, and license plate number? ",9,1,17,http://www.reddit.com/r/RBI/comments/18hdcm/what_can_you_find_out_about_a_person_with_just_a/,"Long story short, a lady in an Escalade hit me today while she was turning left.  I'm not hurt, and the damage to my car was minor but will need tending to.  

As soon as we cleared the intersection, she jumped out and offered to pay for the damage to my vehicle and begged me not to call the police.  She seemed very distraught over the police being called so I assumed her husband would be less than pleased with her and I obliged. I handed her my insurance card and she wrote her name and number on it and handed it back.  She searched her car &amp; purse and said that she couldn't find her insurance info.  I took a photo of her damage, my damage, and her plate.

I went straight to a body shop then called her to see where she would like the estimate sent....that's when she got weird on me.  She thought we ""just take care of our own cars"".  But she agreed to see the estimate anyway after I offered to just go ahead and call the police now.  I feel like she isn't going to answer my call tomorrow.",,False,,t5_2tayf,False,,,True,t3_18hdcm,http://www.reddit.com/r/RBI/comments/18hdcm/what_can_you_find_out_about_a_person_with_just_a/,
1357922450.0,7,self.RBI,16dwh1,I Need Your Help Identifying This Guy (Catfish?),7,0,23,http://www.reddit.com/r/RBI/comments/16dwh1/i_need_your_help_identifying_this_guy_catfish/,"**Hi RBI. I made this throwaway last month, and this post.  But the post never received any responses, and never appeared on the subreddit page or search (on my end anyway).  Between that and a major development this morning, I'm posting again in hopes it can be seen and I could get some help.**

**The quoted text is basically my original post with some updated detail changes.  The crazy latest update from this morning is under it.  I apologize for the length, but I wanted to give you guys as much info as possible.**




&gt; In the spring I was contacted by a man from  a dating site.  When he contacted me, I recognized him because we both posted in the forums.
He is originally from my area, NYC, and now lives in SF. Long story short, even though neither of us were looking for anything more than friendship and conversation, it blossomed very quickly to much more.

&gt; His personal story was quite fantastical. Almost unbelievable. From an awful family and love life, to triumphs academically and financially. We spoke every day, a few times a day, for months. Although, it was a lot to take in, I never could pinpoint a reason to doubt him.

&gt; Two months into our exchange, his personal life was thrown a major monkey wrench. However, it never swayed him from wanting to fly out to see me (or offering to pay for me to come out there) and trying to make a relationship work. A couple of weeks before we are suppose to meet, he said his life was going to be changing too much (because of the monkey wrench), and we should cut things off and ot would be easier for him to have us never speak again. He pretty much cried during the conversation.  It didn't make any sense and my attempts to reach him since have been futile.

&gt; I'm sure most of you are thinking, ""who cares, just drop it"". I can't. His story and what happened was just too weird. I'm not sure how much I can get into the details, but it is-- please trust me. Also, if certain things he told me are truthful, they are possibly dangerous.

&gt; What is weirdest of all is that I have enough information to where you would think I could easily locate him and verify his information. But the more research I do, the more I'm lost. I can't trace of this guy. Which is now bugging me out even more.




&gt; **Information I have**


&gt;  * **Name:** I have his first and last name (he said he wasn't given a middle name). His name is extremely common, which has been the big issue in my search.

&gt;  * **Birthday:** I believe I know his city of birth as well.

&gt;  * **E-mail Address**

&gt;  * **Phone Number:** He has a work assigned cell and personal cell. I have the personal number. Some voicemails to me are saved.

&gt;  * **Screenname:** The one he used on the forum.

&gt;  * **Location:** Current city and area of the city. I know of previous places he has lived. He also has claimed to currently own some properties.

&gt;  * **School/Work:** I know what colleges he attended and major.   He said he had a PhD.  The schools are in Maryland and California.  One is an Ivy.  I know what type of job he works but not clear on details.

&gt;  * **Family/Friends:** I know the name of one family member and one friend. I know how many siblings and nieces/nephews he has.

&gt;  * **Pictures:** I have three photos of him. Yes, I asked to see him on video. He never said no, but video chat was always postponed to another time.




&gt; **Research**





&gt;  * **Pictures:** The images he sent me of himself were through the site we met on. Reverse Google image search comes up empty.

&gt;  * **E-mail Address:** Googled, Spokeo'd, and Peek You'd. Nothing comes up. No results on social networking websites either. I wanted to get his IP from the header of an e-mail, but then I realized our e-mails were just from me. He would never respond back through e-mail.

&gt;  * **Phone Number:** He mentioned phone was no contract. Found out it was a MetroPCS phone (probably a burner). The name registered to the phone has the same first name, but different last name. Weirdly, this registered last name matches part of his e-mail address.  That last name is also common, and has produced nothing in searching.  **--UPDATE: This number is now registered to a different name altogether.  My best guess  is he switched his number and a new person now owns this particular number.**

&gt; However, the very odd thing about this number is it was posted in ads for an escort (dates on the ads were from early 2012). Reviews for this escort have stated they spoke to this girl on the phone and they were scammed.

&gt;  * **School/Work:** Not much here. Only guy with exact school and degree match I could find, doesn't live in his area, and is either really old or dead.

&gt;  * **Screenname:** Results are from the site we met on.

&gt;  * **Social Networking:** He said he didn't do Facebook or anything. Looked into all of them, nada.

&gt;  * **Other info:** He claims to have patents, but was going to give me the details about them “later on”.

&gt; Just to be clear, I don't believe this was possibly a classic ""romance scam,"" from what I know about them. He did not have a foreign accent (he had a slight NY accent if anything), he never claimed to be in another country at any point or was educated anywhere else. He never asked me for money, favors, or for confidential details. In fact, when I passingly told him money was a bit tight, he offered to send me a large sum of cash or a check-- several times. Which I found to be out of bounds, and another reason of many in wanting to confirm this guy.




-----------------**UPDATE**---------------------------------

I had rejoined the same dating site a couple of months ago, but I'm not very active.  After logging in, the bottom of the page shows a row of matches that are in your local area.  This morning, his picture was the first one to show up.

I was completely shocked.  His location was set to NYC, but a different part of the city from where he is from, and where he claims to currently own a place that he rents out.  He hated NY and vowed to never move back.  He settled and happy in SF, so WTF?

I kept reading, and there were huge discrepancies.  His height, hair/eye color, pet, and two of his photos (one he had on his original profile, and one he had sent me through the site privately) were the same.

The other two photos that were posted, I have never seen before...but they were of him.  This new profile had him listed under a completely different occupation, different education level (Masters), and three years younger.  In this ""about me"" he gave a different first name (which was also in ID name).  He stated he was ""new"" to NY.  That he was raised in AZ, went to school in Massachusetts, and landed his ""dream job"" in Los Angeles, where he has been living ever since.

I saved the photos and took screenshots of the profile.  I wrote to him with just “?” (I didn’t know what to say, and was more testing to see if he would respond.  He did-- also with “?”.  I replied asking if he moved back to NY, to which he responded “I got a promotion.  I’m in NY once a week”.  Based on the work and position he told me held; this would not make sense or be possible. Hell, even the style of writing seemed off.   I wrote “****, I’m confused, and this isn’t making sense so what is going on”.  I was immediately blocked.

I was thinking maybe by chance this was someone else, these were his photos, and he blocked me thinking I was some loon who had him confused?   I quickly created another profile on the site (its free), and wrote briefly explaining what the situation was and what I was trying to figure out.  Again, I was blocked.  Shortly after, the profile information and pictures were removed.  A few minutes later, everything was deleted and the account was closed.

I can only come up with three scenarios for this: A) This is the same guy I was talking to, and he lied about almost everything, majorly slipped up, and went back into hiding.  B) Someone else has his photos, made a profile (maybe somehow knows him since some of the details were the same), embarrassed he got caught and deleted everything. C)These photos belong to someone else all together, and it's an operation done by two or more people.

**Now I need suggestions on where do I go from here.  What other avenues can I look into?  How can I proceed in finding out the truth?**
**Again, I apologize for the length, but I wanted to cover everything.  I’ve seen the awesome work this community does, and would be so thankful. I would be happy to give any personal information that might help...privately... since it’s not allowed on here.  Thank you!**
",,False,,t5_2tayf,1358563631.0,,,True,t3_16dwh1,http://www.reddit.com/r/RBI/comments/16dwh1/i_need_your_help_identifying_this_guy_catfish/,
1357247713.0,7,reddit.com,15wqk9,"(Cross post) A crazy roommate wore my friend's clothes, then stole her camera!",7,0,2,http://www.reddit.com/r/RBI/comments/15wqk9/cross_post_a_crazy_roommate_wore_my_friends/,,,False,,t5_2tayf,False,,,False,t3_15wqk9,http://www.reddit.com/r/Images/comments/15wbmz/girl_moves_in_with_me_for_11_days_steals_my/,
1355916442.0,7,reddit.com,153rq3,Reddit helps police solve a hit&amp;run and car theft. : bestof,12,5,0,http://www.reddit.com/r/RBI/comments/153rq3/reddit_helps_police_solve_a_hitrun_and_car_theft/,,,False,,t5_2tayf,False,,,False,t3_153rq3,http://www.reddit.com/r/bestof/comments/152m8e/reddit_helps_police_solve_a_hitrun_and_car_theft/,
1354632686.0,6,self.RBI,149hmz,Do you guys have any tips to AVOID getting your stuff stolen?,7,1,20,http://www.reddit.com/r/RBI/comments/149hmz/do_you_guys_have_any_tips_to_avoid_getting_your/,"I live in a not-so-friendly neighborhood and I'm getting paranoid.  Say I was to have my 360 stolen, is there anything I could have done to make finding it easier?

Sorry if this is in the wrong subreddit, I figured you guys would know a lot more about this sort of thing.",,False,,t5_2tayf,False,,,True,t3_149hmz,http://www.reddit.com/r/RBI/comments/149hmz/do_you_guys_have_any_tips_to_avoid_getting_your/,
1350144923.0,9,self.RBI,11f2gu,"My bike got stolen in Worcester, UK",13,4,7,http://www.reddit.com/r/RBI/comments/11f2gu/my_bike_got_stolen_in_worcester_uk/,"Hi, I don't think that many people from worcester use reddit but if you are from worcester then please please please help me get my bike back, its's a trek 6300 mountain bike [which looks like this](http://www.google.co.uk/imgres?q=trek+6300&amp;um=1&amp;hl=en&amp;sa=N&amp;biw=1024&amp;bih=679&amp;tbm=isch&amp;tbnid=WAwCNfWbWcP3YM:&amp;imgrefurl=http://www.cyclechat.net/threads/f-s-almost-as-new-trek-6300-21-5.35231/&amp;docid=SEdJVhjM-MvgFM&amp;imgurl=http://img.photobucket.com/albums/v303/krb155/SDC10187.jpg&amp;w=640&amp;h=480&amp;ei=35J5ULWJGqqX1AWEnoCABw&amp;zoom=1&amp;iact=hc&amp;vpx=117&amp;vpy=175&amp;dur=223&amp;hovh=194&amp;hovw=259&amp;tx=149&amp;ty=118&amp;sig=115612517486876860325&amp;page=2&amp;tbnh=146&amp;tbnw=212&amp;start=12&amp;ndsp=22&amp;ved=1t:429,r:12,s:0,i:132)

It was stolen from outside the hive library so if you are offered a cheap mountain bike please ask what make it is, thank you :) :) :) :)

Thanks guys :)",,False,,t5_2tayf,1350485982.0,,,True,t3_11f2gu,http://www.reddit.com/r/RBI/comments/11f2gu/my_bike_got_stolen_in_worcester_uk/,
1349588247.0,6,self.RBI,112swv,Coolest subreddit,16,10,4,http://www.reddit.com/r/RBI/comments/112swv/coolest_subreddit/,"Just dropped by to say i found this subreddit recently, coolest subreddit ever!",,False,,t5_2tayf,False,,,True,t3_112swv,http://www.reddit.com/r/RBI/comments/112swv/coolest_subreddit/,
1344561252.0,5,examiner.com,xyzx6,This asshat threw a puppy over the unlocked fence of this animal shelter like he was a bit of garbage. They need help finding him.,8,3,1,http://www.reddit.com/r/RBI/comments/xyzx6/this_asshat_threw_a_puppy_over_the_unlocked_fence/,,,False,,t5_2tayf,False,,,False,t3_xyzx6,http://www.examiner.com/article/outrage-after-man-caught-on-video-throwing-puppy-over-louisiana-shelter-fence,
1344311065.0,7,self.RBI,xt058,"I posted the other day, but the issue isn't letting up. I could really use your help.",9,2,7,http://www.reddit.com/r/RBI/comments/xt058/i_posted_the_other_day_but_the_issue_isnt_letting/,"The past couple of weeks someone has repeatedly tried to login to my Gmail account, luckily without success. But it may only be a matter of time before they succeed. I have a very secure password, but it is by no means impossible. It's random numbers, letters, and capitols. I am really concerned about this because I use my gmail account with chrome, so if he logs into my account he would be able to view all of my saved passwords. I don't save the passwords for my bank account.

The only thing I have to go on is some IP addresses. http://imgur.com/N7HWh

I have looked into a few of the IP addresses but they get me nowhere. Maybe you guys can help me out?

Here's my original post: http://www.reddit.com/r/RBI/comments/xp4jw/suspicious_email_login_attempt/",,False,,t5_2tayf,False,,,True,t3_xt058,http://www.reddit.com/r/RBI/comments/xt058/i_posted_the_other_day_but_the_issue_isnt_letting/,
1340606131.0,7,reddit.com,vk7ud,"STOLEN IPHONE, TRACKED ... what do i do ?",13,6,1,http://www.reddit.com/r/RBI/comments/vk7ud/stolen_iphone_tracked_what_do_i_do/,,,False,,t5_2tayf,False,,,False,t3_vk7ud,http://www.reddit.com/r/AskReddit/comments/vgv2s/lost_my_iphone_tracked_it_what_to_do/,
1340021681.0,7,reddit.com,v7z12,"Reddit, today I lost my most prized possession. Can anyone help me get it back? : AskReddit",17,10,0,http://www.reddit.com/r/RBI/comments/v7z12/reddit_today_i_lost_my_most_prized_possession_can/,,,False,,t5_2tayf,False,,,False,t3_v7z12,http://www.reddit.com/r/AskReddit/comments/v7gsk/reddit_today_i_lost_my_most_prized_possession_can/,
1331015990.0,7,reddit.com,qjujz,I got my phone stolen and I know the thief. What should I do? ,9,2,4,http://www.reddit.com/r/RBI/comments/qjujz/i_got_my_phone_stolen_and_i_know_the_thief_what/,,,False,,t5_2tayf,False,,,False,t3_qjujz,http://www.reddit.com/r/AskReddit/comments/qj396/i_got_my_phone_stolen_and_i_know_the_thief_what/,
1330263138.0,7,reddit.com,q6o34,Old but interesting - Busting an iPhone thief,8,1,0,http://www.reddit.com/r/RBI/comments/q6o34/old_but_interesting_busting_an_iphone_thief/,,,False,,t5_2tayf,False,,,False,t3_q6o34,http://www.reddit.com/r/reddit.com/comments/auo8q/how_to_catch_an_iphone_thief/,
1330262879.0,9,reddit.com,q6o0l,Interview with a bike thief,9,0,0,http://www.reddit.com/r/RBI/comments/q6o0l/interview_with_a_bike_thief/,,,False,,t5_2tayf,False,,,False,t3_q6o0l,http://www.reddit.com/r/MTB/comments/q4epy/interview_with_a_bike_thief/,
1329534512.0,7,reddit.com,pusjd,Stolen military uniforms. San Antonio,9,2,0,http://www.reddit.com/r/RBI/comments/pusjd/stolen_military_uniforms_san_antonio/,,,False,,t5_2tayf,False,,,False,t3_pusjd,http://www.reddit.com/r/self/comments/puqoj/stolen_military_uniforms/,
1329068192.0,7,reddit.com,pm7jh,"Burglars hit Powell gun shop : Columbus, Ohio (interesting entrance)",7,0,0,http://www.reddit.com/r/RBI/comments/pm7jh/burglars_hit_powell_gun_shop_columbus_ohio/,,,False,,t5_2tayf,False,,,False,t3_pm7jh,http://www.reddit.com/r/Columbus/comments/pgy2w/burglars_hit_powell_gun_shop/,
1328752795.0,8,reddit.com,ph6s9,Cold-hearted thieves steal church heating and cooling systems ,11,3,1,http://www.reddit.com/r/RBI/comments/ph6s9/coldhearted_thieves_steal_church_heating_and/,,,False,,t5_2tayf,False,,,False,t3_ph6s9,http://www.reddit.com/r/greed/comments/pg8pp/coldhearted_thieves_steal_church_heating_and/,
1328416313.0,6,reddit.com,pbhla,"Friend and fellow Redditor, Paul Bunbury, missing in Dublin, Ireland. Have you seen him? ",8,2,1,http://www.reddit.com/r/RBI/comments/pbhla/friend_and_fellow_redditor_paul_bunbury_missing/,,,False,,t5_2tayf,False,,,False,t3_pbhla,http://www.reddit.com/r/AskReddit/comments/pb0nt/friend_and_fellow_redditor_paul_bunbury_missing/,
1328266956.0,5,reddit.com,p94o0,How can this be legal? ,9,4,0,http://www.reddit.com/r/RBI/comments/p94o0/how_can_this_be_legal/,,,False,,t5_2tayf,False,,,False,t3_p94o0,http://www.reddit.com/r/videos/comments/p8qm0/how_can_this_be_legal/,
1328236822.0,8,wfaa.com,p8om5,"TSA agent at D/FW Airport suspected of stealing iPads | 
                wfaa.com Dallas - Fort Worth",10,2,1,http://www.reddit.com/r/RBI/comments/p8om5/tsa_agent_at_dfw_airport_suspected_of_stealing/,,,False,,t5_2tayf,False,,,False,t3_p8om5,http://www.wfaa.com/news/crime/TSA-agent-arrested-at-DFW-Airport-for-stealing-iPads-138455504.html,
1328148045.0,6,reddit.com,p71nw,"Galaxy Ace stolen yesterday, could not track it. Bought another one today 'cause I need it for my job. How can I tell the Android Market that I don't want my account linked to the lost device anymore? ",7,1,2,http://www.reddit.com/r/RBI/comments/p71nw/galaxy_ace_stolen_yesterday_could_not_track_it/,,,False,,t5_2tayf,False,,,False,t3_p71nw,http://www.reddit.com/r/Android/comments/p52va/galaxy_ace_stolen_yesterday_could_not_track_it/,
1328084663.0,8,fresnobee.com,p5wpf,"$30,000 ALCS ring among items stolen from ex-Fresno State pitcher Matt Garza's home",9,1,0,http://www.reddit.com/r/RBI/comments/p5wpf/30000_alcs_ring_among_items_stolen_from_exfresno/,,,False,,t5_2tayf,False,,,False,t3_p5wpf,http://www.fresnobee.com/2012/01/31/2704414/30000-ring-among-items-stolen.html,
1328038152.0,7,reddit.com,p4xb5,"Buyer spots Craigslist scam, returns stolen bikes to owner",7,0,0,http://www.reddit.com/r/RBI/comments/p4xb5/buyer_spots_craigslist_scam_returns_stolen_bikes/,,,False,,t5_2tayf,False,,,False,t3_p4xb5,http://www.reddit.com/r/Seattle/comments/p4r8u/buyer_spots_craigslist_scam_returns_stolen_bikes/,
1327969365.0,7,reddit.com,p3rvz,"Reddit, I am concerned that I may be a victim of identity theft....HELP! ",8,1,1,http://www.reddit.com/r/RBI/comments/p3rvz/reddit_i_am_concerned_that_i_may_be_a_victim_of/,,,False,,t5_2tayf,False,,,False,t3_p3rvz,http://www.reddit.com/r/AskReddit/comments/p3mn2/reddit_i_am_concerned_that_i_may_be_a_victim_of/,
1327874933.0,7,bygonebureau.com,p23zh,Burgled in Philly,8,1,0,http://www.reddit.com/r/RBI/comments/p23zh/burgled_in_philly/,,,False,,t5_2tayf,False,,,False,t3_p23zh,http://bygonebureau.com/2012/01/18/burgled-in-philly/,
1327873570.0,9,self.RBI,p22ur,Question: Does security lighting work to cut crime?,9,0,2,http://www.reddit.com/r/RBI/comments/p22ur/question_does_security_lighting_work_to_cut_crime/,"This wikipedia article suggests otherwise:

http://en.wikipedia.org/wiki/Security_lighting

""Security lighting can be counter-productive. Turning off lights halved the number of thefts and burglary in Övertorneå Sweden""

""A test in West Sussex UK showed that adding all-night lighting in some areas made people there feel safer, although crime rates increased 55% in those areas compared to control areas and to the county as a whole.""

""In the early seventies, the public-school system in San Antonio, Texas, began leaving many of its school buildings, parking lots, and other property dark at night and found that the no-lights policy not only reduced energy costs but also dramatically cut vandalism.""

""Bright, unshielded floodlights often prevent people from noticing criminal activity, and help criminals see what they are doing.""

""An important limitation to the usefulness of security lighting is the simple fact that it is only useful at night. This is particularly significant for home owners because, contrary to a widespread myth, most household burglaries occur during the day, when the occupants are away at work or shopping.""

",,False,,t5_2tayf,False,,,True,t3_p22ur,http://www.reddit.com/r/RBI/comments/p22ur/question_does_security_lighting_work_to_cut_crime/,
1327837686.0,7,reddit.com,p1m7g,"Reddit, A coworker came in today covered in bruises. Her boyfriend beat the living sh*t out of her. What should I do? ",8,1,0,http://www.reddit.com/r/RBI/comments/p1m7g/reddit_a_coworker_came_in_today_covered_in/,,,False,,t5_2tayf,False,,,False,t3_p1m7g,http://www.reddit.com/r/AskReddit/comments/p17iv/reddit_a_coworker_came_in_today_covered_in/,
1327523153.0,5,youtube.com,owi4z,Help Ryder Recover his Backpack: News story with surveillance tape,7,2,1,http://www.reddit.com/r/RBI/comments/owi4z/help_ryder_recover_his_backpack_news_story_with/,,,False,,t5_2tayf,False,,,False,t3_owi4z,http://www.youtube.com/watch?v=D3j--YLhH6M,
1327470333.0,5,myassettag.com,ovp71,Bicycle Theft in US Universities (Infographic),8,3,0,http://www.reddit.com/r/RBI/comments/ovp71/bicycle_theft_in_us_universities_infographic/,,,False,,t5_2tayf,False,,,False,t3_ovp71,http://www.myassettag.com/info/Bicycle-Theft-in-US-Universities.aspx,
1327469833.0,8,reddit.com,ovote,H&amp;M steals heartfelt artwork; Does not compensate artist... ,12,4,0,http://www.reddit.com/r/RBI/comments/ovote/hm_steals_heartfelt_artwork_does_not_compensate/,,,False,,t5_2tayf,False,,,False,t3_ovote,http://www.reddit.com/r/WTF/comments/ov10e/hm_steals_heartfelt_artwork_does_not_compensate/,
