created_utc,score,domain,id,title,ups,downs,num_comments,permalink,selftext,link_flair_text,over_18,thumbnail,subreddit_id,edited,link_flair_css_class,author_flair_css_class,is_self,name,url,distinguished
1367354743.0,1213,imgur.com,1dfoo3,"Violently blew a fuse in my extension cord, took it apart to see the damage and found this X-POST from /r/whatisthisthing",1571,358,874,http://www.reddit.com/r/RBI/comments/1dfoo3/violently_blew_a_fuse_in_my_extension_cord_took/,,,False,,t5_2tayf,False,,,False,t3_1dfoo3,http://imgur.com/a/Us0ta/all,
1374498249.0,736,i.imgur.com,1it5dp,"After my family was robbed of all our posessions while we were in Spain last month, this photo appeared in my Dropbox. Any ideas where it could be? I was told you may be able to help. Story in comments.",858,122,92,http://www.reddit.com/r/RBI/comments/1it5dp/after_my_family_was_robbed_of_all_our_posessions/,,,False,,t5_2tayf,False,,,False,t3_1it5dp,http://i.imgur.com/x6DJwoc.jpg,
1359934095.0,521,i.imgur.com,17u0cv,This guy stole my friends brother's phone in a nightclub. Left iCloud on. ,590,69,94,http://www.reddit.com/r/RBI/comments/17u0cv/this_guy_stole_my_friends_brothers_phone_in_a/,,,True,,t5_2tayf,False,,,False,t3_17u0cv,http://i.imgur.com/eBMMpTy.jpg,
1356973727.0,409,imgur.com,15qakp,"Please help my find justice for my father, murdered in his NW Houston home December 23, 2012. Do you recognise these men or have any info?",449,40,52,http://www.reddit.com/r/RBI/comments/15qakp/please_help_my_find_justice_for_my_father/,,,False,,t5_2tayf,False,,,False,t3_15qakp,http://imgur.com/qagir,
1338165718.0,308,i.imgur.com,u7zcr,"Reddit, I know this is a stretch, but my best friend's younger brother went missing a few days ago in New York and I need all the help in the world I can get to assure his safety, I can't imagine the positions his family is in.",358,50,20,http://www.reddit.com/r/RBI/comments/u7zcr/reddit_i_know_this_is_a_stretch_but_my_best/,,,False,,t5_2tayf,False,,,False,t3_u7zcr,http://i.imgur.com/RbDnG.jpg,
1349592296.0,294,i.imgur.com,112v43,"My friend's mother was found murdered in Hercules, CA last night - Oct. 5th. This 2011 Subaru Outback with Idaho license plate #1A1F680 was stolen from her home that same night. Please call the police if you see this car.",333,39,16,http://www.reddit.com/r/RBI/comments/112v43/my_friends_mother_was_found_murdered_in_hercules/,,,False,,t5_2tayf,False,,,False,t3_112v43,http://i.imgur.com/5mYHC.jpg,
1352070262.0,260,savannahnow.com,12mvew,"Local firefighter and my cousin Wesley Franklin was murdered and the killer is still not been found, I know that it is a long shot, but there isn't much else left to do but reach out to you guys",284,24,5,http://www.reddit.com/r/RBI/comments/12mvew/local_firefighter_and_my_cousin_wesley_franklin/,,,False,,t5_2tayf,False,,,False,t3_12mvew,http://savannahnow.com/news/2012-09-09/father-confident-wesley-franklins-killer-will-be-caught#.UJbu8vF5mK0,
1369394809.0,257,i.imgur.com,1eyqxr,Can you decipher this graffiti? This is the suspects backpack from my cousins murder.,284,27,72,http://www.reddit.com/r/RBI/comments/1eyqxr/can_you_decipher_this_graffiti_this_is_the/,,,False,,t5_2tayf,False,,,False,t3_1eyqxr,http://i.imgur.com/nhWmxOC.jpg,
1352263491.0,257,imgur.com,12ryw6,Suggested repost from /r/pics: This guy stole my friends backpack from the gym at the University of Arkansas-Fort Smith. Help us catch him!,272,15,76,http://www.reddit.com/r/RBI/comments/12ryw6/suggested_repost_from_rpics_this_guy_stole_my/,,,False,,t5_2tayf,False,,,False,t3_12ryw6,http://imgur.com/2p554,
1369960706.0,252,woai.com,1fdgzn,Can Reddit help us nab the two men who killed a San Antonio Riverwalk icon? George the duck was tortured and strangled by tourists shown in video.,283,31,40,http://www.reddit.com/r/RBI/comments/1fdgzn/can_reddit_help_us_nab_the_two_men_who_killed_a/,,,False,,t5_2tayf,False,,,False,t3_1fdgzn,http://www.woai.com/news/local/story/Famous-River-Walk-duck-killed/VQqZAYnb6km-X9Qv_-TEFA.cspx,
1357426961.0,236,cbssacramento.files.wordpress.com,16136d,Puppy burned alive last night in Sacramento. $8000 dollar reward for information that leads to an arrest. Article &amp; video in comments. x-post from /r/wtf NSFL,275,39,81,http://www.reddit.com/r/RBI/comments/16136d/puppy_burned_alive_last_night_in_sacramento_8000/,,,False,,t5_2tayf,False,,,False,t3_16136d,http://cbssacramento.files.wordpress.com/2013/01/burn-dog-2.jpg,
1347953976.0,232,reddit.com,102iy3,"Reddit, can you help me find the people who stole my son's cello (surveillance pics) (x-post from r/pics)?",287,55,8,http://www.reddit.com/r/RBI/comments/102iy3/reddit_can_you_help_me_find_the_people_who_stole/,,,False,,t5_2tayf,False,,,False,t3_102iy3,http://www.reddit.com/r/pics/comments/102g3o/reddit_can_you_help_me_find_the_people_who_stole/,
1346086736.0,226,imgur.com,ywt81,My friend is an independent artist who runs a small-scale clothing line. This company called Virgin Blak just ripped off one of his designs. Can you help? ,245,19,51,http://www.reddit.com/r/RBI/comments/ywt81/my_friend_is_an_independent_artist_who_runs_a/,,,False,,t5_2tayf,False,,,False,t3_ywt81,http://imgur.com/bLKpt,
1367425354.0,224,self.RBI,1dhlqy,"UPDATES / INFO: Violently blew a fuse in my extension cord, took it apart to see the damage and found this.",265,41,119,http://www.reddit.com/r/RBI/comments/1dhlqy/updates_info_violently_blew_a_fuse_in_my/,"Went to sleep last night and woke up to being /r/bestof'd and now top of the subreddit. Thought i'd post this thread to give you guys updates and clear anything up for people who haven't seen my comments.

First of all here's all the pictures I've taken so far.
Original Pictures:
http://imgur.com/a/Us0ta/all
Closer pictures w/ better Camera &amp; Lighting
http://imgur.com/a/hBLAK
The damage caused to my Macbook charger that made me decide to look inside this thing:
http://imgur.com/geDsqRP

For the people wondering what inspired me to open up the extension / power strip in the first place, I had to wait for maintenance to reset the fuse to my room (took them about 2 hours) so I wanted to see the extent of the damage.

In regards to suspicions helicopter parents are still not ruled out, not sure if there'd be anyone wanting to spy on my parents.

Law enforcement is unlikely, I don't think I'm that interesting (a student) and it seems to be something you can purchase pretty readily online (not any special kit).

The simcard is currently in an old phone but no phone calls yet. I'll provide any updates on that front in here.

Any more suggestions are welcome, sim card forensics tools or even just suggestions about where else might be a good place to look incase there's any similar devices around.

Thanks for the comments everyone!

**UPDATE** 

I called and an automated message said ""the service is now closed and if you have voicemail you can turn it on and ......... "" nothing interesting - didnt get the last number called in

I created an account on the 02 website and the only information i got is that there have been no top-ups in the last three months

I called 02 and they said that they could not give me the incoming call log, would need a warrant but I don't want to get one ... is there another way to get the incoming call logs off the phone. 

Also how does the six months no outgoing call charges means deactivation of sim work?
As I left for uni at the beginning of October and its now May, but when I put the sim in a phone it worked. Is that possible as no-one could have made any outgoing calls. Or did it re-activate (if it had been inactive) on me putting it in the phone?


Extra pics of the possible microphone: 

http://i.imgur.com/wHsYuRW.jpg

http://i.imgur.com/MALUCNu.jpg",,False,,t5_2tayf,1367510122.0,,,True,t3_1dhlqy,http://www.reddit.com/r/RBI/comments/1dhlqy/updates_info_violently_blew_a_fuse_in_my/,
1371465569.0,217,i.imgur.com,1gibdg,My friend went missing at 4AM yesterday and took a picture saying goodbye. Could anyone help decipher clues from it?,270,53,120,http://www.reddit.com/r/RBI/comments/1gibdg/my_friend_went_missing_at_4am_yesterday_and_took/,,,False,,t5_2tayf,False,,,False,t3_1gibdg,http://i.imgur.com/brWCBer.png,
1370485181.0,214,imgur.com,1frj3m,"From a friends Facebook update. Apparently this guy tried to break into his house at 11:45 am in Los Angeles, Ca today. He climbed in through the cat door and set off the motion detection camera and alarm. Thanks for all the help.",241,27,67,http://www.reddit.com/r/RBI/comments/1frj3m/from_a_friends_facebook_update_apparently_this/,,,False,,t5_2tayf,False,,,False,t3_1frj3m,http://imgur.com/F58B1wP,
1328798030.0,208,reddit.com,phsb8,Recognise this Phone Thief?,230,22,10,http://www.reddit.com/r/RBI/comments/phsb8/recognise_this_phone_thief/,,,False,,t5_2tayf,False,,,False,t3_phsb8,http://www.reddit.com/r/videos/comments/phoz7/recognise_this_phone_thief/,
1367380383.0,203,imgur.com,1dgmca,What happened to Alex? (X-post from /r/creepy),233,30,114,http://www.reddit.com/r/RBI/comments/1dgmca/what_happened_to_alex_xpost_from_rcreepy/,,,False,,t5_2tayf,False,,,False,t3_1dgmca,http://imgur.com/a/QQA6g,
1358806466.0,202,imgur.com,170k36,"Friend´s cell got stolen in paris, the thieves uploaded some pics on his dropbox. Does anyone recognize them?",223,21,61,http://www.reddit.com/r/RBI/comments/170k36/friends_cell_got_stolen_in_paris_the_thieves/,,,False,,t5_2tayf,False,,,False,t3_170k36,http://imgur.com/a/cAPoF,
1366086146.0,196,i.imgur.com,1cfx0k,Girl Missing Since This Morning In Provo Utah,219,23,27,http://www.reddit.com/r/RBI/comments/1cfx0k/girl_missing_since_this_morning_in_provo_utah/,,,False,,t5_2tayf,False,,,False,t3_1cfx0k,http://i.imgur.com/FGnHjGP.jpg,
1361379093.0,191,i.imgur.com,18w6re,My friend's sister was murdered in a home invasion in Utah. This man is wanted for questioning. More info inside.,208,17,12,http://www.reddit.com/r/RBI/comments/18w6re/my_friends_sister_was_murdered_in_a_home_invasion/,,,False,,t5_2tayf,False,,,False,t3_18w6re,http://i.imgur.com/tb5vZrG.jpg,
1369549391.0,192,i.imgur.com,1f2kap,"X-post from r/auto... If anyone sees this truck in the California Bay Area, it was stolen from my work. let me know, please help me reddit, you're my only hope. I love my truck and miss it. On 5/24 @ around 4:30pm.",219,27,20,http://www.reddit.com/r/RBI/comments/1f2kap/xpost_from_rauto_if_anyone_sees_this_truck_in_the/,,,False,,t5_2tayf,False,,,False,t3_1f2kap,http://i.imgur.com/UaWz6FC.jpg,
1348612857.0,186,reddit.com,10h4eq,Hit and run scumbag in Denver needs caught - Help?,206,20,7,http://www.reddit.com/r/RBI/comments/10h4eq/hit_and_run_scumbag_in_denver_needs_caught_help/,,,False,,t5_2tayf,False,,,False,t3_10h4eq,http://www.reddit.com/r/AskReddit/comments/10h169/reddit_my_friend_was_killed_in_a_hit_and_run/,
1350418674.0,186,imgur.com,11l6ph,Two of my friends went missing last Saturday and I was hoping this would help. Have you seen them?,204,18,42,http://www.reddit.com/r/RBI/comments/11l6ph/two_of_my_friends_went_missing_last_saturday_and/,,,False,,t5_2tayf,False,,,False,t3_11l6ph,http://imgur.com/a/Fhryb,
1367719420.0,180,i.imgur.com,1dplz7,"This man and his unidentified accomplice have burglarized Tims Music in Sacramento, California twice in the week of April 29- May 4. They've stolen over $70,000 of music equipment. If you have any information please contact the email in the comments. Thank You",238,58,33,http://www.reddit.com/r/RBI/comments/1dplz7/this_man_and_his_unidentified_accomplice_have/,,,False,,t5_2tayf,False,,,False,t3_1dplz7,http://i.imgur.com/9V4gZpY.jpg,
1368703007.0,179,self.RBI,1eg0jy,Can we help this military widow out? Phone stolen with only photos of husband.,210,31,40,http://www.reddit.com/r/RBI/comments/1eg0jy/can_we_help_this_military_widow_out_phone_stolen/,"$10,000 reward for stolen cell phone. 

Begging whoever has it. (Fredericksburg)Someone took my phone. A Samsung Galaxy S3. It's white. It's only worth a few hundred bucks to you or anyone else. If you unlock the screen you will see my home screen. 

In the picture stands a man. A man with a backpack and 2 other bags. That man you see, was my husband. And that night, it was the last time he ever held me. If you open the gallery you will see a collection of photos. Mostly of him. But some of his children as well. You will also see some of his funeral. Of his burial flag, his coffin. 

See, that man you saw on the home screen. The one who looks so eager to head into a war zone to protect the country he loved and his family, he lost his life doing so. The only pictures I have of him are on that phone because my computer crashed after I transferred them. 

Tonight, I cried uncontrollably in the arms of a friend because tonight I felt as though I lost my husband once more. I know with time my memory will fade. I will have difficulty explaining his features to his children. Or why I think they look like him. One who never had the honor of meeting his father.

I don't care about the phone. If you have it. Please just email me. I will respond and you will be able to send them to my email and you will never hear from me again. I only want the pictures nothing else. The reward money is 100%. If you can prove to me you have the phone and are willing to give it back. Proof required: My husbands Eye color hair color and shirt color in the skype photo of him. Along with the type of cover that was on the phone.

http://fredericksburg.craigslist.org/laf/3756601062.html


I know it's not much to go on, but I've seen this subreddit do some amazing things!",,False,,t5_2tayf,False,,,True,t3_1eg0jy,http://www.reddit.com/r/RBI/comments/1eg0jy/can_we_help_this_military_widow_out_phone_stolen/,
1368547339.0,178,i.imgur.com,1ebjt3,HIT AND RUN: Help me enhance this image of a license plate #!,201,23,103,http://www.reddit.com/r/RBI/comments/1ebjt3/hit_and_run_help_me_enhance_this_image_of_a/,,,False,,t5_2tayf,False,,,False,t3_1ebjt3,http://i.imgur.com/Xf5arXK.jpg,
1349367333.0,172,youtube.com,10xwyh,Find the guy who sucker punched Elderly Bus Driver in Kansas City,189,17,34,http://www.reddit.com/r/RBI/comments/10xwyh/find_the_guy_who_sucker_punched_elderly_bus/,,,False,,t5_2tayf,False,,,False,t3_10xwyh,https://www.youtube.com/watch?v=Y-f84b7vJsY,
1354685010.0,166,self.RBI,14b3jw,"My Uncle went missing at between 11am and 4pm, his cellphone was found in a ditch at 6pm. Can you help find him?",185,19,12,http://www.reddit.com/r/RBI/comments/14b3jw/my_uncle_went_missing_at_between_11am_and_4pm_his/,"**EDIT: [He has been found](https://twitter.com/CBCTBay/status/276357542051983360)! Thank you everyone for your support and aide in the search and spreading the word.** 

xpost from r/canada and r/thunderbay. This happened in Thunder Bay, Ontario on December 4.

[picture](https://fbcdn-sphotos-h-a.akamaihd.net/hphotos-ak-ash4/270173_10151327044026405_1400904227_n.jpg).

Name: Neil Soloway

Last seen: 11:45 am leaving Lakehead University

Noticed Missing: 4pm when he didn't show up to be picked up from work.

More Details: found his cell phone in a far-off park (on the edge of the MacIntyre River behind the Slovak Legion) about 6:30 this evening.

The police and family member are currently searching for him. We have no idea what happened and are fearing the worst.",,False,,t5_2tayf,1354724465.0,,,True,t3_14b3jw,http://www.reddit.com/r/RBI/comments/14b3jw/my_uncle_went_missing_at_between_11am_and_4pm_his/,
1360761191.0,165,reddit.com,18fy8s,"My 16 year old brother and two friends left on Friday and have not returned. We have no reason to believe they ran away. Last seen in Naples, Florida",186,21,6,http://www.reddit.com/r/RBI/comments/18fy8s/my_16_year_old_brother_and_two_friends_left_on/,,,False,,t5_2tayf,False,,,False,t3_18fy8s,http://www.reddit.com/r/self/comments/18ebx0/my_16_year_old_brother_and_two_friends_left_on/?sort=confidence,
1372169068.0,160,youtube.com,1h1cx2,"Home invasion Millburn, NJ caught on Nanny Cam, Recognize the perp?",193,33,58,http://www.reddit.com/r/RBI/comments/1h1cx2/home_invasion_millburn_nj_caught_on_nanny_cam/,,,False,,t5_2tayf,False,,,False,t3_1h1cx2,http://www.youtube.com/watch?v=dvvHMM6TF50&amp;feature=youtu.be,
1364686242.0,158,self.RBI,1bbu9t,"Grandfather murdered a man 53 years ago, we're still trying to find the man's family. Can you help?",177,19,30,http://www.reddit.com/r/RBI/comments/1bbu9t/grandfather_murdered_a_man_53_years_ago_were/,"My family has been trying to find the family of a man who was murdered back in 1959.  The murderer was my Grandfather.   In the summer of 1959, my grandfather was working as a carpenter.  At some point, he ran into a drifter and offered him room and board, with a little money on the side to help him with a job.  They worked all day, then my grandfather took him home with him.  After eating dinner, my grandfather went out, as he did every night to partake in the local moonshine.

Around 9 p.m., my grandfather came stumbling in, drunk and agitated.  He found the man sitting in the front room, reading the paper with my great grandmother.  An argument ensued, ending with my grandfather shooting the man, point blank with a shot gun, killing him.

The man had introduced himself as Chester Stotts.  But, police found numerous forms of ID on him (back then it was social security cards, membership cards, a paper driver’s license).  He did have a social security card with the name Chester Otis Stotts.  He had spoken of a wife and two daughters.  And, it also believed that he came from Kentucky, Indiana or Missouri.  Law Enforcement were not able to find anything viable, so the man was buried in a unmarked grave in our community cemetery.   My father would later place a tombstone on the grave with the only name we knew “Chester Otis Stotts”.  In addition, he and my mother would make regular trips to Missouri, Kentucky or Indiana in hopes of tracking down his family (this is before the internet age). They did this up until their deaths 4 years ago.  

Now, I’m posting here, hoping that somebody may know of a family named “Stotts”, that had a male member go missing in 1959.  I know this took place a long time ago, and it’s possible this man’s immediate family has passed, but it would be nice to get some closure.

And for the record, my grandfather was convicted and serve significant prison time for this murder.  Like my father, I can’t undo the horrible crime, but I can continue his search for the family.

Edit:  Picture added of the tombstone placed on the grave.  http://imgur.com/VWB2eGm
Thank you all!",,False,,t5_2tayf,1364768122.0,,,True,t3_1bbu9t,http://www.reddit.com/r/RBI/comments/1bbu9t/grandfather_murdered_a_man_53_years_ago_were/,
1374200314.0,161,i.imgur.com,1ilsfn,"Found a Purple Heart for one ""Moses Johnson"" in quite a strange way. Can you help find the recipient or his family? No telling how much Mr. Johnson has given for you personally. Please share this on facebook or twitter! It's the least we can do, and sooooo very easy!",191,30,30,http://www.reddit.com/r/RBI/comments/1ilsfn/found_a_purple_heart_for_one_moses_johnson_in/,,,False,,t5_2tayf,False,,,False,t3_1ilsfn,http://i.imgur.com/AV752CI.jpg,
1360814279.0,158,imgur.com,18hqy8,"found a SD card in Detroit, anyone recognize them?",180,22,44,http://www.reddit.com/r/RBI/comments/18hqy8/found_a_sd_card_in_detroit_anyone_recognize_them/,,,False,,t5_2tayf,False,,,False,t3_18hqy8,http://imgur.com/3JYompr,
1348078590.0,158,reddit.com,105blr,"Hey Reddit, we got my son's cello back! Thanks for your help! (x-post from /r/pics)",172,14,3,http://www.reddit.com/r/RBI/comments/105blr/hey_reddit_we_got_my_sons_cello_back_thanks_for/,,,False,,t5_2tayf,False,,,False,t3_105blr,http://www.reddit.com/r/pics/comments/105b98/hey_reddit_we_got_my_sons_cello_back_thanks_for/,
1356008210.0,157,ice.gov,155ykt,"What do you know, RBI? Can you help find a child pornographer?",189,32,4,http://www.reddit.com/r/RBI/comments/155ykt/what_do_you_know_rbi_can_you_help_find_a_child/,,,False,,t5_2tayf,False,,,False,t3_155ykt,http://www.ice.gov/news/releases/1212/121219washingtondc.htm,
1366174836.0,151,reddit.com,1cijyn,We're scanning images of the Boston Marathon for a Black Fox bag over at /r/findbostonbombers - you guys are good at this stuff,200,49,14,http://www.reddit.com/r/RBI/comments/1cijyn/were_scanning_images_of_the_boston_marathon_for_a/,,,False,,t5_2tayf,False,,,False,t3_1cijyn,http://www.reddit.com/r/findbostonbombers/,
1372006917.0,147,seattletimes.com,1gwz1s,"She stole another’s identity, and her own husband never found who she really was before she died. But she did leave a strongbox filled with evidence behind. Can you identify her?",174,27,31,http://www.reddit.com/r/RBI/comments/1gwz1s/she_stole_anothers_identity_and_her_own_husband/,,,False,,t5_2tayf,False,,,False,t3_1gwz1s,http://seattletimes.com/html/localnews/2021243552_janedoexml.html,
1369068357.0,148,imgur.com,1epax7,"Was anybody at Loud!Fest in downtown Bryan, TX? If so, some people are looking for this girl. She stole a drum pedal and the owners want it back. There is a possibility her name is Taylor. Help?",189,41,40,http://www.reddit.com/r/RBI/comments/1epax7/was_anybody_at_loudfest_in_downtown_bryan_tx_if/,,,False,,t5_2tayf,False,,,False,t3_1epax7,http://imgur.com/a/PY8XY,
1376436311.0,144,wesh.com,1kb9mu,"RBI I need your help. My cousin was attacked outside a bar in Orlando. He has been in a coma for almost a month, and the assailants have yet to be identified.",177,33,7,http://www.reddit.com/r/RBI/comments/1kb9mu/rbi_i_need_your_help_my_cousin_was_attacked/,,,False,,t5_2tayf,False,,,False,t3_1kb9mu,http://www.wesh.com/news/central-florida/orange-county/police-search-for-suspect-witnesses-in-downtown-attack/-/12978032/21433838/-/gamumyz/-/index.html,
1366072569.0,141,i.imgur.com,1cff1l,My friend's apartment was broken into &amp; all of his stuff was stolen. This is the first lead. Looking for advice on how to follow this up,155,14,28,http://www.reddit.com/r/RBI/comments/1cff1l/my_friends_apartment_was_broken_into_all_of_his/,,,False,,t5_2tayf,False,,,False,t3_1cff1l,http://i.imgur.com/rx0EqNv.jpg,
1368501632.0,141,imgur.com,1eaiza,"Spotted a camera on a ski run at Mont Tremblant, Quebec. Screen was broken but pictures recovered - looks like a fun bunch with a lot of memories they might want returned to them. Anyone know these guys?",160,19,17,http://www.reddit.com/r/RBI/comments/1eaiza/spotted_a_camera_on_a_ski_run_at_mont_tremblant/,,,False,,t5_2tayf,False,,,False,t3_1eaiza,http://imgur.com/a/9mMqU,
1366845942.0,131,self.RBI,1d1mjp,Looking for 3 Girls I Saved From House Fire When I was 17,160,29,53,http://www.reddit.com/r/RBI/comments/1d1mjp/looking_for_3_girls_i_saved_from_house_fire_when/,"It was either 1993 or 1994 I am not sure about the date, there was a family who lived next door to my parents house they had 3 daughters I know one daughter was about 1-2 years younger than me. 
I believe her name was Dusty or Destiny I think she was a step daughter, the fathers name was Marty I don't remember the mother's name. 
I know Dusty or Destiny attended Antelope Valley High School for a while. 
The other 2 girls were about 4 years old and 6 years old if I remember correctly. Marty worked in Aerospace in Palmdale CA. 

Here is what I remember about that evening:
I was in my parent's back yard working out, and I heard a fire alarm go off next door, I looked over the fence and saw fire coming from the window. I ran inside my parents house and told my mom to call 911, I grabbed a couple fire extingushers from my parents kitchen and ran over next door.

The front door was unlocked to I ran in and went down the hall and the older sister was crouched down in the corner of the hallway, I asked her where her sisters were she was crying and in panic. I pulled her out of the hallway and told her to go across the street to the neighbors and make sure the fire dept was on the way. 
I entered the little girls room fire was coming from under the bed up the wall and over the ceiling. 
I looked around the room but it was so smokey and dark and the only bright light was from the flames, I was able to see the two little girls in the corner crying. 
I reached over and picked them up, I remember one of them was scratching me and hitting me as they were frightened. I ran out of the house and handed them to neighbors who were gathered outside. 
I then went back into the house and started swipping the fire with the first extingusher until it ran out, then I started using the second one and was able to knock the flames down enough to break out the window and toss the smoldering bed outside. 
I jumped out of the window mostly because I needed air, then I noticed a water hose nearby and used the water hose to put out the mattress and box spring. 
By this time the fire department started to pull up and started treatment on the girls, I refused treatment but found out later that all the hair on my arms, legs, stubble on my face, neck and some of hair on my head were burned off. 

A few days later I found out that the 2 little girls were playing with a candle under their bed. 
Marty was upset that I broke out the window that he wanted my dad to pay for the replacement, or so I was told by another neighbor not sure if that was true or not. 
Shortly after the fire they moved away. I would just like to know how the girls ended up in life and if they remember that evening at all. I am sure the older sister does. About a year after the fire I moved away from home. 
The street name was Pondera and it was in Lancaster",,False,,t5_2tayf,False,,,True,t3_1d1mjp,http://www.reddit.com/r/RBI/comments/1d1mjp/looking_for_3_girls_i_saved_from_house_fire_when/,
