created_utc,score,domain,id,title,ups,downs,num_comments,permalink,selftext,link_flair_text,over_18,thumbnail,subreddit_id,edited,link_flair_css_class,author_flair_css_class,is_self,name,url,distinguished
1332165372.0,22,ieet.org,r3fq5,IEET Fellow Mike Treder is Missing,27,5,2,http://www.reddit.com/r/RBI/comments/r3fq5/ieet_fellow_mike_treder_is_missing/,,,False,,t5_2tayf,False,,,False,t3_r3fq5,http://ieet.org/index.php/IEET/more/treder20120318,
1329110381.0,24,self.RBI,pn31z,"X-Post from /r/gaming: ""Lock your doors when you leave your house, even if you're only going to the corner store. I'll tell you why...""",33,9,17,http://www.reddit.com/r/RBI/comments/pn31z/xpost_from_rgaming_lock_your_doors_when_you_leave/,"Throwaway because I'm ashamed of myself.

In pursuit of a better job, I had to sacrifice and move to a fairly shady part of Boston. Better rent, cool room mates, a place that was in fact nicer than my old place, but the area around us was fairly shady.

We live pretty much across the street from a corner store and it's no chore to walk there and back. Yesterday, I left the house (Unlocked even though I was the only one home) and went to the store to get some Arizona (A-Palms for life). When I got back I found stuff missing my from my room (Closest room to the front door). The list of missing shit:

* Droid (Plan B didn't work worth shit and Verizon is basically laughing at me because I installed CM7.)
* Guitar in hard, unmarked guitar case.
* Desktop computer (With all of the music I've written over the last 10 or so years).
* Laptop (Gaming-grade laptop with all of my accounts set to log in automatically) Side note: I have a BIOS password on it and Prey installed, but I'll tell you why that shit didn't work out for me in a minute.
* Nikon D700 + about $3000 of lenses + a couple years worth of photos.
* External hard drive

I'm lucky enough that they didn't try to take my 42"" monitor, but that would've been hard to run with I assume.

It wasn't a smash-and-grab job, but rather a ""we saw you leaving your house dark and walked in the front door"" job. I called the cops immediately using the phone at the corner store and they weren't even a little sympathetic. They tell me they can't do much because they didn't steal my gun and they didn't break anything. I asked if they could fingerprint and they said no. Yay. The neighbors were less than helpful (The ones who spoke English, anyway). I now have nothing. My roomie is nice enough to let me use his netbook until I can save up to buy all that shit back (Not going to happen any time soon).

What hurts pretty badly is that my Facebook, Soundcloud, deviantArt, Steam, Gmail and original Reddit account have since been hijacked. Google is being really, REALLY slow to help me. Like... One canned response. They're probably not going to be able to in at least a couple days because of my phone situation. Valve can't help because my Gmail is unrecoverable. Same with deviantArt and same with Facebook.

My girlfriend called my room mate wondering what the deal is with my Facebook which has been horrifically defaced. Friends messaged, my girlfriend's ""pictures"" distributed to a large portion of them.

My life is on fire and I have nothing. And to think, I was buying some Arizona so I could have a nice all-nighter of Skyrim with all my new mods.

Don't fuck up like I did. Don't.

EDIT: In my frustration, I forgot to add why Prey and my BIOS password isn't working. The photos of my girlfriend were on that laptop. I figure they reset BIOS with a battery pull or something. Either way, they got into my life and stirred the pot all the way.",,False,,t5_2tayf,False,,,True,t3_pn31z,http://www.reddit.com/r/RBI/comments/pn31z/xpost_from_rgaming_lock_your_doors_when_you_leave/,
1328923511.0,23,reddit.com,pk7dn,"My father's tools were stolen, I have found them on eBay. What shall I do reddit? ",25,2,6,http://www.reddit.com/r/RBI/comments/pk7dn/my_fathers_tools_were_stolen_i_have_found_them_on/,,,False,,t5_2tayf,False,,,False,t3_pk7dn,http://www.reddit.com/r/AskReddit/comments/pk0hi/my_fathers_tools_were_stolen_i_have_found_them_on/,
1328785107.0,24,reddit.com,pho01,"My father was one of those ""One Hit Wonders"" from the early 80s. He was murdered in 1990. I realize that this is a long shot, but Reddit, I need your help. ",27,3,1,http://www.reddit.com/r/RBI/comments/pho01/my_father_was_one_of_those_one_hit_wonders_from/,,,False,,t5_2tayf,False,,,False,t3_pho01,http://www.reddit.com/r/Music/comments/pgsfh/my_father_was_one_of_those_one_hit_wonders_from/,
1375924658.0,22,self.RBI,1jxbki,Threatening calls and texts from multiple numbers probably through Google Voice?,30,8,5,http://www.reddit.com/r/RBI/comments/1jxbki/threatening_calls_and_texts_from_multiple_numbers/,"Every time I block one number, they call or text from another number, sending messages like ""I'm going to buttf*** you until you bleed"" and such. Is there any way Icanfifigure out who it is? Stop it permanently? Anyone useful I can turn to for help? ",,False,,t5_2tayf,False,,,True,t3_1jxbki,http://www.reddit.com/r/RBI/comments/1jxbki/threatening_calls_and_texts_from_multiple_numbers/,
1374937980.0,22,self.RBI,1j5v57,Can r/rbi help me identify a potential scam ?,33,11,38,http://www.reddit.com/r/RBI/comments/1j5v57/can_rrbi_help_me_identify_a_potential_scam/,"So here's the situation. My mom works as a real estate agent in Caracas, Venezuela. A couple of days ago she got an email from someone who claims to be a vascular surgeon from California under the name of Dan Newton.

Everything seems a bit fishy to me, mainly because of 3 things

1. I don't know why a californian surgeon would ever want an appartment in Caracas. My dad says there are some surgeons from overseas that come and work here because they apparentlypay less taxes in Venezuela, but I don't think that's enough evidence for me to be sure everything is in check.

2. I read the e-mail he sent to my mom and it looks like the guy doesn't even know how to write in his own language. 

3. The guy says he specializes in vascular surgery, yet I still can't find anything about him on the internet.


Here's a textual copy of the email sent to my mother. I didn't post his full adress because I don't know if I am allowed, just the type of adress he is using. I will however, give them via PM to anyone who can help.

''Hello, I am Doctor Dan a surgeon from California, US. I saw your house listing for sale on Coldwellbanker site which I am interested in, Please get back to me on my personal email address so we can make neccesary arrangement for viewing and payment. -------@gmail.com Regards, Dan Newton, M.D. Specialty: Vascular Surgery ------@gmail.com -------@aol.com''


If anyonce can help me prove is this guy is real or not, me and my family would greatly appreciate it. Venezuela is a country where everything can happen unnoticed and I just want to avoid having a parent run into serious trouble or an unpleasent situation. I already told her to excercise some caution should anything else happen.
",,False,,t5_2tayf,False,,,True,t3_1j5v57,http://www.reddit.com/r/RBI/comments/1j5v57/can_rrbi_help_me_identify_a_potential_scam/,
1368219312.0,18,reddit.com,1e3b2x,Man got away with shooting this pug's sister. was not bitten but claimed he feared for his life.,39,21,3,http://www.reddit.com/r/RBI/comments/1e3b2x/man_got_away_with_shooting_this_pugs_sister_was/,,,False,,t5_2tayf,False,,,False,t3_1e3b2x,http://www.reddit.com/r/pugs/comments/1e38tw/this_poor_pugs_sister_was_shot_and_killed_by_her/,
1365523161.0,20,youtube.com,1bzuhv,Video from Syria: I am Syrian. Both civil war parties in Syria blame each other for the assassination of Albuti. Is this video fake? (Details inside),27,7,9,http://www.reddit.com/r/RBI/comments/1bzuhv/video_from_syria_i_am_syrian_both_civil_war/,,,False,,t5_2tayf,False,,,False,t3_1bzuhv,http://www.youtube.com/watch?v=XFGwwRQINvg,
1361058401.0,19,self.RBI,18nw6q,Burglar Caught on Video in Atlanta,28,9,5,http://www.reddit.com/r/RBI/comments/18nw6q/burglar_caught_on_video_in_atlanta/,"This video was at 7:30pm last night in Atlanta. After jumping an eight foot wall, this gentleman was attempting to break into our back door. I pulled up just in time. He then went to the neighbors house and did a lot of damage there, including stealing some very valuable jewelry. You can see photos of him here:

[1] http://imgur.com/a/qjgD9 

And video here:

[2] http://www.youtube.com/watch?v=ZxriryS56ao&amp;feature=youtu.be
",,False,,t5_2tayf,False,,,True,t3_18nw6q,http://www.reddit.com/r/RBI/comments/18nw6q/burglar_caught_on_video_in_atlanta/,
1358540951.0,20,self.RBI,16u46v,I need help identifying an intl phone number that has called me 5 times in the past day. Redditors? ,28,8,11,http://www.reddit.com/r/RBI/comments/16u46v/i_need_help_identifying_an_intl_phone_number_that/,"The first intelligible voicemail was car horns in the background. I just got one that has a woman saying hello? hello? - with other men (or tv) in the background speaking a non-english language. I usually backtrace them on google, but no luck. Here's part of the 12 digit number, in sequence: + 234 806 484 ****. I'll reveal the last four numbers or the voicemail if needed. 


Can anyone tell me what this is? I have my cell linked to my paypal account where I've bought things online. I have recently been subjected to credit card fraud so I don't want to call them back or anything. 

Notes below say it could be Ohio or Nigeria. But because it's 12 numbers I think Nigeria. I used the true caller app which matched Nigeria - &amp; it gave me an occupation and a name. This could have been inputted by the cell owner as a first and last name, I'm not sure how true caller works. Help?

http://en.wikipedia.org/wiki/Area_codes_234_and_330

http://answers.yahoo.com/question/index?qid=20090104124106AA3CPrk


",,False,,t5_2tayf,False,,,True,t3_16u46v,http://www.reddit.com/r/RBI/comments/16u46v/i_need_help_identifying_an_intl_phone_number_that/,
1350354097.0,21,self.RBI,11jr02,Not a tradition RBI case- my half-brother contracted an airborne virus; no one remembers the name.,28,7,10,http://www.reddit.com/r/RBI/comments/11jr02/not_a_tradition_rbi_case_my_halfbrother/,"Help, my Google skills are failing me.

This particular year was rough for my dad- his oldest daughter was a middle schooler, his wife was pregnant, and his already disabled 8-year-old son acquired a virus that was determined to be airborne.  It left him blind in one eye (&lt;15% vision in that eye until corrective surgery in 2004) and damaged sight slightly in the other.

No one remembers the name of the virus.  My half-sister was 12, I don't expect her to remember.  My mom was pregnant with me, and my older siblings aren't her kids, so she doesn't remember.  My dad, as I said, was having a rough year due to those life stressors.  He ""doesn't want to bother"" contacting his ex-wife to find out the name of it strictly because I'm curious.  I don't really want to either, because I've met her twice in my life and it would be weird.  My half-brother is mentally and physically disabled, and knows about as much as he does about his health conditions as he does about calculus.

Any medical professionals of Reddit know what this could be?  I feel like conjunctivitis and herpes would've been simple enough to remember, so I'm guessing it was neither of those.  Plus, my family always seems to tack on ""rare airborne disease"" when talking about my brother's blindness, which also leads to my tentative conclusion that it is not conjunctivitis or herpes.

This was in the late 1980s in the Midwest of the USA, if that helps at all.",,False,,t5_2tayf,False,,,True,t3_11jr02,http://www.reddit.com/r/RBI/comments/11jr02/not_a_tradition_rbi_case_my_halfbrother/,
1346898061.0,20,self.RBI,zffh1,I'm afraid I got scammed out of $800... help please!,22,2,9,http://www.reddit.com/r/RBI/comments/zffh1/im_afraid_i_got_scammed_out_of_800_help_please/,"I think I may have fucked up... now I need to try to figure out how to make it right if I can.
Three weeks ago I bought a 1978 ford truck in Texas. I bought the truck on a Sunday and was told that the notary who has the title wouldn't be open until Monday. OK, in figured it wasn't a big deal. This is the first Time I've bought a used vehicle so I had No idea how important the title is. I know, I'm stupid, I should never have bought it with no title.
Anyway, I have a bill of sale that says I would receive the title by the 20th, but obviously that never happened.
Now the title is supposedly en route to me in the mail, but it was supposed to be here last week. I have the guy's name and number. He apparently owns a roofing company, I googled him. He's not answering my calls.
I really just want to know what the deal is with this truck... stolen, lost title, salvage title, whatever. In looked up the VIN, no records. I have no idea where the title is or who it's titled to.
Any ideas what I can do?",,False,,t5_2tayf,False,,,True,t3_zffh1,http://www.reddit.com/r/RBI/comments/zffh1/im_afraid_i_got_scammed_out_of_800_help_please/,
1330560312.0,20,reddit.com,qc3si,"Work at a bar, have cell video of MGR stealing $$ from tipjar",23,3,2,http://www.reddit.com/r/RBI/comments/qc3si/work_at_a_bar_have_cell_video_of_mgr_stealing/,,,False,,t5_2tayf,False,,,False,t3_qc3si,http://www.reddit.com/r/AskReddit/comments/qaomk/work_at_a_bar_have_cell_video_of_mgr_stealing/,
1368587650.0,20,imgur.com,1eczyx,"Stolen: Generator 5-14-2013. It was taken from my grandfather's workplace in San Diego California by a man wearing a reflective vest. The pictures are blurry, so any help we can get is appreciated. Identifying the suspect might be our best shot.",23,3,10,http://www.reddit.com/r/RBI/comments/1eczyx/stolen_generator_5142013_it_was_taken_from_my/,,,False,,t5_2tayf,False,,,False,t3_1eczyx,http://imgur.com/a/6jITA,
1366906978.0,20,myfoxny.com,1d3a29,2 children wanted in Central Park attempted robbery,25,5,5,http://www.reddit.com/r/RBI/comments/1d3a29/2_children_wanted_in_central_park_attempted/,,,False,,t5_2tayf,False,,,False,t3_1d3a29,http://www.myfoxny.com/story/22073625/2-children-wanted-for-central-park-robbery,
1361318242.0,20,self.RBI,18unmr,Update on my Grandpa,27,7,17,http://www.reddit.com/r/RBI/comments/18unmr/update_on_my_grandpa/,"http://www.reddit.com/r/conspiracy/comments/17qw3x/here_i_go_my_grandfather_was_what/ 

I have a little update. The FOIA request is still processing. Something very strange happened to me this morning. I was emailing few family members regarding the case when I went to my desktop to attach a few files from the folder I made specifically for my Grandpa's disappearance. I left it on my desktop, in plain view, to remind myself to keep my search going.

Well, the folder wasn't there anymore. I thought maybe I misplaced it... I searched for it both manually and automatically. I tried every word I could think of that was in the file names, NOTHING. ZERO. It's like the folder never existed. Even tried to do the file recovery. NADA. It somehow got wiped off my computer and I'm PISSED. 

I don't know if it was intentional or I was really a dumbass, but I'm pretty sure I would have known it if I deleted the entire folder full of articles, photographs, etc. I just feel completely invaded... I'm also puzzled, why would someone do this? I didn't think it was that important to go onto my computer and just delete it? There was no bombshell in there. Just same ol' information. 

Is it a threat? A warning of some kind? It's giving me even more reason to get into this deeper... I still have some of the folder's contents stored elsewhere so I'm okay. But dayum, I should have backed up the whole folder onto a flashdrive or something. Any ideas of what I should do next? :/ I'm trying not to get paranoid, but wtf I can't believe that this happened to me. Something is DEFINITELY going on and I'm kinda in a freak out mode now. 

Edit: I'm now going on a hunt for his briefcase. If you know of an old briefcase with initials of VH on it around Rockford, IL. Let me know! ",,False,,t5_2tayf,1361375579.0,,,True,t3_18unmr,http://www.reddit.com/r/RBI/comments/18unmr/update_on_my_grandpa/,
1358662241.0,19,self.RBI,16x2eo,"Bought a phone off craigslist then discovered it had been stolen; therefore turning my $310 phone into a glorified ipod. I need your help! (Tucson, AZ)",24,5,17,http://www.reddit.com/r/RBI/comments/16x2eo/bought_a_phone_off_craigslist_then_discovered_it/,"This ""normal"" seeming college-aged kid sold me an iPhone with a couple of accessories for $310 yesterday (1/18). 

After a trip to the Verizon store I discovered the phone had been reported as stolen. As per Verizon policy, no stolen phone can be reactivated regardless of context. 

My repeated phone calls go unanswered presumably because he knew he was f'n me over.

I would like to find out his whole name and maybe an address just to leverage getting my money back. I'd never resort to physical harm or property damage fyi. In fact I plan on filing a police report regardless of how the situation plays out.

Please let me know if you have the resources to transform a phone number into personal info and I will supply the number!

As a college kid this is a lot of money! Please help!",,False,,t5_2tayf,False,,,True,t3_16x2eo,http://www.reddit.com/r/RBI/comments/16x2eo/bought_a_phone_off_craigslist_then_discovered_it/,
1354889518.0,19,reddit.com,14fzof,"Xpost: Have any of you successfully identified a person from a missing persons poster/billboard, resulting in their safe return home? If so, please tell us your story! : AskReddit",25,6,0,http://www.reddit.com/r/RBI/comments/14fzof/xpost_have_any_of_you_successfully_identified_a/,,,False,,t5_2tayf,False,,,False,t3_14fzof,http://www.reddit.com/r/AskReddit/comments/14fqmg/have_any_of_you_successfully_identified_a_person/,
1354397234.0,20,imgur.com,144biw,"In honor of World AIDS Day, I'd love to find the family of the guy on my PWA Memorial bracelet.",27,7,6,http://www.reddit.com/r/RBI/comments/144biw/in_honor_of_world_aids_day_id_love_to_find_the/,,,False,,t5_2tayf,False,,,False,t3_144biw,http://imgur.com/kd9ja,
1350814668.0,20,self.RBI,11u80u,Recommendations on background check sites,26,6,16,http://www.reddit.com/r/RBI/comments/11u80u/recommendations_on_background_check_sites/,"I've seen sites like privateeye.com, beenverified.com, etc. These sites seem rather scammish to me, I was wondering if RBI has any input on some good sites to use for some basic fact checking?

Criminal history, previous addresses, marriage records, that kind of thing.",,False,,t5_2tayf,False,,,True,t3_11u80u,http://www.reddit.com/r/RBI/comments/11u80u/recommendations_on_background_check_sites/,
1345845244.0,20,reddit.com,yrz0i,Crosspost -- NYC field office: can you track this mystery noise that's been driving people crazy for almost 2 years?  Video and backstory inside.,23,3,2,http://www.reddit.com/r/RBI/comments/yrz0i/crosspost_nyc_field_office_can_you_track_this/,,,False,,t5_2tayf,False,,,False,t3_yrz0i,http://www.reddit.com/r/nyc/comments/yrydm/mystery_noise_on_east_ninth_street_is_driving/,
1339633498.0,19,studentlife.mit.edu,v0rxk,[X-Post from r/MIT] Help MIT community return class ring found in Vietnam War 40 years ago!,27,8,1,http://www.reddit.com/r/RBI/comments/v0rxk/xpost_from_rmit_help_mit_community_return_class/,,,False,,t5_2tayf,False,,,False,t3_v0rxk,http://studentlife.mit.edu/vietnamring,
1339318984.0,18,reddit.com,uuer9,"Redditors, maybe we can help this aquarium enthusiast find out what killed his beloved fry :-(",21,3,0,http://www.reddit.com/r/RBI/comments/uuer9/redditors_maybe_we_can_help_this_aquarium/,,,False,,t5_2tayf,False,,,False,t3_uuer9,http://www.reddit.com/r/Aquariums/comments/utvth/today_has_totally_sucked/,
1338694855.0,21,reddit.com,ui4pi,Let's do this CSI style,24,3,1,http://www.reddit.com/r/RBI/comments/ui4pi/lets_do_this_csi_style/,,,False,,t5_2tayf,False,,,False,t3_ui4pi,http://www.reddit.com/r/WTF/comments/uh6ad/ra_dickey_interviewed_after_the_mets_no_hitter/c4vf7hb,
1329273420.0,20,reddit.com,pq3sy,Police catch train phone thief caught on camera : london,24,4,1,http://www.reddit.com/r/RBI/comments/pq3sy/police_catch_train_phone_thief_caught_on_camera/,,,False,,t5_2tayf,False,,,False,t3_pq3sy,http://www.reddit.com/r/london/comments/pp0fs/police_catch_train_phone_thief_caught_on_camera/,
1376323277.0,19,self.RBI,1k7ohy,Bypassing an Iphone 4 password of a theif,41,22,29,http://www.reddit.com/r/RBI/comments/1k7ohy/bypassing_an_iphone_4_password_of_a_theif/,"Two nights ago someone broke into our house. He trashed everything and stole $250 in cash. Afterwards must have passed out on the lawn because he dropped his iphone 4. Unfortunately it has a passcode. I've been trying all day to bypass the passcode with no luck. Its an Iphone 4(No SIM tray), on Sprint and running iOS 6.1.3. Gecko toolkit won't work and multiple iphone file browsers can't access the directory so i can't manually delete the passcode. I've pretty much exausted my knowledge of bypassing an iphone and thought I would bring it Reddit for help so I can find who broke into my house. I really would appreciate any help.

Thanks, PB",,False,,t5_2tayf,False,,,True,t3_1k7ohy,http://www.reddit.com/r/RBI/comments/1k7ohy/bypassing_an_iphone_4_password_of_a_theif/,
1369863587.0,18,self.RBI,1fan3z,I am a journalist. I need help tracking an IP,32,14,16,http://www.reddit.com/r/RBI/comments/1fan3z/i_am_a_journalist_i_need_help_tracking_an_ip/,"Hi /r/RBI,

I work for a newspaper. Our comment system works anonymously, and someone posted a comment with some pretty revealing personal information on the staff of the paper, including stuff that clearly required credit checks and/or criminal background checks.

The only thing we have is an IP address. Is there any way we can get more information about that, such as cross-checking it with known IP addresses of local businesses, etc.?

Thanks!",,False,,t5_2tayf,False,,,True,t3_1fan3z,http://www.reddit.com/r/RBI/comments/1fan3z/i_am_a_journalist_i_need_help_tracking_an_ip/,
1369714800.0,21,self.RBI,1f6ixi,Looking for the person who catfished me,42,21,20,http://www.reddit.com/r/RBI/comments/1f6ixi/looking_for_the_person_who_catfished_me/,"* Hello Reddit. This day, 2 years ago, my life was completely flipped upside down when the girl I had been e-dating for a year+ turned out to be a guy all along. Upon finding out, he completely disappeared and I haven't seen him since. Since then, I have been plagued with numerous questions about the entire ordeal and could seriously benefit from some closure from the entire event. In addition to this, it would also mean a lot to me, as I'm sure it would others, if I could make sure this never happens to anyone else, as maybe she has other victims. In addition to this, I'm sure the girl he's pretending to be wouldn't be too thrilled about him posting her picture around. 

* So here's the information I know about him. The name he went by was Regina. He has an account on D2Jsp forums called RvBFan, and was a massive fan of Red Vs. Blue. He played many games, including Diablo 2, Starcraft and CoD Black Ops 2. He was an avid fan of football. He claimed to live in Houghton, Michigan. He'd always used proper grammar/punctuation when talking. He's 24. He's very tech saavy and is going to be making a living doing things with computers.
* Last of all, this is the girl he posed as: http://i.imgur.com/YA3bKY9.jpg

* I realize this probably seems pathetic, but it seriously messed me up something pretty awful. I don't want anyone to ever go through what I did when this shit happened.
",,False,,t5_2tayf,False,,,True,t3_1f6ixi,http://www.reddit.com/r/RBI/comments/1f6ixi/looking_for_the_person_who_catfished_me/,
1367698650.0,18,self.RBI,1dp14d,Had my original Yahoo! account compromised; original Twitter account compromised; and now my GMail account had a suspicious attempt at access...all from Russia?,25,7,6,http://www.reddit.com/r/RBI/comments/1dp14d/had_my_original_yahoo_account_compromised/,"RBI,

I've had a lot of problems with online security lately (the past year) and lost my original Twitter account and had to do A LOT of cleaning from my Yahoo! email account. Earlier today I received a security message from Google saying someone tried to access my account.


**Here's the information I was given:**


Saturday, May 4, 2013 5:56:05 PM UTC


IP Address: 89.250.157.77


Location: Tyumen, Tyumen Oblast, Russia 


This is the third ""attack"" with a Russian location. Does anyone know what this means - if anything? Do I need better internet security? Would love to hear y'alls thoughts. Many thanks in advance for any advice! 

EDIT: THANKS everyone for your advice! I learned a ton from all the info given, and hopefully, will be better protected in the future. Can't thank you all enough!!",,False,,t5_2tayf,1367725918.0,,,True,t3_1dp14d,http://www.reddit.com/r/RBI/comments/1dp14d/had_my_original_yahoo_account_compromised/,
1363956009.0,19,youtube.com,1asni3,[VIDEO] Philly police need your help identifying triple shooter ,21,2,3,http://www.reddit.com/r/RBI/comments/1asni3/video_philly_police_need_your_help_identifying/,,,False,,t5_2tayf,False,,,False,t3_1asni3,http://www.youtube.com/watch?v=CdwcnpJWBws,
1362253187.0,20,self.RBI,19jb4u,"A friend is probably getting catfished. She's wise to it now, we're just trying to figure out who the phone number belongs to.",33,13,22,http://www.reddit.com/r/RBI/comments/19jb4u/a_friend_is_probably_getting_catfished_shes_wise/,"Of course I know not to publish personal information here, but does anyone have any good resources for finding out who owns a phone number or who it is registered to?",,False,,t5_2tayf,False,,,True,t3_19jb4u,http://www.reddit.com/r/RBI/comments/19jb4u/a_friend_is_probably_getting_catfished_shes_wise/,
