created_utc,score,domain,id,title,ups,downs,num_comments,permalink,selftext,link_flair_text,over_18,thumbnail,subreddit_id,edited,link_flair_css_class,author_flair_css_class,is_self,name,url,distinguished
1353315134.0,50,self.RBI,13fz1a,"RBI, Can someone teach me/us proper internet investigation[or atleast point us somewhere we can learn]?",67,17,19,http://www.reddit.com/r/RBI/comments/13fz1a/rbi_can_someone_teach_meus_proper_internet/,"How do people track ip's?
How do people gather social accounts?
How do people extract gps data from images, etc, etc..

After witnessing the amazing justice of the Anonymous v. Teenagers incident, it's something I think more of us [the atleast somewhat technologically proficient] should know...

Link: http://www.dailydot.com/news/anonymous-kylie-suicide-trolls-bully/

Edit: whilst I have no way of proposing just intentions, it would be pretty dumb of someone to ask the RBI if they were up to no good... ",,False,,t5_2tayf,1353331259.0,,,True,t3_13fz1a,http://www.reddit.com/r/RBI/comments/13fz1a/rbi_can_someone_teach_meus_proper_internet/,
1370578365.0,44,wfaa.com,1fubom,Reward offered for suspect in fatal carjacking of elderly Arlington woman,58,14,0,http://www.reddit.com/r/RBI/comments/1fubom/reward_offered_for_suspect_in_fatal_carjacking_of/,,,False,,t5_2tayf,False,,,False,t3_1fubom,http://www.wfaa.com/news/crime/arlington-police-searching-for-car-in-carjacking-kidnapping-210082801.html,
1368582912.0,44,m011y.imgur.com,1ecu4a,$100 or Redditgold for any info leading me to the bastard who stole my from Salt Lake City (details in comments),57,13,17,http://www.reddit.com/r/RBI/comments/1ecu4a/100_or_redditgold_for_any_info_leading_me_to_the/,,,False,,t5_2tayf,False,,,False,t3_1ecu4a,http://m011y.imgur.com/,
1352449220.0,43,52firstdates.com,12wlmn,Hi RBI. A serial internet stalker has been targeting women via dating sites in the UK. Can we catch him?,64,21,40,http://www.reddit.com/r/RBI/comments/12wlmn/hi_rbi_a_serial_internet_stalker_has_been/,,,False,,t5_2tayf,False,,,False,t3_12wlmn,http://www.52firstdates.com/2012/11/sebastian-pritchard-jones-strikes-back.html,
1343457444.0,48,reddit.com,xafir,"[x-post from askreddit] This is a long shot, but I'm asking reddit for help. A couple of friends of a friend attempting a first ascent on the south face of Palcaraju Oeste in Peru and have been missing for over 5 days. Can anyone help?",57,9,1,http://www.reddit.com/r/RBI/comments/xafir/xpost_from_askreddit_this_is_a_long_shot_but_im/,,,False,,t5_2tayf,False,,,False,t3_xafir,http://www.reddit.com/r/AskReddit/comments/x9ss7/this_is_a_long_shot_but_im_asking_reddit_for_help/,
1376338590.0,43,self.RBI,1k8978,"Wedding party robbed during ceremony {Milwaukee, WI}",57,14,8,http://www.reddit.com/r/RBI/comments/1k8978/wedding_party_robbed_during_ceremony_milwaukee_wi/,"My wife and her friend had their iPhone's, purses, and car keys stolen this weekend. We filed a police report right away but have since learned some new information.

1.One of the CC's was used at the Citgo gas station at 6325 N. 76th st.   
2. My wife's phone made two phone calls right after it was taken. We called the numbers and one lady was kind enough to give us her first and last name.  
3. Later that night my wife's ""Find my iPhone"" app pinged the phone at at a strip mall at 27th and Center. There is a Boost mobile and a check cashing store there. I called the cell phone store they say they don't buy cellphones. I spoke to the check cashing place, they have camera's that cover the storefronts and some of the lot.  

The gas station and the strip mall both have security camera's, we know exactly when the person/person's were there. What should I do next? I'm also assuming the lady who gave us her name knows who called her on Saturday. How do I get a police officer to ask her?

I know the chances of us getting anybody's property returned is pretty slim. But this slim-ball deserves what's coming to them. Who steals thing from inside a church?

Thoughts?
",,False,,t5_2tayf,False,,,True,t3_1k8978,http://www.reddit.com/r/RBI/comments/1k8978/wedding_party_robbed_during_ceremony_milwaukee_wi/,
1375078093.0,46,self.RBI,1j9fbs,Help find a long lost internet buddy - archymage1!,64,18,6,http://www.reddit.com/r/RBI/comments/1j9fbs/help_find_a_long_lost_internet_buddy_archymage1/,"Hi, been stalking reddit for a while now and thought I'd join w this request. Back in probably 2007ish I made a friend over runescape, so close that I lied to my parents to pay for their membership because this kid had parents going through a divorce at the time. I only know a runescape username and first name of this girl. All google web searches for the username pull up only stupid things I've done with the username since we shared the account right before she disappeared off the planet (said her parents might be moving and cutting the Internet). Thanks reddit",,False,,t5_2tayf,False,,,True,t3_1j9fbs,http://www.reddit.com/r/RBI/comments/1j9fbs/help_find_a_long_lost_internet_buddy_archymage1/,
1372104628.0,43,huffingtonpost.com,1gznk9,Let's try to find the person who used a golf club to beat a turtle in Wisconsin.,65,22,6,http://www.reddit.com/r/RBI/comments/1gznk9/lets_try_to_find_the_person_who_used_a_golf_club/,,,False,,t5_2tayf,False,,,False,t3_1gznk9,http://www.huffingtonpost.com/2013/06/13/turtle-beaten-golf-course_n_3434177.html,
1361571448.0,43,youtube.com,191p9n,Can we get the people in these vids charged with anything? Can you find who they are?,63,20,25,http://www.reddit.com/r/RBI/comments/191p9n/can_we_get_the_people_in_these_vids_charged_with/,,,False,,t5_2tayf,False,,,False,t3_191p9n,https://www.youtube.com/user/theCHAIZYchannel?feature=watch,
1361346860.0,47,reddit.com,18vjsd,"Xpost: Reddit user lejefferson uses mad detective skills to uncover the identity of a man in a photo on the wall of a secret hotel room in Houston as an investment banking executive who's company was recently indicted for fraud, potentially uncovering a sex scandal/high society underground sex ring.",58,11,0,http://www.reddit.com/r/RBI/comments/18vjsd/xpost_reddit_user_lejefferson_uses_mad_detective/,,,False,,t5_2tayf,False,,,False,t3_18vjsd,http://www.reddit.com/r/bestof/comments/18tj7s/reddit_user_lejefferson_uses_mad_detective_skills/,
1360202679.0,43,self.RBI,181eeh,Georgia Nolan has never been found.,53,10,13,http://www.reddit.com/r/RBI/comments/181eeh/georgia_nolan_has_never_been_found/,"She was last seen November 28, 1976.  She got out of the vehicle that she was in near the Kentucky/Illinois border.  She was traveling with her estranged husband at the time.
She was born June 5, 1946 and was 30 years old when she disappeared.  She was 5'4-5'5""; 120-130 lbs with dark brown hair, and brown eyes. She was a smoker.  She had a scar on her forehead and severe scarring from deep stab wounds on her lower back. On the back of her neck she had a large mole.  She had given birth to four children, the last via Cesarean section two months before her disappearance. She was possibly wearing an Indian style shirt of unknown design and a cross necklace.
Her favorite color was yellow. 

* Her profile in NamUs: [https://www.findthemissing.org/cases/1295](https://www.findthemissing.org/cases/1295)
* Georgia's page on FB: [http://www.facebook.com/MissingPersonColdCase1976](http://www.facebook.com/MissingPersonColdCase1976)
* Doe Network Profile: [http://doenetwork.org/cases/1515dfky.html](http://doenetwork.org/cases/1515dfky.html)

Thanks for taking time to look. ",,False,,t5_2tayf,False,,,True,t3_181eeh,http://www.reddit.com/r/RBI/comments/181eeh/georgia_nolan_has_never_been_found/,
1358894244.0,46,self.RBI,1730n3,"Reddit, after a break-in my Xbox was one of the many items taken. With an Xbox live account already activated on the system, what would you do to track these guys and bring them to justice? [x-post/askreddit]",56,10,7,http://www.reddit.com/r/RBI/comments/1730n3/reddit_after_a_breakin_my_xbox_was_one_of_the/,,,False,,t5_2tayf,False,,,True,t3_1730n3,http://www.reddit.com/r/RBI/comments/1730n3/reddit_after_a_breakin_my_xbox_was_one_of_the/,
1357154053.0,45,self.RBI,15u8n1,"I lost my Galaxy S3 - I got Prey, Cerberus and Lookout mobile on it - and i got a ringing signal. But I got nothing. Please Help!!!",54,9,19,http://www.reddit.com/r/RBI/comments/15u8n1/i_lost_my_galaxy_s3_i_got_prey_cerberus_and/,"Hey RBI

I prepared myself to this day. I lost my phone (and wallet) on my way home from new years eve.. I either got it stolen or lost in my drunkness. 

I have Prey Project, Cerberus App and Lookout mobile security installed on it. Also I didn't set any pincode or security to open og turn it on. So everybody can have access to it. But I did put up security - everytime someone tries to open facebook, gmail or something else that would compromise my persona - it ask for a pincode. That way, maybe a thieft would use the phone... And I could track him down easier. 

But none of the programs can give my any data, since they have problems connection to the phone. Even though, when I call it - it gives my the ringtone...

Also when I go to google play, I tried to install apps on it. And it says it done it without problems....

Im from Denmark, Copenhagen - if it helps.

Please give me some tricks or help me out RBI!!!


",,False,,t5_2tayf,1357159365.0,,,True,t3_15u8n1,http://www.reddit.com/r/RBI/comments/15u8n1/i_lost_my_galaxy_s3_i_got_prey_cerberus_and/,
1354755356.0,43,youtube.com,14ctef,"Video of Motorcycle Thieves, their Car and License Plate.  Need help ENHANCING THE VIDEO and SOLVING THE CRIME.  ",50,7,18,http://www.reddit.com/r/RBI/comments/14ctef/video_of_motorcycle_thieves_their_car_and_license/,,,False,,t5_2tayf,False,,,False,t3_14ctef,http://www.youtube.com/watch?v=WachSg0dtyw&amp;feature=youtu.be,
1350950296.0,49,self.RBI,11wujt,"iPhone 4 stolen a few months ago, recently getting contacts pushed to phone",56,7,21,http://www.reddit.com/r/RBI/comments/11wujt/iphone_4_stolen_a_few_months_ago_recently_getting/,"a few months ago my mom had her purse stolen in Atlantic City; along with her purse $200 cash, all her credit and ATM cards and SS card (don't ask they were closing on a house) - took it as an experience and bought a new iPhone. 

Now ~2 months later I am getting some of their contacts, their foot doctor and a few blank contacts and some movie interests pushed to my iCloud account and dropped directly into my contacts, wondering if there is anything I could do? So far no ""mom"" or ""home"" numbers unfortunately. 

I have paperwork filed with the police with the serial and IMEI of the stolen phone but I know a stolen iPhone and purse would not be on the top of their to-do lists, plus I do not know if someone maybe bought the phone stolen and did not know.

**TL;DR - iphone got stolen, two months later their contacts are being pushed to my phone.**",,False,,t5_2tayf,False,,,True,t3_11wujt,http://www.reddit.com/r/RBI/comments/11wujt/iphone_4_stolen_a_few_months_ago_recently_getting/,
1373675944.0,42,youtube.com,1i6w33,"Van hits mom, stroller, child Then flees",65,23,10,http://www.reddit.com/r/RBI/comments/1i6w33/van_hits_mom_stroller_child_then_flees/,,,False,,t5_2tayf,False,,,False,t3_1i6w33,http://www.youtube.com/watch?v=pOYhhbOkOoU,
1365011603.0,44,self.RBI,1blnap,Trying to find inheritance my mom is hiding from me.,58,14,31,http://www.reddit.com/r/RBI/comments/1blnap/trying_to_find_inheritance_my_mom_is_hiding_from/,"Someone suggested I crosspost from r/frugal... this looks super cool so I'm gonna give it a try. 

Basically, I have almost no money and I have an opportunity to go abroad and possibly perform for agents who are interested in me. (not a sketchy situation, I have more details if people are interested.) However, I need money to do that.

Many years ago, my mom would tell me about a CD that my grandparents left for me when they died when I was little, and how it was near $15,000 in initial money + interest. When I turned 18, she woke me up at like 8 AM and forced me to go down to the bank to sign it over to me, so that my father couldn't have access to it if she were to unexpectedly pass away. Needless to say, they didn't have a good relationship.

Two years ago, my parents (who are kind of crazy I will admit) stopped speaking to me on account of my significant other, who is of a different race than I am. We haven't spoken for two years.
Long story short, I really want that money and before we stopped speaking, I asked about it (when I first graduated college) and all my mom would say was ""I don't want you spending that, it's for saving, you can just ask me for money"". I am not even sure what bank it is at but I do have a few ideas (commerce, chase, or TD bank.)

Is there any way to track down this money? Could I call and just give my social security number? It seems so weird to call a bank and be like ""hey I MIGHT have an account with thousands of dollars in it, but not sure"" without explaining the parental situation.",,False,,t5_2tayf,False,,,True,t3_1blnap,http://www.reddit.com/r/RBI/comments/1blnap/trying_to_find_inheritance_my_mom_is_hiding_from/,
1363062382.0,44,kpic.com,1a4omz,Murder suspect at large in NW,52,8,11,http://www.reddit.com/r/RBI/comments/1a4omz/murder_suspect_at_large_in_nw/,,,False,,t5_2tayf,False,,,False,t3_1a4omz,http://www.kpic.com/news/local/Murder-suspect-at-large-in-NW-I-cant-stress-how-dangerous-this-guy-is-197179471.html,
1357749332.0,45,chessbase.com,1696vi,"25-year-old untitled Bulgarian player mysteriously smashes Grandmasters with perfect play. No cheating officially found, yet trainer presents convincing analysis. [x-post from r/chess]",57,12,8,http://www.reddit.com/r/RBI/comments/1696vi/25yearold_untitled_bulgarian_player_mysteriously/,,,False,,t5_2tayf,False,,,False,t3_1696vi,http://chessbase.com/newsdetail.asp?newsid=8760,
1355183265.0,47,newyork.cbslocal.com,14mt3w," Suspect Attacked, Robbed 85-Year-Old Woman In Elevator ",50,3,2,http://www.reddit.com/r/RBI/comments/14mt3w/suspect_attacked_robbed_85yearold_woman_in/,,,False,,t5_2tayf,False,,,False,t3_14mt3w,http://newyork.cbslocal.com/2012/12/10/nypd-suspect-attacked-robbed-85-year-old-woman-in-elevator/,
1372635660.0,40,facebook.com,1he5de,"In October 1996, this Jane Doe checked into a Seattle hotel room and committed suicide by drinking cyanide. She is only known by the alias she left behind: ""Mary Anderson.""",67,27,4,http://www.reddit.com/r/RBI/comments/1he5de/in_october_1996_this_jane_doe_checked_into_a/,,,False,,t5_2tayf,False,,,False,t3_1he5de,https://www.facebook.com/pages/The-Case-of-Mary-Anderson/555011514520773,
1367504452.0,42,self.RBI,1djvcu,Pretty sure someone is trying to scam me on CL right now. I have a 'name' and phone number (likely prepaid). Can we find this scammer?,69,27,32,http://www.reddit.com/r/RBI/comments/1djvcu/pretty_sure_someone_is_trying_to_scam_me_on_cl/,"I have an item listed on CL. I am located in San Francisco. Here is the communication I've had so far:


**First email**: Still for sale? Your phone number#?

**My response**: Hi - yes. The camera is still available. My number is [my number]. Can you let me know when you plan to call? Thanks.


**Following over text**: (ongoing, will update as messages come in)

**Scammer**: Hello...its [name withheld] from Craigslist.

**Me**: Hi [name withheld]. Do you have a question?

**Scammer**: (1/2) Sounds good,i am a member of the US Marine and currently on duty right now. I am getting it for my son who is studying abroad as a surprise gift I accept (2/2) your price and will be adding $80 for shipping fee..so get back to me now with your PayPal email for an instant payment.

**Me**: I don't have pay pal. [Getting suspicious, so I lie.]

**Scammer**: Okay...You can set it up at www.paypal.com on your phone browser or computer...so around what time should i text you back?

**Me**: Where are you located? I prefer to deal in person.

**Scammer**: (1/2) told you earlier. I'm a marine officer and am in boot-camp right now training new recruits so am very busy that's why i want you to help me in shipping (2/2)it to him. am very sure $80 will cover the shipping

**Me**: Where will it be shipped to?

**Scammer**: Nigeria

**Me**: Oh ok. Where in Nigeria? [I actually have a close friend living in a major city there. I was going to just call his bluff and say my friend will deliver the item...]

**Scammer**: ABK, am very sure $80 will cover the shipping just get back to me with your paypal account email



So... any thoughts on catching this dude? I'm getting texts from a U.S. 424 number (LA). It seems like a crappy prepaid dumb phone given the (1/1)'s and (1/2)'s in front of the longer text messages....
",,False,,t5_2tayf,1367505182.0,,,True,t3_1djvcu,http://www.reddit.com/r/RBI/comments/1djvcu/pretty_sure_someone_is_trying_to_scam_me_on_cl/,
1363576914.0,44,kutv.com,1ai5gc,"Co-Worker had this happen today, need help locating purse",56,12,8,http://www.reddit.com/r/RBI/comments/1ai5gc/coworker_had_this_happen_today_need_help_locating/,,,False,,t5_2tayf,False,,,False,t3_1ai5gc,http://www.kutv.com/news/top-stories/stories/vid_4231.shtml?wap=0&amp;,
1359619822.0,43,self.RBI,17mbmh,New leads on a stolen laptop,50,7,5,http://www.reddit.com/r/RBI/comments/17mbmh/new_leads_on_a_stolen_laptop/,"A few months ago I started a post about a stolen macbook pro. My icloud account had been signed on to the laptop but bootcamp always booted windows. In the first 3 months there was no activity at all but the laptop miraculously started sending me it's location. Whom ever had the macbook had figured out how to boot into the mac side. I called up the police and opened up a case. And for months I have been gathering data on it's location.

I still didn't have much information to retrieve the laptop... I kind of just gave up but kept having Find My iPhone give me it's location to gather up an archive of where it's located and used most. Today months after all this tracking I look through my contacts and see two names I have never seen before. One was an odd Spanish first and last name, the second contact was called mi amor mesa which means my love mesa. I went on Facebook and copied the phone number. It gave me a profile and I was even able to verify this person lived in the area where my laptop was being tracked. I lurk through the profile and I see he's in a relationship with a woman who's last name happens to be mesa.. coincidence? 

oh wait there's an email too???? not sure if it was a typo but the word music in it was spelled as miusic...

Looking at his Facebook photos he seems to be into the whole hey I'm a cuban with a mac making music scene.

Think I've found the person who has my laptop and if I give the detective on my case this information he'll actually help me retrieve it?

Other than my icloud account being signed on it I have no other proof that it's my laptop. No receipts no serial number. But I'm 100% this guy is a moron and doesn't know how to sign out of my account...",,False,,t5_2tayf,False,,,True,t3_17mbmh,http://www.reddit.com/r/RBI/comments/17mbmh/new_leads_on_a_stolen_laptop/,
1352483451.0,43,self.RBI,12x83m,"Do you live in El Paso, TX, USA with the IP 64.134.24.42? You're computer might be a zombie!!",83,40,11,http://www.reddit.com/r/RBI/comments/12x83m/do_you_live_in_el_paso_tx_usa_with_the_ip/,"Someone at this IP address tried to gain access to my email account. They failed but I am also sure that the person trying to gain access wasn't at this address (no hacker worth his salt would try that). So if this is you, your computer is [compromised](http://en.wikipedia.org/wiki/Zombie_(computer_science\))!",,False,,t5_2tayf,False,,,True,t3_12x83m,http://www.reddit.com/r/RBI/comments/12x83m/do_you_live_in_el_paso_tx_usa_with_the_ip/,
1346868565.0,42,reddit.com,zek25,"Girl photographs thieves in Fayetteville, NC near Jack Britt High School. Can anybody Identify? ",44,2,2,http://www.reddit.com/r/RBI/comments/zek25/girl_photographs_thieves_in_fayetteville_nc_near/,,,False,,t5_2tayf,False,,,False,t3_zek25,http://www.reddit.com/r/Assistance/comments/ze7yi/girl_has_photo_of_guy_robbing_her_parents_anybody/c63visg,
1345434860.0,40,self.RBI,yi8kp,Girl in South Carolina has gone missing.  Possible kidnapping.  (cross post from /r/askreddit),49,9,1,http://www.reddit.com/r/RBI/comments/yi8kp/girl_in_south_carolina_has_gone_missing_possible/,"* Original Post:  http://www.reddit.com/r/AskReddit/comments/yi4vx/please_help_find_gabbie/

* News story: http://www.midlandsconnect.com/news/story.aspx?id=790312#.UDGltt1lSDk

* Facebook: https://www.facebook.com/findGabbiee

Girl isn't the type to run away and the only thing missing (besides her) is her cell.
",,False,,t5_2tayf,False,,,True,t3_yi8kp,http://www.reddit.com/r/RBI/comments/yi8kp/girl_in_south_carolina_has_gone_missing_possible/,
1345028750.0,42,reddit.com,y98dt,"Bike owner from Portland has bike stolen, tracks it down through Craigslist to Seattle and confronts thief, and gets bike back. A good day. : videos",53,11,0,http://www.reddit.com/r/RBI/comments/y98dt/bike_owner_from_portland_has_bike_stolen_tracks/,,,False,,t5_2tayf,False,,,False,t3_y98dt,http://www.reddit.com/r/videos/comments/y8dyv/bike_owner_from_portland_has_bike_stolen_tracks/,
1342918355.0,46,imgur.com,wy3kn,"I left my house for a few hours and came back to this beautiful broken window. It's not really a big deal, but I'm stumped as to how it could have happened. Any ideas?",51,5,30,http://www.reddit.com/r/RBI/comments/wy3kn/i_left_my_house_for_a_few_hours_and_came_back_to/,,,False,,t5_2tayf,False,,,False,t3_wy3kn,http://imgur.com/a/AorlO,
1372871145.0,43,reddit.com,1hksp9,Xpost: I got my anonymous cyberstalker of 1.5 years arrested for harassing me and threatening to shoot up the college where I teach. AMA!,74,31,2,http://www.reddit.com/r/RBI/comments/1hksp9/xpost_i_got_my_anonymous_cyberstalker_of_15_years/,,,False,,t5_2tayf,False,,,False,t3_1hksp9,http://www.reddit.com/r/IAmA/comments/1hkeok/i_got_my_anonymous_cyberstalker_of_15_years/,
1371968075.0,43,self.RBI,1gwb2p,"After nearly four years of working on a missing persons case, I'm at a loss and turning to the RBI",57,14,35,http://www.reddit.com/r/RBI/comments/1gwb2p/after_nearly_four_years_of_working_on_a_missing/,"The case is Steven Koecher, a man who went missing in a Las Vegas suburb in December of 2009. [Here's the original story](http://www.8newsnow.com/story/11852528/where-is-steven-koecher), along with sidebar links to the others. I'm happy to answer any questions and give any information on the leads I've followed. I'm pretty close with the missing's family and they're very interested in finding out what happened.",,False,,t5_2tayf,False,,,True,t3_1gwb2p,http://www.reddit.com/r/RBI/comments/1gwb2p/after_nearly_four_years_of_working_on_a_missing/,
1369919404.0,41,self.RBI,1fc15h,Does anyone recognise this garbage truck? He hit my car yesterday and then drove off. I managed to snap this picture. (x-post r/Sydney),51,10,14,http://www.reddit.com/r/RBI/comments/1fc15h/does_anyone_recognise_this_garbage_truck_he_hit/,"Yesterday morning, I was driving in my parents car to go pick them up from Sydney airport. This garbage truck came into my lane and scraped the side of the car, broke off the side view mirror and dented the front. 

The car is not insured, and I beeped and tried to get him to stop but he sped off. I went to the police and they checked his rego but his details are old. They said if they can't find him, then I have to pay for the damage myself. I'm pretty damn poor, so I want to avoid this. Any idea on what I can do?

Here's the picture: http://i.imgur.com/3hiO07K.jpg?1

Here's what happened to the car: http://i.imgur.com/qMKsw3l.jpg?1

td;lr This truck hit me. I want to find the owner.
",,False,,t5_2tayf,False,,,True,t3_1fc15h,http://www.reddit.com/r/RBI/comments/1fc15h/does_anyone_recognise_this_garbage_truck_he_hit/,
1367212265.0,40,self.RBI,1dbjx4,"*Correction* Female gas station attendant abducted in NORTON SHORES (Muskegon County), Michigan around 11pm Friday at an Exxon Mobile. Previous news article posted INCORRECT INFO! Link provided below.",56,16,5,http://www.reddit.com/r/RBI/comments/1dbjx4/correction_female_gas_station_attendant_abducted/,"Thank you to torpidnotion for posting the correct information, the Yahoo.com news article got the location wrong!

[LINK](http://www.mlive.com/news/muskegon/index.ssf/2013/04/search_for_missing_muskegon_co.html)

Some relevant info: 

*Investigators are currently searching for a silver minivan, possibly a Chrysler Town &amp; Country, that was last seen in the area prior to Heeringa’s disappearance. The evidence is based on a passerby observing the car parked near the gas station and driving away, police said.

The driver is described as a white male, approximately 30 to 40 years old, 6 feet tall, medium to heavy build with broad shoulders, light brown or sandy blonde wavy hair parted in the middle and slightly longer on top. He was last seen wearing a bright red or orange sweatshirt, police said.

Heeringa is described as a white female, 5 feet 1 inch tall, about 110 pounds, with blond, shoulder-length hair and blue eyes. Heeringa is also known to wear wired rim glasses. She may be wearing a blue collared shirt with “Sternberg Exxon"" on it, the police chief said.

Shaw said anyone who may have tips to contact Silent Observer at 231-72-CRIME (231-722-7463) or call 911.*

Edit: Grammar



",,False,,t5_2tayf,1367232434.0,,,True,t3_1dbjx4,http://www.reddit.com/r/RBI/comments/1dbjx4/correction_female_gas_station_attendant_abducted/,
