created_utc,score,domain,id,title,ups,downs,num_comments,permalink,selftext,link_flair_text,over_18,thumbnail,subreddit_id,edited,link_flair_css_class,author_flair_css_class,is_self,name,url,distinguished
1345921754.0,11,self.teaching,ytf4c,Elementary K-5 Technology/Engineering teacher here.  Would any other elementary teacher be interested in doing a digital pen pals project with our students?,13,2,3,http://www.reddit.com/r/teaching/comments/ytf4c/elementary_k5_technologyengineering_teacher_here/,"Hey Hey.  I'm an elementary science/engineering teacher in Boston.  I want to add more elements into my curriculum that build on the community aspect of technology as well as understanding how we operate within that community.  I thought that a good way to do this would be to have a pen pal in some other part of the country to write back and forth with.  If you're interested, I think there's a lot of meaningful projects that can be done with this and would love to bounce some ideas. 

So yeah, this is just a thought right now.  If you want some more information about my school, I work at a Dual-Language Spanish/English K-8 school in Boston.  99% of my students are eligible for free/reduced lunch.  The demographic breakdown is mostly Black, Hispanic, and Asian (mostly Vietnamese).  Of the Hispanic students, most are Dominican and Puerto Rican.  

PM me if you're interested!  ",,False,self,t5_2qyj9,False,,,True,t3_ytf4c,http://www.reddit.com/r/teaching/comments/ytf4c/elementary_k5_technologyengineering_teacher_here/,
1345870841.0,8,self.teaching,yslv7,Is there a good multiple-choice item creator?,10,2,6,http://www.reddit.com/r/teaching/comments/yslv7/is_there_a_good_multiplechoice_item_creator/,"I'm looking specifically for a program that takes my input of a question, possible answers, and the correct answer, and can randomly arrange them and output it as a Word doc.  Anybody know of something like this?",,False,self,t5_2qyj9,False,,,True,t3_yslv7,http://www.reddit.com/r/teaching/comments/yslv7/is_there_a_good_multiplechoice_item_creator/,
1343919844.0,7,self.teaching,xkd8x,Teaching ideas for the upcoming year.,11,4,12,http://www.reddit.com/r/teaching/comments/xkd8x/teaching_ideas_for_the_upcoming_year/,"I know some of you are looking for ideas for the upcoming year.
Just a precursor, I am no expert in teaching; I no longer am one. I taught for two years, and I was an educational technology consultant for one year.    
However, I did some novel things with my 9th graders.  I taught 9th grade RTI on a reservation in South Dakota.  I did a few things that worked well and increased student mastery.

1. I taped my lessons (vodcasting).  This gave students a resource to study; it also helped with absent students.  I just filmed and posted my lecture portion on a website.

2. I had my students blog; I had 20 laptops in my classroom.  This gave me writing samples.  I posted these blogs on a parent site to showcase work and start global discussions.  My students could see their work and words extended beyond my classroom. [Blog](http://futurelakotaleaders.wordpress.com/)

3. I made all my resources, with the exception of books, available on my webpage, Twitter, Facebook, and local server. This made assignments available at all hours to the majority of my students.

4. Most assessments were online.  This gave me real time data on end of unit assessments and formative assessments. It saved me hours of grading.

Anything else people want to share?

Edit: The formatting was weird, fixed.",,False,self,t5_2qyj9,1343923862.0,,,True,t3_xkd8x,http://www.reddit.com/r/teaching/comments/xkd8x/teaching_ideas_for_the_upcoming_year/,
1343325344.0,8,en.wikipedia.org,x78f5,E-Prime(X-post from r/wikipedia). Would this be a good way to teach writing?,11,3,9,http://www.reddit.com/r/teaching/comments/x78f5/eprimexpost_from_rwikipedia_would_this_be_a_good/,,,False,default,t5_2qyj9,False,,,False,t3_x78f5,http://en.wikipedia.org/wiki/English_Prime,
1342377160.0,9,self.teaching,wlop0,"Math Teachers of Reddit, what software do you use to write worksheets and tests?",13,4,15,http://www.reddit.com/r/teaching/comments/wlop0/math_teachers_of_reddit_what_software_do_you_use/,"I am a 1st year 7th grade math teacher, and the fractions and division problems are killing me. They just take so long to write and format properly. I've been using MS word 2010, which does have the fraction option in the equation editor, but it's still tedious. And there is no option to write a long division problem.

I also found a few decent websites to create customizable worksheets online (which I can use to copy paste into Word). But it takes a while to find one with the desired objective and approriate level of rigor.

So math teachers, any advice? ",,False,self,t5_2qyj9,False,,,True,t3_wlop0,http://www.reddit.com/r/teaching/comments/wlop0/math_teachers_of_reddit_what_software_do_you_use/,
1341804575.0,9,self.teaching,w93rc,"So, I might become some kind of teacher",13,4,10,http://www.reddit.com/r/teaching/comments/w93rc/so_i_might_become_some_kind_of_teacher/,"Hey. Next year I'm running for school presidency along with some friends. I don't really care about winning and become popular; what I really care about is about some initiatives I planned. 

In Mexico we don't have AP style classes. We all get the *same* class (until the last year of high school). I thought I could somehow help people interested in Physics, Chem, and Computing by installing extracurricular classes, taught by me. I really love science (knowledge in general) and also like transmitting what I know to other people. 

The problem is the following: *no one* seems to care about being smart. At least that's the general impression in my Schule. I plan on doing demonstrations of laws of Physics, Chem experiments, and programming stuff for the iPhone, but I'm not sure if they would even care to show up to class and peek at what we're doing. Any ideas on how to catch their attention?",,False,self,t5_2qyj9,False,,,True,t3_w93rc,http://www.reddit.com/r/teaching/comments/w93rc/so_i_might_become_some_kind_of_teacher/,
1341339197.0,10,self.teaching,vzn5i,Advice on leaving a position? (x-post from r/teachers),12,2,14,http://www.reddit.com/r/teaching/comments/vzn5i/advice_on_leaving_a_position_xpost_from_rteachers/,"Okay, here goes: I got my first teaching job last year at a small rural school. One year later, I am absolutely convinced that I have no desire to return to that school. Ohio state law requires that you notify the school district of your intent to break contract by July 10th, so I need to tell my principal/superintendent within the week. Here are my questions:

-How do I tell them that I don't want to return? What can I give them as a reason when the true reason is that I can't stand the school?

-Do you recommend sending a letter, calling, face-to-face, or some combination thereof?

This would be much easier if I had a position lined up for next year, but I don't. I simply know that this is not the right position for me, and furthermore, I'm not sure that teaching is the field for me. Thanks for any advice you can offer, and please no ""try it for another year"" advice. That decision has already been made.
",,False,self,t5_2qyj9,False,,,True,t3_vzn5i,http://www.reddit.com/r/teaching/comments/vzn5i/advice_on_leaving_a_position_xpost_from_rteachers/,
1340916867.0,8,self.teaching,vrdr5,Seeking insights to finding jobs Abroad,10,2,21,http://www.reddit.com/r/teaching/comments/vrdr5/seeking_insights_to_finding_jobs_abroad/,"I was just curious if anybody here has experience teaching abroad and/or knows a good process to follow to finding a job overseas.  I just graduated this past semester with a Communication Arts and Literature degree from a Minnesotan college, and am striving to try and find a job in  either the UK or Japan.  Any insights would be excellent and appreciated!

tl;dr New teacher from US looking for teaching job in Japan/Uk",,False,self,t5_2qyj9,False,,,True,t3_vrdr5,http://www.reddit.com/r/teaching/comments/vrdr5/seeking_insights_to_finding_jobs_abroad/,
1340235257.0,10,reddit.com,vcrqo,"Help with cool math memes! I don't want the usual lame ""inspirational"" posters most teachers have",16,6,14,http://www.reddit.com/r/teaching/comments/vcrqo/help_with_cool_math_memes_i_dont_want_the_usual/,,,False,default,t5_2qyj9,False,,,False,t3_vcrqo,http://www.reddit.com/r/teaching/inspire_kids_with_inspirational_memes,
1339387760.0,10,self.teaching,uvn38,"As a 1st year teacher (and therefore a temp), I'm learning how depressing this time of year is...how do you cope?",10,0,16,http://www.reddit.com/r/teaching/comments/uvn38/as_a_1st_year_teacher_and_therefore_a_temp_im/,"Hi everyone.  As I said, I'm a first year teacher and love both teaching and my school so far.  I'm not sad about my kids moving forward; that's what they should do.

However, my contract ends with the school year and I see ahead of me another summer of desperately applying for every job posted and going to interview after interview.  I want so badly to stay at my school, but if there are no positions (not sure yet, but it looks that way), there's nothing I can do but go elsewhere.  I feel like I can't do anything this summer but focus on getting a job, just like last year when I didn't get my job until late August.  What's more, I see ahead of me years of this same problem, until the budget finally allows me to keep a job for more than a year (but honestly there are 10-year temps in my district).

At the same time, I feel so angry to see the complacent permanent teachers (though this doesn't apply to all of the permanents) who don't make much of an effort to continually improve on their methods as a teacher *always* should - I just wish they'd give room for people like me who are still passionate.  

All this uncertainty and lack of hope is really depressing me.  No career should have to be like this - the people who are good at their jobs should get to keep them and the people who are not...well, they need to stop being the ones to influence children's minds for an entire year.

To be clear, **I'm not looking for explanations about the economy or unions.** I get those things, and know it's hard to make changes at such a large scale.  I just wonder what those of you who have been at this for a while do so that entire summers for years on end aren't ruined.  I want to hold on to the enjoyment I've had the rest of the year.

**TL;DR How do you keep the need to reapply for jobs every summer from depressing you?**

Thanks in advance!",,False,self,t5_2qyj9,False,,,True,t3_uvn38,http://www.reddit.com/r/teaching/comments/uvn38/as_a_1st_year_teacher_and_therefore_a_temp_im/,
1339034894.0,10,self.teaching,up2ic,"Anyone know of, or use, a good book of riddles/lateral thinking puzzles?",10,0,10,http://www.reddit.com/r/teaching/comments/up2ic/anyone_know_of_or_use_a_good_book_of/,"Trying to build up that side of my teaching, if anyone could point me in the direction of a good book it'd be much appreciated!",,False,self,t5_2qyj9,False,,,True,t3_up2ic,http://www.reddit.com/r/teaching/comments/up2ic/anyone_know_of_or_use_a_good_book_of/,
1338355827.0,10,self.teaching,ubp8m,Bullying in School,11,1,13,http://www.reddit.com/r/teaching/comments/ubp8m/bullying_in_school/,"So in my english class we're doing ""presidential debates"" wherein we have to act as if we are in, well, a presidential debate.

One of the topics my group decided to discuss was bullying and how it can be dealt with, so I've been doing some (I admit, not much since it was assigned today) research.

However, I was wondering if you guys had any insight on what the teachers think they would be able to do about it.

Some of the main points I've already come up with is a better system to report it (anonymously so that someone doesn't get bullied even more due to tattling). Better education on the topic and how students can deal with it (this is more anecdotal, but in my schools teachers/administration rarely talk about bullying). And lastly less restrictions on what teachers are able to do (I have yet to really look for sources, but I have read many stories about teachers on Reddit being disciplined for interfering in bullying)

So I guess what I'm looking for is any feedback on how effective you as teachers think those ideas would be, and any other suggestions you might have.

I also only have a minute and a half to talk, so I don't need a long source-filled report ;)

Thanks in advance for any help!",,False,self,t5_2qyj9,False,,,True,t3_ubp8m,http://www.reddit.com/r/teaching/comments/ubp8m/bullying_in_school/,
1337278258.0,9,self.teaching,trzhs,Adults with 4th grade education,9,0,4,http://www.reddit.com/r/teaching/comments/trzhs/adults_with_4th_grade_education/,"A friend of mine knows two adult sisters (in their 30s) with 4th grade educations. Their mother is totally at fault for this but I won't go there! They have casually mentioned wanting to get their GED, but we suspect there is some irrational fear and shame which is hindering them from getting started. 

He wants to motivate them to learn, and get them started down the path to their GED. Teachers: what's the best way to approach adults about this without making them feel embarrassed, ashamed, angry, etc? How can we get them to get off their duffs and get a tutor? What should we keep in mind when broaching the topic? ",,False,self,t5_2qyj9,False,,,True,t3_trzhs,http://www.reddit.com/r/teaching/comments/trzhs/adults_with_4th_grade_education/,
1336550663.0,11,taiwanasaurusrex.wordpress.com,teevx,"""Basically, every class is like being on stage and being heckled for 2 hours by tiny people who don’t speak English very well."" - A blog about teaching early elementary English in Taiwan",13,2,2,http://www.reddit.com/r/teaching/comments/teevx/basically_every_class_is_like_being_on_stage_and/,,,False,default,t5_2qyj9,False,,,False,t3_teevx,https://taiwanasaurusrex.wordpress.com/2011/10/13/on-teaching-and-evolving/,
1335975455.0,8,self.teaching,t3gax,ESL teachers: Can a 10 year English/literacy teacher teach ESL without taking ESL Ed classes?,9,1,8,http://www.reddit.com/r/teaching/comments/t3gax/esl_teachers_can_a_10_year_englishliteracy/,"I've been teaching secondary English, with an emphasis on low-level readers and literacy, for 10 years. I want to move to teaching ESL, and can add ESL endorsement to my teaching license by taking (and passing!) the Praxis. But looking at the Praxis study guide, DAMN! There's a ton of stuff I've never learned about, related to the shape the mouth makes when pronouncing certain sounds, and the tildes and squiggles over different letters...at least that's how it looks to the uninitiated! So my question: ANY hope of succeeding on the Praxis, and successfully teaching ESL, by studying the meaty Praxis study guide and ""learning as I go"" in the classroom? Or do I (I'm afraid I know the answer to this) need to take a bunch of courses on teaching ESL before even trying? Many thanks; hope to join your ranks soon!",,False,self,t5_2qyj9,False,,,True,t3_t3gax,http://www.reddit.com/r/teaching/comments/t3gax/esl_teachers_can_a_10_year_englishliteracy/,
1334767057.0,9,self.teaching,sg847,Dealing with 'Hot for Teacher' syndrome...,16,7,41,http://www.reddit.com/r/teaching/comments/sg847/dealing_with_hot_for_teacher_syndrome/,"I'm not a teacher yet... but I will be soon. I'm only an education minor so while I'm getting a certificate to teach in my state, I haven't really done any student-teaching. I've just had 'field experiences' where I pretty much just am a student aide and taught a couple lessons. And it's all been wonderful, I just really have never been 'in control' of a classroom yet.

But here's the thing... I still look like a 16 year old girl. I've actually gotten berated by security at one of the high schools I was spending time at for being outside during class hours and I had to show him my college ID to prove I wasn't a student cutting class... 

And, I'm aware that I'm an attractive girl as well. Students in the classes I've aided have definitely tried to flirt with me before.

Some of my friends tell me that my appearance is going to cause issues for me in terms of earning respect. I know of course that my position of teacher will be obvious, and I know of course that I must project an air of professionalism and of course never ever ever act in a way that would jeopardize my position. I make a point to dress conservatively and act maturely, and I'm confident enough that what my students think in this regard wouldn't bother me personally.

But I do worry if there ever will be some 'hot for teacher' awkward situation that I'll have to deal with... whether it be an obvious thing (and I know there are plenty of class clowns out there), or a more subtle occurrence such as, a student being nervous around me, and if there is a best way of dealing with that? I don't think it's very conducive to the learning environment to inadvertently be a distraction from yourself... or is there a way I can use it to my advantage? I suppose it depends on the personality of the classroom, for sure.

Any other hot teachers out there care to shed some insight? Or are my friends just inadvertently trying to scare me when I have nothing really to worry about and I'll be able to figure it out if the time comes?

Thanks :)",,False,self,t5_2qyj9,False,,,True,t3_sg847,http://www.reddit.com/r/teaching/comments/sg847/dealing_with_hot_for_teacher_syndrome/,
1332356757.0,7,imgur.com,r7597,Primary school rocket science,9,2,1,http://www.reddit.com/r/teaching/comments/r7597/primary_school_rocket_science/,,,False,http://e.thumbs.redditmedia.com/LKOelHBPH-jwJ55j.jpg,t5_2qyj9,False,,,False,t3_r7597,http://imgur.com/p7Xyo,
1332260879.0,9,imgur.com,r58vm,Project requests can be a strange looking thing on the first day of a new project... (Edmodo),14,5,0,http://www.reddit.com/r/teaching/comments/r58vm/project_requests_can_be_a_strange_looking_thing/,,,False,http://b.thumbs.redditmedia.com/e4j0exv2nDRGBmw7.jpg,t5_2qyj9,False,,,False,t3_r58vm,http://imgur.com/CIOFO,
1327551726.0,11,classconnect.com,ox5d0,"Teachers of reddit - I spent the past year making this lesson plan/curriculum collaboration &amp; sharing site, tell me what you think!",13,2,19,http://www.reddit.com/r/teaching/comments/ox5d0/teachers_of_reddit_i_spent_the_past_year_making/,,,False,default,t5_2qyj9,False,,,False,t3_ox5d0,http://www.classconnect.com,
1327360076.0,9,self.teaching,otk04,I just had my first job substitute teaching...,9,0,22,http://www.reddit.com/r/teaching/comments/otk04/i_just_had_my_first_job_substitute_teaching/,"...and it went better than I ever imagined it would.  I had no prior classroom experience/training so I was quite nervous and felt very unprepared.  It was only for half the day (3 class periods) and they were all senior/junior level language arts courses. 

Highlights:

The students were respectful and many were very helpful.  I didn't really have to actively teach any lessons, as the plan left for me by the teacher mostly consisted of the students working on projects and copying an exam review.  Needless to say, most of the students finished with a lot of time remaining.  Some worked on other homework, others read, some played scrabble, and others just talked or listened to music quietly.  

If that's all that my day had consisted of, then I would have considered that a good first day.  However, a couple things happened that really made it a great experience.  First, I noticed a couple boys were terribly bored so I gave them a couple of brain teasers to work on, and they almost immediately recruited a small group around them and seemed to enjoy the activity.  In another class (last period), I caught a boy trying to sneak out of the classroom.  I sternly confronted him.  He did not seem to appreciate me for it, but by the end of the class I was sitting in a desk next to him and we discussed some of his favorite bands/albums, and I could tell that I had something of a genuine ""breakthrough"" with him.

My question to r/teaching is if I just simply lucked into a great situation or can I expect most days to be similar?

  ",,False,self,t5_2qyj9,False,,,True,t3_otk04,http://www.reddit.com/r/teaching/comments/otk04/i_just_had_my_first_job_substitute_teaching/,
1327315982.0,10,self.teaching,osqq9,I teach 11th grade American History - does anyone have suggestions for a lesson on the State of the Union tomorrow night? ,10,0,9,http://www.reddit.com/r/teaching/comments/osqq9/i_teach_11th_grade_american_history_does_anyone/,"45 minute periods, college prep-level class. Thanks all! ",,False,self,t5_2qyj9,False,,,True,t3_osqq9,http://www.reddit.com/r/teaching/comments/osqq9/i_teach_11th_grade_american_history_does_anyone/,
1324150032.0,10,self.teaching,ngkio,Assigning homework online.,10,0,27,http://www.reddit.com/r/teaching/comments/ngkio/assigning_homework_online/,"I'm preparing to accept a position teaching middle school science. I'd like to create a website which student's could use as a resource, and where I could stay in touch with parents.

Are there any teachers here who make an effort assign homework online? For example, you would tell your students ""See my most recent webpost at www.science_guy.com for your homework, and please submit your answers online."" If so, how do you do it, and how is it working out for you?

I think if properly implemented, it would reduce paper usage and perhaps simplify grading. Thoughts?

---
EDIT:
Also, how many of you have your own website that you use with your students? And i don't mean the crappy kind of websites that the school district assigns you.

-----
Update:

Thanks for the responses! I should have added that I feel comfortable setting up websites and content management systems (ie, wordpress); he techie aspect of website doesn't concern me as much as the classroom logistics.

I like what I'm hearing from people: essentially, use the website as a supplemental aid to class content, but be careful about using it to *require* work from students. Also beware of students who might abuse the website to tease other students, etc. 

In all, a website has the following advantages:

* Enhance communication opportunities with parents and students
* Provide copies of coursework online for students who were absent
* *Perhaps* provide opportunities to submit homework digitally (as long as analog HW is available)
* Use Facebook/Twitter to push notifications to students
* Share additional videos/news online

",,False,self,t5_2qyj9,True,,,True,t3_ngkio,http://www.reddit.com/r/teaching/comments/ngkio/assigning_homework_online/,
1323975173.0,8,self.teaching,ne33m,Gift for sister who is going to begin teaching soon. ,9,1,17,http://www.reddit.com/r/teaching/comments/ne33m/gift_for_sister_who_is_going_to_begin_teaching/,"Hey reddit I don't know if this belongs here or not but I have a sister who is going to start teaching soon (early childhood education major) and I am looking for a good gift for her that she would enjoy and would be helpful for teaching.

Any ideas of items that you guys would like or wish you had to start teaching with?",,False,self,t5_2qyj9,False,,,True,t3_ne33m,http://www.reddit.com/r/teaching/comments/ne33m/gift_for_sister_who_is_going_to_begin_teaching/,
1323713317.0,8,self.teaching,n9vet,Advice for teaching ESL?,9,1,8,http://www.reddit.com/r/teaching/comments/n9vet/advice_for_teaching_esl/,"In March, I am moving to S. Korea for a year to teach English to elementary school children.  I am only allowed to use English in the classroom, and the students will be of mixed levels.  To teach in Korea, you don't need any certificates or major qualifications, so I don't have any.

I want to be a good teacher and get through to my students.  I don't want to be ineffective (as many foreign English teachers are).  What do you recommend I do from now until March to best prepare? Any suggested courses or reading would be excellent.  If you've taught English as a second/foreign language, do you have any specific sources I should check out?

Thank you!",,False,self,t5_2qyj9,False,,,True,t3_n9vet,http://www.reddit.com/r/teaching/comments/n9vet/advice_for_teaching_esl/,
1321632929.0,9,self.teaching,mh0tm,How could public education be improved? ,10,1,39,http://www.reddit.com/r/teaching/comments/mh0tm/how_could_public_education_be_improved/,"I don't mean to beat a dead horse. This is an essay prompt I'm working on for financial aid to a Masters of Arts in Teaching program. I searched /r/teaching, but didn't find a thread that asks for people's input about this question.

This is a huge topic with any number of answers: economic, standardized testing, teacher quality, culture, parenting, genetics (yikes), student incentives, etc, etc. How do **you** think public education could be improved? Why do you feel this way? If there was one campaign you could lead to improve public education, what would it be?

Do you have any resources you could cite to defend your position? If so, what are they? 

I'd like to see if there's a consensus on this topic. *What do most people think is the #1 way to improve public education?*",,False,self,t5_2qyj9,False,,,True,t3_mh0tm,http://www.reddit.com/r/teaching/comments/mh0tm/how_could_public_education_be_improved/,
