created_utc,score,domain,id,title,ups,downs,num_comments,permalink,selftext,link_flair_text,over_18,thumbnail,subreddit_id,edited,link_flair_css_class,author_flair_css_class,is_self,name,url,distinguished
1322940080.0,1131,self.teaching,myxtw,"I taught my students the real definition of ""Fair"" and my world has CHANGED!!!",1469,338,264,http://www.reddit.com/r/teaching/comments/myxtw/i_taught_my_students_the_real_definition_of_fair/,"I am a first year Teach For America teacher in the Midwest. I teach 5th grade language arts at a mastery based, college prep middle school in its inaugural year. Life is very interesting.

Our student population (40 5th graders and 45 6th graders) is quite diverse. They have come from over 30 different schools in our area, all for very different reasons - bullying, far behind in achievement, far ahead in achievement, behavior issues, etc. Our population is 88% free and reduced lunch, and 70/30 ratioed black/white.

In my classes, I have functionally illiterate children, children reading at a high school level, and children everywhere in between.  This means that I have a LOT of differentiating to do - and this has created a divide amongst many of my students.  ""Ms. B!!"" they scream at me when I'm explaining homework, ""Why did Timmy get half a page of homework, and I got 2 FULL pages? That's just not fair!!!!""

I hit a breaking point at the beginning of last week, and finally scrapped my vocab words for Tuesday in order to teach the meaning of the word fair.

""Who can tell me what fair means?""
""It means treating everyone the same.""
""WRONG! You've just given me the definition of the word 'equal.' What does 'fair' mean?""
""We.... Don't know?""
""So then why do you say it to me ALL OF THE TIME?""

We then had a LONG discussion about fair meaning ""everyone gets what they need."" I explained that if the cafeteria was serving Peanut butter treating someone with a peanut allergy EQUALLY would mean that they would either eat the peanut butter and get sick or not eat that day, and that treating them FAIRLY would mean providing them with a cheese sandwich so that they could eat lunch too. I then took a class poll, letting everyone see each others strengths and weaknesses.  ""what if I made everyone write 5 paragraphs every night for homework? How many of you would be very frustrated with that because it would be kind of tough for you?"" when about half the class raised their hand, it finally dawned on the other half - ""oh, we all have strengths and weaknesses."" One of the higher leveled readers said ""Oh yeah, Ms. B. that would be like if I had to do all the math homework. It takes me forever because it's really hard!""

My classroom has TURNED AROUND. My students want to help each other now. Lower leveled students want to work harder to prove they can do all of the homework, and higher leveled students are reinforcing their skills by helping the lower kids out.  My life is THAT MUCH EASIER!

**Tl;dr I taught my students the correct definition of ""fair"" and my classroom culture has never been better!**
------------------------------------------------------------------------------------------------------

EDIT:  Thank you all for the enlightening discussion, words of praise, and words of criticism!  

",,False,self,t5_2qyj9,True,,,True,t3_myxtw,http://www.reddit.com/r/teaching/comments/myxtw/i_taught_my_students_the_real_definition_of_fair/,
1363730693.0,288,i.imgur.com,1ame47,Happens wayyy too often!,313,25,19,http://www.reddit.com/r/teaching/comments/1ame47/happens_wayyy_too_often/,,,False,http://a.thumbs.redditmedia.com/RIMe_qJ3Nx4jiMWH.jpg,t5_2qyj9,False,,,False,t3_1ame47,http://i.imgur.com/ODvzJwI.jpg,
1369960210.0,185,qkme.me,1fdgee,"Last day of my first year of teaching. Very proud, reflective, and exhausted",197,12,39,http://www.reddit.com/r/teaching/comments/1fdgee/last_day_of_my_first_year_of_teaching_very_proud/,,,False,http://a.thumbs.redditmedia.com/P556XFzlAs8DK9VH.jpg,t5_2qyj9,False,,,False,t3_1fdgee,http://qkme.me/3unlhn,
1355879578.0,164,i.imgur.com,152zpw,There are lawmakers suggesting teachers should carry guns...I don't think they realize how many times a day I lose this...,174,10,32,http://www.reddit.com/r/teaching/comments/152zpw/there_are_lawmakers_suggesting_teachers_should/,,,False,http://e.thumbs.redditmedia.com/0-H_TF3G8BeOhea4.jpg,t5_2qyj9,False,,,False,t3_152zpw,http://i.imgur.com/kFg7j.jpg,
1373381457.0,148,i.picasion.com,1hxqzn,"All year I wore a bowtie to work. When five of my 8th graders graduated, they wore one too. [GIF]",165,17,18,http://www.reddit.com/r/teaching/comments/1hxqzn/all_year_i_wore_a_bowtie_to_work_when_five_of_my/,,,False,http://d.thumbs.redditmedia.com/8-1fP4LC6dAIiElc.jpg,t5_2qyj9,False,,,False,t3_1hxqzn,http://i.picasion.com/pic71/37653dcca00ac0f2bf863c5ff28f0f1e.gif,
1370651844.0,133,imgur.com,1fwe21,How I feel at the end of a long day teaching,148,15,8,http://www.reddit.com/r/teaching/comments/1fwe21/how_i_feel_at_the_end_of_a_long_day_teaching/,,,False,http://f.thumbs.redditmedia.com/IFD94JzkgiYC4Fhw.jpg,t5_2qyj9,False,,,False,t3_1fwe21,http://imgur.com/kohqt4K,
1361568734.0,128,imgur.com,191lvr,Good poster for schools; not sure where this pic originally came from...,141,13,6,http://www.reddit.com/r/teaching/comments/191lvr/good_poster_for_schools_not_sure_where_this_pic/,,,False,http://b.thumbs.redditmedia.com/kJBtA-M7fcK0zpxm.jpg,t5_2qyj9,False,,,False,t3_191lvr,http://imgur.com/0tkj9Tq,
1352777972.0,128,i.imgur.com,133qud,I realized this 3 weeks into my first year of teaching. ,142,14,14,http://www.reddit.com/r/teaching/comments/133qud/i_realized_this_3_weeks_into_my_first_year_of/,,,False,http://e.thumbs.redditmedia.com/gcV1fTnDySRXlw-L.jpg,t5_2qyj9,False,,,False,t3_133qud,http://i.imgur.com/x7fTm.jpg,
1365966309.0,120,i.imgur.com,1cc8cx,Neil DeGrass Tyson's view of cheating via Twitter.,144,24,20,http://www.reddit.com/r/teaching/comments/1cc8cx/neil_degrass_tysons_view_of_cheating_via_twitter/,,,False,default,t5_2qyj9,False,,,False,t3_1cc8cx,http://i.imgur.com/7aFIWwl.jpg,
1337096929.0,123,imgur.com,toc5c,Only one of these still works.,135,12,25,http://www.reddit.com/r/teaching/comments/toc5c/only_one_of_these_still_works/,,,False,http://d.thumbs.redditmedia.com/nMdooXUehDFUkC5o.jpg,t5_2qyj9,False,,,False,t3_toc5c,http://imgur.com/lU8IB,
1355937094.0,122,imgur.com,15476m,So my friend is finishing up his first teaching internship. This was written on the back of one of his students tests. ,129,7,11,http://www.reddit.com/r/teaching/comments/15476m/so_my_friend_is_finishing_up_his_first_teaching/,,,False,http://a.thumbs.redditmedia.com/G4C8_M8ev2Lgji6x.jpg,t5_2qyj9,False,,,False,t3_15476m,http://imgur.com/oeiJw,
1329349414.0,122,i.imgur.com,prgfd,What my students look like when I step in the hall to deal with something,135,13,3,http://www.reddit.com/r/teaching/comments/prgfd/what_my_students_look_like_when_i_step_in_the/,,,False,http://d.thumbs.redditmedia.com/x66FQ-BewGO-YDhc.jpg,t5_2qyj9,False,,,False,t3_prgfd,http://i.imgur.com/9Rtyr.jpg,
1372772367.0,114,dallasnews.com,1hhuqt,Teacher wears the same outfit for forty years of yearbook photos,129,15,9,http://www.reddit.com/r/teaching/comments/1hhuqt/teacher_wears_the_same_outfit_for_forty_years_of/,,,False,http://f.thumbs.redditmedia.com/KQ5zkJiYTMqy7apS.jpg,t5_2qyj9,False,,,False,t3_1hhuqt,http://www.dallasnews.com/photos/20130630-40-years-of-dale-irby-in-same-school-photo-outfit.ece,
1376016348.0,114,i.imgur.com,1k02lg,"Every time I hear ""It's OK teachers get paid so little because you get all those vacation days""...",140,26,38,http://www.reddit.com/r/teaching/comments/1k02lg/every_time_i_hear_its_ok_teachers_get_paid_so/,,,False,http://c.thumbs.redditmedia.com/7hKB6HUx_T39VRR2.jpg,t5_2qyj9,False,,,False,t3_1k02lg,http://i.imgur.com/W6P4Spc.png,
1345512085.0,111,imgur.com,yk0pw,All teachers on reddit are feeling this now....,127,16,8,http://www.reddit.com/r/teaching/comments/yk0pw/all_teachers_on_reddit_are_feeling_this_now/,,,False,http://b.thumbs.redditmedia.com/EvSs0N_TLExBt3Cg.jpg,t5_2qyj9,False,,,False,t3_yk0pw,http://imgur.com/FyLQX,
1366939832.0,114,i.imgur.com,1d4i7u,First world teacher problems,125,11,11,http://www.reddit.com/r/teaching/comments/1d4i7u/first_world_teacher_problems/,,,False,http://f.thumbs.redditmedia.com/h1xK__XQ3P0HxUfY.jpg,t5_2qyj9,False,,,False,t3_1d4i7u,http://i.imgur.com/6zJEJpd.jpg,
1328064939.0,106,a6.sphotos.ak.fbcdn.net,p5jml,The modern day classroom...,116,10,14,http://www.reddit.com/r/teaching/comments/p5jml/the_modern_day_classroom/,,,False,http://e.thumbs.redditmedia.com/_0iOzFrGaXVK2M6p.jpg,t5_2qyj9,False,,,False,t3_p5jml,http://a6.sphotos.ak.fbcdn.net/hphotos-ak-ash4/424942_10150564695580349_762125348_8816791_2083254501_n.jpg,
1330299831.0,111,imgur.com,q7aw2,I know people are sick of these- but ours is better than the other ones!,124,13,7,http://www.reddit.com/r/teaching/comments/q7aw2/i_know_people_are_sick_of_these_but_ours_is/,,,False,http://b.thumbs.redditmedia.com/Tfmsa1ttIgqGdvuO.jpg,t5_2qyj9,False,,,False,t3_q7aw2,http://imgur.com/pf2Fk,
1366823203.0,102,eduondemand.org,1d0qnt,"I created a non-profit website that streams high-quality education videos into classrooms for free. No ads. Teachers of Reddit, I hope you find this helpful!",115,13,4,http://www.reddit.com/r/teaching/comments/1d0qnt/i_created_a_nonprofit_website_that_streams/,,,False,http://f.thumbs.redditmedia.com/-5e0-Bk8v6snrjf_.jpg,t5_2qyj9,False,,,False,t3_1d0qnt,http://www.eduondemand.org,
1375106622.0,105,buzzfeed.com,1j9yar,For those of you planning your classrooms...[LINK],117,12,16,http://www.reddit.com/r/teaching/comments/1j9yar/for_those_of_you_planning_your_classroomslink/,,,False,http://d.thumbs.redditmedia.com/-gidGOkrvX8tkEbQ.jpg,t5_2qyj9,False,,,False,t3_1j9yar,http://www.buzzfeed.com/peggy/clever-classroom-tips-for-elementary-school-teachers,
1367206512.0,106,i.imgur.com,1dbdk1,As a first year teacher...,119,13,22,http://www.reddit.com/r/teaching/comments/1dbdk1/as_a_first_year_teacher/,,,False,http://f.thumbs.redditmedia.com/fh14glpHIFbIEnAG.jpg,t5_2qyj9,False,,,False,t3_1dbdk1,http://i.imgur.com/MpzHCJz.jpg,
1362889735.0,99,quickmeme.com,1a0bro,Chicago Public Schools Becky Carroll reveals biggest class size taught. (Spoiler Alert: It's zero),106,7,14,http://www.reddit.com/r/teaching/comments/1a0bro/chicago_public_schools_becky_carroll_reveals/,,,False,http://d.thumbs.redditmedia.com/G-T9KHbrRK80bB6i.jpg,t5_2qyj9,False,,,False,t3_1a0bro,http://www.quickmeme.com/meme/3tb5xu/,
1326947053.0,99,self.teaching,omrfh,Told my 7th graders about SOPA/PIPA today.  Awesomeness ensued.,106,7,19,http://www.reddit.com/r/teaching/comments/omrfh/told_my_7th_graders_about_sopapipa_today/,"So in the spirit of the day, I put the ""This image has been found in violation of SOPA"" picture as the background on my Smartboard.  During 2nd hour, a couple students asked what was wrong with my board.  I explained to them the basic gist of SOPA/PIPA, told them to check out google and reddit and get some more information on it.  I didn't really think it would go anywhere.  7th graders are fickle with their attention.

But holy shit it exploded.

Most of my 2nd hour class sent emails to Congress, including one student who said, ""We recently celebrated Martin Luther King, Jr. Day.  He was a man who fought for freedom.  We need to do the same now.""  While I know he was being overly dramatic, he still struck a chord.  The whole class applauded him when he read it.

Each class period I had after that wanted to do nothing but talk about freedom of speech, the necessary evils of such freedom (i.e. piracy), and by the end of the day, probably 90% of my students had sent emails or signed the petition against SOPA/PIPA.

So yeah, this was one of those good teaching days.

TL;DR:  Told my students about SOPA; they got all a-furious, sent some emails, and made me proud.

Edit: grammar",,False,self,t5_2qyj9,True,,,True,t3_omrfh,http://www.reddit.com/r/teaching/comments/omrfh/told_my_7th_graders_about_sopapipa_today/,
1358314936.0,99,quickmeme.com,16o4s0,My first world problem lately,114,15,2,http://www.reddit.com/r/teaching/comments/16o4s0/my_first_world_problem_lately/,,,False,http://a.thumbs.redditmedia.com/O4MYbZWL-uamb0FN.jpg,t5_2qyj9,False,,,False,t3_16o4s0,http://www.quickmeme.com/meme/3sl2lh/,
1346893915.0,96,quickmeme.com,zfb14,"Overworked Teacher. This is certainly true for me tonight, and it's only the second week.",110,14,32,http://www.reddit.com/r/teaching/comments/zfb14/overworked_teacher_this_is_certainly_true_for_me/,,,False,http://d.thumbs.redditmedia.com/TbK5CAjqfNOLbiE3.jpg,t5_2qyj9,False,,,False,t3_zfb14,http://www.quickmeme.com/meme/3qs5g7/,
1368240039.0,99,i.imgur.com,1e3x9n,My kindergartners today...,119,20,3,http://www.reddit.com/r/teaching/comments/1e3x9n/my_kindergartners_today/,,,False,http://f.thumbs.redditmedia.com/PRQg1YddXxjv0hf5.jpg,t5_2qyj9,False,,,False,t3_1e3x9n,http://i.imgur.com/pywcxuM.jpg,
1366644257.0,94,youtube.com,1cv8g9,What Teachers Make,123,29,23,http://www.reddit.com/r/teaching/comments/1cv8g9/what_teachers_make/,,,False,http://f.thumbs.redditmedia.com/UrSbn6xiP8izuD_w.jpg,t5_2qyj9,False,,,False,t3_1cv8g9,http://www.youtube.com/watch?v=RxsOVK4syxU&amp;list=PLB76BBDAC110E5E4D,
1355347527.0,95,imgur.com,14qvqr,Note Taking in 2012,101,6,28,http://www.reddit.com/r/teaching/comments/14qvqr/note_taking_in_2012/,,,False,http://f.thumbs.redditmedia.com/ic_T3gexGmnmYq7S.jpg,t5_2qyj9,False,,,False,t3_14qvqr,http://imgur.com/4DSqY,
1359425349.0,92,imgur.com,17gwl6,"When a student says they ""left their homework on their desk at home.""",107,15,10,http://www.reddit.com/r/teaching/comments/17gwl6/when_a_student_says_they_left_their_homework_on/,,,False,http://c.thumbs.redditmedia.com/zpWksliHgbTIPU6P.jpg,t5_2qyj9,False,,,False,t3_17gwl6,http://imgur.com/KgHzzou,
1358457576.0,92,i.imgur.com,16rw2m,I teach kindergarten and my students know they are not to interrupt me during guided reading groups so she wrote me a message!! ,103,11,17,http://www.reddit.com/r/teaching/comments/16rw2m/i_teach_kindergarten_and_my_students_know_they/,,,False,http://b.thumbs.redditmedia.com/Cz17itHbRt5izPvm.jpg,t5_2qyj9,False,,,False,t3_16rw2m,http://i.imgur.com/2j7Fg.jpg,
1355857643.0,91,imgur.com,152c2q,Heartwarming note from our mail lady  ,92,1,14,http://www.reddit.com/r/teaching/comments/152c2q/heartwarming_note_from_our_mail_lady/,,,False,http://b.thumbs.redditmedia.com/iQDmkdtejajBrVrC.jpg,t5_2qyj9,False,,,False,t3_152c2q,http://imgur.com/i4hmj.jpg,
1335106041.0,84,imgur.com,smnfs,You meme? I meme back.,98,14,1,http://www.reddit.com/r/teaching/comments/smnfs/you_meme_i_meme_back/,,,False,http://d.thumbs.redditmedia.com/e8lbBk05geFSt49-.jpg,t5_2qyj9,False,,,False,t3_smnfs,http://imgur.com/tyeve,
1375747805.0,88,imgur.com,1jrzcc,Another little nugget for the first year teachers...,96,8,21,http://www.reddit.com/r/teaching/comments/1jrzcc/another_little_nugget_for_the_first_year_teachers/,,,False,http://b.thumbs.redditmedia.com/o9fkfL1-Xlvsm-My.jpg,t5_2qyj9,False,,,False,t3_1jrzcc,http://imgur.com/ijHj0J4,
1373487782.0,91,upworthy.com,1i153v,Watch A Teacher Make Her 3rd-Grade Kids Hate Each Other For The Best Reason Imaginable,104,13,12,http://www.reddit.com/r/teaching/comments/1i153v/watch_a_teacher_make_her_3rdgrade_kids_hate_each/,,,False,http://b.thumbs.redditmedia.com/-IWnU8XGuciVhYKC.jpg,t5_2qyj9,False,,,False,t3_1i153v,http://www.upworthy.com/watch-a-teacher-make-her-3rd-grade-kids-hate-each-other-for-the-best-reason-imaginable-2,
1348694391.0,88,quickmeme.com,10j0f4,How I feel when I'm asked if there's a quiz on quiz day...,100,12,16,http://www.reddit.com/r/teaching/comments/10j0f4/how_i_feel_when_im_asked_if_theres_a_quiz_on_quiz/,,,False,http://f.thumbs.redditmedia.com/CRojVqjY-JN7Vj8G.jpg,t5_2qyj9,False,,,False,t3_10j0f4,http://www.quickmeme.com/meme/3r37ov/,
1335154630.0,83,i.imgur.com,snosf,"Whenever I call home about swearing, this is what I imagine happens when I hang up...",93,10,15,http://www.reddit.com/r/teaching/comments/snosf/whenever_i_call_home_about_swearing_this_is_what/,,,False,http://c.thumbs.redditmedia.com/lu_fzxdhYbjoeXv2.jpg,t5_2qyj9,False,,,False,t3_snosf,http://i.imgur.com/uRxa1.jpg,
1366130084.0,86,imgur.com,1cgwv3,Today I visited a Head Start school near my college for a class assignment. Just an internal reflection I had when I left...,100,14,7,http://www.reddit.com/r/teaching/comments/1cgwv3/today_i_visited_a_head_start_school_near_my/,,,False,http://b.thumbs.redditmedia.com/GvqG5VqbYJBOKPk7.jpg,t5_2qyj9,False,,,False,t3_1cgwv3,http://imgur.com/d5LQxDB,
1345393271.0,85,self.teaching,yh5tr,Uplifting story for the start of the new school year.,94,9,4,http://www.reddit.com/r/teaching/comments/yh5tr/uplifting_story_for_the_start_of_the_new_school/,"My wife and I are both teachers. We were out for a bite to eat, sitting at the patio bar at a local restaurant. A big family arrived; she has taught a couple of their kids and they are big school boosters - really nice people.  We chatted with them briefly and then they got their table and went inside. We went to pay our bill and the bartender told us they had taken care of it for us!  We went to say thank you but couldn't find them in the crowded restaurant so my wife texted the mom to thank her, and she texted back ""We LOVE treating teachers to dinner. Thanks for everything you do - you do some of the most important work out there.""

Here's to all the AWESOME parents who DO support teachers and what we do.... ",,False,self,t5_2qyj9,False,,,True,t3_yh5tr,http://www.reddit.com/r/teaching/comments/yh5tr/uplifting_story_for_the_start_of_the_new_school/,
1327675320.0,81,i.imgur.com,oz58s,The real job creators,88,7,15,http://www.reddit.com/r/teaching/comments/oz58s/the_real_job_creators/,,,False,http://c.thumbs.redditmedia.com/VmXXuiG3lgkyu5Zb.jpg,t5_2qyj9,False,,,False,t3_oz58s,http://i.imgur.com/pPywi.jpg,
1320165500.0,82,i.imgur.com,lwkej,One of my students wrote this on my calendar while I was helping another student.,93,11,8,http://www.reddit.com/r/teaching/comments/lwkej/one_of_my_students_wrote_this_on_my_calendar/,,,False,http://f.thumbs.redditmedia.com/IYeu8UQ7t-Ng__Je.jpg,t5_2qyj9,False,,,False,t3_lwkej,http://i.imgur.com/7opGB.jpg,
1369344846.0,80,buzzfeed.com,1exhtp,Signs You've Been A Teacher Too Long,98,18,13,http://www.reddit.com/r/teaching/comments/1exhtp/signs_youve_been_a_teacher_too_long/,,,False,http://e.thumbs.redditmedia.com/JDy4rbIZT7Iy8Y5R.jpg,t5_2qyj9,False,,,False,t3_1exhtp,http://www.buzzfeed.com/ashleyperez/31-signs-youve-been-a-teacher-too-long,
1376246577.0,79,i.imgur.com,1k5nej,Laundry Day,93,14,9,http://www.reddit.com/r/teaching/comments/1k5nej/laundry_day/,,,False,http://b.thumbs.redditmedia.com/VDPWcDGZ744zYM_y.jpg,t5_2qyj9,False,,,False,t3_1k5nej,http://i.imgur.com/Q85oO9H.jpg,
1370480544.0,78,qkme.me,1frdka,"Math &amp; Science + High Needs School + 5 years = $17,500",82,4,37,http://www.reddit.com/r/teaching/comments/1frdka/math_science_high_needs_school_5_years_17500/,,,False,http://a.thumbs.redditmedia.com/z2rnsAHVxpWpo_dB.jpg,t5_2qyj9,False,,,False,t3_1frdka,http://qkme.me/3uqku8,
1328316688.0,82,imgur.com,pa1c4,"Reddit, I'm officially certified to teach!",88,6,13,http://www.reddit.com/r/teaching/comments/pa1c4/reddit_im_officially_certified_to_teach/,,,False,http://f.thumbs.redditmedia.com/IvtPPbB8C_uIP4zw.jpg,t5_2qyj9,False,,,False,t3_pa1c4,http://imgur.com/cfwZu,
1360518804.0,79,quickmeme.com,1896up,At least five calls a day . . . ,86,7,19,http://www.reddit.com/r/teaching/comments/1896up/at_least_five_calls_a_day/,,,False,http://f.thumbs.redditmedia.com/74aq0QfaI2WO8CHq.jpg,t5_2qyj9,False,,,False,t3_1896up,http://www.quickmeme.com/meme/3sxhzw/,
1359778564.0,75,imgur.com,17qkn6,After several weeks of feeling like I've been hitting walls....,83,8,1,http://www.reddit.com/r/teaching/comments/17qkn6/after_several_weeks_of_feeling_like_ive_been/,,,False,http://b.thumbs.redditmedia.com/2Puliqew1stosD6m.jpg,t5_2qyj9,False,,,False,t3_17qkn6,http://imgur.com/vxrAuY8,
1357875463.0,76,imgur.com,16cwux,Wil Wheaton answers THE question,79,3,1,http://www.reddit.com/r/teaching/comments/16cwux/wil_wheaton_answers_the_question/,,,False,http://b.thumbs.redditmedia.com/T0kBOv96zPS0KkR1.jpg,t5_2qyj9,False,,,False,t3_16cwux,http://imgur.com/j8LEZ,
1370037202.0,76,quickmeme.com,1ffi0o,"My doctor suggested I schedule surgery a week before school ends and just ""end a bit early""",84,8,25,http://www.reddit.com/r/teaching/comments/1ffi0o/my_doctor_suggested_i_schedule_surgery_a_week/,,,False,http://a.thumbs.redditmedia.com/1cXGA8bFK7hLI7PB.jpg,t5_2qyj9,False,,,False,t3_1ffi0o,http://www.quickmeme.com/meme/3uo3dw/,
1366716827.0,74,imgur.com,1cxgy8,[Vent] A third-grader's honest response.,85,11,12,http://www.reddit.com/r/teaching/comments/1cxgy8/vent_a_thirdgraders_honest_response/,,,False,http://c.thumbs.redditmedia.com/l39TvTWIYRLcwCcz.jpg,t5_2qyj9,False,,,False,t3_1cxgy8,http://imgur.com/Sw5eh45,
1352114924.0,77,imgur.com,12nvez,I'm sure most of us are familiar with this sentiment.,84,7,9,http://www.reddit.com/r/teaching/comments/12nvez/im_sure_most_of_us_are_familiar_with_this/,,,False,http://c.thumbs.redditmedia.com/iZ7STOzZolvk0u3z.jpg,t5_2qyj9,False,,,False,t3_12nvez,http://imgur.com/4RAjt,
1332714796.0,73,i.qkme.me,rd9np,Every time I respond to something my students are whispering about,79,6,8,http://www.reddit.com/r/teaching/comments/rd9np/every_time_i_respond_to_something_my_students_are/,,,False,http://c.thumbs.redditmedia.com/vAJJJeMR8zjFULlb.jpg,t5_2qyj9,False,,,False,t3_rd9np,http://i.qkme.me/3ogrl2.jpg,
1347908713.0,73,self.teaching,101b6s,I think they're getting the picture...,81,8,5,http://www.reddit.com/r/teaching/comments/101b6s/i_think_theyre_getting_the_picture/,"Today we did an activity in which I handed out cards with countries on them and then I divided up brownies according to the countries’ wealth, so the wealthiest 20% gets 80% of the brownies and the lowest 40% got 1% of the brownies. When I was handing out the cards, the kids had no idea what the activity was going to be, but one of them looked as his card and said “Somalia! Oh, crap. I don’t know what we’re doing, but this can’t be good.”",,False,self,t5_2qyj9,False,,,True,t3_101b6s,http://www.reddit.com/r/teaching/comments/101b6s/i_think_theyre_getting_the_picture/,
1376689825.0,74,imgur.com,1kij9g,I wrote and illustrated this comic/story about a lonely Plot who wants to become a Book. Intended to be a tool for teaching kids about the writing process. Might be useful as the school year starts!,77,3,8,http://www.reddit.com/r/teaching/comments/1kij9g/i_wrote_and_illustrated_this_comicstory_about_a/,,,False,http://e.thumbs.redditmedia.com/4HhA3DP3eY7jm4Kj.jpg,t5_2qyj9,False,,,False,t3_1kij9g,http://imgur.com/a/kbcCG,
1370579691.0,71,imgur.com,1fud27,My English teacher from high school is so passionate about her job. I'm proud to say I had her for my teacher.,80,9,10,http://www.reddit.com/r/teaching/comments/1fud27/my_english_teacher_from_high_school_is_so/,,,False,http://f.thumbs.redditmedia.com/YrzX6Ats8fpunYcw.jpg,t5_2qyj9,False,,,False,t3_1fud27,http://imgur.com/Oru46jx,
1368450059.0,71,imgur.com,1e8pk3,"""and dont get me started...""",81,10,5,http://www.reddit.com/r/teaching/comments/1e8pk3/and_dont_get_me_started/,,,False,http://a.thumbs.redditmedia.com/wBdmsgmvdlIXre7Z.jpg,t5_2qyj9,False,,,False,t3_1e8pk3,http://imgur.com/RizEZft,
1360879798.0,74,quickmeme.com,18jjkh,Discovered this about myself while student teaching today. (X post with advice animals) ,89,15,17,http://www.reddit.com/r/teaching/comments/18jjkh/discovered_this_about_myself_while_student/,,,False,http://d.thumbs.redditmedia.com/tnjo5gOzcEG1KFou.jpg,t5_2qyj9,False,,,False,t3_18jjkh,http://quickmeme.com/meme/3szy3i/,
1347475647.0,72,imgur.com,zs1x6,had my students fill out a survey on reading....should I be worried?,76,4,18,http://www.reddit.com/r/teaching/comments/zs1x6/had_my_students_fill_out_a_survey_on/,,,False,http://f.thumbs.redditmedia.com/eE-LeyK-uMOsCqQk.jpg,t5_2qyj9,False,,,False,t3_zs1x6,http://imgur.com/yV6M0,
1368103389.0,67,youtube.com,1dzx3w,"Student attempts to give the teacher a lesson in ""teaching""",90,23,69,http://www.reddit.com/r/teaching/comments/1dzx3w/student_attempts_to_give_the_teacher_a_lesson_in/,,,False,http://b.thumbs.redditmedia.com/Zgx3tSRAHKyrJtFU.jpg,t5_2qyj9,False,,,False,t3_1dzx3w,https://www.youtube.com/watch?v=bQ2VAV3HYdU,
1361053305.0,73,i.imgur.com,18nqvl,As a kindergarten teacher...,87,14,5,http://www.reddit.com/r/teaching/comments/18nqvl/as_a_kindergarten_teacher/,,,False,http://c.thumbs.redditmedia.com/H4X4ThlrLvxukArP.jpg,t5_2qyj9,False,,,False,t3_18nqvl,http://i.imgur.com/ydXCE9i.jpg,
1338779390.0,74,i.imgur.com,ujl85,Something isn't adding up here...,90,16,8,http://www.reddit.com/r/teaching/comments/ujl85/something_isnt_adding_up_here/,,,False,http://d.thumbs.redditmedia.com/iskukaGzfVtMhr-o.jpg,t5_2qyj9,False,,,False,t3_ujl85,http://i.imgur.com/RdbEH.jpg,
1333483860.0,72,i.imgur.com,rrod1,I took this picture today in my classroom.  It feels like a metaphor for public education.,78,6,6,http://www.reddit.com/r/teaching/comments/rrod1/i_took_this_picture_today_in_my_classroom_it/,,,False,http://e.thumbs.redditmedia.com/jvp_PT7kwMm-09ZR.jpg,t5_2qyj9,False,,,False,t3_rrod1,http://i.imgur.com/gE4PI.jpg,
1334814206.0,64,i.imgur.com,shfcl,Technology is a two-way road in education... (epic teacher maneuver),71,7,18,http://www.reddit.com/r/teaching/comments/shfcl/technology_is_a_twoway_road_in_education_epic/,,,False,http://c.thumbs.redditmedia.com/5X7PIozf6q-_Fbun.jpg,t5_2qyj9,False,,,False,t3_shfcl,http://i.imgur.com/aPy8K.jpg,
