created_utc,score,domain,id,title,ups,downs,num_comments,permalink,selftext,link_flair_text,over_18,thumbnail,subreddit_id,edited,link_flair_css_class,author_flair_css_class,is_self,name,url,distinguished
1361395874.0,11,self.teaching,18ws8l,Teachers: Help shape the future of our educational software (TCS),13,2,2,http://www.reddit.com/r/teaching/comments/18ws8l/teachers_help_shape_the_future_of_our_educational/,"Hi Teachers! 

I've spent the last two years working on a computer program inspired by the touch screen interfaces on Star Trek.

**Touch Control System (TCS)**: A 3D game engine built for home automation, electronics projects, and more!

link: [http://hyperplaneinteractive.com/tcs](http://hyperplaneinteractive.com/tcs)

We are going to release an educational version of this software for free! 

Our hope is that by providing a hands-on learning experience with computer graphics and electronics hardware, we'll be able to spark the imaginations of future engineers.

We are working on several ""cool"" tech demos that we hope students of all ages will enjoy.

Here is a WiFi controlled robot:
[http://hyperplaneinteractive.com/blog/robots/](http://hyperplaneinteractive.com/blog/robots/)

Launching model rockets:
[http://hyperplaneinteractive.com/blog/launching-rockets/](http://hyperplaneinteractive.com/blog/launching-rockets/)

We can fly model helicopters around with TCS and recently added support for the [NeuroSky Mindwave](http://neurosky.com/Products/MindWave.aspx).

Using this program can get extremely technical and we plan to provide tutorials and instruction for everything from processing 1's and 0's to full-blown 3D graphics and user interaction. Any skills developed here will translate to other platforms and technologies easily.

Our plan is to get on Kickstarter to fully fund the development of this project.

Would any of you be interested in helping with the educational aspect of this project? We would love to work with anyone interested to develop structure for lesson plans, tutorials, tests, workshops, and anything else that would be useful in a learning environment.

We also need messages from educators stating the importance of this kind of hands-on learning and general ""Thumbs up! This is awesome!"" quotes that we could use for marketing purposes.

We're open to any comments or suggestions and welcome any questions or support!



Thanks for everything Teachers!

Mike Blakemore
mike@hyperplaneinteractive.com
[http://hyperplaneinteractive.com](http://hyperplaneinteractive.com)
",,False,self,t5_2qyj9,False,,,True,t3_18ws8l,http://www.reddit.com/r/teaching/comments/18ws8l/teachers_help_shape_the_future_of_our_educational/,
1360931871.0,12,theartcreature.blogspot.com,18ktsf,Art teacher discovers a very phallic drawing of a butterfly.  The joys of teaching elementary. Haha.,14,2,1,http://www.reddit.com/r/teaching/comments/18ktsf/art_teacher_discovers_a_very_phallic_drawing_of_a/,,,False,http://c.thumbs.redditmedia.com/iXRRHvJiYv1m2Gaz.jpg,t5_2qyj9,False,,,False,t3_18ktsf,http://theartcreature.blogspot.com/2013/02/butterfly-or-penis.html,
1355182460.0,14,self.teaching,14ms6f,"I'm currently working toward my degree in elementary education, but I'm also a burlesque performer. What do I do?",14,0,43,http://www.reddit.com/r/teaching/comments/14ms6f/im_currently_working_toward_my_degree_in/,"So, I'm in my first year of the elementary education program and I absolutely love it. I've always worked with kids and I'm so happy with where I'm headed. However, I am involved in the burlesque community on the side; i.e. performing, attending shows, volunteering, etc.

What I'm worried about is whether I can maintain this hobby while pursuing a career in teaching. 

I've gotten some concerned messages from family and friends who are already in the program, warning me not to post ANYTHING, even a status related to burlesque onto Facebook (although my privacy settings are all set up). However, the people who I have talked to who are already teachers seem less worried about it. I'm getting a lot of mixed opinions.

What are your thoughts? Ultimately I want to continue doing this, but it would be nice to see what others think.

For those who don't know what burlesque is, here's a link to a good (but kind of long) descriptor. http://savageminds.org/2012/09/24/the-anthropologist-in-the-museum-what-is-burlesque/

TL;DR: I'm a burlesque performer that is going into elementary education and is worried about possible negative implications. 

Edit: I don't know if it makes a difference, but I will be a teacher in B.C., Canada. :)

Edit: I'm not determined by any means to have an online presence, I was just using Facebook as an example of how some people in my life are concerned about me keeping this as private as possible.

Edit: Thanks to everyone for all of the thoughtful responses! I appreciate hearing what the the teaching community has to say about it; whether I may like the answer or not. :)",,False,self,t5_2qyj9,1355282485.0,,,True,t3_14ms6f,http://www.reddit.com/r/teaching/comments/14ms6f/im_currently_working_toward_my_degree_in/,
1350430911.0,10,self.teaching,11lkqw,"TIL that, according to one of my students, the Bill of Rights has 0 amendments in it, ""Going to School"" is a euphemism (he couldn't say for what), ""Buttoner"" is a proper noun, and Mexican-Spanish is a language. I teach in college.",15,5,12,http://www.reddit.com/r/teaching/comments/11lkqw/til_that_according_to_one_of_my_students_the_bill/,"Okay, he's not a dumb as it sounds.  We were using a Classroom Jeopardy! game for the midterm review. He just got a bit ahead of himself in the answers.  And, after uttering every one of these gems, this student quickly corrected himself and got very flustered.  But he cracked up the whole room and a great time was had by all.",,False,self,t5_2qyj9,False,,,True,t3_11lkqw,http://www.reddit.com/r/teaching/comments/11lkqw/til_that_according_to_one_of_my_students_the_bill/,
1349712091.0,13,self.teaching,1154yy,Teachers of reddit... Give a soon-to-be-teacher the scoop on parent-teacher conferences.,14,1,20,http://www.reddit.com/r/teaching/comments/1154yy/teachers_of_reddit_give_a_soontobeteacher_the/,Do you find them useful?  What percentage of parents actually show up?  What are your goals for these meetings?  ,,False,self,t5_2qyj9,False,,,True,t3_1154yy,http://www.reddit.com/r/teaching/comments/1154yy/teachers_of_reddit_give_a_soontobeteacher_the/,
1340037279.0,13,jezebel.com,v8agg,"Teacher Fights Violence With Violence, Orders Entire Class to Hit Six-Year-Old Bully",16,3,6,http://www.reddit.com/r/teaching/comments/v8agg/teacher_fights_violence_with_violence_orders/,,,False,http://e.thumbs.redditmedia.com/vaL1oZMpwNM0U7vp.jpg,t5_2qyj9,False,,,False,t3_v8agg,http://jezebel.com/5919175/creative-teacher-fights-violence-with-violence-orders-entire-class-to-hit-six+year+old-bully,
1338493292.0,11,self.teaching,uecy6,Using videos as a teaching tool- need feedback,15,4,7,http://www.reddit.com/r/teaching/comments/uecy6/using_videos_as_a_teaching_tool_need_feedback/,"Hi, I teach 3rd grade in Hawaii and I've been using video clips to introduce new topics and ideas. For example I recently used Ice Age to kick off our lesson on animal adaptations. The students loved it and were able to relate to the video throughout our unit. 
I was thinking about putting together a resource online for teachers to access that had a list of videos/clips and what topics/common core standards they relate to. It would be a place where myself and other teachers could submit video ideas that relate to what we're teaching. 
Would this resource be helpful? Looking for feedback or ideas. All feedback is welcome ;)
",,False,self,t5_2qyj9,False,,,True,t3_uecy6,http://www.reddit.com/r/teaching/comments/uecy6/using_videos_as_a_teaching_tool_need_feedback/,
1337778980.0,11,self.teaching,u0y0i,Motivating Students,12,1,21,http://www.reddit.com/r/teaching/comments/u0y0i/motivating_students/,"I'm ending my second year teaching high school math. The more I reflect on the year, the more it troubles me that there are students I did not reach. There were students who basically refused to participate in class, who almost never turned in homework, and who honestly did not seem to care. (I know that some simply put forth an appearance of not caring, but I also honestly feel that some of them just did not care about the class at all, unless threatened by their parents.)

I have realized that the students who worked hard for me are the students who would work hard for anyone, because they are intrinsically motivated. What I want to learn more about is how to motivate people, especially the ones who aren't naturally motivated for math or for school in general. Does anyone have any book recommendations? They could be teaching specific books, or even just general books on the psychology of motivating people.

Thank you.

",,False,self,t5_2qyj9,False,,,True,t3_u0y0i,http://www.reddit.com/r/teaching/comments/u0y0i/motivating_students/,
1336398656.0,11,edition.cnn.com,tb5eg,Indiana mom sends son to school with stun gun to confront bullies,12,1,10,http://www.reddit.com/r/teaching/comments/tb5eg/indiana_mom_sends_son_to_school_with_stun_gun_to/,,,False,http://f.thumbs.redditmedia.com/QJM0sPbm3l_h9rRS.jpg,t5_2qyj9,False,,,False,t3_tb5eg,http://edition.cnn.com/2012/05/07/us/indiana-bullied-teen/index.html?eref=mrss_igoogle_cnn,
1331052757.0,12,huffingtonpost.com,qkbrs,Teacher fired for giving third-graders hilariously morbid math problems,13,1,4,http://www.reddit.com/r/teaching/comments/qkbrs/teacher_fired_for_giving_thirdgraders_hilariously/,,,False,http://e.thumbs.redditmedia.com/7Bi4QoAP-y0IP6aL.jpg,t5_2qyj9,False,,,False,t3_qkbrs,http://www.huffingtonpost.com/2012/03/05/teacher-fired-for-giving-_n_1322173.html,
1330490445.0,11,self.teaching,qaus4,Teachers of reddit...What are you like?,15,4,24,http://www.reddit.com/r/teaching/comments/qaus4/teachers_of_redditwhat_are_you_like/,"I'm a special education major in the second semester of my junior year. Tomorrow, for one of my classes, we will be attending a job fair sponsored by my University to meet with administrators from all around the state. I was really excited! I've spent a week or so perfecting my resume...because even though I'm not in the job pool yet, I can recognize this great opportunity and the idea of ""playing"" applicant is exciting to me.

Then...I started reading some the ""tips and guidelines"" provided on my school's Career Services website. Essentially, they advise strongly against any display of personality. They state (numerous times) that nothing-except your resume-should stand out in the prospective employer's mind after you leave. Shirts should be white, off-white, or light blue; makeup should be kept to an absolute minimum; 1-2 inch heels should be worn; hair should be neat and combed back; nails should be manicured.

Now, I'm not some sloppy mope--but NONE of the aforementioned qualities really click with me. I pride myself on my personality. I'm a bubbly, smiling, outgoing girl and my aura of friendliness has landed me every job I've applied for up to this point. I can't imagine going to meet with employers and having to ""tone it down."" I want my personality to stick with employers. I want them to remember me as the smiley, excited, and motivated teaching candidate. I don't want to lie about who I am. I wouldn't want to work for a district that would discourage energy and positivity in the classroom. 

The hair thing, too...Not to toot my own horn, but I've got some cute hair. It's a shorter, layered bob and stands out when compared to the slick straight, side bangs of every other girl my age. I get tons of compliments on my hair, and it's something I really like about myself. Am I going to have to cut it off and go for something average/plain/not me?

I don't wear heels. I don't get manicures. I like my shirts bright and fun. I KNOW not all teachers fit the bill that my school's Career Services has laid out, but I'm just looking for some reassurance.

I know this is a huge rant, but someone put my mind at ease. I just had one of those ""oh-my-god-maybe-I'm-not-right-for-this"" moments...and surprisingly, it has nothing to do with my competence in the classroom.

TL,DR: What are you all like?  How do you present yourself to employers- do you flaunt your personalities or try to conform in to the ""professional"" world?",,False,self,t5_2qyj9,False,,,True,t3_qaus4,http://www.reddit.com/r/teaching/comments/qaus4/teachers_of_redditwhat_are_you_like/,
1329865673.0,13,mindcorestudios.com,q00kx,Why I Hate Teaching,29,16,44,http://www.reddit.com/r/teaching/comments/q00kx/why_i_hate_teaching/,,,False,http://f.thumbs.redditmedia.com/rbImuO2Z18mPD5DY.jpg,t5_2qyj9,False,,,False,t3_q00kx,http://www.mindcorestudios.com/enrique-recuero-hates-teaching/,
1329063806.0,12,imgur.com,pm4wf,"I have taught my class to make a video game, someone decided to put this in it...",18,6,7,http://www.reddit.com/r/teaching/comments/pm4wf/i_have_taught_my_class_to_make_a_video_game/,,,False,http://f.thumbs.redditmedia.com/zLMvmb46bcc91wEA.jpg,t5_2qyj9,False,,,False,t3_pm4wf,http://imgur.com/mjXcj,
1326203805.0,13,tinyurl.com,oatc0,Why is Public Education outsourced to Online Schools,25,12,0,http://www.reddit.com/r/teaching/comments/oatc0/why_is_public_education_outsourced_to_online/,,,False,default,t5_2qyj9,False,,,False,t3_oatc0,http://tinyurl.com/79cof4t,
1323999924.0,12,self.teaching,nel5y,Holiday Concerts are Done!,12,0,8,http://www.reddit.com/r/teaching/comments/nel5y/holiday_concerts_are_done/,"Hey all,

Just wanted to revel in the fact that my holiday music concerts are done. I did two, one at each elementary school that I teach at. They were my first ever as a teacher, and I feel like I've been in labor for two days. The relief is astounding.

At one school, I was showered with gifts and thanks. At the other, two parents came up to me and said thanks, and I got a little handmade gift from a student. That student made it worth it to direct the concert at that school.

All in all, they went well, and I learned a LOT about planning and communication. Just wanted to share with Reddit :)",,False,self,t5_2qyj9,False,,,True,t3_nel5y,http://www.reddit.com/r/teaching/comments/nel5y/holiday_concerts_are_done/,
1323758415.0,13,self.teaching,napso,Any advice for a college student aspiring to be a teacher?,13,0,18,http://www.reddit.com/r/teaching/comments/napso/any_advice_for_a_college_student_aspiring_to_be_a/,"So, I'm a freshman in college, and I'd really like to be a high school english teacher. I've wanted to be a teacher for almost as long as I can remember, and I would love to be able to inspire students like my high school english teachers did for me. I'm just having some trouble convincing my parents that this is a viable career for me to commit to. 

While they seem to understand my desire to be a teacher, they still think i should do something else in order to make more money so I can take care of myself. They believe this to the point where they might not let me go back to school next semester (they wouldnt continue taking loans out for me) because there isn't another career I'd like to do and they don't think I should be in college if i don't have a direction. 

Any advice for a desperate hopeful future teacher?",,False,self,t5_2qyj9,False,,,True,t3_napso,http://www.reddit.com/r/teaching/comments/napso/any_advice_for_a_college_student_aspiring_to_be_a/,
1323372527.0,13,self.teaching,n56xw,Need help with behaviour management (chatting),13,0,23,http://www.reddit.com/r/teaching/comments/n56xw/need_help_with_behaviour_management_chatting/,"I'm a training French teacher and I'm having a lot of troubles with a group of sixth form I'm teaching to (16yo)

I have a group of 19 pupils. Among them 4, sitting at the same table are always chatting. These are very good pupils, they have excellent marks.

I've done almost everything I could think of to keep them quiet.
My lessons are well planned as I give exactly the same lesson to two other group and everything goes well.

I've tried not speaking, it worked a few times but not anymore. 

I've tried switching the lights on and off as a visual signal.

I've tried to interrogate the one chatting.

I've tried whispering and talking louder.

I've tried with 2 different seating plans, but I think it's good.

I've tried talking to them at the end of class.

I've tried standing behind them silent.

I can't get them detention as there are no detention.

I'm getting very frustrated at repeating so many times the same thing because they were not listening. I'm very patient but my patience has some limits.

The thing is once they're chatting there is some sort of mass effect where all the others tend to do the same and they are slowing down the whole class.


Please reddit teachers help me, I really don't want to shout at them. I'm sure there are other solutions.",,False,self,t5_2qyj9,False,,,True,t3_n56xw,http://www.reddit.com/r/teaching/comments/n56xw/need_help_with_behaviour_management_chatting/,
1322994937.0,12,businessweek.com,mznim,"All teachers should read this, telling a kid they are bright might not be the best thing to do.",15,3,0,http://www.reddit.com/r/teaching/comments/mznim/all_teachers_should_read_this_telling_a_kid_they/,,,False,http://d.thumbs.redditmedia.com/oNE7RUrYAsdOYfPQ.jpg,t5_2qyj9,False,,,False,t3_mznim,http://www.businessweek.com/management/the-trouble-with-bright-kids-11212011_page_1.html,
1318279222.0,11,self.teaching,l7gs2,I'm not sure I want to teach anymore...,13,2,20,http://www.reddit.com/r/teaching/comments/l7gs2/im_not_sure_i_want_to_teach_anymore/,"I've always told people I knew what I wanted to do from a very young age. I wanted to teach. I went to a college with one of the best Social Studies Education programs anywhere and excelled. 

I am now student teaching and I hate it. I feel that my supervisor and my cooperating teacher as unsupportive. I feel like my students don't like me and I know they don't respect me. I probably did it to myself wanting to student teach in a high needs area... 

I'm not sure where I am going with this, just need to vent I guess. I'm just scared... how do I know when to say that this isn't what I want?",,False,self,t5_2qyj9,False,,,True,t3_l7gs2,http://www.reddit.com/r/teaching/comments/l7gs2/im_not_sure_i_want_to_teach_anymore/,
1317357926.0,13,open.salon.com,kw4y9,"""I teach"" means one thing to the listener and another to the teacher.",15,2,0,http://www.reddit.com/r/teaching/comments/kw4y9/i_teach_means_one_thing_to_the_listener_and/,,,False,http://thumbs.reddit.com/t3_kw4y9.png,t5_2qyj9,False,,,False,t3_kw4y9,http://open.salon.com/blog/mango_sherbert/2011/09/29/what_it_means_when_i_say_i_teach,
1316085803.0,12,self.teaching,kgeox,"I took a long-term subbing job the day before school started. I've been bending over backwards for them, and yesterday they told me that I've been ""volunteering"" and that I may not be getting paid for my time. Help? ",13,1,18,http://www.reddit.com/r/teaching/comments/kgeox/i_took_a_longterm_subbing_job_the_day_before/,"I'm sorry if this is an inappropriate place for this, but I don't have anyone in the teaching community that I can ask for advice.

I'll spare you guys the long version of the story, but basically I was hired on very short notice to teach an art class for the first four (or so) weeks of the year. I have subbed before, but this is my first assignment in this district, so I was not previously an X Jurisdiction Public Schools employee. I was told by several administrators and the substitute office that this would not be a problem, and that, while I wouldn't start receiving paychecks until I was officially hired, I would be compensated fully for every day that I worked at the long-term substitute rate. I accepted the job with this understanding and began work pretty much instantaneously.

It took a little longer than the administrators and I had expected to get through the red tape of being hired by XJPS (which is gigantic). I had hoped to have it done last Wednesday, but I was only able to get officially hired yesterday.

Yesterday I had a discussion with one of the administrators and she informed me that they were not going to be able to pay me, at all, until I had an employee number. Even though I was hired yesterday, I won't receive a number until my background check, etc. is complete, so I don't anticipate receiving it until sometime next week. I said that that was not my understanding of our arrangement, and she said that when I started she thought that I would be able to be paid for all of my time, but it turns out it just wouldn't be possible, and that they were sorry. Basically, I wouldn't start accruing wages, at all, until my background check goes through. This also means that I would only end up getting paid for seven or eight days, so I wouldn't even be receiving the long-term rate. In my district, this is a difference of about $1500.

We went around in circles for awhile and. I said that I felt I should inform her that if I wasn't compensated fully for my time that I would take legal action. (In retrospect I know that this might not have been the best idea, even though it's completely true.) I excused myself back to my room to get some planning done, and two minutes later she was in my room telling me that she had been mistaken, and I would get paid for everything after all, so no worries.

Guys, I don't know what to believe here. I love the kids I'm working with and I don't want to leave them until I have to, but every day that I work with XJCS is a day that I could be *definitely* getting paid in my home district (yes, even this early in the year). I plan to write them a letter explaining my understanding of our arrangement (so that there's something in writing), and I plan to draw up timesheets today and have them signed by someone sufficiently important, but other than that I have no idea how to cover my ass.

To add further insult to insult, this is the school district I graduated from. I don't know why that stings so badly, but it does.

This experience has definitely taught me not to take any job ever unless I have something on paper, but I'd prefer not to write this off as an expensive lesson. Any ideas on how to remedy this situation would be most appreciated.

**Update - The assistant principal just came in and asked me to wear a ""volunteer"" badge with my name on it. I said no, but I'm irritated that my name is now on paper next to the word ""volunteer.""**

**Update 2 - The principal came to me today to clarify that he would indeed be able to pay me for all of my time. I'm still planning on writing that letter to get something down on paper, because I don't completely trust anything they tell me anymore. I'm still welcoming advice on how to cover my ass.**",,False,self,t5_2qyj9,True,,,True,t3_kgeox,http://www.reddit.com/r/teaching/comments/kgeox/i_took_a_longterm_subbing_job_the_day_before/,
1315965586.0,12,self.teaching,kew06,"I teach US History at a private high school. TIL that X=Y, in which X is the amount of money I make in a year, and Y is the amount of money one of my juniors has to spend on her new car",14,2,10,http://www.reddit.com/r/teaching/comments/kew06/i_teach_us_history_at_a_private_high_school_til/,"No greater point, just thought it was interesting.",,False,self,t5_2qyj9,False,,,True,t3_kew06,http://www.reddit.com/r/teaching/comments/kew06/i_teach_us_history_at_a_private_high_school_til/,
1308402561.0,12,self.teaching,i2wpa,Reddit Teachers: What are the best and worst interview questions you've asked/been asked?,13,1,18,http://www.reddit.com/r/teaching/comments/i2wpa/reddit_teachers_what_are_the_best_and_worst/,"As a new teacher, I'd love a collection of some of the top and toughest interview questions for teachers.

Yesterday at an interview I was asked, ""What percentage of your student's academic success rests on you? Why?"" 

",,False,self,t5_2qyj9,False,,,True,t3_i2wpa,http://www.reddit.com/r/teaching/comments/i2wpa/reddit_teachers_what_are_the_best_and_worst/,
1294204706.0,10,self.teaching,ewey7,Did this subreddit become NSFW?,14,4,2,http://www.reddit.com/r/teaching/comments/ewey7/did_this_subreddit_become_nsfw/,"If so, why?",,True,nsfw,t5_2qyj9,False,,,True,t3_ewey7,http://www.reddit.com/r/teaching/comments/ewey7/did_this_subreddit_become_nsfw/,
1283071773.0,12,money.cnn.com,d6t1y,Sal Khan: Bill Gates' favorite teacher,13,1,1,http://www.reddit.com/r/teaching/comments/d6t1y/sal_khan_bill_gates_favorite_teacher/,,,False,http://thumbs.reddit.com/t3_d6t1y.png,t5_2qyj9,False,,,False,t3_d6t1y,http://money.cnn.com/2010/08/23/technology/sal_khan_academy.fortune/index.htm,
1376757422.0,12,graceup5636.blogspot.com,1kk0wf,I'm a teacher - how about you let me get ready to TEACH!!!,14,2,6,http://www.reddit.com/r/teaching/comments/1kk0wf/im_a_teacher_how_about_you_let_me_get_ready_to/,,,False,http://e.thumbs.redditmedia.com/ROlJNJm5hsCQgLNv.jpg,t5_2qyj9,False,,,False,t3_1kk0wf,http://graceup5636.blogspot.com/2013/08/getting-back-to-school-letter-wrong.html,
1376692588.0,12,tolerance.org,1kimlx,"Here's a really cool way of having students think about a topic called ""cubing""",12,0,6,http://www.reddit.com/r/teaching/comments/1kimlx/heres_a_really_cool_way_of_having_students_think/,,,False,default,t5_2qyj9,False,,,False,t3_1kimlx,http://www.tolerance.org/sites/default/files/documents/guide_act8.pdf,
