created_utc,score,domain,id,title,ups,downs,num_comments,permalink,selftext,link_flair_text,over_18,thumbnail,subreddit_id,edited,link_flair_css_class,author_flair_css_class,is_self,name,url,distinguished
1362356321.0,21,self.teaching,19lu42,Finishing my last semester and just realized this isn't for me,25,4,31,http://www.reddit.com/r/teaching/comments/19lu42/finishing_my_last_semester_and_just_realized_this/,"I'm finishing up my last semester and I'm currently one month into student teaching for adolescent math. It's been a miserable experience and I'm finally realizing that this isn't for me at all.

Teaching has always been a back up for me and I've never been particularly interested in it. I just picked it up and for whatever reason decided to stick with it. I've made no friends in the program (all of my friends are taking up other studies at the university), and I've always hated my edu courses. I don't know why it took so long, but now that I'm actually in the field as a student teacher, I've realized the mistake I've made. 

I have no interest in kids. I'm not passionate about helping them. I don't care much for my concentration (math). In the beginning it seemed like a decent backup because of the vacation hours and I had a blast when I was in high school fucking around with my teachers. I've now realized that I was interested in all the wrong things with the profession. I was looking at the rewards and not the job itself. I thought about the traits and qualities of all of my favorite teachers, and I've come to realize that these are not traits that I embody. 

I kept chugging along thinking ""this is just a backup, all you want is a degree, just get it and move on"" and here I am now and I'm not sure if I can keep this up. There's three months left but I'm constantly stressed, depressed and overall miserable. I get emails from my university about mandatory career meetings and I just sit around and sulk while I'm there. 

I thought maybe I can just work hard and keep pushing until graduation but my sponsor teacher has finally pulled me aside and expressed her concern about the kids. My performance in the classroom is putting their grades at risk. 

I keep trying to get better and take suggestions but it's not helping me. It's not a matter of me not working hard enough. Student teaching has pretty much consumed my life and despite all the work I put in, I'm not seeing any improvement. 

I'm tempted to just drop it and move on to something to else but it seems like such a waste since it's my final semester. My parents and my friends have suggested switching majors to something that will make me happier but I don't want to delay my graduation. Maybe I can deal with one extra semester, but I don't want to stay in school any longer. I honestly don't care what my degree is in, I just want one under my belt. ",,False,self,t5_2qyj9,False,,,True,t3_19lu42,http://www.reddit.com/r/teaching/comments/19lu42/finishing_my_last_semester_and_just_realized_this/,
1353522594.0,18,theatlantic.com,13kt5i,"""AP Classes Are a Scam."" - The Atlantic. What do you think?",20,2,19,http://www.reddit.com/r/teaching/comments/13kt5i/ap_classes_are_a_scam_the_atlantic_what_do_you/,,,False,http://d.thumbs.redditmedia.com/Dz8ruraEDORZB8pE.jpg,t5_2qyj9,False,,,False,t3_13kt5i,http://www.theatlantic.com/national/archive/2012/10/ap-classes-are-a-scam/263456/,
1349915778.0,21,self.teaching,11a6so,How do you get high schoolers to stop talking?,24,3,57,http://www.reddit.com/r/teaching/comments/11a6so/how_do_you_get_high_schoolers_to_stop_talking/,"I cannot get my high school class to stop talking. I repeat myself over and over until they be quiet. They even talk during my lectures. I tried changing the seating chart and some of them defy me and sit in their old seat. I'm a first year teacher and don't have a good grasp on classroom management. Any advice?


*Thank you guys sooo much for your encouragement and advice! I'm going to try some of the things you mentioned! 

[Update] I tried to simply place detention slips on my podium while I lecture. I held up the slips and said if I have to continue to ask you to stop talking, your name is going on this slip. They got quiet quickly and were quiet the entire lecture. Also, I tried the whole ""don't talk over them, wait for them to get quiet first"" approach and it worked. Once the good kids noticed I was getting annoyed/waited for them to get quiet they told each other to be quiet lol. So thanks for all of your advice, things are getting better! :)",,False,self,t5_2qyj9,1351038946.0,,,True,t3_11a6so,http://www.reddit.com/r/teaching/comments/11a6so/how_do_you_get_high_schoolers_to_stop_talking/,
1348884645.0,19,teachingchannel.org,10nfom,"As a student intern who has been working on classroom management, I thought this quick video gave some pretty good advice.",21,2,16,http://www.reddit.com/r/teaching/comments/10nfom/as_a_student_intern_who_has_been_working_on/,,,False,http://b.thumbs.redditmedia.com/BZGxV5yTdkSfMwNU.jpg,t5_2qyj9,False,,,False,t3_10nfom,https://www.teachingchannel.org/videos/new-teacher-classroom-management,
1344400307.0,20,self.teaching,xv58f,What is your favourite short story or poem to teach?,20,0,27,http://www.reddit.com/r/teaching/comments/xv58f/what_is_your_favourite_short_story_or_poem_to/,"Hi everyone,

Right now I am in my second placement as a student teacher and have been asked to take a Year 12 class (16-17 year olds) for unfamiliar texts.  We will be analysing a **short** text during class.  Although I haven't taught it, my favourite short story is *Everything That Rises Must Converge* by Flannery O'Connor, buuut it's a bit long to analyse in an hour.

What are you favourites to teach?  And, any reason why?",,False,self,t5_2qyj9,False,,,True,t3_xv58f,http://www.reddit.com/r/teaching/comments/xv58f/what_is_your_favourite_short_story_or_poem_to/,
1341932258.0,20,teach.com,wbvqi,Pearson in Trouble over a Reading Comprehension Section about a Pineapple Racing a Hare ,22,2,8,http://www.reddit.com/r/teaching/comments/wbvqi/pearson_in_trouble_over_a_reading_comprehension/,,,False,http://f.thumbs.redditmedia.com/tFYA_bJe9JIaMn2e.jpg,t5_2qyj9,False,,,False,t3_wbvqi,http://teach.com/education-policy/can-you-pass-an-8th-grade-reading-test,
1327215928.0,19,gizmodo.com,or86b,The Japanese method for multiplying is blowing my mind... ,28,9,5,http://www.reddit.com/r/teaching/comments/or86b/the_japanese_method_for_multiplying_is_blowing_my/,,,False,http://f.thumbs.redditmedia.com/PdqHBzW-nlgcMLmA.jpg,t5_2qyj9,False,,,False,t3_or86b,http://gizmodo.com/5713010/this-bewildering-japanese-multiplication-method-just-multiplied-my-brain-by-zero,
1323724193.0,21,self.teaching,na2lt,Is it culturally accepted for middle school teachers to receive flowers from their SO at their place of work?,21,0,25,http://www.reddit.com/r/teaching/comments/na2lt/is_it_culturally_accepted_for_middle_school/,"Hey guys,

I know this isn't really related to teaching but I wasn't sure where else I could go to get an answer.  Since there is a plethora of members involved with the teaching profession here, I hope you'll allow this post to  stay.  If not, thanks for reading and feel free to downvote, I understand.

I would like to send my SO flowers for no particular reason but I'm not sure if this kind of thing is culturally accepted in a school environment.  She is 24 and works with other teachers near her age all the way up to retirement ago.  We live in Northern NJ if that lends a helping hand to anyone trying to help me out.

Thanks for your help and I understand if this gets down voted.  I just don't want to put her in a weird place with her superiors and peers at work.",,False,self,t5_2qyj9,False,,,True,t3_na2lt,http://www.reddit.com/r/teaching/comments/na2lt/is_it_culturally_accepted_for_middle_school/,
1323469473.0,18,self.teaching,n6rs9,"caring too much, burning out too quickly",22,4,23,http://www.reddit.com/r/teaching/comments/n6rs9/caring_too_much_burning_out_too_quickly/,"Good evening! First post here under teaching. It seems more often than not, I end up crying Friday afternoons when I get home. I'm a third year teacher, and this year I am struggling more than the past two years. Specifically, I team teach with my special ed teacher (we get along well and this is our third year together), and this year we feel there is more apathy from students. We teach chemistry, which in our state is a required class for all students, even though not all students have the skills. Our student grades our either Bs &amp; Cs or Fs. We've talked to the students with no luck. We're smoothing out our lessons every year, and we're making things as easy as possible for students. I spent my entire hour and a half planning period calling home and emailing counsellors about failing students; I checked in with counsellors to make sure they received all the info, and I get nothing back. 

I know I am not the only one struggling with this; teachers, how do you keep sane and happy and not burn out within the first five years? ",,False,self,t5_2qyj9,False,,,True,t3_n6rs9,http://www.reddit.com/r/teaching/comments/n6rs9/caring_too_much_burning_out_too_quickly/,
1299697956.0,20,boingboing.net,g0mdh,miltary budget vs. education budget (awesome comic),22,2,1,http://www.reddit.com/r/teaching/comments/g0mdh/miltary_budget_vs_education_budget_awesome_comic/,,,False,http://thumbs.reddit.com/t3_g0mdh.png,t5_2qyj9,False,,,False,t3_g0mdh,http://www.boingboing.net/2011/03/09/tom-the-dancing-bug-39.html,
1372868646.0,19,chicagonow.com,1hkp7d,Schools are not businesses! Why Corporate Reform is a Losing Proposition,27,8,3,http://www.reddit.com/r/teaching/comments/1hkp7d/schools_are_not_businesses_why_corporate_reform/,,,False,http://a.thumbs.redditmedia.com/gz4Yhy2QHTdU9oCx.jpg,t5_2qyj9,False,,,False,t3_1hkp7d,http://www.chicagonow.com/which-side-are-you-on/2013/07/corporate-education-reform-is-a-losing-proposition/,
1371396464.0,18,self.teaching,1gghc9,What are some supplies a first-year teacher might overlook?,22,4,51,http://www.reddit.com/r/teaching/comments/1gghc9/what_are_some_supplies_a_firstyear_teacher_might/,"I'm a first-year teacher who is going to be teaching ninth grade ELA in the upcoming school year. I have a meeting with my principal soon and she mentioned that she'd put in an order for any supplies I need. 

We haven't designed our year-long curriculum yet and I haven't began throwing together my syllabus yet. I can think of a few things to ask for, but I'm wondering what supplies I might overlook. 

Thanks!",,False,self,t5_2qyj9,False,,,True,t3_1gghc9,http://www.reddit.com/r/teaching/comments/1gghc9/what_are_some_supplies_a_firstyear_teacher_might/,
1370116159.0,18,self.teaching,1fh9dt,"""Oh....you're an education major? You know you're never going to get a job right?""",22,4,45,http://www.reddit.com/r/teaching/comments/1fh9dt/ohyoure_an_education_major_you_know_youre_never/,"Hi everyone! This is going to be a bit of a rant/question thread. I'm currently a senior childhood education major in New York and I student teach next January. I'm planning on going to grad school right after for literacy education. 

A lot of times when I tell new people I'm an education major, the first thing they say it ""Oh...you know you're never going to get a job right?"" or ""I know xyz whose a teacher and they hate it."" It's incredibly frustrating to hear because not only do I love my major/teaching, it's not like I can undo the last three years of my education studying to be a teacher. I'm excited to become a teacher and it's annoying when people I just meet put me down with my career path. 

Does anyone deal with this? Does anyone have any advice to a senior whose almost done with their degree on what to do next? I've been a long time lurker/subscriber of this subreddit and it's one of my favorites ones :) Thanks everyone!",,False,self,t5_2qyj9,False,,,True,t3_1fh9dt,http://www.reddit.com/r/teaching/comments/1fh9dt/ohyoure_an_education_major_you_know_youre_never/,
1368914067.0,20,guardian.co.uk,1eljed,Secret Teacher: I'd rather leave the job I love than teach Gove's propaganda (UK),24,4,3,http://www.reddit.com/r/teaching/comments/1eljed/secret_teacher_id_rather_leave_the_job_i_love/,,,False,http://f.thumbs.redditmedia.com/FQLhVHO0YGuL6MhA.jpg,t5_2qyj9,False,,,False,t3_1eljed,http://www.guardian.co.uk/teacher-network/teacher-blog/2013/may/18/gove-leaving-teaching-curriculum-changes-history,
1367103046.0,20,loopmath.com,1d8omz,We made this free app to help anyone learn math. It figures out what you don't know and shows you stuff to help you learn. What do you think?,25,5,8,http://www.reddit.com/r/teaching/comments/1d8omz/we_made_this_free_app_to_help_anyone_learn_math/,,,False,default,t5_2qyj9,False,,,False,t3_1d8omz,http://www.loopmath.com,
1365797155.0,18,wisecareers.com,1c87hb,Interview Tips for Teachers,27,9,5,http://www.reddit.com/r/teaching/comments/1c87hb/interview_tips_for_teachers/,,,False,http://a.thumbs.redditmedia.com/krdz_ldgCJzKs2kl.jpg,t5_2qyj9,False,,,False,t3_1c87hb,http://wisecareers.com/articles/education/five-interview-tips-teachers,
1364558497.0,21,teachersjourneytolife.blogspot.com,1b8k2u,The Art of Teaching Children: Didactic Humility and Directiveness: DAY 4 ,50,29,2,http://www.reddit.com/r/teaching/comments/1b8k2u/the_art_of_teaching_children_didactic_humility/,,,False,http://f.thumbs.redditmedia.com/eiMLVobcdjOoA1KA.jpg,t5_2qyj9,False,,,False,t3_1b8k2u,http://teachersjourneytolife.blogspot.com/2013/03/the-art-of-teaching-children-didactic.html,
1360716147.0,18,self.teaching,18euy6,"When I get home, I'm Tweeting This",24,6,19,http://www.reddit.com/r/teaching/comments/18euy6/when_i_get_home_im_tweeting_this/,"I sent a first grader to the time out chair after he stepped on someone's fingers and wouldn't apologize for it.  

His response as I pointed to the chair and waited for him to go was ""When I get home, I'm tweeting this.""    I had to bite my tongue not to laugh at him.""

Has anyone else experienced any moments like this.   Just crazy technological moments things in the classroom that make go wtf kind of world do we live in?    Maybe I'm just sheltered because I teach in primary grades but this was a first for me.    
",,False,self,t5_2qyj9,False,,,True,t3_18euy6,http://www.reddit.com/r/teaching/comments/18euy6/when_i_get_home_im_tweeting_this/,
1345082386.0,19,self.teaching,yap02,Sharing the love!,20,1,4,http://www.reddit.com/r/teaching/comments/yap02/sharing_the_love/,"I am a single parent (not-by choice) and teach in one of the lowest SES schools in my area. Today, the third day of school, a sudent's mom shows up with the biggest basket of goodies for me. There were things for my classroom, things for me personally, and eventhings for my son. I am not one to wear my emotions on the outside, but I just started to cry. Her kindness touched me at a hard time. 

In what ways has a random act of kindness brighten your day?",,False,self,t5_2qyj9,False,,,True,t3_yap02,http://www.reddit.com/r/teaching/comments/yap02/sharing_the_love/,
1342058831.0,18,self.teaching,wf41l,A former student died today. He was shot and killed in front of his home. It's absolutely devastating. He was one of the sweetest kids I've met. I've never lost a student. He was 17. I'm so sad. ,20,2,20,http://www.reddit.com/r/teaching/comments/wf41l/a_former_student_died_today_he_was_shot_and/,,,False,self,t5_2qyj9,False,,,True,t3_wf41l,http://www.reddit.com/r/teaching/comments/wf41l/a_former_student_died_today_he_was_shot_and/,
1341500330.0,19,self.teaching,w2ucr,Happy AP Scores Day! ,19,0,10,http://www.reddit.com/r/teaching/comments/w2ucr/happy_ap_scores_day/,"Scores for AP exams begin to be released today. 

62% of my AP US history students passed! How did yours do? ",,False,self,t5_2qyj9,False,,,True,t3_w2ucr,http://www.reddit.com/r/teaching/comments/w2ucr/happy_ap_scores_day/,
1331646949.0,20,educatetoday.co.uk,quiqn,TED-Ed,21,1,0,http://www.reddit.com/r/teaching/comments/quiqn/teded/,,,False,default,t5_2qyj9,False,,,False,t3_quiqn,http://www.educatetoday.co.uk/2012/03/introducing-ted-ed.html,
1331591545.0,20,youtube.com,qtl4x,TEDEducation YouTube Site Launches!,20,0,2,http://www.reddit.com/r/teaching/comments/qtl4x/tededucation_youtube_site_launches/,,,False,default,t5_2qyj9,False,,,False,t3_qtl4x,http://www.youtube.com/TEDEducation,
1328642234.0,22,self.teaching,pf1be,"Can we stop with the ""I passed my test"" posts?",60,38,17,http://www.reddit.com/r/teaching/comments/pf1be/can_we_stop_with_the_i_passed_my_test_posts/,"We're happy for you. We love teachers, and new teachers need encouragement more than any others- but seriously, the Praxis tests and most of our certification tests are a joke. That's like announcing to us that you're a D student and proud of it.

Instead, tell us something we can use! Show us an awesome lesson plan, tell us about the success you had with the student that never backs down, or how about how you got the sleepy student to stay awake for your class!  

I mean, after all, we're teachers. Who hates standardized tests more than us?

",,False,self,t5_2qyj9,True,,,True,t3_pf1be,http://www.reddit.com/r/teaching/comments/pf1be/can_we_stop_with_the_i_passed_my_test_posts/,
1321825656.0,19,self.teaching,mjdeh,I am a science teacher with some success at writing grants.  Willing to share some experience.  ,19,0,12,http://www.reddit.com/r/teaching/comments/mjdeh/i_am_a_science_teacher_with_some_success_at/,"Here's a quick overview of what I've learned. In no particular order. 
1. If you want the really big grants (&gt;$10K) you're going to need help.
2. You must shamelessly self-promote.
3. You must make a grant request with an educational purpose for which the things you need are necessary.  You can never have a grant just for things you need.  There must be a plan, a project, a measurable outcome.
4. Many grants are adaptable to meet multiple purposes. 
5. You must learn to write believable budget justifications. 
6. There are some grant-generic things you need to know, in particular Letters of Intent, Fiscal years, Indirect Rates, and your tax-exempt status.
7. Each grant has specific rules you need to follow. Read the instructions carefully.
8. There's no substitute for a great idea or enthusiasm in your writing. Counts for a lot compared to technical competency. 
9. The difference between a grant and an award is that with an award you can generally spend it any way you like. 
10. Start locally. ",,False,self,t5_2qyj9,False,,,True,t3_mjdeh,http://www.reddit.com/r/teaching/comments/mjdeh/i_am_a_science_teacher_with_some_success_at/,
1307962663.0,20,self.teaching,hyf83,I'm failing my first student out of college. It's a weird feeling.,26,6,15,http://www.reddit.com/r/teaching/comments/hyf83/im_failing_my_first_student_out_of_college_its_a/,"I teach oral English and culture in a college in Shanghai. Obviously this means it's a high level and quite advanced class. You can't come in knowing only the words ""hello"" and ""thank you"" and expect to pass. I should also point out that, maturity-wise, people in China are about four years behind the level of Americans. So in college they really act more like high schoolers.

I try to accommodate as many levels as I can in each of my lessons, but I can't really get much lower than intermediate simply because I don't speak any Chinese. They need to be at least intermediate for us to be able to communicate with each other.

This one guy hasn't turned in any homework and was often quite rude to me. He would take out his cell phone and play games or read some other book while in my class and would roll his eyes at me when I told him to take part in class. Obviously this is not acceptable because bad attitudes like that can spread and if I need to partner people up I can't have this guy affecting other students.

I've kicked him out of class a couple of times.

When I told him ""Leave class"" the most recent time he said ""I don't understand"" in Chinese and put on his headphones and sat there reading. I tried to explain further, even got someone who could speak Chinese for me (which I think is highly unfair to my interpreting student and to his privacy). When I tried to say it in Chinese myself he would scoff me and said: ""My *head* teacher said I have to stay in class. So I'm not leaving class."" and I was like ""Oh man I am going to kill his head teacher for getting involved in my class.""

So I talked to his head teacher and was all like ""how dare you undermine my authority"", and she started telling me he's from a poor family, probably the first person in his family to go college. I said: ""Don't care. Being poor doesn't mean you get to be disrespectful and not pay attention in class.""

She tells me: ""He doesn't know any English"" and I say: ""Then why on earth is he in an advanced English class?""

She tells me: ""If he doesn't pass your class, then he gets kicked out of college. You're the last class he needs."" and I'm like: ""Then he should fail out college.""

So eventually he apologized and wrote me this long note, in pretty decent English mind you, about being sorry. I accepted it, pat him on the shoulder, wanted bygones to be bygones as long as he stopped being a dick in my class. That day he was good, he was looking stuff up in his dictionary and while he didn't understand everything that was being thrown at him he at least looked like he was trying.

Final day of class rolls around and he doesn't show up to do the final test. He hasn't even done any of the homework over the course of the semester to make up for it.

Fuck that guy for making me fail a poor chinese kid who was probably the first in his family to go to college. He makes me feel like an asshole.

Just wanted to vent. I'm sure I'll get some angry words for not trying to ""reach out to him"" or something but honestly, this is college, grow up.",,False,self,t5_2qyj9,False,,,True,t3_hyf83,http://www.reddit.com/r/teaching/comments/hyf83/im_failing_my_first_student_out_of_college_its_a/,
1376183372.0,20,self.teaching,1k4bsu,Things I will do differently this coming year,20,0,7,http://www.reddit.com/r/teaching/comments/1k4bsu/things_i_will_do_differently_this_coming_year/,"I'm teaching English, mostly 10th grade. I've been teaching for 20 years, 13 at this school. 

1. I'm going to get rid of clutter. I have STACKS of old test prep materials stacked against my back wall, most of it at least a year old. I'll ask the library what they want back, dump the rest.

2. I love teaching vocabulary; I think there's a lot of bang for the buck as far as time invested. The books are meant to be consumable, used once or twice and I've had some of them for 6 years. I doubt I could find a clean class set. I'm going to look for a new book of vocab words, maybe based on our state testing. I'm going to make a 'word wall', put the words up with definitions and sample sentences. Then, I'll have the kids 'adopt' one or two words each to teach to the rest of the class. Their grade will be based on how well they learned all of the words **and** how well they taught their assigned words to the rest of the class, based on the scores. 

3. I am going to find a workable, enforceable attendance policy this year. I am hardcore about rules being violated in class, cheating/copying...but I suck at informing parents about ditching or tardies and our system for checking truancies is a joke. Teleparent just doesn't do it, and sending in a referral if a kid is absent three times...I could drown under all the paper that'd generate. No thanks! I've got to find a better way.

What three things are you going to change this year?",,False,self,t5_2qyj9,False,,,True,t3_1k4bsu,http://www.reddit.com/r/teaching/comments/1k4bsu/things_i_will_do_differently_this_coming_year/,
1371690344.0,16,slate.com,1gp34s,Wu-Tang Clan's GZA teaches kids science with rap. [VIDEO],21,5,3,http://www.reddit.com/r/teaching/comments/1gp34s/wutang_clans_gza_teaches_kids_science_with_rap/,,,False,http://b.thumbs.redditmedia.com/p0HEnHNDCnWt6zVm.jpg,t5_2qyj9,False,,,False,t3_1gp34s,http://www.slate.com/blogs/future_tense/2013/06/18/wu_tang_clan_s_gza_teaches_kids_science_with_rap_video.html,
