created_utc,score,domain,id,title,ups,downs,num_comments,permalink,selftext,link_flair_text,over_18,thumbnail,subreddit_id,edited,link_flair_css_class,author_flair_css_class,is_self,name,url,distinguished
1343995847.0,47,deadline.com,xm6xj,Warner Bros Has 'Dark Tower' Decision Looming: And Russell Crowe Is In The Mix,55,8,23,http://www.reddit.com/r/TheDarkTower/comments/xm6xj/warner_bros_has_dark_tower_decision_looming_and/,,,False,,t5_2run7,False,,rose,False,t3_xm6xj,http://www.deadline.com/2012/08/warner-bros-has-dark-tower-decision-looming-and-russell-crowe-is-in-the-mix/,
1340692650.0,47,imgur.com,vm9hx,A Zippo my friend commissioned for me.,56,9,6,http://www.reddit.com/r/TheDarkTower/comments/vm9hx/a_zippo_my_friend_commissioned_for_me/,,,False,,t5_2run7,False,,19,False,t3_vm9hx,http://imgur.com/bPsbn,
1340445949.0,50,adsoftheworld.com,vh8jn,"I saw this on r/WTF. I know it's not him, but it's the first and only thing I can think of.",63,13,5,http://www.reddit.com/r/TheDarkTower/comments/vh8jn/i_saw_this_on_rwtf_i_know_its_not_him_but_its_the/,,,False,,t5_2run7,False,,coffin,False,t3_vh8jn,http://adsoftheworld.com/files/images/ff_1_bear-beard-beer.jpg,
1337160507.0,46,darktowercompendium.com,tpq74,"Collection of book illustrations, say thank ya",53,7,9,http://www.reddit.com/r/TheDarkTower/comments/tpq74/collection_of_book_illustrations_say_thank_ya/,,,False,,t5_2run7,False,,,False,t3_tpq74,http://www.darktowercompendium.com/fottergrafs-menu.html,
1333907140.0,46,imgur.com,rzg5n,Reversible dice bag my wife had made for our anniversary. Thought you guys might like it.,53,7,8,http://www.reddit.com/r/TheDarkTower/comments/rzg5n/reversible_dice_bag_my_wife_had_made_for_our/,,,False,,t5_2run7,False,,,False,t3_rzg5n,"http://imgur.com/NNmyo,Wnewg",
1333655981.0,46,self.TheDarkTower,rv4m5,Holy crap!,53,7,15,http://www.reddit.com/r/TheDarkTower/comments/rv4m5/holy_crap/,"I honestly don't remember how I stumbled into the Tower series - but about 2 months ago I started reading them and I'm about 1/4 of the way through Wizard and Glass. 


Then, sitting at desk bored - I start clicking on the reddit ""random"" tab and WHAMMO - I almost fell outta my chair. 

So glad to have found you guys - I love this series and I'm so glad to have a subreddit to enjoy.

Anyways, thanks for being here - I guess Ka was in the machine today. ",,False,,t5_2run7,False,,unfound,True,t3_rv4m5,http://www.reddit.com/r/TheDarkTower/comments/rv4m5/holy_crap/,
1360945380.0,47,self.TheDarkTower,18l3rs,Just finished Wizard and Glass for the first time...(book IV spoilers),49,2,24,http://www.reddit.com/r/TheDarkTower/comments/18l3rs/just_finished_wizard_and_glass_for_the_first/,"Right in the feels, man...

I reread the ending, somewhat hoping that somehow the words would magically rearrange themselves. That Roland would denounce the Tower and rescue Susan. That somehow the other six books on my shelf would simply vanish into thin air. I would forget what I had read in the first three and never wonder the events of the last. Because I would be left with just this one story, this one happily ended love story I've grown so accustomed to in my life. 

Alas, it wasn't so. Damn you, Stephen King! Now I'm left wondering and still very much intrigued by a story that's just sad. I know from what I've read thus far that it will only get more morose. Yet, I can't wait for my first piece of free time today so I can read on. I have to know the end now to know if it was worth it. Was it? (Rhetorical question; don't you dare answer it for me)",,False,,t5_2run7,False,,,True,t3_18l3rs,http://www.reddit.com/r/TheDarkTower/comments/18l3rs/just_finished_wizard_and_glass_for_the_first/,
1347124300.0,50,i.imgur.com,zk8km,"So I went to finally get ""Wind"" today and also bought another book (Mistborn: The Alloy of Law is the english title), only now I realize why I grabbed it.",56,6,6,http://www.reddit.com/r/TheDarkTower/comments/zk8km/so_i_went_to_finally_get_wind_today_and_also/,,,False,,t5_2run7,False,,unfound,False,t3_zk8km,http://i.imgur.com/NL5RJ.jpg,
1344293978.0,46,i.imgur.com,xsif8,Eld tattoo,55,9,10,http://www.reddit.com/r/TheDarkTower/comments/xsif8/eld_tattoo/,,,False,,t5_2run7,False,,white,False,t3_xsif8,"http://i.imgur.com/WZ6aC.jpg"" alt="""" title=""Hosted by imgur.com"" /&gt;",
1339304286.0,48,i.imgur.com,uu7ua,"I was at a concert when the Video Jockey flashed this on the screen, not even the band noticed.",52,4,9,http://www.reddit.com/r/TheDarkTower/comments/uu7ua/i_was_at_a_concert_when_the_video_jockey_flashed/,,,False,,t5_2run7,False,,unfound,False,t3_uu7ua,http://i.imgur.com/HpbFV.jpg,
1338921939.0,45,imgur.com,umhla,Fun Taheen-ish art at local tea shop.,50,5,2,http://www.reddit.com/r/TheDarkTower/comments/umhla/fun_taheenish_art_at_local_tea_shop/,,,False,,t5_2run7,False,,eye,False,t3_umhla,http://imgur.com/XpXVg,
1332776169.0,44,amazon.com,reayn,"I know there's no ""true"" way to read the series, but as a new Stephen King fan, I find this a good way to enjoy his best works.",55,11,17,http://www.reddit.com/r/TheDarkTower/comments/reayn/i_know_theres_no_true_way_to_read_the_series_but/,,,False,,t5_2run7,False,,,False,t3_reayn,http://www.amazon.com/Dark-Tower-True-Order-according/lm/R10YBYAJZD1OGQ,
1331855178.0,45,imgur.com,qykm4,Opened a signed limited edition of The Wind Through the Keyhole yesterday (1 of 800) (x-post from /r/stephenking/),47,2,21,http://www.reddit.com/r/TheDarkTower/comments/qykm4/opened_a_signed_limited_edition_of_the_wind/,,,False,,t5_2run7,False,,,False,t3_qykm4,http://imgur.com/a/v1VEa,
1325910383.0,45,i.imgur.com,o6dq7,Map of the Barony of New Canaan,51,6,5,http://www.reddit.com/r/TheDarkTower/comments/o6dq7/map_of_the_barony_of_new_canaan/,,,False,,t5_2run7,False,,rose,False,t3_o6dq7,http://i.imgur.com/Wy1SG.jpg,
1313988583.0,44,i.imgur.com,jqac6,Bought this for $1 at the library book sale,49,5,11,http://www.reddit.com/r/TheDarkTower/comments/jqac6/bought_this_for_1_at_the_library_book_sale/,,,False,,t5_2run7,False,,,False,t3_jqac6,http://i.imgur.com/mvWk8.jpg,
1375660846.0,43,i.imgur.com,1jpiiw,"My Dark Tower by Rachel Jones at Wookies Tattoo in Mannsville, OK",61,18,14,http://www.reddit.com/r/TheDarkTower/comments/1jpiiw/my_dark_tower_by_rachel_jones_at_wookies_tattoo/,,,False,,t5_2run7,False,,,False,t3_1jpiiw,http://i.imgur.com/3873JMk.jpg,
1372238171.0,46,self.TheDarkTower,1h3jsg,A thought about a DT movie adaptation. [SPOILERS],54,8,41,http://www.reddit.com/r/TheDarkTower/comments/1h3jsg/a_thought_about_a_dt_movie_adaptation_spoilers/,"SPOILER ALERT

If the DT movie ever gets made, how would you feel about it starting with Roland in possesion of the Horn of Eld like at the end of DT7? I imagine the movies being a continuation of the books instead of an adaptation; assuming Stephen King has a hand in re-writing the ending with Roland arriving at the tower with the horn, would this excite or infuriate you constant readers? I, for one, would love to see what happens at the tower when Roland shows up blasting the shit out of that horn! LDAPN
 
*EDIT*

 So I was just going through some dt reddits and saw that /u/Obsessyywi mentions pretty much exactly what I said 10 days ago [here](http://obsessiveviewer.com/2013/06/19/ka-is-a-wheel-how-i-would-adapt-the-dark-tower/) Sorry pal, I wasnt trying to rip you off, I guess brilliant minds just think alike XD",!!Spoilers!!,False,,t5_2run7,1372965007.0,spoiler,,True,t3_1h3jsg,http://www.reddit.com/r/TheDarkTower/comments/1h3jsg/a_thought_about_a_dt_movie_adaptation_spoilers/,
1366444625.0,44,self.TheDarkTower,1cqcs6,The most impressive thing about the awesome Wizard and Glass...,56,12,8,http://www.reddit.com/r/TheDarkTower/comments/1cqcs6/the_most_impressive_thing_about_the_awesome/,It made the color pink creepy as fuck.,,False,,t5_2run7,False,,,True,t3_1cqcs6,http://www.reddit.com/r/TheDarkTower/comments/1cqcs6/the_most_impressive_thing_about_the_awesome/,
1345566804.0,46,slashfilm.com,yl4xv,"Media Rights Capital to finance The Dark Tower, one of the key players there is a big Stephen King Fan. ",48,2,7,http://www.reddit.com/r/TheDarkTower/comments/yl4xv/media_rights_capital_to_finance_the_dark_tower/,,,False,,t5_2run7,False,,,False,t3_yl4xv,http://www.slashfilm.com/media-rights-capital-is-ready-to-finance-the-dark-tower/,
1344798269.0,45,self.TheDarkTower,y3qxt,What is your favorite quote from the DT series?,58,13,98,http://www.reddit.com/r/TheDarkTower/comments/y3qxt/what_is_your_favorite_quote_from_the_dt_series/,"For me, it's either ""First come smiles, then comes lies. Last is gunfire"" or ""To us, everything is dangerous, but what of it? Have we not been made to live forever?"" ",,False,,t5_2run7,False,,,True,t3_y3qxt,http://www.reddit.com/r/TheDarkTower/comments/y3qxt/what_is_your_favorite_quote_from_the_dt_series/,
1336583637.0,43,self.TheDarkTower,teydk,Gilead in the News,53,10,6,http://www.reddit.com/r/TheDarkTower/comments/teydk/gilead_in_the_news/,"In big news story today, the [FDA has announced](http://www.msnbc.msn.com/id/47345265/ns/health-aids/#.T6pZ0VKQm7A) that there may be an effective HIV vaccine.  The developer is [Gilead Sciences](http://www.gilead.com/).

Perhaps a subsidiary of the Tet Corporation?",,False,,t5_2run7,False,,,True,t3_teydk,http://www.reddit.com/r/TheDarkTower/comments/teydk/gilead_in_the_news/,
1335467758.0,48,imgur.com,su00i,The tattoo is finally complete! ,59,11,2,http://www.reddit.com/r/TheDarkTower/comments/su00i/the_tattoo_is_finally_complete/,,,False,,t5_2run7,False,,,False,t3_su00i,http://imgur.com/ejOv6,
1335396961.0,44,i.imgur.com,ssmrb,"Curses! My Kindle broke this morning, aye. But there will be water if Ka wills it...",53,9,8,http://www.reddit.com/r/TheDarkTower/comments/ssmrb/curses_my_kindle_broke_this_morning_aye_but_there/,,,False,,t5_2run7,False,,eye,False,t3_ssmrb,http://i.imgur.com/PRIDU.jpg,
1333678164.0,46,i.imgur.com,rvnaj,Joe Anderson. His acting shouts Eddie Dean to me.,52,6,16,http://www.reddit.com/r/TheDarkTower/comments/rvnaj/joe_anderson_his_acting_shouts_eddie_dean_to_me/,,,False,,t5_2run7,False,,white,False,t3_rvnaj,http://i.imgur.com/fzjpE.jpg,
1333044967.0,45,self.TheDarkTower,rjkwi,"The Dark Tower series kind of changed my life... How about you?
 P.s.- My logo is also my tattoo :D",47,2,20,http://www.reddit.com/r/TheDarkTower/comments/rjkwi/the_dark_tower_series_kind_of_changed_my_life_how/,"There were so many coincidences while I read the series that I started to get a bit creeped out. Essentially, it helped me look at life in a completely different way; I never believe in coincidences anymore.

I embrace Ka. So, I figured it is only fitting that I get the ""Ka"" insignia from the 7th book tattooed as a constant reminder for myself. It is the same as my username logo.

Anyone else have interesting Dark Tower stories/occurances? ",,False,,t5_2run7,False,,ka,True,t3_rjkwi,http://www.reddit.com/r/TheDarkTower/comments/rjkwi/the_dark_tower_series_kind_of_changed_my_life_how/,
1331007804.0,45,i.imgur.com,qjoly,Subsidiary of the Tet Corporation? (comparison in comments),50,5,9,http://www.reddit.com/r/TheDarkTower/comments/qjoly/subsidiary_of_the_tet_corporation_comparison_in/,,,False,,t5_2run7,False,,,False,t3_qjoly,http://i.imgur.com/d1ARS.png,
1327229731.0,45,motherfalcon.bigcartel.com,orcyh,Just ordered one of these,53,8,9,http://www.reddit.com/r/TheDarkTower/comments/orcyh/just_ordered_one_of_these/,,,False,,t5_2run7,False,,ka,False,t3_orcyh,http://motherfalcon.bigcartel.com/product/ka-tet,
1369070616.0,45,self.TheDarkTower,1epdru,Damon Lindelof discusses his experience with The Dark Tower adaptation,51,6,19,http://www.reddit.com/r/TheDarkTower/comments/1epdru/damon_lindelof_discusses_his_experience_with_the/,"**You're not doing Star Wars. You were potentially going to work on the adaptation of Stephen King's Dark Tower series, but now you're not. I imagine at one point these would have been lifelong-dream projects for you. Maybe I'm reading too much into this, but are you feeling burned out on being this fixer and caretaker of preexisting properties? Are you looking to do something brand-new?**

Yes, very much so, but also, you know, when the phone rings or those dream opportunities sort of present themselves, it's really difficult to say no. I think there's a part of all of us — writers or directors or fanboys or whatnot — that, when you went into those worlds, imagined what you would do with it. And when somebody calls you and says, ""I'm going to give you the opportunity to manifest that, to make it real,"" you just say yes. That's what happened with Dark Tower. Entertainment Weekly brokered this little summit between us — J.J. and I, and Carlton — and Steve King. I'm just going to refer to him as Steve King, as if we are, like, best pals.

**Sure. Steve-arino.**

Steve. You know, Uncle Stevie, my buddy. We went to Bangor and spent this amazing, like, nine-hour period with him, the result of which afterward was that J.J. and Stephen started exchanging e-mails, and J.J. ended up optioning The Dark Tower series for 19 bucks — I was like, ""Oh, that's clever,"" because 19's a recurring number in The Dark Tower, and J.J.'s like, ""What?"" So J.J. and I had several conversations over the course of maybe a year or a year and a half. But once we actually started having those conversations, I just became filled with, like, ""Oh my god, I'm going to screw up this thing that I love. It's so hard to do it exactly right, and I'm just going to say that I'm too busy on Lost.""

Also, you've seen, like, amazingly talented filmmakers really struggling with those books. Is it a movie? Is it a TV series? Is it both? How do you work the time-travel elements of it? There's a boy, Jake, in the series, who becomes this pivotal sort of time-traveling lynchpin [throughout the books], and therefore you either have to have a 12-year-old who doesn't age, you know, or shoot, like, 50 hours of material while the kid is 11 to 13 — and since you can't do that, you either say, ""We're doing it as an animated thing, or we have to throw out that entire plot point of Jake.""

**It's the Walt problem on a massive scale.**

Yes. Oh my god. And the pivotal emotional moment in The Gunslinger, which is the first book, is Roland decides to let Jake die so that he can continue to go after the Man in Black, and then you revisit that moment like, five times over. Like, I ran into Akiva Goldsman, who was adapting it, and I was like, ""What are you going to do about Jake?"" And he was like, ""We've got a plan."" If I'd taken on The Dark Tower I would've become Russell Crowe in A Beautiful Mind. It would've happened very, very quickly.

[Grantland](http://www.grantland.com/story/_/id/9293739/page/2/a-not-brief-conversation-damon-lindelof-writer-lost-prometheus-star-trek-darkness)",,False,,t5_2run7,False,,,True,t3_1epdru,http://www.reddit.com/r/TheDarkTower/comments/1epdru/damon_lindelof_discusses_his_experience_with_the/,
1368720378.0,42,deadline.com,1egh15,"Imagine Entertainment may have secured financing for the movie/television series, starring Russel Crowe",55,13,27,http://www.reddit.com/r/TheDarkTower/comments/1egh15/imagine_entertainment_may_have_secured_financing/,,,False,,t5_2run7,False,,19,False,t3_1egh15,http://www.deadline.com/2013/05/cannes-brian-grazer-ron-howard-introduce-imagine-2-0-a-pele-pic-on-the-croisette-a-crowd-funded-friday-night-lights-dark-tower-jay-z-and-one-angry-white-whale/,
1366270151.0,45,i.imgur.com,1cle4g,I was stuck behind the creator in traffic,65,20,3,http://www.reddit.com/r/TheDarkTower/comments/1cle4g/i_was_stuck_behind_the_creator_in_traffic/,,,False,,t5_2run7,False,,,False,t3_1cle4g,http://i.imgur.com/bjJ4s7w.jpg,
1338843504.0,44,hbowatch.com,uku7w,I didn't notice this until today. HBO has an official page for The Dark Tower series that is going to be made. Makes it feel so official!,53,9,34,http://www.reddit.com/r/TheDarkTower/comments/uku7w/i_didnt_notice_this_until_today_hbo_has_an/,,,False,,t5_2run7,False,,,False,t3_uku7w,http://hbowatch.com/category/dark-tower/,
1332673085.0,47,shelf-life.ew.com,rckhp,Stephen King reads a chapter from his upcoming eighth novel 'The Dark Tower: The Wind through the Keyhole',47,0,3,http://www.reddit.com/r/TheDarkTower/comments/rckhp/stephen_king_reads_a_chapter_from_his_upcoming/,,,False,,t5_2run7,False,,rose,False,t3_rckhp,http://shelf-life.ew.com/2012/03/23/listen-to-stephen-king-read-from-the-dark-tower-the-wind-through-the-keyhole-exclusive-audio/,
1373251494.0,43,imgur.com,1hu81t,"I crafted this metalwork box, I thought i'd share with all of you [More pictures in comments]",48,5,5,http://www.reddit.com/r/TheDarkTower/comments/1hu81t/i_crafted_this_metalwork_box_i_thought_id_share/,,,False,,t5_2run7,False,,eye,False,t3_1hu81t,http://imgur.com/LIErlV9,
1372790072.0,43,i.imgur.com,1hihaz,Last night I downloaded the Bioshock Infinite soundtrack. I was going through and changing the file names when I stumbled upon this act of ka,63,20,12,http://www.reddit.com/r/TheDarkTower/comments/1hihaz/last_night_i_downloaded_the_bioshock_infinite/,,,False,,t5_2run7,False,,,False,t3_1hihaz,http://i.imgur.com/qcgxgG3.png,
1367451548.0,39,i.imgur.com,1dikxl,The Beam across Topeka today. [x-post from /r/funny],49,10,6,http://www.reddit.com/r/TheDarkTower/comments/1dikxl/the_beam_across_topeka_today_xpost_from_rfunny/,,,False,,t5_2run7,False,,,False,t3_1dikxl,http://i.imgur.com/fDprMZv.jpg,
1355897188.0,45,self.TheDarkTower,153h1w,What is your Dark Tower?,52,7,16,http://www.reddit.com/r/TheDarkTower/comments/153h1w/what_is_your_dark_tower/,"I've read through the series multiple times and each time I'm touched by the themes and statements on addiction and obsession. Eddie's heroin addiction, and Roland's obsession with The Tower being two of the more obvious metaphors. 

So, my katet, what is your addiction, obsession, Dark Tower?

Let's say I had more in common with our eminent junkie, Eddie Dean, than I would like to admit in polite company. And his trials were part of my recovery, I'm happy to say!",,False,,t5_2run7,False,,eye,True,t3_153h1w,http://www.reddit.com/r/TheDarkTower/comments/153h1w/what_is_your_dark_tower/,
1354994669.0,41,self.TheDarkTower,14ic7s,"Out of all the quotes from the series, and there are some great ones, this is my absolute favorite (Spoilers)",44,3,5,http://www.reddit.com/r/TheDarkTower/comments/14ic7s/out_of_all_the_quotes_from_the_series_and_there/,"“And will I tell you that these three lived happily ever after? I will not, for no one ever does. But there was happiness. And they did live.”

Serious frisson goosebumps.",,False,,t5_2run7,False,,eye,True,t3_14ic7s,http://www.reddit.com/r/TheDarkTower/comments/14ic7s/out_of_all_the_quotes_from_the_series_and_there/,
1354931302.0,42,i.imgur.com,14h6sv,tattoo outline,44,2,3,http://www.reddit.com/r/TheDarkTower/comments/14h6sv/tattoo_outline/,,,False,,t5_2run7,False,,pistol,False,t3_14h6sv,http://i.imgur.com/Sm15S.jpg,
1348479886.0,43,self.TheDarkTower,10dwd7,The Future of the Dark Tower,57,14,52,http://www.reddit.com/r/TheDarkTower/comments/10dwd7/the_future_of_the_dark_tower/,"Where do see the future of the Dark Tower series going, if additional novels are written? 
&gt; ""It's not really done yet. Those seven books are really sections of one long über-novel.""

For me I would die for a (purposeful) retelling of the original 7 books but with severe changes due to Roland having the Horn of Eld including:

* Exploring the ""New"" Gunslingers created by the Tet Corporation.
* Flagg/Crimson King/Mordred being more villainous/imposing. 
* Most importantly, a clear chain of events that can be traced back to having the Horn of Eld that results in a serious change, like Jake or Eddie surviving and entering the Tower with Roland (although waiting for him outside makes more sense).

A retelling of the 7 books also fits in nicely with the themes presented in the Dark Tower series; Ka, Wheels, Journey &gt; Destination, ect. ",!!Spoilers!!,False,,t5_2run7,False,red,19,True,t3_10dwd7,http://www.reddit.com/r/TheDarkTower/comments/10dwd7/the_future_of_the_dark_tower/,
1347493755.0,43,cultspark.com,zsl7w,"A guy writes how he would adapt ""The Dark Tower"" series into four films. ",55,12,22,http://www.reddit.com/r/TheDarkTower/comments/zsl7w/a_guy_writes_how_he_would_adapt_the_dark_tower/,,,False,,t5_2run7,False,,,False,t3_zsl7w,http://cultspark.com/2012/09/11/the-best-plan-for-filming-the-dark-tower/,
1344390354.0,43,youtube.com,xuuym,Someone Saved My Life Tonight - Elton John ,47,4,4,http://www.reddit.com/r/TheDarkTower/comments/xuuym/someone_saved_my_life_tonight_elton_john/,,,False,,t5_2run7,False,,unfound,False,t3_xuuym,http://www.youtube.com/watch?v=Sw2Lptf7K0E,
1341285304.0,45,self.TheDarkTower,vykos,I can finally subscribe...,50,5,16,http://www.reddit.com/r/TheDarkTower/comments/vykos/i_can_finally_subscribe/,"I felt I needed to finish the series before I could join the ka-tet.  

The main emotion I feel is to Stephen King himself and it goes as follows:

WRITE MORE. please...",,False,,t5_2run7,1341285782.0,,,True,t3_vykos,http://www.reddit.com/r/TheDarkTower/comments/vykos/i_can_finally_subscribe/,
1328707736.0,40,self.TheDarkTower,pg79i,I know there are a lot of folken here who'd not see the movies made. How many of us are there who WOULD want to see them come to fruition?,50,10,43,http://www.reddit.com/r/TheDarkTower/comments/pg79i/i_know_there_are_a_lot_of_folken_here_whod_not/,"The reasoning many people have for not wanting them made is that they *might* be bad. I'm not too worried about that. What if they're awesome?! That's just as likely.....Even if they do end up sucking, it'll still be entertaining and takes absolutely nothing away from the novels.

So ya, I say give it a shot Ron.",,False,,t5_2run7,False,,eye,True,t3_pg79i,http://www.reddit.com/r/TheDarkTower/comments/pg79i/i_know_there_are_a_lot_of_folken_here_whod_not/,
1367324343.0,42,self.TheDarkTower,1demot,Just started by first re-read. Mind is being blown.,49,7,18,http://www.reddit.com/r/TheDarkTower/comments/1demot/just_started_by_first_reread_mind_is_being_blown/,Just started re-listening (audiobook) to The Gunslinger. I recently found out that King revised the first Dark Tower book in 2003. This was a great idea! Little references to details in later book are like nuggets of awesomeness. This series in totally meant to be re-read. ,,False,,t5_2run7,False,,,True,t3_1demot,http://www.reddit.com/r/TheDarkTower/comments/1demot/just_started_by_first_reread_mind_is_being_blown/,
1366905421.0,38,imgur.com,1d381c,Had this wallpaper cycling for a few years. Just realized what it reminds me of.,78,40,7,http://www.reddit.com/r/TheDarkTower/comments/1d381c/had_this_wallpaper_cycling_for_a_few_years_just/,,,False,,t5_2run7,False,,,False,t3_1d381c,http://imgur.com/nvSFDqV,
1346509032.0,43,gabeleonard.com,z6n8a,Saw this artist at a local art fair a few years ago. He's never read The Dark Tower series (but he's heard of it from people who enjoy his work). ,44,1,2,http://www.reddit.com/r/TheDarkTower/comments/z6n8a/saw_this_artist_at_a_local_art_fair_a_few_years/,,,False,,t5_2run7,False,,unfound,False,t3_z6n8a,http://www.gabeleonard.com/original-art/original-oils/i-dont-shake-hands#,
1343210977.0,44,self.TheDarkTower,x4iac,"It is 6am here, and I just finished Roland's journey for the second time.",49,5,5,http://www.reddit.com/r/TheDarkTower/comments/x4iac/it_is_6am_here_and_i_just_finished_rolands/,"I stayed up all night reading, and wept just like the first time I finished the series years ago. I was worried that the story wouldn't be as powerful the second time through, but it stood true and I say thank ya.",,False,,t5_2run7,False,,eye,True,t3_x4iac,http://www.reddit.com/r/TheDarkTower/comments/x4iac/it_is_6am_here_and_i_just_finished_rolands/,
1340677412.0,44,i.imgur.com,vlvt7,Many other functions...,47,3,7,http://www.reddit.com/r/TheDarkTower/comments/vlvt7/many_other_functions/,,,False,,t5_2run7,False,,eye,False,t3_vlvt7,http://i.imgur.com/7JcKu.jpg,
1339590739.0,43,imgur.com,uzpql,Birthday Present! Now I'll never forget the face of my father,46,3,4,http://www.reddit.com/r/TheDarkTower/comments/uzpql/birthday_present_now_ill_never_forget_the_face_of/,,,False,,t5_2run7,False,,ka,False,t3_uzpql,http://imgur.com/oxbuZ,
1339479701.0,45,imgur.com,uxibg,"Found in Full Dark, No Stars",52,7,7,http://www.reddit.com/r/TheDarkTower/comments/uxibg/found_in_full_dark_no_stars/,,,False,,t5_2run7,False,,,False,t3_uxibg,http://imgur.com/ihnx6,
1374108391.0,41,imgur.com,1iiy2t,I built the Dark Tower in Minecraft [spoilers if you haven't reached the Tower],51,10,10,http://www.reddit.com/r/TheDarkTower/comments/1iiy2t/i_built_the_dark_tower_in_minecraft_spoilers_if/,,,False,,t5_2run7,False,,pistol,False,t3_1iiy2t,http://imgur.com/a/BeXtW#0,
1372355216.0,44,i.imgur.com,1h6wmq,Saw this on /r/funny today,51,7,11,http://www.reddit.com/r/TheDarkTower/comments/1h6wmq/saw_this_on_rfunny_today/,,,False,,t5_2run7,False,,ka,False,t3_1h6wmq,http://i.imgur.com/uX2IyU2.jpg?1,
