created_utc,score,domain,id,title,ups,downs,num_comments,permalink,selftext,link_flair_text,over_18,thumbnail,subreddit_id,edited,link_flair_css_class,author_flair_css_class,is_self,name,url,distinguished
1348813825.0,19,self.TheDarkTower,10lweg,Go slowly past the drawers...,26,7,10,http://www.reddit.com/r/TheDarkTower/comments/10lweg/go_slowly_past_the_drawers/,"Ok, so the gun slinger is warned multiple times this statement.. Go slow passed the drawers. It is later revealed that the wastelands are the drawers, and yet, Roland and his ka-tet take Blaine the Mono, and pass it by at up to 900 miles/hour.. While Ka and all of Jakes signs pointed to Blaine as being the old option, was it really the one they were intended to take, even if another option was much slower?",,False,,t5_2run7,False,,,True,t3_10lweg,http://www.reddit.com/r/TheDarkTower/comments/10lweg/go_slowly_past_the_drawers/,
1346393428.0,19,theyetee.com,z4fza,"""Come Come Commala"", another Dark Tower tee I designed, is available for $11 today only!  :)  ",21,2,9,http://www.reddit.com/r/TheDarkTower/comments/z4fza/come_come_commala_another_dark_tower_tee_i/,,,False,,t5_2run7,False,,rose,False,t3_z4fza,http://theyetee.com/,
1345427245.0,17,self.TheDarkTower,yi171,Question about geography from the Drawing of the Three,20,3,16,http://www.reddit.com/r/TheDarkTower/comments/yi171/question_about_geography_from_the_drawing_of_the/,"Ok, so I'm gonna list the things as I understand them first:
The sea they are walking along is the Western Sea. Roland is headed north.
Assuming those two things are right, the sea should be to Roland's left hand side as he walks north, right?
What confuses me is that it is mentioned multiple times that the east is to Roland's left side and the sea stretches out to his right. So he should be headed south, even though it is also said that he is still headed north.
Is it supposed to be this way since the world has ""moved on""? Or what's up with this?",,False,,t5_2run7,False,,,True,t3_yi171,http://www.reddit.com/r/TheDarkTower/comments/yi171/question_about_geography_from_the_drawing_of_the/,
1343720087.0,19,self.TheDarkTower,xftm9,Wow...,23,4,26,http://www.reddit.com/r/TheDarkTower/comments/xftm9/wow/,"I started reading The Gunslinger 4 years ago. Now I am 15, and I just finished The Dark Tower. I am speechless. The way that Stephen King connects everything is just amazing. Everything is somehow connected. Like the points on a circle. Ka, after all, is a wheel.

His detailed writing gave me such a vivid image of Roland and his ka-tet, and everything they encounter. This is going to sound corny but it was like I was right there with them, on their journey to the Dark Tower.

I just wanted to say that this will probably be the greatest book series I will read in my life, and to Stephen King, I say thankya.",,False,,t5_2run7,False,,ka,True,t3_xftm9,http://www.reddit.com/r/TheDarkTower/comments/xftm9/wow/,
1339887108.0,19,self.TheDarkTower,v5mmq,Have any of you guys watched the Justified series?,23,4,24,http://www.reddit.com/r/TheDarkTower/comments/v5mmq/have_any_of_you_guys_watched_the_justified_series/,"The main character has some similarities to the last gunslinger.
First off, he's a badass gunslinger himself. The cowboy hat is the same one I imagine Roland using if he was from this world. Their personalities have some things in common, excluding the silly sense of humor of Roland's.
Despite of that, his name is **Raylan**. Marshal Raylan Givens is how they call him. Yes, 19.
Maybe the producers of the series are fans of the Tower aswell. Or perhaps ka is working.

(*sorry about the english, not my native language*)",,False,,t5_2run7,False,,,True,t3_v5mmq,http://www.reddit.com/r/TheDarkTower/comments/v5mmq/have_any_of_you_guys_watched_the_justified_series/,
1339165060.0,18,self.TheDarkTower,url6d,Thoughts about the dark tower VII? Potential spoilers,25,7,21,http://www.reddit.com/r/TheDarkTower/comments/url6d/thoughts_about_the_dark_tower_vii_potential/,Was wondering what everyone thought about the last book? I want to go ahead and read Wind Through the Keyhole but I feel as if anything added on would kind of mess things up for me. Now that I know Rolands whole story and the ending I am thinking what more point is there?,,False,,t5_2run7,False,,,True,t3_url6d,http://www.reddit.com/r/TheDarkTower/comments/url6d/thoughts_about_the_dark_tower_vii_potential/,
1338828310.0,18,i.imgur.com,ukf1u,I instantly imagined this as one if the creatures from the canyon the pass over while on Blaine. (x-post from r/creepy),19,1,9,http://www.reddit.com/r/TheDarkTower/comments/ukf1u/i_instantly_imagined_this_as_one_if_the_creatures/,,,False,,t5_2run7,False,,,False,t3_ukf1u,http://i.imgur.com/JHNwj.jpg,
1333715711.0,19,yourfavoriteweb.com,rw6jv,I think Mike had a good Christmas.,22,3,1,http://www.reddit.com/r/TheDarkTower/comments/rw6jv/i_think_mike_had_a_good_christmas/,,,False,,t5_2run7,False,,pistol,False,t3_rw6jv,http://yourfavoriteweb.com/tower.htm,
1331556509.0,19,self.TheDarkTower,qsu85,An excerpt from The Book of Lost Things by John Connolly. ,21,2,7,http://www.reddit.com/r/TheDarkTower/comments/qsu85/an_excerpt_from_the_book_of_lost_things_by_john/,"David’s book of Greek myths, meanwhile, was the same size and color as a collection of poetry nearby, and he would sometimes pull out the poems instead of the myths. Some of the poems weren’t too bad, once he gave them a chance. One was about a kind of knight—except in the poem he was called a “Childe”—and his search for a dark tower and whatever secret it contained. The poem didn’t really seem to end properly, though. The knight reached the tower and, well, that was it. David wanted to know what was in the tower, and what happened to the knight now that he’d reached it, but the poet obviously didn’t think that was important. It made David wonder about the kinds of people who wrote poems. Anyone could see that the poem was really only getting interesting when the knight reached the tower, but that was the point at which the poet decided to go off and write something else instead. Perhaps he had meant to come back to it and had simply forgotten, or maybe he couldn’t come up with a monster for the tower that was impressive enough. David had a vision of the poet, surrounded by bits of paper with lots of ideas for creatures crossed out or scribbled over

~~Werewolf.~~

~~Dragon.~~

~~Really big dragon.~~

~~Witch.~~

~~Really big witch.~~

~~Small witch.~~

David tried to give a form to the beast at the heart of the poem but found that he could not. It was more difficult than it appeared, for nothing quite seemed to fit. Instead, he could only conjure up a half-formed being that crouched in the cobwebbed corners of his imagination where all the things that he feared curled and slithered upon one another in the darkness.",,False,,t5_2run7,False,,19,True,t3_qsu85,http://www.reddit.com/r/TheDarkTower/comments/qsu85/an_excerpt_from_the_book_of_lost_things_by_john/,
1331083238.0,20,reddit.com,ql077,"Going through random subreddits, I found this. Creeped me out and made me think of the Taheen. (x-post from r/bridswitharms)",24,4,0,http://www.reddit.com/r/TheDarkTower/comments/ql077/going_through_random_subreddits_i_found_this/,,,False,,t5_2run7,False,,,False,t3_ql077,http://www.reddit.com/r/birdswitharms/comments/qikd4/hi_there_pretty_lady/,
1329711074.0,19,i.imgur.com,pxbyc,My girlfriend made this picture of Roland after reading Wizard and Glass.,34,15,2,http://www.reddit.com/r/TheDarkTower/comments/pxbyc/my_girlfriend_made_this_picture_of_roland_after/,,,False,,t5_2run7,False,,,False,t3_pxbyc,http://i.imgur.com/MAEZz.jpg,
1329595686.0,18,self.TheDarkTower,pvk7v,Wizard and Glass (Spoiler Alert),28,10,50,http://www.reddit.com/r/TheDarkTower/comments/pvk7v/wizard_and_glass_spoiler_alert/,"Hey guys! So, I'm a bit late on the series, but I've just finished the 

4th installment. WOW. So far, W&amp;G is my favorite. I loove the tale of 

young Roland (and his rise to a Gunslinger)! I've also grown attached 

to Cuthbert and Alain. Being from Kansas i was digging the references 

too. The series has yet again, exceeded my expectations. I'm about 

to start Wolves of the Calla now, wish me luck! :P Also, what's 

everyone's favorite book out of the series?",,False,,t5_2run7,False,,white,True,t3_pvk7v,http://www.reddit.com/r/TheDarkTower/comments/pvk7v/wizard_and_glass_spoiler_alert/,
1329528957.0,19,imgur.com,pup44,"Sorry guys, no upvotes for you today",30,11,2,http://www.reddit.com/r/TheDarkTower/comments/pup44/sorry_guys_no_upvotes_for_you_today/,,,False,,t5_2run7,False,,ka,False,t3_pup44,http://imgur.com/gIYAb,
1327719644.0,17,self.TheDarkTower,p01jg,Carrie's power as a breaker.,20,3,9,http://www.reddit.com/r/TheDarkTower/comments/p01jg/carries_power_as_a_breaker/,I've always wondered even though it is not said directly that Carrie is a breaker she shows all the signs of it. But how strong is she compared to other breakers? Is she one of the strongest or is she average? I've always thought she is one of the stronger ones. In Firestarter Charlie is considered one of the strongest that the shop has ever seen. But she can only start fires. While Carrie can not only start fires but also move things and has a high level of Telekinesis. ,,False,,t5_2run7,False,,rose,True,t3_p01jg,http://www.reddit.com/r/TheDarkTower/comments/p01jg/carries_power_as_a_breaker/,
1326070708.0,20,self.TheDarkTower,o8lws,I have never yelled harder while reading a book... (11/22/63 Spoilers),22,2,11,http://www.reddit.com/r/TheDarkTower/comments/o8lws/i_have_never_yelled_harder_while_reading_a_book/,"Then when Jake came back to the present after saving Kennedy. Maine... diseases everywhere... King explained the alternate universe that Roland and his band wound up in briefly. As soon as I saw the words ""Takuro Spirit"" it all clicked. Anyways just had to get that off my chest.",,False,,t5_2run7,False,,19,True,t3_o8lws,http://www.reddit.com/r/TheDarkTower/comments/o8lws/i_have_never_yelled_harder_while_reading_a_book/,
1319285625.0,20,i.imgur.com,lky07,Quick draft for a half-sleeve tower tattoo.,25,5,16,http://www.reddit.com/r/TheDarkTower/comments/lky07/quick_draft_for_a_halfsleeve_tower_tattoo/,,,False,,t5_2run7,False,,,False,t3_lky07,http://i.imgur.com/5Om0W.jpg,
1316172691.0,20,imgur.com,khjcc,Thank you for inspiring me to do something... (x-post from r/terraria),22,2,6,http://www.reddit.com/r/TheDarkTower/comments/khjcc/thank_you_for_inspiring_me_to_do_something_xpost/,,,False,,t5_2run7,False,,ka,False,t3_khjcc,http://imgur.com/mg6rl,
1316089276.0,20,self.TheDarkTower,kgfs6,How much time does the Dark Tower series cover? (spoilers),21,1,18,http://www.reddit.com/r/TheDarkTower/comments/kgfs6/how_much_time_does_the_dark_tower_series_cover/,"By which I mean, how much time passes between Roland chasing Walter across the desert and the tower ascent that closes the series? Has anyone worked it out, or are there too many gaps?

* The ka-tet spend at least a month, if I recall correctly, camping and training near Shardik's woods before moving on.    
* *Wizard and Glass* seems to last no more than a week.   
* *Wolves of the Calla* lasts 30 days, that much is clear.    
* *Song of Susannah* takes place over one day.   
* Roland and Susannah spend 50 days minimum crossing the Badlands and White Lands of Empathica, and another week heading down Tower Road.

So does the entire series take place over less than six months?",,False,,t5_2run7,False,,,True,t3_kgfs6,http://www.reddit.com/r/TheDarkTower/comments/kgfs6/how_much_time_does_the_dark_tower_series_cover/,
1316037780.0,18,reddit.com,kftpk,"Hey guys, am I doing this right? ",31,13,2,http://www.reddit.com/r/TheDarkTower/comments/kftpk/hey_guys_am_i_doing_this_right/,,,False,,t5_2run7,False,,,False,t3_kftpk,http://www.reddit.com/r/nosleep/comments/kft1v/the_man_in_black/c2jwxn5,
1315947250.0,17,eric.errthum.com,kelw3,My favorite Dark Tower illustration. Also my desktop background. (Created by Michael Whelan),33,16,14,http://www.reddit.com/r/TheDarkTower/comments/kelw3/my_favorite_dark_tower_illustration_also_my/,,,False,,t5_2run7,False,,,False,t3_kelw3,http://eric.errthum.com/backgrounds/darktower/DTA.jpg,
1314047124.0,19,self.TheDarkTower,jqz2y,Am I the only gunslinger against a Dark Tower movie?,24,5,40,http://www.reddit.com/r/TheDarkTower/comments/jqz2y/am_i_the_only_gunslinger_against_a_dark_tower/,"I live, eat, and breath Stephen Kings novels and of course DT is the bible of his wonderful world but do we need to cheapen it with a movie? I'm riding the line of sounding like a sad hipster (I read it before you!etc.etc.)and a mega creepy fan(You just wouldn't get the story, man..it's, like, deep) but I cannot find it in me to support this...can't they pick another one? I just think there is too much to make a decent movie...*sigh* please be gentle with my Roland Ron Howard.",,False,,t5_2run7,False,,,True,t3_jqz2y,http://www.reddit.com/r/TheDarkTower/comments/jqz2y/am_i_the_only_gunslinger_against_a_dark_tower/,
1311951636.0,18,aintitcool.com,j398n,Aintitcool has a nice editorial about Darabont and a hypothetical DT HBO series,20,2,3,http://www.reddit.com/r/TheDarkTower/comments/j398n/aintitcool_has_a_nice_editorial_about_darabont/,,,False,,t5_2run7,False,,,False,t3_j398n,http://www.aintitcool.com/node/50598,
1305309727.0,17,self.TheDarkTower,haph1,"I've read the Dark Tower series several times, but never any of King's other stuff. Which books tie in the most to the series and would be worth a read to enrich the Dark Tower experience.",21,4,35,http://www.reddit.com/r/TheDarkTower/comments/haph1/ive_read_the_dark_tower_series_several_times_but/,What do you guys suggest?,,False,,t5_2run7,False,,,True,t3_haph1,http://www.reddit.com/r/TheDarkTower/comments/haph1/ive_read_the_dark_tower_series_several_times_but/,
1371801066.0,19,i.imgur.com,1gs7sk,"Thought I'd share a pic with you all, part of my DT tattoo sleeve. (sorry for the shoddy quality!)",29,10,9,http://www.reddit.com/r/TheDarkTower/comments/1gs7sk/thought_id_share_a_pic_with_you_all_part_of_my_dt/,,,False,,t5_2run7,False,,ka,False,t3_1gs7sk,http://i.imgur.com/se397ie.jpg,
1370902917.0,18,thereptilians.bandcamp.com,1g2rjc,"A couple of years in the works, my band finally completed our homage to the Tower. The new album from The Reptilians, ""The Breakers"".",24,6,7,http://www.reddit.com/r/TheDarkTower/comments/1g2rjc/a_couple_of_years_in_the_works_my_band_finally/,,,False,,t5_2run7,False,,,False,t3_1g2rjc,http://thereptilians.bandcamp.com/album/the-breakers,
1370143504.0,17,dictionary.reference.com,1fi1hg,Dictionary.com Word of the Day (06-01-13) took me back to Mid-World,21,4,2,http://www.reddit.com/r/TheDarkTower/comments/1fi1hg/dictionarycom_word_of_the_day_060113_took_me_back/,,,False,,t5_2run7,False,,rose,False,t3_1fi1hg,http://dictionary.reference.com/wordoftheday,
1369154031.0,17,self.TheDarkTower,1ersst,PSA: For those unaware of the Dark Tower Comics,24,7,5,http://www.reddit.com/r/TheDarkTower/comments/1ersst/psa_for_those_unaware_of_the_dark_tower_comics/,"They are absolutely amazing, you need to at least get fall of gilead / battle of jericho hill.  That is all.",,False,,t5_2run7,False,,,True,t3_1ersst,http://www.reddit.com/r/TheDarkTower/comments/1ersst/psa_for_those_unaware_of_the_dark_tower_comics/,
1369143645.0,19,generationterrorists.com,1erh16,Size encompasses Life,24,5,5,http://www.reddit.com/r/TheDarkTower/comments/1erh16/size_encompasses_life/,,,False,,t5_2run7,False,,,False,t3_1erh16,http://www.generationterrorists.com/quotes/the_dark_tower_the_gunslinger_size.shtml,
1367472854.0,18,self.TheDarkTower,1djaip,Did not realize Reddit enjoys The Dark Tower as much as it does.,19,1,15,http://www.reddit.com/r/TheDarkTower/comments/1djaip/did_not_realize_reddit_enjoys_the_dark_tower_as/,"Well, I was scrolling down the front page, and I see a post saying that HBO/Netflix might pick up on a Dark Tower series. I subconsciously assume that it was posted here, until I saw that the post had 2500+ upvotes. Turns out that post was submitted to r/movies. 
I had no clue Reddit was so enthusiastic about the series! Now I'm wondering why this subreddit doesn't have more subscribers than it does now. ",,False,,t5_2run7,False,,ka,True,t3_1djaip,http://www.reddit.com/r/TheDarkTower/comments/1djaip/did_not_realize_reddit_enjoys_the_dark_tower_as/,
1365445782.0,19,imgur.com,1bxlal,Makes me think of book 5 [x-post from r/pics],23,4,1,http://www.reddit.com/r/TheDarkTower/comments/1bxlal/makes_me_think_of_book_5_xpost_from_rpics/,,,False,,t5_2run7,False,,,False,t3_1bxlal,http://imgur.com/CIGIGca,
1363840036.0,20,i.imgur.com,1apq7k,Saw this on r/woahdude and thought of Maturin and you guys. [GIF],20,0,2,http://www.reddit.com/r/TheDarkTower/comments/1apq7k/saw_this_on_rwoahdude_and_thought_of_maturin_and/,,,False,,t5_2run7,False,,ka,False,t3_1apq7k,http://i.imgur.com/4BctM.gif,
1363727416.0,16,self.TheDarkTower,1am9na,r/TheDarkTower's Community Splicing Project. An idea I've been kicking around...,22,6,4,http://www.reddit.com/r/TheDarkTower/comments/1am9na/rthedarktowers_community_splicing_project_an_idea/,"Well, we don't know if (when) a movie/television series will get made. In the meantime, this subreddit could use a little activity, don't you think?

I've been kicking around the idea of having this subreddit splice the 7(.5) books into movies (or T.V. Series). 

The project would assign a few subscribers per book (tWTtK, as well). Their task would then be to splice the narrative in the most effective manner for film.  After all the books have been spliced, we make a crude ""storyboard"" of what /r/TheDarkTower believes to be the best adaption of the books.

Thoughts? Too Ambitious? 

Feedback welcome!

**Edit: If you would like to contribute, drop a comment!**",,False,,t5_2run7,1363749865.0,,white,True,t3_1am9na,http://www.reddit.com/r/TheDarkTower/comments/1am9na/rthedarktowers_community_splicing_project_an_idea/,
1361279863.0,18,self.TheDarkTower,18tdza,"""Nineteen"" - A Poem",20,2,3,http://www.reddit.com/r/TheDarkTower/comments/18tdza/nineteen_a_poem/,"*Nineteen*

Nineteen is the number  
I constantly perceive;  
Never relenting, never  
Easing up, always there.  
The insanity it spawns,  
Even without trying, is  
Egregious, outrageous,  
Nefarious, horrendous.  
It invades my thoughts,  
Soul, brain, mind, psyche.  
There's an omnipotence.  
Harrowing and painful.  
Eradicating all it can.  
Nothing can stop it, the  
Umbra of its existence  
Makes the sane go crazy.  
Broken and lost, trying  
Everything to expel it,  
Running from Nineteen.  ",,False,,t5_2run7,False,,,True,t3_18tdza,http://www.reddit.com/r/TheDarkTower/comments/18tdza/nineteen_a_poem/,
1360978640.0,17,imgur.com,18m5a8,"For what ever reason, This is how I pictured Lobstrosities...",31,14,7,http://www.reddit.com/r/TheDarkTower/comments/18m5a8/for_what_ever_reason_this_is_how_i_pictured/,,,False,,t5_2run7,False,,,False,t3_18m5a8,http://imgur.com/b9WEMv2,
1358967215.0,19,self.TheDarkTower,174xen,A question about SoS re: Calvin's palaver with Roland outside...,20,1,4,http://www.reddit.com/r/TheDarkTower/comments/174xen/a_question_about_sos_re_calvins_palaver_with/,"So I'm only a few chapters into DT, but it's still killing me that we don't know (yet?) what was said between Calvin Tower and Roland once they went outside following their speaking of ""foreign"" words, that led to Tower's eventual sale of the vacant lot to the Tet corporation.  If this info is forthcoming, let me know, otherwise I'd love to hear your thoughts regarding what might have been said.  Presumably there was more info in Tower's letter, but so far I can only deduce that Tower was made aware of Roland and his lineage, providing him with proof of Roland's authenticity upon their meeting in the ""future"".  God this is killing me!


EDIT:  OK, I'm hearing that this conversation comes up in DT7, so thanks anyway but I think I'm just gonna hold out.  Since I keep a copy of Robin Furth's Complete Concordance next to me as I read (in addition to a slew of DT links for reference) it's tough enough to avoid spoilers as it is!  I was just worried that this particular loose end was not going to be resolved for me.  Thanks guys!

There'll be water if god wills it!",,False,,t5_2run7,1358989223.0,,pistol,True,t3_174xen,http://www.reddit.com/r/TheDarkTower/comments/174xen/a_question_about_sos_re_calvins_palaver_with/,
1357607670.0,17,i.imgur.com,165klr,Tattoo my brother did on my arm. Thought I'd share :),32,15,2,http://www.reddit.com/r/TheDarkTower/comments/165klr/tattoo_my_brother_did_on_my_arm_thought_id_share/,,,False,,t5_2run7,False,,,False,t3_165klr,http://i.imgur.com/vVN4G.jpg,
1357246082.0,19,self.TheDarkTower,15woi4,Dark Tower turtle tattoo ideas,23,4,13,http://www.reddit.com/r/TheDarkTower/comments/15woi4/dark_tower_turtle_tattoo_ideas/,"I'm almost done with my second read-through of the series, and I've decided that I want a Dark Tower themed tattoo. Since the Turtle is such a big symbol/ presence in the books, and I already have a turtle tattoo on my left arm, I think it would be cool to have something incorporating a turtle on my other arm.  
  
I was thinking of having an anthropomorphized turtle taking the place of one of the characters from a key scene, or maybe just going with something simple like Maturin or the skoldpadda. Turtles have a deeper significance for me personally, so the inclusion of a turtle in the picture doesn't necessarily have to make perfect sense within the framework of the story. I probably won't be getting this for at least another year or two, but I figured this was the place to come for general preliminary ideas. Thanks :)",,False,,t5_2run7,False,,,True,t3_15woi4,http://www.reddit.com/r/TheDarkTower/comments/15woi4/dark_tower_turtle_tattoo_ideas/,
1356446566.0,17,i.imgur.com,15f6ah,somehow he reminds me of andy,23,6,2,http://www.reddit.com/r/TheDarkTower/comments/15f6ah/somehow_he_reminds_me_of_andy/,,,False,,t5_2run7,False,,unfound,False,t3_15f6ah,http://i.imgur.com/05L06.gif,
1355984036.0,17,self.TheDarkTower,155l6l,"Question about the end of the series (Spoilers, obviously)",20,3,37,http://www.reddit.com/r/TheDarkTower/comments/155l6l/question_about_the_end_of_the_series_spoilers/,"Okay, so [when Roland comes out of the door to the desert, all of time resets, right? Didn't he get drop/pick up horn at the Battle of Jericho Hill? So, shouldn't the time have reset to that period? I guess what I'm saying is, will time always reset to him in the desert? I understand why King did it, it is a nice writing tool. Y'know, ending with the same beginning sentence.](/spoiler)",,False,,t5_2run7,False,,eye,True,t3_155l6l,http://www.reddit.com/r/TheDarkTower/comments/155l6l/question_about_the_end_of_the_series_spoilers/,
1355887474.0,17,self.TheDarkTower,1537sb,Question about the end.  Contains Spoilers!!,22,5,16,http://www.reddit.com/r/TheDarkTower/comments/1537sb/question_about_the_end_contains_spoilers/,"So I just finished reading the series for the second time.  It was even better the second time.  I had a question about the ending though.

*****Spoilers Below*****



[When Roland walks through the door at the top of the tower he is back in the desert but this time he has the horn with him.  When he goes back to that point in time and starts the journey all over, is his age ""reset"" as well?  I would imagine that his fingers are back so I would assume his age was reset as well.  There were so many references to Roland being so old and around forever though...maybe this could be why???](/spoiler)

Thoughts?",,False,,t5_2run7,False,,,True,t3_1537sb,http://www.reddit.com/r/TheDarkTower/comments/1537sb/question_about_the_end_contains_spoilers/,
1355791455.0,19,self.TheDarkTower,150vto,The Mist and the Dark Tower (Spoilers),21,2,9,http://www.reddit.com/r/TheDarkTower/comments/150vto/the_mist_and_the_dark_tower_spoilers/,"So I just finished reading The Waste Lands after having read The Mist, and as Roland and his gang are heading out of Lud in our friend Blaine the Mono, they catch sight of the creatures in the wastelands. The whole area is covered in some sort of crazy mist, although it seems to be black or purple, but something I thought was very interesting is that one of the creatures goes by this description:

""Misshapen flying things which looked like pterodactyls cruised between these pipes on leathery wings, occasionally snapping at each other with their hooked beaks.""

Which is pretty much exactly like the pterodactyl creatures from The Mist. Pretty interesting, to me at least. :p",,False,,t5_2run7,False,,coffin,True,t3_150vto,http://www.reddit.com/r/TheDarkTower/comments/150vto/the_mist_and_the_dark_tower_spoilers/,
1354646077.0,20,gma.yahoo.com,149uhe,Anyone else think of [The Pusher?](/spoiler),29,9,7,http://www.reddit.com/r/TheDarkTower/comments/149uhe/anyone_else_think_of_the_pusherspoiler/,,,False,,t5_2run7,False,,ka,False,t3_149uhe,http://gma.yahoo.com/manhunt-nyc-subway-pusher-125824962--abc-news-topstories.html,
1354029684.0,17,reddit.com,13vjs3,Saw this /r/askreddit thread about riddles; couldn't help but think of Riddle-De-Dum!,23,6,1,http://www.reddit.com/r/TheDarkTower/comments/13vjs3/saw_this_raskreddit_thread_about_riddles_couldnt/,,,False,,t5_2run7,False,,rose,False,t3_13vjs3,http://www.reddit.com/r/AskReddit/comments/13v9l8/okay_askreddit_what_is_the_most_confusing_riddles/,
