created_utc,score,domain,id,title,ups,downs,num_comments,permalink,selftext,link_flair_text,over_18,thumbnail,subreddit_id,edited,link_flair_css_class,author_flair_css_class,is_self,name,url,distinguished
1373666857.0,28,self.TheDarkTower,1i6ls1,"""I will show you fear in a handful of dust.""",30,2,4,http://www.reddit.com/r/TheDarkTower/comments/1i6ls1/i_will_show_you_fear_in_a_handful_of_dust/,"After reading the Dark Tower I went looking for the poems that were inspiration for the series for King.

[Childe Roland To The Dark Tower Came](http://classiclit.about.com/library/bl-etexts/rbrowning/bl-rbrown-childe.htm) by Robert Browning

and

[The Waste Land](http://www.bartleby.com/201/1.html) by T.S. Eliot

My favorite lines from any poem ever are the following from The Waste Land:

*There is shadow under this red rock,
(Come in under the shadow of this red rock),	 
And I will show you something different from either	 
Your shadow at morning striding behind you	 
Or your shadow at evening rising to meet you;	 
I will show you fear in a handful of dust.*

Those lines seriously give me chills every time I read them.

Any other tangentially related works that have influenced Stephen King in his writing have a similar effect on you?

edit: Showing my age here, I used to have that text on the header for my livejournal. 
",,False,,t5_2run7,1373679088.0,,rose,True,t3_1i6ls1,http://www.reddit.com/r/TheDarkTower/comments/1i6ls1/i_will_show_you_fear_in_a_handful_of_dust/,
1372012812.0,27,self.TheDarkTower,1gx5a3,Do you guys think King would Kickstart a Dark Tower video game?,43,16,24,http://www.reddit.com/r/TheDarkTower/comments/1gx5a3/do_you_guys_think_king_would_kickstart_a_dark/,,,False,,t5_2run7,False,,,True,t3_1gx5a3,http://www.reddit.com/r/TheDarkTower/comments/1gx5a3/do_you_guys_think_king_would_kickstart_a_dark/,
1370012037.0,30,self.TheDarkTower,1fen3s,Just finished Wizard and Glass (spoilers),36,6,31,http://www.reddit.com/r/TheDarkTower/comments/1fen3s/just_finished_wizard_and_glass_spoilers/,"Just got done with Wizard and Glass. For most of it I didn't like it, wanted to get back to the main story, but towards the end it got real good. I started to see how and why it impacts the rest of the story. 

I understand [alot](http://fc02.deviantart.net/fs70/f/2010/210/1/9/Alot_by_chrispygraphics.jpg) more now that the worlds bleed together, and how Ka works. But those don't seem to explain the shoes. How did they get there and who? I'm a huge fan of all things OZ, so I was thrilled King incorporated it, but a little disappointed there wasn't more!

Tell me to shut up and keep reading if that's what it takes. ",,False,,t5_2run7,False,,19,True,t3_1fen3s,http://www.reddit.com/r/TheDarkTower/comments/1fen3s/just_finished_wizard_and_glass_spoilers/,
1367601539.0,26,imgur.com,1dmo8d,Newest Dark Tower Tattoo,70,44,10,http://www.reddit.com/r/TheDarkTower/comments/1dmo8d/newest_dark_tower_tattoo/,,,False,,t5_2run7,False,,19,False,t3_1dmo8d,http://imgur.com/UdfwQHf,
1367252652.0,25,i.imgur.com,1dcg3b,"Saw this while going for a walk at camp, and had to look up to see if the clouds were aligned",32,7,2,http://www.reddit.com/r/TheDarkTower/comments/1dcg3b/saw_this_while_going_for_a_walk_at_camp_and_had/,,,False,,t5_2run7,False,,,False,t3_1dcg3b,http://i.imgur.com/dN7Yrxj.jpg,
1364857221.0,28,self.TheDarkTower,1bgvja,"Does anyone reread the tower series as much as other ""king"" novels.",36,8,23,http://www.reddit.com/r/TheDarkTower/comments/1bgvja/does_anyone_reread_the_tower_series_as_much_as/,"I started reading the Dark Tower series a few years before book seven released. Since its ending I have reread the series at least fifteen times. I have a long drive to work, and the audiobooks are fabulous. I'm a huge Stephen King fan and have read most of his works. I reread books like ""IT"" and  "" The stand""  over and over. But nothing compares to ""The Tower"" for me.  I'm just wondering, am I the only one that sees the tower as the ultimate story?",,False,,t5_2run7,False,,,True,t3_1bgvja,http://www.reddit.com/r/TheDarkTower/comments/1bgvja/does_anyone_reread_the_tower_series_as_much_as/,
1363409640.0,27,self.TheDarkTower,1ae8tk,Are there any video interviews with Stephen King primarily concerning The Dark Tower Series?,35,8,1,http://www.reddit.com/r/TheDarkTower/comments/1ae8tk/are_there_any_video_interviews_with_stephen_king/,"I've just finished the books and I don't quite want to let the world go just yet . . . so I've been looking on the youtubes for interviews or discussions with the author about the series, but I can't seem to find what I'm looking for. Can you folks recommend any good interviews?",,False,,t5_2run7,False,,,True,t3_1ae8tk,http://www.reddit.com/r/TheDarkTower/comments/1ae8tk/are_there_any_video_interviews_with_stephen_king/,
1363290403.0,27,self.TheDarkTower,1aaxlb,"This may be a little, 19... (Spoilers?)",37,10,23,http://www.reddit.com/r/TheDarkTower/comments/1aaxlb/this_may_be_a_little_19_spoilers/,"Am I alone in thinking that The Dark tower encompasses all stories ever. Not just King's stuff but everything. Some direct examples: Harry Potter, Star Wars, Wizard of Oz. Also Jerusalem's Lot and The Stand. It just seems to me that maybe each work of fiction, may be true on another level of the tower?  I don't know it just all seems very, weird? To me it makes the books that much cooler. What do ya'll say? ",,False,,t5_2run7,False,,rose,True,t3_1aaxlb,http://www.reddit.com/r/TheDarkTower/comments/1aaxlb/this_may_be_a_little_19_spoilers/,
1356735287.0,27,self.TheDarkTower,15lglo,I'm here! Where next? ,30,3,28,http://www.reddit.com/r/TheDarkTower/comments/15lglo/im_here_where_next/,"The purpose of this post is to A) Nerd out that I just finished the series (and no RL friends have read it so I'm OVERJOYED that there's a subreddit for this) and B) What should I read next? I powered through Insomnia and The Stand (voracious reader on school holiday) and now I'm reading Hearts in Atlantis, just grasping at other shreds of the world that seems to have driven Stephen King. Any other books with threads of Ka, the Beam, or Flagg? ",,False,,t5_2run7,False,,,True,t3_15lglo,http://www.reddit.com/r/TheDarkTower/comments/15lglo/im_here_where_next/,
1348089926.0,28,self.TheDarkTower,105o1t,A map of In-World?,32,4,15,http://www.reddit.com/r/TheDarkTower/comments/105o1t/a_map_of_inworld/,"I have found a map of end-world and mid-world, but I'm missing a map of in-world. Does anyone know where I can find one? I'm trying to piece together a collage of a map of All-World, but having a bit of trouble.",,False,,t5_2run7,False,,,True,t3_105o1t,http://www.reddit.com/r/TheDarkTower/comments/105o1t/a_map_of_inworld/,
1345997961.0,25,imdb.com,yuuv5,What do you think about this guy for Roland?,53,28,36,http://www.reddit.com/r/TheDarkTower/comments/yuuv5/what_do_you_think_about_this_guy_for_roland/,,,False,,t5_2run7,False,,,False,t3_yuuv5,http://www.imdb.com/media/rm257339392/tt1489428,
1338246883.0,28,self.TheDarkTower,u9eyp,IT was still fresh in my mind as I finished The Gunslinger last night. Im pretty sure Roland encounters The Deadlights. Slight spoilers for both books.,32,4,13,http://www.reddit.com/r/TheDarkTower/comments/u9eyp/it_was_still_fresh_in_my_mind_as_i_finished_the/,"So near the end of The Gunslinger before TMIB lectures on size Roland goes into a dreamstate and is flung through the universe in a similar way Bill is in IT. And then.....

""*And there was light, crashing in on him like a hammer, a great and primordial light. Consciousness had no chance of survival in that great glare, but before it perished, the gunslinger saw something clearly, something he believed to be of cosmic importance. He clutched it with agonized effort and then went deep, seeking refuge in himself before that light should blind his eyes and blast his sanity.*""


Ive never seen this connection made before but it probably has been discussed exstensively - so my apologies if this is old news. Still though, pretty cool, right?
",,False,,t5_2run7,False,,eye,True,t3_u9eyp,http://www.reddit.com/r/TheDarkTower/comments/u9eyp/it_was_still_fresh_in_my_mind_as_i_finished_the/,
1333769196.0,30,imgur.com,rxdcr,Found this drawing someone did. First thing that came to mind was Roland ,34,4,3,http://www.reddit.com/r/TheDarkTower/comments/rxdcr/found_this_drawing_someone_did_first_thing_that/,,,False,,t5_2run7,False,,eye,False,t3_rxdcr,http://imgur.com/iz6lU,
1333376034.0,27,reddit.com,rpiii,This weeks /r/StephenKing discussion is on The Eyes of The Dragon. ,30,3,2,http://www.reddit.com/r/TheDarkTower/comments/rpiii/this_weeks_rstephenking_discussion_is_on_the_eyes/,,,False,,t5_2run7,False,,,False,t3_rpiii,http://www.reddit.com/r/stephenking/comments/rpiaf/skd_week_2_the_eyes_of_the_dragon_spoilers/,
1332342008.0,29,self.TheDarkTower,r6smo,"With the inevitable Dark Tower adaptation, how much do you expect/want them to stick to the books?",30,1,51,http://www.reddit.com/r/TheDarkTower/comments/r6smo/with_the_inevitable_dark_tower_adaptation_how/,"I ask this because it seems that anytime an adaptation tries to stick completely to its source it fails. I have been watching The Walking Dead recently and even though it strays from some of the comics, it still keeps the feel and characters intact and all in all becomes its own experience separate from the comics. Still great, just different. So I was wondering what the rest of the ka-tet feels. Would you be disappointed if everything isn't exactly like the books? Or would you be open to adaptation and interpretation?

Also, if you ask me, something like the Dark Tower would be better served as a series on AMC or HBO rather than a trilogy or series of films. I think that shows like The Walking Dead and Game of Thrones prove that a serial drama is better for an epic series like this. Thoughts?",,False,,t5_2run7,False,,ka,True,t3_r6smo,http://www.reddit.com/r/TheDarkTower/comments/r6smo/with_the_inevitable_dark_tower_adaptation_how/,
1326281469.0,27,self.TheDarkTower,oc8jz,"So, I've finally finished. Vague Spoilers.",31,4,22,http://www.reddit.com/r/TheDarkTower/comments/oc8jz/so_ive_finally_finished_vague_spoilers/,"After around a year of reading and trying to get my hands on the books from various sources, I have finally completed King's magnum opus. I didn't quite wrap my brain around the ending at first, but then I re-read it, and found it very satisfying. Also, the day before this accomplishment, my copies of The Shining and The Stand arrived. Just wanted to share my accomplishment with some fellow Tower Junkies.",,False,,t5_2run7,False,,,True,t3_oc8jz,http://www.reddit.com/r/TheDarkTower/comments/oc8jz/so_ive_finally_finished_vague_spoilers/,
1324533634.0,28,youtube.com,nmatu,First song I've ever heard written about the dark tower on the Radio ,31,3,6,http://www.reddit.com/r/TheDarkTower/comments/nmatu/first_song_ive_ever_heard_written_about_the_dark/,,,False,,t5_2run7,False,,,False,t3_nmatu,http://www.youtube.com/watch?v=E5wJbT2yhFM,
1322849607.0,27,self.TheDarkTower,mxrf0,Time to re-pack my gunna,31,4,17,http://www.reddit.com/r/TheDarkTower/comments/mxrf0/time_to_repack_my_gunna/,"""The gunslinger fled across the desert, and the constant reader followed.""

After finishing 11/22/63 last week, I realized the Tower is calling me again, singing sweet siren songs of salvation.

I have re-packed my gunna, cleaned my gun, and remembered the face of my father. 

Wish me luck that I might stay true.",,False,,t5_2run7,False,,rose,True,t3_mxrf0,http://www.reddit.com/r/TheDarkTower/comments/mxrf0/time_to_repack_my_gunna/,
1322814268.0,28,images1.cafepress.com,mxbyw,HAE seen this on the backs of some of King's books?,30,2,8,http://www.reddit.com/r/TheDarkTower/comments/mxbyw/hae_seen_this_on_the_backs_of_some_of_kings_books/,,,False,,t5_2run7,False,,19,False,t3_mxbyw,http://images1.cafepress.com/image/27780611_125x125.png,
1321458609.0,30,secure.grantbooks.com,megxf,"First look at art from ""Wind Through The Keyhole"" from Jae Lee!",31,1,2,http://www.reddit.com/r/TheDarkTower/comments/megxf/first_look_at_art_from_wind_through_the_keyhole/,,,False,,t5_2run7,False,,19,False,t3_megxf,https://secure.grantbooks.com/z-sk-dt-twttk.html,
1316697455.0,29,self.TheDarkTower,knv7m,I've been noticing the same spider in my bathroom for the past few days.,35,6,6,http://www.reddit.com/r/TheDarkTower/comments/knv7m/ive_been_noticing_the_same_spider_in_my_bathroom/,I have named him Mordred. ,,False,,t5_2run7,True,,,True,t3_knv7m,http://www.reddit.com/r/TheDarkTower/comments/knv7m/ive_been_noticing_the_same_spider_in_my_bathroom/,
1306210264.0,28,i.imgur.com,himdq,"Just got my Ka-tee of 99 shirt, and It's rad! Great design bakedbiscuits, Thanks.",31,3,25,http://www.reddit.com/r/TheDarkTower/comments/himdq/just_got_my_katee_of_99_shirt_and_its_rad_great/,,,False,,t5_2run7,False,,coffin,False,t3_himdq,http://i.imgur.com/Nba25.jpg,
1375242559.0,28,self.TheDarkTower,1jedff,For the guy who was getting a chest tattoo of Oy..,35,7,2,http://www.reddit.com/r/TheDarkTower/comments/1jedff/for_the_guy_who_was_getting_a_chest_tattoo_of_oy/,Did you ever get it? I'd love to see it if it's finished.,,False,,t5_2run7,False,,coffin,True,t3_1jedff,http://www.reddit.com/r/TheDarkTower/comments/1jedff/for_the_guy_who_was_getting_a_chest_tattoo_of_oy/,
1374860094.0,29,self.TheDarkTower,1j3xli,Finally Finished the Series!,32,3,19,http://www.reddit.com/r/TheDarkTower/comments/1j3xli/finally_finished_the_series/,"So I finally finished the series. (Books 1 through 7 at least, not sure if I will read Wind yet). Thought I'd give my opinions...

So it took me about 3 months from start to finish - including a 2 week break trying to get through Wizard and Glass.

Though I did enjoy *The Gunslinger*, I thought it was a little slow moving for my personal take. I also found it hard to like Roland at first. 

*The Drawing of the Three* was what really hooked me. I loved the character development, the story line, the plot, everything. 

*The Waste Lands* was more of that. More drawing me into the story and making me really like the characters, the idea of Jake and Roland being in a paradox-like state. Meeting Oy. And of course the riddle contest. 

Now, I will admit I did have some problems with *Wizard and Glass* (as seen in previous posts). I was so hooked on the story of Roland's **present** Ka-tet that I didn't really want to back track into what his old one had done. This is where I took a break from the series, because no matter how hard I tried, I just couldn't make myself commit to reading it. I powered through it though, and while it's probably last on my list, it did provide valuable insight into why Roland is the way he is. Moving right along.

*Wolves of the Calla* brought me right back to where I wanted to be. Action, Adventure, Suspense, more Character Development and **HOLY SHIT** Did I ever love Father Callahan being in it! *'Salem's Lot'* is one of my favourites, so I was happy to see an old friend. My heart continually broke for Jake and the sacrifices he makes and everything he endures throughout this book.

*Song of Susannah* was another one that I wasn't *crazy* about. I didn't like that the Ka-tet was split up. I love John Cullum and the role he inevitably plays in the series. I really didn't like how Stephen King puts himself as a character in the novels at first. But, again the role he plays makes it worth it in the end.

Now on to *The Dark Tower*. The longest of the 7, I will admit that starting it was daunting. But as soon as I did, man was I hooked! It took me merely 3 days to finish it. I felt betrayed at parts, heart broken, excited and happy. And again, seeing **Ted Brautigan** was a real treat. I say this a lot about a lot of books but *Hearts in Atlantis* was one of the first SK books I read, and it remains one of my favourites. I loved seeing Sheemie again!

Anyways, those were my thoughts! I'd love to hear what you guys think!

TL;DR: Finished the series. In the end, I give it a 9.5 out of 10. ",,False,,t5_2run7,False,,ka,True,t3_1j3xli,http://www.reddit.com/r/TheDarkTower/comments/1j3xli/finally_finished_the_series/,
1371524122.0,29,self.TheDarkTower,1gk7nm,Non-Stephen King Reading Suggestions,36,7,110,http://www.reddit.com/r/TheDarkTower/comments/1gk7nm/nonstephen_king_reading_suggestions/,"I'm a long time Dark Tower fan, and after recently finishing my second read through the series, I'm looking for suggestions on other book series that I would enjoy. I've read a ton of other King, but I'm interested in reading another long, multi-book fantasy/sci-fi series kind of like The Dark Tower, or that other Tower fans have enjoyed. I've already read ASOIAF and LOTR (which seem to be two of the biggest options), and a ton of HP Lovecraft. Does /r/thedarktower have any other suggestions? Thanks in advance!",,False,,t5_2run7,False,,,True,t3_1gk7nm,http://www.reddit.com/r/TheDarkTower/comments/1gk7nm/nonstephen_king_reading_suggestions/,
1365737395.0,27,i.imgur.com,1c6n9a,"Creatures neither of the Prim, nor of the natural world, but misbegotten things from somewhere between the two.",31,4,0,http://www.reddit.com/r/TheDarkTower/comments/1c6n9a/creatures_neither_of_the_prim_nor_of_the_natural/,,,False,,t5_2run7,False,,,False,t3_1c6n9a,http://i.imgur.com/mqrPq94.jpg,
1363363101.0,28,self.TheDarkTower,1act1x,Just finished the audiobook for 11/22/63 (spoilers),30,2,14,http://www.reddit.com/r/TheDarkTower/comments/1act1x/just_finished_the_audiobook_for_112263_spoilers/,"I looked at the other threads in this subreddit about the book, but two of the biggest tower connections in my opinion were not mentioned: in the apocalyptic world, a nuclear power plant exploded on June 19th, 1999, and the door under Fedic that goes to Dallas, 1963. Any thoughts on either of those?

I thought it was a great book, although just a bit too long (the audiobook was 28 hours!)",,False,,t5_2run7,False,,,True,t3_1act1x,http://www.reddit.com/r/TheDarkTower/comments/1act1x/just_finished_the_audiobook_for_112263_spoilers/,
1363008909.0,28,i.imgur.com,1a2wua,Welcome to North Brentwood Maryland.,43,15,6,http://www.reddit.com/r/TheDarkTower/comments/1a2wua/welcome_to_north_brentwood_maryland/,,,False,,t5_2run7,False,,,False,t3_1a2wua,http://i.imgur.com/x85NabN.jpg,
1361674476.0,28,self.TheDarkTower,1943av,Dark Tower ending Update. SPOILERS,29,1,8,http://www.reddit.com/r/TheDarkTower/comments/1943av/dark_tower_ending_update_spoilers/,So i finally finished it and dammit  i have to say i wasnt disappointed. I was still upset until the epilogue but that was definitely satisfying i just wish Oy had gone with Susannah i had to put the book down a bit when he died he was by far my favorite character. Overall the journey outweighed the actual ending but i think king left it where he should have. ,,False,,t5_2run7,False,,,True,t3_1943av,http://www.reddit.com/r/TheDarkTower/comments/1943av/dark_tower_ending_update_spoilers/,
1360467460.0,27,self.TheDarkTower,1889sv,Did I miss something? (Spoilers and possible plot hole),32,5,19,http://www.reddit.com/r/TheDarkTower/comments/1889sv/did_i_miss_something_spoilers_and_possible_plot/,"Ok, so I was thinking about Roland's boots. Over the course of the series, his boots are described several times as broken, sprung, old and dusty, etc. We hear the thud of him planting his heel to bow, a fist knocking on a coffin. We even watch him dance a sort of jig in them, come Commala.

Here's the problem: in the beginning of TDotT, a lobstrosity tears off the end of his right boot, eats most of his big toe, tears the boot from his foot, and starts tearing it up. He later retrieves the torn boot.

Did I miss something, or does Roland's boot somehow regenerate after this? Because I can't remember him getting new boots until the tet picks up some shor'boots in WotC, and I can't remember if Roland got those at all. Yet nothing is ever said about him walking around mid-world with what was left of his toes hanging out. Thoughts? ",,False,,t5_2run7,False,,unfound,True,t3_1889sv,http://www.reddit.com/r/TheDarkTower/comments/1889sv/did_i_miss_something_spoilers_and_possible_plot/,
1358904532.0,29,5.mshcdn.com,173duo,Many other functions,48,19,9,http://www.reddit.com/r/TheDarkTower/comments/173duo/many_other_functions/,,,False,,t5_2run7,False,,ka,False,t3_173duo,http://5.mshcdn.com/wp-content/uploads/2012/12/humanoid-robot.jpg,
1357584981.0,29,imgur.com,164su0,Beam Sauce of the line of Eld! All things must Serve...,51,22,2,http://www.reddit.com/r/TheDarkTower/comments/164su0/beam_sauce_of_the_line_of_eld_all_things_must/,,,False,,t5_2run7,False,,,False,t3_164su0,http://imgur.com/4samN,
1349992672.0,26,i.imgur.com,11bzde,"Just found this subreddit, allow me to introduce my Roland",37,11,6,http://www.reddit.com/r/TheDarkTower/comments/11bzde/just_found_this_subreddit_allow_me_to_introduce/,,,False,,t5_2run7,False,,ka,False,t3_11bzde,http://i.imgur.com/R2sv6.jpg,
1348767362.0,27,self.TheDarkTower,10kmbm,Quick question about The Gunslinger,33,6,32,http://www.reddit.com/r/TheDarkTower/comments/10kmbm/quick_question_about_the_gunslinger/,"This may seem like a really dumb question, but it's bothering me nonetheless. I recently started re-reading the series (literally just finished Wizard and Glass) and there's one thing that I can't exactly remember which is causing me some frustration as far as putting all of the pieces together go: Why is Roland initially chasing the man in black (who he believes to be Walter, right?) across the desert? Thanks much.",,False,,t5_2run7,False,,,True,t3_10kmbm,http://www.reddit.com/r/TheDarkTower/comments/10kmbm/quick_question_about_the_gunslinger/,
1346719265.0,27,self.TheDarkTower,zb5pl,Sandalwood grips,32,5,25,http://www.reddit.com/r/TheDarkTower/comments/zb5pl/sandalwood_grips/,So i have a pretty good picture in my head of rolands guns but i was wondering if someone could draw what they believe they look like,,False,,t5_2run7,False,,white,True,t3_zb5pl,http://www.reddit.com/r/TheDarkTower/comments/zb5pl/sandalwood_grips/,
1341611778.0,23,i.imgur.com,w5eys,"Jack ""The Pusher"" Mort in action (r/wtf x-post) (NSFW: Probable Death)",50,27,6,http://www.reddit.com/r/TheDarkTower/comments/w5eys/jack_the_pusher_mort_in_action_rwtf_xpost_nsfw/,,,True,,t5_2run7,False,,pistol,False,t3_w5eys,http://i.imgur.com/F8vT4.gif,
1323043116.0,30,self.TheDarkTower,n0bqj,Thankee-sais!,36,6,8,http://www.reddit.com/r/TheDarkTower/comments/n0bqj/thankeesais/,"I had no idea there were such Dark Tower bumhugs as me. I just wanted to say thankee-sai to each of you, say thankya big-big. I love this series, and usually no one gets my DT references. Thanks guys.",,False,,t5_2run7,False,,,True,t3_n0bqj,http://www.reddit.com/r/TheDarkTower/comments/n0bqj/thankeesais/,
1318209052.0,29,self.TheDarkTower,l6jj8,"If you could pick one character from the DT series to have a spin-off novel, who would it be and why?",36,7,57,http://www.reddit.com/r/TheDarkTower/comments/l6jj8/if_you_could_pick_one_character_from_the_dt/,"I'd want to see something more about the Tick-Tock Man. He was an interesting character who didn't get nearly enough ""screen-time"".",,False,,t5_2run7,False,,,True,t3_l6jj8,http://www.reddit.com/r/TheDarkTower/comments/l6jj8/if_you_could_pick_one_character_from_the_dt/,
1312034114.0,28,self.TheDarkTower,j4476,Would you enjoy a Dark Tower film based on Wizard and Glass/Gunslinger Born,29,1,13,http://www.reddit.com/r/TheDarkTower/comments/j4476/would_you_enjoy_a_dark_tower_film_based_on_wizard/,"So with the news that universal is backing out of the DT film trilogy+series it got me thinking ""well if they made just one film, what would it be?""

So my question is in the title of course and i think it could make a great film seeing Rolands life in Gilead,Mejis, Jericho Hill etc as just a one off film. But while i would love to see this i see a few problems:

-Who would you cast as a young Roland,Cuthbert and Alain? Young Actors with a Clint Eastwood stare..

-Could you enjoy just this part of the story knowing there is so much more ie. the other 6 books.

-Cinemagoers unfamiliar with The Dark Tower  would see this as a period cowboy film set in Camelot and Mexico and go meh?",,False,,t5_2run7,False,,unfound,True,t3_j4476,http://www.reddit.com/r/TheDarkTower/comments/j4476/would_you_enjoy_a_dark_tower_film_based_on_wizard/,
1309541047.0,25,trev-solo.deviantart.com,ieczr,Awesome Gunslinger Sculpture (by trev-solo on deviantArt),29,4,4,http://www.reddit.com/r/TheDarkTower/comments/ieczr/awesome_gunslinger_sculpture_by_trevsolo_on/,,,False,,t5_2run7,False,,white,False,t3_ieczr,http://trev-solo.deviantart.com/art/The-Gunslinger-animation-14734569,
1374578874.0,27,self.TheDarkTower,1ivmiv,I did it again. I will do it again. And again.,32,5,13,http://www.reddit.com/r/TheDarkTower/comments/1ivmiv/i_did_it_again_i_will_do_it_again_and_again/,"I just finished the DT-Books once again. And as Roland is pulled through the last door, so am I. Again I am sorry for him. Again I don't know if I like the ending or not. Again I know I will re-read the books soon. And as allways I will be mostly the same guy. But also a little different.

By the way: I can't believe that I own the last book for more than 8 years now (it's from 2004, isn't it?) as I had to wait sooo long between 3 and 4, 4 and 5, 5 and 6/7... :-D",!!Spoilers!!,False,,t5_2run7,False,spoiler,,True,t3_1ivmiv,http://www.reddit.com/r/TheDarkTower/comments/1ivmiv/i_did_it_again_i_will_do_it_again_and_again/,
1367283072.0,28,imgur.com,1ddmr2,We still showing off Dark Tower inspired tattoos?,36,8,2,http://www.reddit.com/r/TheDarkTower/comments/1ddmr2/we_still_showing_off_dark_tower_inspired_tattoos/,,,False,,t5_2run7,False,,,False,t3_1ddmr2,http://imgur.com/a/RzBJu,
