created_utc,score,domain,id,title,ups,downs,num_comments,permalink,selftext,link_flair_text,over_18,thumbnail,subreddit_id,edited,link_flair_css_class,author_flair_css_class,is_self,name,url,distinguished
1349979933.0,301,imgur.com,11bl1b,Aaron Paul on The Dark Tower,322,21,59,http://www.reddit.com/r/TheDarkTower/comments/11bl1b/aaron_paul_on_the_dark_tower/,,,False,,t5_2run7,False,,,False,t3_11bl1b,http://imgur.com/wTstU,
1361146564.0,280,i.imgur.com,18pwxm,"My first DT tattoo. In honor of my daughter who passed away...may I see you again, my ladybug.",310,30,36,http://www.reddit.com/r/TheDarkTower/comments/18pwxm/my_first_dt_tattoo_in_honor_of_my_daughter_who/,,,False,,t5_2run7,False,,,False,t3_18pwxm,http://i.imgur.com/gKlCSWG.jpg,
1350164230.0,244,i.imgur.com,11fjmr,All things serve The Beam,269,25,8,http://www.reddit.com/r/TheDarkTower/comments/11fjmr/all_things_serve_the_beam/,,,False,,t5_2run7,False,,,False,t3_11fjmr,http://i.imgur.com/yoG08.jpg,
1362074830.0,242,imgur.com,19ep47,Most Badass DT Poster I've come across,259,17,14,http://www.reddit.com/r/TheDarkTower/comments/19ep47/most_badass_dt_poster_ive_come_across/,,,False,,t5_2run7,False,,ka,False,t3_19ep47,http://imgur.com/XlaJoSt,
1350235690.0,235,imgur.com,11gu5i,my Ka tattoo,262,27,35,http://www.reddit.com/r/TheDarkTower/comments/11gu5i/my_ka_tattoo/,,,False,,t5_2run7,False,,ka,False,t3_11gu5i,http://imgur.com/wycLO,
1366126520.0,225,i.imgur.com,1cgs3q,"Found this at a Renaissance Festival, my friends didn't understand why I had to buy it. (Hand crafted pewter)",243,18,9,http://www.reddit.com/r/TheDarkTower/comments/1cgs3q/found_this_at_a_renaissance_festival_my_friends/,,,False,,t5_2run7,False,,,False,t3_1cgs3q,http://i.imgur.com/6tmLoFF.jpg,
1354760430.0,225,imgur.com,14cz4z,My collection. And It's my cakeday. And I started this sub.,257,32,45,http://www.reddit.com/r/TheDarkTower/comments/14cz4z/my_collection_and_its_my_cakeday_and_i_started/,,,False,,t5_2run7,False,,19,False,t3_14cz4z,http://imgur.com/IDAgb,
1346993201.0,214,imgur.com,zhpf0,Minecraft. Spoilers all. Had tears in my eyes.,240,26,21,http://www.reddit.com/r/TheDarkTower/comments/zhpf0/minecraft_spoilers_all_had_tears_in_my_eyes/,,,False,,t5_2run7,False,,19,False,t3_zhpf0,http://imgur.com/a/Av9CS#0,
1323846197.0,214,fbcdn-sphotos-a.akamaihd.net,nc4yg,Found this while walking my dogs! Please take a moment for a gunslinger who is now in the clearing at the end of the path.,220,6,18,http://www.reddit.com/r/TheDarkTower/comments/nc4yg/found_this_while_walking_my_dogs_please_take_a/,,,False,,t5_2run7,False,,ka,False,t3_nc4yg,https://fbcdn-sphotos-a.akamaihd.net/hphotos-ak-ash4/p480x480/385551_10150524389406514_758941513_10737569_1187152510_n.jpg,
1350989126.0,213,imgur.com,11xuo8,The Tower should totally go here (Found in Iran),238,25,12,http://www.reddit.com/r/TheDarkTower/comments/11xuo8/the_tower_should_totally_go_here_found_in_iran/,,,False,,t5_2run7,False,,,False,t3_11xuo8,http://imgur.com/f7TAR,
1374898777.0,208,imgur.com,1j56p6,Buddy posted this on his FB. Somewhere here in Oregon,220,12,7,http://www.reddit.com/r/TheDarkTower/comments/1j56p6/buddy_posted_this_on_his_fb_somewhere_here_in/,,,False,,t5_2run7,False,,,False,t3_1j56p6,http://imgur.com/qNoJxV8,
1368122951.0,201,i.imgur.com,1e0jxv,No one understood why I was scared by this birth announcement.,230,29,8,http://www.reddit.com/r/TheDarkTower/comments/1e0jxv/no_one_understood_why_i_was_scared_by_this_birth/,,,False,,t5_2run7,False,,,False,t3_1e0jxv,http://i.imgur.com/J3psjut.jpg,
1349497127.0,201,i.imgur.com,1112h0,"Saw this in Washington State. Tried to open, but it was locked. (x-post from /r/pics).",219,18,18,http://www.reddit.com/r/TheDarkTower/comments/1112h0/saw_this_in_washington_state_tried_to_open_but_it/,,,False,,t5_2run7,False,,,False,t3_1112h0,http://i.imgur.com/mVz3E.jpg,
1344897965.0,198,i.imgur.com,y64ex,All things serve the beam (x-post from r/pics),213,15,12,http://www.reddit.com/r/TheDarkTower/comments/y64ex/all_things_serve_the_beam_xpost_from_rpics/,,,False,,t5_2run7,False,,ka,False,t3_y64ex,http://i.imgur.com/h1jUh.jpg,
1348268790.0,191,imgur.com,109uok,The Crimson King has low men at all levels of the tower I wot... (Borderlands 2),203,12,31,http://www.reddit.com/r/TheDarkTower/comments/109uok/the_crimson_king_has_low_men_at_all_levels_of_the/,,,False,,t5_2run7,False,,eye,False,t3_109uok,http://imgur.com/LjU3q,
1355412527.0,194,i.imgur.com,14sdq3,Check out the awesome start of the Stephen King movie The Mist,207,13,19,http://www.reddit.com/r/TheDarkTower/comments/14sdq3/check_out_the_awesome_start_of_the_stephen_king/,,,False,,t5_2run7,False,,coffin,False,t3_14sdq3,http://i.imgur.com/BrY1S.jpg,
1363946826.0,181,imgur.com,1asih4,My 17 year old cat passed away and this was the only way I wanted to say goodbye to him,220,39,18,http://www.reddit.com/r/TheDarkTower/comments/1asih4/my_17_year_old_cat_passed_away_and_this_was_the/,,,False,,t5_2run7,False,,ka,False,t3_1asih4,http://imgur.com/LR9NuHx,
1370516133.0,182,i.imgur.com,1fs7qd,Incredible. All things serve the beam. Amazing photo,204,22,4,http://www.reddit.com/r/TheDarkTower/comments/1fs7qd/incredible_all_things_serve_the_beam_amazing_photo/,,,False,,t5_2run7,False,,,False,t3_1fs7qd,http://i.imgur.com/potceWT.jpg,
1353440282.0,177,i.imgur.com,13ivh2,Dad-a chum?,204,27,15,http://www.reddit.com/r/TheDarkTower/comments/13ivh2/dada_chum/,,,False,,t5_2run7,False,,,False,t3_13ivh2,http://i.imgur.com/sc3ze.jpg,
1359590006.0,180,imgur.com,17lep0,Here are the close ups of The Dark Tower prints I promised. OP delivers.,196,16,21,http://www.reddit.com/r/TheDarkTower/comments/17lep0/here_are_the_close_ups_of_the_dark_tower_prints_i/,,,False,,t5_2run7,False,,,False,t3_17lep0,http://imgur.com/a/0cQPi,
1355837102.0,178,imgur.com,151trj,"Came across Maturin on my walk to the bus this morning in Ithaca, NY",187,9,7,http://www.reddit.com/r/TheDarkTower/comments/151trj/came_across_maturin_on_my_walk_to_the_bus_this/,,,False,,t5_2run7,False,,ka,False,t3_151trj,http://imgur.com/KabAb,
1367162015.0,176,i.imgur.com,1d9w79,"My new Gunslinger prints, numbered and signed by Michael Whelan",197,21,13,http://www.reddit.com/r/TheDarkTower/comments/1d9w79/my_new_gunslinger_prints_numbered_and_signed_by/,,,False,,t5_2run7,False,,,False,t3_1d9w79,http://i.imgur.com/VHJz3Wd.jpg,
1365886955.0,176,i.imgur.com,1caenj,Saw this online today. Not sure if a repost. The Dark Tower as imagined by Dr. Suess.,194,18,3,http://www.reddit.com/r/TheDarkTower/comments/1caenj/saw_this_online_today_not_sure_if_a_repost_the/,,,False,,t5_2run7,False,,,False,t3_1caenj,http://i.imgur.com/NyUChuI.jpg,
1360017756.0,174,i.imgur.com,17w74q,Someone said this cap from  'Rango' should be the opening shot for a DT movie. I agree,187,13,9,http://www.reddit.com/r/TheDarkTower/comments/17w74q/someone_said_this_cap_from_rango_should_be_the/,,,False,,t5_2run7,False,,19,False,t3_17w74q,http://i.imgur.com/b64ccSN.jpg,
1328123332.0,169,imgur.com,p6hgf,All things follow the beam,181,12,9,http://www.reddit.com/r/TheDarkTower/comments/p6hgf/all_things_follow_the_beam/,,,False,,t5_2run7,False,,ka,False,t3_p6hgf,http://imgur.com/6ndzf,
1331156733.0,169,i.imgur.com,qmbaf,I was on my way back home when I saw something that gave me goosebumps...,174,5,16,http://www.reddit.com/r/TheDarkTower/comments/qmbaf/i_was_on_my_way_back_home_when_i_saw_something/,,,False,,t5_2run7,False,,white,False,t3_qmbaf,http://i.imgur.com/Jqwhb.jpg,
1338432066.0,161,imgur.com,ud7i8,Like my Dark Tower t-shirt?  A friend made it with a printed out stencil and bleach.,173,12,33,http://www.reddit.com/r/TheDarkTower/comments/ud7i8/like_my_dark_tower_tshirt_a_friend_made_it_with_a/,,,False,,t5_2run7,False,,,False,t3_ud7i8,http://imgur.com/HtugF,
1354903788.0,163,i.imgur.com,14gdfs,Childe Roland to the Dark Tower Came,177,14,11,http://www.reddit.com/r/TheDarkTower/comments/14gdfs/childe_roland_to_the_dark_tower_came/,,,False,,t5_2run7,False,,,False,t3_14gdfs,http://i.imgur.com/ygAxy.jpg,
1371663791.0,161,reddit.com,1go27o,Reminder : Stephen King is doing an AMA tomorrow around 4:15 p.m. (x-post from r/writing),184,23,15,http://www.reddit.com/r/TheDarkTower/comments/1go27o/reminder_stephen_king_is_doing_an_ama_tomorrow/,,,False,,t5_2run7,False,,,False,t3_1go27o,http://www.reddit.com/r/writing/comments/1gnvcu/reminder_stephen_king_is_doing_an_ama_tomorrow/,
1351093822.0,164,i.imgur.com,120dus,"""Road to the Tower"", Dark Tower themed pendant I made",178,14,14,http://www.reddit.com/r/TheDarkTower/comments/120dus/road_to_the_tower_dark_tower_themed_pendant_i_made/,,,False,,t5_2run7,False,,,False,t3_120dus,http://i.imgur.com/Hxjcl.jpg,
1364660429.0,160,i.imgur.com,1bb2p9,All things serve the Beam,182,22,4,http://www.reddit.com/r/TheDarkTower/comments/1bb2p9/all_things_serve_the_beam/,,,False,,t5_2run7,False,,,False,t3_1bb2p9,http://i.imgur.com/kbXf2XD.jpeg,
1342334581.0,160,reddit.com,wl25s,/r/TheDarkTower is Subreddit of the Day for 7/15/12!,177,17,7,http://www.reddit.com/r/TheDarkTower/comments/wl25s/rthedarktower_is_subreddit_of_the_day_for_71512/,,,False,,t5_2run7,False,,,False,t3_wl25s,http://www.reddit.com/r/subredditoftheday/comments/wl212/july_15_2012_rthedarktower_dattachum_dattachee/,
1367255409.0,161,imgur.com,1dcjqp,Watching a random cartoon show on Netflix and noticed this familiar character,185,24,15,http://www.reddit.com/r/TheDarkTower/comments/1dcjqp/watching_a_random_cartoon_show_on_netflix_and/,,,False,,t5_2run7,False,,,False,t3_1dcjqp,http://imgur.com/u32Zyit,
1372344855.0,158,i.imgur.com,1h6j0e,A build I'm currently working on (X-Post to r/Minecraft),173,15,24,http://www.reddit.com/r/TheDarkTower/comments/1h6j0e/a_build_im_currently_working_on_xpost_to/,,,False,,t5_2run7,False,,unfound,False,t3_1h6j0e,http://i.imgur.com/veM9S3K.png,
1356455128.0,154,imgur.com,15fc42,"One of the best gifts I've ever received! Merry Christmas, /r/TheDarkTower!",167,13,8,http://www.reddit.com/r/TheDarkTower/comments/15fc42/one_of_the_best_gifts_ive_ever_received_merry/,,,False,,t5_2run7,False,,,False,t3_15fc42,http://imgur.com/ugEfP,
1353886327.0,158,i.imgur.com,13s650,"Made me think of ""The Drawing of the Three"" [x-post from r/frisson]",172,14,9,http://www.reddit.com/r/TheDarkTower/comments/13s650/made_me_think_of_the_drawing_of_the_three_xpost/,,,False,,t5_2run7,False,,,False,t3_13s650,http://i.imgur.com/uEpjv.jpg,
1348370444.0,154,i.imgur.com,10bsoe,It finally arrived!,165,11,8,http://www.reddit.com/r/TheDarkTower/comments/10bsoe/it_finally_arrived/,,,False,,t5_2run7,False,,eye,False,t3_10bsoe,http://i.imgur.com/0iL2n.jpg,
1349481194.0,158,i.imgur.com,110pk9,Felt this belonged here :),169,11,5,http://www.reddit.com/r/TheDarkTower/comments/110pk9/felt_this_belonged_here/,,,False,,t5_2run7,False,,,False,t3_110pk9,http://i.imgur.com/USXMB.jpg,
1363213468.0,154,i.imgur.com,1a8usg,My amazing wife drew a Billy-Bumbler from the Dark Tower series. (X-Post from r/pics),176,22,12,http://www.reddit.com/r/TheDarkTower/comments/1a8usg/my_amazing_wife_drew_a_billybumbler_from_the_dark/,,,False,,t5_2run7,False,,,False,t3_1a8usg,http://i.imgur.com/vr4JAQf.jpg,
1357153112.0,154,imgur.com,15u7c1,Damn I love my new xmas DT tee.,172,18,14,http://www.reddit.com/r/TheDarkTower/comments/15u7c1/damn_i_love_my_new_xmas_dt_tee/,,,False,,t5_2run7,False,,,False,t3_15u7c1,http://imgur.com/jPnC6,
1356661792.0,150,imgur.com,15jvb6,Awesome gift this year from my family!,161,11,11,http://www.reddit.com/r/TheDarkTower/comments/15jvb6/awesome_gift_this_year_from_my_family/,,,False,,t5_2run7,False,,,False,t3_15jvb6,http://imgur.com/i4YKG,
1363841892.0,153,i.imgur.com,1aps3c,Crimson King in the cosmos. This is an unedited picture of the galaxy known as The Eye of God. (x-post from r/Woahdude) ,164,11,5,http://www.reddit.com/r/TheDarkTower/comments/1aps3c/crimson_king_in_the_cosmos_this_is_an_unedited/,,,False,,t5_2run7,False,,ka,False,t3_1aps3c,http://i.imgur.com/Gh4PIiF.jpg,
1363833700.0,149,i.imgur.com,1apin1,"Since we seem to be kicking around the ""who should play xxx"" game, here's my vote for your old pal Gasher",168,19,31,http://www.reddit.com/r/TheDarkTower/comments/1apin1/since_we_seem_to_be_kicking_around_the_who_should/,,,False,,t5_2run7,False,,ka,False,t3_1apin1,http://i.imgur.com/U9j6ECs.jpg,
1360717730.0,143,imgur.com,18ewwa,Any fandom love for my sketch tonight?,170,27,7,http://www.reddit.com/r/TheDarkTower/comments/18ewwa/any_fandom_love_for_my_sketch_tonight/,,,False,,t5_2run7,False,,,False,t3_18ewwa,http://imgur.com/a5fBZz7,
1374062693.0,141,imgur.com,1ihbdq,Moe Szyslak looking a bit Mid-World ish.,156,15,8,http://www.reddit.com/r/TheDarkTower/comments/1ihbdq/moe_szyslak_looking_a_bit_midworld_ish/,,,False,,t5_2run7,False,,,False,t3_1ihbdq,http://imgur.com/0FmYtr2,
1369934091.0,144,self.TheDarkTower,1fcid2,"I'm sure thoughts like these have been posted before, but I just had a conversation with my friend that gave me new respect for the ending. The very end of it all. [Obviously, SPOILERS if you haven't finished the series.]",168,24,37,http://www.reddit.com/r/TheDarkTower/comments/1fcid2/im_sure_thoughts_like_these_have_been_posted/,"*tone: intrigued, a touch excited*

I was talking to a friend about how it ends, and he said that while he loved the novels, he hated the very end, where King says it's the end... but if you'd like, you can continue reading and see what was in the Tower. My friend protested and said that little ""gimmick"" was bullshit and totally unnecessary, because *of course* we're going to keep reading and see what's in the Tower. Who wouldn't read that whole series and just be able to set the book down without *knowing*?

I started laughing. I had never verbalized before why I loved how he ended it, but my friend's protestations made it crystal clear: King *perfectly* puts the reader in Roland's shoes right there at the end. People tend to criticize Roland, citing that his need to *know* what's in the Tower is more important to him than even his companions. He risks everything just to climb those stairs. All the books are about his journey to know.

So as much as we, as readers, criticize his (possible lack of) morality and empathy, and curse him for his unfaltering drive, at the end of all things... we climb that Tower with him. King stops us and pulls us out of the story for a moment and makes us *choose* what we want to do. Are we content to walk away? Or do we, like Roland, have to *know*? And all of us, each of us, turned the page and climbed the stairs and completed the cycle. In that moment, we knew Roland. We were Roland.

That's damn fine storytelling.",,False,,t5_2run7,False,,rose,True,t3_1fcid2,http://www.reddit.com/r/TheDarkTower/comments/1fcid2/im_sure_thoughts_like_these_have_been_posted/,
1369246969.0,141,imgur.com,1eukx0,sköldpadda,154,13,5,http://www.reddit.com/r/TheDarkTower/comments/1eukx0/sköldpadda/,,,False,,t5_2run7,False,,,False,t3_1eukx0,http://imgur.com/z9yshT4,
1358830539.0,135,imgur.com,171dtp,After 7 Years Of Searching Finally Found The Wastelands In Hardcover ,148,13,29,http://www.reddit.com/r/TheDarkTower/comments/171dtp/after_7_years_of_searching_finally_found_the/,,,False,,t5_2run7,False,,,False,t3_171dtp,http://imgur.com/a/feKQU,
1354978165.0,137,images2.wikia.nocookie.net,14hypb,"So someone wanted a map, this is pretty good. ",152,15,24,http://www.reddit.com/r/TheDarkTower/comments/14hypb/so_someone_wanted_a_map_this_is_pretty_good/,,,False,,t5_2run7,False,,,False,t3_14hypb,http://images2.wikia.nocookie.net/__cb20120618022022/stephenking/images/8/88/DarkTowerMapFull2.jpg,
1362944201.0,134,imgur.com,1a1cls,"""Dark Tower: Roland and Susan"" by Chris Koehler",149,15,15,http://www.reddit.com/r/TheDarkTower/comments/1a1cls/dark_tower_roland_and_susan_by_chris_koehler/,,,False,,t5_2run7,False,,rose,False,t3_1a1cls,http://imgur.com/9QJg2fR,
1346548596.0,133,self.TheDarkTower,z7kzr,"Roland, his obsession and King's warning.",155,22,18,http://www.reddit.com/r/TheDarkTower/comments/z7kzr/roland_his_obsession_and_kings_warning/,"I recently posted this in another thread but felt it may deserve it's own thread as I've never seen it mentioned:

I believe his obsession with the tower in the face of all the death and negativity it brings upon him and his loved ones is his damnation. His obsession to see the journey to the end is one and the same as ours. He will be freed from this cycle of pain once he and us as the readers stop at King's warning. Our obsession to read on is what damns Roland. Once we stop, he stops and we get a semi sweet, but most importantly, a FINAL, ending. And Roland gets his redemption. That's the way I see it. 

I don't think the horn has much to do with anything other than to show each time he gets closer to realizing what is most important. Friendship, loved ones, life.

I feel many people just see the warning as King being strange/copping out; failing to recognize the genius and importance behind it. The amount of times we as readers push on to the end is the amount of times Roland continues his damnation. When we all reached that warning for the first time there was no way we could just turn back so close to the end. And that's exactly the way Roland feels. It's a very creative way to mirror Roland's internal struggle in the reader and give us an opportunity to decide when his hell gives way.

Really, the ending is perfect, warning and all.",,False,,t5_2run7,1346573520.0,,eye,True,t3_z7kzr,http://www.reddit.com/r/TheDarkTower/comments/z7kzr/roland_his_obsession_and_kings_warning/,
1339543994.0,136,self.TheDarkTower,uyu3h,Dark Tower on Jeopardy,154,18,41,http://www.reddit.com/r/TheDarkTower/comments/uyu3h/dark_tower_on_jeopardy/,"The final jeopardy answer tonight was:

This best selling author has a book series inspired by Robert Browning's Childe Roland to the Dark Tower Came.

Whats impressive though is that a contestant bet $1999.
Ka or just a constant reader?",,False,,t5_2run7,1339544311.0,,,True,t3_uyu3h,http://www.reddit.com/r/TheDarkTower/comments/uyu3h/dark_tower_on_jeopardy/,
1375842662.0,134,i.imgur.com,1juujm,I build aerospace wiring harnesses. Came across this yesterday.,148,14,6,http://www.reddit.com/r/TheDarkTower/comments/1juujm/i_build_aerospace_wiring_harnesses_came_across/,,,False,,t5_2run7,False,,pistol,False,t3_1juujm,http://i.imgur.com/HTJcChi.jpg,
1351738176.0,133,i.imgur.com,12fs2d,Speed Limit along the Path of the Beam [X-Post r/funny],150,17,4,http://www.reddit.com/r/TheDarkTower/comments/12fs2d/speed_limit_along_the_path_of_the_beam_xpost/,,,False,,t5_2run7,False,,ka,False,t3_12fs2d,http://i.imgur.com/KITvj.jpg,
1359658873.0,132,i.imgur.com,17n714,Waiting for the Kings command.,143,11,7,http://www.reddit.com/r/TheDarkTower/comments/17n714/waiting_for_the_kings_command/,,,False,,t5_2run7,False,,,False,t3_17n714,http://i.imgur.com/UROUI3a.jpg,
1345763399.0,127,imgur.com,yq143,"Oddly enough, this man is pretty close to how I picture Roland.",155,28,33,http://www.reddit.com/r/TheDarkTower/comments/yq143/oddly_enough_this_man_is_pretty_close_to_how_i/,,,False,,t5_2run7,False,,19,False,t3_yq143,http://imgur.com/1qVcl,
1314663745.0,129,24.media.tumblr.com,jyicd,"Damn it, Roland",138,9,9,http://www.reddit.com/r/TheDarkTower/comments/jyicd/damn_it_roland/,,,False,,t5_2run7,False,,ka,False,t3_jyicd,http://24.media.tumblr.com/tumblr_ljx4b2g3bf1qbslufo1_500.jpg,
1376280838.0,128,i.imgur.com,1k6qb5,Rewatching The West Wing when suddenly ...,148,20,14,http://www.reddit.com/r/TheDarkTower/comments/1k6qb5/rewatching_the_west_wing_when_suddenly/,,,False,,t5_2run7,False,,,False,t3_1k6qb5,http://i.imgur.com/sWkZYZr.jpg,
1369681649.0,125,imgur.com,1f5h5r,Re-reading The Waste Lands and I just realized the eyes are roses,140,15,15,http://www.reddit.com/r/TheDarkTower/comments/1f5h5r/rereading_the_waste_lands_and_i_just_realized_the/,,,False,,t5_2run7,False,,,False,t3_1f5h5r,http://imgur.com/a/f0VgG,
1361512246.0,126,imgur.com,19097q,Painted My Hockey Helmet,144,18,5,http://www.reddit.com/r/TheDarkTower/comments/19097q/painted_my_hockey_helmet/,,,False,,t5_2run7,False,,eye,False,t3_19097q,http://imgur.com/KY2TU,
1348012123.0,129,i.imgur.com,103w0w,Just a wall hanging my grandmother made me,141,12,7,http://www.reddit.com/r/TheDarkTower/comments/103w0w/just_a_wall_hanging_my_grandmother_made_me/,,,False,,t5_2run7,False,,,False,t3_103w0w,http://i.imgur.com/L4xQR.jpg,
1365350019.0,129,i.imgur.com,1buum2,The Tower Card - Michael Whelan,139,10,6,http://www.reddit.com/r/TheDarkTower/comments/1buum2/the_tower_card_michael_whelan/,,,False,,t5_2run7,False,,ka,False,t3_1buum2,http://i.imgur.com/mAWlK96.jpg,
1366830423.0,128,25.media.tumblr.com,1d10w5,"Different take on a Dark Tower tattoo [found, Maxwell Alves - Curitiba, Brasil]",141,13,11,http://www.reddit.com/r/TheDarkTower/comments/1d10w5/different_take_on_a_dark_tower_tattoo_found/,,,False,,t5_2run7,False,,rose,False,t3_1d10w5,http://25.media.tumblr.com/82ea0168030b4de7fa3538999cdb3956/tumblr_mj46na3HsC1qzabkfo1_1280.jpg,
1361679993.0,125,i.imgur.com,1948gv,Saw this at the thrift store. I was instantly thrown back to last spring when I was in the wastelands. Maybe you will feel the same,139,14,15,http://www.reddit.com/r/TheDarkTower/comments/1948gv/saw_this_at_the_thrift_store_i_was_instantly/,,,False,,t5_2run7,False,,,False,t3_1948gv,http://i.imgur.com/vcKCgFF.jpg,
1367764095.0,123,i.imgur.com,1dqd1l,Made a shirt for my girlfriend,144,21,18,http://www.reddit.com/r/TheDarkTower/comments/1dqd1l/made_a_shirt_for_my_girlfriend/,,,False,,t5_2run7,False,,,False,t3_1dqd1l,http://i.imgur.com/34N9DKu.jpg,
1357331005.0,119,i46.tinypic.com,15yuot,The Beam,139,20,6,http://www.reddit.com/r/TheDarkTower/comments/15yuot/the_beam/,,,False,,t5_2run7,False,,pistol,False,t3_15yuot,http://i46.tinypic.com/166f1b6.jpg,
1343710980.0,123,i.imgur.com,xfn29,I could only wish,137,14,50,http://www.reddit.com/r/TheDarkTower/comments/xfn29/i_could_only_wish/,,,False,,t5_2run7,False,,coffin,False,t3_xfn29,http://i.imgur.com/fRjq2.jpg,
1373661406.0,122,sphotos-b.xx.fbcdn.net,1i6eeq,"From the Stephen King Facebook page, thought it would go well here.",150,28,4,http://www.reddit.com/r/TheDarkTower/comments/1i6eeq/from_the_stephen_king_facebook_page_thought_it/,,,False,,t5_2run7,False,,,False,t3_1i6eeq,https://sphotos-b.xx.fbcdn.net/hphotos-prn2/1069851_278469155626007_467708154_n.png,
1369169201.0,124,i.imgur.com,1esdjw,Struck me as familiar.,144,20,10,http://www.reddit.com/r/TheDarkTower/comments/1esdjw/struck_me_as_familiar/,,,False,,t5_2run7,False,,,False,t3_1esdjw,http://i.imgur.com/f46nz5a.jpg,
1358571948.0,120,imgur.com,16v1mr,The Calla?,133,13,14,http://www.reddit.com/r/TheDarkTower/comments/16v1mr/the_calla/,,,False,,t5_2run7,False,,,False,t3_16v1mr,http://imgur.com/XLRsjE8,
1361593427.0,119,i.imgur.com,192bvn,Charlie the Choo Choo (x-post from r/AbandonedPorn.,136,17,5,http://www.reddit.com/r/TheDarkTower/comments/192bvn/charlie_the_choo_choo_xpost_from_rabandonedporn/,,,False,,t5_2run7,False,,,False,t3_192bvn,http://i.imgur.com/MaVrHEA.jpg?1,
1349008410.0,121,i.imgur.com,10picf,See the TURTLE of enormous girth! On his shell he holds the earth!,135,14,11,http://www.reddit.com/r/TheDarkTower/comments/10picf/see_the_turtle_of_enormous_girth_on_his_shell_he/,,,False,,t5_2run7,False,,,False,t3_10picf,http://i.imgur.com/0NkuM.jpg,
1343921045.0,123,imgur.com,xkefh,My Dark Tower shirt (xpost with /r/bleachshirts),135,12,14,http://www.reddit.com/r/TheDarkTower/comments/xkefh/my_dark_tower_shirt_xpost_with_rbleachshirts/,,,False,,t5_2run7,False,,,False,t3_xkefh,http://imgur.com/m8HUN,
1368258117.0,119,i.imgur.com,1e4bdj,All things serve the Beam. (xpost- r/mildlyinteresting),137,18,2,http://www.reddit.com/r/TheDarkTower/comments/1e4bdj/all_things_serve_the_beam_xpost_rmildlyinteresting/,,,False,,t5_2run7,False,,,False,t3_1e4bdj,http://i.imgur.com/Ja5Kgsu.jpg,
1361227870.0,120,upload.wikimedia.org,18s2p1,Oy in real life (minus the gold ringed eyes)?,132,12,9,http://www.reddit.com/r/TheDarkTower/comments/18s2p1/oy_in_real_life_minus_the_gold_ringed_eyes/,,,False,,t5_2run7,False,,,False,t3_18s2p1,http://upload.wikimedia.org/wikipedia/commons/0/0a/Nyctereutes_procyonoides_4_%28Piotr_Kuczynski%29.jpg,
1370662791.0,120,25.media.tumblr.com,1fwpgj,Map of End-World,138,18,17,http://www.reddit.com/r/TheDarkTower/comments/1fwpgj/map_of_endworld/,,,False,,t5_2run7,False,,white,False,t3_1fwpgj,http://25.media.tumblr.com/tumblr_lpgzsnY9Cz1qdwahko1_1280.jpg,
1354845821.0,118,i.imgur.com,14f4hm,Sköldpadda found in a gas station in Mississippi,130,12,3,http://www.reddit.com/r/TheDarkTower/comments/14f4hm/sköldpadda_found_in_a_gas_station_in_mississippi/,,,False,,t5_2run7,False,,,False,t3_14f4hm,http://i.imgur.com/h6bEG.jpg,
1342745953.0,121,i.imgur.com,wuk5i,The Gunslinger:On The Beach by Michael Whelan,126,5,22,http://www.reddit.com/r/TheDarkTower/comments/wuk5i/the_gunslingeron_the_beach_by_michael_whelan/,,,False,,t5_2run7,False,,rose,False,t3_wuk5i,http://i.imgur.com/6PhGW.jpg,
1327535558.0,120,i.imgur.com,owskm,Eddie's dream inspired me. Made entirely out of magazine ads.,123,3,14,http://www.reddit.com/r/TheDarkTower/comments/owskm/eddies_dream_inspired_me_made_entirely_out_of/,,,False,,t5_2run7,False,,,False,t3_owskm,http://i.imgur.com/xdITi.jpg,
1367496114.0,120,imgur.com,1djnut,My Dark Tower-inspired Wedding Ring,128,8,14,http://www.reddit.com/r/TheDarkTower/comments/1djnut/my_dark_towerinspired_wedding_ring/,,,False,,t5_2run7,False,,,False,t3_1djnut,http://imgur.com/uS7j7SX,
1369076931.0,120,i.imgur.com,1epm4x,Found in /firstworldanarchists,144,24,3,http://www.reddit.com/r/TheDarkTower/comments/1epm4x/found_in_firstworldanarchists/,,,False,,t5_2run7,False,,,False,t3_1epm4x,http://i.imgur.com/tzX05xv.jpg?1,
