created_utc,score,domain,id,title,ups,downs,num_comments,permalink,selftext,link_flair_text,over_18,thumbnail,subreddit_id,edited,link_flair_css_class,author_flair_css_class,is_self,name,url,distinguished
1298903252.0,198,iheartnymuseums.com,fub4s,"A couple weeks ago, a nyc/redditor asked if there was a good list of NY museums and when they were free. There wasn't so I made one; hope it's useful to anyone traveling to NYC",208,10,20,http://www.reddit.com/r/travel/comments/fub4s/a_couple_weeks_ago_a_nycredditor_asked_if_there/,,,False,http://thumbs.reddit.com/t3_fub4s.png,t5_2qh41,False,,,False,t3_fub4s,http://iheartnymuseums.com/,
1369343309.0,192,i.imgur.com,1exfpg,I think Istanbul is underrated just a bit,253,61,51,http://www.reddit.com/r/travel/comments/1exfpg/i_think_istanbul_is_underrated_just_a_bit/,,,False,http://d.thumbs.redditmedia.com/DIOAcJObTiizpcxK.jpg,t5_2qh41,False,,,False,t3_1exfpg,http://i.imgur.com/IO2amDL.jpg,
1342612652.0,196,imgur.com,wr75o,Images of Occupation: some pictures from my travels through Palestine,273,77,149,http://www.reddit.com/r/travel/comments/wr75o/images_of_occupation_some_pictures_from_my/,,,False,http://e.thumbs.redditmedia.com/NHHjyQPpPkKJplf4.jpg,t5_2qh41,False,,,False,t3_wr75o,http://imgur.com/a/G0DUT#0,
1325511090.0,197,listverse.com,nzr3g,Top 10 Places You Don’t Want To Visit,247,50,66,http://www.reddit.com/r/travel/comments/nzr3g/top_10_places_you_dont_want_to_visit/,,,False,http://a.thumbs.redditmedia.com/CoOxOJLFuvGCYcZH.jpg,t5_2qh41,False,,nld,False,t3_nzr3g,http://listverse.com/2010/03/22/top-10-places-you-dont-want-to-visit/,
1370922989.0,191,i.imgur.com,1g3j8x,Since everyone is posting their Scotland beauty shots today...,221,30,7,http://www.reddit.com/r/travel/comments/1g3j8x/since_everyone_is_posting_their_scotland_beauty/,,,False,http://a.thumbs.redditmedia.com/kcBIyHxdVuVsbij0.jpg,t5_2qh41,False,,,False,t3_1g3j8x,http://i.imgur.com/8MvzE23.jpg?1,
1362865642.0,194,trinityvdp.squarespace.com,19znt5,"A bunch of students from my alma mater in Dublin are having a ""jailbreak"" competition - they have 36 hours to get as far as they can without spending any of their own money. Leading team just landed in Dubai.",219,25,57,http://www.reddit.com/r/travel/comments/19znt5/a_bunch_of_students_from_my_alma_mater_in_dublin/,,,False,default,t5_2qh41,False,,,False,t3_19znt5,http://trinityvdp.squarespace.com/trinity-jailbreak/,
1325346703.0,194,theworldgeography.com,nxkd3,Nine really unusual deserts,210,16,26,http://www.reddit.com/r/travel/comments/nxkd3/nine_really_unusual_deserts/,,,False,http://b.thumbs.redditmedia.com/lCalMidXGV3ejnRI.jpg,t5_2qh41,False,,,False,t3_nxkd3,http://www.theworldgeography.com/2011/12/9-really-unusual-deserts.html,
1364977762.0,194,i.imgur.com,1bks1j,"Hostel in Skopje, Macedonia. . . seems legit.",231,37,21,http://www.reddit.com/r/travel/comments/1bks1j/hostel_in_skopje_macedonia_seems_legit/,,,False,http://b.thumbs.redditmedia.com/70xO2ZI0GjDcHl7O.jpg,t5_2qh41,False,,,False,t3_1bks1j,http://i.imgur.com/gKgATax.jpg,
1316147284.0,191,imgur.com,khb1v,"Just got back from a ‎8,305 mile roadtrip. 12 states. 7 national parks. Here's 15 photos of the best of the Rocky Mountains + collage of wildlife.",207,16,62,http://www.reddit.com/r/travel/comments/khb1v/just_got_back_from_a_8305_mile_roadtrip_12_states/,,,False,http://thumbs.reddit.com/t3_khb1v.png,t5_2qh41,False,,,False,t3_khb1v,http://imgur.com/a/jEEEc,
1354918324.0,197,imgur.com,14gu06,"Should I be worried? Just checked my flight itinerary and it says ""FAKE FLIGHT""?",242,45,34,http://www.reddit.com/r/travel/comments/14gu06/should_i_be_worried_just_checked_my_flight/,,,False,http://d.thumbs.redditmedia.com/9xA3_OPDOw6mvMK9.jpg,t5_2qh41,False,,,False,t3_14gu06,http://imgur.com/TbAGk,
1325845966.0,195,flickr.com,o5adn,Cant wait to get back On the road again. [high up in the peruvian Andes],226,31,27,http://www.reddit.com/r/travel/comments/o5adn/cant_wait_to_get_back_on_the_road_again_high_up/,,,False,http://a.thumbs.redditmedia.com/TfFWEqncRVVcfJCH.jpg,t5_2qh41,False,,,False,t3_o5adn,http://www.flickr.com/photos/erinsitt/5949111490/in/photostream/lightbox/,
1319629731.0,195,i.imgur.com,lplb4,Awesome worldwide metro!,304,109,138,http://www.reddit.com/r/travel/comments/lplb4/awesome_worldwide_metro/,,,False,http://c.thumbs.redditmedia.com/AgXBJJKYK9JSqUD2.jpg,t5_2qh41,False,,,False,t3_lplb4,http://i.imgur.com/XI5tc.jpg,
1358956108.0,192,imgur.com,174k5b,Lomé Fetish Markets:  dried animals that people grind down into Voodoo medicine.. shame I couldn't photograph the smell.,225,33,59,http://www.reddit.com/r/travel/comments/174k5b/lomé_fetish_markets_dried_animals_that_people/,,,False,http://d.thumbs.redditmedia.com/mH9mQBzw6GMpk9mu.jpg,t5_2qh41,False,,,False,t3_174k5b,http://imgur.com/a/oDmaH,
1334678460.0,190,youtube.com,secrk,My friend Steve just released this inspiring video of exercising while travelling the globe. I think it deserves more views...,247,57,45,http://www.reddit.com/r/travel/comments/secrk/my_friend_steve_just_released_this_inspiring/,,,False,http://e.thumbs.redditmedia.com/2jYR-vxDhdf1qlfj.jpg,t5_2qh41,False,,,False,t3_secrk,http://www.youtube.com/watch?v=Av5WivuFAzk,
1330385654.0,194,imgur.com,q8tol,Cat I met at the entrance of Petra,289,95,23,http://www.reddit.com/r/travel/comments/q8tol/cat_i_met_at_the_entrance_of_petra/,,,False,http://a.thumbs.redditmedia.com/Ngp5qdK4a-TrLwMl.jpg,t5_2qh41,False,,,False,t3_q8tol,http://imgur.com/P495s,
1363209646.0,189,imgur.com,1a8pm2,"A lonely little island in the Philippine sea off the coast of Hamahiga Island in Okinawa, Japan.",211,22,14,http://www.reddit.com/r/travel/comments/1a8pm2/a_lonely_little_island_in_the_philippine_sea_off/,,,False,http://e.thumbs.redditmedia.com/GBE8jJGVQxLEXNIL.jpg,t5_2qh41,False,,,False,t3_1a8pm2,http://imgur.com/1kSOCC5,
1362745010.0,192,flickr.com,19wp7d,"View from a private helicopter over Rome and Colosseum? No, view from a Ryanair aeroplane! (1000x500)",237,45,7,http://www.reddit.com/r/travel/comments/19wp7d/view_from_a_private_helicopter_over_rome_and/,,,False,http://c.thumbs.redditmedia.com/NrkRAHN1AkQdFKqh.jpg,t5_2qh41,False,,,False,t3_19wp7d,http://www.flickr.com/photos/60509750@N08/8533956353/,
1350041962.0,193,youtube.com,11d0o9,How I feel after living for 3 months in a Muslim country (0:10 seconds in),268,75,65,http://www.reddit.com/r/travel/comments/11d0o9/how_i_feel_after_living_for_3_months_in_a_muslim/,,,False,http://d.thumbs.redditmedia.com/TRa3c52HmHgjTTvi.jpg,t5_2qh41,False,,,False,t3_11d0o9,http://www.youtube.com/watch?v=2T_obaO46Bo,
1326783699.0,189,g.co,okkak,My wife and I are 10 months into our 14 month trip. Each peg is at least one night spent at a place,213,24,114,http://www.reddit.com/r/travel/comments/okkak/my_wife_and_i_are_10_months_into_our_14_month/,,,False,http://c.thumbs.redditmedia.com/HMp-cEeqmCE68FNb.jpg,t5_2qh41,False,,,False,t3_okkak,http://g.co/maps/wtmr3,
1312737409.0,192,self.travel,jbn4w,Are Greyhound buses really that bad?,209,17,279,http://www.reddit.com/r/travel/comments/jbn4w/are_greyhound_buses_really_that_bad/,"I am planning a trip to the USA (from the UK) for next summer, and for part of it I was considering using Greyhound buses to cross the country from Miami to LA, stopping off for a couple of days at New Orleans, Austin and maybe Pheonix, before arriving in LA (all in all taking about 8 or 9 days).

That was until I did a bit of research on reddit and other travel sites such as Lonely Planet, where nearly everyone seemed to be saying that Greyhounds were basically piss-stained prisons on wheels, full of tramps and 'questionable' individuals. 

Obviously they aren't all as bad as that, but are they so bad that I should reconsider how I'm going to get from Miami to LA?
(Oh, and renting a car is not an option)

TL;DR: Are Greyhounds so bad that I should essentially avoid them at all costs?

EDIT:Thanks for all the advice, I really appreciate it! I'm going to have another look at Amtrak, in the meantime, I don't suppose anyone would have any tips of things to do in New Orleans, Austin or Phoenix that they particularly love to do? Thanks again!

EDIT 2: Wow, I never thought this many people would respond! After using the Amtrak site and Skyscanner I think I have a trip planned that doesn't involve Greyhounds whatsoever! From what's been said, it's clear that the scenery from a Greyhound has nothing on a the scenery from an Amtrak, so I've managed to build in the California Zephyr route (the whole thing) and the last part of the Coastal Starlight (going towards LA). I truly appreciate you all sharing your experiences and opinions, know that you have helped shaped my dream holiday (and first to the US). If anyone is curious of the exact route I'm taking, or the approximate costings of a months travel in the US, ask and ye shall receive. Thank you again, reddit never disappoints.",,False,self,t5_2qh41,True,,,True,t3_jbn4w,http://www.reddit.com/r/travel/comments/jbn4w/are_greyhound_buses_really_that_bad/,
1353558303.0,188,i.imgur.com,13lspt,I see your Russian McDonalds and raise you McDonalds/Burger King hybrid from Kazakhstan,217,29,23,http://www.reddit.com/r/travel/comments/13lspt/i_see_your_russian_mcdonalds_and_raise_you/,,,False,http://a.thumbs.redditmedia.com/JsO5zA2Zc9gJ2YS6.jpg,t5_2qh41,False,,can,False,t3_13lspt,http://i.imgur.com/0zpuN.jpg,
1345042650.0,188,imgur.com,y9hus,My wife and I went on a trip to Myanmar (Burma) last year. Here are some photos we took of the beautiful people there.,216,28,54,http://www.reddit.com/r/travel/comments/y9hus/my_wife_and_i_went_on_a_trip_to_myanmar_burma/,,,False,http://d.thumbs.redditmedia.com/ut2AsP93zC0LNBFi.jpg,t5_2qh41,False,,,False,t3_y9hus,http://imgur.com/a/yJGY4,
1340951975.0,189,imgur.com,vs9nz,Images from Svalbard,207,18,38,http://www.reddit.com/r/travel/comments/vs9nz/images_from_svalbard/,,,False,http://a.thumbs.redditmedia.com/rI_F2HkUrCiNUNjl.jpg,t5_2qh41,False,,usa,False,t3_vs9nz,http://imgur.com/a/TzgYI#0,
1366195516.0,187,baltictravelcompany.com,1cix3o,Travellers Guide To The Northern Lights - Contains Awesome Pictures And Video,224,37,23,http://www.reddit.com/r/travel/comments/1cix3o/travellers_guide_to_the_northern_lights_contains/,,,False,http://e.thumbs.redditmedia.com/VxkUETuK6L62dzcL.jpg,t5_2qh41,False,,,False,t3_1cix3o,http://www.baltictravelcompany.com/blog/index.php/norway/the-definitive-travellers-guide-to-the-northern-lights,
1349753269.0,188,priceoftravel.com,116epp,Backpacker Index: World cities by price per day-2012,212,24,50,http://www.reddit.com/r/travel/comments/116epp/backpacker_index_world_cities_by_price_per_day2012/,,,False,http://f.thumbs.redditmedia.com/VcozVYzV32b5qljS.jpg,t5_2qh41,False,,,False,t3_116epp,http://www.priceoftravel.com/2222/world-cities-by-price-backpacker-index/,
1321765999.0,188,i.imgur.com,mirf8,This friendly critter greets me every time I fly to Chicago.,210,22,15,http://www.reddit.com/r/travel/comments/mirf8/this_friendly_critter_greets_me_every_time_i_fly/,,,False,http://c.thumbs.redditmedia.com/mLEGKOGfyC_QX5Pz.jpg,t5_2qh41,False,,,False,t3_mirf8,http://i.imgur.com/D29lR.jpg,
1311718679.0,186,flickr.com,j0ksp,Tourists as seen by a local.,214,28,47,http://www.reddit.com/r/travel/comments/j0ksp/tourists_as_seen_by_a_local/,,,False,http://thumbs.reddit.com/t3_j0ksp.png,t5_2qh41,False,,,False,t3_j0ksp,http://www.flickr.com/photos/bigbrotherbackpacking/5978978359/in/photostream,
1308845461.0,190,self.travel,i79bs,As someone who has travelled Europe a lot...,225,35,92,http://www.reddit.com/r/travel/comments/i79bs/as_someone_who_has_travelled_europe_a_lot/,"if you are young, stop basing your entire trips around Rome/Paris/London! When you are older, and with lots more money, these places will still exist and you will be able to afford to enjoy them properly.

Central Europe- so Poland, Slovenia, Hungary, Baltic States etc will not be like they are forever. Their prices will soar, the fun outgoing atmosphere will be replaced with the placid stolid one which the Western European hubs have. Stop thinking such rubbish about crime rates, or these places being more unreliable and dodgy. You're young- go and enjoy the cheap prices, the fun atmosphere, and you can still have all the amazing scenery.",,False,self,t5_2qh41,False,,,True,t3_i79bs,http://www.reddit.com/r/travel/comments/i79bs/as_someone_who_has_travelled_europe_a_lot/,
1374104511.0,191,vimeo.com,1iit9d,"Last year I spent my life savings, and went on a trip around the world for a year. This is a video I made.",205,14,68,http://www.reddit.com/r/travel/comments/1iit9d/last_year_i_spent_my_life_savings_and_went_on_a/,,,False,http://e.thumbs.redditmedia.com/9kknb12o-1r7TgoX.jpg,t5_2qh41,False,,,False,t3_1iit9d,https://vimeo.com/70286577,
1366709518.0,186,imgur.com,1cxcwd,In case r/Travel doesn't get enough of New Zealand.,205,19,10,http://www.reddit.com/r/travel/comments/1cxcwd/in_case_rtravel_doesnt_get_enough_of_new_zealand/,,,False,http://f.thumbs.redditmedia.com/T5fE82nOclxp1YDk.jpg,t5_2qh41,False,,can,False,t3_1cxcwd,http://imgur.com/waeYOXR,
1366479302.0,188,i.imgur.com,1cr1ki,Kerala india ..,214,26,4,http://www.reddit.com/r/travel/comments/1cr1ki/kerala_india/,,,False,http://e.thumbs.redditmedia.com/9pHoaAcZfHCkWmOj.jpg,t5_2qh41,False,,,False,t3_1cr1ki,http://i.imgur.com/4w7DtS5.jpg,
1355521212.0,190,imgur.com,14v3co,this is my morning commute in Paris,204,14,17,http://www.reddit.com/r/travel/comments/14v3co/this_is_my_morning_commute_in_paris/,,,False,http://e.thumbs.redditmedia.com/gWhqR-N1XrGhpRzR.jpg,t5_2qh41,False,,,False,t3_14v3co,http://imgur.com/iPabC,
1353124280.0,190,imgur.com,13c4ho,"The beautiful city, and one of my favorite places in the world, of Nerja, Spain",214,24,19,http://www.reddit.com/r/travel/comments/13c4ho/the_beautiful_city_and_one_of_my_favorite_places/,,,False,http://a.thumbs.redditmedia.com/wmeOEfcXghMcqjvZ.jpg,t5_2qh41,False,,,False,t3_13c4ho,http://imgur.com/DUvAR,
1339830027.0,191,odditycentral.com,v4qkn,What a little beach.,221,30,9,http://www.reddit.com/r/travel/comments/v4qkn/what_a_little_beach/,,,False,http://e.thumbs.redditmedia.com/PISdU5YQbhDbmi9d.jpg,t5_2qh41,False,,,False,t3_v4qkn,http://www.odditycentral.com/pics/playa-de-gulpiyuri-a-strange-beach-in-the-middle-of-a-meadow.html,
1334511959.0,186,flickr.com,sb0nf,Rising up through the clouds (in San Marino).,200,14,4,http://www.reddit.com/r/travel/comments/sb0nf/rising_up_through_the_clouds_in_san_marino/,,,False,http://a.thumbs.redditmedia.com/KNFTeabJmlO-OeBl.jpg,t5_2qh41,False,,,False,t3_sb0nf,http://www.flickr.com/photos/bigbrotherbackpacking/7080715817/in/photostream/lightbox/,
1373419281.0,184,imgur.com,1hz5uv,"a photo my girlfriend snapped when we were in the ever-hectic la paz, bolivia",220,36,10,http://www.reddit.com/r/travel/comments/1hz5uv/a_photo_my_girlfriend_snapped_when_we_were_in_the/,,,False,default,t5_2qh41,False,,,False,t3_1hz5uv,http://imgur.com/BWl1Y7X,
1352223416.0,184,imgur.com,12qm3g,"Australia/New Zealand. July, 2012 - Imgur",215,31,38,http://www.reddit.com/r/travel/comments/12qm3g/australianew_zealand_july_2012_imgur/,,,False,http://f.thumbs.redditmedia.com/CbNuyhEzmrOdC_OS.jpg,t5_2qh41,False,,can,False,t3_12qm3g,http://imgur.com/a/RGBGH,
1320591981.0,187,totravelin.com,m2em9,Officialy decleared as MOST BEAUTIFUL town in Norway - ALESUND,208,21,32,http://www.reddit.com/r/travel/comments/m2em9/officialy_decleared_as_most_beautiful_town_in/,,,False,http://b.thumbs.redditmedia.com/VXm2gmm3PZK6_lgy.jpg,t5_2qh41,False,,,False,t3_m2em9,http://totravelin.com/alesund-art-nouveau-norway/,
1313433371.0,188,thisiscolossal.com,jjlt4,One Day on Earth: A film shot in every country in the world in a single day,204,16,13,http://www.reddit.com/r/travel/comments/jjlt4/one_day_on_earth_a_film_shot_in_every_country_in/,,,False,http://thumbs.reddit.com/t3_jjlt4.png,t5_2qh41,False,,,False,t3_jjlt4,http://thisiscolossal.com/2011/07/one-day-on-earth/,
1352427729.0,185,self.travel,12w4so,"Where is the best place to teach English abroad, and which organization should I use/avoid?",216,31,203,http://www.reddit.com/r/travel/comments/12w4so/where_is_the_best_place_to_teach_english_abroad/,"Hi r/travel!  I was going to go to law school this year, but I decided against it.  I have always wanted to travel, teach, and learn a new language.  What better way than to teach an ESL class?  

A few of my friends have been to China and Spain, but what are your experiences?  I honestly don't have a strong preference on where I go.

Which organizations pay best and are the most trustworthy?  

Do I need to get certified or take any classes beforehand, or is that just a scam?  I have been doing research, but it's hard to find an objective article that isn't trying to sell me classes.  

I have a Bachelor of Arts in English, and I'm from the US.  Thanks, guys. I appreciate your advice as I contemplate this potentially life changing experience!   

edit: I just got back from work to find all your comments.  Wow!  Thanks for the response.  I haven't read them yet, so it might take me a while. :)",,False,self,t5_2qh41,1352505385.0,,,True,t3_12w4so,http://www.reddit.com/r/travel/comments/12w4so/where_is_the_best_place_to_teach_english_abroad/,
1323362318.0,185,matadornetwork.com,n4zcq,Just a beautiful timelapse video of Saigon's infamous traffic,216,31,29,http://www.reddit.com/r/travel/comments/n4zcq/just_a_beautiful_timelapse_video_of_saigons/,,,False,http://c.thumbs.redditmedia.com/ITU0lrJmi6cM8bht.jpg,t5_2qh41,False,,,False,t3_n4zcq,http://matadornetwork.com/tv/traffic-has-never-been-this-beautiful/,
1345745207.0,183,flickr.com,yph2h,"nothing like riding off into the sunset, longboat style. ",214,31,15,http://www.reddit.com/r/travel/comments/yph2h/nothing_like_riding_off_into_the_sunset_longboat/,,,False,http://d.thumbs.redditmedia.com/vfagZk72CCUx-Xto.jpg,t5_2qh41,False,,,False,t3_yph2h,http://www.flickr.com/photos/erinsitt/7839742908/lightbox/,
1369627383.0,187,i.imgur.com,1f4axn,"Since we're posting flyover photos, here's a cool one I took flying over Chicago in December.",206,19,6,http://www.reddit.com/r/travel/comments/1f4axn/since_were_posting_flyover_photos_heres_a_cool/,,,False,http://b.thumbs.redditmedia.com/ryyyaBl4aHWwadgO.jpg,t5_2qh41,False,,,False,t3_1f4axn,http://i.imgur.com/fJtIOvY.jpg,
1361146547.0,179,i.imgur.com,18pwwr,Spent two weeks in Sydney. My favorite picture taken with my iPhone. ,219,40,17,http://www.reddit.com/r/travel/comments/18pwwr/spent_two_weeks_in_sydney_my_favorite_picture/,,,False,http://c.thumbs.redditmedia.com/neSqt7lcmhCYUvcJ.jpg,t5_2qh41,False,,,False,t3_18pwwr,http://i.imgur.com/NvjoBQb.jpg,
1355763191.0,183,imgur.com,15005r,Waiting for the sun in Machu Picchu ,205,22,11,http://www.reddit.com/r/travel/comments/15005r/waiting_for_the_sun_in_machu_picchu/,,,False,http://d.thumbs.redditmedia.com/FMWMaCocMY65GAQu.jpg,t5_2qh41,False,,,False,t3_15005r,http://imgur.com/jnO5a,
1334427124.0,178,adventuresauce.com,s9qcq,"How To Sleep For Free (How I Saved $18,000 While Traveling)",230,52,42,http://www.reddit.com/r/travel/comments/s9qcq/how_to_sleep_for_free_how_i_saved_18000_while/,,,False,http://f.thumbs.redditmedia.com/XMpij-oKb0OGSHL5.jpg,t5_2qh41,False,,,False,t3_s9qcq,http://www.adventuresauce.com/2012/01/how-to-sleep-for-free-how-i-saved-18000-while-traveling/,
1366187055.0,185,i.imgur.com,1cissb,"Ho Chi Minh, Vietnam",215,30,21,http://www.reddit.com/r/travel/comments/1cissb/ho_chi_minh_vietnam/,,,False,http://c.thumbs.redditmedia.com/fIrryVqjpysgT1cV.jpg,t5_2qh41,False,,mys,False,t3_1cissb,http://i.imgur.com/ab5QCp4.jpg,
1359227247.0,181,i.imgur.com,17bs33,On the bank of the Thames in London. My favorite of all the pictures I took on my trip to Europe.,201,20,5,http://www.reddit.com/r/travel/comments/17bs33/on_the_bank_of_the_thames_in_london_my_favorite/,,,False,http://e.thumbs.redditmedia.com/C8k7JJ3U5Un-zl34.jpg,t5_2qh41,False,,,False,t3_17bs33,http://i.imgur.com/ro9ZFWt.jpg,
1331114988.0,185,i.imgur.com,qlkmd,"I don't usually find kids that cute, but these kids melted my little Grinch heart - taken at a festival in Phayao, Thailand.",229,44,15,http://www.reddit.com/r/travel/comments/qlkmd/i_dont_usually_find_kids_that_cute_but_these_kids/,,,False,http://f.thumbs.redditmedia.com/-yqZt1SMF0mTtdTA.jpg,t5_2qh41,False,,,False,t3_qlkmd,http://i.imgur.com/ttV47.jpg,
1367253743.0,178,flickr.com,1dchji,More than 1 million visitors are expected in Amsterdam tomorrow during the Queen's abdication - I won't be there be I'm glad I could see the church in Amsterdam where the event will take place just a few days ago (1000x500) (OC),225,47,31,http://www.reddit.com/r/travel/comments/1dchji/more_than_1_million_visitors_are_expected_in/,,,False,http://c.thumbs.redditmedia.com/iUrog01NIhCYFsdh.jpg,t5_2qh41,False,,,False,t3_1dchji,http://www.flickr.com/photos/60509750@N08/8691636563/in/photostream/,
1361294175.0,177,i.imgur.com,18trvy,One of my most memorable days from a 6 week trip to Switzerland I took in 2007:,201,24,41,http://www.reddit.com/r/travel/comments/18trvy/one_of_my_most_memorable_days_from_a_6_week_trip/,,,False,http://f.thumbs.redditmedia.com/uLRzqBuSHO45G5oq.jpg,t5_2qh41,False,,,False,t3_18trvy,http://i.imgur.com/jcpnL2o.jpg,
1359126987.0,184,self.travel,179abf,Sex and hostels,237,53,191,http://www.reddit.com/r/travel/comments/179abf/sex_and_hostels/,"I'm being blunt, but I can't find much information other than don't do it in the hostels when other people are sleeping.  I was surprised this wasn't covered in ""Reddit's hosteling tips"".  Normally I couchsurf, but I don't want to intrude on the hospitality shown to me by my host.

What is the rule of thumb?  Do single people travelling alone normally get private rooms?  I would upgrade to a private room if the opportunity presented itself, but chances are it would be booked by then, or are the walls paper thin (only stayed in a hostel once before) and I get hate stares after?  I searched but couldn't find anything on it.  Obviously sex while travelling happens I'm just curious what the polite way to do it without upsetting anyone else is if there is one.",,False,self,t5_2qh41,1359142115.0,,,True,t3_179abf,http://www.reddit.com/r/travel/comments/179abf/sex_and_hostels/,
1353416869.0,180,imgur.com,13i9l2,Amsterdam - Red Light District,233,53,49,http://www.reddit.com/r/travel/comments/13i9l2/amsterdam_red_light_district/,,,False,http://b.thumbs.redditmedia.com/SNtEJ1i1JIj9OCym.jpg,t5_2qh41,False,,,False,t3_13i9l2,http://imgur.com/TWVHl,
1350998893.0,183,imgur.com,11y0o1,I had two months and $5000. Pictures from my quick round the world trip,194,11,63,http://www.reddit.com/r/travel/comments/11y0o1/i_had_two_months_and_5000_pictures_from_my_quick/,,,False,http://b.thumbs.redditmedia.com/aMCtmeYQMTEXAyXO.jpg,t5_2qh41,False,,,False,t3_11y0o1,http://imgur.com/a/nr0ZC,
1342461889.0,181,i.imgur.com,wnksn,"Hiding your emergency money, helpful on vacation. (x-post LifeProTips)",207,26,34,http://www.reddit.com/r/travel/comments/wnksn/hiding_your_emergency_money_helpful_on_vacation/,,,False,http://f.thumbs.redditmedia.com/wi0wIoHBWgpwBv__.jpg,t5_2qh41,False,,,False,t3_wnksn,http://i.imgur.com/4xTha.png,
1319099317.0,178,outside-in.typepad.com,liino,How Bad Smog in Beijing Can Be? This is How Bad...,197,19,54,http://www.reddit.com/r/travel/comments/liino/how_bad_smog_in_beijing_can_be_this_is_how_bad/,,,False,http://thumbs.reddit.com/t3_liino.png,t5_2qh41,False,,,False,t3_liino,http://outside-in.typepad.com/outside_in/2011/10/how-bad-is-the-smog-in-beijing.html,
1308572646.0,179,flickr.com,i49pc,"Spent the last week walking nonstop through the Swiss Alps. My body is now destroyed, but I wouldn't take back a single step.",217,38,73,http://www.reddit.com/r/travel/comments/i49pc/spent_the_last_week_walking_nonstop_through_the/,,,False,http://thumbs.reddit.com/t3_i49pc.png,t5_2qh41,False,,,False,t3_i49pc,http://www.flickr.com/photos/bigbrotherbackpacking/5852777212/in/photostream,
1365357916.0,179,flickr.com,1bv3dx,Stockholm - a temporary attraction for locals and tourists due to the low water level - a 17th century shipwreck showed up - maybe Danish (1000x500),204,25,11,http://www.reddit.com/r/travel/comments/1bv3dx/stockholm_a_temporary_attraction_for_locals_and/,,,False,http://d.thumbs.redditmedia.com/eRHluyDtLC6WsOzK.jpg,t5_2qh41,False,,,False,t3_1bv3dx,http://www.flickr.com/photos/60509750@N08/8625900096/in/photostream/lightbox/,
