created_utc,score,domain,id,title,ups,downs,num_comments,permalink,selftext,link_flair_text,over_18,thumbnail,subreddit_id,edited,link_flair_css_class,author_flair_css_class,is_self,name,url,distinguished
1332976929.0,456,flickr.com,ric9z,"I was Hanging out in Burma, when all of a sudden two little monks appeared with a cat. thought you guys would like it. ",526,70,43,http://www.reddit.com/r/travel/comments/ric9z/i_was_hanging_out_in_burma_when_all_of_a_sudden/,,,False,http://b.thumbs.redditmedia.com/9q7cdshyssiy2Kq7.jpg,t5_2qh41,False,,,False,t3_ric9z,http://www.flickr.com/photos/erinsitt/4532427770/in/photostream,
1353346670.0,452,i.imgur.com,13gj4l,Best view in Germany! Taken with iPhone 4.... ,644,192,86,http://www.reddit.com/r/travel/comments/13gj4l/best_view_in_germany_taken_with_iphone_4/,,,False,default,t5_2qh41,False,,,False,t3_13gj4l,http://i.imgur.com/h3SuO.jpg,
1340994935.0,454,imgur.com,vt1yx,I recently stayed in a guest house in Cambodia and found these behind a door marked 'Entry No Danger!!' [x-post from pics],636,182,63,http://www.reddit.com/r/travel/comments/vt1yx/i_recently_stayed_in_a_guest_house_in_cambodia/,,,False,http://e.thumbs.redditmedia.com/qyPNiCzftZaoqJrv.jpg,t5_2qh41,False,,,False,t3_vt1yx,http://imgur.com/031ot,
1359153548.0,449,imgur.com,17a6yx,"Favourite memory of South America - Climbing Mount Roraima, the triple border point of Venezuela, Brazil and Guyana",495,46,54,http://www.reddit.com/r/travel/comments/17a6yx/favourite_memory_of_south_america_climbing_mount/,,,False,http://d.thumbs.redditmedia.com/QtiR5ER25JSI8yjW.jpg,t5_2qh41,False,,gbr,False,t3_17a6yx,http://imgur.com/a/mk7Aj,
1372518781.0,444,i.imgur.com,1hb9qh,A pic from my recent road trip up to Alaska from Seattle.,734,290,62,http://www.reddit.com/r/travel/comments/1hb9qh/a_pic_from_my_recent_road_trip_up_to_alaska_from/,,,False,default,t5_2qh41,False,,,False,t3_1hb9qh,http://i.imgur.com/PvmVkb8.jpg,
1360167054.0,445,imgur.com,1805v3,My dream come true! The Flag Bag - A backpack with a patch for each country I've visited (so far).,561,116,117,http://www.reddit.com/r/travel/comments/1805v3/my_dream_come_true_the_flag_bag_a_backpack_with_a/,,,False,http://e.thumbs.redditmedia.com/_CB1We7JYiL6t_yL.jpg,t5_2qh41,False,,,False,t3_1805v3,http://imgur.com/a/rkBPQ,
1299959732.0,439,imgur.com,g2q1q,"Hey Reddit. I just traveled for 11.5 months on 5000 USD. This is where I went. AMA
",491,52,186,http://www.reddit.com/r/travel/comments/g2q1q/hey_reddit_i_just_traveled_for_115_months_on_5000/,,,False,http://thumbs.reddit.com/t3_g2q1q.png,t5_2qh41,False,,,False,t3_g2q1q,http://imgur.com/HSns1,
1375197563.0,444,imgur.com,1jcp3e,So I met a couple new friends in the Swiss Alps the other day,563,119,38,http://www.reddit.com/r/travel/comments/1jcp3e/so_i_met_a_couple_new_friends_in_the_swiss_alps/,,,False,http://e.thumbs.redditmedia.com/0V2yMH_oKw4XpbEv.jpg,t5_2qh41,False,,,False,t3_1jcp3e,http://imgur.com/pbpe8pM,
1372879127.0,441,imgur.com,1hl3cw,"Took a daytrip to La Paz, Bolivia a few days ago. Here is a shot of the busy street markets in El Alto, the city rapidly expanding around La Paz.",497,56,27,http://www.reddit.com/r/travel/comments/1hl3cw/took_a_daytrip_to_la_paz_bolivia_a_few_days_ago/,,,False,http://e.thumbs.redditmedia.com/_gbSj6dlcQx2K0OX.jpg,t5_2qh41,False,,usa,False,t3_1hl3cw,http://imgur.com/8CxcdA4,
1372917449.0,443,i.imgur.com,1hmakv,Trans-African overland routes...,499,56,79,http://www.reddit.com/r/travel/comments/1hmakv/transafrican_overland_routes/,,,False,http://e.thumbs.redditmedia.com/HieBg0tqQ4erqHBF.jpg,t5_2qh41,False,,hkg,False,t3_1hmakv,http://i.imgur.com/ECgR2xt.png,
1365473263.0,437,imgur.com,1byndt,"The first few times I was disappointed, now I'm starting a photo collection!",492,55,99,http://www.reddit.com/r/travel/comments/1byndt/the_first_few_times_i_was_disappointed_now_im/,,,False,http://c.thumbs.redditmedia.com/c6fCxDEsC77k8mst.jpg,t5_2qh41,False,,,False,t3_1byndt,http://imgur.com/a/LXa02/,
1356636217.0,443,imgur.com,15j5i3,"Clovelly, England. Steep car-free cobbled stone village. Album includes few pictures of cream tea for your viewing pleasure.",481,38,56,http://www.reddit.com/r/travel/comments/15j5i3/clovelly_england_steep_carfree_cobbled_stone/,,,False,http://c.thumbs.redditmedia.com/sxC_SvBiXRCp-n7z.jpg,t5_2qh41,False,,gbr,False,t3_15j5i3,http://imgur.com/a/i3Bpq,
1357253343.0,440,imgur.com,15wxl1,Flooded Catacombs of Winchester Cathedral,484,44,31,http://www.reddit.com/r/travel/comments/15wxl1/flooded_catacombs_of_winchester_cathedral/,,,False,http://d.thumbs.redditmedia.com/-h8vfaRa2XFkp_0o.jpg,t5_2qh41,False,,,False,t3_15wxl1,http://imgur.com/m50mE,
1371705007.0,436,imgur.com,1gpk6z,A photo from every national park I have visited (23 and counting),493,57,74,http://www.reddit.com/r/travel/comments/1gpk6z/a_photo_from_every_national_park_i_have_visited/,,,False,http://c.thumbs.redditmedia.com/2tbKSUgIxV3Qlw7t.jpg,t5_2qh41,False,,,False,t3_1gpk6z,http://imgur.com/a/4eTBM,
1360943792.0,437,imgur.com,18l2by,Another beautiful day in the Philippines,491,54,43,http://www.reddit.com/r/travel/comments/18l2by/another_beautiful_day_in_the_philippines/,,,False,http://a.thumbs.redditmedia.com/SIqSou45zNhN-acN.jpg,t5_2qh41,False,,,False,t3_18l2by,http://imgur.com/hK6MCiR,
1343842640.0,438,imgur.com,xikmd,"My friend drove through Nebraska yesterday. ""I'd send you more pics, but they all look the same.""",505,67,80,http://www.reddit.com/r/travel/comments/xikmd/my_friend_drove_through_nebraska_yesterday_id/,,,False,http://f.thumbs.redditmedia.com/2e4xDoys-RTfJbXY.jpg,t5_2qh41,False,,,False,t3_xikmd,http://imgur.com/pLiYt,
1351873707.0,439,i.imgur.com,12iqkp,"Went to Zion National Park, Utah and took this photo during the Angel's Landing hike",505,66,33,http://www.reddit.com/r/travel/comments/12iqkp/went_to_zion_national_park_utah_and_took_this/,,,False,http://c.thumbs.redditmedia.com/2UiKEzB3Pg24CXGJ.jpg,t5_2qh41,False,,,False,t3_12iqkp,http://i.imgur.com/LkQMs.jpg,
1342415331.0,439,self.travel,wmo0x,I studied abroad in Turkey last semester and skipped a week of classes to hop the border and hitchhike around Iraq. Here's some pics. ,503,64,134,http://www.reddit.com/r/travel/comments/wmo0x/i_studied_abroad_in_turkey_last_semester_and/,"I had a great time- Northern Iraq (Kurdistan) is a great place with a great people. I hope these pictures dispel any negative notions you might have of Iraq (at least the northern part). It's very safe and very beautiful. With the amount of development going on, I wouldn't be surprised if Northern Iraq isn't the next Dubai. 

http://imgur.com/a/YzF3Z

Edit: There was a comment that my prefacing this post with ""Kurdistan is a great place with a great people"" is racist. I spent 5 months in the Middle East and interacted with Kurds from the get-go. On couchsurfing.com the vast majority of hosts in Turkey are Kurds (a testament to their hospitality) and every time I couch surfed in Turkey I stayed with Kurds. In fact, the main reason I wanted to visit Kurdistan was to visit the homeland of these crazy nice people. Never before have I met a people so welcoming and open without anything expected in return. At first, it was surprising every time I was offered a free meal, offered lodging for the night, or invited into somebody's home (all of this done with a genuine smile). Eventually, I realized: this is just part of their culture.",,False,self,t5_2qh41,1342447108.0,,,True,t3_wmo0x,http://www.reddit.com/r/travel/comments/wmo0x/i_studied_abroad_in_turkey_last_semester_and/,
1338107787.0,433,flickr.com,u73dk,If you've ever wondered just how big the Pyramids of Giza actually are...,498,65,65,http://www.reddit.com/r/travel/comments/u73dk/if_youve_ever_wondered_just_how_big_the_pyramids/,,,False,http://e.thumbs.redditmedia.com/PXPg601w5wMM5qVj.jpg,t5_2qh41,False,,mys,False,t3_u73dk,http://www.flickr.com/photos/jubbing/7278055390/in/photostream,
1371923521.0,431,imgur.com,1gv5oq,"Taken with my phone, but still a great view. Mostar, Bosnia and Herzegovina.",475,44,21,http://www.reddit.com/r/travel/comments/1gv5oq/taken_with_my_phone_but_still_a_great_view_mostar/,,,False,http://a.thumbs.redditmedia.com/MAUvPdeMv_sbqiKH.jpg,t5_2qh41,False,,usa,False,t3_1gv5oq,http://imgur.com/l23lTj6,
1375366116.0,434,i.imgur.com,1jht68,"Machu Picchu was nice, but this is the real reason I went to Peru...",571,137,101,http://www.reddit.com/r/travel/comments/1jht68/machu_picchu_was_nice_but_this_is_the_real_reason/,,,False,http://d.thumbs.redditmedia.com/-rdbXEEMLmBnNc0i.jpg,t5_2qh41,False,,usa,False,t3_1jht68,http://i.imgur.com/YhGWM4X.jpg,
1358572797.0,433,imgur.com,16v2dt,Can someone tell me where this photo was taken? ,497,64,44,http://www.reddit.com/r/travel/comments/16v2dt/can_someone_tell_me_where_this_photo_was_taken/,,,False,http://b.thumbs.redditmedia.com/TRxl3A-xwMgJg_X1.jpg,t5_2qh41,False,,,False,t3_16v2dt,http://imgur.com/cMyh7M9,
1357075924.0,427,imgur.com,15sdmr,I'm feeling a bit of wanderlust today and was looking through my gap year photos. I think this one's my favorite and wanted to share!,510,83,101,http://www.reddit.com/r/travel/comments/15sdmr/im_feeling_a_bit_of_wanderlust_today_and_was/,,,False,default,t5_2qh41,False,,,False,t3_15sdmr,http://imgur.com/RTobc,
1335358400.0,434,imgur.com,srodj,Muslim friend planning to visit the USA.  This conversation bummed me out.,574,140,196,http://www.reddit.com/r/travel/comments/srodj/muslim_friend_planning_to_visit_the_usa_this/,,,False,http://e.thumbs.redditmedia.com/EolMjlJzeEYEKEn4.jpg,t5_2qh41,False,,,False,t3_srodj,http://imgur.com/zdw9c,
1353445248.0,431,i.imgur.com,13j157,Amazing northern light over Tromsø in Norway tonight.,462,31,47,http://www.reddit.com/r/travel/comments/13j157/amazing_northern_light_over_tromsø_in_norway/,,,False,http://b.thumbs.redditmedia.com/FA9-mmzqINTZAmVy.jpg,t5_2qh41,False,,,False,t3_13j157,http://i.imgur.com/nHfSJ.jpg,
1347699604.0,425,imgur.com,zx4pt,"I went to a little-known island in Japan named Naoshima, filled with galleries and outdoor art installations. If anyone is heading to Japan, I highly recommend it, it was one of the best things I've ever done. ",482,57,31,http://www.reddit.com/r/travel/comments/zx4pt/i_went_to_a_littleknown_island_in_japan_named/,,,False,http://c.thumbs.redditmedia.com/9T70_6soNKA2TSTJ.jpg,t5_2qh41,False,,,False,t3_zx4pt,http://imgur.com/a/3DDNH,
1343463583.0,421,imgur.com,xaiqn,Here goes nothing...,496,75,92,http://www.reddit.com/r/travel/comments/xaiqn/here_goes_nothing/,,,False,http://c.thumbs.redditmedia.com/kmo10WdGPvo1jQBJ.jpg,t5_2qh41,False,,usa,False,t3_xaiqn,http://imgur.com/a/4woNX,
1349303467.0,423,imgur.com,10wg1a,Pictures from my trip to North Korea (more will be added as I process them) (xpost from r/pics),479,56,191,http://www.reddit.com/r/travel/comments/10wg1a/pictures_from_my_trip_to_north_korea_more_will_be/,,,False,http://d.thumbs.redditmedia.com/aCwlH2qCHgW1JLWc.jpg,t5_2qh41,False,,usa,False,t3_10wg1a,http://imgur.com/a/F8H0b#0,
1347388628.0,429,i.imgur.com,zpzax,I went around the world in 50 days this summer. This is the best picture from all 9 countries I visited.,531,102,95,http://www.reddit.com/r/travel/comments/zpzax/i_went_around_the_world_in_50_days_this_summer/,,,False,http://d.thumbs.redditmedia.com/z1t1Fow8XpXLlpkc.jpg,t5_2qh41,False,,,False,t3_zpzax,http://i.imgur.com/JbAG0.jpg,
1317746636.0,421,flickr.com,l0noj,Are you like me? The only time i step inside a church is when i am on vacation?,486,65,82,http://www.reddit.com/r/travel/comments/l0noj/are_you_like_me_the_only_time_i_step_inside_a/,,,False,http://thumbs.reddit.com/t3_l0noj.png,t5_2qh41,False,,,False,t3_l0noj,http://www.flickr.com/photos/phil_marion/5479606856/in/set-72157603677465506/,
1308088586.0,421,derebikh.tumblr.com,hzrt3,My friend is leaving for Cairo today. This was his to-do list.,491,70,85,http://www.reddit.com/r/travel/comments/hzrt3/my_friend_is_leaving_for_cairo_today_this_was_his/,,,False,http://thumbs.reddit.com/t3_hzrt3.png,t5_2qh41,False,,,False,t3_hzrt3,http://derebikh.tumblr.com/post/6521489815/to-do-list-6-13-11,
1369534972.0,419,confiscatedtoothpaste.com,1f28jj,18 Strange Observations of America (from an Australian Living in the USA) Australian or American? You need to read this!,496,77,211,http://www.reddit.com/r/travel/comments/1f28jj/18_strange_observations_of_america_from_an/,,,False,http://f.thumbs.redditmedia.com/2FeBVNr8AVXT881M.jpg,t5_2qh41,False,,,False,t3_1f28jj,http://www.confiscatedtoothpaste.com/australian-living-in-the-usa/,
1363212820.0,421,imgur.com,1a8u0u,Children from around the world pose with their favorite toys,486,65,52,http://www.reddit.com/r/travel/comments/1a8u0u/children_from_around_the_world_pose_with_their/,,,False,http://f.thumbs.redditmedia.com/qQ3N_SQjL2cIhSLk.jpg,t5_2qh41,False,,,False,t3_1a8u0u,http://imgur.com/gallery/YCjuU,
1358621525.0,423,i.imgur.com,16vy2p,Hidden canals in Amsterdam,485,62,22,http://www.reddit.com/r/travel/comments/16vy2p/hidden_canals_in_amsterdam/,,,False,http://a.thumbs.redditmedia.com/Hc5XgAxdTzDfy0pH.jpg,t5_2qh41,False,,,False,t3_16vy2p,http://i.imgur.com/CauUz.jpg,
1374336259.0,412,vimeo.com,1ip6w5,My trip to Oahu with my girlfriend.,496,84,75,http://www.reddit.com/r/travel/comments/1ip6w5/my_trip_to_oahu_with_my_girlfriend/,,,False,http://b.thumbs.redditmedia.com/YIWTPwmUULfWvsgC.jpg,t5_2qh41,False,,,False,t3_1ip6w5,https://vimeo.com/68235295,
1356298298.0,419,i.imgur.com,15cbd6,Beware,475,56,25,http://www.reddit.com/r/travel/comments/15cbd6/beware/,,,False,http://e.thumbs.redditmedia.com/XBjn4ya1-5ZU98CX.jpg,t5_2qh41,False,,,False,t3_15cbd6,http://i.imgur.com/fk7Zp.jpg,
1341834336.0,416,self.travel,w9lyw,I just have to tell someone.. Today I quit my job! Getting ready for a 1 year adventure.,480,64,226,http://www.reddit.com/r/travel/comments/w9lyw/i_just_have_to_tell_someone_today_i_quit_my_job/,"Since my boss asked me to not start telling people just yet, I came here to vent :)

So I had the talk with my boss today and told him why I'd like to quit. He was surprisingly understanding and very supportive. Now begins the long 3 month notice! I imagine going to work will feel very different knowing each day brings me closer to one of my greatest adventures. 

In October my boyfriend and I will head east and we're not planning to be back until a year later. There is an overall plan, but we try not to get into too much detail. What we do know is that we'll start off with the Trans Siberian Railway, and then through eastern Asia, Australia, NZ over to South America and then all the way up north through USA and Canada. Like this: http://imgur.com/HDTQz

Wow... just writing about it makes my stomach flutter. Anyone out there who has done something similar? I think it might be a bit ambitious, but we're very open to changing things up along the way. My main concerns are about how to keep the relationship healthy (we're both kind if independent) packing, border crossings and money. We've set aside $25K each and are planning on mixing hostels with Bnb, couchsurfing, AirBnb and Wwoofing. 

**TL;DR: in 3 months [this](http://imgur.com/HDTQz) turns into reality!** 

EDIT: Oh my you people are amazing! Posted this thread and didn't get much more than downvotes so I logged out and went to bed. Woke up to this! THIS is the reason I want to travel, I wish I could meet up with all of you and share the experiences over a cup of coffee. Thank you, so much.",,False,self,t5_2qh41,1341902532.0,,,True,t3_w9lyw,http://www.reddit.com/r/travel/comments/w9lyw/i_just_have_to_tell_someone_today_i_quit_my_job/,
1372205459.0,409,aroundtheworldin80jobs.com,1h2op0,"Update: Turner from ""Around the World in 80 Jobs"" is still battling Adecco for hijacking his blog's brand. Here's his open letter to them.",473,64,35,http://www.reddit.com/r/travel/comments/1h2op0/update_turner_from_around_the_world_in_80_jobs_is/,,,False,http://c.thumbs.redditmedia.com/UBjITMmNxumuw4y2.jpg,t5_2qh41,False,,,False,t3_1h2op0,http://www.aroundtheworldin80jobs.com/even-multibillion-dollar-corporations-should-apologize-when-they-are-wrong/,
1346688747.0,410,imgur.com,za9sd,The most ridiculous safety sign I've seen in 4 years of round-the-world travels.,474,64,43,http://www.reddit.com/r/travel/comments/za9sd/the_most_ridiculous_safety_sign_ive_seen_in_4/,,,False,http://e.thumbs.redditmedia.com/Da7tA2zHcvZw4U2v.jpg,t5_2qh41,False,,,False,t3_za9sd,http://imgur.com/DIC43,
1370393018.0,414,imgur.com,1fouce,I planned my trip to Switzerland around this redditor's photo,456,42,26,http://www.reddit.com/r/travel/comments/1fouce/i_planned_my_trip_to_switzerland_around_this/,,,False,http://f.thumbs.redditmedia.com/QwhFJkzn5QQlEXvM.jpg,t5_2qh41,False,,,False,t3_1fouce,http://imgur.com/a/Eey6X,
1354189150.0,412,tynan.com,13zmh3,Hua Shan,467,55,81,http://www.reddit.com/r/travel/comments/13zmh3/hua_shan/,,,False,http://a.thumbs.redditmedia.com/bsHDgzM3HlE0wHZ6.jpg,t5_2qh41,False,,,False,t3_13zmh3,http://tynan.com/huashan,
1365424387.0,410,maps.google.com,1bwwaf,Google Street View lets you tour inside the Palace at Versailles,465,55,28,http://www.reddit.com/r/travel/comments/1bwwaf/google_street_view_lets_you_tour_inside_the/,,,False,http://e.thumbs.redditmedia.com/ZKwgjvDag0MkWzF4.jpg,t5_2qh41,False,,,False,t3_1bwwaf,"https://maps.google.com/?ll=48.805055,2.121466&amp;spn=0.002385,0.006539&amp;t=h&amp;layer=c&amp;cbll=48.805062,2.12045&amp;panoid=ld12aQu1ftMRFjgOxkqTzg&amp;cbp=12,205.7,,0,-0.17&amp;z=18",
1338255356.0,410,self.travel,u9lpy,What is the coolest most spontaneous thing to happen to you while traveling?,504,94,270,http://www.reddit.com/r/travel/comments/u9lpy/what_is_the_coolest_most_spontaneous_thing_to/,"One night I was walking around St. Petersburg (Russia not Florida) and I saw a group of street musicians.  I asked them if they knew any Beatles songs and they started playing ""Yesterday"".  They noticed English was my native tongue so they asked me to sing.  I sang with them and I have a decent voice.  So through the language of music we communicated and they started playing their favorite rock and rolls songs acoustically.  I sang along with them and we actually drew a bit of a crowd and they made decent money.  When they stopped they offered me a share and I said no they could keep it.  Then they asked if I wanted to go to a party with them and keep singing songs.  I said why not and we went to a party in an apartment and sang songs and had a great time.  
TLDR: **Sang rock songs and went to a party with a group of subway musicians in St. Petersburg.**
EDIT1:  Number 19 on my front page!!!!  Thank you guys for getting me there it is really all of your incredible stories that made that happen.  Awesome.",,False,self,t5_2qh41,1338271992.0,,,True,t3_u9lpy,http://www.reddit.com/r/travel/comments/u9lpy/what_is_the_coolest_most_spontaneous_thing_to/,
1373661454.0,410,i.imgur.com,1i6eh0,"The view of Machu Picchu from the Mt. Machu Picchu, 10,111ft.",460,50,34,http://www.reddit.com/r/travel/comments/1i6eh0/the_view_of_machu_picchu_from_the_mt_machu_picchu/,,,False,http://a.thumbs.redditmedia.com/-Smr8AJ3FJPfzkW0.jpg,t5_2qh41,False,,per,False,t3_1i6eh0,http://i.imgur.com/jXKC6dN.jpg,
1369621560.0,404,i.imgur.com,1f4548,"Wineglass Bay, Tasmania.",454,50,16,http://www.reddit.com/r/travel/comments/1f4548/wineglass_bay_tasmania/,,,False,http://d.thumbs.redditmedia.com/eo_Zp-h3c4VE0eGW.jpg,t5_2qh41,False,,,False,t3_1f4548,http://i.imgur.com/ojt8NZT.jpg,
1358949722.0,401,i.imgur.com,174dzk,A panoramic I took in the Scottish Highlands,463,62,45,http://www.reddit.com/r/travel/comments/174dzk/a_panoramic_i_took_in_the_scottish_highlands/,,,False,http://f.thumbs.redditmedia.com/X67L_lefeY0sTSZ5.jpg,t5_2qh41,False,,usa,False,t3_174dzk,http://i.imgur.com/qWRCWO5.jpg,
1365965298.0,402,flickr.com,1cc75i,Off the beaten road in Sweden - Övertorneå church is the best preserved church from the 18th century in north Sweden (1000x500) (OC),456,54,13,http://www.reddit.com/r/travel/comments/1cc75i/off_the_beaten_road_in_sweden_övertorneå_church/,,,False,http://c.thumbs.redditmedia.com/Si-nJTEcPi41qL82.jpg,t5_2qh41,False,,,False,t3_1cc75i,http://www.flickr.com/photos/60509750@N08/8646161957/lightbox/,
1360700506.0,402,imgur.com,18ealx,Swimming with pink river dolphins deep in the Amazon jungle!,453,51,62,http://www.reddit.com/r/travel/comments/18ealx/swimming_with_pink_river_dolphins_deep_in_the/,,,False,http://f.thumbs.redditmedia.com/48GqktF9Sr4K2TJY.jpg,t5_2qh41,False,,can,False,t3_18ealx,http://imgur.com/Ni5mnSU,
1341255399.0,400,imgur.com,vxqj9,cycled with a friend 16.500 km to Hong Kong -&gt; this is what we ate! ,450,50,124,http://www.reddit.com/r/travel/comments/vxqj9/cycled_with_a_friend_16500_km_to_hong_kong_this/,,,False,http://d.thumbs.redditmedia.com/t7KPJpD13mheiqq-.jpg,t5_2qh41,False,,,False,t3_vxqj9,http://imgur.com/a/oDURu#0,
1340755779.0,396,imgur.com,vnpc6,"I did a short trip to Iran 3 years ago. - Here is are 
some assorted pictures.",438,42,147,http://www.reddit.com/r/travel/comments/vnpc6/i_did_a_short_trip_to_iran_3_years_ago_here_is/,,,False,http://b.thumbs.redditmedia.com/UyjqLntyzddk1Tk1.jpg,t5_2qh41,False,,aut,False,t3_vnpc6,http://imgur.com/a/IpkwQ,
1358185137.0,400,imgur.com,16k75y,Niagara Falls from low altitude.  ,456,56,42,http://www.reddit.com/r/travel/comments/16k75y/niagara_falls_from_low_altitude/,,,False,http://f.thumbs.redditmedia.com/E7wLnuu1iMeB9gsM.jpg,t5_2qh41,False,,,False,t3_16k75y,http://imgur.com/7TxjN,
1345955597.0,397,imgur.com,yu9ev,I got the opportunity to go to Australia for about a month last year. Lady Elliot Island was one of our stops,450,53,36,http://www.reddit.com/r/travel/comments/yu9ev/i_got_the_opportunity_to_go_to_australia_for/,,,False,http://d.thumbs.redditmedia.com/53QYUlc11pRmn1vW.jpg,t5_2qh41,False,,,False,t3_yu9ev,http://imgur.com/a/7vshf,
1357173516.0,392,i.imgur.com,15uvuh,Took a drive out to the Otago Peninsula in NZ,438,46,41,http://www.reddit.com/r/travel/comments/15uvuh/took_a_drive_out_to_the_otago_peninsula_in_nz/,,,False,http://e.thumbs.redditmedia.com/QvK4bqtFjp55YSBv.jpg,t5_2qh41,False,,can,False,t3_15uvuh,http://i.imgur.com/ErhbK.jpg,
1372339434.0,390,i.imgur.com,1h6d1r,Room with a view on Guam,459,69,25,http://www.reddit.com/r/travel/comments/1h6d1r/room_with_a_view_on_guam/,,,False,http://c.thumbs.redditmedia.com/JOZ8k9_WThobvE1J.jpg,t5_2qh41,False,,,False,t3_1h6d1r,http://i.imgur.com/QnyQMqq.jpg,
1364153166.0,393,imgur.com,1axegn,View from the top of Switzerland - the Jungfraujoch,457,64,25,http://www.reddit.com/r/travel/comments/1axegn/view_from_the_top_of_switzerland_the_jungfraujoch/,,,False,http://a.thumbs.redditmedia.com/XuYVoNd_-0BU8JqT.jpg,t5_2qh41,False,,,False,t3_1axegn,http://imgur.com/a/UA8EN#0,
1363708252.0,394,imgur.com,1aljdw,Two days in Rome,432,38,33,http://www.reddit.com/r/travel/comments/1aljdw/two_days_in_rome/,,,False,http://c.thumbs.redditmedia.com/eaN995kzgPDMEJK8.jpg,t5_2qh41,False,,,False,t3_1aljdw,http://imgur.com/a/m5ZNx,
1364867896.0,399,imgur.com,1bhi7k,Cambodia,482,83,89,http://www.reddit.com/r/travel/comments/1bhi7k/cambodia/,,,False,http://f.thumbs.redditmedia.com/guOfTxjwExuvexC5.jpg,t5_2qh41,False,,,False,t3_1bhi7k,http://imgur.com/582Qfs5,
1345635127.0,391,i.imgur.com,ymsek,Here's my favourite photo from my trip to Thailand 2 months ago - Phi Phi Island,498,107,62,http://www.reddit.com/r/travel/comments/ymsek/heres_my_favourite_photo_from_my_trip_to_thailand/,,,False,http://c.thumbs.redditmedia.com/y1Www-b4AdRKNt4t.jpg,t5_2qh41,False,,aus,False,t3_ymsek,http://i.imgur.com/i07WQ.jpg,
1371239397.0,395,imgur.com,1gcx4m,"Scotland's 100 mile long ""West Highland Way"" into the middle of the highlands",432,37,54,http://www.reddit.com/r/travel/comments/1gcx4m/scotlands_100_mile_long_west_highland_way_into/,,,False,http://f.thumbs.redditmedia.com/ayt7huYKnLKvf9tA.jpg,t5_2qh41,False,,,False,t3_1gcx4m,http://imgur.com/a/6vIm1,
1359645331.0,388,reuters.com,17mr1l,"Backpacker-photographer returns from 35,000-mile journey across China: ""I think travel and immersing yourself in new cultures - that's the secret to world peace. War's not actually working."" ",468,80,68,http://www.reddit.com/r/travel/comments/17mr1l/backpackerphotographer_returns_from_35000mile/,,,False,http://c.thumbs.redditmedia.com/aSagyYtRK6ZPWcCP.jpg,t5_2qh41,False,,,False,t3_17mr1l,http://www.reuters.com/article/2013/01/31/books-authors-carter-idUSL1E9CA14U20130131,
1350159340.0,385,farm8.staticflickr.com,11ff7y,"Last day in Belize, enjoying a fire under the stars.",426,41,31,http://www.reddit.com/r/travel/comments/11ff7y/last_day_in_belize_enjoying_a_fire_under_the_stars/,,,False,http://b.thumbs.redditmedia.com/OyOxN18SUSfYlBWI.jpg,t5_2qh41,False,,,False,t3_11ff7y,http://farm8.staticflickr.com/7084/7146986363_2b64abc990_h.jpg,
1368889868.0,386,i.imgur.com,1ekupi,My attempt to seclude myself in nature didn't work out so well,467,81,40,http://www.reddit.com/r/travel/comments/1ekupi/my_attempt_to_seclude_myself_in_nature_didnt_work/,,,False,http://c.thumbs.redditmedia.com/PR5VJhBP_T-HUndt.jpg,t5_2qh41,False,,usa,False,t3_1ekupi,http://i.imgur.com/Bu0ueg3.jpg,
1362021712.0,384,stuckincustoms.smugmug.com,19dgl0,A long road in New Zealand (but I forgot exactly where I took it!!) [OC],416,32,50,http://www.reddit.com/r/travel/comments/19dgl0/a_long_road_in_new_zealand_but_i_forgot_exactly/,,,False,http://f.thumbs.redditmedia.com/bYd3zujkw0VNH8Dw.jpg,t5_2qh41,False,,,False,t3_19dgl0,http://stuckincustoms.smugmug.com/Portfolio-The-Best/your-favorites/i-dLcWhrZ/0/X3/The%20Long%20Road%20in%20NZ-X3.jpg,
