created_utc,score,domain,id,title,ups,downs,num_comments,permalink,selftext,link_flair_text,over_18,thumbnail,subreddit_id,edited,link_flair_css_class,author_flair_css_class,is_self,name,url,distinguished
1367758636.0,305,i.imgur.com,1dq9i9,"5 years after an arson attack, Namdaemun, one of Seoul's most important landmarks has re-opened yesterday.",345,40,16,http://www.reddit.com/r/travel/comments/1dq9i9/5_years_after_an_arson_attack_namdaemun_one_of/,,,False,http://c.thumbs.redditmedia.com/VkAWvDBCtAisGLph.jpg,t5_2qh41,False,,,False,t3_1dq9i9,http://i.imgur.com/5dnj2XY.jpg,
1356590965.0,299,imgur.com,15ibfv,"Niskakoski, Kuusamo, Finland ",331,32,4,http://www.reddit.com/r/travel/comments/15ibfv/niskakoski_kuusamo_finland/,,,False,http://c.thumbs.redditmedia.com/YYYAhM2r1Q0p8gT8.jpg,t5_2qh41,False,,,False,t3_15ibfv,http://imgur.com/Tmyq1,
1354642726.0,300,i.imgur.com,149qva,Relaxing in Bora Bora,475,175,166,http://www.reddit.com/r/travel/comments/149qva/relaxing_in_bora_bora/,,,False,http://d.thumbs.redditmedia.com/ZJ0b6vSlaYd4Uj59.jpg,t5_2qh41,False,,usa,False,t3_149qva,http://i.imgur.com/8OhVL.jpg,
1372673148.0,299,imgur.com,1hf2j9,Found you!,354,55,52,http://www.reddit.com/r/travel/comments/1hf2j9/found_you/,,,False,http://e.thumbs.redditmedia.com/F2O6bekJ658vEQaj.jpg,t5_2qh41,False,,,False,t3_1hf2j9,http://imgur.com/i0uXFtM,
1351488923.0,293,imgur.com,129fw1,"It's a tough life for a buffalo in Yellowstone NP, Wyoming (OC)",344,51,19,http://www.reddit.com/r/travel/comments/129fw1/its_a_tough_life_for_a_buffalo_in_yellowstone_np/,,,False,http://f.thumbs.redditmedia.com/J6V3LhtBn2RqBh2q.jpg,t5_2qh41,False,,,False,t3_129fw1,http://imgur.com/pyJJQ,
1337703291.0,298,i.imgur.com,tzf6u,A street in Rome at sunrise,347,49,28,http://www.reddit.com/r/travel/comments/tzf6u/a_street_in_rome_at_sunrise/,,,False,http://c.thumbs.redditmedia.com/cK2Nii9XNwEE51pn.jpg,t5_2qh41,False,,,False,t3_tzf6u,http://i.imgur.com/eRKHs.jpg,
1372067747.0,296,i.imgur.com,1gyl3g,Took a last minute trip to Phoenix Arizona. Was not disappointed.,348,52,27,http://www.reddit.com/r/travel/comments/1gyl3g/took_a_last_minute_trip_to_phoenix_arizona_was/,,,False,http://d.thumbs.redditmedia.com/fBRc4pH63musF3r-.jpg,t5_2qh41,False,,,False,t3_1gyl3g,http://i.imgur.com/Yz1Wmne.jpg,
1367066209.0,293,flickr.com,1d7of8,"I spent 7 days in Holland and one of my favourite spots was Kinderdijk with a large number of 18th century windmills, also UNESCO world heritage site (1000x500) (OC)",333,40,19,http://www.reddit.com/r/travel/comments/1d7of8/i_spent_7_days_in_holland_and_one_of_my_favourite/,,,False,http://c.thumbs.redditmedia.com/N7nw9Z_1P5TRMPaV.jpg,t5_2qh41,False,,,False,t3_1d7of8,http://www.flickr.com/photos/60509750@N08/8681298613/in/photostream/lightbox/,
1362409473.0,295,imgur.com,19n22e,"As requested: The rest of my trip the Zhangjiajie, China on a misty, rainy day.",335,40,32,http://www.reddit.com/r/travel/comments/19n22e/as_requested_the_rest_of_my_trip_the_zhangjiajie/,,,False,http://c.thumbs.redditmedia.com/blWQ-_1X5GqiarDn.jpg,t5_2qh41,False,,usa,False,t3_19n22e,http://imgur.com/a/OGY69,
1353787426.0,294,imgur.com,13q5a8,Amsterdam in 50 beautiful photos,331,37,62,http://www.reddit.com/r/travel/comments/13q5a8/amsterdam_in_50_beautiful_photos/,,,False,default,t5_2qh41,False,,,False,t3_13q5a8,http://imgur.com/a/nlo4J,
1365205311.0,291,imgur.com,1brmry,How I like to pay it forward after staying in a shithole of a hostel (note in comments),385,94,53,http://www.reddit.com/r/travel/comments/1brmry/how_i_like_to_pay_it_forward_after_staying_in_a/,,,False,http://f.thumbs.redditmedia.com/-7MhriG7EPwe0mCk.jpg,t5_2qh41,False,,usa,False,t3_1brmry,http://www.imgur.com/q6axjC1.jpeg,
1351811273.0,293,imgur.com,12hg08,Me and my partner went on a roadtrip across USA (San Francisco - New York) last month.  3645 miles. Here's some of our pics (warning 56!) (x-post from r/pics),340,47,103,http://www.reddit.com/r/travel/comments/12hg08/me_and_my_partner_went_on_a_roadtrip_across_usa/,,,False,http://c.thumbs.redditmedia.com/A9C_CT3oUKkk52lb.jpg,t5_2qh41,False,,,False,t3_12hg08,http://imgur.com/a/1anIx,
1350573145.0,290,matadornetwork.com,11ox7a,23 of the world’s most insane caves that you can explore,332,42,60,http://www.reddit.com/r/travel/comments/11ox7a/23_of_the_worlds_most_insane_caves_that_you_can/,,,False,http://f.thumbs.redditmedia.com/aojL5zKFGTg-C32k.jpg,t5_2qh41,False,,,False,t3_11ox7a,http://matadornetwork.com/trips/23-of-the-the-worlds-most-insane-caves-that-you-can-explore-2/,
1343806453.0,291,imgur.com,xhvfu,"Kayaking in Antarctica my sister, myself and my parents got stuck in pack ice",327,36,59,http://www.reddit.com/r/travel/comments/xhvfu/kayaking_in_antarctica_my_sister_myself_and_my/,,,False,http://d.thumbs.redditmedia.com/WNnAAjKFvagSmXUi.jpg,t5_2qh41,False,,,False,t3_xhvfu,http://imgur.com/a0XW8,
1373193256.0,291,i.imgur.com,1hspe4,Friend gets it right regarding air safety amidst the recent crash.,363,72,24,http://www.reddit.com/r/travel/comments/1hspe4/friend_gets_it_right_regarding_air_safety_amidst/,,,False,http://d.thumbs.redditmedia.com/pv0ZVzkOOW-FJhHQ.jpg,t5_2qh41,False,,,False,t3_1hspe4,http://i.imgur.com/SpiTW2h.jpg,
1363621823.0,292,imgur.com,1aj252,I've been taking pictures of my LEGO Gandalf while traveling around Europe. This is what I have so far.,334,42,16,http://www.reddit.com/r/travel/comments/1aj252/ive_been_taking_pictures_of_my_lego_gandalf_while/,,,False,http://c.thumbs.redditmedia.com/p7TLromi2pg4j4L2.jpg,t5_2qh41,False,,,False,t3_1aj252,http://imgur.com/a/C2Kht#0,
1360690520.0,292,imgur.com,18dy7i,West Bank - 2009,332,40,67,http://www.reddit.com/r/travel/comments/18dy7i/west_bank_2009/,,,False,http://f.thumbs.redditmedia.com/oNeF4mlyIKrMdKHS.jpg,t5_2qh41,False,,mex,False,t3_18dy7i,http://imgur.com/a/KcRfa,
1348508911.0,292,imgur.com,10ehqa,"Somebody asked for an imgur repost, so: Mumbai to Shanghai in 609 days, with a single photo from every stop",323,31,38,http://www.reddit.com/r/travel/comments/10ehqa/somebody_asked_for_an_imgur_repost_so_mumbai_to/,,,False,http://f.thumbs.redditmedia.com/HkOR-zaC5mLQOEmY.jpg,t5_2qh41,False,,,False,t3_10ehqa,http://imgur.com/a/JDFWy,
1332771681.0,291,imgur.com,re7pb,Just got back from 14 days on 5 islands in Hawaiʻi. 297 photos narrowed down to 28.,308,17,58,http://www.reddit.com/r/travel/comments/re7pb/just_got_back_from_14_days_on_5_islands_in/,,,False,http://e.thumbs.redditmedia.com/fWOzK2cPm8Mzz1hX.jpg,t5_2qh41,False,,,False,t3_re7pb,http://imgur.com/a/jWvPd,
1319734068.0,290,imgur.com,lr4fp,"Everyone needs to try camping in the desert, but this is how it felt waking up.",331,41,36,http://www.reddit.com/r/travel/comments/lr4fp/everyone_needs_to_try_camping_in_the_desert_but/,,,False,http://b.thumbs.redditmedia.com/JAHO0TepD_v2Yf8O.jpg,t5_2qh41,False,,can,False,t3_lr4fp,http://imgur.com/ttUdD,
1336621897.0,291,imgur.com,tfxbm,Tikal,348,57,45,http://www.reddit.com/r/travel/comments/tfxbm/tikal/,,,False,http://c.thumbs.redditmedia.com/-bEw42FREGvYwQ4P.jpg,t5_2qh41,False,,,False,t3_tfxbm,http://imgur.com/aVk7g,
1339719065.0,286,imgur.com,v2kpt,"These little fellows invited me into their village to 
stay for the night.",322,36,38,http://www.reddit.com/r/travel/comments/v2kpt/these_little_fellows_invited_me_into_their/,,,False,http://f.thumbs.redditmedia.com/h638PJh0PDf1e3he.jpg,t5_2qh41,False,,aut,False,t3_v2kpt,http://imgur.com/a/GOnwO,
1368321152.0,289,i.imgur.com,1e5ran,Covertly took a picture of Shogi players in Osaka.,328,39,17,http://www.reddit.com/r/travel/comments/1e5ran/covertly_took_a_picture_of_shogi_players_in_osaka/,,,False,http://c.thumbs.redditmedia.com/3YJJFg1C9cqACQat.jpg,t5_2qh41,False,,aus,False,t3_1e5ran,http://i.imgur.com/qyMrTuX.jpg,
1363337235.0,284,i.imgur.com,1acalo,"This is a rough plan for a cycling trip in Europe this summer. Any experiences, thoughts and suggestions are welcome. Also, feel free to join if you want.",325,41,93,http://www.reddit.com/r/travel/comments/1acalo/this_is_a_rough_plan_for_a_cycling_trip_in_europe/,,,False,http://f.thumbs.redditmedia.com/pqzW8AVrj-JunthG.jpg,t5_2qh41,False,,,False,t3_1acalo,http://i.imgur.com/vOLBPyY.jpg,
1359693186.0,285,i.imgur.com,17odxt,My favorite spot in The Gambia,338,53,14,http://www.reddit.com/r/travel/comments/17odxt/my_favorite_spot_in_the_gambia/,,,False,http://f.thumbs.redditmedia.com/ekCvaA2VjSWc1K6_.jpg,t5_2qh41,False,,,False,t3_17odxt,http://i.imgur.com/PmjeAMX.jpg,
1343931236.0,286,self.travel,xkplc,The saddest thing Rick Steves has ever said:,339,53,145,http://www.reddit.com/r/travel/comments/xkplc/the_saddest_thing_rick_steves_has_ever_said/,"""But loneliness can turn hotel rooms into depressing cells. And meals for one are often served in a puddle of silence. Big cities can be cold and ugly when the only person to talk to is yourself. Being sick and alone in a country where no one knows you is a sad and miserable experience--even in retrospect."" - Rick Steves from his book *Europe Though the Back Door.*",,False,self,t5_2qh41,False,,,True,t3_xkplc,http://www.reddit.com/r/travel/comments/xkplc/the_saddest_thing_rick_steves_has_ever_said/,
1325960756.0,289,hejorama.com,o6xy9,We sent 10 disposable cameras around the world last summer. The first camera just came back!,312,23,18,http://www.reddit.com/r/travel/comments/o6xy9/we_sent_10_disposable_cameras_around_the_world/,,,False,http://e.thumbs.redditmedia.com/ruCZLigytnpojNzp.jpg,t5_2qh41,False,,,False,t3_o6xy9,http://www.hejorama.com/articles/disposable-stories-camera-4-is-back-7692/,
1364306367.0,283,imgur.com,1b1hh6,Just got back from 15 days in New Zealand. 62 pictures of the best of NZ. ,320,37,60,http://www.reddit.com/r/travel/comments/1b1hh6/just_got_back_from_15_days_in_new_zealand_62/,,,False,http://f.thumbs.redditmedia.com/c5Er2GBZiI7AdIyw.jpg,t5_2qh41,False,,,False,t3_1b1hh6,http://imgur.com/a/MibGU,
1355160311.0,286,fbcdn-sphotos-g-a.akamaihd.net,14m1zn,"I was up in the Himalayas for my sisters birthday and had to make it up to her somehow. So, I took a picture of a monk, a ""shoe doctor"" and three other random locals wishing her a happy birthday.",344,58,28,http://www.reddit.com/r/travel/comments/14m1zn/i_was_up_in_the_himalayas_for_my_sisters_birthday/,,,False,http://e.thumbs.redditmedia.com/f4ZP-cA2PCekMSPv.jpg,t5_2qh41,False,,isl,False,t3_14m1zn,https://fbcdn-sphotos-g-a.akamaihd.net/hphotos-ak-prn1/532472_10151482164715438_1789955323_n.jpg,
1322512644.0,283,infobarrel.com,msebp,Something I feel our cities in North America are missing. Europe has awesome metro systems.,339,56,285,http://www.reddit.com/r/travel/comments/msebp/something_i_feel_our_cities_in_north_america_are/,,,False,http://e.thumbs.redditmedia.com/ZLv2KFq5mCjaMckp.jpg,t5_2qh41,False,,,False,t3_msebp,http://www.infobarrel.com/the_best_metro_systems_in_europe,
1374564948.0,285,imgur.com,1ivefj,Copenhagen hasn't disappointed so far,328,43,54,http://www.reddit.com/r/travel/comments/1ivefj/copenhagen_hasnt_disappointed_so_far/,,,False,http://e.thumbs.redditmedia.com/RkuKe33JV-tR6Bu4.jpg,t5_2qh41,False,,,False,t3_1ivefj,http://imgur.com/XIexo3s,
1366724798.0,281,goinswriter.com,1cxnqv,3 reasons to travel while you're young.,345,64,77,http://www.reddit.com/r/travel/comments/1cxnqv/3_reasons_to_travel_while_youre_young/,,,False,http://a.thumbs.redditmedia.com/oiCQql7N2OjIk0FN.jpg,t5_2qh41,False,,,False,t3_1cxnqv,http://goinswriter.com/travel-young/,
1363844066.0,280,imgur.com,1apu4t,Missing Kyoto [OC],317,37,24,http://www.reddit.com/r/travel/comments/1apu4t/missing_kyoto_oc/,,,False,http://e.thumbs.redditmedia.com/VSbJunxbNjYl_4NL.jpg,t5_2qh41,False,,,False,t3_1apu4t,http://imgur.com/a/386ql#0,
1358972107.0,286,i.imgur.com,17549y,Traditional Romanian food shack (x-post from r/FoodPorn),321,35,28,http://www.reddit.com/r/travel/comments/17549y/traditional_romanian_food_shack_xpost_from/,,,False,http://e.thumbs.redditmedia.com/YP8JL-u9u12yK5Dp.jpg,t5_2qh41,False,,,False,t3_17549y,http://i.imgur.com/K5L4JyB.jpg,
1349724500.0,284,flickr.com,115hyg,I love strolling in the Stockholm Old Town [1024 x 682] [OC],323,39,21,http://www.reddit.com/r/travel/comments/115hyg/i_love_strolling_in_the_stockholm_old_town_1024_x/,,,False,http://a.thumbs.redditmedia.com/qigOqz3PA9DQ9IA6.jpg,t5_2qh41,False,,,False,t3_115hyg,http://www.flickr.com/photos/60509750@N08/8058239962/lightbox,
1332608988.0,284,self.travel,rbk3i,My partner and I hitchhiked from Cancun to Tierra del Fuego on a $5/day budget for 13 months. I'm happy to answer any questions about shoestring traveling/hitchhiking. AMA,322,38,126,http://www.reddit.com/r/travel/comments/rbk3i/my_partner_and_i_hitchhiked_from_cancun_to_tierra/,"After graduating from college, my partner and I decided to have an adventure while we were still young and unfettered by commitments. So we bought the cheapest flight to Mexico from Washington DC: Cancun. From there, we hitchhiked through Mexico, Central America, and South America for 13 months, until the southernmost city of the Americas, Ushuaia in Tierra del Fuego. Of course, it was a great experience - a lesson of hospitality, frugal living, language learning, and cultures.

We had never hitchhiked before in our lives, but we picked up the ropes quickly. Mexico was the perfect starting ground - hitchhiking is a widely-accepted practice there, and the senors and senoritas are very happy to help anyone out there. We never stayed in hostels - we stealth-camped with our tent, asked people and police where we could camp, got invited into their homes and stations quite often with wonderful hospitality. We also WWOOFed (in Mexico and Argentina), and used couchsurfing (we must've couchsurfed at least once almost every country we've been in).

And yes, we made it under $5 a day for food, travel, and lodging. Since lodging is free, travel is free, we only had to worry about spending on food and miscellaneous stuff, and we ate cheap street food and never got sick. 

It should be said that we are both Deaf and do not speak one word between us (we sign with each other... and no, sign language isn't universal), but we got along with the locals just fine with our pen and paper (hablamos español bien bastante). I saved all of the conversations i've had with people on paper in my backpack. I still have them, waiting for the right moment and inspiration to seize me into writing a book or something.

So ask me anything you might want to know about traveling in such a fashion or about the places.

Countries we hitchhiked: Mexico, Guatemala, Belize, El Salvador, Honduras, Nicaragua, Costa Rica, Panama, Colombia, Ecuador, Peru, Bolivia, Chile, Argentina, Uruguay. (we actually went north from Ushuaia to see the Iguazu Falls then returned to Buenos Aires to catch the flight back to the states.)

Here's some of the pics I thought you might find interesting:

http://imgur.com/a/epJ3D#0",,False,self,t5_2qh41,False,,,True,t3_rbk3i,http://www.reddit.com/r/travel/comments/rbk3i/my_partner_and_i_hitchhiked_from_cancun_to_tierra/,
1356710161.0,281,i.imgur.com,15kr0l,Just a lovely 'Chinese Gondola' ride in chilly Shanghai  ,327,46,22,http://www.reddit.com/r/travel/comments/15kr0l/just_a_lovely_chinese_gondola_ride_in_chilly/,,,False,http://f.thumbs.redditmedia.com/eCNUoXYA9hPsKJHw.jpg,t5_2qh41,False,,mys,False,t3_15kr0l,http://i.imgur.com/NXuJW.jpg,
1340567384.0,280,imgur.com,vjau8,My trip to Buzludzha communist monument in Bulgaria. Best abandoned building exploration ever!,309,29,34,http://www.reddit.com/r/travel/comments/vjau8/my_trip_to_buzludzha_communist_monument_in/,,,False,http://f.thumbs.redditmedia.com/LYp6ZgGmUvHYztG5.jpg,t5_2qh41,False,,,False,t3_vjau8,http://imgur.com/a/IiFtG,
1332534578.0,280,imgur.com,rah9g,My travel kit for two years+ of traveling (vagabonding) through Latin America.,311,31,151,http://www.reddit.com/r/travel/comments/rah9g/my_travel_kit_for_two_years_of_traveling/,,,False,http://d.thumbs.redditmedia.com/ZNHx8sjF7OxYLSDE.jpg,t5_2qh41,False,,,False,t3_rah9g,http://imgur.com/rRLpX,
1354960292.0,277,imgur.com,14hrb2,"I went to this temple for the first time today. I've lived only 15 minutes from it for over a year. Reddit, what are some of the things you've never been to that you live close to?",319,42,208,http://www.reddit.com/r/travel/comments/14hrb2/i_went_to_this_temple_for_the_first_time_today/,,,False,http://c.thumbs.redditmedia.com/4jHZhtW-UGBj-1xt.jpg,t5_2qh41,False,,,False,t3_14hrb2,http://imgur.com/menPg,
1341480533.0,278,i.imgur.com,w2jps,I'm on a working holiday in OZ and saw a venomous blue ringed octopus!  Tell me about your wildlife encounters while traveling.,318,40,99,http://www.reddit.com/r/travel/comments/w2jps/im_on_a_working_holiday_in_oz_and_saw_a_venomous/,,,False,http://d.thumbs.redditmedia.com/eREZv_gxlnw99yju.jpg,t5_2qh41,False,,,False,t3_w2jps,http://i.imgur.com/j2ow8.jpg,
1337572430.0,280,imgur.com,tx040,Rush Hour - Northern Laos,324,44,23,http://www.reddit.com/r/travel/comments/tx040/rush_hour_northern_laos/,,,False,http://c.thumbs.redditmedia.com/S9Wl9Ae35K79z1YP.jpg,t5_2qh41,False,,,False,t3_tx040,http://imgur.com/Ez8Kk,
1373889114.0,277,imgur.com,1ic1ji,Best hoilday ever: Crete was so beautiful that it seemed surreal,313,36,23,http://www.reddit.com/r/travel/comments/1ic1ji/best_hoilday_ever_crete_was_so_beautiful_that_it/,,,False,http://b.thumbs.redditmedia.com/rGQ7K9v04m-G7TRs.jpg,t5_2qh41,False,,,False,t3_1ic1ji,http://imgur.com/a/2rqjT,
1356254154.0,279,i.imgur.com,15bkko,One of my favorite pics - Sitting near Tokyo Bay,326,47,23,http://www.reddit.com/r/travel/comments/15bkko/one_of_my_favorite_pics_sitting_near_tokyo_bay/,,,False,http://c.thumbs.redditmedia.com/UqhWTJRO0B1T0XJ2.jpg,t5_2qh41,False,,,False,t3_15bkko,http://i.imgur.com/adndP.jpg,
1355979553.0,281,imgur.com,155h5i,"On my first cakeday, I want to share pictures from Zermatt. Paragliding over the Swiss Alps was the best birthday present I've ever received!",462,181,26,http://www.reddit.com/r/travel/comments/155h5i/on_my_first_cakeday_i_want_to_share_pictures_from/,,,False,http://a.thumbs.redditmedia.com/7R_3ZUYVkolxNEAB.jpg,t5_2qh41,False,,,False,t3_155h5i,http://imgur.com/a/DjbXD,
1338547407.0,276,youtube.com,ufg05,This seems to be the best country in the world,330,54,80,http://www.reddit.com/r/travel/comments/ufg05/this_seems_to_be_the_best_country_in_the_world/,,,False,http://c.thumbs.redditmedia.com/GkXf4HbxRPPZyB72.jpg,t5_2qh41,False,,,False,t3_ufg05,http://www.youtube.com/watch?v=HG92NUXKzZ0,
1354616188.0,278,i.imgur.com,1498gi,"Sailing through the Grand Canal, Venice",328,50,33,http://www.reddit.com/r/travel/comments/1498gi/sailing_through_the_grand_canal_venice/,,,False,default,t5_2qh41,False,,,False,t3_1498gi,http://i.imgur.com/6AOl8.jpg,
1347414667.0,277,imgur.com,zqrzj,"My wife and I planned our dream honeymoon.  A month: Fiji, New Zealand, Vietnam, a day in Japan. Worth every one of the 1 Million pennies we spent.  Here are a few of our favorite pictures.",315,38,44,http://www.reddit.com/r/travel/comments/zqrzj/my_wife_and_i_planned_our_dream_honeymoon_a_month/,,,False,http://f.thumbs.redditmedia.com/Rz1bt8DzhgMvw_m_.jpg,t5_2qh41,False,,,False,t3_zqrzj,http://imgur.com/a/X0hhj,
1345485886.0,272,imgur.com,yj8ho,"A photo I took during my travels around Europe this summer: Beer and Bernese Alps, Mürren, Switzerland",325,53,38,http://www.reddit.com/r/travel/comments/yj8ho/a_photo_i_took_during_my_travels_around_europe/,,,False,http://a.thumbs.redditmedia.com/B_BSoVcpJM3aQk-r.jpg,t5_2qh41,False,,can,False,t3_yj8ho,http://imgur.com/tcfkw,
1345331826.0,271,i.imgur.com,yg5hq,"9,517 Miles, 68 Days, 211 Hours of Driving, &amp; 26 States. ",316,45,46,http://www.reddit.com/r/travel/comments/yg5hq/9517_miles_68_days_211_hours_of_driving_26_states/,,,False,http://a.thumbs.redditmedia.com/Fk3T_iIFGJXmrEiT.jpg,t5_2qh41,False,,,False,t3_yg5hq,http://i.imgur.com/mTnVw.jpg,
1344713209.0,274,flickr.com,y25bt,"Hiked up some crazy Limestone Mountain to snap this photo. Krabi, Thailand. ",300,26,44,http://www.reddit.com/r/travel/comments/y25bt/hiked_up_some_crazy_limestone_mountain_to_snap/,,,False,http://f.thumbs.redditmedia.com/o7MeUQeibMPUQ43S.jpg,t5_2qh41,False,,,False,t3_y25bt,http://www.flickr.com/photos/erinsitt/7756576074/in/photostream/lightbox/,
1331352087.0,275,imgur.com,qpvvi,I miss switzerland. going down this was so much fun!,316,41,43,http://www.reddit.com/r/travel/comments/qpvvi/i_miss_switzerland_going_down_this_was_so_much_fun/,,,False,http://a.thumbs.redditmedia.com/wrwPs66txYKz281B.jpg,t5_2qh41,False,,,False,t3_qpvvi,http://imgur.com/ltiLY,
1309188194.0,275,i.imgur.com,iae1m,My aunty has been traveling the world... here is here with a sloth,404,129,50,http://www.reddit.com/r/travel/comments/iae1m/my_aunty_has_been_traveling_the_world_here_is/,,,False,http://thumbs.reddit.com/t3_iae1m.png,t5_2qh41,False,,,False,t3_iae1m,http://i.imgur.com/rfktD.jpg,
1364674305.0,278,imgur.com,1bbhld,My Favorite picture I took in Amsterdam. A Cold March day 7 years ago.,348,70,41,http://www.reddit.com/r/travel/comments/1bbhld/my_favorite_picture_i_took_in_amsterdam_a_cold/,,,False,http://f.thumbs.redditmedia.com/hw1_S1TMBvd_ZFqk.jpg,t5_2qh41,False,,,False,t3_1bbhld,http://imgur.com/oPPA2Jc,
1336304057.0,273,i.imgur.com,t9l3o,in-flight WIFI. I'm a fan of it.,344,71,66,http://www.reddit.com/r/travel/comments/t9l3o/inflight_wifi_im_a_fan_of_it/,,,False,http://d.thumbs.redditmedia.com/jf8DmXRykK6wkGt3.jpg,t5_2qh41,False,,,False,t3_t9l3o,http://i.imgur.com/Fy2YT.jpg,
1371093844.0,273,imgur.com,1g8ths,"Since you loved my pic from Manorola, here is the other top photo from my trip (Neuschwanstein Castle in Germany)!",317,44,58,http://www.reddit.com/r/travel/comments/1g8ths/since_you_loved_my_pic_from_manorola_here_is_the/,,,False,http://e.thumbs.redditmedia.com/nB6tPS62hg4G-7CR.jpg,t5_2qh41,False,,,False,t3_1g8ths,http://imgur.com/IJsjJMu,
1376139707.0,273,imgur.com,1k3565,"I travelled recently to Mount Athos in Greece,a peninsula with monasteries open only to men.These are my best photos.",335,62,38,http://www.reddit.com/r/travel/comments/1k3565/i_travelled_recently_to_mount_athos_in_greecea/,,,False,http://c.thumbs.redditmedia.com/FBSZOWMHxb4AUn5b.jpg,t5_2qh41,False,,,False,t3_1k3565,http://imgur.com/a/D7lvL#0,
1358639152.0,271,i.imgur.com,16wgkw,My connection flight is on the exact date and time. I've gone around the world and about to gain a day in my life,317,46,36,http://www.reddit.com/r/travel/comments/16wgkw/my_connection_flight_is_on_the_exact_date_and/,,,False,http://c.thumbs.redditmedia.com/XuPAEX-8tfuz3ryz.jpg,t5_2qh41,False,,,False,t3_16wgkw,http://i.imgur.com/Vzm18Uy.jpg,
1346377663.0,267,imgur.com,z41g0,Looking into the Gulf of Thailand ,303,36,17,http://www.reddit.com/r/travel/comments/z41g0/looking_into_the_gulf_of_thailand/,,,False,http://b.thumbs.redditmedia.com/K-ebH9HadYXP7yYg.jpg,t5_2qh41,False,,usa,False,t3_z41g0,http://imgur.com/mKUSo,
1352951129.0,270,imgur.com,137z8u,"I haven't been a lot of places yet, but this was the best - Istanbul, Turkey",323,53,52,http://www.reddit.com/r/travel/comments/137z8u/i_havent_been_a_lot_of_places_yet_but_this_was/,,,False,http://b.thumbs.redditmedia.com/TXbeT3ewv4n-V3_U.jpg,t5_2qh41,False,,,False,t3_137z8u,http://imgur.com/WE48n,
1346079113.0,269,thecoolhunter.net,ywlou,Four Seasons Hotel - Bora Bora! ,310,41,56,http://www.reddit.com/r/travel/comments/ywlou/four_seasons_hotel_bora_bora/,,,False,http://e.thumbs.redditmedia.com/F-3a_J3ukLvCQZQF.jpg,t5_2qh41,False,,,False,t3_ywlou,http://www.thecoolhunter.net/images/bora.jpg,
1369442442.0,267,imgur.com,1f06r9,"Jerónimos Monastery, from a recent trip to Lisbon",305,38,30,http://www.reddit.com/r/travel/comments/1f06r9/jerónimos_monastery_from_a_recent_trip_to_lisbon/,,Portugal,False,http://a.thumbs.redditmedia.com/NcugoNzWDw3kXD46.jpg,t5_2qh41,False,,gbr,False,t3_1f06r9,http://imgur.com/nGf2OMV,
1357320306.0,268,flickr.com,15yiwg,"Only 20 minutes with the express train from Shanghai you find the so called ""Venice of China"" - Suzhou [1000x500] [OC]",310,42,27,http://www.reddit.com/r/travel/comments/15yiwg/only_20_minutes_with_the_express_train_from/,,,False,http://c.thumbs.redditmedia.com/j0n4SVKi8Ha6x3cz.jpg,t5_2qh41,False,,,False,t3_15yiwg,http://www.flickr.com/photos/60509750@N08/8341863213/in/photostream,
1375560984.0,270,imgur.com,1jn5a6,Go to South Albania and see this underrated history.,311,41,32,http://www.reddit.com/r/travel/comments/1jn5a6/go_to_south_albania_and_see_this_underrated/,,,False,http://e.thumbs.redditmedia.com/T5cifiMgUj9MKZkF.jpg,t5_2qh41,False,,usa,False,t3_1jn5a6,http://imgur.com/a/OYjZH?gallery,
1370902873.0,268,imgur.com,1g2rhk,In May I visited Iran and recreated photos of my family taken when they lived there in the 70s (cross-post from /r/pics),304,36,21,http://www.reddit.com/r/travel/comments/1g2rhk/in_may_i_visited_iran_and_recreated_photos_of_my/,,,False,http://a.thumbs.redditmedia.com/Ir3WRanKTReGX8fl.jpg,t5_2qh41,False,,gbr,False,t3_1g2rhk,http://imgur.com/a/N50ZJ,
1370572921.0,268,buzzfeed.com,1fu5jk,41 Camping Hacks That Are Borderline Genius,491,223,106,http://www.reddit.com/r/travel/comments/1fu5jk/41_camping_hacks_that_are_borderline_genius/,,,False,http://a.thumbs.redditmedia.com/XYi6lhM5Ya7LAjPf.jpg,t5_2qh41,False,,,False,t3_1fu5jk,http://www.buzzfeed.com/peggy/camping-hacks-that-are-borderline-genius?s=mobile,
1363043705.0,266,imgur.com,1a41my,My dad is in Japan and sent me this beautiful photo of Mount Fuji,319,53,11,http://www.reddit.com/r/travel/comments/1a41my/my_dad_is_in_japan_and_sent_me_this_beautiful/,,,False,http://d.thumbs.redditmedia.com/TuYaJ6n_nyoBgSN-.jpg,t5_2qh41,False,,,False,t3_1a41my,http://imgur.com/C384z7S,
1355630852.0,269,imgur.com,14xdud,"Tikal, Guatemala ",295,26,41,http://www.reddit.com/r/travel/comments/14xdud/tikal_guatemala/,,,False,http://d.thumbs.redditmedia.com/h62ttowoKpoGepao.jpg,t5_2qh41,False,,,False,t3_14xdud,http://imgur.com/wXgGm,
