created_utc,score,domain,id,title,ups,downs,num_comments,permalink,selftext,link_flair_text,over_18,thumbnail,subreddit_id,edited,link_flair_css_class,author_flair_css_class,is_self,name,url,distinguished
1362109507.0,2843,imgur.com,19fx7g,"I remember a little girl wearing a traditional dress. I took a picture of her. She told me something in Farsi and she ran away. After a while she came back ready for taking another picture. “I went to take the scarf, I’m more beautiful like this” Hamed translated me. proficiscorestvivo.",5287,2444,158,http://www.reddit.com/r/travel/comments/19fx7g/i_remember_a_little_girl_wearing_a_traditional/,,,False,http://a.thumbs.redditmedia.com/NjpJXNtRbgZ04ZSZ.jpg,t5_2qh41,False,,,False,t3_19fx7g,http://imgur.com/OwRigLL,
1375622381.0,2783,imgur.com,1jofu5,Catching this as I woke up was amazing,4947,2164,178,http://www.reddit.com/r/travel/comments/1jofu5/catching_this_as_i_woke_up_was_amazing/,,,False,http://b.thumbs.redditmedia.com/JSnScPfkIA3oV7og.jpg,t5_2qh41,False,,usa,False,t3_1jofu5,http://imgur.com/a/Z9rva,
1358319244.0,2729,lh5.ggpht.com,16o8lx,"Me and a friend before and after 6 months of motorbike travel through Asia. we didn't wash our shirt or jeans, shave, or pay to sleep the whole trip.",5190,2461,725,http://www.reddit.com/r/travel/comments/16o8lx/me_and_a_friend_before_and_after_6_months_of/,,,False,http://d.thumbs.redditmedia.com/eej0GbmF7kY3k9t3.jpg,t5_2qh41,False,,usa,False,t3_16o8lx,http://lh5.ggpht.com/-H9KZH3LKwmk/UGDKBmhm22I/AAAAAAAAHfg/9sV6BbiVGF8/BEFORE-AND-AFTER-INDIA-copy8.jpg,
1370172564.0,2580,i.imgur.com,1fijfu,"Thanks to CouchSurfing, this has been my view for the last three days",4132,1552,131,http://www.reddit.com/r/travel/comments/1fijfu/thanks_to_couchsurfing_this_has_been_my_view_for/,,,False,http://a.thumbs.redditmedia.com/BR4EQu5bXJsyMsk6.jpg,t5_2qh41,False,,,False,t3_1fijfu,http://i.imgur.com/byeyTIH.jpg,
1375307857.0,2504,i.imgur.com,1jg919,Best text I've ever gotten at 3am (other than a booty call),4607,2103,156,http://www.reddit.com/r/travel/comments/1jg919/best_text_ive_ever_gotten_at_3am_other_than_a/,,,False,http://b.thumbs.redditmedia.com/poUupY8UHkuqMO-I.jpg,t5_2qh41,False,,,False,t3_1jg919,http://i.imgur.com/coH7Nfk.jpg,
1371174219.0,2332,i.imgur.com,1gb6pf,Sums up my thoughts right about now.,4976,2644,342,http://www.reddit.com/r/travel/comments/1gb6pf/sums_up_my_thoughts_right_about_now/,,,False,http://a.thumbs.redditmedia.com/00WpemEEHwQ0Z_ml.jpg,t5_2qh41,False,,,False,t3_1gb6pf,http://i.imgur.com/Z6wLcbr.png,
1353588558.0,2245,imgur.com,13m9yc,"My girlfriend always took a couple small plush toys with us when we travelled.  We’re in Mexico on vacation, hung over, and decide to stage a scene for housekeeping.  They appreciated it enough to reply with one of their own.",3023,778,66,http://www.reddit.com/r/travel/comments/13m9yc/my_girlfriend_always_took_a_couple_small_plush/,,,False,http://e.thumbs.redditmedia.com/epHbx_HBCjUZATJv.jpg,t5_2qh41,False,,,False,t3_13m9yc,http://imgur.com/a/pdeKr,
1348669510.0,2203,i.imgur.com,10i9w3,What I wish I could convince people about travelling...,3079,876,335,http://www.reddit.com/r/travel/comments/10i9w3/what_i_wish_i_could_convince_people_about/,,,False,http://e.thumbs.redditmedia.com/hblhoCvNKpqLcZAF.jpg,t5_2qh41,False,,hkg,False,t3_10i9w3,http://i.imgur.com/xcLpX.jpg,
1359411118.0,2201,timdoddphotography.com,17ge15,"I was disappointed when I got to the top of the Empire State Building. It was snowing, cold and visibility was awful! Looking back, I'd say it was pretty worth it!",3310,1109,110,http://www.reddit.com/r/travel/comments/17ge15/i_was_disappointed_when_i_got_to_the_top_of_the/,,,False,http://b.thumbs.redditmedia.com/nCn-a62HJeh3AK9C.jpg,t5_2qh41,False,,,False,t3_17ge15,http://timdoddphotography.com/blog/wp-content/uploads/2013/01/NYC-8625-web.jpg,
1373068258.0,2167,imgur.com,1hpy80,Hubby and I are finishing our 3 year tour in Japan. Thought I'd share our favorite travel pics from our time in Asia.,3028,861,208,http://www.reddit.com/r/travel/comments/1hpy80/hubby_and_i_are_finishing_our_3_year_tour_in/,,,False,http://b.thumbs.redditmedia.com/PccX81LAnlbrQeCI.jpg,t5_2qh41,False,,,False,t3_1hpy80,http://imgur.com/a/rx68q,
1366095753.0,2086,i.imgur.com,1cg5jn,"Today whilst waiting for lassi in Jodhpur: ""Hey white boy! Your moustache is no good - my moustache is beautiful. You take photo now.""",2739,653,93,http://www.reddit.com/r/travel/comments/1cg5jn/today_whilst_waiting_for_lassi_in_jodhpur_hey/,,,False,http://f.thumbs.redditmedia.com/2hVubhkjyLnlEv45.jpg,t5_2qh41,False,,,False,t3_1cg5jn,http://i.imgur.com/TDDwgkf.jpg,
1362902247.0,2089,i.imgur.com,1a0kz6,"My guide and I slept in hammocks over a flooded Amazon forest, with stars above and piranhas below. ",2617,528,98,http://www.reddit.com/r/travel/comments/1a0kz6/my_guide_and_i_slept_in_hammocks_over_a_flooded/,,,False,http://a.thumbs.redditmedia.com/G19QUzu1XKx-bVlB.jpg,t5_2qh41,False,,,False,t3_1a0kz6,http://i.imgur.com/AKkMzEd.jpg,
1363990684.0,2029,i.imgur.com,1atrp2,Up at 6am to catch the sunrise in the Himalayas,2618,589,68,http://www.reddit.com/r/travel/comments/1atrp2/up_at_6am_to_catch_the_sunrise_in_the_himalayas/,,,False,default,t5_2qh41,False,,,False,t3_1atrp2,http://i.imgur.com/lepMNRA.jpg,
1352574456.0,1875,i.imgur.com,12z2qm,My sister sent me a picture of her pleasant afternoon in Ecuador.,2290,415,48,http://www.reddit.com/r/travel/comments/12z2qm/my_sister_sent_me_a_picture_of_her_pleasant/,,,False,http://b.thumbs.redditmedia.com/I7B-BAo4cDQ24TrO.jpg,t5_2qh41,False,,esp,False,t3_12z2qm,http://i.imgur.com/ju2Se.jpg,
1370431919.0,1833,i.imgur.com,1fpr80,Venice at sunset - taken on iphone as my camera was dead!,2589,756,73,http://www.reddit.com/r/travel/comments/1fpr80/venice_at_sunset_taken_on_iphone_as_my_camera_was/,,,False,http://e.thumbs.redditmedia.com/wN8lzT5dh6KwjC4v.jpg,t5_2qh41,False,,aus,False,t3_1fpr80,http://i.imgur.com/ElyPrr5.jpg,
1368484465.0,1823,imgur.com,1e9wpx,"I received a ""Wreck This Journal"" as a gift before I left for a month long backpacking trip through Europe a few years ago. I took it with me and it ended up being a really great interactive souvenir! Here are some of my favourite pages.",2265,442,134,http://www.reddit.com/r/travel/comments/1e9wpx/i_received_a_wreck_this_journal_as_a_gift_before/,,,False,http://b.thumbs.redditmedia.com/_Q3EDVlvuhE634Ca.jpg,t5_2qh41,False,,,False,t3_1e9wpx,http://imgur.com/a/tadQc,
1371580572.0,1757,imgur.com,1glmt0,Which road do I take?,2385,628,40,http://www.reddit.com/r/travel/comments/1glmt0/which_road_do_i_take/,,,False,http://a.thumbs.redditmedia.com/JSIQj_w7KVIvRv96.jpg,t5_2qh41,False,,,False,t3_1glmt0,http://imgur.com/A9ygSU7,
1356150623.0,1650,pdnphotooftheday.com,159lhd,"TIL I must visit Lauterbrunnen, Switzerland immediately",1967,317,142,http://www.reddit.com/r/travel/comments/159lhd/til_i_must_visit_lauterbrunnen_switzerland/,,,False,http://a.thumbs.redditmedia.com/f3p42cQh7uFXyWaN.jpg,t5_2qh41,False,,,False,t3_159lhd,http://www.pdnphotooftheday.com/wp-content/uploads/2009/06/swit_04.jpg,
1371778676.0,1644,aroundtheworldin80jobs.com,1grn0y,"The ""Around The World in 80 Jobs"" blogger has had his concept stolen and name trademarked by Adecco.",2033,389,133,http://www.reddit.com/r/travel/comments/1grn0y/the_around_the_world_in_80_jobs_blogger_has_had/,,,False,http://c.thumbs.redditmedia.com/0C4B68u397YIqq6V.jpg,t5_2qh41,False,,,False,t3_1grn0y,http://aroundtheworldin80jobs.com/how-i-got-fired-from-the-job-i-invented/,
1353243593.0,1626,imgur.com,13eapw,I traveled from Cape Town to London overground via public transport here are my favorite photos. (x-post /pics),1858,232,182,http://www.reddit.com/r/travel/comments/13eapw/i_traveled_from_cape_town_to_london_overground/,,,False,http://d.thumbs.redditmedia.com/Pm-gbudjoKbSd0OW.jpg,t5_2qh41,False,,,False,t3_13eapw,http://imgur.com/a/PVAgQ,
1353856426.0,1616,imgur.com,13rer1,The Top 15 Photos from my Solo Trip to New Zealand,1986,370,148,http://www.reddit.com/r/travel/comments/13rer1/the_top_15_photos_from_my_solo_trip_to_new_zealand/,,,True,nsfw,t5_2qh41,False,,,False,t3_13rer1,http://imgur.com/a/UgyNe,
1360581461.0,1608,i.imgur.com,18axz0,"Me, rowing over the Ganges in Varanasi, India. I also passed bathing worshippers, bloated floating cow-corpses, a lot of trash, and burning dead people on traditional pyres.",2077,469,194,http://www.reddit.com/r/travel/comments/18axz0/me_rowing_over_the_ganges_in_varanasi_india_i/,,,False,http://d.thumbs.redditmedia.com/VeZLcvTXOh0RMaiQ.jpg,t5_2qh41,False,,,False,t3_18axz0,http://i.imgur.com/60OsBXU.jpg,
1359513488.0,1553,imgur.com,17jc21,"I've seen a lot of llama photos at Machu Picchu in Peru, but this one takes the cake.",1963,410,45,http://www.reddit.com/r/travel/comments/17jc21/ive_seen_a_lot_of_llama_photos_at_machu_picchu_in/,,,False,http://b.thumbs.redditmedia.com/wI1eDrZ3LCJAGn8C.jpg,t5_2qh41,False,,,False,t3_17jc21,http://imgur.com/bvQLRyE,
1350998729.0,1550,i.imgur.com,11y0iv,"These Cambodian guys didn't hesitate for a second, they just jumped into the ditch of sewerage and helped me drag myself and the motorcycle out.

",1819,269,145,http://www.reddit.com/r/travel/comments/11y0iv/these_cambodian_guys_didnt_hesitate_for_a_second/,,,False,http://d.thumbs.redditmedia.com/Jz6enE70ktGC7ypW.jpg,t5_2qh41,False,,,False,t3_11y0iv,http://i.imgur.com/kTj4u.jpg,
1361990172.0,1532,i.imgur.com,19cao2,This is my life for the next year or so...,1834,302,425,http://www.reddit.com/r/travel/comments/19cao2/this_is_my_life_for_the_next_year_or_so/,,,False,http://a.thumbs.redditmedia.com/nrDu2azEUd3Cp0ax.jpg,t5_2qh41,False,,gbr,False,t3_19cao2,http://i.imgur.com/nnjOJ4J.jpg,
1376530655.0,1501,i.imgur.com,1ke2vk,For anyone who's considering eurotripping,1889,388,359,http://www.reddit.com/r/travel/comments/1ke2vk/for_anyone_whos_considering_eurotripping/,,,False,http://e.thumbs.redditmedia.com/LoAGHBgg06DtDD9d.jpg,t5_2qh41,False,,,False,t3_1ke2vk,http://i.imgur.com/MGDubRL.jpg,
1369271495.0,1484,i.imgur.com,1evhhx,I love empty planes! Only 15 people on a late flight from SEA-LAX.,1932,448,287,http://www.reddit.com/r/travel/comments/1evhhx/i_love_empty_planes_only_15_people_on_a_late/,,,False,http://f.thumbs.redditmedia.com/kW1QN_dnpEo4N7CS.jpg,t5_2qh41,False,,,False,t3_1evhhx,http://i.imgur.com/PCQT4uq.jpg,
1344042403.0,1474,i.imgur.com,xnews,The best part of my Thailand trip - falling asleep with a baby elephant,2021,547,87,http://www.reddit.com/r/travel/comments/xnews/the_best_part_of_my_thailand_trip_falling_asleep/,,,False,http://f.thumbs.redditmedia.com/5zkJB7myH7yhlp9w.jpg,t5_2qh41,False,,usa,False,t3_xnews,http://i.imgur.com/LPJER.jpg,
1367291484.0,1400,i.imgur.com,1ddy96,Reasons to visit China off-peak...,1674,274,152,http://www.reddit.com/r/travel/comments/1ddy96/reasons_to_visit_china_offpeak/,,,False,http://c.thumbs.redditmedia.com/zymJiXasTFJ650A8.jpg,t5_2qh41,False,,hkg,False,t3_1ddy96,http://i.imgur.com/MVESMka.jpg,
1361729006.0,1388,imgur.com,1952wx,This summer my friends and I drove from scotland to mongolia in a car that should have never made it. This is me after we crossed the border into mongolia. ,1670,282,154,http://www.reddit.com/r/travel/comments/1952wx/this_summer_my_friends_and_i_drove_from_scotland/,,,False,http://c.thumbs.redditmedia.com/oZBmco-nK3jyaV6n.jpg,t5_2qh41,False,,can,False,t3_1952wx,http://imgur.com/lyhfUQr,
1338675729.0,1375,i.imgur.com,uhqvb,"So I recently went to Shanghai. I met a 6 year old girl who was standing on a motorbike while her mother pushed it along.  When she saw me, she hopped off, grabbed my hand and spoke to me in perfect English. We talked about colors, animals, and her favorite foods. Even the Statue of Liberty.",1796,421,93,http://www.reddit.com/r/travel/comments/uhqvb/so_i_recently_went_to_shanghai_i_met_a_6_year_old/,,,False,http://f.thumbs.redditmedia.com/F04UT2PcAl33DrhA.jpg,t5_2qh41,False,,usa,False,t3_uhqvb,http://i.imgur.com/r8bbu.jpg,
1373462631.0,1374,imgur.com,1i07fg,Some of my favourite photos during my first trip to USA last month,1666,292,408,http://www.reddit.com/r/travel/comments/1i07fg/some_of_my_favourite_photos_during_my_first_trip/,,,False,http://e.thumbs.redditmedia.com/1aJ4oRNCvBDq_yVj.jpg,t5_2qh41,False,,,False,t3_1i07fg,http://imgur.com/a/wXcqw,
1364066217.0,1322,imgur.com,1avflh,A group of Russians climbed the Great Pyramid in Egypt illegaly and took pictures,1671,349,191,http://www.reddit.com/r/travel/comments/1avflh/a_group_of_russians_climbed_the_great_pyramid_in/,,,False,http://c.thumbs.redditmedia.com/aE8ElmurIqc0qaYD.jpg,t5_2qh41,False,,bel,False,t3_1avflh,http://imgur.com/a/wFyOo,
1364729250.0,1301,imgur.com,1bcqt8,After riding a small dirt path in Vietnam for 4 hours we came across this bridgeless river with an ingenius way to get across...,1561,260,113,http://www.reddit.com/r/travel/comments/1bcqt8/after_riding_a_small_dirt_path_in_vietnam_for_4/,,,False,http://a.thumbs.redditmedia.com/lEz2ma-TLKEvngW0.jpg,t5_2qh41,False,,gbr,False,t3_1bcqt8,http://imgur.com/a/RlQ4N,
1372592456.0,1272,i.imgur.com,1hczyc,Tonight's sunset from my apartment in Vietnam,1575,303,65,http://www.reddit.com/r/travel/comments/1hczyc/tonights_sunset_from_my_apartment_in_vietnam/,,,False,default,t5_2qh41,False,,twn,False,t3_1hczyc,http://i.imgur.com/VWj4XFn.jpg,
1368067306.0,1258,imgur.com,1dz6nk,"I planned my trip to China mostly based on cool pictures I found on the internet. I was not disappointed, here are a few that I took!",1514,256,88,http://www.reddit.com/r/travel/comments/1dz6nk/i_planned_my_trip_to_china_mostly_based_on_cool/,,,False,http://a.thumbs.redditmedia.com/Grhv7nLVTsh63tcH.jpg,t5_2qh41,False,,,False,t3_1dz6nk,http://imgur.com/a/O0Y37,
1368997026.0,1225,i.imgur.com,1engvx,"My older brother and I backpacked through Japan some years ago, and while the bright neon lights of Tokyo dazzled us, it was places like this that were truly enchanting.",1474,249,60,http://www.reddit.com/r/travel/comments/1engvx/my_older_brother_and_i_backpacked_through_japan/,,,False,default,t5_2qh41,False,,,False,t3_1engvx,http://i.imgur.com/6gk4xCB.png,
1367429475.0,1216,i.imgur.com,1dhr6b,Just finished a 3.5 week road trip totaling 7700 miles. This is one of my favorite shots of the trip.,1422,206,72,http://www.reddit.com/r/travel/comments/1dhr6b/just_finished_a_35_week_road_trip_totaling_7700/,,,False,http://f.thumbs.redditmedia.com/zXoxNgYYLExyT83k.jpg,t5_2qh41,False,,,False,t3_1dhr6b,http://i.imgur.com/pDWve6b.jpg,
1354025043.0,1218,imgur.com,13vg04,Jumping into the Devil's Pool at Victoria Falls...life goal accomplished,1383,165,73,http://www.reddit.com/r/travel/comments/13vg04/jumping_into_the_devils_pool_at_victoria/,,,False,http://b.thumbs.redditmedia.com/e6lwsVJe9DF-umqU.jpg,t5_2qh41,False,,usa,False,t3_13vg04,http://imgur.com/ITix5,
1367521245.0,1204,imgur.com,1dkgnm,I dropped everything and bought a one-way ticket to Shanghai not sure where I'd end up. Here's the view from my apartment.,1467,263,227,http://www.reddit.com/r/travel/comments/1dkgnm/i_dropped_everything_and_bought_a_oneway_ticket/,,,False,http://f.thumbs.redditmedia.com/ni9DxtRHcgYZx1xk.jpg,t5_2qh41,False,,,False,t3_1dkgnm,http://imgur.com/gohv46R,
1369371044.0,1203,imgur.com,1eyclo,Natural walkway Maldives,1387,184,54,http://www.reddit.com/r/travel/comments/1eyclo/natural_walkway_maldives/,,,False,http://e.thumbs.redditmedia.com/_1A1TflUDHbVkgij.jpg,t5_2qh41,False,,,False,t3_1eyclo,http://imgur.com/4YS5TlC,
1366649508.0,1178,i.imgur.com,1cvexd,"Zermatt 2010 when I was 17, summer before college. Basically represents everything I love in life. God I love to travel.",1454,276,67,http://www.reddit.com/r/travel/comments/1cvexd/zermatt_2010_when_i_was_17_summer_before_college/,,,False,http://c.thumbs.redditmedia.com/odpgKdvL38trQgaD.jpg,t5_2qh41,False,,,False,t3_1cvexd,http://i.imgur.com/PE0f4XL.jpg,
1368916873.0,1173,imgur.com,1elma4,I spent the best 3 1/2 weeks of my life in an isolated cabin in East Iceland. These guys were my only companions.,1387,214,52,http://www.reddit.com/r/travel/comments/1elma4/i_spent_the_best_3_12_weeks_of_my_life_in_an/,,,False,http://d.thumbs.redditmedia.com/ekVbU3K9xlt1z7XQ.jpg,t5_2qh41,False,,,False,t3_1elma4,http://imgur.com/IgCAMJJ,
1363877968.0,1141,imgur.com,1aqgk8,"Scumbag Backpacker, caught in the act. Now were hunting him down",1382,241,249,http://www.reddit.com/r/travel/comments/1aqgk8/scumbag_backpacker_caught_in_the_act_now_were/,,,False,http://a.thumbs.redditmedia.com/2F4BHywzzl-LxfcH.jpg,t5_2qh41,False,,,False,t3_1aqgk8,http://imgur.com/gallery/7LaPy/new,
1359900552.0,1141,i.imgur.com,17t1pv,"Amber Fort, near Jaipur, India. My favourite Indian fort!",1285,144,86,http://www.reddit.com/r/travel/comments/17t1pv/amber_fort_near_jaipur_india_my_favourite_indian/,,,False,http://a.thumbs.redditmedia.com/-uPcI5YdOqfPEgI0.jpg,t5_2qh41,False,,,False,t3_17t1pv,http://i.imgur.com/tsMhXEy.jpg,
1363754510.0,1135,imgur.com,1an8w6,"Almost 40 years ago my parents went to Europe for 9 weeks. 38 cities, 26 hotel keys, and lots of wine. Here are the pics",1378,243,141,http://www.reddit.com/r/travel/comments/1an8w6/almost_40_years_ago_my_parents_went_to_europe_for/,,,False,http://e.thumbs.redditmedia.com/p1shcEiZiKAa8wWL.jpg,t5_2qh41,False,,,False,t3_1an8w6,http://imgur.com/a/ZIvWT,
1363124129.0,1125,i.imgur.com,1a68qo,"A little behind schedule, but here is my picture of Antarctica at 2.00am New Years Day",1284,159,38,http://www.reddit.com/r/travel/comments/1a68qo/a_little_behind_schedule_but_here_is_my_picture/,,,False,http://c.thumbs.redditmedia.com/IlAdhHI94foAUTEh.jpg,t5_2qh41,False,,,False,t3_1a68qo,http://i.imgur.com/4eaT5Ja.jpg,
1354708517.0,1131,kookaburratrail.wordpress.com,14bhin,My aging father really surprised me with his video editing skills while traveling Brazil &amp; Peru! Now I want to freak him out - he currently gets excited by 5 views  a day. :),1288,157,77,http://www.reddit.com/r/travel/comments/14bhin/my_aging_father_really_surprised_me_with_his/,,,False,default,t5_2qh41,False,,,False,t3_14bhin,http://kookaburratrail.wordpress.com/,
1375076614.0,1099,i.imgur.com,1j9e48,"I went on my first big trip with my girlfriend of 6 years. We went to Japan and it was amazing. We were a bit bummed that we missed the Sakura season, but we went during Autumn and it was beautiful.",1275,176,42,http://www.reddit.com/r/travel/comments/1j9e48/i_went_on_my_first_big_trip_with_my_girlfriend_of/,,,False,http://c.thumbs.redditmedia.com/APh3G8Oxhg9pMBRJ.jpg,t5_2qh41,False,,,False,t3_1j9e48,http://i.imgur.com/caem4hG.jpg,
1374923825.0,1097,youtube.com,1j5m5y,Me in EVERY SINGLE COUNTRY in the world in LESS THAN FOUR MINUTES!! Breathless!,1424,327,257,http://www.reddit.com/r/travel/comments/1j5m5y/me_in_every_single_country_in_the_world_in_less/,,,False,http://a.thumbs.redditmedia.com/Xa7y8zWXkrHpB3Yx.jpg,t5_2qh41,False,,,False,t3_1j5m5y,http://www.youtube.com/watch?v=qcmY6ZQSAXI,
1362347710.0,1089,imgur.com,19ljio,Follow up to my Mongol Rally picture I posted last week. Here is the album.,1236,147,170,http://www.reddit.com/r/travel/comments/19ljio/follow_up_to_my_mongol_rally_picture_i_posted/,,,False,http://c.thumbs.redditmedia.com/Qg53UvNZO3FRWcAn.jpg,t5_2qh41,False,,can,False,t3_19ljio,http://imgur.com/a/vgXXO,
1364922843.0,1085,imgur.com,1biy7a,Bagan Temples in Myanmar,1233,148,103,http://www.reddit.com/r/travel/comments/1biy7a/bagan_temples_in_myanmar/,,,False,http://f.thumbs.redditmedia.com/ab3kjxw41rUvqzvk.jpg,t5_2qh41,False,,,False,t3_1biy7a,http://imgur.com/tVKTBg0,
1367103178.0,1089,imgur.com,1d8ory,Last summer my two best friends and I road tripped from VA to Cali and back in 15 days. Here we are admiring the Grand Canyon,1286,197,90,http://www.reddit.com/r/travel/comments/1d8ory/last_summer_my_two_best_friends_and_i_road/,,,False,http://b.thumbs.redditmedia.com/x_Wbe4VJZbDxbudg.jpg,t5_2qh41,False,,,False,t3_1d8ory,http://imgur.com/plQLg7D,
1348323791.0,1083,i.imgur.com,10aq25,When we went to Zion we weren't expecting Jurassic Fucking Park,1242,159,60,http://www.reddit.com/r/travel/comments/10aq25/when_we_went_to_zion_we_werent_expecting_jurassic/,,,False,http://b.thumbs.redditmedia.com/yHHzD39-fGu-HUfO.jpg,t5_2qh41,False,,,False,t3_10aq25,http://i.imgur.com/aERoy.jpg,
1356797307.0,1070,imgur.com,15mlpr,"20 years ago this month, my mother drove a stranded Brazilian tourist to her hotel in Arizona. To this day, the grateful woman sends her gifts, letters, and poems.",1249,179,53,http://www.reddit.com/r/travel/comments/15mlpr/20_years_ago_this_month_my_mother_drove_a/,,,False,default,t5_2qh41,False,,,False,t3_15mlpr,http://imgur.com/hw4Ut,
1367158537.0,1058,i.imgur.com,1d9t58,"Here's me jumping into a 1500 year old bathing pool in Sri Lanka, part of a ruined fortress a king built on top of an enormous rock around 480 AD (Sigiriya rock)",1255,197,62,http://www.reddit.com/r/travel/comments/1d9t58/heres_me_jumping_into_a_1500_year_old_bathing/,,,False,http://f.thumbs.redditmedia.com/2Cp7pCJ-mNiii-YY.jpg,t5_2qh41,False,,,False,t3_1d9t58,http://i.imgur.com/CS3Te6P.jpg,
1365304538.0,1057,i.imgur.com,1bu14o,"I don't always get high, but when I do, I prefer a wicker basket. Cappadocia, Turkey.",1234,177,46,http://www.reddit.com/r/travel/comments/1bu14o/i_dont_always_get_high_but_when_i_do_i_prefer_a/,,,False,http://c.thumbs.redditmedia.com/6GvgeSq-UFO0FRQn.jpg,t5_2qh41,False,,,False,t3_1bu14o,http://i.imgur.com/DQtsMt5.jpg,
1361310580.0,1053,imgur.com,18udco,"My wife and I were hosted by this wonderful woman last night in an unintentional home stay. She cooked us dinner and laughed at us. A lot. This is why I travel.
Atlas Mountains, Morocco. ",1237,184,93,http://www.reddit.com/r/travel/comments/18udco/my_wife_and_i_were_hosted_by_this_wonderful_woman/,,,False,http://c.thumbs.redditmedia.com/XZtVTEBEertNZxAJ.jpg,t5_2qh41,False,,,False,t3_18udco,http://imgur.com/U0lhBL9,
1373289366.0,1055,imgur.com,1hv14v,My Favorite Photo I Took in Anatarctica,1211,156,84,http://www.reddit.com/r/travel/comments/1hv14v/my_favorite_photo_i_took_in_anatarctica/,,,False,http://d.thumbs.redditmedia.com/TGDfui6jwv1y7TKK.jpg,t5_2qh41,False,,usa,False,t3_1hv14v,http://imgur.com/Rl5E6WF,
1371653001.0,1056,imgur.com,1gno97,I didn't realize the US was so pretty until I visited some National Parks,1250,194,169,http://www.reddit.com/r/travel/comments/1gno97/i_didnt_realize_the_us_was_so_pretty_until_i/,,,False,http://d.thumbs.redditmedia.com/wT8XpdDtIQuFt12K.jpg,t5_2qh41,False,,,False,t3_1gno97,http://imgur.com/a/GG1st,
1342084047.0,1041,media-cdn.tripadvisor.com,wfmyc,"The most beautiful, stunning sight while traveling South Asia",1256,215,177,http://www.reddit.com/r/travel/comments/wfmyc/the_most_beautiful_stunning_sight_while_traveling/,,,False,http://a.thumbs.redditmedia.com/d7JFKx9aOiRN3P2Z.jpg,t5_2qh41,False,,,False,t3_wfmyc,http://media-cdn.tripadvisor.com/media/photo-s/01/64/8f/c8/western-toilet.jpg,
1366978058.0,1029,i.imgur.com,1d5d8z,My favourite picture from my visit to the Taj.,1266,237,75,http://www.reddit.com/r/travel/comments/1d5d8z/my_favourite_picture_from_my_visit_to_the_taj/,,,False,http://b.thumbs.redditmedia.com/Jor4yIee8yB6FCFm.jpg,t5_2qh41,False,,can,False,t3_1d5d8z,http://i.imgur.com/p0HQXTM.jpg,
1372261441.0,1021,imgur.com,1h43mm,My fav picture from my safari in Kenya,1197,176,43,http://www.reddit.com/r/travel/comments/1h43mm/my_fav_picture_from_my_safari_in_kenya/,,,False,http://f.thumbs.redditmedia.com/3T264eIe1c4oBeI5.jpg,t5_2qh41,False,,,False,t3_1h43mm,http://imgur.com/Kmm0TZt,
1360338495.0,1007,imgur.com,184w0q,double exposure I took in India. Gypsy and birds.,1189,182,56,http://www.reddit.com/r/travel/comments/184w0q/double_exposure_i_took_in_india_gypsy_and_birds/,,,False,http://f.thumbs.redditmedia.com/24-bSouBea1w4_iG.jpg,t5_2qh41,False,,,False,t3_184w0q,http://imgur.com/9pK0GRz,
1373820443.0,1009,i.imgur.com,1ia6pu,x/post from /r/dataisbeautiful - shortest route through Europe that hits all the capitals. Who's in?,1195,186,169,http://www.reddit.com/r/travel/comments/1ia6pu/xpost_from_rdataisbeautiful_shortest_route/,,,False,http://f.thumbs.redditmedia.com/izkbtq-MZl0F7x1G.jpg,t5_2qh41,False,,,False,t3_1ia6pu,http://i.imgur.com/l5rKfGC.png,
1322658473.0,1002,imgur.com,muofe,Finance Charts for my 1.5 Year Round-the-World Trip,1201,199,351,http://www.reddit.com/r/travel/comments/muofe/finance_charts_for_my_15_year_roundtheworld_trip/,,,False,http://f.thumbs.redditmedia.com/0N9-bH_0Cwp2Xg7w.jpg,t5_2qh41,False,,,False,t3_muofe,http://imgur.com/a/k9mmB,
1372090474.0,996,i.imgur.com,1gz4n3,"Fast Food in Katakolon, Greece",1184,188,85,http://www.reddit.com/r/travel/comments/1gz4n3/fast_food_in_katakolon_greece/,,,False,http://a.thumbs.redditmedia.com/e81h9tAj8d1kuhpl.jpg,t5_2qh41,False,,,False,t3_1gz4n3,http://i.imgur.com/MJGcDlz.jpg,
1370873061.0,995,imgur.com,1g1m83,Everything I'm taking to Europe for a 6 month trip,1282,287,399,http://www.reddit.com/r/travel/comments/1g1m83/everything_im_taking_to_europe_for_a_6_month_trip/,,,False,http://a.thumbs.redditmedia.com/8g-A8PUi0SiapRix.jpg,t5_2qh41,False,,usa,False,t3_1g1m83,http://imgur.com/a/8SjSS,
1359979935.0,994,i.imgur.com,17v345,Encountered a wild tiger in India,1157,163,83,http://www.reddit.com/r/travel/comments/17v345/encountered_a_wild_tiger_in_india/,,,False,http://d.thumbs.redditmedia.com/W5HplcUlZ6a06TzQ.jpg,t5_2qh41,False,,,False,t3_17v345,http://i.imgur.com/R5Uerar.jpg,
1351650446.0,987,i.imgur.com,12dkya,Results of the USA election [x-post/funny],1170,183,26,http://www.reddit.com/r/travel/comments/12dkya/results_of_the_usa_election_xpostfunny/,,,False,http://b.thumbs.redditmedia.com/wdYBoPE0y-IGKj6U.jpg,t5_2qh41,False,,,False,t3_12dkya,http://i.imgur.com/cMLcu.png,
